,api_path,primary_artist,title,url,song_endpoint,album,release_date,lyrics,polarity,anger,anticipation,disgust,fear,joy,negative,positive,sadness,surprise,trust
15,/songs/2033026,Billy Currington,Give It To Me Straight,https://genius.com/Billy-currington-give-it-to-me-straight-lyrics,http://api.genius.com/songs/2033026,Summer Forever,2015-06-02," Well if I had a dollar for every time you let me down Stood me up, gave me the run around I'd still spend it all on you We used to get so dressed up just to get so messed up Chilling in the back of the club all night like we're all alone But that girls gone   So give it me straight babe, I can take it If there's another guy just tell me why You've been runnin' late babe every single day, every single night Give it to me straight baby   Who ya been with is there something to it? Are you just friends with him? I ain't mad at ya I'm just asking Just asking   Well tell me what you thinking just tell me anything at all Say a word or say it all I gotta hear it straight from you We used to get so caught up Getting spent and making love The kind of love where we both end up on the bedroom floor But it ain't no more   So give it me straight babe, I can take it If there's another guy just tell me why You've been runnin' late babe every single day, every single night Give it to me straight baby   Who ya been with is there something to it? Are you just friends with him? I ain't mad at ya I'm just asking Just asking   What you been doing? And who ya been with? Is there something to it? Are you just friends with him? I ain't mad at ya I'm just asking Oohh   So give it me straight babe, I can take it If there's another guy just tell me why You've been runnin' late babe every single day, every single night Give it to me straight baby",0.9952,3,1,3,3,9,7,10,6,0,5
16,/songs/446309,Billy Currington,Good Directions,https://genius.com/Billy-currington-good-directions-lyrics,http://api.genius.com/songs/446309,Doin' Somethin' Right,2005-10-18," I was sitting there selling turnips on a flatbed truck Crunching on a pork rind when she pulled up She had to be thinking, ""this is where rednecks come from"" She had Hollywood written on her license plate She was lost and looking for the interstate Needing directions and I was the man for the job   I told her way up yonder past the caution light There's a little country store with an old Coke sign You got to stop in and ask Miss Bell for some of her sweet tea Then a left will take you to the interstate But a right will bring you right back here to me   I was sitting there thinking about her pretty face Kicking myself for not catching her name I threw my hat and thought, You fool, that could have been love I knew my old Ford couldn't run her down She probably didn't like me anyhow So I watched her disappear in a cloud of dust   I told her way up yonder past the caution light There's a little country store with an old Coke sign You got to stop in and ask Miss Bell for some of her sweet tea Then a left will take you to the interstate But a right will bring you right back here to me   Is this Georgia heat playing tricks on me Or am I really seeing what I think I see The woman of my dreams coming back to me She went way up yonder past the caution light Don't know why, but something felt right When she stopped in and asked Miss Bell for some of her sweet tea Mama gave her a big old glass and sent her right back here to me   Thank God for good directions and turnip greens",0.9564,4,13,1,5,8,7,12,1,5,9
17,/songs/2033015,Billy Currington,Good Night,https://genius.com/Billy-currington-good-night-lyrics,http://api.genius.com/songs/2033015,Summer Forever,2015-06-02," It's a bad night To go downtown Amateur night Too many tourists around It's a bad night To go for a drive Speed traps Don't wanna get a DUI It can just be you and I Kicking our shoes off Listening to some Clapton yeah   It's a good night For falling in love It's the right time for sipping A little bit of whiskey And it's a good night For slowing it down Throw some wood on the fire Let the flame burn higher, yeah   It's the perfect night For dancing in the kitchen If you're hungry We'll make a little breakfast For dinner It's just about to get good You don't wanna leave now (Come over) Come a little closer Let me show you how   It's a good night For falling in love It's the right time for sipping A little bit of whiskey It's a good night For slowing it down Throw some wood on the fire Let the flame burn higher   It's a bad night (It's a bad night) For breaking hearts (For breaking hearts) You gonna break mine If you leave me alone In the dark   But it's a good night For falling in love It's the right time for sipping A little bit of whiskey It's a good night For slowing it down Throw some wood on the fire Let the flame burn It's a good night For falling in love It's the right time for sipping A little bit of whiskey And it's a good night For slowing it down Throw some wood on the fire Let the flame burn higher, yeah   (It's a good night baby) (For falling in love) Yeah, it's a good night For falling in love Ooo-woah-woah-woah",0.992,5,17,4,8,19,13,23,13,14,15
18,/songs/446293,Billy Currington,Growin' Up Down There,https://genius.com/Billy-currington-growin-up-down-there-lyrics,http://api.genius.com/songs/446293,Billy Currington,2003-09-30," That red Georgia clay when mixed with the rain Sure made for one nasty mess Ah, but we were riding high in the old truck of mine In deep as we could get Always looking for a rut, trying not to get stuck And swinging that mud everywhere, growing up down there Me and my friends where the deep river bends Had a long rope tied to a tree Taking turns on a swing, taking turns taking drinks And I don't mean iced tea A good buzz later playing chicken with the gators Way too young to be scared, growing up down there   And those tan little peaches turning us on Keeping things hot all summer long If I could back in a second I swear Well, I'd still be growing up down there   Well, nothing going on ever lasted too long We were good at making good times Find a field spread the word keep a bonfire burning Through both ends of the night Had the radio up, had a keg in a truck Trying to get lucky somewhere Growing up down there   And those tan little peaches turning us on Keeping things hot all summer long If I could back in a second I swear Well, I'd still be growing up down there  And those tan little peaches turning us on Keeping things hot all summer long If I could back in a second I swear Well, I'd still be growing up down there   Yeah, looking back now man it don't seem fair If you didn't get to do your growing up down there",0.989,5,12,3,3,7,3,16,1,6,13
19,/songs/446415,Billy Currington,Hallelujah,https://genius.com/Billy-currington-hallelujah-lyrics,http://api.genius.com/songs/446415,We Are Tonight,2013-09-17," God is great Man is not Man made whiskey God made pot God made women We make war But oh a good woman That's worth fighting for Oh, yea And the way I'm feeling Ain't never gonna change Baby don't you know my heart is healing Every time I see your face   La, da, da, da, da, da, dee Oh, God made you and God made me He made you a girl to pull me through And he made this man for loving you Hallelujah, so glad I bumped into ya Hallelujah, so glad I bumped into ya   God made grandma She made pie Taste so good Bring a tear to your eye Make a grown man cry God made music God made love And he made Smokey Robinson So, let's put him on and make some, that's right Yeah Hallelujah   La, da, da, da, da, da, dee Oh, God made you and God made me He made you a girl to pull me through And he made this man for loving you Hallelujah, so glad I bumped into ya Hallelujah, so glad I bumped into ya   I don't want no tie I want no suit Just want you in your birthday suit Don't want no cars Want no trucks Just want you And I want your love, oh, yeah, baby Just want you And I want your love   La, da, da, da, da, da, dee Oh, God made you and God made me He made you a girl to pull me through And he made this man for loving you Hallelujah, so glad I bumped into ya Hallelujah, so glad I bumped into ya",0.9994,2,24,1,15,32,4,39,3,4,23
20,/songs/446278,Billy Currington,Hangin' Around,https://genius.com/Billy-currington-hangin-around-lyrics,http://api.genius.com/songs/446278,Billy Currington,2003-09-30," You're the last thing that I cling to Before I fall asleep at night You're the first thing that reach for In the early morning light   You're the name that I see written in the stars You're the face that I see in every cloud Oh, I wish you could have been more like Your memory and kept hanging around   You're that tap on my shoulder You're that voice in the crowd You're that constant distraction You're that book I can't put down   You're the name that I see written in the stars You're the face that I see in every cloud Oh, I wish you could have been more like Your memory and kept hanging around   It keeps haunting me, I still want and need you, always will You're every, thought I think, every sight I see Every feeling I feel   You're the name that I see written in the stars You're the face that I see in every cloud Oh, I wish you could have been more like Your memory and kept hanging around   You're the last thing that I wish for When I lay down at night",0.9369,4,5,4,4,4,6,6,5,1,6
21,/songs/446406,Billy Currington,Hard To Be A Hippie,https://genius.com/Billy-currington-hard-to-be-a-hippie-lyrics,http://api.genius.com/songs/446406,We Are Tonight,2013-09-17," It used to be that You could up and thumb a ride from Nashville to L.A And everyone who stopped and picked you up Would get you high along the way  And it used to be that You could fall in and out of love in an afternoon And then fall again that evening And not think that it was happening too soon   But it's hard to be a hippie anymore It hurts more now Waking up on the floor Oh, it's still free But it ain't easy like before It's hard to be a hippie anymore   Fire it up boys It used to be just walking down the street Would make the people stop and stare Now all the cowboys and the preppies And the rednecks and the yuppies have long hair  But I was always going places In my head and seeing things that blew my mind Now the only thing I'm tripping on Are my own two feet, trying to keep up with the times Ah yeah, you know that's right   But it's hard to be a hippie anymore It hurts more now Waking up on the floor Oh, it's still free But it ain't easy like before It's hard to be a hippie anymore   Lord, it's still free But it ain't easy like before It's hard to be a hippie anymore",-0.9453,3,2,2,3,1,12,2,5,0,1
22,/songs/446359,Billy Currington,Heal Me,https://genius.com/Billy-currington-heal-me-lyrics,http://api.genius.com/songs/446359,Little Bit Of Everything,2008-10-14," Use a lighter hand I've got bruses you can't see You can take your time Your love is all I need They say time is a healer But it's been no friend to me I've had a share of heartache I've had my fill of pain Girl you took away the hurt And stopped the falling rain I know you walk on water I know that you can heal me   Heal me With your sweet and sexy ways Feel me Your touch is all I crave I've been waiting for so long For you to come along And heal me   Girl don't cut yourself On my broken heart Watch for the jagged pieces They might tear you apart Oh, once you touch my soul I know that you can heal me   Heal me With your sweet and sexy ways Feel me Your touch is all I crave I've been waiting for so long For you to come along And heal me   Oh Heal me Stars are aligned They're in perfect harmony Love is the position That you pour on me   Heal me With your sweet and sexy ways Feel me Your touch is all I crave I've been waiting for so long For you to come along And heal me",0.9891,2,15,0,4,19,5,20,5,3,19
23,/songs/447959,Billy Currington,Here I Am,https://genius.com/Billy-currington-here-i-am-lyrics,http://api.genius.com/songs/447959,Doin' Somethin' Right,2005-10-18," Walks in the rain, talks in the dark Old black and white movies, a day at the park On a blanket on the ground on a Sunday afternoon Hanging with friends or off by ourselves Driving around yard sale to yard sale Dropping by the county fair, winning you a bear popping balloons   If you're looking for someone to do that with, here I am Someone to be the other half of your plans Don't look any further than in my eyes It you're looking for that man, here I am   December nights all cuddled up Warmed by the fire and sharing a cup Of hot cocoa laughing at old photos Spanish guitars, sand and the sea A quiet little table just you and me Sipping margaritas in a little cantina in Old Mexico   If you're looking for someone to do that with, here I am Someone to be the other half of your plans Don't look any further than in my eyes It you're looking for that man, here I am   Talking 'bout life and talking about babies Talking bout us still in love when we're eighty   If you're looking for someone to do that with, here I am Someone to be the other half of your plans Don't look any further than in my eyes It you're looking for that man, here I am   Here I am Baby, here I am",0.9565,5,5,2,3,7,4,14,5,1,9
24,/songs/446398,Billy Currington,Hey Girl,https://genius.com/Billy-currington-hey-girl-lyrics,http://api.genius.com/songs/446398,We Are Tonight,2013-09-17," Hey girl, what's your name girl I've been looking at you And every guy here's doing the same girl It'd be a shame girl If I let you just walk on by Cause I'm all caught up in your sweet smile A girl like you comes around once in a while So hot, got to give it a shot Gotta get get a little bit of what you got   I know you don't know me but I can't leave here lonely Knowing I didn't even try to make you mine and You might think I'm crazy Girl but who could blame me You're looking so fine, got me all tongue tied And the only line I can think to say is   Hey girl, what you think girl You look a little thirsty let me go get you something to drink girl Before you blink girl I'll be right back by your side And if you want we can roll out I know my way around this town I got a shotgun seat for you You can tell me where it is you want to take off to   I know you don't know me but I can't leave here lonely Knowing I didn't even try to make you mine and You might think I'm crazy Girl but who could blame me You're looking so fine, got me all tongue tied And the only line I can think to say is   Ooh, baby you're still standing here I guess you must like what you hear Hey girl, what you say girl About you and me getting away girl   I know you don't know me but I can't leave here lonely Knowing I didn't even try to make you mine and You might think I'm crazy Girl but who could blame me You're looking so fine, got me all tongue tied And the only line I can think to say is   You're looking so fine, got me all tongue tied And the only line I can think to say is Hey girl Oh yeah",0.8924,11,1,7,8,3,15,10,11,7,5
25,/songs/446271,Billy Currington,I Got A Feelin,https://genius.com/Billy-currington-i-got-a-feelin-lyrics,http://api.genius.com/songs/446271,Billy Currington,2003-09-30," I don't want to rush this thing I don't want to jump the gun I really want to say those three little words But I'm going to bite my tongue Yeah, I'm just going to lay on back Leave it on cruise control I'm gonna hold it all inside Till the right time comes down the road   I got a feeling My head's a reeling My heart is screaming I'm about to bust loose Bottled up emotion It's more than a notion It starts with an I And ends with a U I got a feeling Are you feeling it too   I guess I've all but said it now So much for hoping you'd go first Don't leave me hanging out here on a line Baby, it's your turn Say you couldn't sleep last night Swore that you could feel me breathe Had you wanting me there by your side Yeah, baby I know what you mean   I got a feeling My head's a reeling My heart is screaming I'm about to bust loose Bottled up emotion It's more than a notion It starts with an I And ends with a U I got a feeling Are you feeling it too  I got a feeling My head's a reeling My heart is screaming I'm about to bust loose Bottled up emotion It's more than a notion It starts with an I And ends with a U I got a feeling Are you feeling it too",-0.1817,14,13,13,14,12,18,19,13,12,13
26,/songs/446357,Billy Currington,I Shall Return,https://genius.com/Billy-currington-i-shall-return-lyrics,http://api.genius.com/songs/446357,Little Bit Of Everything,2008-10-14," My little Mexican woman Got herself a hot little body. (whistle) That little sweet senorita Knows how to be the life of the party We dance and we talk Hold hands when we walk Shoot tequilla all night long She can't understand Why this rambling man Says its time to be moving on My little sweet Georgia peach She sure knows how to show me a good time She's got the longest legs I swear they're smoother than her daddy's moonshine. (that's smooth) We eat her mama's fried chicken Go skinny dipping Drink cold beer all night long She can't understand When this rambling man Says its time to be moving on   I got places to be I got people to see Got both ends of the candle to burn But I'll try to hurry So girls don't you worry I promise you shall return   My little Miami friend With that cinnamon skin, lord shes so fine. (sure is) She always lights up my night With a ray of pure Florida sunshine Man we work on our tans Roll around in the sand Chug Bacardi all night long She don't understand When this rambling man Says its time to be moving on   I got places to be I got people to see Got both ends of the candle to burn But I'll try to hurry So girls don't you worry I promise you shall return  I got places to be I got people to see Got both ends of the candle to burn But I'll try to hurry So girls don't you worry I promise you shall return   No, don't worry girls, I shall return",0.9633,2,17,1,6,10,10,19,4,3,16
27,/songs/2033032,Billy Currington,It Don't Hurt Like It Used To,https://genius.com/Billy-currington-it-dont-hurt-like-it-used-to-lyrics,http://api.genius.com/songs/2033032,Summer Forever,2015-06-02," I had a couple beers with one of my friends ​Told him just how our story ends ​Did all I could to try to make it work ​But you drug my heart through the Alabama dirt   ​I've been at the house, climbin' them walls ​Checkin' that calendar, x'in days off ​Hit another bar, call another friend ​Throw a few down, tell the story again ​  ​Hey, hey, what can I say? ​I can just lie and say it's all okay ​Oh, oh, what can I do? ​Been goin' through Hell gettin' over you ​But it don't hurt, it don't hurt like it used to ​No it don't hurt, it don't hurt like it used to ​  I'm finally gettin' out back into the world ​Life is good, I met me a girl ​She got a beautiful heart, eyes are blue ​I don't hardly ever think about you ​  ​Hey, hey, what can I say? I can just lie and say it's all okay Oh, oh, what can I do? Been goin' through Hell gettin' over you But it don't hurt, it don't hurt like it used to No it don't hurt, it don't hurt like it used to   ​Sometimes I find peace of mind in a bottle of wine ​Sometimes I break down and cry ​  ​Hey, hey, what can I say? I can just lie and say it's all okay Oh, oh, what can I do? Been goin' through Hell gettin' over you ​Hey, hey, what can I say? I can just lie and say it's all okay Oh, oh, what can I do? Been goin' through Hell gettin' over you But it don't hurt, it don't hurt like it used to No it don't hurt, it don't hurt like it used to ​No it don't hurt, it don't hurt like it used to It don't hurt, it don't hurt like it used to",0.9699,25,3,10,20,7,27,24,26,3,22
28,/songs/446305,Billy Currington,I Wanna Be A Hillbilly,https://genius.com/Billy-currington-i-wanna-be-a-hillbilly-lyrics,http://api.genius.com/songs/446305,Doin' Somethin' Right,2005-10-18," I want to be a hillbilly, praying for the rain Drink corn whiskey, raise a little cane You can have the big city, I want to be a hillbilly   City folks got worries A country boy's got none All I want to be is the daddy of a farmer's son Subdivisions are silly, I want to be a hillbilly   I want to be a hillbilly, praying for the rain Drink corn whiskey, raise a little cane You can have the big city, I want to be a hillbilly   When I get finished plowing I'm going to go to the pond And take my sweet baby And have some good clean fun You got to work, that's a pity I'm going to be a hillbilly   I want to be a hillbilly, praying for the rain Drink corn whiskey, raise a little cane You can have the big city, I want to be a hillbilly   When I die, throw me a big fine wake And have a party in the barn Let me lie in state Plant me under that oak tree I want to be a hillbilly   I want to be a hillbilly, praying for the rain Drink corn whiskey, raise a little cane You can have the big city, I want to be a hillbilly",0.9633,6,5,3,6,7,5,7,4,3,4
29,/songs/2033019,Billy Currington,Jonesin',https://genius.com/Billy-currington-jonesin-lyrics,http://api.genius.com/songs/2033019,Summer Forever,2015-06-02," This porch light I can keep it on all night I can stay up til the birds fly But every minute's like a year I got it bad It ain't going away I've gotta have it I don't mean to sound dramatic But I'm going crazy over here   I want ya, need ya Wanna lose it with ya Tired of sitting Lookin' at your picture Should be right here with ya Instead of being lonely Yeah, I've gotta Get a little bit of you To get me going You got me Jonesin', Jonesin', Jonesin' Yeah, you got me Jonesin', Jonesin', Jonesin'   I'm thirsty And I could start This night off early And drink until The TV's blurry Cause I got plenty of beer But that won't fix me You're the only one that hits me One shot of you it always kicks me Into another gear   You know, I want ya, need ya Wanna lose it with ya Tired of sitting Lookin' at your picture Should be right here with ya Instead of being lonely Yeah, I've gotta Get a little bit of you To get me going You got me Jonesin', Jonesin', Jonesin' Yeah, you got me Jonesin', Jonesin', Jonesin' Yeah, you got me Jonesin', Jonesin', Jonesin' Hey, hey, alright Oh, oh, ooo, woo   Wherever you are Girl it's too damn far Cause if you ain't in my arms Oh, you know I'm Jonesin'   I want ya, need ya Wanna lose it with ya Tired of sitting Lookin' at your picture Should be right here with ya Instead of being lonely Yeah, I've gotta Get a little bit of you To get me going I want ya, need ya Wanna lose it with ya Tired of sitting Lookin' at your picture Should be right here with ya Instead of being lonely Oh, I've gotta Get a little bit of you To get me going You got me Jonesin', Jonesin', Jonesin' Yeah, you got me Jonesin', Jonesin', Jonesin' Yeah, you got me Jonesin', Jonesin', Jonesin' Hey, hey, alright Oh, oh, ooo, woo That's right You got me Jonesin', Jonesin'",-0.9505,14,1,10,11,1,19,3,11,5,1
30,/songs/1155744,Billy Currington,Keep Your Hands To Yourself,https://genius.com/Billy-currington-keep-your-hands-to-yourself-lyrics,http://api.genius.com/songs/1155744,None,2018-09-19,I got a little change in my pocket goin' jing-a-ling-a-ling I wanna call you on the telephone baby give you a ring But each time we talk I get the same old thing Always no huggie and no kissie 'til I get a weddin' ring My honey my baby don't put my love up on no shelf She said don't hand me no lines and keep your hands to yourself  Baby baby baby why you treat me this way You know I'm still your loverboy I still feel the same way That's when she told me the story about free milk and a cow She said no huggie and no kissie 'til I get a weddin' vow My honey my baby don't put my love up on no shelf She said don't hand me no lines and keep your hands to yourself  See I wanted her real bad and I was about to give in That's when she started talkin 'bout true love started talkin' bout sin I said honey I'll live with ya for the rest of my life She said no huggie and no kissie 'til you make me your wife My honey my baby don't put my love up on no shelf She said don't hand me no lines and keep your hands to yourself,-0.9958,5,3,3,4,14,5,27,3,1,10
31,/songs/446388,Billy Currington,Let Me Down Easy,https://genius.com/Billy-currington-let-me-down-easy-lyrics,http://api.genius.com/songs/446388,Enjoy Yourself,2010-09-21," There's a little moonlight, dancing on the sand There's a warm breeze blowing by the ocean as you're taking my hand You need to know where I'm standing now That I'm right on the edge of giving in to ya Baby it's a long way down   If I fall, can ya let me down easy? If I leave my heart with you tonight Will you promise me that you're going to treat it right? I'm barely hanging on If I fall, can you let me down easy?   The scent of your perfume, floating in the air Looking like an angel, lying on a blanket with a halo of hair And those lips, look to good to be true Once I taste that kiss, I know what'll happen I'll be at the mercy of you   If I fall, can ya let me down easy? If I leave my heart with you tonight Will you promise me that you're going to treat it right? I'm barely hanging on If I fall, can you let me down easy?  If I fall, can ya let me down easy? If I leave my heart with you tonight Will you promise me that you're going to treat it right? I'm barely hanging on If I fall, can you let me down easy?   Let me down easy babe Mmmm",0.9933,7,8,7,6,11,16,14,15,9,10
