,api_path,primary_artist,title,url,song_endpoint,album,release_date,lyrics,polarity,anger,anticipation,disgust,fear,joy,negative,positive,sadness,surprise,trust
32,/songs/446335,Billy Currington,Life And Love And The Meaning Of,https://genius.com/Billy-currington-life-and-love-and-the-meaning-of-lyrics,http://api.genius.com/songs/446335,Little Bit Of Everything,2008-10-14," Well I never thought that I'd be where I'm at At this point in my life looking back My old heart's been broken more than I can count And my plans aren't going like I've worked 'em out   I think I just might spend the day looking up at the clouds above Laying around and contemplate, life and love and the meaning of   Well I posed my questions and got no reply Maybe God's just saying why ask why And I think how boring this old life would be if we had the answers to everything   I think I just might spend the day looking up at the clouds above Laying around and contemplate, life and love and the meaning of   That's the beauty of it If I don't solve nothing I can try again Another day is coming I should be on to something really good by then   I think I just might spend the day looking up at the clouds above Laying around and contemplate, life and love and the meaning of  I think I just might spend the day looking up at the clouds above Laying around and contemplate, life and love and the meaning of",0.9622,1,5,0,2,7,2,10,1,1,4
33,/songs/446385,Billy Currington,Like My Dog,https://genius.com/Billy-currington-like-my-dog-lyrics,http://api.genius.com/songs/446385,Enjoy Yourself,2010-09-21," He never tells me that he's sick of this house He never says why don't you get off that couch? He don't cost me nothing when he wants to go out I want you to love me like my dog He never says I need a new attitude Him and my sister ain't always in a feud When I leave the seat up he don't think that it's rude I want you to love me like my dog does baby   When I come home, want you to just go crazy He never looks at me like he might hate me I want you to love me like my dog   He never acts like he don't care for my friends He never asks me where in the hell have you been? He don't play dead when I want to pet him I want you to love me like my dog does honey He never says ""I wish you made more money"" He always thinks that pull my finger's funny I want you to love me like my dog He don't get mad at me and throw a major fit When I say his sister is a bitch   When I come home, want you to just go crazy He never looks at me like he might hate me I want you to love me like my dog   I want you to love me like my dog does baby",0.9908,9,1,6,7,11,11,20,10,2,8
34,/songs/446395,Billy Currington,Lil' Ol' Lonesome Dixie Town,https://genius.com/Billy-currington-lil-ol-lonesome-dixie-town-lyrics,http://api.genius.com/songs/446395,Enjoy Yourself,2010-09-21," Some folks sit and wait On government checks Some of us have the Sun beating down on our necks We've all got the same damn thing in mind An all screen door that swings 'Neath the neon sign   Nah, we don't need a reason To get down Turn the jukebox up to ten Son, throw 'em down Keep those long necks cold on ice Before too long it sure be nice Just might have to buy The house around In this little all lonesome dixie town   Someone throw some cornmeal Down on the floor So me and my baby can shuffle Just a little bit more Then, I think we look funny The way that we move That's our thing, and We got our own groove   Nah, we don't need a reason To get down Turn the jukebox up to ten Son, throw 'em down Keep those long necks cold on ice Before too long it sure be nice Just might have to buy The house around In this little all lonesome dixie town  Nah, we don't need a reason To get down Turn the jukebox up to ten Son, throw 'em down Keep those long necks cold on ice Before too long it sure be nice Just might have to buy The house around In this little all lonesome dixie town   In this little all lonesome dixie town",0.3845,2,8,1,2,2,11,8,5,1,4
35,/songs/446320,Billy Currington,Little Bit Lonely,https://genius.com/Billy-currington-little-bit-lonely-lyrics,http://api.genius.com/songs/446320,Doin' Somethin' Right,2005-10-18," Well, I parked my car in the driveway Somewhere around one am Worn out from the road with a big heavy load On my mind, what a week it had been Then I stumbled into the kitchen And I saw that little red light Blinking at me from my message machine Then I knew it would be alright Because she said   Baby, come over tonight I'm a little bit lonely Baby, come hold me tonight I'm a little bit lonely   Now it didn't take me a second til I knew The right thing to do I picked up the phone and said Baby I'm home I'll be there in a minute or two I stole some of my neighbor's daisies Grabbed an old bottle of wine She don't call me much but I know when she does That I'm in for one helluva time When she says   Baby, come over tonight I'm a little bit lonely Baby, come hold me tonight I'm a little bit lonely Baby, come over tonight I'm a little bit lonely Baby, come hold me tonight I'm a little bit lonely   Yeah everybody needs a little love sometimes Yeah, who am I to leave you hanging high and dry No baby, not tonight No,no,no,no Not tonight, now baby   Baby, come over tonight I'm a little bit lonely Baby, come hold me tonight I'm a little bit lonely Baby, come over tonight I'm a little bit lonely Baby, come hold me tonight I'm a little bit lonely   So come on baby Said, I'll be there in a minute or two And I brought those daises and that red wine We had one hell of a time Yeah, yeah, yeah",-0.9409,12,3,12,12,15,14,17,14,1,3
36,/songs/446372,Billy Currington,Love Done Gone,https://genius.com/Billy-currington-love-done-gone-lyrics,http://api.genius.com/songs/446372,Enjoy Yourself,2010-09-21," Don't worry, baby, sometimes things change Nothing we can do about it now, no way This doesn't come easy, but that's just life We can't keep pretending everything's alright We told each other it was love before The simple truth is it just ain't no more The bells stop ringing, the music won't play The crazy little feeling that's faded away Like snowflakes when the weather warms up Like leaves on the trees when the autumn comes Like the dogwood blossoms in a late spring rain All the disappearing bubbles in a glass of champagne Like a red kite lost in a blue sky wind I don't know where the good times end when   It ain't nothing we ever said or ever did wrong It's just love done gone   I don't regret a single thing that we did Anytime together, we ever spent I wouldn't change a thing, baby, you know Sometimes we got to just go with the flow Like snowflakes when the weather warms up Like leaves on the trees when the autumn comes Like the dogwood blossoms in a late spring rain All the disappearing bubbles in a glass of champagne Like money in a slot machine Don't know what happened to you and me   It ain't nothing we ever said or ever did wrong It's just love done gone",0.9938,6,7,4,5,13,12,20,9,5,11
37,/songs/447957,Billy Currington,Lucille,https://genius.com/Billy-currington-lucille-lyrics,http://api.genius.com/songs/447957,Doin' Somethin' Right,2005-10-18," In a bar in Toledo, across from the depot On a bars tool she took off her ring I thought I'd get closer So I walked on over I sat down and asked her her name When the drinks finally hit her She said,"" I'm no quitter But I finally quit living on dreams I'm hungry for laughter And here ever after I'm after whatever the other life brings In the mirror I saw him And I closely watched him I thought how he looked out of place He came to the woman Who sat there beside me He had a strange look on his face The big hands were calloused He looked like a mountain For a minute I thought I was dead But he started shaking His big heart was breaking He turned to the woman and said   You picked a fine time to leave me, Lucille With four hungry children and a crop in the field I've had some bad times I've lived through some sad times But this time the hurting won't heal You picked a fine time to leave me, Lucille   After he left us, I ordered more whiskey I thought how she'd made him look small From the lights of the barroom to the rented hotel room We walked without talking at all She was a beauty, but when she came to me She must have thought I'd lost my mind I couldn't hold her, for the words that he told her Kept coming back time after time   You picked a fine time to leave me, Lucille With four hungry children and a crop in the field I've had some bad times I've lived through some sad times But this time the hurting won't heal You picked a fine time to leave me, Lucille  You picked a fine time to leave me, Lucille With four hungry children and a crop in the field I've had some bad times I've lived through some sad times But this time the hurting won't heal You picked a fine time to leave me, Lucille",-0.9825,7,34,5,7,10,21,11,13,9,6
38,/songs/446312,Billy Currington,Must Be Doin' Somethin' Right,https://genius.com/Billy-currington-must-be-doin-somethin-right-lyrics,http://api.genius.com/songs/446312,Doin' Somethin' Right,2005-10-18," A woman is mystery A man just can't understand Sometimes all it takes to please her Is the touch of your hand And other times you got to take it slow And hold her all night long Heaven knows there's so many ways A man can go wrong   Must be doing something right I just heard you sigh You leaned into my kiss And closed those deep blue need you eyes Don't know what I did To earn a love like this, but baby, I Must be doing something right   Anywhere you want to go Baby, show me the way I'm open to suggestions Mmm, whatever you say Tonight's about giving you What you want, whatever it takes Girl, I hope I'm on the right road And judging by the smile on your face   Must be doing something right I just heard you sigh You leaned into my kiss And closed those deep blue need you eyes Don't know what I did To earn a love like this, but baby, I Must be doing something right   Ah, Baby Mmm   I don't know what I did To earn a love like this, but baby, I Must be doin' something right Must be doin' something right",0.9919,0,6,0,0,12,1,19,2,5,6
39,/songs/446298,Billy Currington,Next Time,https://genius.com/Billy-currington-next-time-lyrics,http://api.genius.com/songs/446298,Billy Currington,2003-09-30," So there's somewhere you got to be Well, I sure hate to see you leave I'll break my grip but babe you need to know Next time I might not let you go   I know what you said And I wanted that too But taking it slow is getting harder to do It's feeling more and more like forever Holding you close And next time I might not let you go   Good thing I don't get paid to think Cause I sure thought I had the strength To fight love off, but my resistance is running low And next time I might not let you go   I know what you said And I wanted that too But taking it slow is getting harder to do It's feeling more and more like forever Holding you close And next time I might not let you go   Yeah next time I just might Hold on for dear life Yeah, next time I might not let you go Next time I might not let you go   So, there's somewhere you got to be Well, I sure hate to see you leave",0.9842,6,11,4,5,4,8,7,6,6,5
40,/songs/446353,Billy Currington,No One Has Eyes Like You,https://genius.com/Billy-currington-no-one-has-eyes-like-you-lyrics,http://api.genius.com/songs/446353,Little Bit Of Everything,2008-10-14," Sometimes they look brown Sometimes they look blue Always they offer a beautiful view Into the soul I'm connected to No one has eyes like you They dance in the light They sing in the dark They pull me together They tear me apart I'm jealous of paper when you read the news Oh no one has eyes like you   They hold me, they know me Like no one will ever know me They fly me They land me Most of all they understand me   They shout hallelujah when you whisper my name Patiently listen to whatever I say They're playful and funny And passionate too No one has eyes like you   They hold me, they know me Like no one will ever know me They fly me They land me Most of all they understand me   They smile when I'm happy They cry when I'm sad They make me out to be more than I am Oh no one loves me more than you do And no one has eyes like you Oh no one has eyes baby like you",0.9623,3,3,1,0,9,2,13,4,3,6
41,/songs/2254854,Billy Currington,Nowhere Town,https://genius.com/Billy-currington-nowhere-town-lyrics,http://api.genius.com/songs/2254854,Summer Forever,2015-06-02," We got really good, at Rollin' my old mans jeep, out With the head lights off, while He was still asleep, and We stayed out all night, cause We knew all the right roads, yeah We knew just where, the Cops didn't go Yeah we had our hungry hearts beatin' like thunder We were kings of the summer on a double broken yellow line Knew what life was all about, had it all figured out like a mount and a dashboard light   We were watchin' the world go 'round In a nowhere town Livin' in a nowhere town Map dot, Camelot, lost and found In a nowhere town Livin' in a nowhere town   Starts gettin' late, and Your runnin' out of stars, so You and your girl, go Find a place to park, and She leans in close, for A knock-you-dead kiss That's the kind of thing, that You won't forget   Two hearts in a chevy, we were sure we were ready and we knew we were headin' for paradise Too young to know, that the streets of gold only go to the county line   We were watchin' the world go 'round In a nowhere town Livin' in a nowhere town Map dot, Camelot, lost and found In a nowhere town Livin' in a nowhere town   All you wanna do is have a drink on the bank of a river With your buddies little somethin' on a saturday night Yeah the way the world was spinnin', we were on and we were in it We were lovin' every minute, we were livin’ right   Woah, yeah No-oh-where town Smack dab in the middle of a nowhere town Woah-oh Hey hey Nowhere town Hey Nowhere town Nowhere town Smack dab in the middle of a little bit of nowhere town   We were watchin' the world go 'round In a nowhere town Livin' in a nowhere town Map dot, camelot, lost and found In a nowhere town Livin' in a nowhere town   All you wanna do is have a drink on the bank of a river With your buddies little somethin' on a saturday night Yeah the way the world was spinnin', we were on and we were in it We were lovin' every minute, we were livin’ right All you wanna do is have a drink on the bank of a river With your buddies little somethin' on a saturday night Yeah the way the world was spinnin', we were on and we were in it We were lovin' every minute, we were livin’ right   Woah-yeah No-oh-where town Nowhere town",0.8593,3,10,0,2,11,9,13,5,3,14
42,/songs/446279,Billy Currington,Off My Rocker,https://genius.com/Billy-currington-off-my-rocker-lyrics,http://api.genius.com/songs/446279,Billy Currington,2003-09-30," Well we know it ain't the first time We know it used to be my past time And a couple times back we agreed That was going to be my last time But I guess last night I plum forgot Who's running this show and who's not   Oh I must have been off of my rocker I must have got some wires crossed To come in hear claiming that from here on out I'm going to be the boss Oh it must have been me the big talker I had a little too much of Johnny Walker So let's forget about it baby I must have been off of my rocker   No there ain't no need to stay mad No need to waste a whole day mad Though I have to admit honey You look pretty darn cute mad Oh baby working this out can't be that hard Hahaha, I said I'm gonna be in charge   Oh I must have been off of my rocker I must have got some wires crossed To come in hear claiming that from here on out I'm going to be the boss Oh it must have been me the big talker I had a little too much of Johnny Walker So let's forget about it baby I must have been off of my rocker   Oh burn it down now Yeah I guess last night I plum forgot Who's running this show and who's not   Oh I must have been off of my rocker I must have got some wires crossed To come in hear claiming that from here on out I'm going to be the boss Oh it must have been me the big talker I had a little too much of Johnny Walker So let's forget about it baby I must have been off of my rocker",-0.814,3,5,4,3,5,7,11,3,2,4
43,/songs/446402,Billy Currington,One Way Ticket,https://genius.com/Billy-currington-one-way-ticket-lyrics,http://api.genius.com/songs/446402,We Are Tonight,2013-09-17," I'm a son-of-a-gun and a dad-gum joker I'm just a crazy, old laid-back loafer I got a dog looks like a gopher And he's been a pretty good friend  Play my guitar for the girls I'm meetin' Writing the songs from the books I'm readin' I find it odd that I'm breaking even Look at the money I've spent   I'm going through life on a one way ticket Ain't looking back, no, I don't want to miss it I'm going to dip my toes in the river of life Got a big bucket list, and before I kick it Going to buy me a Harley and Route Sixty-Six it Got a one way ticket and I'm going to enjoy the ride   Threw a dart at the map and it landed on Phoenix She looked at me like I was from Venus I grabbed the keys and she grabbed a Kleenex I headed off into the night  I'm nothing more than a modern day Jonah In the belly of a whale they call Arizona Ordering hot wings and cold Coronas Taking one town at a time   I'm going through life on a one way ticket Ain't looking back, no, I don't want to miss it I'm going to dip my toes in the river of life Got a big bucket list, and before I kick it Going to buy me a Harley and Route Sixty-Six it Got a one way ticket and I'm going to enjoy the ride   I'm going through life on a one way ticket Want to visit New England and sail the Pacific Gamble in Reno, give Frappuccino a try Going to call up the boss man and tell him to stick it Change the to-do's, to the already did it's Got a one way ticket and I'm going to enjoy the ride I got a one way ticket and I'm going to enjoy the ride That's right",0.9814,6,8,0,4,9,8,15,1,3,10
44,/songs/446349,Billy Currington,People Are Crazy,https://genius.com/Billy-currington-people-are-crazy-lyrics,http://api.genius.com/songs/446349,Little Bit Of Everything,2008-10-14," This old man and me Were at the bar and we Were having us some beers and Swapping I don't cares Talking politics Blonde and red-haired chicks Old dogs and new tricks and Habits we ain't kicked We talked about God's grace And all the hell we raised Then I heard the ol' man say   God is great Beer is good And people are crazy   He said ""I fought two wars Been married and divorced"" What brings you to Ohio? He said ""Damned if I know"" We talked an hour or two 'Bout every girl we knew What all we put them through Like two old boys will do We pondered life and death He lit a cigarette He said ""These damn things will kill me yet""   But God is great Beer is good And people are crazy   Last call is 2 a.m I said goodbye to him I never talk to him again Then one sunny day I saw the old man's face Front page obituary He was a millionaire-y He left his fortune to Some guy he barely knew His kids were mad as hell But me, I'm doing well   And I drop by today To just say thanks and pray I left a six-pack right there on his grave And I said   God is great Beer is good And people are crazy God is great Beer is good And people are crazy God is great Beer is good And people are crazy",0.9797,12,15,6,19,20,19,23,12,10,14
45,/songs/446387,Billy Currington,Perfect Day,https://genius.com/Billy-currington-perfect-day-lyrics,http://api.genius.com/songs/446387,Enjoy Yourself,2010-09-21," Baby drop what your doing Let's jump off this merry-go-round I don't know if we're coming or going Same old same old bringing me down I've had it up to here with this rat race We're just wasting time not tasting life   I'd rather be sitting on the beach Watching the sun come up Running my finger's through your hair As you lay there, all curled up Looking at me with that give me one more kiss Love doesn't get any better than this look on your face   I'd reach down and pull you up and we'd head that sailboat out to sea Chart our course for Anywhere the wind blows anyplace we see Our sails anchoring down Loving the night away Waiting on the light of another perfect day   I want a little sand between my toes The sunshine on your face But today's the perfect day   I'd rather be sitting on the beach Watching the sun come up Running my finger's through your hair As you lay there, all curled up Looking at me with that give me one more kiss Love doesn't get any better than this look on your face   I'd reach down and pull you up and we'd head that sailboat out to sea Chart our course for Anywhere the wind blows anyplace we see Our sails anchoring down Loving the night away Waiting on the light of another perfect day   Loving the night away Waiting on the light of another perfect day",0.9928,0,10,2,2,19,2,22,1,4,12
46,/songs/446381,Billy Currington,Pretty Good At Drinkin' Beer,https://genius.com/Billy-currington-pretty-good-at-drinkin-beer-lyrics,http://api.genius.com/songs/446381,Enjoy Yourself,2010-09-21," I wasn't born for digging deep holes I'm not made for paving long roads I ain't cut out to climb high line poles But I'm pretty good at drinking beer   I'm not the type to work in a bank I'm no good at slapping on paint Don't have a knack for making motors crank, no But I'm pretty good at drinking beer   So hand me one more That's what I'm here for I'm built for having a ball I love the nightlife I love my Bud Light I like 'em cold and tall   I ain't much for mowing thick grass I'm too slow for working too fast I don't do windows so honey don't ask But I'm pretty good at drinking beer   A go getter maybe I'm not I'm not known for doing a lot But I do my best work when the weather's hot But I'm pretty good at drinking beer   So hand me one more That's what I'm here for I'm built for having a ball I love the nightlife I love my Bud Light I like 'em cold and tall   I wasn't born for digging deep holes I'm not made for paving long roads I ain't cut out to climb high line poles But I'm pretty good at drinking beer   So hand me one more boys That's what I'm here for",0.9986,1,13,1,0,20,9,26,0,6,15
47,/songs/447960,Billy Currington,She Knows What To Do With A Saturday Night,https://genius.com/Billy-currington-she-knows-what-to-do-with-a-saturday-night-lyrics,http://api.genius.com/songs/447960,Doin' Somethin' Right,2005-10-18," She don't cook, she don't clean She ain't never found the knob on the washing machine She don't iron, she don't sew Says why waste time, folding clothes She ain't never gonna get Mama's recipe right But she knows what to do with a Saturday night   Hit every hot spot all around town Turn it on up, she'll tear it on down People rubber necking, trying to see her dance She got a belly button ring and some low-rider pants They call me lucky, I know that's right She knows what to do with a Saturday night   She makes a mean margarita and a Singapore Sling And if ya'll are into Skynard, she sure can sing She's gonna run the table, if you let her break She might pop out of the top of a birthday cake And that little black dress painted on tight She knows what to do with a Saturday night   Hit every hot spot all around town Turn it on up, she'll tear it on down People rubber necking, trying to see her dance She got a belly button ring and some low-rider pants They call me lucky, I know that's right She knows what to do with a Saturday night   We get home in the early a.m That's when all the real fun begins Yeah, she holds me close and whispers in my ear Every little sweet thing I want to hear Then she lights them candles and out go the lights She knows what to do with a Saturday night Yeah, they call me lucky, I know that's right She knows what to do with a Saturday night Saturday night With a Saturday night Saturday night",0.9806,4,6,1,0,11,5,20,2,7,14
48,/songs/446323,Billy Currington,She's Got A Way With Me,https://genius.com/Billy-currington-shes-got-a-way-with-me-lyrics,http://api.genius.com/songs/446323,Doin' Somethin' Right,2005-10-18," It's a gentle touch, but more than enough She can stop this ole world from spinning too much It's a natural thing and I do believe I found my reason to be   She's got a way with me She's got a way with me   I'm not the same man since she's been around There's more to this life, I've suddenly found I look at myself now so differently It's her love that brings me peace   She's got a way with me She's got a way with me   Whatever it is, I'll always be under her spell She'll always be all I'll ever need I could search the whole world And I know I'd never find Someone perfect as her for me Suddenly it's something You just can't live without Oh, you know you found love Beyond any doubt With a simple man's words I can never convey all that I feel when I say   She's got a way with me She's got a way with me She's got a way with me She's got a way with me",0.926,0,2,0,1,7,1,9,1,3,7
