,Unnamed: 0,api_path,primary_artist,title,url,song_endpoint,album,release_date,lyrics,polarity,anger,anticipation,disgust,fear,joy,negative,positive,sadness,surprise,trust
38,38,/songs/342146,Kid Rock,Detroit Thang,https://genius.com/Kid-rock-detroit-thang-lyrics,http://api.genius.com/songs/342146,Early Mornin' Stoned Pimp,1996-01-09," It's a Detroit thing, everybody It's a Detroit thing, tell your body It's a Detroit thing, gonna show you right It's a Detroit thing, yeah, yeah   I'm bout to say the law, cause i'm the K-I-D I'll be whipping and flipping rhymes from the fucking D And for the peoples, and for the peoples There is nobody in the D being equals to us So i bust, cause it's a must that i go for my With another funky Detroit rhyme, yeah I got it all like Jack, and my shit is Phat, you know that And ya don't stop, and ya don't stop Somebody in the houses? Somebody, can i get a little soul clap Can i get a soul clap y'all, a soul, a soul clap y'all There's a party in the D, where ya at yo   I be busting and flicking, for the mother fucks Cause i'm the bigging with the rock Who got the getting ducks Talking about John Lee, I'm talking 'bout the P funk Come on lets get drunk Get a glass of wine, you'll be feeling fine Rock is on the mic., i'm about to go for mine Got my shoelaces laced up, my hat turned back My shit is Phat, you know that   I am not talking about Philly, no I am not talking about DC., no I am not talking about New Orleans, where they say the funk got started I'm talking about the D, i'm talking about the D you all I'm talking about the D It's a Detroit thing Yes, yes you all, A free freak you all To the beach you all, so unique you all I rock, rock you all, i'm Kid Rock you all There's a party in the D, where ya at yo It's a Detroit thing, gonna show you right   It's a Detroit thing, same same It's a Detroit thing, everybody It's a Detroit thing, tell your body It's a Detroit thing, gonna show you right It's a Detroit thing, yeah, yeah   And ya don't stop, and ya don't quit And ya don't stop, stop, stop Let ya body rock, and ya rock a shot Like in the sure shot   Because you know i got the fucking rhymes that'll make you say hooahh Bring it down You all know what the fuck i'm talking about Don't even stand there in the front Put your hands in the air you all Lets rock one more time, here we go  ",0.934,7,6,4,3,6,12,20,6,4,15
39,39,/songs/26071,Kid Rock,Devil Without a Cause,https://genius.com/Kid-rock-devil-without-a-cause-lyrics,http://api.genius.com/songs/26071,Devil Without a Cause,1998-08-18," You knew that I was coming cause you heard my name But you don't know my game, you never felt my pain Can't read my brain but you read my lips And got scared when you heard that I was coming with hits Now don't even trip, be a man instead Give thanks I'm alive when I should be dead Uh! I'm in the red cause my mind's distortin' People claimin' that they know me, but they only know a portion I'm gonna move mountains and touch the sun Don't get scared now, you knew this day would come So hold your bids, all bets are closed And fuck all you hoes Cause it's been a long time comin' But I finally broke like an egg yolk I ain't no joke Like some uncut dope motherfucker, Kid Rock's to blame Same game, same name, ain't a damn thing changed No sell-out, I ain't no ho, fuck the radio I'm comin' from that R-O-M-E-O Watch me throw like a fist of rage Self-made and paid and sawed-off 12 gauges Up that ass for the 9-8 Never fake, shake, straight from the Great Lakes Seven years on wax comin' correct Flat out you diss me punk, that's when I pull the strap out And I get to buck-buck-bucking I'm fuck-fuck-fucking your hoes Cause they know who's runnin' this shit, Top Dog I'm the C-E-O Role model, your mother-fucking H-E-R-O My motto, ""Be Cool - Keep Pimpin'."" Don't sleep, we roll deep in a Lincoln Four Vogues on a hundred spokes We bust Biltmore Beavers in Top Dog coats We float like butterflies, sting like queen bees Strapped with A-K's straight from the Chinese What the fuck's goin' on in the D Bunch of white boys pimpin' like the K-I-D And it's all good I got love for my honkeys We roll thick kick ass like donkeys Anybody fuck's with you, I'm gonna mack 'em   Devil without a cause...I'm going platinum I'm going Platinum (DEVIL) I'm going Platinum (DEVIL) We're going platinum (DEVIL) Devil without a cause I'm going platinum   Yeah we come to party, so get down everybody Yeah we come to party   I went from St. Claire shores and drink specials at Winners To New York City and $700 dinners From hangin' with sinners and second hand cheap sex To gettin' much respect from top record execs The cool Kid's claimin' up to call you out So shut up now or put my balls in your mouth Bet that ass hoss I ain't forgot When I was tossed in the dime bin and left to rot Used to call me funny when my nose was fucking runny Now my fuckin' bunnies gettin' fuckin' Matchbox 20 money Motherfuckers want to claim they're down But when I was broke and down I never seen them around All the shit we talked, all the shit we dreamed I did it without you got a brand new team No triple beams it seems like a movie Bought two cribs, droptop, and jacuzzi No more fluzzies only high class hoes A couple when it rains and a few when it snows A brand new nose to go along with my habit And a garden hose made out of 24 karat Bought a couple parots that like to squak And they sound like you and all the shit you talk Step inside my shoes, you couldn't fill em' doc You're too old to kid, too soft to rock Already did what most love to shout 7 years on wax and I still ain't sold out And there ain't no doubt in my mind That I'm gonna stomp all over you test of time   I'm going platinum I'm going platinum I'm going platinum We're going platinum Devil without a cause I'm going platinum Devil Devil Devil Devil   Straight out of the streets of Taylor 3 foot high, ready to get fly Joe C  [Verse 3: Joe-C] I'm the J-O-E to the C ho Call me Joe C ,got more game than Coleco I'm a freak ho call me sick Three foot nine with a ten foot dick The ladies pick, I'm a crazy hick And rake through kind like a bum through wine It's my time so I'm gonna shine like glass Old as piss, but small as ass Watch me cash smoke some hash You're raking grass while I'm raking cash High-ass voice just like Aaron Neville And I'm down with The Devil Say we like to party, rock the party We like to party, rock the party We like to party, rock the party We like to party, rock the party You like to party, rock the party We like to party, rock the party You like to party, rock the party   Devil without a cause, I'm going platinum Come on!",0.9408,29,37,27,27,18,42,45,22,10,22
40,40,/songs/26105,Kid Rock,Do it for You,https://genius.com/Kid-rock-do-it-for-you-lyrics,http://api.genius.com/songs/26105,Kid Rock,2003-11-11, Been sitting alone Thinking about the past Another lonely night Another empty glass This path i'm walking Always seems to lead no where I wonder how much you think of me How we used to laugh How we used to be It seems like freedom Has never had a man so scared   Times might change Love it comes and goes How i wish i could have shown you How deep for you my love goes And i know this might seem crazy I would end my life for you You know i don't want to But id do it for you Hey id do it for you I wonder how much you think of me It hurts to think the past Is all that you can see Now it seems like freedom Is better then the love we shared   Listen to me I wonder how long it takes to see There's nothing more i want Then you here with me Freedoms been knocking But i refuse to let her in   Times may change Love it comes and goes How i wish i would have shown you How deep for you my love goes And i know this might sound crazy I would end my life for you You know i want to Come back home and care for you Baby id do anything for you Id do anything for you,0.9915,4,3,1,6,10,5,12,4,1,4
41,41,/songs/342212,Kid Rock,Don't Tell Me U Love Me,https://genius.com/Kid-rock-dont-tell-me-u-love-me-lyrics,http://api.genius.com/songs/342212,Rock n Roll Jesus,2007-10-09," From hard luck tricks To trust fund freaks Bathroom stalls to penthouse suites I been around I been around From the bottom of the barrel To the cream of the crop They've picked me up And I've watched them drop I been around I been around I sang them all a song or two About simple things Still I feel I'm being used Isn't a damn thing changed   I'm an outlaw Bad Leroy Brown The only Cool Hand Luke left in this town I get my loving on the run I'm a low down Mister fly by night Baby slow down Let me show you right I sure don't want to hurt no one   So, don't tell me you love me Don't tell me you love, love me do Don't tell me you love me Because love's one thing that I cannot do And it's the only thing that I can't give to you   From Hollywood hoes to backstage jive Jacked up trucks and Gulf Stream 5's I been around I been around From silly little girls who play them games To the rich and famous I won't say no names I been around I been around You got to touch the stove to learn they say Get burnt and learn that way You better keep your feelings at bay Or honey you going to pay     So, don't tell me you love me",0.9904,4,4,5,3,13,9,22,4,4,11
42,42,/songs/713490,Kid Rock,Drinking Beer With Dad,https://genius.com/Kid-rock-drinking-beer-with-dad-lyrics,http://api.genius.com/songs/713490,First Kiss,2015-02-24," It’s the simple things in life But life ain’t so simple right Times get hard and people can make you mad But I remember when I was young I couldn’t wait to turn 21 To sit in the backyard sun and drink beer with dad   Drinking beer with dad Out there on the back porch swinging Drinking beer with dad Picking my guitar and grinning   We’d hem and haw, we’d cuss and fight But that’s where I learned life’s best advice We’d talk about when I was young and bad Sometimes he’d make me fightin’ mad The best education I ever had Was out there on the back porch drinking beer with dad   Nowadays most things have changed This whole world is heading down the drain There’s no God in schools Totin' guns is the latest fad A little discipline would sure be nice A little lesson in wrong and right Maybe it’s time young man to have a beer with dad   I’d play him songs all through the night Like praise the Lord I saw the light We’d stay up late and make mom mad But half the time we’d just laugh and laugh Some of the best times I ever had Was out there on the back porch drinking beer with dad   Now son I’m so damn proud of you And the young man you’ve turned into You’re the best son a father could ever have And though your grandpa’s done past on Soon you’ll be 21 So come on the back porch son and have a beer with dad   We’ll hem and haw, we’ll cuss and fight But I’ll pass along life’s best advice We’ll talk about your old granddad The things he gave us he never had I wish forever our time could last I wish this world wouldn’t move so fast Out here on the back porch Out here on the back porch drinking beer with dad",0.9849,8,14,6,9,18,18,22,5,7,10
43,43,/songs/26053,Kid Rock,Drunk in the Morning,https://genius.com/Kid-rock-drunk-in-the-morning-lyrics,http://api.genius.com/songs/26053,Cocky,2001-11-20," I want to make money to take away my problems But my problems get bigger with the more money I make I want to find love, but that's my problem Because the money makes it hard to tell the real from fake I wanna spend time with my son, oh, every hour But the money and the problems and the women keep me away I want to be happy for just one hour But the only time I'm happy anymore is on the stage  I get drunk in the morning, I don't look for afternoons I don't care if tomorrow never comes I've been pushed and kicked around, it seems, my whole life And now I'm tired, Lord, I'm so damn tired inside  So let's rock it with the band, turn this shit up to ten now I got a feeling you've been waiting for way too long now And if you're looking for a party you came to the right spot So drink them down motherfuckers and roll with the Kid Rock And the band plays   And I thank you people for feeling me, I'm feeling you too Oh what a ride it's been Up and down, all around the world We've been, we're back, you're here Let's make the most of our time now And if you get up, I won't let you down   And when the power hits the brain you'll be feeling it real fine I'm talking guitars, car sex and real cheap wine On time and tight, you let me hear it if you want more I got a fifth of good music, if you're holding out, pour more   And I thank you people for feeling me, I'm feeling you too Oh what a ride it's been Up and down, all around the world We've been, we're back, you're here Let's make the most of our time now And if you get up, I won't let you down   Get up, get up, yeah Get up, get up, yeah What a ride, and I thank you, people, thank you",0.9099,13,21,9,10,16,18,24,11,11,20
44,44,/songs/1169402,Kid Rock,E.M.S.P. (feat. Uncle Kracker),https://genius.com/Kid-rock-emsp-feat-uncle-kracker-lyrics,http://api.genius.com/songs/1169402,Early Mornin' Stoned Pimp,1998-08-18,"This is the true story about mackin  Check it Times are changin Talk about it More so each year But the Early Mornin, Stoned Pimp is here Yeah So let it rain, and let the guitar rock And if ya here me yaaaawwwwn Just drop that top Come on, girl Hey hey hey Well well well well Hey hey hey Well well well well, well Come on, girl, Yeeeaaahhh  And I be catchin them northern pike Like on a ten pound test Posess, never fess, take a guess I be the early mornin stoned pimp Straight limpin Boone's Farm drinkin At the party big booty pinchin Chillin, like a villian, balloon fillin Whack MC killin, the fine hoe drillin With the million dollar talent and the ten cent brain Been gone too long, too much cocaine But now that I'm back, on the block I'm ready to rock Left to right, all night My game's tight, I wish you might Take a bite Out of this here toxic, melodic, neurotic product Fresh from the harvest Who'll be the largest, hardest, smartest, label in town Top Dog get down, Uh Radio won't play me But still I got the kids around the world goin Kid Rock crazyin Wicked witches be flyin on broomsticks Kid Rock be comin with the boom boom boom biatch I from the sticks biatch Straight from the RO Kid Rock I ain't's no bitch Ah, yes you are hoe So quit frontin like y'all don't know When I step straight into the party with my homeboy Tino What's up? So get a good look bro, get a good gander I'm made in Detroit, but my name ain't Stanzler Spreadin' like a cancer, a virus While you're lookin really gay like fuckin Billy Ray Cyrus I'm the highest MC of all time Got my mind on the D And the D on my mind And the line gets drawn when my eyes can't see Hit me twice with the Tussin and the morphine IV I be What they call an O-G bitch I'm the motherfuckin Early Mornin Stoned Pimp Say what?  One time for you Now throw your hands in the air and let's rock y'all Just throw your hands up high, hip hop y'all Just throw your hands in the air and let's rock y'all Because a Detroit party don't stop y'all  Just throw your hands up high, let's rock y'all Just throw your hands side to side, hip hop y'all Just throw your hands up high, let's rock y'all Because a Kid Rock party don't stop y'all  Now I'm the self made mack on a mountain on Mars Got the money green, cut it with the high roll gloss A Lincoln Continental and a Grand Marquis Rag top, drop down, rollin on chrome D's biatch The purple furs and the gold trim glasses I only bust the fat asses And I don't be givin a fuck who da hell can rap better than me Cause I'm a true fuckin' player and I mack like a real G H-I-J-K, L-M-N-O-P is for pimpin Early mornin stoned pimpin I been down, been around From the bottom to the top Partyin down with the slimmies in the cities that I rock So ah, ooh baby, baby, baby let me love ya Or if you wanna get your freak on, I'll just fuck ya With the ooh, ahh, ooh, ooh, ooh ahhh, biatch, shit I'm the Early Morning Stoned Pimp Hahaha  Hey hey hey Come on yo  Now throw your hands in the air and let's rock y'all Just throw your hands up high, hip hop y'all Just throw your hands in the air and let's rock y'all Because a Detroit party don't stop y'all  Just throw your hands up high, let's rock y'all Just throw your hands side to side, hip hop y'all Just throw your hands up high, let's rock y'all Because a Kid Rock party don't stop y'all   I'm Joe C bitch Let me get them digits I might be a little small hoe But I ain't no God damn midget So stick it up your ass where the sun don't shine I'm vertically challenged, your vertically blind I'm three foot nine, it's ten foot long I'm gonna smack that ass after I pack this bong I can flow on like all night long Till the break of dawn Till the early morn I'm a thorn in your side Can you feel me stickin Eighty pills a day bitch, I ain't bullshittin So groove baby groove baby call your momma I'm like John Lee Hooker girl  I got the boogie drama With the boogie drama, what With the boogie drama, yeah With the boogie drama, oh yeah  Ridin around the neighborhood Me and Kid Rock were up to no good With the boogie drama, yeah With your leather miniskirt and we got some wine Playin the radio, ya look so fine With the boogie drama, yeah Well, Well, Well, boogie drama, oh baby Let's get funky, that's my job With the boogie drama, oh yeah Punchin nine to five, seven times, times twenty-four, times twelve With the boogie drama, oh yeah Day in and day out With the boogie drama, oh yeah Let's get funky Come on everybody Well, with the boogie drama With the boogie drama",0.9994,13,27,13,11,19,40,59,9,9,25
45,45,/songs/26110,Kid Rock,Feel Like Makin' Love,https://genius.com/Kid-rock-feel-like-makin-love-lyrics,http://api.genius.com/songs/26110,Kid Rock,2003-11-11, Baby when i think about you I think about love Darling don't live without you And you love If i had these golden dreams Of my yesterdays I would wrap you in heaven Till i'm dying on the way Feel like makin love Feel like making love to you Baby if i thinking about you I think about love Darlin if i live without you I live without love   If i had the sun and the moon I would give you both night and day Of satisfying Feel like making Feel like makin love Feel like making love to you And if i had those golden dreams Of my yesterdays I would wrap you in heaven Till im dyin on the way Feel like making love Feel like making love to you,0.9976,1,1,1,1,14,1,15,1,1,3
46,46,/songs/713468,Kid Rock,First Kiss,https://genius.com/Kid-rock-first-kiss-lyrics,http://api.genius.com/songs/713468,First Kiss,2015-02-24," I remember waiting for the school bus Jenny Clayton was my first crush And neither one of us had a clue An old Cheyenne it was my first truck Rusted, rough and kinda beat up But when she jumped in it felt brand new   And now these days when I drive through a small town I turn my stereo up and roll my windows down   ’Cause it reminds me of my first kiss And those days that I always miss Tom Petty on the radio Going steady with nowhere to go No money just time to spend An old Chevy and a couple friends Oh how I wish that I could go back in time  Just to love you again   I remember drinking from the same cup We’d break up just to make up I remember falling in love with you Smokin’ cigarettes on the tailgate Man it seems like it was yesterday When Main Street felt like Park Avenue   And when I’m driving through any ol’ small town I turn my stereo up and roll my windows down   ’Cause it reminds me of my first kiss And those times that I always miss Tom Petty on the radio Going steady with nowhere to go No money just time to spend An old Chevy and a couple friends Oh how I wish that I could go back in time   When forever felt like it would never come And we never thought we’d turn 21 So young we thought this could never end Oh how I wish we could go back again   And now that time has taken over And we can’t fight this getting older But somehow baby we made it through And every time I’m a lookin’ at you   ’Cause it reminds me of my first kiss And those days that I always miss Tom Petty on the radio Going steady with nowhere to go No money just time to spend An old Chevy and a couple friends Oh how I wish that I could go back in time   Just to love you again Just to love you again Just to love you again Just to love you again Oh how I wish that I could go back in time",0.9979,4,20,0,1,17,9,21,2,11,11
47,47,/songs/26069,Kid Rock,Fist of Rage,https://genius.com/Kid-rock-fist-of-rage-lyrics,http://api.genius.com/songs/26069,Devil Without a Cause,1998-08-18," Got to make this money Gotta make this money This money is me This money is everything I do and see Who are you to judge me Just let me be - and let me breathe I see this whole world headed for damnation And I'm ready to leave I can't believe this whole world twisted me You fucking bigots, you fakes, you want to be's I see the future and its looking grim A lake of fire looking like a gonks whip   I'm going to fist of rage (one foot in the grave) I'm going to fist of rage (far from saved) I'm going to fist of rage (in a broken state) (I'ma razor blade slitting through a wrist of hate) I'm going to fist of rage! x4 Crack another bottle and let me knock one back   Huh-huh, Slim Jim's And the tin men grins Fat heads with dreads And all the feds growing shark fins Huh-huh, my girls knocked up We're in love but she's young and I think I'm being locked up I couldn't cut the mustard with a Ginsu And a twist of brown for all the bullshit I been through I'm looking for love but it's got too many dam faces I can't win even with these four aces My place is here with the mix and the tricks and sickos I spend g's but only make nickels My soul tickles But this isn't even fun and games My heart bleeds from the pleasures of the pain My fuse is short and its lit like me I'm short It's sketchy It's getting hard to see My heart bleeds believe it every dying breath These people take and they take Until there's nothing left   You feeling bold with me Your up a creek And you don't know it Finger on the trigger but your punk ass is scared to pull it And I know it Because the fear you hide your eyes show it Payback on your ass because I know I owe it Now when your going down bet I'll be blowing up Hear the sound of a shotgun cock and know you're fucked I hope you see my middle finger from the stage (Coming - Come and feel me x4)  ",-0.9906,18,14,6,14,12,24,18,10,11,11
48,48,/songs/342223,Kid Rock,Flyin' High,https://genius.com/Kid-rock-flyin-high-lyrics,http://api.genius.com/songs/342223,Born Free,2010-11-16," You know I spent a little time out in Malibu I spent quite a bit down in Nashville too Because I like the beach and loves to honky tonk But the place that I call home Is where I never have to feel alone It's the place where I was raised and I was born   And the grass don't get much greener And life can't get no sweeter I got a funny cigarette and a two-dollar bottle of wine And there's no need for new beginnings More money or window trimmings And if the good Lord's willing, I'm a keep on chilling, refilling and flying high   Flying high In an old lawn chair Flying high With an ice cold beer Got nowhere to go, no place I'd rather be Yeah the grass don't get much greener And life can't get no sweeter And if the good Lord's willing, I'm a keep on chilling, refilling and flying high   You know I've traveled on yachts threw the south of France Think I even got a pair of Versace pants But all that makes me feel is like a fool Because a pontoon boat, and a bottle of Beam A couple good friends, and some cut off jeans Has made us realize, you can't buy cool  ",0.9783,1,5,3,4,9,7,17,0,4,9
49,49,/songs/713509,Kid Rock,FOAD,https://genius.com/Kid-rock-foad-lyrics,http://api.genius.com/songs/713509,First Kiss,2015-02-24," I heard that you been talking ‘bout me Walkin’ round without a tear in your eye, eyes, eyes Airing out my dirty laundry while trying to suck my well bone dry, dry, dry You ain’t nothing but complicated Everything you preach is a lie Everything I try you hate it So baby why don’t you just fuck off and die   I heard that you been speaking softly Trying to toss my good name under the bus, bus, bus Creeping ‘round with everybody Hey baby whatever happened to trust, trust, trust   You ain’t nothing but complicated Every time you love it’s a lie You got me so damn agitated So baby why don’t you just fuck off and die Fuck off and die All your lies and hatred Fuck off and die All the good times wasted Die for the good yeah die for the bad Die for the memories we’ll never have C’est la vie adios fuck off and die   I’m giving you an ultimatum Cuz I ain’t gonna watch you break him down, down, down You told me you were trying to save him But all you did was sit back and watch him drown, drown, drown The truth is far from how you played it Everything you said was a lie All this time I watched you fake it So baby why don’t you just fuck off and You ain’t nothing but complicated You put me down every time I try You’re so damn jealous I finally made it So baby why don’t you just fuck off and die So baby now you can kiss my ass goodbye Yeah fuck off and die",-0.999,14,12,13,19,13,33,19,20,6,13
