,Unnamed: 0,api_path,primary_artist,title,url,song_endpoint,album,release_date,lyrics,polarity,anger,anticipation,disgust,fear,joy,negative,positive,sadness,surprise,trust
116,116,/songs/342202,Kid Rock,Roll On,https://genius.com/Kid-rock-roll-on-lyrics,http://api.genius.com/songs/342202,Rock n Roll Jesus,2007-10-09," I love it when you play it like that Come on, play   Sitting here alone I'm looking back on where I've roamed And laughing how I swore I'd win and not get burned Left my family Left my home I worked my fingers to the bone And there was not a stone I did not leave unturned And I was having a good time   Roll on Roll on Roller Coaster We're one day older and one step closer Roll on there's mountains to climb Roll on we're on borrowed time Roll on Roller coaster Roll on tonight Roll on tonight yeah   Money and success I don't complain about the stress I wanted this and now it's here So I don't bitch And I swear that time's a trick It disappears in oh so quick Man I was just sixteen And now I'm staring at thirty-six But I'm still having a good time   Roll on Roll on Roller Coaster We're one day older and one step closer Roll on there's mountains to climb Roll on we're on borrowed time Roll on Roller coaster Roll on tonight Roll on tonight And I know it's hard to see with the sun in your eyes But one day you're going to say I saw the light   And now heading for the hill And I just cannot wait until My children grow up to have children of their own And I'll be telling them about The times I turned the party out And how I stood against an army all alone Drinking wine and staying high And realized it couldn't last And how I turned myself around And went down another path And the signs we must observe When life's changes do occur But most of all I'll tell them Just how proud I am of them And always have a good time It's all the love and good times Let's all have a good time, yeah   Roll on Roll on Roller Coaster We're one day older and one step closer Roll on there's mountains to climb Roll on we're on borrowed time Roll on Roller coaster Roll on tonight (roll on tonight, roll on tonight) Roll on tonight (just roll, roll baby, roll baby) Roll on tonight (hey woo hooh) Roll on, roll on I want you to roll Roll with me babe Roll with me babe Roll with me every time Hey   Roll on Roll on Roller Coaster We're one day older and one step closer Roll on there's mountains to climb Roll on we're on borrowed time Roll on Roll on Roller Coaster We're one day older and one step closer Roll on there's mountains to climb Roll on we're on borrowed time   Roll on Roll on Roller Coaster We're one day older and one step closer",0.9936,4,31,1,2,17,9,20,9,9,12
117,117,/songs/26072,Kid Rock,Roving Gangster (Rollin'),https://genius.com/Kid-rock-roving-gangster-rollin-lyrics,http://api.genius.com/songs/26072,Devil Without a Cause,1998-08-18," Everything's tight from my loot to my friends I ain't got time to tighten up loose ends, huh I've been that route too many times If I ain't stabbed in the back I ain't fightin' no crime I wish for that which my heart holds near But ain't nobody playin' what I'm tryin' to hear I've been sayin' for years that the fakes wouldn't last You were jockin' that bullshit, now you look like an ass   Get gassed in your garage of sickness As I bring a little swing into your world of stiffness Cause I've got plenty of rhymes to spill Ain't got nothin' more than time to kill Form like a blister, drink like a failure Rip like a twister right through a trailer Park after dark is when you'll see me comin' My gun's gunnin' and the 808's hummin' Raw Raw Rip Rock Rude Sample anything I like and never get sued At 18 I had a hardcore attitude When I turned 19 I was touring with Ice Cube It's true I broke the old school Where the rules don't bend and the beats don't end No place to be I gotta let these knuckles know who the fuck I be I'm still the (I'm still body rockin' DP MC) (So clap your hands to what he's doing) I'm a razor blade slittin' through a wrist of hate I'm a contradiction I'm a twist of fate   See me rollin' You got me rollin' I'm rollin' Searchin' underneath the sun     I'm dead as shit, but I ain't been killed See I'm a Mack, I'm a truck, but I'm Peter built I am the Trucker and my ego's large I'm the K to the I call me sarge Roll number seven raise south of heaven See my crew comin' hear them Harley's revin' I'm steppin' to your crew with a glick of hits Got 3 LP's but I ain't got no hits And I'm a greatful, hateful, little son of a G I'm a deadhead runnin' from the D-P-D Got soul so plagued with the rhythms cancer Grab a pole and you'll be swingin' like a topless dancer Biltmore Beavers and a Top Dog Coat Top car 4 Vogues on a hundred spokes Got a roundtrip ticket to the promised land If it ain't all that I'll be back my man   See me rollin' You got me rollin' I'm rollin' Searchin' underneath the sun Rollin' You got me rollin' I'm rollin' Searchin' underneath the sun   Days roll by they roll too fast I said days roll by, I watch them pass Yeah, you wanna roll with Rock And party with crews that just don't stop, uh-huh Yeah   Rollin' You got me rollin' I'm rollin' Searchin' underneath the sun   Searching underneath the sun Searching underneath the sun Searching underneath the sun",-0.93,10,15,7,11,10,20,19,8,7,22
118,118,/songs/26115,Kid Rock,Run Off to LA,https://genius.com/Kid-rock-run-off-to-la-lyrics,http://api.genius.com/songs/26115,Kid Rock,2003-11-11," This here is no love song And it is not for you Its for the folks that relate to What i have been going through Its for the 40 hour overtime Working man And too the good women out there I know you'll understand  Why don't you run off to L.A And lose your mind And get some energy doctor to tell You everything is fine We can still be friends like you talk about But first give me back them pearls And the keys to my fucking house Get out   They say all wee need is just a little patience But what do you do when your woman Is too high maintenance yea I'm hating to admit it Even if its your wife Tell her pack your shit And take the first train out of my life   Its a classic line baby I just wanna be friends But baby my friends don't have the keys to my Mercedes Benz, no I think i know what you mean You wanna talk and such Tell me all your problems But we don't fuck Its is not that right I had plenty of friends before i met you I don't need no more So now i thinks its time you started heading out for that door and even tho i feel real bad tonight Please pack your shit And take the first train out of my life   Why don't you run off to L.A And lose your mind Louver got 15 minutes and I think your wasting time yea Its easy to see when you've lost your mind But here ill be when you decide to come back blind You were a mid-west girl who says She liked to drink beer and hang And now your walking red carpets talking new York hip hop slang And even though i might break down And cry tonight Please pack your shit And take the first train out of my life oh yea yea  Why don't you run off to L.A",-0.9627,8,4,8,6,9,13,22,8,4,15
119,119,/songs/713511,Kid Rock,Say Goodbye,https://genius.com/Kid-rock-say-goodbye-lyrics,http://api.genius.com/songs/713511,First Kiss,2015-02-24," We haven’t really talked about it All we do is walk around it now I hate to say I’ve thought about it I wish that we could make this work somehow It’s not really complicated I can hear it when you sigh Comes a time we have to face it Maybe it’s just time to say goodbye   Lately I can feel us drifting Even though the good outweighs the bad Feels like our world is shifting, but yet you are the best I’ve ever had I still love to watch you sleeping I still see that look in your eye But there’s seeing and believing And maybe it’s just time to say goodbye   Say goodbye, to all the times we treasure Say goodbye, let the chips fall where they lie Say goodbye, to things we cannot measure Walk away, say goodbye   I’ll remember you forever I’ll remember every single year Running through the rain and laughing And later in our bed with you so near And I know when I am older And the clouds fill up the sky I may look over my shoulder And know I was too young to say goodbye Years from now when I am older I may sit and wonder why Will I look over my shoulder And know I was too young to say goodbye I was just too young to say goodbye Say goodbye",0.967,3,11,3,3,7,5,12,6,4,8
120,120,/songs/342148,Kid Rock,Shotgun Blast,https://genius.com/Kid-rock-shotgun-blast-lyrics,http://api.genius.com/songs/342148,Early Mornin' Stoned Pimp,1996-01-09," Ah, shit! Kid Rock back in this motherfucking house Feel the effects of my shotgun blast Mothers crying from theses shotgun blasts Feel the effects of my shotgun blast People dying from theses shotgun blasts Cause I'm ripping, flipping, cripping, like a real one does So if your rap's wrapped in jack, sweep it under the rug Cause I'm a go above that, beyond the calls of my fucking duty Cause all theses corney, foney emcee's now a days don't move me So I'm a show it proof G, so make waves I got a full time pay, stat to dig graves Because I'm burrying emcee's, and sharin their lady's Now you rolled ho's are carrying my babies Grab me it never hurt no one A broken home always hurts someone Grab me it never hurt no one I saw kid's get shot, don't sell guns And still i rip it, flip it, grip it like a real one does Rocking, shocking on the stage, with a hella steady buzz From a 5th of ole Jimmy Beam We frying emcee's up just like some motherfucking Jimmy Dean Sausage patty's, and smoking cabbies like it's no thing Drinking more Colt's then the 45 king Swinging emcee's like a cow hands rope And if the guns too loud, oh boy, i'm straight slitting throats Cause that's the way I like to do shit Holmes Every time I get my gamble on Yeah that's the way i like to do shit Holmes I never stay in one spot, i was born to roam Feel like i got bank, but it's not enough friend Cause i want more bank see, than my grand-kids could ever spend So if ya need some cheep slut, then speak up Most ho's know not to ask for cash, cause i'm a cheep fuck   Feel the effects of my shotgun blast Mothers crying from theses shotgun blasts Feel the effects of my shotgun blast People dying from theses shotgun blasts",-0.9653,24,7,7,19,7,30,15,11,10,14
121,121,/songs/26117,Kid Rock,Single Father,https://genius.com/Kid-rock-single-father-lyrics,http://api.genius.com/songs/26117,Kid Rock,2003-11-11, Lately i have been spending lots of time with my kid Telling him stories About the things that we did When we were a family Long time ago I've answered his questions Till i'm blue in the face Wish all that hurt in him I could erase But i tell him the truth Cause he is not to young to know   Single father Part time mother When i'm not one Then i'm the other You used to be My full time lover Now i'm a single father And a part time mother   I spend every minute I can with my boy There's no doubt about it Hes my pride and joy Someday he will grow up And i won't have him no more Some things i just find Too hard to explain So we go to McDonald's Or i buy him a train And we go put it together On the living room floor  Such is the life Of a single father He says daddy explain If its not too much bother While its just you and me Living here in this home I don't understand it And neither does he Why there's just two When there should be three of us Sharing this moment Lord i feel so alone  ,0.9132,1,11,2,3,7,8,14,5,1,13
122,122,/songs/206453,Kid Rock,Slow My Roll,https://genius.com/Kid-rock-slow-my-roll-lyrics,http://api.genius.com/songs/206453,Born Free,2009-11-16," There's a new day on the horizon There's a rising in the air Somewhere somebody's trying to tell me they care So I'm a lift my head to a new day Plant my feet on the ground Look at life in a new way and what's going down   Because today's the day, I'm gonna take things slow Try and change my ways, forgive and let all that go Tell the ones I love, what they need to know I'm gonna turn around, settle down   And slow my roll Mixin' loneliness and whiskey Heartache and cocaine Living life like a gypsy, lost and ashamed So I'm a look to the Lord as my witness Rest my hat on a shelf Trade these boots for forgiveness and find myself   And I can't believe 16 has long since past Because I'm tired of running, and never looking back And I won't survive if I live this life this fast, no, no   And today's the day, I'm gonna take things slow Change my ways, forgive and let all that go Tell the ones I love, what they need to know I'm going to turn around, settle down And Slow my roll",0.7096,0,3,2,3,3,8,9,5,0,4
123,123,/songs/342205,Kid Rock,So Hott,https://genius.com/Kid-rock-so-hott-lyrics,http://api.genius.com/songs/342205,Rock n Roll Jesus,2007-10-09," You got a body like the devil and you smell like sex I can tell you're trouble but I'm still obsessed   Because you know you're so hot, I want to get you alone So hot, I want to get you stoned So hot, I don't want to be your friend I want to fuck you like I'm never going to see you again ....Yeah.....Come on....Yeah   You're like the kiss of death, like the hand of fate I can tell you're trouble but I still want a taste     Because you're so hot I want to get you alone I want to get you stoned I don't want to be your friend I want to fuck you like I'm never going to see you again   See you again",0.9146,7,5,3,2,4,6,6,2,2,5
124,124,/songs/26070,Kid Rock,Somebody's Gotta Feel This,https://genius.com/Kid-rock-somebodys-gotta-feel-this-lyrics,http://api.genius.com/songs/26070,Devil Without a Cause,1998-08-18," I used to party with the Betties on the lower east side Never drop top forty cause I always rock b-sides G-rides with a hundred spokes to match We roll two deep...three freaks...four amps in the back I kicked that crack game rap game now I let my axe bang Livin' in sin and it's a beautiful thing I wanna twang like Hank...rock like Run Got soul like Stevie when I'm under the sun and so  Somebody's gotta feel this Someone's got to feel this Somebody's gotta feel this Someone's got to feel this Somebody's gotta feel this Someone's got to feel this   I never had a lot of money, never made much sense Been chasin' bunnies like a dummy overlookin' my rent He spent every rent cent puttin' hickeys on his bed He's rockin' dickie's slippin lickin' honey's steady Lookin' for love I put my talent on hold Told my soul to glow it said get up and go And so I packed my bags with a whole lot of realness  (Somebody's gotta feel this) Someone's got to feel this (Somebody's gotta feel this) Someone's got to feel this (Somebody's gotta feel this) Someone's got to feel this   I see these people makin' money and it's funny to me Tryin' to act that fresh I wish they'd bump into me Cause it ain't nothing to me want to eat a little more Taste a little bit pride from every drink that I pour I've been a whore for years showing love to my peers Never sold for any less than what I see in the mirror Steer wide to avoid the blows I've been dealt Let the six strings ride when the twelves are felt So when you see me tuggin' on the end of my roap You better raise up or duck when I reach in my coat because  (Somebody's gotta feel this) (Somebody's gotta feel this) Someone's got to feel this Someone's got to feel this (Some-some-some body's gotta feel this) Someone's got to feel this (Somebody's gotta feel this) Someone's got to feel this  Feel this",0.9779,4,5,3,3,8,9,15,3,5,6
125,125,/songs/26116,Kid Rock,Son of Detroit,https://genius.com/Kid-rock-son-of-detroit-lyrics,http://api.genius.com/songs/26116,Kid Rock,2003-11-11," I like to play Hank Williams Jr. Records Just as loud as they will rock I'm into lynerd sky-nerd Run DMC And that American Pimp Kid Rock I like Willie, Waylon, George and Merle and alot of ZZ Top I like country, soul, rock-n-roll And I love me some hip hop  I'm a redneck redneck rock-n-roll Son of Detroit I don't like no new wave Techno bands around I'm a drink a couple dozen beers Go out and jam some gears I'm a long haired redneck rock-n-roll Son of Detroit   I got bougart and west coast chopper That sure makes them bitches stare Got a dead flamingo wrapped around this cowboy hat I wear I like 2 cuss, yell, scream, fight And raise all kinds of hell And if you ride to live like I live to ride Then let me hear that rebel yell  I like my whiskey straight up daiquiris Make me ill And if someone touches my beaver skins I get mad enough to kill I got a rifle rack in my pick up truck I'm a four wheeling maniac And if you wanna race Just name the place And I'll show you where its at",-0.7588,11,2,5,12,3,15,15,6,3,6
126,126,/songs/3291090,Kid Rock,Stand the Pain,https://genius.com/Kid-rock-stand-the-pain-lyrics,http://api.genius.com/songs/3291090,Sweet Southern Sugar,2017-11-03," And when life it burns you like a candle Don't think it ain't nothing that you can't handle Go ahead,now finish what you started You're not the last one left who's broken hearted, no   When it feels like you just can't stand the pain When it feels like you just can't stand the pain And when it feels there's nothing left that you can do Just bow your head down and plow right through When it feels like you just can't stand the pain   Sometimes life's plans can be postponed And it's hard to step back out into the unknown But should you ever find yourself alone You gotta friend right here if you come back home Come back home   When it feels like you just can't stand the pain When it feels like you just can't stand the pain And when it feels there's nothing left that you can do Just bow your head down and plow right through When it feels like you just can't stand the pain   When it feels like you just can't stand the pain When it feels like you just can't stand the pain And when it feels there's nothing left that you can do Just bow your head down and plow right through When it feels like you just can't stand the pain When it feels like you just can't stand the pain When it feels like you just can't stand the pain",0.9961,1,2,0,13,1,13,3,12,0,2
127,127,/songs/26085,Kid Rock,Step in Stride,https://genius.com/Kid-rock-step-in-stride-lyrics,http://api.genius.com/songs/26085,Grits Sandwiches for Breakfast,1990-12-11," I think you might like to hear something from us  Stand up Put your hands up Come on get up Kid Rock's in the house yo, Ready to pick up The tempo and you know in so I will for somewhat unconventional But comprehensible I'm the presentable the good looking The Mello Yellow young fellow and I'm cooking Heating the house up just like a hot plate Smooth on the groove like an ice skate You didn't think in a blink I'd stand here But now your in fear and stand clear You can't come near this hot styling Groove by the kid who's smooth as a violin Also the perfect lyric announcer On the set with a cold forty ouncer Ready to glide from side to side Why, cause I Step In Stride   These are the criteria I believe should be applied Cause I step in stride These are the criteria I believe should be applied  N-N-Now yes I'm new But before I'm through Your gonna see I paddle my own canoe Cause I'm solo A young pro on the go Close to an angel But I wear no Halo I just shake, create, and never act fake And I learned to dislike and not hate Because hatred leads to an uproar Violence is one thing I am not here for I'm just here flat out and to blow the roof Kick some watts and that's what I intend to do Pump it up like an air comb presser Teach to each like a wise professor No job I strive to reach high Make the girls in the house all sigh And I'll glide from side to side Why, cause I Step in Stride    Applied, Step in Stride you bet I do Get you high like a bottle of German Brew Coming clean New on the scene Making girls scream if you know what I mean Cause they dream of me to rock the place And put a big smile upon their face Any girl of any race But they have to like the b-b-bass And that's the rep I've earned and kept on the set Working up a sweat No Jive Kid Rock uparrivd And I Step in Stride   These are the criteria I believe should be applied I step in stride These are the criteria I believe should be applied Thee[?]Thee[?]Thee[?]Thee These are the criteria Thee[?]Thee[?]Thee[?]Thee These are the criteria I believe should be applied Applied[?]applied[?]applied[?]applied Applied[?]plied[?]plied[?]plied",0.9923,9,12,4,6,11,11,23,3,7,10
128,128,/songs/341576,Kid Rock,Style Of X-Pression,https://genius.com/Kid-rock-style-of-x-pression-lyrics,http://api.genius.com/songs/341576,Grits Sandwiches for Breakfast,1990-12-11," Non-commercial lyrics run like Hershel Walking fast cause I'm a smooth talker Appeal the feel, but don't praise and kneel Just heal And always look for the seal that's real Top Dog, looking up to say what is this Kid Rock serious and I mean business Ascending up and up I keep boosting Making hit records like Whitney Houston With a mind of violence, right, I might Blow the show teachers speaking yo, I cut MP's To release to each and be friends of Every single, individual   Everybody all over the world, it's time for understanding Come together   Jumbo, yo that's how I'm moving I'm the new kid in, here's what I'm giving A jammed, slamming, command that take authority Cause too many MC's appear apart of me Name and they claim me, yo, that they're winning A lotta just came in, sound the same in Thinking they swift and can get with these young men But I keep the crowd swinging like Tarzan Cause I'm a wise man here to teach and speak And if you step out of line your up shits creek So come with it, Kid Rock's gonna get it His style ain't dope, its a throat, and I slit it I'm raw like cowhide, smooth like a plane ride No half stepping, I always take a full stride Who came played and they say I'm concrete made I used to come correct in the projects New Port, Oxford, deep in the basement House and parties like real estate agent So on, so strong, and everyone got along Knowledge is power, and there's a point to this song     Now as I said my prayers through the years I shed a few tears Cause it's unjust when I see my peers get shot And dropped and forgot, now that's hot Too many can't score as victims of a drug war Cocaines ran and weapons are shipped out The press finds out, then the public is tripped out New tax the acts and half the drug industry Uncle Sam is my man, are you kidding me Me in the White house, now that's fucked up For one to get over, one must get stuck up One will roll up, another will smoke up Two more thrown in jail, who picks the toll up Tell her to beware if she's gonna stand there Eyes bugged out and hands in the air Cause there comes an onlooker, looking for a hooker And act like the doors overlooked her and took her For a place to hide and when he got his ride He let the nice slide and the girl, she died Her family cried over this homicide And why they pondered, why she wandered Left her own spot, her home, her mom and pop All to smoke a little cooked up rock So on and so strong, she couldn't get along Knowledge is power, and there's a point to this song     From the outskirts with a mind like Albert Einstein Maybe I'm ahead of my time Imaginate, create, spectate, elevate from the states Surrounded by the Great Lakes I was once out cold at 15 years old Rolled and sold, you, me, and Bo Sitting in Jackson infested with rats With a silver gat tucked deep in my slacks I was a young bad mother in my own eyes But now I realize it wasn't too wise So now I teach, I'll reach to each And every single individual   Everybody all over the world, its time for understanding Come together Come[?]come[?]come[?]come together",0.9804,9,13,5,10,12,19,34,10,8,18
129,129,/songs/26122,Kid Rock,Sugar,https://genius.com/Kid-rock-sugar-lyrics,http://api.genius.com/songs/26122,Rock n Roll Jesus,2007-10-09," Hard to remember if anything is real Cold like December, and I don't like how that feels I been living a long time, I've been giving a long time too And I can't believe I wasted so much time on you But time has brought me back around Back around to me, and I feel so free Yeah!   Now who's going to give me some sugar tonight?! Sugar tonight!! Sugar tonight!!   Bad like Brutis, hit like Joe Louis I got lots of cash but I'm not Jewish I'm not no nudist, I'm fully clothed And I'll fuck hot pussy until its cold Got rhymes of gold, got a voice of plantium I'm not Dwayne Wayne, but that's 'What's Happening' I'm 'Back in Black', and if you have to ass You can kiss my Anglo-Saxon ass!     Hot like a toti, smooth like Mondovi Around the way, they call me Bathroom Bobby Sugar is my hobby and my greatest joy And that's why they call me (""Cowboy!"") No jive, I 'Come Alive' like Frampton I'm bigger than Seinfeld's house in the Hamptons Cramp my style, go head and give it your best But I am not (""met a motherfucker who can do that yet"" -- LL Cool J)     Now who's going to give me some sugar tonight?! Whoo, whoo!! Whoo, whoo!!     They call me Shotgun Bobby, rock the young hotties Jock the John Gottis, sock the paparazzi Real-life Fonzie, I roll like yahtzee I like stars and bars but I ain't no Nazi So fuck you, fuck you in the nose Fuck you and your clothes, fuck you and your hoes Fuck you and your mother if you can't understand it I'm the illest motherfucker on the God damn planet! HUH!!!",0.9835,7,14,5,3,9,10,22,3,2,9
