,api_path,primary_artist,title,url,song_endpoint,album,release_date,lyrics,polarity,anger,anticipation,disgust,fear,joy,negative,positive,sadness,surprise,trust
30,/songs/56981,Macklemore & Ryan Lewis,The End,https://genius.com/Macklemore-and-ryan-lewis-the-end-lyrics,http://api.genius.com/songs/56981,The VS. EP,2009-11-27,"We came in together, but you held me The process walking right through that door, at the entry I can't seem to remember, the lights were so bright And the disco-ball blurred in the turn of that night But it was perfect I was told the tux was starched and all Grabbed the glass of punch nervousness struck, stood by that wall Arms folded, myself I didn't know yet Until you came over, stood by me, you poasted You put your hand out like I was stranded Tried to pull me on that dance floor.I stepped backwards See I wasn't ready yet, but you were my medicine You showed me that trust through that love that you held me with Our backs against the wall as the DJ would spin The soundtrack had changed as he played that mix Our lives flashed in front of us, just a glimpse We were together and experience this  You finally pulled me up I didn't want to But you filled me up, from the bottom of my heart And as we walked through that gymnasium that I'd been watching Feeling like my chest would explode from my heartbeat To the middle of the floor, I almost panicked You put your hand out and I fearfully grabbed it The most beautiful thing that I'd seen on this planet She laughed cause you could tell that I didn't know how to dance yet We started moving And I, didn't know what I was doing You whispered, ""Don't you love music? It's such a gift and I'll give it to you But you gotta use it""  I strayed She brought me back in Trying to sneak a flask outside of that gym She said, ""You don't need that, look within"" She hugged me, looked into my eyes, she gave me a kiss And she said, ""I can't help you, if you don't let me You're here to live just be, don't forget me The end of this dance you don't want to regret me Live, cos tonight you'll all be set free""  ""Last dance!"" the DJ yelled Looked into her eyes and I could see myself Slow motion Frozen, toast to this moment Like there is no morning, like there is no mourning No emotions, you on my shoulder Me lead and you follow As we circle the floor like the globe Through this infinite mass Makes us seem so small With you in my hand like the skyline holds the stars Not letting go But I can't hold on Fading through my fingertips Watching us fall I try to catch you with my arms I would never take it for granted when I had you in my palms To all I ever wanted Please play my song And put the record to the needle Don't ever touch that off switch You are perfect, forget that prom dress My God, seconds away from God yes Somebody turned the heat on in this party Or we’re becoming one because I’m melting into your body One being, heartbeating, universe falling The ground split right between us and that concrete Separated my love I could hear her calling Separated, but I could hear her calling Goodbye forever Never see you again Winterball 2012 ""The End""",0.9985,4,11,3,8,19,17,31,10,9,20
31,/songs/2425971,Macklemore & Ryan Lewis,The Shades,https://genius.com/Macklemore-and-ryan-lewis-the-shades-lyrics,http://api.genius.com/songs/2425971,This Unruly Mess I've Made,2016-02-26," Where the hell did soul go? I am not the logo Been here too long and I'm going home Airplane mode, better hold the phone, better hold the phone I woke up this morning, I looked in the mirror Cold feet on the tile, how the hell am I here? Lost track of the moment, barely remember the year Is this a higher calling or just a career? Oh god, I'm lost, my bad, my fault And ""I'm sorry"" doesn't cover all the pain that I've caused Just wanna love myself, not codependent on applause Just wanna run myself, not codependent on applause   I don't wanna go to work, nah I just wanna play I just wanna stay in bed And watch life through the shades Through the shade I just wanna feel better, feel better And I don't wanna wait, no I just wanna be happy, man Man, I'll open up the shades Open up the shades, open up the shades   I wish that taro cards would tell me my future They say faith is good only if you use it My uncle's kidneys failed when he got out the hospital But he stayed drunkaholic, he just couldn't get off that bottle Couldn't get off that bottle I went to the casino, swore I ain't going back The next day, went to the ATM and bet it on black I spun the roulette wheel and I felt it all start to crash Playing cards with the Devil, we all know the dealer wins that I got too much bad karma, yeah, I shoulda saved up Got kicked off that ladder I was finally getting praise from A chance to see how we react when God decides to break us Once you pick the pieces up, well then it's time to make something I wanna get high, just wanna stay up Chipped my teeth on the curb Fight, fuck and make up Wanna escape my mind, these thoughts need vacations And girl, you look good, but you'd look better in Jamaica   I don't wanna go to work, nah I just wanna play I just wanna stay in bed And watch life through the shades Through the shade I just wanna feel better, feel better And I don't wanna wait, no I just wanna be happy, man Man, I'll open up the shades Open up the shades, open up the shades",0.9822,7,22,6,15,13,16,20,12,8,17
32,/songs/2414880,Macklemore & Ryan Lewis,The Train,https://genius.com/Macklemore-and-ryan-lewis-the-train-lyrics,http://api.genius.com/songs/2414880,This Unruly Mess I've Made,2016-02-26," Pretty face tryna chase the train And I could look the other way but it still won't erase the pain And I pray that she stay the same, amazing grace Yeah, yeah, yeah Just another reflection in the window Watchin' the trees pass by at a tempo Got a round trip ticket out to limbo And I'm getting close to my kinfolk I'm sorry that you didn't get the memo Yeah, yeah, yeah Water under burned bridges Always on the road tryna earn a livin' I remember when I bought my first ticket I've been going, haven't turned back since then This return day must be a misprint Made a wrong turn now I'm long distance And I miss them   Otra ciudad, otra vida, otra, otra ciudad, ah, oh, oh, oh   I try to write but every sentence is a run on I try to text you but I don't get reception in this tunnel Vision, visit only for a minute I'm gettin' on track but the wheels still spinnin' You can see the smoke in the distance, it billows Roll up my sweatshirt, turn it into a pillow, ay I got a polaroid camera so I don't forget where I travel I got a couple rolls of film I'll get developed when I get back to Seattle I told momma that I'd call her, talked for a couple minutes But I didn't I miss my brother, feel disconnected Wanted to stay, wanted to catch the next one I wanted to talk, just me and him Because I had some things I felt I had to tell him When you're always runnin', tryna make a connection It's almost impossible to stay connected When you get on this train after standin' in the rain You'd be crazy to exit And give your seat to the next one, nah I'ma ride this shit 'til the wheels fall off The conductor screams out, ""All aboard, last call"" The city as you pass on, the city as you pass on   Otra ciudad, otra vida, otra, otra ciudad, ah, oh, oh, oh",0.952,5,7,4,6,3,12,14,6,5,7
33,/songs/90834,Macklemore & Ryan Lewis,Thin Line,https://genius.com/Macklemore-and-ryan-lewis-thin-line-lyrics,http://api.genius.com/songs/90834,The Heist,2012-10-09," And on, on and on, and on we go And on, on and on, and on we go We love what we had, but now it’s gone Let’s leave before we eat each other alive Alive   Same city, yeah, we can’t break up Nice mask on, I wore the same one The greatest trick that the devil ever pulled Was convincing women that they looked Better in their makeup I wear war paint, fight to the casket Too tired to apologize on this mattress Emotional detachment – what’s the matter? She’s learning that she never should have dated a rapper I don’t blame her, my mind is gone I’m at dinner, checking phone calls, texts and blogs I don’t hear a word, I know nothing at all Just concerned about the world Memorizing these songs It goes on and on Don’t wanna break you, but I’m leading you on On, on, on, on And now it’s gone   And on, on and on, and on we go And on, on and on, and on we go We love what we had, but now it’s gone Let’s leave before we eat each other alive Alive   You are the love of my life You are the love of my life You were the love of my life This time we know we know It’s over Over   Didn’t believe in love until we fell out Gave the keys back, now I’m on the homie’s couch Always going out, sleeping ‘round with strangers Danger! But you can’t live without her Now you’re paranoid, checking on her cellphone Making sure she ain’t like you alone Haven’t made love with the lights still on It’s like you’re hiding something from me   Let’s fake another toast to the good life Predict the future, clean slate, blue sky Fantasy of me husband and you wife Lyin’, staring into those two eyes And I can’t take it, back to where we came from My pavement, past the emotional earthquake foundation Yeah, let’s keep swimming in the snake pit Get bit, get out then jump back into the suffocation Make up and fuck to save us like we got this Come on, this is just us baby And this is just a fight, this is just love – maybe Is it just you or am I fucking crazy? I swear to God, I wish that I could Photoshop the scars off Cold world and gettin' my heart thawed And I said it all and never get lock jaw Mouth is a sawed off shotgun at any second could pop off How does the truth taste? My job comes with a complimentary toothpaste Lately, I’ve been living up out of my suitcase Building trust in that I’m leaving on Tuesday Bought a one night stand, just a bootleg A duplication of something authentic Heart augmented, and it’s so hard to end it I said peace before but this time I meant it   Can’t get her out of my head This place is a mess Holding onto cobwebs That has us both on the fence She walks that thin line In and out of my bed Each time I love her less Can’t get her out of my head This place is a mess Holding onto cobwebs That has us both on the fence She walks that thin line In and out of my bed Each time I love her less   And on on and on and on we go And on on and on and on we go Love what we had but now it's gone Let's leave before we eat each other alive Alive   You are the love of my life You are the love of my life You were the love of my life This time we know we know It's over",0.999,8,16,6,15,29,27,47,14,10,25
34,/songs/2407880,Macklemore & Ryan Lewis,This Unruly Mess I've Made,https://genius.com/Macklemore-and-ryan-lewis-this-unruly-mess-ive-made-lyrics,http://api.genius.com/songs/2407880,This Unruly Mess I've Made,2016-02-26,"I couldn't escape I'd been escaping the whole time I had to finally look Look at the mess we had made And all that's lacker the glory And tarnished failures Stare at it... and then leave  I was too comfortable Being comfortable is what kills artists There is creativity for validation and there is creativity for survival They're very different places I didn't know what I wanted to say Didn't know how the ink would stick to the page How to let go of the anxiety And the suffocating fear that latched onto my vocal chords I had to figure out how to use my voice again  So we went ghost The Irish goodbye, into the woods in the dead of winter We bought a 1985 Suburban, loaded up our equipment And just left town  People make music for all different reasons It's the fabric that connects us We dance together, we cry together We celebrate our communities We question our politics We laugh, we scream, we imagine, we live What I couldn't find in a hotel room on the road, or even in Seattle I found in the middle of nowhere, no reception Making music not because we had to, but because we got to I had forgotten how to do that Not being afraid of the platform we were standing on Not creating from a place of ""Don't fuck it up"" But creating from a place of ""Fuck it up""  Look at the mess Not just the one that we created But the one that is the very fabric of our country The mess we're all living in Stop being silent Even if it's not perfect or politically correct, you have to speak up You have to listen Dance, cry, question everything Laugh, scream, imagine, live  Music was never intended to be programmed to, manufactured and turned into a commodity Music was intended to be that one thing that we could rely on to disrupt the norm Start conversations and change the way that we think and we feel  If you aren't scared of what you created, you aren't done yet On February 26th, I want to share with you This Unruly Mess I've Made",-0.9499,6,10,10,13,13,18,22,12,6,8
35,/songs/86538,Macklemore & Ryan Lewis,Thrift Shop,https://genius.com/Macklemore-and-ryan-lewis-thrift-shop-lyrics,http://api.genius.com/songs/86538,The Heist,2012-08-27," ""Hey, Macklemore, can we go thrift shopping?"" What what, what, what What what, what, what What what, what, what What what, what, what What what, what, what Bada, bada, bada doo da What what, what, what Bada, bada, bada doo da What what, what, what Bada, bada, bada doo da Bada, bada, bada doo da Bada, bada, bada doo da Bada, bada, bada doo da Bada, bada, bada doo da   I'm gonna pop some tags Only got 20 dollars in my pocket I'm, I'm, I'm huntin' Lookin' for a come up This is fucking awesome   Now, walk into the club like, ""What up, I got a big cock!"" Nah, I’m just pumped, I bought some shit from a thrift shop Ice on the fringe is so damn frosty The people like, ""Damn, that’s a cold ass honkey!"" Rollin' in hella deep, headed to the mezzanine Dressed in all pink; except my gator shoes, those are green Draped in a leopard mink, girl standin' next to me Probably should've washed this, smells like R. Kelly sheets (Pissssss...) But shit, it was 99 cents! Fuck it, coppin' it, washin' it 'Bout to go and get some compliments Passin' up on those moccasins Someone else has been walkin' in Bummy and grungy, fuck it, man I am stunting and flossin' and saving my money And I'm hella happy; that’s a bargain, bitch! I'ma take your grandpa's style, I'ma take your grandpa's style No, for real, ask your grandpa Can I have his hand-me-downs? (Thank you!) Velour jumpsuit and some house slippers Dookie brown leather jacket that I found diggin' They had a broken keyboard, I bought a broken keyboard I bought a skeet blanket, then I bought a knee board Hello, hello, my ace man, my mellow John Wayne ain't got nothing on my fringe game, hell no I could take some Pro Wings, make 'em cool, sell those The sneaker heads would be like, ""Ah, he got the Velcros.""   I'm gonna pop some tags Only got 20 dollars in my pocket I'm, I'm, I'm huntin' Lookin' for a come up This is fucking awesome I'm gonna pop some tags Only got 20 dollars in my pocket I'm, I'm, I'm huntin' Lookin' for a come up This is fucking awesome   What you know about rockin' a wolf on your noggin? What you knowin' about wearin' a fur fox skin? I'm diggin', I'm diggin' I'm searchin' right through that luggage One man's trash, that's another man's come up Thank your granddad for donatin' that plaid button- up shirt 'cause right now, I'm up in hurr stuntin' I'm at the Goodwill, you can find me in the bins I'm not, I'm not stuck on searchin' in that section (Mens) Your grammy, your auntie, your mama, your mammy I'll take those flannel zebra jammies Second hand and I'll rock that, motherfucker The built-in onesie with the socks on the motherfucker I hit the party and they stop in that motherfucker They be like, ""Oh, that Gucci? That's hella tight"" I'm like, ""Yo, that's 50 dollars for a t-shirt."" Limited edition, let's do some simple addition 50 dollars for a t-shirt, that's just some ignorant bitch shit I call that getting-swindled-and-pimped shit I call that getting tricked by business That shirt's hella dough And having the same one as six other people in this club is a hella don't Peep game, come take a look through my telescope Tryna get girls from a brand? Man, you hella won't! Man, you hella won't!   Goodwill, poppin' tags, yeah!   I'm gonna pop some tags Only got 20 dollars in my pocket I'm, I'm, I'm huntin' Lookin' for a come up This is fucking awesome   I'll wear your granddad's clothes I look incredible I'm in this big-ass coat From that thrift shop down the road I'll wear your granddad's clothes (damn right) I look incredible (now come on, man) I’m in this big-ass coat (big-ass coat) From that thrift shop down the road (let's go, come on!)   I'm gonna pop some tags Only got 20 dollars in my pocket I'm, I'm, I'm huntin' Lookin' for a come up This is fucking awesome   ""Is that your grandma's coat?""",-0.9821,17,6,18,5,6,27,18,7,8,16
36,/songs/70903,Macklemore & Ryan Lewis,Victory Lap,https://genius.com/Macklemore-and-ryan-lewis-victory-lap-lyrics,http://api.genius.com/songs/70903,The Heist,2012-10-09," Now they say, ""Don't forget where you come from Don't die holding on to your words Cause you know, that you got a whole world to change But understand who you gotta change first""   And I was like ""Fuck that"", humility bust back I remember the days with nothing but a bus pass I was just a little shorty, just hopin' that I could find a bum To buy a 40 for me and have enough for a bud sack Yeah, and I dance on that instrumental Unorthodox like Basquiat with the pencil Give me a microphone and a beat box I could vent to Music the only medium that I could find myself through Recluse, sippin' on some lean I would let loose Lookin' in the mirror, watchin' myself lose Cleaned up in oh-eight, got a job makin' barely minimum wage To get into that page Hit the road with R.L., performing in front of eight people And that shit will check your ego About around that time I'm watching that EP go From nothing to getting us booked around the country I know no limits, life can change in an instant Eight people turn into sold out shows in a minute Now watching my pops in the back row grinnin' With his glass up to my mom, toastin' his Guinness   And we on, we on Good music, it lies in the ambiance One day we'll leave here But these words live on Till then, we keep on making the songs   So put 'em up, up up, up up, so high So put 'em up, up up, up up, so high So put 'em up, up up, up up, so high Put 'em up, up up, up up, so high So put 'em up, up up, up up, so high So put 'em up, up up, up up, so high   I remember that Freshman edition Last year thinking to myself like Yeah, nah, I won't win it yet, I probably won't get it, but I'ma give it everything, play my position The next 11 months I gave it all, everything I had in me Left blood, sweat, tears in every god damn city No label, no deal, no publicist, indie Just music that connected and fans that rode with me Throw me a gold mine, and a co-sign While you're riding a couple dope rides Two women, both dimes Not gonna lie, that shit sounds so nice But I got creative control, and my soul's mine I wouldn't trade it, maybe I'm crazy I put on for my city, Seattle, that raised me Rule four-thousand-and-eighty, it's really not changing Now a days make good music, the people are your label   So put 'em up, up up, up up, so high So put 'em up, up up, up up, so high So put 'em up, up up, up up, so high Put 'em up, up up, up up, so high So put 'em up, up up, up up, so high So put 'em up, up up, up up, so high   Oh my God Feels like a victory lap Can I have that moment Can I talk my shit   Now they say, ""Don't forget where you come from Don't die holding on to your words Cause you know, that you got a whole world to change But understand who you gotta change first""   Put 'em, up, up, up up Up, up, up up Put 'em, up, up, up up Macklemore, Ryan Lewis Put 'em up, up, up up Up, up, up up Put 'em, up, up, up up (so high)",-0.7611,11,8,8,13,11,19,24,12,6,20
37,/songs/51963,Macklemore & Ryan Lewis,Vipassana,https://genius.com/Macklemore-and-ryan-lewis-vipassana-lyrics,http://api.genius.com/songs/51963,The VS. EP,2009-11-27," ""Vipassana is a science of mind and matter: how the mind is influencing the body and later how the body is influencing the mind.""   Yesterday? Forget it Tomorrow is? Nada The present is right here, through the breath, watch it Atheist Jesus piece, hangin' on a cross We sit and discuss God on lawn chairs About how we got here What it is, what it isn't, shit Fate versus faith, scrimmaging with coincidence Leave out the marketing, hold up on the business end Focus on the genuine, and everything else, you can shed the skin I was a couple moves away from being dead In that ER overdosing, eyes bleeding red I fell in love, made an album, got a buzz Lost it all, sobered up, and guess what? Now we meet again And now I'm back, finally just laughin' Expectations are resentments waiting to happen Studying the dharma, karma, vipassana practice Bahá'u'lláh, Buddha, God, to the mountaintop and I'm traveling Learning, yes, reflecting on what matters People, impermanence, lack of attachments It's space and time, a couple of man-made distractions The measure of a spirit that no human can ever capture Church, this booth is my Vatican I don't control life, but I can control how I react to it Student of the breath, brick beats and balancin' Desire versus truth until I finally find happiness   Passing through space and time Passing through space and time, oh Passing through space and time Space and time Space and time   I was put here to do something before I'm lying in that casket I'd be lying on the beat if I said I didn't know what that is The world's a stage and we play a character, I found him It took me twenty-something years and a bunch of shitty soundchecks I'm not gonna be content, until I find gratitude Regardless of my sales or the record deals they're handing you If the next generation takes our legacy and samples you We'll have a bunch of mp3s and misled kids to pass 'em to I use my veins to create the color I paint from Delve into self 'til my heart becomes my paint brush I told my mama I'm not stoppin' 'til my name's up Thinking those comments on that blog is gonna save us Searchin' for everything but God to validate you Get insecure and then we start blaming the haters Used to look to women to fill a part of me that was vacant Truth, the only thing that I ever used in moderation So I stare into this paper instead of sitting at a cubicle Take all the ugly shit inside and try to make it beautiful Use the cement from rock bottom and make it musical So the people can relate to where I've been Where I'm going, what I've seen, what I've heard From the guts, fuck the glory Just a person on a porch putting it all into recording Many in my past and many that came before me I just keep walkin' my path and blessed to share my story   Passing through space and time Passing through space and time, oh Passing through space and time Space and time Space and time",0.9709,11,32,10,10,21,22,34,10,8,22
