,api_path,primary_artist,title,url,song_endpoint,album,release_date,lyrics,polarity,anger,anticipation,disgust,fear,joy,negative,positive,sadness,surprise,trust
15,/songs/91231,Macklemore & Ryan Lewis,Jimmy Iovine,https://genius.com/Macklemore-and-ryan-lewis-jimmy-iovine-lyrics,http://api.genius.com/songs/91231,The Heist,2012-10-09," I put my life on the line I roll them dice and I'm fine Cause all I ever dreamt about was makin' it They ain't giving it, I'm taking it I’m taking it, taking it, they ain’t giving it I’m taking it, taking it, they ain’t giving it I’m taking it, taking it, they ain’t giving it I’m taking it, taking it, I need all that shit   If I just went in and stole it, the police would have noticed Gotta be strategic, creep it, go in, leave without motive Hold up, my plan is forming, alright, casing this building Watch these rappers that rappin' walk in and leave out with millions (millions) Headed in sweating, open that front door ""Interscope"" printed out right by the entrance Door closes, not a metaphor Then I start towards that front desk, right where you check in Dressed in a uniform, acting like a janitor All blue, jumpsuit, rush in Bloodthirsty for the money like a bull Looking in the eyes of the matador (""Fuck you!"") Carrying two cans of paint, security looks at me awkward I say third floor I'm late, paintin' Jimmy Iovine's office Holding my breath 'bout to faint I’m scared to death that he stops me Heart beating so loud that you can hear the echo in that lobby And see I'm breaking down if I don’t make it out Then I'm leaving town with that contract And I'm spazzing out, grabbing the A&R out His chair and I'm taking him hostage I don't give a fuck, step into the elevator, press ""3"" Now I'm headed up (""Heist!"") What they don't know is there is a gun in the paint can And I’m ready and willing to bust 'em, I'm fucking desperate Stuck in this recession, now what you think If I could get signed my life is destined My future depends on ink And secretary at the front of the entrance staring right at me I walk up she whispers ""Go ahead"", and then gives me a wink   I put my life on the line I roll them dice and I'm fine Cause all I ever dreamt about was makin' it They ain't giving it, I'm taking it I'm taking it, taking it, they ain't giving it I'm taking it, taking it, they ain't giving it I'm taking it, taking it, they ain't giving it I'm taking it, taking it, I need all that shit   I made it past security, the secretary, the cubicles But it’s weird, it’s like this room I’ve walked into is unusual Thought it would be shiny and beautiful Thought it would be alive and like musical But it feels like someone died, it’s got the vibe of a funeral There’s numbers on a chalkboard CDs boxed in cardboard Artists that flopped, that got dropped and never got to be sophomores Graphic designers are sitting around Waiting for albums that never come out Complainin' that they have nobody in house Wonderin’ what they make art for I start thinking, am I in the right place? Just walk forward, see plaques on the wall Oh yeah, in a second those will be all yours Finally see an office with a mounted sign, heaven-sent Big, block, silver letters, read it out loud, ""President"" (""Heist!"") This was my chance to grab that contract and turn and jet Right then felt a cold hand grab on the back of my neck, he said   ""We’ve been watching you, so glad you could make it Your music, it's so impressive, and this whole brand you created You're one hell of a band, we here think you're destined for greatness And with that right song we all know that you're next to be famous Now I’m sorry, I’ve had a long day, remind me now what your name is? That’s right, 'Macklemore,' of course... today has been crazy Anyway, you ready? We’ll give you a hundred thousand dollars After your album comes out, we’ll need back that money that you borrowed"" ""So it’s really like a loan?"" ""A loan?! Come on, no We're a team, 360 degrees, we will reach your goals! You'll get a third of the merch that you sell out on the road Along with a third of the money you make when you’re out doing your shows Manager gets twenty, booking agent gets ten So shit, after taxes, you and Ryan have 7% to split! That’s not bad, I’ve seen a lot worse No one will give you a better offer than us"" ""Mm-hm,"" I replied, ""I appreciate the offer"" Thought that this is what I wanted Rather be a starving artist Than succeed at getting fucked",0.8181,19,24,11,12,12,27,35,16,12,15
16,/songs/2376000,Macklemore & Ryan Lewis,Kevin,https://genius.com/Macklemore-and-ryan-lewis-kevin-lyrics,http://api.genius.com/songs/2376000,This Unruly Mess I've Made,2015-11-22," OK, OK Yeah We live tonight Check it, now   I seen pain, I felt the losses Attended funerals and seen coffins 21 years old, an angel was lost here Wings clipped by the grip of 80 milligram sniffs of oxycontin Everyday through the nostrils Never went away, never does it stop there Death a line or two away and a couple tall cans Cause you never know when God is gonna call, man Precious, what we all share I said peace at 5:30, the next time that I saw him was in the hands of the pallbearer What if I would've never gone and dropped him off there? Blaming myself, in hysterics, screaming ""It's not fair!"" 21 years old with a book of rhymes he was gonna recite to the globe Only thing to numb the pain besides that shit in his nose He was gonna quit tomorrow, we're all gonna quit tomorrow Just get us through the weekend, and then Monday follows Then it's Wednesday, then it's ""fuck it, I'm already feeling hollow"" Might as well go crack a seal and might as well go chug a bottle Might as well go pop a pill and go and band-aid that problem And escape this world, vacate this world Cause I hate myself No praying's gonna cure this pain   Doctor, please, give me a dose of the American Dream Put down the pen and look in my eyes We're in the waiting room and something ain't right All this is on you, we're over-prescribed   For me and Kev He went up in jail, institutions are dead And with our lives, we play Russian Roulette And try to find a life where we could be content Cause for us, we're just trying to minimize the fear of being alive And now my little brother is in the sky From a pill that a doctor prescribed That a drug-dealing billion dollar industry supplied And the cops never go and profile at night Yeah, the, the, the orange plastic with the white top they sell to you Has us looking for the answers and that instead of you Quick fix, whatever'll do We just gonna neglect the truth Because a doctor with a license played God and said it's cool Played God and said it's cool But me? I don't blame Kev or his mom freebasing while pregnant with him I blame the pharmacy companies And country that spends trillions fighting a war they supplying themselves Politicians and business and jail Public defenders and judges who fail Look at Kevin, look at Kevin Now he's wrapped in plastic First dealer was his mom's medicine cabinet Got anxiety, better go and give him a Xanax Focus, give him Adderall, sleep, give him Ambien 'Til he's walking 'round the city looking like a mannequin Ups and downs, shooting up prescriptions you're handing him So America, is it really worth it? I'm asking you   Doctor, please, give me a dose of the American Dream Put down the pen and look in my eyes We're in the waiting room and something ain't right All this is on you, we're over-prescribed   Doctor, your medicine and your methods Can't cure my disease without killing me You're killing me, you're killing me You're killing me, you're killing me Doctor, your medicine and your methods Can't cure my disease without killing me You're killing me, you're killing me You're killing me, you're killing me",0.9941,24,19,10,33,11,42,35,27,5,26
17,/songs/68268,Macklemore & Ryan Lewis,Kings,https://genius.com/Macklemore-and-ryan-lewis-kings-lyrics,http://api.genius.com/songs/68268,The VS. EP,2009-11-27,"[Intro (Sampled): Win Butler of Arcade Fire] My body is a cage   In the darkest of days Men become kings and still die of old age While the children become gods At last the whole world begins to play  [Verse 1: Pearl Dragon of Champagne Champagne] My body is adorned with thorns King with a crown of thorns I wash my feet and kiss the ground I'm on I wash my feet kiss the ground I'm on, I'm on Jump niggas cos they thought I was a pawn But knowing I'm a king, I'm about to get on This the sirens for the quiet of the storm Ring that alarm, r-r-ring that alarm Yo, her body was adorned, adorned And I adored her, so much that I had to ignore her Her body I explored it, like an explorer Her first name was Dora, her first name was Dora I opened up the door and saw My queen getting raw, getting raw So like me beating, Resevoir Dog Had to hit it raw, no not raw, dog I was a hog, but I don't eat the pork She was a swine, crippling' my time On the cast of my pearl, yo she wasn't my girl This wasn't reality, this wasn't my world Like Jimi or Kurt before King with a crown I shall be adored Even if I have, always been ignored I was not the norm I will not be ignored   In the darkest of days Men become kings and still die of old age While the children become gods At last the whole world begins to play  [Verse 2: Sir Thomas Gray of Champagne Champagne] Young world, this the story of the kings A nigga couldn't decide should I rap or should I sing And since God blessed me with my wings I'm like a lil' nappy-head Bill Russell with the rings, feel me? Lately globetrotting through a lotta traps Friends become rats, I'm talkin Judas in expensive slacks Fuck 'em, to tell the truth now, I'm over that Sucker'll be suckers, it don't matter that you roll with pack I steady grab my nuts and you can roll with that Pardon my back, and the weight on my shoulders, black History's on my side, these niggas hard in they cars But in the streets they can't look me in the eye Look me in the eye, look me in the eye Champagne Champagne   (Can I get 'em?) Stand like a man, move like a legend Talk but with action, that's how you'll be remembered The greats learned that humility is a weapon Sever ties with the part of you too big to learn a lesson Sit in silence, to fight the mind and try to find the present Cos we only get a couple chances to be epic And I'm connected, like God plugged my headphones Directly into Heaven and told me to go and get 'em with this Mic cord, I am, nothing you can tell me They bark when they talk, but they walk like the legless The purpose of my art is for people to respect me I'm not a king, I'm a servant to the desires that tempt me Only way to escape the cage in a valley of roots Be Emir to the people when they're searching for truth Only way to escape the cage in a valley of roots Claim the mirror, my people, keep searchin for you   In the darkest of days Men become kings and still die of old age While the children become gods At last the whole world begins to play",0.9353,8,21,6,19,19,32,48,13,10,24
18,/songs/2414876,Macklemore & Ryan Lewis,Let's Eat,https://genius.com/Macklemore-and-ryan-lewis-lets-eat-lyrics,http://api.genius.com/songs/2414876,This Unruly Mess I've Made,2016-02-26," I woke up, threw some sweat pants on Then I fed my cat and then I walked to the mini mart And I really want a donut, shouldn't get a donut Bought a donut, fuck it man it's really hard Supposed to be on a diet, I wanna be like Ryan He lost thirty pounds on that paleo But fuck it man I love fried shit I was gonna get skinny for the summer I was gonna start doing my crunches But looking down at my stomach I'ma go to the beach, but I'm not taking my shirt off in public My girl shaped like a bottle of Coke Me? I'm shaped like a bottle of nope I'd like to order a hot dog, some bon bons A large soda, and some tacos to go   I never knew what a carbohydrate was Turns out that it's all the snacks I love   I wanna be like Hugh Jackman, you know jacked man With a really huge package I wanna be the 2015 Batman And send Ben Affleck packing If you ain't gonna treat Jennifer Garner right You don't deserve to have that You better pass that to the homie Matt Damon He'd eat the booty like Pac Man (Pac Man)   You know I feel good about this place You know I feel good about this steak You know I feel good about this shake You know I feel good about these plates You know I feel good about these crepes You know I feel good about this cake You know I just love how it tastes I'm not gonna wait, I'm not tripping about my weight, no   Happy New Years Everybody got a resolution But the next day, we forget about it, never do 'em I went to the gym and got a membership Five minutes on the treadmill and I never lift That was four years ago I should probably cancel this But they tell me I gotta do it in person, ain't that a bitch? But tomorrow though, I'ma get fit Get me a fuel band and a fit-bit Get me some workout shoes, and a bench press Some Lulu Lemons and a french press I'ma finally focus, do some private yoga Exercise my shoulders, I'ma hide the donuts Realign my posture, no time for sofas I'm finally sober, no lime Coronas But again, that's tomorrow And today, man, I gotta go in cause it's my last day Before I lose that weight, I gotta get one last plate and go big I ate all night, Kool-Aid on ice I woke up and I felt like shit And I said, ""You know what, man, fuck it I should probably start on Monday instead"" Motherfucker let's eat   You know I feel good about this place You know I feel good about this steak You know I feel good about this shake You know I feel good about these plates You know I feel good about these crepes You know I feel good about this cake You know I just love how it tastes I'm not gonna wait, I'm not tripping about my weight, no  [Click here to learn more about the making of ""Let's Eat""]",0.9958,11,29,12,8,24,18,33,10,19,22
19,/songs/52459,Macklemore & Ryan Lewis,Life Is Cinema,https://genius.com/Macklemore-and-ryan-lewis-life-is-cinema-lyrics,http://api.genius.com/songs/52459,The VS. EP,2009-11-27," I don't know why But it's like I can't stay quiet This is my voice I can't let it die inside me See I'll be scared if there wasn't a riot Pushing and pulling, grabbing some hair Puking and fucking up the sidewalk This battle makes it interesting I abide desires Like a dog pissing on the hydrant Just to spite the fire It's not to be taken lightly The page is a set of eyelids The booth is an instrument that God created To record us trying to find him But don't let the word throw you off Religion and spirit are two different plots Just know that it's bigger than me and my ego When I'm flyin Take me higher I've got something to pray for Please leave me when I'm guided Who said that ""Life is cinema""? This is epic, be present I'm right here  Selfish, selfish, selfish me, yeah, me, yeah Girlfriend, break-up, new one, one-night stand, cheat, cheat, repeat that Drug use, clean up, drug use, drug use, clean up, drug use, rehab Fuck you, I suck dude, self-loathing, self-esteem, ego, then me again Put a soundtrack right in the middle A neverending quest to try and get fans There you have the beginning, a middle and a really shitty end Nah, give me a break through, can I get a montage, come on I need that Humble me, give me a conflict, a hardship, let me break through this cement They're gonna be so disappointed when they roll the credits and I realize that my movie sucked and I was the only one that could edit it Well the course, the chain of events, that would be the evidence, some say it's coincidence I say I found something greater than myself and started accepting it And I can see, feel, taste and smell again And I'm the only one with the hammer to break this shell I'm in It's gonna take me crackin' this mirror to finally be myself again Met my potential a long time ago and I'm not stopping til I resemble him  (I got soul but I'm not a soldier...)",-0.9741,13,8,10,7,8,18,20,10,10,14
20,/songs/2414867,Macklemore & Ryan Lewis,Light Tunnels,https://genius.com/Macklemore-and-ryan-lewis-light-tunnels-lyrics,http://api.genius.com/songs/2414867,This Unruly Mess I've Made,2016-02-26," Last night the skies turned purple and Past lives in light tunnels Light tunnels   In the back of a town car, staring at myself in a tux Maneuvering through the people out front Police barricade, orange cones and we're stuck Twenty minutes late and my manager blowing me up Security guard in the garage at the entrance We roll down the window and show him our credentials Terrell flash the pass and he lets us continue Metal detectors, phone losing reception I should be grateful this my nine to five I walk into the green room, alright, alright I get on YouTube tryna learn how to tie on my tie Fuck it, I'll wear the bolo tonight, night, night I probably shouldn't have done the drugs I've done A couple of days ago, detox son I forgot my belt at the hotel Fuck, now my team all scrambling to help, this sucks I need something to cope, ain't nothing to cope I eat  a banana and I drink a cup of Throat Coat I wish I had the homies with me here but nope Most of the artists that I know don't get invited to this show Because success to them determines our value The make-up, the power, hairspray, perfume, makeup and powder The ratings come down to who's popular now in the song in the hour Knock at the door, I let them in, hair and makeup now, red carpet in ten She covers up my freckles, concealer on my chin I look orange but she swears it looks natural with my skin The show is starting, they take me to my seat Walk in the arena, feel the ego of elites Like the whole industry is staring at me A row away from Taylor, two away from Jay and Bey   Last night the skies turned purple and Past lives in light tunnels Light tunnels So that's who we are Just like the stars Shine your light on Shine your light on   Curtain opens up, host walks out We stand in unison and applaud real loud I watch the other people that have been around for a while Just excited I got invited, feeling cool in the crowd Thinking such and such is bold, look at such and such's gold Damn, such and such in real life, looks really fuckin' old Such and such is fine, she's with such and such, oh I'm here but I'm barely even watching the show Cause tonight we toast to our accomplishments Insecurity dressed up as confidence I said tonight we toast to our accomplishments Insecurity dressed up as confidence An award is given out, commercial, reset the scene They keep saying, ""Coming up soon is the Biebs"" Watch celebrities take selfies with celebrities It feels so make believe They want the gossip, they want the drama They want Britney Spears to make out with Madonna They want Kanye to rant and to go on longer, cause that equates to more dollars They want talking topics, they want trending topics They want outfits to be outlandish, they want sideways glances Beef and problems, they want nipple slips Cause they live for clicks, this is economics So we Botox our skin and we smile for the camera Might as well get a new nose while we're at it This is America, insecurity's our fabric And we wear it and we renamed it fashion I look to my right, there's a cameraman snapping Picture after picture after sister after sister Of the line of Kardashians, mind so distracted Realized there's an ovation and everyone's clapping   Last night the skies turned purple and Past lives in light tunnels Light tunnels So that's who we are Just like the stars Shine your light on Shine your light on   It's just weird when the camera's on you Gotta remember to still clap if I lose I see myself up on the screen Split into five different artists on TV And just look normal, don't get turned into a meme Relax, breathe (And the award goes to: Macklemore and Ryan Lewis) Me There's a stranger holding my award I give her an awkward hug she says ""It's yours"" Think I'm supposed to kiss her on the cheek Man, I should have prepared an acceptance speech Do I talk first? Is it Ryan? Is it me? Fuck it, I'll take the lead, grab the mic, say my piece Do I look at camera one? Do I look at camera three? I promise, I'm honored, I'd like to thank God, my momma and father I'd like to thank Tricia, the mother of my daughter I couldn't have done it without you all in my corner Especially the fans, been here since the beginning Supported the music, allowed us to be independent And I know, I shouldn't be long-winded Wait, hold up, don't play the music, let me finish This feels so narcissistic, dressed as a celebration to conceal it's a business Me, me, me, my, my image, my, my songs, my self interest One big reality show that is scripted And I can keep trying or get off the competition I'd rather run out of my fifteen minutes Than have life past me by and I forget to live it But that doesn't mean retirement But I don't like who I am in this environment I forgot what this art's for I didn't get through Freshman year to drop out as a Sophomore Here I am in this arena, yeah, I'm scared I got the people's attention, don't wanna lose it here Thinking about my career, miserable here But wanna make sure I'm invited next year To the same damn party, celebrities and aisles Same blank stares, same fake smiles Same big budget production I know now who I am when the lights go out and it falls down And the curtain closes, nobody notices Wanted to throw up the Roc, wanted to be Hova Wanted to be Wayne with the accent from the 'Nolia Thought I'd feel better when the award show was over But I guess I showed up late Almost got cut off when they closed the gate Just in time, what will I say? Time to explain this unruly mess I've made I guess I showed up late Almost got cut off when they closed the gate Just in time, what will I say? Time to explain this unruly mess I've made",0.9978,18,36,15,22,32,49,71,18,19,52
21,/songs/57368,Macklemore & Ryan Lewis,Make the Money,https://genius.com/Macklemore-and-ryan-lewis-make-the-money-lyrics,http://api.genius.com/songs/57368,The Heist,2012-10-09," Now, this is my job, I will not quit it Pulled me out the depths when I thought that I was finished Yeah I questioned if I could go the distance That's just the work, regardless of who's listening, listening Listen, see I was meant to be a warrior Fight something amongst me, leave here victorious Classroom of kids, or a venue performing If I'd done it for the money I'd have been a fucking lawyer Concrete, vagabond, van telling stories Humbled by the road, I'm realizing I'm not important See life's a beautiful struggle, I record it Hope it helps you maneuvering through yours and That's why we stay in the lab at night I've been staring into this pad for over half my life A true artist won't be satisfied So I guess that's the sacrifice And I say   Make the money, don't let the money make you Change the game, don't let the game change you I'll forever remain faithful All my people stay true, I say Make the money, don't let the money make you Change the game, don't let the game change you I'll forever remain faithful All my people stay true   Forget about the fame, fortune and the mansion Sitting and tripping watching myself on a plasma Yeah, I start slipping when I'm thinking about that stuff Ego once swollen until karma catches that up, that up I'm my grandma's number one grandson I lost myself to remember who that was We start thinking about some kicks, necklace What I really need is a job off CraigsList Take away the dot com, name, love Fans, Twitter followers, and the buzz See, you keep the issues but you take away the drugs And I had to find out who I really was Who I really wasn't So sick of who I was becoming Yeah, tired of running Time to look at the man in the mirror until I can learn to love him   Make the money, don't let the money make you Change the game, don't let the game change you I'll forever remain faithful All my people stay true, I say Make the money, don't let the money make you Change the game, don't let the game change you I'll forever remain faithful All my people stay true   Of course I want dubs and a candy-painted 'lac Watch the videos and get the girls in the back But if that's what I believe in, and the reason that I rap Uncle Sam is my pimp when he puts me on the track Of course I want dubs and a candy-painted 'lac Watch the videos and get the girls in the back But if that's what I believe in, and the reason that I rap Uncle Sam is my pimp when he puts me on the track   Make the money, don't let the money make you Change the game, don't let the game change you I'll forever remain faithful Stay true, stay true, and I said Make the money, don't let the money make you Change the game, don't let the game change you I'll forever remain faithful Stay true, stay true, stay true   Forget about the fame I said forget about the fame I'll forever remain faithful Stay true, stay true, stay true",0.998,19,24,2,19,33,17,66,6,18,50
