,api_path,primary_artist,title,url,song_endpoint,album,release_date,lyrics,polarity,anger,anticipation,disgust,fear,joy,negative,positive,sadness,surprise,trust
8,/songs/63311,Macklemore & Ryan Lewis,Crew Cuts,https://genius.com/Macklemore-and-ryan-lewis-crew-cuts-lyrics,http://api.genius.com/songs/63311,The VS. EP,2009-11-27," If it ain't fresh, then you ain't gettin' play in my tape deck Way back, I used to rock the hat with the suede strap at ABC's Bought my food from the Arabs Played craps on corners where the OG's slang at Cross colors, I'm the boss of the playground Iesha on the nuts, cos I knew how to play house The 8 oz. baby from '84 to grow up Cleaner than my Easter suit was with my shoes buffed Don't step on my new ones These Reeboks beat blocks, you give 'em a few pumps Baby, why your attitude, ""boo boo""? She came from a new school, and all I wanna do is my zoom zoom My uncle stayed faded like crew cuts But I was just too young to know the what's-what and the who's-who 'Round here, they could give a fuck if you got props You get clowned for rockin' British Knights to the sock hop The BK stood for ""black kids,"" the hood was crackin' And ""Poison"" was on everybody's tracklist Spandex was in fashion, back then And bad chicks had tracks in that lasted   Before CDs and Internet the kings was in effect You fiends wasn't gettin' respect Before mp3s and CD-Js, we pop in a tape cassette Chain on my chest, I'm fresh   Let's take it back, b-b-b-back to the days of AC/DC, Back in Black Gimme a mullet, a 1984 Chevrolet Alright, I'm lying, I was listening to rap OshKosh B'Gosh, stone wash, so hard Overalls hung, one strap on, one off Eatin' on my cold lunch, grabbin' on both nuts Mom I want a jheri curl, fuck this bowl cut Ice Cube's got one Quik in my Walkman Blowin' on the cartridge Hypercolor, awesome Kube's in my pocket and I'm outta here I'm bouncing and Sam Goody's not getting shit from my allowance Day dreaming in class, know I'm zoning out and Rosie Perez's titties are right where my mouth is Who says that white men can't jump? They were hella wrong! A'ight, they were right, but I was really good at tetherball Before the days of getting drunk at kegs We were bumping some Jodeci and dry-humpin' legs That's right, I was born in the '80s Pimpin', adventurous, tryin to bone my babysitter House party? Crackin' Humpty dance? Crackin' Never find the baby, David Bowie, Labyrinth Why don't you reminisce and bring it back, rap shit Dodge Caravan, humpin' in the back, classic   Before CDs and Internet the kings was in effect You fiends wasn't gettin' respect Before mp3s and CD-Js, we pop in a tape cassette Chain on my chest, I'm fresh",-0.9696,10,9,9,7,13,20,23,5,6,14
9,/songs/2429093,Macklemore & Ryan Lewis,Dance Off,https://genius.com/Macklemore-and-ryan-lewis-dance-off-lyrics,http://api.genius.com/songs/2429093,This Unruly Mess I've Made,2016-02-26," I challenge you to a dance off Hands off, no trash talk, no back walk On the black top, just me, you, that's all No cat calls, no tag teams, no mascots Right now, dance off Get on the floor Get on the, get on the floor, go Get on the floor, do it Come on and get on the floor, go   I grab my ankle and pull it up And do that thing where I move my butt I got the juice, motherfucker don't use it up I say woo there it is, then loosen my tux Then I shimmy, shimmy, shimmy, shimmy, shimmy, to the left Shimmy, shimmy, shimmy, shimmy, shimmy, to the right Gimme, gimme, gimme, everything that you got Dance off motherfucker, do the damn thing right   She got loose elbows and a big ol' neck I like a big boned girl who could work up a sweat I rock shelltoes and a turtleneck She just wanna talk, I said, ""I ain't TED"" Dance off   Your grandma, that's a bad mama jama She doing the banana, grabbing my trunk like a hammock Mmm, she like the funk, god dammit, she can handle it She tugging my dick, I'm feeling a little bit inadequate (Dance off) Your grandpa got a cock like a ham hock Hella old, hella long, looking like Matlock Damn dog, I don't even wanna have a standoff He drunk talkin' 'bout he 'bout to take his pants off (Dance off) The hater with the macarena I can Roger Rabbit in my office space If you watch my pace looks like I'm concentrated Or constipated when I walk this way   I challenge you to a dance off Hands off, no trash talk, no back walk On the black top, just me, you, that's all No cat calls, no tag teams, no mascots Right now, dance off (dance off) Get on the floor Get on the, get on the floor, go Get on the floor, do it Come on and get on the floor, go   Rewind Go, go, go, go Go, go, go, go (Dance off) Go, go, go, go Go, go, go, go   I sneak up behind you like a panther Who ordered the private dancer? Can I get an amen from the pastor? Pulled the ol' ""Do you want a back rub?"" You must hurt like Grey Poupon Swag on tap like Savion Jump on the tablecloth, fake a fall Pretend to break my arm then I'm breaking you off But please don't tell my baby’s mama I wanna dance all night 'til the break of dawn I wanna sweat, sweat, sweat, sweat 'til your make-up's gone Baby girl, you looking like a champion   Hey you, you there, get up out of your chair Paid twenty bucks to get up in this club, put your cellphone down, you square I be going in, I can't help it, I got bruises on my pelvis Ladies, fellas, don't drunk dial your ex's Hello bouncer, I have a job for you While I'm dancing, watch my shoes Tonight is the night that we rendezvous Sweat the fountain of youth, bust a move Fringe jacket, pants of leather Tanktop, spandex and pleather Been a stressful week, I got a lot of pressure You have a lot of great moves but mine are better   I challenge you to a dance off Hands off, no trash talk, no back walk On the black top, just me, you, that's all No cat calls, no tag teams, no mascots Right now, dance off (dance off) Get down the floor Get down the, get down the floor, go Get down the floor, do it Come on and get down the floor, go   Rewind Go, go, go, go Go, go, go, go (Dance off) Go, go, go, go Go, go, go, go   Oh Lord, I can't sit down Better hold my phone, I'm going for the crown, good God But I'm confident this is my town Better hope my feet don't fail me now, good God   I challenge you to a dance off Go, go, go, go Go, go, go, go (Dance off) Go, go, go, go Go, go, go, go Rewind Get on the floor Get on the, get on the floor, go (Dance off) Get on the floor, do it Come on and get on the floor, go Rewind",0.8359,16,17,8,22,34,30,51,12,10,42
10,/songs/2291611,Macklemore & Ryan Lewis,Downtown,https://genius.com/Macklemore-and-ryan-lewis-downtown-lyrics,http://api.genius.com/songs/2291611,This Unruly Mess I've Made,2015-08-27," I went to the moped store, said ""Fuck it"" And salesman's like ""What up, what's your budget?"" And I'm like ""Honestly, I don't know nothing about mopeds"" He said ""I got the one for you, follow me"" Ooh, it's too real Chromed out mirror, I don't need a windshield Banana seat, a canopy on two wheels Eight hundred cash, that's a hell of a deal I'm headed...  [Verse 2: Grandmaster Caz, Kool Moe Dee & Melle Mel] Downtown, cruising through the alley Tip-toeing in the street like ballet Pulled up, moped to the valet White walls on the wheels like mayonnaise Dope, my crew is ill, and all we need is two good wheels Got gas in the tank, cash in the bank And a bad little mama with her ass in my face I'ma lick that, stick that, break her off, Kit-Kat Snuck her in backstage, you don't need a wristband Dope   Killing the game, 'bout to catch a body Passed the Harley, Dukie on the Ducati Timbaland, Khaled, Scott Storch, Birdman Goddamn, man, everybody got Bugattis But I'ma keep it hella 1987 Head into the dealership and drop a stack and cop a Kawasaki I'm stunting on everybody, hella raw, pass the Wasabi I'm so low that my scrotum's almost dragging up on the concrete My seat is leather, alright, I'm lying, it's pleather But girl, we could still ride together, oh You don't need an Uber, you don't need a cab Fuck a bus pass, you got a moped, man She got 1988 Mariah Carey hair Very rare, mom jeans on her derriere Throwing up the West Side as we tear in the air Stop by Pike Place, throwing fish to a player   Downtown, downtown (Downtown) Downtown, downtown (Downtown) She has her arms around your waist With a balance that will keep her safe (Downtown) Have you ever felt the warm embrace (Downtown) Of a leather seat between your legs Hey, hey-oh-ey-ey Hey, hey-oh-ey-ey Hey, hey-oh-ey-ey Hey, hey-oh-ey-ey   Downtown You don't want no beef, boy Know I run the streets, boy Better follow me towards Downtown What you see is what you get, girl Don't ever forget, girl Ain't seen nothing yet until you're Downtown  [Verse 4: Grandmaster Caz, Kool Moe Dee & Melle Mel] Dope Cut the bullshit, get off my mullet Stone washed, so raw, moped like a bullet, oh, yee-ow You can't catch me, a po-po can't reprimand me I'm in a B-Boy stance, I'm not dancing I got your girl on the back going tandem Cause I'm too damn quick, I'm too damn slick Whole downtown yelling out ""Who that is?""   It's me, the M, the A-C, the K Sounding like a French pimp from back in the day I take her to Pend Oreille and I water skate I mean, water ski, ollie, ollie, oxen free I'm perusing down Fourth and they watching me I do a headstand, the eagle lands on my seat Well hello, but baby, the kickstand ain't free Now do you or do you not wanna ride with me? I got one girl, I got two wheels She a big girl, but ain't a big deal I like a big girl, I like 'em sassy Going down the backstreet listening to Blackstreet Running around the whole town Neighbors yelling at me like, ""You need to slow down"" ""Going thirty-eight, Dan, chill the fuck out Mow your damn lawn and sit the hell down"" If I only had one helmet, I would give it to you, give it to you Cruising down Broadway, girl, what a wonderful view, wonderful view There's layers to this shit, player, tiramisu, tiramisu Let my coat-tail drag but I ain't tearing my suit, tearing my suit   Downtown, downtown (Downtown) Downtown, downtown She has her arms around your waist With a balance that will keep her safe Have you ever felt the warm embrace Of a leather seat between your legs   Downtown You don't want no beef, boy Know I run the streets, boy Better follow me towards Downtown What you see is what you get, girl Don't ever forget, girl Ain't seen nothing yet until you're Downtown   You don't want no beef, boy Know I run the streets, boy Better follow me towards Downtown What you see is what you get, girl Don't ever forget, girl Ain't seen nothing yet until you're Downtown",0.9505,15,10,17,9,13,27,33,5,10,31
11,/songs/2342795,Macklemore & Ryan Lewis,Downtown (Clean),https://genius.com/Macklemore-and-ryan-lewis-downtown-clean-lyrics,http://api.genius.com/songs/2342795,This Unruly Mess I've Made,2015-08-27," I went to the moped store with shoppers Salesman's like, ""What up, what's your budget?"" And I'm like, ""Honestly, I don't know nothing about mopeds."" He said, ""I got the one for you, follow me."" Ooh, it's too real Chromed out mirror, I don't need a windshield Banana seat, a canopy on two wheels Eight hundred cash, that's a hell of a deal  [Interlude 1: Grandmaster Caz, Kool Moe Dee & Melle Mel] I'm headed Downtown, cruising through the alley Tip-toeing in the street like ballet Pulled up, moped to the valet Whitewalls on the wheels like mayonnaise Dope, my crew is ill, and all we need is two good wheels Got gas in the tank, cash in the bank And a bad little mama with her *** in my face I'mma lick that, stick that, break her off, Kit-Kat Snuck her in backstage, you don't need a wristband Dope   Killing the game, 'bout to catch a body Passed the Harley, Dukie on the Ducati Timbaland, Khaled, Scott Storch, Birdman Goddamn, man, everybody got Bugattis But I'mma keep it hella 1987 Head into the dealership and drop a stack and cop a Kawasaki I'm stunting on everybody, hella raw, pass the Wasabi I'm so low that my scrotum's almost dragging up on the concrete My seat is leather, alright, I'm lying, it's pleather But girl, we could still ride together You don't need an Uber, you don't need a cab Forget a bus pass, you got a moped man She got 1988 Mariah Carey hair Very rare, mom jeans on her derrière Throwing up the West Side as we tear in the air Stop by Pike Place, throwing fish to a player   Downtown, downtown (Downtown) Downtown, downtown (Downtown) She has her arms around your waist With a balance that will keep her safe (Downtown) Have you ever felt the warm embrace (Downtown) Of the leather seat between your legs? (Hey-ey-ey-ey, hey-ey-ey-ey) (Hey-ey-ey-ey, hey-ey-ey-ey) Downtown You don't want no beef, boy Know I run the streets, boy Better follow me towards Downtown What you see is what you get, girl Don't ever forget, girl Ain't seen nothing yet until you're Downtown  [Interlude 2: Grandmaster Caz, Kool Moe Dee & Melle Mel] Dope Cut the bull Get off my mullet Stone washed, so raw Moped like a bullet You can't catch me A po-po can't reprimand me I'm in a B-Boy stance, I'm not dancing I got your girl on the back going tandem Cause I'm too damn quick, I'm too damn slick Whole downtown yelling out, ""Who that is?""   It's me, the M, the A-C, the K Sounding like a French pimp from back in the day I take her to Pend Oreille and I water skate I mean, water ski, ollie ollie oxen free I'm perusing down fourth and they watching me I do a headstand, the eagle lands on my seat Well hello, but baby, the kickstand ain't free Now do you or do you not wanna ride with me I got one girl, I got two wheels She a big girl, that ain't a big deal I like a big girl, I like 'em sassy Going down the backstreet listening to Blackstreet Running around the whole town Neighbors yelling at me like, ""You need to slow down!"" ""Going thirty-eight, Dan, chill yourself out! Mow your damn lawn and sit the hell down!"" If I only had one helmet I would give it to you, give it to you Cruising down Broadway, girl, what a wonderful view, wonderful view There's layers to this ish player, tiramisu, tiramisu Let my coat-tail drag but I ain't tearing my suit, tearing my suit   Downtown, downtown (Downtown) Downtown, downtown She has her arms around your waist With a balance that will keep her safe (Downtown) Have you ever felt the warm embrace (Downtown) Of the leather seat between your legs? Downtown You don't want no beef, boy Know I run the streets, boy Better follow me towards Downtown What you see is what you get, girl Don't ever forget, girl Ain't seen nothing yet until you're Downtown   You don't want no beef, boy Know I run the streets, boy Better follow me towards Downtown What you see is what you get, girl Don't ever forget, girl Ain't seen nothing yet until you're Downtown",0.9933,14,9,16,9,12,27,34,5,10,30
12,/songs/91232,Macklemore & Ryan Lewis,Gold,https://genius.com/Macklemore-and-ryan-lewis-gold-lyrics,http://api.genius.com/songs/91232,The Heist,2012-10-09," Everything is gold, everything is equal Posted on the porch just chillin', me and my people Eyelids closed, gold sun shines on The world’s coated in the gold Krylon, yay And these days, days days, they never run away Gold tints, shades, that block out that golden haze Take all the gold from the pawnshop that lives behind the case And g-g-give it away When gold erupted from volcanoes in the heavens And every shrine that existed in time melted Tombs open, Dookie Ropes on the pharaohs When everything is gold, who cares about the carats? They say that gold's the skin of the gods You can’t take the band-aid when you’re gone Now I, now I-I-I, I’ll tip over that kiosk in the mall As the sunset falls into tomorrow   Today we're feeling like gold, five hundred thousand sold Slick Rick Gold, rope on, hella cold And we stay fresh, so fresh head to toes Goldschlager faded, 14 carat plated So we’re feeling like gold, five hundred thousand sold Slick Rick Gold, rope on, hella cold Today we’re feeling like gold So fresh head to toes Goldschlager faded, 14 carat plated So we’re feeling like gold   Alright now, we open up That car door, hop out, hope they notice us Throughout society we been locked in that cobra clutch More gold bottles, gold bottles, never sober up Ditch Jesus, In Gold I Trust I solemnly swear to wear my cross and stunt Separate myself by stickin' out just because That’s how you illustrate power and who you’re above But nah, tonight we take it, take it, giving it back Crack open the vault, let everyone mob in the bank Take whatever they want, we party and give thanks I've been rocking gold chains since P was in the tank You only live once, you only live once Watch Rick Ross give his Jesus piece to a bum 'Cause tonight, we ball, we ball, we comin’ up Paintin' the globe gold, two steppin’ on the sun like   Like gold, five hundred thousand sold Slick Rick Gold, rope on, hella cold And we stay fresh, so fresh head to toes Goldschlager faded, 14 carat plated So we’re feeling like gold Oh, oh, oh, oh Today we’re feeling like gold Oh, oh, oh, oh   Gold coins, gold phone, gold car Costs at least 10 racks to get 16 gold bars Gold rush, suck on my gold dust stuntin' Under these gold trunks, that’s 2 golden nugget Flyin' on the gold eagle, flier than the rest of ‘em Past the Space Needle, golden shower on pedestrians ""Excuse me, that’s my bad, that’s my eagle and he shouldn’t have"" My eagle got hair, that motherfucker got a mullet bruh And it’s gold, two girls gold brass Loungin' on the water, feet in the gold sand Sippin' on Orangina, arms around them both pants They’re sippin' Olde English right out of a gold can Two girls, gold spandex so pretty That girl ain’t even gold, she just got golden girl titties I’m kidding, everyone is gold in my city You paint Betty White gold, even Betty White can get it Get it, get it, get it...   Today we're feeling like gold, five hundred thousand sold Slick Rick Gold, rope on, hella cold And we stay fresh, so fresh head to toes Goldschlager faded, 14 carat plated So we’re feeling like gold, five hundred thousand sold Slick Rick Gold, rope on, hella cold And we stay fresh, so fresh head to toes Goldschlager faded, 14 carat plated So we’re feeling like gold Oh, oh, oh, oh So we’re feeling like gold Oh, oh, oh, oh   Oh, oh, oh, oh Oh, oh, oh, oh Oh, oh, oh, oh Oh, oh, oh, oh",0.9964,13,21,12,19,17,35,70,17,14,24
13,/songs/2274403,Macklemore & Ryan Lewis,Growing Up,https://genius.com/Macklemore-and-ryan-lewis-growing-up-lyrics,http://api.genius.com/songs/2274403,This Unruly Mess I've Made,2015-08-05," They say boys don't cry But your dad has shed a lot of tears They say I should be a strong man But baby, I'm still filled with fear Sometimes I don't know who I am Sometimes I question why I'm here I just wanna be a good dad Will I be? I have no idea They say girls shouldn't be tough And moms should raise their kids at home But baby, I know that that isn't true Cause your momma's the toughest person I know I wanna raise you to be like her And watch you show the world how to do it on your own I'm still tryna figure out who I am I don't wanna mess this up or do this wrong I'm gonna be there for your first breath I don't know if I'll be there for your first step I can promise you that I'll try to work less But the tour's routed, and I got this album Put in so many hours, and I just want the outcome To be something that I can look back and I can be proud of Don't wanna be a dad that's living in FaceTime But I got a world to sing to and you at the same time I won't spoil you, you can trust that For your sweet sixteen, you get a bus pass Had your heart broken? Been there, done that I love you and I can't give you enough of that Give back to community that raised you up Read Langston Hughes, I suggest ""A Raisin in the Sun"" Listen to Sam Cooke, a change gon' come You put the work in, don't worry about the praise, my love Don't try to change the world, find something that you love And do it every day Do that for the rest of your life And eventually, the world will change   I'll be patient, one more month You'll wrap your fingers round my thumb Times are changing, I know But who am I if I'm the person you become If I'm still growing up, up, up, up I'm still growing up, up, up, up I'm still growing up   I recommend that you read ""The Alchemist"" Listen to your teachers, but cheat in calculus Tell the truth, regardless of the consequence And every day, give your momma a compliment Take your girl to the prom But don't get too drunk hanging out the limo Slow dance with your woman in your arms Sneak her in after but boy, you better tiptoe Don't wake your mom up Do yoga, learn 'bout karma Find God, but leave the dogma The quickest way to happiness? Learning to be selfless Ask more questions, talk about yourself less Study David Bowie, James Baldwin and 2Pac Watch the sun set with best friends from a rooftop Wear a helmet, don't be stupid Jaywalk, but look before you do it If it snows, go outside, build a jump, get some help Get a sled, thrash the hill with your friends, 'til it melts Go to festivals, camp, fall in love and dance You're only young once, my loved one, this is your chance Take risks, cause life moves so fast You're only young once, my loved one, this is your chance   I'll be patient, one more month You'll wrap your fingers round my thumb Times are changing, I know, but who am I if I'm the person you become If I'm still growing up, up, up, up I'm still growing up, up, up, up   I'll be patient, one more month You'll wrap your fingers round my thumb Times are changing, I know But who am I if I'm the person you become If I'm still growing up, still growing up, still growing up If I'm still growing up, still growing up, still growing up   I'm still growing up I'm still growing up, ooh I'm still growing up I'm still growing up",0.9991,7,23,7,14,26,21,53,9,12,33
14,/songs/87637,Macklemore & Ryan Lewis,Irish Celebration,https://genius.com/Macklemore-and-ryan-lewis-irish-celebration-lyrics,http://api.genius.com/songs/87637,The VS. EP,2009-11-27," I'm an Irishman Leather weathered Irish skin Beard orange as the sunset or the flag In the night sky we fly it in Pride for the life we fight to live History, I write with it Spit it with the dialect And this is a celebration of course The green, white, orange And when they pulled up on that shore First generation born Toast to those that made it on a boat to New York And when the English came the colonizer came They filled up bottles of gasoline, turned 'em into balls of flame And hurled 'em to protect what's ours Don't touch these lucky charms Whole bunch of Irish screaming ""Fuck the London Guard"" I'm kidding not dissin' London, it's bloody raw But go against the Irish and get a bloody jaw Preaching nonviolence but reminds of the scars Unify us, put a pint up everybody sing a song   We put our glass to the sky and lift up And live tonight cause you can't take it with ya So raise a pint for the people that aren't with us And live tonight cause you can't take it with ya   From New England to New Brunswick Galway to Dublin A rebellious nation of freckled face hustlers Heart, blue collared workers and family My heritage, proud to be a Haggerty Now with whiskey in our veins Claiming we're the bravest men I drank Old Crow, but pretended it was Jameson Dad sipped Guinness, I sipped Old English 'Til he sat me down at 16 and said ""boy, this is what a beer is"" I put down the drink, couldn't drink like a gentleman That doesn't mean I can't make a drinking song for the rest of 'em Challenge us in football, yeah we might lose But don't put us next to a bar stool We take the history, script it in song Light the torch then you pass it on That's right I said, lineage through the rhythm we script it from the palm And we give til' Ireland is on Bottoms Up   We put our glass to the sky and lift up And live tonight cause you can't take it with ya So raise a pint for the people that aren't with us And live tonight cause you can't take it with ya   Tonight, we're celebrating life Those are all my Irish goons in the background Put 'em up! Because you know All the way from Ireland To the States From Dublin to Boston Grafton to Seattle My whole Haggerty family This one's for you Let's go And all my people say (hey!) All over the world Even if you're not Irish Put your glasses up Ryan Lewis and all my people say That's Ireland It's beautiful isn't it? Irish celebration And all my people say Versus   We put our glass to the sky and lift up And live tonight cause you can't take it with ya So raise a pint for the people that aren't with us And live tonight cause you can't take it with ya",0.8794,8,8,7,8,13,13,28,7,4,12
