,Unnamed: 0,api_path,primary_artist,title,url,song_endpoint,album,release_date,lyrics,anger,anticipation,disgust,fear,joy,negative,positive,sadness,surprise,trust,polarity
124,124,/songs/35220,Nelly,Problems,https://genius.com/Nelly-problems-lyrics,http://api.genius.com/songs/35220,Brass Knuckles,2008-09-16,"* Wal-Mart online bonus track   Let's go, ay This story we about to tell you, is all true The names may have been changed to protect some of those close to me Uhh, uhh, true story, but if not   They say money is the root of all evil And I'm really startin to see what it do to people Check it (c'mon) mo' money, mo' problems Well e'rybody got problems, but they expect me to solve 'em (hey) And I can barely solve my own Got me lookin at 'em like, ""You supposed to be grown?"" And I done said this shit in four different tones To they face, e-mails mayne and over the phone I done said that shit calm, I done said that shit loud I done pulled 'em to the side, I done tried to sit 'em down But some just don't get it Cause they mind only focused on (hey) shit what I got What they ain't got, and what they can't get Got me lookin at my albums like ""Who wrote this shit?"" Believe me man, I hope this get Just a tad bit better but I doubt that shit (it's like hey!)   I can hear these people say, ""Damn that boy done changed"" But they don't understand the pressures I'm goin through Oh how I wish there was a way, to change places for a day Just so they can see what it's like to walk a mile in my shoes   Yo, listen C'mon, I love Dave Chappelle But I don't know too many turn down 50 mil' See that's talk for real Besides, you know what I had to go through to get this deal? How many brothers I done seen get killed For 50 bucks and a few of them pills? Y'all don't feel me (Man please) Damn right I sing all them songs So I can buy my pops a car and my momma a home So she can sit up on the phone with her best friend Joan Talkin like on and on how her baby done grown ""How my baby make his own through the microphone And how my baby been my baby since my baby was born"" But uhh, I ain't sayin man it's all about the money But let's face it, you can't make a record for free I'll be damned if I watch 'em make a mil' off me And I just sit back and take it, for minimum wage And I done gave 'em e'rything but my D and my A I say hey, that's what the contract say (contract say) They make it seem like you can't get away It's like you owe these niggas three more days Y'all don't feel me (hey!)     Woo! Uh, uh... Shout out to my nigga Polow Woo! A knocker right here O.G Uh, uh, uh, yea",13,11,10,7,16,18,30,5,10,19,0.9325
125,125,/songs/219320,Nelly,Rick James,https://genius.com/Nelly-rick-james-lyrics,http://api.genius.com/songs/219320,M.O.,2013-09-30," I cant wait to spend this money Spend it all on you It dont matter what it is, what it cost, girl See Im on pay per view She's standing on the couches Bottles in the air She's dancing on the tables (dont worry) My account keeps the business running Thats what rich niggas do   Put your number in my phone Im almost gone Too much Patron (Shots shots shots) Here alone Hey what Im on In my zone Everybody get down Yea, Im rich bitch freeze   Like Rick James Fire in the hole Everybody in the zone Baby hold my phone Like what? (oh oh oh oh oh oh) Rick James Fire in the hole Everybody on the floor Too early to go home Like what? (oh oh oh oh oh oh)   I said I cant wait to spend this money (Do you hear me?) Girl what you wanna do? (Nah Listen) I dont drive or park no cars girl See I park avenue Shes standing on the couches Bottles in the air She's dancing on the tables How about I send my pilot for you baby? Thats what rich niggas do    [Verse 3: T.I.] You know we parlaying all day In a mansion in Miami, keep it full LeBron playin Yellow gold, Scott Dweller, solitaire park bay Whenever I say it they mnage it Vegas, stumbling up out of the club High as elegant, now youre looking for love Call your girl if youre lookin for her Nah I aint going for it like a bong Im drinkin pourin In the strip club where the girls aint getting naked Me and five, six girl, body out of this world Pretty pull strings to a lot of these girls Take a hit of it, get high with me girl   Who tryna get sky high? (Me and my girls) Raise your hands if you want it twice Whos feelin right? (Me and my girls) Am I the shit bitch? (Yeah)  ",9,7,3,8,8,11,19,9,5,10,0.9536
126,126,/songs/166,Nelly,Ride wit Me,https://genius.com/Nelly-ride-wit-me-lyrics,http://api.genius.com/songs/166,Country Grammar,2000-06-27," Where they at? Where they at? Where they at? Where they at? Where they at? Where they at? Where they at? Where they at? Come on, now   If you want to go and take a ride with me We 3-wheeling in the fo' with the gold D's Oh, why do I live this way? (Hey, must be the money!) If you want to go and get high with me Smoke a L in the back of the Benz-E Oh, why must I feel this way? (Hey, must be the money!)   In the club on the late night, feeling right Looking, trying to spot something real nice Looking for a little shorty I noticed so that I can take home (I can take home) She can be 18 (18) with an attitude Or 19, kinda snotty, acting real rude But as long as you a thicky-thicky-thick girl you know that it's on (You know that it's on) I peep something Coming towards me on the dance floor, sexy and real slow Saying she was peeping and I dig the last video ""So when Nelly, can we go?"" How could I tell her no? Her measurements was 36-25-34, tell it I like the way you brush your hair And I like those stylish clothes you wear I like the way the light hit the ice and glare And I can see you, boo, from way over there   If you want to go and take a ride with me We 3-wheeling in the fo' with the gold D's Oh, why do I live this way? (Hey, must be the money!) If you want to go and get high with me Smoke a L in the back of the Benz-E Oh, why must I feel this way? (Hey, must be the money!)   Face and body Frontenac, don't know how to act Without no vouchers on her boots she's bringing nothing back You should feel the impact, shop on plastic When the sky's the limit and them haters can't get past that Watch me as I gas that 4 dot 6 Range Watch the candy paint change, every time I switch lanes It feel strange now, making a living off my brain Instead of 'caine now, I got the title from my Momma put the whip in my own name now, damn shit done Changed now, running credit checks with no shame now I feel the fame now (come on), I can't complain now (no more) Shit I'm the mayne now, in and out my own town I'm getting pages out of New Jersey from Courtney B Telling me about a party up in NYC And can I make it? Damn right, I be on the next flight Paying cash; first class - sitting next to Vanna White, c'mon   If you want to go and take a ride with me We 3-wheeling in the fo' with the gold D's Oh, why do I live this way? (Hey, must be the money!) If you want to go and get high with me Smoke a L in the back of the Benz-E Oh, why must I feel this way? (Hey, must be the money!) If you want to go and take a ride with me We 3-wheeling in the fo' with the gold D's Oh, why do I live this way? (Hey, must be the money!) If you want to go and get high with me Smoke a L in the back of the Benz-E Oh, why must I feel this way? (Hey, must be the money!)   Check, check, yo I know something you don't know And I've got something to tell ya You wont believe how many people straight doubted the flow Most said that I was a failure But now the same motherfuckers asking me for dough And I'm yelling: ""I can't help ya"" ""But Nelly can we get tickets to the next show?"" Hell no (what's witchyou?!) you for real?!   Hey yo, now that I'm a fly guy, and I fly high Niggas want to know why, why I fly by But yo, it's all good, Range Rover all wood Do me like you should, fuck me good, suck me good We be them stud niggas, ""wishing you was"" niggas Popping like we drug dealers, sipping Crissy, bubb' macking Honey in the club, me in the Benz Icy grip, telling me to leave with you and your friends So if shorty wanna... knock, we knocking to this And if shorty wanna... rock, we rocking to this And if shorty wanna... pop, we popping the Crist' Shorty wanna see the ice, then I ice the wrist City talk, Nelly listen; Nelly talk, city listen When I fuck fly bitches; when I walk pay attention See the ice and the glist'; niggas staring or they diss Honies looking all ""they wish,"" come on boo, gimme kiss, c'mon   If you want to go and take a ride with me We 3-wheeling in the fo' with the gold D's Oh, why do I live this way? (Hey, must be the money!) If you want to go and get high with me Smoke a L in the back of the Benz-E Oh, why must I feel this way? (Hey, must be the money!) If you want to go and take a ride with me We 3-wheeling in the fo' with the gold D's Oh, why do I live this way? (Hey, must be the money!) If you want to go and get high with me Smoke a L in the back of the Benz-E Oh, why must I feel this way? (Hey, must be the money!) Hey, must be the money! Hey, must be the money! Hey, must be the money! Must be the money! If you want to go and take a ride with me We 3-wheeling in the fo' with the gold D's Oh, why do I live this way? (Hey, must be the money!) If you want to go and get high with me Smoke a L in the back of the Benz-E Oh, why must I feel this way?",29,30,9,10,27,21,51,8,24,37,-0.9807
127,127,/songs/5740,Nelly,River Don't Runn,https://genius.com/Nelly-river-dont-runn-lyrics,http://api.genius.com/songs/5740,None,2018-04-06,"* send corrections to the typist   Yeah! Yeahhhh, yeah! Yeah, right down, right down Light on, heh, right down   + (S. Marley) They say - walk down the river Cause the river don't run (Yeah!) Same thing make you laugh, make you cryyyyyyyyyyyy (That's why what goes around comes around, my son) They say - walk down the river Cause the river don't run (River don't run!) Same thing make you laugh, make you cryyyyyyyyyyyy - c'mon! Plus I got the rocks, them yellow diamonds and that oh-oh-ohh Bling!   C'mon! Yeah, yeah, yeah And I got two twin Cutlasses interior gatored I call 'em Now and Later's cause they candy flavored You see, I drive one now and drive the other one later Shit it's the new Fresh Prince and all I'm missin is Jada (hey) I got a hard drive, all I'm missin is data Please give my number to your sister, I been missin a dater I hate to hate a hater, in fact I hate to hate Hatin is hatin, you should never hate, congratulate Look hurr, my attitude is sensed that you may never know my mind I know just what I'm thinkin if I don't want you inside Yeah, inside my men-tal, I know you meant well I'm out of time and out of training days like Denzel Never the gangsta type, more like a hustler - mayne I fuck them ones up out them Playboy books and Hustler, man +Honeys+ and +Black Tails+ (uhh) The King magazines (yeah) The Maxim or the Eye Candy, Jet Beauty Queens   Yeah, yeah, yeah, yeah, yeah I'mma spit it 'til I really can't spit it no mo' (yeah) Nothin changed, cell phone still 3-1-4 Nah the derrty ain't moved to near East/West coast I'm a ""Midwest Swanger"" cause they love me the most (hey) Some like me humble, others like me to boast Please, my whole life is alphabets and numbers I take a G4, land to that H2 Hummer Leave at 7:45 in L.A. for the summer I got the World Wide sale to check the E-mail Plus 401(k) plan in A.T.L Got eight females, I see 'em all from 8 to 12 The only playa who can ball without his A.C.L. (c'mon!) Who may not be original but still a don-dada (yeah!) I'm gon' take this beat and flip it, I'm gon' make it hotter (yeah!) You go 'head and take your plane and I'm gon' take the chopper I'm tired of niggas frontin like they top gun shottas (hey)   Not come runnin ovah! Jah-Jah shine his light (JAH!) Blessed is the day! Sacred is the night (yeah) Wrong wishers beware (watch it) now that I am here Hey, lordy lordy lordy lordy Lord Lordy lordy lordy lordy Lord   Shoot, they thought a derrty wouldn't make it this far (far) Now I'm supportin my family, they likin who I are (are) Schoolboy a hard worker, they consider him a star I guess that's why they look at us as if we from Mars Singin-a-ling! I deal with bars like a weight trainer (trainer) Hustlin got me bigger like weight gainer (gainer) Always remain a, St. Louis entertainer My women love me later, how could a hater blame her? Shoot, I'm just that dude that kick bars for a livin Get rich and trick, collect cars for a livin Houses on hills, with Great Lakes in the back Bowlin' alleys in basements, bed's bigger than Shaq's Damn, look at the leather in that old school 'Llac They be doo-doo green, I wonder who would do that The original rude dude, considered too cool Probably know me from touchin yo' booty at school Bling!    [S. Marley ad libs to fade]",12,11,16,12,12,29,33,10,8,20,0.8971
128,128,/songs/35283,Nelly,River Don't Runnn,https://genius.com/Nelly-river-dont-runnn-lyrics,http://api.genius.com/songs/35283,Sweat,2004-09-13," Yeah, yeah, yeah, yeah, right down Right down, light on, right down   They say, walk down the river 'Cause the river don't run Same thing makes you laugh, makes you cry That's why what goes around comes around, my son They say, walk down the river 'Cause the river don't run Same thing makes you laugh, makes you cry, come on Plus I got the rocks, them yellow diamonds and that bling   Come on, yeah, yeah, yeah And, I've got two twin Cutlass's interior gatored I call them Now and Later's 'cause they're candy flavoured You see, I drive one now and drive the other one later Shit, it's the new Fresh Prince and all I'm missing is Jada I've got a hard drive, all I'm missing is data Please give my number to your sister, I've been missing a dater I hate to hate a hater, in fact I hate to hate Hating is hating, you should never hate, congratulate Look here, my attitude is sensed that you may never know my mind I know just what I'm thinking if I don't want you inside Yeah, inside my mental, I know you meant well I'm Out Of Time and out of Training Days like Denzel Never the gangster type, more like a hustler, man I fuck them ones up out them Playboy books and Hustler, man Honeys and Black Tails, the King magazines The Maxim or the Eye Candy, Jet Beauty Queens     Yeah, yeah, yeah, yeah, yeah I'm a spit it 'til I really can't spit it no more Nothing's changed, cell phone's still three-one-four No, the Derrty ain't moved to near East, West coast I'm a Midwest swinger 'cause they love me the most Some like me humble, others like me to boast Please, my whole life is alphabets and numbers I take a G4, land to that H2 Hummer Leave at seven-forty-five in LA for the summer I've got the worldwide sale to check the e-mail Plus, four-oh-one K plan in A-T-L Got eight females, I see them all from eight to twelve The only player who can ball without his A.C.L Who may not be original but still a don-dada I'm gon' take this beat and flip it, I'm gon' make it hotter You go ahead and take your plane and I'm gon' take the chopper I'm tired of niggers' fronting like they're top gun shotters' (hey)     Not come running over, Jah-Jah shine his light Blessed is the day, sacred is the night Wrong wishers beware now that I am here Hey, Lordy, Lordy, Lordy, Lordy, Lord Lordy, Lordy, Lordy, Lordy Lord   Shoot, they thought a Derrty wouldn't make it this far Now I'm supporting my family, they liking who I are Schoolboy's a hard worker, they consider him a star I guess that's why they look at us as if we're from Mars Singin-a-ling, I deal with bars like weight trainers Hustling's got me bigger like weight gainers Always remain a Saint Louis entertainer My women love me later, how could a hater blame her Shoot, I'm just that dude that kicks bars for a living Get rich and trick, collect cars for a living Houses on hills, with great lakes in the back Bowling alleys in basements, beds bigger than Shaq's Damn, look at the leather in that old school 'Llac They be doo-doo green, I wonder who would do that The original rude dude, considered too cool Probably know me from touching your booty at school  ",14,11,16,14,14,36,36,15,9,21,0.9099
129,129,/songs/35303,Nelly,Say Now,https://genius.com/Nelly-say-now-lyrics,http://api.genius.com/songs/35303,Nellyville,2002-06-25," Gun shots ringed out over the city And had everybody duckin and runnin checkin for any Kinda shelter cause them peoples man they at it again If you ain't heard or seen it then you better pretend Ain't got no time for stoppin ain't no catchin your wind Ya baby mammas on the porch tellin her daughters ""come in"" Got fathers grabbin sons ""where the hell have you been?"" Boy and y'all just startin young I'm talkin 13 and 10 They started tradin in the streets some type of ghetto battles But they ain't hoopin in the gym they hoopin crates in the alleys Where else can you shoot a jump shot Slang a rock all from the same spot? Got one gang on this half the other gang On the other half of the same block Gunplay on Monday Sundays a fun day Will it stop one day? I can't call it no way When your gettin started everybody wanna help and get you off But turn around first motherfuckers wanna see you fall   Say now (say now) Can you hoes come out to play now? (play now) Say now (say now) Can you hoes come out to play now? (play now) Say now (na na na na) Can you hoes come out to play now? (na na na na na na na na) Say now (na na na na) Can you hoes come out Na wait a minute na wait a minute na wait a minute na   Feel like I'm runnin for the daylight Tryin ta get my mind right And just before I die will somebody reach out and snatch it from me Say now Can you hoes come out to play now?   (Hear me out) Tryin ta put my city on the map and they mad at me The same city some of them live in and they mad at me When I come down to speak derrty why you mad at me? Is it cause the old school freaked out niggas from A to Z? Eight cd's, tv's, I aim to please They mean the same to me like Biggie to C's Like Eazy to E's, 2Pac to overseas And I done seen more Aaliyah fans fall cry to their knees I tell ya, I ain't been livin this life for too long And I can't count how many times someone has asked me what's wrong Why my mother was gone Why my daddy wasn't home And the same shit they told me I found myself tellin my own Now its good-bye bad nights Hello good times There ain't no way Ill let no nigga step in my shine Keep tryin (keep tryin) Theres bound ta be somethin G As long as I'm in STL You in the TIC I'll tell ya    Hear me out now  Say now (echose) (4x)",14,14,9,14,9,27,13,14,5,9,-0.9243
130,130,/songs/1057361,Nelly,Scorpio Season Intro,https://genius.com/Nelly-scorpio-season-intro-lyrics,http://api.genius.com/songs/1057361,None,2018-04-06,"Ladies and gentlemen Scorpio Season has began USA Scorpio Season has began Scorpio Season has began This is the season for the truest to step forward You see me cause Two time, one time for the more ho Let's get it Shout to my little T family Leezy Peace to the gat Ki 1, Murf Durf City Spuff Shout to the whole motherf*ckin WT Cap one time Stay in line Little San Louis, I see you Shout out to the whole JGE Cap one time Retro in the building one time Pop easy, I got love Aye V, I see you It's no reason to explain why I'm the shit Scorpio Season Better act like you know",4,8,1,0,2,2,8,0,4,5,0.9658
131,131,/songs/35222,Nelly,Self-Esteem,https://genius.com/Nelly-self-esteem-lyrics,http://api.genius.com/songs/35222,Brass Knuckles,2008-09-16," You got to believe in yourself Don't let nobody tell you what you can't be You got to believe in yoursel-elf, yeah And everything else'll work out, you'll see Ohh (ohh) ohh, ohh, hoh!   You got to believe in yourself Don't let nobody tell you what you can't be You got to believe in yoursel-elf, yeah And everything else'll work out, you'll see Ohh, ohh, ohh, ohh I think I - naw, I know I can I think I - naw, I know I can I think I - naw, I know I can I know I can, I know I can, ay   Ay, yeah Nobody, uh-uh uh uhh Everybody I think I... Uhh, uhh, uhh, uhh   You see my poppa was a rollin stone And my momma had problems of her own But I still managed to make it out okay ... ohh, ohh Although I'm hailed as a hometown hero Still in my hometown I'm seen as a negro But man, that's okay Uh uh uh uh uh uh It's so many obstacles in life to overcome And as soon as you jump over one here come another come But we got to be strong, and set examples for our sons If the sun don't shine, then the decayin has begun   Uhh, uhh, uhh, uhh They say I'm old enough to go to war But I ain't old enough to play in the NBA no more Now you tell me, what's wrong with that? Ah ah ah, ah-ah ah ah I pledge allegiance all the way to Iraq But ain't nobody pledgin to me when I get back Tell my Uncle Sam he wrong for that Ah ah ah, WOO! You see my self-esteem, I'm never leavin home without it They told me I'd never make it, they told me I ain't doubt it Now tell me whoever make it, now tell me I ain't got it I'm seein No Limits nigga, who sayin I ain't Bout it? WOO!     That's right, you gotta believe it y'all, c'mon I know I can I think I - naw, I know I can I think I - naw, I know I can Know I can, know you can   Rock on Nelly, rock on my brother Keep your head up over the storm, young fella (hoh!) Got a letter from the government, opened and read it Uhh, and told 'em all to forget it C'mon, cause we BELIEVE in the future Uncle Sam sent his man to recruit ya You still can't trust it, cause you came this far End of discussion, when you KNOW who you are     That's right believe, c'mon now Don't let nobody tell you, what you can be C'mon Nelly, tell 'em man That's right, rockin it positivity, that's right I know I can, I know I can I think I, I know I can   You gotta believe it You gotta believe, my brother You keep doin your thing That's right, keep that head up All the way to the future That's right, for the babies baby For the babies",6,5,2,7,9,12,22,5,3,13,0.9122
132,132,/songs/225820,Nelly,Shake Whatever,https://genius.com/Nelly-shake-whatever-lyrics,http://api.genius.com/songs/225820,M.O.,2013-09-30," My license plates be heavy 4-55 in my Chevy Got a stitch in the seat that read Nelly Peanut butter inside and out jelly I push it straight down the block, I made a left at the curb I had my windows cracked cuz I was smoking some herb I saw the Shawty I knew so I started to swerve I pulled right up beside her and I started to serve I said hold up, Shawty get it Boy thats soft like the seat that you be sit in How bout we ride somewhere where I can get it She aint want it at all but she was with it Like a 50 amaro she was ready to follow Like a coke bottle with a walk in the bottle She was sippin muscato with a skinny malato The only thing that I did in here was hit her lock   Shawty it could be real Hell it could be a headshot I got a couple bills Tryna put em in yo stash box Your sexy ass gon get it Got band in hand, come get it That pinch is a herb  its my method Just shake whatever that is behind you   I like em big, I like em small I like em thin, I like em tall I like em round, I like em both But on the real, I like em all   Now I done swoop off your pants, theyre worth were buying the same Now I did most of the layin like only offer it came Ali came with demands, I became the man Then came in the bands, then they came in the Benz Im like oh, Shawty works it Put that ass in the air, dont twerk it Swing around that pole, go and murk it You see a nigga behind, you know Im lurkin I like a girl with a bottom, I like a girl on the top I like a girl when I roll, I like a girl when I rock I like a girl when I sing, I like a girl when I rap Cause when Im doin my thing I want that ass to clap   Shawty it could be real Hell it could be a ass shot I got a couple bills Tryna put em in yo stash box Your sexy ass gon get it Got band in hand, come get it That pinch is a herb  its my method Just shake whatever that is behind you   Ive got what you want but baby This aint love, could drive you crazy If you want it go on and say that Say that, say that  ",8,4,3,6,4,12,12,6,2,8,0.9916
