,Unnamed: 0,api_path,primary_artist,title,url,song_endpoint,album,release_date,lyrics,anger,anticipation,disgust,fear,joy,negative,positive,sadness,surprise,trust,polarity
77,77,/songs/35248,Nelly,King's Highway,https://genius.com/Nelly-kings-highway-lyrics,http://api.genius.com/songs/35248,Da Derrty Versions - The Reinvention,2003-11-25,"Ugh Yeah You should really turn this up Natural Bridge and Kingshighway As loud as possible (that's what I'm talkin about, gon shine my shit up) Natural Bridge and Kingshighway (yeah) Ask em' Where you headed? Natural Bridge and Kingshighway (yeah) Natural Bridge and Kingshighway (St. Louis shake it)   Come on with it It's me and my derrty we just got back home In the blue grey Bentley with the cellular phone Callin' up the 'Tics (you know) it's time to get it jumpin' Smoke comin' out the sunroof to let you know we're comin' Everybody looking if you're jealous turn around 21 inches keep me further from the ground I'm gettin good grip from the Dunlop Tires The F1's bumpin' but I need the volume higher Cause the 808 kick drum Basement Beats hits son Jay-E and Wally got it knocking (you wanna) dirty get some I heard them haters talkin' but what am I to do? I'm the man they love to hate the Bill Clinton of the Lou Picked up some shorties on Skinker towards Wellston Headed for the Castle lot moscato got me croachin Bently kinda crowded the whole car was leanin' back Shandra watchin' TV with two gurlies on their lap (man) Martin Luther King the set is kind of dead Made a left on Kingshighway Natural Bridge is just ahead So fresh and so clean U City representin' The St Lunatics on that Castle lot set   (Tell it) Where you headed? Natural Bridge and Kingshighway (uhh uhh) We gon' make it knock, 'Tics gon' make it fuck Natural Bridge and Kingshighway Come on with it Where you headed? Natural Bridge and Kingshighway Basement Beats gon' make it knock, 'Tics gon' make it rock Natural Bridge and Kingshighway Come on with it   Now rollin' with the 'Tics you know we never bored Show me another clique when more points scored We walk around with criminals a bunch of big gorillas My dirty Murphy Lee he's a teenage lady killer Kyjuan is on my left side dancin' with this freak The way she clap that ass make my knees get weak JD is the white guy people think he's funny Been down long time way before we had the money But now we collectin' dollars from platinum to white gold Swervin' in this Bentley and ain't got no place to go Rollin' past Fairground what's up to the thugs Shorties in their mini's wanna show a nigga love But the dope man got em and they butts just drop Shorties looked depressed cause that thing gon' stop Headed back toward Union bust a Uie what the hell Somebody shoutin' Nelly we're damn near out of L's Baby girl blew me a kiss said ""you're number one"" Then looked over to me and I ain't gon tell you what she done The closer we get the woozier I feel Natural Bridge and Kingshighway somebody take the wheel   Where you headed? Natural Bridge and Kingshighway (St. Louis) Basement beats gon' make it knock, 'Tics gon' make it rock Natural Bridge and Kingshighway (dirty) Come on with it Where you headed? (uhh) Natural Bridge and Kingshighway Basement Beats gon' make it knock, 'Tics gon' make it rock Natural Bridge and Kingshighway Come on with it   Rolling Natural Bridge and we bumped in the store Mobbing with the 'Tics is the only way to go Four shorties by McDonald's was looking for a ride We in the wide body so it's plenty room inside We put two by the trunk, one on the hood One on my lap, don't it feel good Posse's getting deeper, we still looking for freaks Ain't worried about them tripping cuz three got that heat Now them shorties getting hungry and Jackie Frost treating We stopped at Burger King for some royalty eating But Burger King was closed, the girls started to hassle Said ""man, go back the other way I want some White Castle"" Now this is the place where the dubs hang out The new shits is cool but old schools get the clout Posse's so damn big what the fuck you want to do I'm getting dirty looks from those other rapper crews Ali dropped a hundred, I tripped off what he done Now should I pick it up? No, drop another one Some nigga started tripping cuz his girl was in my face I told Big B to chill cuz he ain't worth the case And I ain't with the smacking and beating up on your girl If your Pimp Juice is low, then let her leave your world We took his girl with us (us) I seen him on the bus (bus) He beating on the window and it damn near about to bust (man) I got a tight clique, you got a bunch of dudes Now you're broke cold crying them St. Louis Blues We rolled off with your girl and now you all upset She with that Country Grammer boy and them St. Lunatics (uhh)   (Check it) Where you headed? Natural Bridge and Kingshighway (uhh uhh) Basement beats gon' make it knock, 'Tics gon' make it rock Natural Bridge and Kingshighway Come on with it (Tell me) Where you headed? Natural Bridge and Kingshighway (listen to me) Basement Beats gon' make it knock, 'Tics gon' make it rock Natural Bridge and Kingshighway Come on with it  Ho ho ho ho ho ho ho ho Basement Beats gon' make it knock, 'Tics gon' make it rock Yo if you ain't tens or better 12s or getting leather If you ain't tens or better 12s woods or leather",22,13,18,14,13,36,31,15,5,15,-0.9945
78,78,/songs/35257,Nelly,K.I.S.S.,https://genius.com/Nelly-kiss-lyrics,http://api.genius.com/songs/35257,5.0,2010-11-12," Uh-huh.. uhh, uhh, uhh, listen The way your Apple Bottom pokin out got me on a mission I wanna get you in every kind of position I don't wanna keep my cool baby, I can't keep my distance Girl I salute you, I'll be at attention I'm so into you, I just wanna be your lover On the floor, in the chair, under covers When I'm kissin you I can't think about another (think about another) Girl (think-a, think about another) turn the lights on   You're my pride and joy, you're my baby boy People ask me how I feel, 'bout you They ask me if I love you (baby, I want your love) And if I'm crazy 'bout ya (baby, I want your love) Kissin you is, all that I've been thinkin of Kissin you is, ooooh, ooooh Kissin you is, all that I've been thinkin of Kissin you is, ooooh, ooooh   See I'mma kiss you, wan' go up to your body, shawty you will never Scorpio, girl I was built for pleasure I'll make your body start rainin, I change the weather Let it fall on me, I don't need no umbrella I get it - from the back (from the back) from the front (from the front) On your side lil' mama, now here it come Heyyyy, I just wanna be your loverrrrrr {yeahhhhhhh} Now sing it for me girl {*echoes*}   w/ ad libs   Look, uhh, yo, check it, uhh I'm in a Lex' bubbly talkin to my text buddy Said I forgot about her thinkin 'bout my next money Not only that honey, kissin's what I think of You got the Wi-Fi, what's the code so we can link up Kitchen flo', kitchen table, fuck the whole sink up The best sprinkler, your back open like a pick-up The mess that you're makin we can blame it on the liquor If that's not enough then you can blame it on Murph' baby   w/ ad libs",8,6,4,3,18,12,23,6,2,8,0.9637
79,79,/songs/35215,Nelly,LA,https://genius.com/Nelly-la-lyrics,http://api.genius.com/songs/35215,Brass Knuckles,2008-09-16," + (Nelly) West, Coast! (WOO!) Wh-wh-wh-wh-what what what? (This this right here homie?) Yeah, yeah, yeah (This shit right here? Straight West coastin!) W-W-W-W-West West Coast Coast Coast (uhh!) Yeah (uhh) yes, yes (this Midwest nigga) Neff-U (on this West Coast shit) Go hard, go hard, go hard, go hard (check, uh)   + (Snoop) Switch one, switch one (raise it up) Switch two, switch two (make the back end up) Switch three, switch three (work it side to side) And switch four (make it three-wheel ride) You hurr me?   Yo.. yo, listen Ay, yo, I just touched down at this LAX I'm lookin for these girls on this L.A. X Tryin to find them niggas with that L.A. best Dodgin them niggas with that L.A. stress See I'm a visitor, I'm a L.A. guest I gotta be awurr of how they L.A. dress Cause if it comes down I might get L.A. stretched I ain't tryin to be a trophy on no L.A. desk Some niggas walk up, tossin L.A. sets I guess that's 'sposed to be some type of L.A. test Better watch the girls with the L.A. chest A lot of plastic in them L.A. breasts (haha-haha-ha) See I - hit the Crenshaw where they L.A. stunt Seen a lot of six-fo's and L.A. trucks Seen a lot of girls with them L.A. butts A lot of niggas with them Dickies and Chucks - you feel me?   Yo, yo Aiyyo I spend a lot of time on this L.A. coast Out hurr tryin to do the L.A. most Chauffeur-driven Phantom like a L.A. ghost In the back with a drink, take a L.A. toast I spend a lot of time in Woodland Hills With them models and actresses in them L.A. heels To my lawyer's office for an L.A. deal Cut the check for some L.A. meals So now I'm off to Rodeo just to L.A. shop Still gettin dirty looks from some L.A. cops You'd of thought since Rodney King, nigga, L.A. stopped They burned the L.A.'s Watts (uh-uh) I send a lot of love to my L.A. brothers My Latinos and my negroes in them L.A. colors My blessings goes out to them L.A. mothers Know that Nelly is a L.A. lover, ha ha   Guess who just stepped in the place (the Midwest) It's your O.G. homie, Nate (all day) My homie Snoop and yep, Nelly (L.A.) And we all up in your face (all day) Different questions every day (the Midwest) I got the answer in my waist (all day) Yeah they all got somethin to say (L.A.) From St. Louis to L.A. (all day)     West, Coast West, Coast! West, Coast West, Coast! Ha ha! Ha ha! Yeah, yeah W-W-W-W-West West Coast Coast Coast L.A., L.A., L.A., L.A., L.A., L.A., ha ha! Wh-wh-wh-wh-what what what y'all y'all? Yeah, yeah",4,10,4,5,8,13,26,3,4,8,0.9899
80,80,/songs/352892,Nelly,Let It Go (Lil Mama),https://genius.com/Nelly-let-it-go-lil-mama-lyrics,http://api.genius.com/songs/352892,Brass Knuckles,2008-09-16," (OHH!) Turn it up, turn it up Turn the beat up, uhh (DERRTY E-N-T!) Turn it up some mo', uhh, okay (uhh) You turn it up a little bit? Here we go (WE ALL WE GOT, OHH!)   She blowin cause she seen that car (she 'bout to blow!) She blowin cause you turned that corner (there they go!) She blowin cause she seen that watch (she 'bout to blow!) She blowin cause you flashed in it on her ('bout to blow!) She blowin cause she seen that knot (she 'bout to blow!) She blowin cause she seen your flash (there they go!) So many y'all in one spot (she lose her mind!) She never seen so much cash   So let it go lil' mama, let it go lil' mama Just let it go lil' mama, let it go lil' mama Just let it go lil' mama, let it go lil' mama Just let it go lil' mama, let it goooo (Hey!)   Yo, they call me Mr. Intellectual, I keep a bunch of vegetables Carrots and the broccoli, how the hell can you stop me? (Naughty by Nature), yup I'm (Treacherous) and less than this Would be uncivil-ous, and like some syphilis I'm killin this Beat by Pharrell-y; yeah, yeah, really Chad this is silly; ju-just silly (WHOO!) Got a team in the Carolinas, your highness Keep the finest big booty behind us, behind us Just to remind us that, that we the flyest so Kids at home, yo, please don't try this My hands in my pocket mayne I'm doin the wop Lil' mama on her Snoopy Doggy Dogg, she droppin it hot I got whatever in my garage, pull up and shut down your spot I got how many in my bezel man I shut down your watch Oh yeah I'm rappin, believin, my zing and my trees in And soon I'll be leavin, with yo' chick (ah-ha!)     She call me Mr. extra sexual, Scorpio ma is legible Extraterrestrial, she say I'm harder to swivel I keep a fresh pair of Versace, shine up my Liberace My Dolce and my Gabanna, ma I'm keepin it thorough I keep one hundreds in the bunnies{?}, let me keep it 100 I'm the most underrated, under-appreciated Most sold to dated, fuck you rapper we GOT See I don't drop every year to give you niggas a shot Now I might not get five mics or a double-XL (never) But fuck it, you keep it, I'ma take the 100 mil' (cha-ching!) And the Murcielago with the rim kitted Tahoe The show stopper, when I ride all you hear is ""Bravo"" (bravo!)  And all you hear is, ""There he go"" Ha ha ha - ah, ah, ah You see my paint job's a fool, my paint job be poppin My paint job's so wet my license plates read (what it read?) PUSSY, shut yo' mouth       Listen now I, I She wanna know what my girlfriend know And uh, she wanna see how deep this can go She wanna know how much she can blow She wanna know what my girlfriend know Bong bong - RZA   She 'bout to blow, there they go She 'bout to blow, 'bout to blow She 'bout to blow, there they go ",16,4,5,7,4,16,12,3,4,6,0.5551
81,81,/songs/35217,Nelly,Let's Go,https://genius.com/Nelly-lets-go-lyrics,http://api.genius.com/songs/35217,Brass Knuckles,2008-09-16,"* iTunes bonus track   Yo, check If I was from New York, I'd probably be from Harlem An uptown nigga with a hunger for stardom Players runningback, coach I can't guard 'em If you like me on your team ma, you needs a starter Beg your pardon, kid is actin disrespectful He walks up in the club, Slick Rick with his neck full Goin to start a money war, what is he there for? Stacks little paper, what he do that for? Throw a few thousand out the roof of my Maybach Just a little somethin that I got from Reebok We cop, e'rything you see up in the windows Shoppin sprees keep me hungry ma, it's time to get some {?} Turkey bacon, egg whites all up in my griddle Obscene how the protein keep a nigga lean ... Knahmean? It's obscene how the protein keep a nigga lean   We got a problem in here?! HELL NO! We got a problem in here?! I SAID HELL NO! You niggas wanna set it off?! HELL YEAH! You really wanna set it off?! H-H-HELL YEAH! Then let's go, let's go, let's go, let's go Let's go, let's go, let's go, let's go (hey!) Let's go, let's go, let's go, let's go Let's go, let's goooo (hey!)   I'm just chillin in my Coupe (what?) chillin in my Coupe (what?) I'm chillin in my Coupe with my chick on the side I'm just chillin in my Coupe (what?) I'm chillin in my Coupe (what?) I'm chillin in my Coupe with my chick on the side  I'm like a country-ass Adonis lookin for my goddess Same attractin apparatus around, that can find her Pulled down the shades, clothes on your body She can go behind this lame and let shorty go to work Show a couple thou', bet shorty go berserk Last night she on the pole, then this mornin she in chruch On her knees in both places, man I bet that hurt Get you some extra funds, support ya single moms Heard she slangin ass so you can say she buy sex Plus she got a friend so I hope she bi-sex I park right next to her, yeah that's me Plus the house up on the hill, baby yeah that's me   See I'm a U-City alumni, lookin out my one eye Similar to Popeye, when I'm on that spinach Somebody call up the Guinness Book, it's gotta be record Like when I heard the beat I knew it had to be on my record Know folks need it, I'm officially elected The right to bear arms, I'm officially protected So if I call you out, don't argue, respect it Matter fact, go hit the showers, you officially ejected! I used to slang the Jimmy Crack when I didn't care I seen Jimmy jack corn homie, I was there When Jimmy turned around with his devilish glare I showed Jimmy waistline, partner he wouldn't dare (c'mon) I can burn your chest like shots of Patron Fuck a drink, I'm talkin 50-cal desert eagle holmes ... Ah ah ah ah I drop down and get my 50-cal desert eagle on (boom!)   - 2X",15,12,10,17,9,24,16,12,4,19,-0.9868
82,82,/songs/35218,Nelly,Lie,https://genius.com/Nelly-lie-lyrics,http://api.genius.com/songs/35218,Brass Knuckles,2008-09-16," La la la la la, la-la-la-la   Uhh, uhh yo yo Yo I'm tired of the ""he say she say"" Why every time they get mad man we pay? She wanna act like the judge and the jury The police, F.B.I. and the C.I.A. (all in one) And now it's me she tryin to convict She better show me some DNA and fingerprints She better show me the name of the one that snitched Matter fact, right now I'mma plead the fifth   + (Keri Hilson) (She said you tried to fuck her) She's a motherfuckin liar (Boy please) No way (whatever) not me (Yeah you) Man, she's just hatin (She said you met her last summer) She's a motherfuckin liar (Boy please) No way (whatever) not me (Yeah you) Girl, you sound crazy (She said y'all exchangin numbers) She's a motherfuckin liar (Boy please) No way (whatever) not me (Yeah you) Fellas what we gon' do - what? Take it to the grave - what? Take it to the grave Take it to the grave, I'mma take it to the grave I'mma take it to the grave - you better take it to the grave Take it to the grave, I'mma take it to the graaaaave!   Yo, yo, yo, yo, yo (is she serious?) She said she did what, with who? She wrong Since she knows so much ask her what I had on True Religion, Air Jordan, Ed Hardy? C'mon ma, that's e'ry nigga in the party But I was at the studio perfectin my hustle With Ky', Murph' and Mo just finishin ""Brass Knuckles"" Now with all these purses, fur coats, fly whips I done bought for you, now you still believe any chick? Is you serious?   3:24 when I walk in the do' (oh) Phone on loud, what it do that fo'? (damn) She said she went down south, all in my texts 6:30 in the mornin got this loud-ass message I ain't even do it though, mama girl lyin {You tried to fuck her} I ain't even had time Ask her where she know me from, who I be with? What number she dial? That crazy girl wild   I really don't know her, I seen her on MySpace Looked at her page, all I seen was my face Her username read, ""Kyjuan fo' life"" With videos and pictures, set up so right The only bad thing is she writes me all night Sayin shit like, ""The 'Tics is so tight"" She ends with I love you, that starts the big fight Baby, I can't control what she types Believe me  ",9,4,11,14,5,25,7,12,1,10,-0.9817
83,83,/songs/1810747,Nelly,Like Dat,https://genius.com/Nelly-like-dat-lyrics,http://api.genius.com/songs/1810747,None,2018-04-06,"Like dat (like dat), like dat (like dat) Like dat (like dat), like dat (like dat) Like dat (like dat), like dat (like dat) Like dat (like dat), like dat (like dat) Like dat (like dat), like dat (like dat) Like dat (like dat) I went from mac flippin off a mattress on the vilkin lot To back flippin in the ocean off a yellow yacht From hundred pennies worth of candy at the corner store To hundred thou on rodeo just a day ago Yea, the trials and tributes of a country nigga Multiple personalities, I'm a bunch of niggas So far out they reach, they say I'm out of touch from niggas Too much temptation, I ain't gone, David rough the nigga Click! That's my swag getting turned on Shorty see me in the Lamb, now she turned on More loop, the king of the ave, I just turned on Saint Louis nigga, watch me put my bird on Straight up (like dat) I wake up (like dat) I blaze up (like dat) Straight up (like dat) Straight up (like dat) I'm caked up (like dat) I came up (like dat) Straight up (like dat) I'm like dat, like dat You talk shit and it's like dat I got a bad bitch, she like dat I give her everything, she come right back Like dat, like dat My whole town be like dat Don't play around, nigga like dat Shut shit down, straight like dat Uh, I'm Dukes of Hazard playin dodge, 8 bricks in the Charger Inside my hood they call me Ace, yea I hustle harder I started up behind a bitch but now I play the starter Tangle up so many rocks, they call it Mr. Carter Mr. Cate, G I'm talkin sure My money disrespectful, ghost Phantom, sleep on my lawn My Drisco well in distance like Diddy with Sean John I got the streets so my bitch on lash, I can't post no bond Nah, tell them niggas I'm like dead beat Summing up, they don't fight back Up in Barcelona, no flight back In the outtie 8 til bank black Hundred grand a spill so I backpack And fear the safety, come right back Build it back up just like dat Straight up (like dat) I wake up (like dat) I blaze up (like dat) Straight up (like dat) Straight up (like dat) I'm caked up (like dat) I came up (like dat) Straight up (like dat) I'm like dat, like dat You talk shit and it's like dat I got a bad bitch, she like dat I give her everything, she come right back Like dat, like dat My whole town be like dat Don't play around, nigga like dat Shut shit down, straight like dat I came up just like dat My X texts, I ain't write back Til I came around with my new bitch She like Daniel, it's like that Ride around to that pimpsy With your girl and her 2 friend I don't drink but it's tradition I sip syrup in Houston I fell in love at the strip clubs She fell in love with my clique Goddamn right, bandz a make er dance Shit, I'm tryina make enough to make her quit In the cut with Dirty Mo Yea, young nigga on the move Mama tell your friends your son is on TV and I ain't on the news, word Now they all call cause they see I'm hot And they see a nigga buzzin like a beehive drop Don't be fooled by this brand new Rolly baby, I've been getting money since ER dropped Hotels I spend nights at, that pussy good enough to miss he flight back Black card, I swipe dat 10 thousand just like dat, word Straight up (like dat) I wake up (like dat) I blaze up (like dat) Straight up (like dat) Straight up (like dat) I'm caked up (like dat) I came up (like dat) Straight up (like dat) I'm like dat, like dat You talk shit and it's like dat I got a bad bitch, she like dat I give her everything, she come right back Like dat, like dat My whole town be like dat Don't play around, nigga like dat Shut shit down, straight like dat",27,7,20,18,12,35,32,15,5,17,0.9966
84,84,/songs/1296037,Nelly,Liv Tonight,https://genius.com/Nelly-liv-tonight-lyrics,http://api.genius.com/songs/1296037,5.0,2010-11-12,"Chorus: I just wanna liv tonight! I just wanna liv tonight away! I just wanna liv tonight! I just wanna liv my life, babe! I just wanna liv tonight! I just wanna liv tonight away! I just wanna liv tonight! I just wanna liv my life, babe! New York, L.A., Chicago, V.A., Saint Louis! I just wanna live my life, babe Hey Vegas, Miami, Hey London, Toronto, Hey Paris! I just wanna live my life, babe!  Top down there's a road down the back street Shot gun with a twin in the back seat No one with them two, it's just me Pull up to the club like a Pimp c Shouts out to the playas in the V.I.P Hey D.J., yeah, you remember me? Its the Nigga with the same group from the last week And we be, and we be Popping bottles, making noise On the tables, on the bars Shooting game at every broad Tell the girls to freak them boys I feel the patron and the re shots I'm throwin hundred dollar raindrops I live it up yo it may not , it may not cause today....  Chorus: I just wanna liv tonight! I just wanna liv tonight away! I just wanna liv tonight! I just wanna liv my life, babe! New York, L.A., Chicago, V.A., Saint Louis! I just wanna live my life, babe Hey Vegas, Miami, Hey London, Toronto, Hey Paris! I just wanna live my life, babe!  I'm with whatever shawty what u thinking I'm treating all night so whatchu drinkin Don't be afraid 'lil mama let loose Get shawty there another grey goose Tell your friends come here lets see what they do What they do..heyy Go shawty It's your birthday!  Wanna Maybach for my birthday Want a place to see my birthday,... Only black on black to the light grey And you can roll with me Yeah u can roll with me All ya'll can roll with me Cause today:  Chorus: I just wanna liv tonight! I just wanna liv tonight away! I just wanna liv tonight! I just wanna liv my life, babe! New York, L.A., Chicago, V.A., Saint Louis! I just wanna live my life, babe Hey Vegas, Miami, Hey London, Toronto, Hey Paris! I just wanna live my life, babe!  I just want to live tonight away I just want to live tonight away  If you like how the sound then shawty let's get down! You wanna go crazy on me, let's go now! Tonight we gon' party, till they shut the club down I'm going hard until they kick my ass out If you like how the sound then shawty let's get down! You wanna go crazy one me, let's go now! Tonight we gon' party, till they shut the club down I'm going hard until they kick my ass out  Chorus: I just wanna liv tonight! I just wanna liv tonight away! I just wanna liv tonight! I just wanna liv my life, babe! New York, L.A., Chicago, V.A., Saint Louis! I just wanna live my life, babe Hey Vegas, Miami, Hey London, Toronto, Hey Paris! I just wanna live my life, babe!  Liv tonight away I just wanna liv tonight away!",9,8,1,7,8,14,17,6,10,8,0.3111
