,Unnamed: 0,api_path,primary_artist,title,url,song_endpoint,album,release_date,lyrics,anger,anticipation,disgust,fear,joy,negative,positive,sadness,surprise,trust,polarity
36,36,/songs/35271,Nelly,Flap Your Wings,https://genius.com/Nelly-flap-your-wings-lyrics,http://api.genius.com/songs/35271,Sweat,2004-07-17,"[Hook x2: Nelly & Pharrell] Drop down and get your eagle on girl Flap your wings Drop down and get your eagle on girl Flap your wings Hell naw, ain't leaving me alone girl Flap your wings Drop down and get your eagle on girl Flap your wings  [Bridge: Pharrell & Vanessa Marquez & (Nelly)] (She's got that!) Sweat dripping all over her body Do you like that sweat dripping all over my body? (Oh! Oh! Yeah I like that) Sweat dripping all over yo body You like that sweat dripping all over my body   It's summertime and I'm back again Then went to VA yo and got my friends Say wassup, Pharrell! (These motherfuckers, now) Yeah! But let's show em what's above an L, BLING! 100 thou' couldn't get ya one of these I guarantee there ain't a flaw in one of these 200 thou' couldn't get you in the league And 300 thou' you couldn't even buy the keys I think ya need to add 50 more G's Now shall I proceed?! (yes indeed!) Ho! I need to see ya take it down to the floor Spread your wings if you're real ma, fly real low Pause for a second ma, grind real slow And if you do it right Rodeo we'll go Ho! I talk a lil Fred Siegel girl Bonnie and Judy Lee but when she bad call Vida Guerra Apple bottom wit a pearl underneath it You talking like you don't need it, I can tell ya conceded I like that in you, I don't see nothing wrong Drop down and get your eagle on, whoa!    [Bridge: Pharrell & Vanessa Marquez & (Nelly)] (She's got that!) Sweat dripping all over her body Do you like that sweat dripping all over my body? (Oh! Oh! Yeah I like that) Sweat dripping all over yo body You like that sweat dripping all over my body   Now what's next, the trend sin up in this party O.P.P. time, now let's get naughty You take baby girl and I'mma take shorty With the sweat dripping all over her body We gon' move if you wanna (oh!) groove if you wanna (oh!) Fly ya north up ma and get rude if you wanna Ain't got nothing to lose nor to prove Baby girl soaking like she just got up out the pool, eh! I know you're thirsty ma, go 'head and order what you want Some call it tricking, go 'head call it what you want I came to ball, I ain't come out here to front Cause the black card'll pickup what the grey card won't Her attractiveness, got me attacking this Oh so fabulous! Booty is maximus! She wanna fly south for the winter I might just go down south just to win her Hell naw she ain't gon leave me alone Making plans for us to be at home Take your pants off ma, you can leave your panties on But first drop down and get your eagle on, whoa!    [Bridge: Pharrell & Vanessa Marquez & (Nelly)] (She's got that!) Sweat dripping all over her body Do you like that sweat dripping all over my body? (Oh! Oh! Yeah I like that) Sweat dripping all over yo body You like that sweat dripping all over my body   From the girls wit skinny waists to girls heavy set C'mon flap your wings, c'mon flap your wings To the girls wit extensions to the girls wit dreads C'mon flap your wings, c'mon flap your wings From the girls got it good living in the suburbs C'mon flap your wings, c'mon flap your wings To the ones in the ghetto wit their hands on their curves C'mon flap your wings, c'mon flap your wings, OH!  ",6,4,7,21,4,28,21,12,5,14,0.9802
37,37,/songs/35262,Nelly,Fly Away,https://genius.com/Nelly-fly-away-lyrics,http://api.genius.com/songs/35262,Sweatsuit,2005-11-22," Free City This is a shout out to every young brother ya know Thats doin his thing right now Keep ya head up.. He's walkin the yard wishin he had wings Ya know so he could fly up out that joint Man   If I could, fly away Ooo and I wouldn't come back no more I, I'd turn around Just to see you for the last time See, now I know Hey, that it won't be easy I done fought in a battle, and I done made it this far I gotta few more feet, but its still the longest yard   Man, it's the longest yard I ever had to get in my life And see my life ain't right, if my wife don't write My niggas can't eat if the fish don't bite My raise the gross sales, like Mike and Ike Now big brother almighty I keep a gamma ray, I'mma G-5 G Take a G-5 jeep, G-5 deep Too some of their bare feet And that jeep don't speak Listen mayne they lock it down round herre See body bag and gag and your found round herre This as serious as it sound round herre The guards guard the ground, 4 pounds round herre And they ain't playin, they're just lettin you know That anything they want to happen, make it happen real slow Get the word from upstairs, put you in that hole I can't take it, I'm just ready to go   If I could, fly away Ooo and I wouldn't come back no more I, I'd turn around Just to see you for the last time See, now I know Hey, that it won't be easy I done fought in a battle, and I done made it this far I gotta few more feet, but its still the longest yard Yeah yeah, it's still the longest yard Uh uh, it's still the longest yard Um um, it's still the longest yard I done fought in a battle and I done made it this far (this far)   I'm in my cell 20 hours a day And doin push-ups ever hour a day Cause im tryin to keep the cowards away Thats why im markin off the calendar days Tryin to get it out of the way And im just tryin to keep a peace of mind And im gonna shank a motherfucker with a piece of mine Cause he tryin to take a piece of mine So im gon slice his ass a piece at a time But now that they close the door Lock me in and cell 30 deep but its built for 10 Tell me what kind of world they got you in When the barbed wire fences box you in From now, til they turn off the lights I'mma read everything in sight Its kinda hard tryin to read at night But I'mma change my life And help another brother take this flight   If I could, fly away Ooo and I wouldn't come back no more I, I'd turn around Just to see you for the last time See, now I know Hey, that it won't be easy I done fought in a battle, and I done made it this far I gotta few more feet, but its still the longest yard Yeah yeah, it's still the longest yard Uh uh, it's still the longest yard Um um, it's still the longest yard I done fought in a battle and I done made it this far (this far)   (Oohh no) I gotta make it out this place some how (Oohh no) Man I really believe that I done turned it around (Oohh no) You see, all I need is that second chance to show Since incarceration, my obligation of rehabilitation (Oohh no) They can punch me high, and they can kick me low (Oohh no) Spit on me its gonna take more than that for them to break my soul, I said (Oohh no) Man its hard for people to understand what its like to be Gated, incarcerated, I just can't take it But I'mma make it man to see better days   If I could, fly away Ooo and I wouldn't come back no more I, I'd turn around Just to see you for the last time See, now I know Hey, that it won't be easy I done fought in a battle, and I done made it this far I gotta few more feet, but its still the longest yard Yeah yeah, it's still the longest yard Uh uh, it's still the longest yard Um um, it's still the longest yard I done fought in a battle and I done made it this far (this far)   If I could fly away If I could I turn around If I could fly away If I could I turn around",12,11,5,7,4,15,17,3,5,15,-0.9706
38,38,/songs/35227,Nelly,For My,https://genius.com/Nelly-for-my-lyrics,http://api.genius.com/songs/35227,Country Grammar,2000-06-27," Yo, uh, you didn't see this one comin', did ya? All the way from the N.O to S.T.L Nelly-Nel and Lil' Wayne   Now on the scale of one to ten, I been rated, a 12 (right!) You know this and these cats hate it I got nothin' outdated, if it is it's upgraded S-Class with everything voice-activated Chrome rim three-bladed, factory custom made it Paid with big faces, if it's broke then replace it Now it's like that, purple haze and cognac On the beach in L.A. with dime bitches ridin' my back  [Verse 2: Lil' Wayne] I represent them street niggas When they get hot, carry the heat niggas Them sweet niggas off they feet niggas You livin' on the edge Fleet nigga That's why my clique we do or die and roll deep nigga Ain't nothing sweet nigga, recognize the bloody clothes Ready to represent the 'Grove with two Calico's I carry 4's in my side pocket While yours cockin' nigga mine poppin' Walk through your house with my iron knockin'   I'm doing this one for my niggas who be keepin' it tight Only lovin' dime bitches that fuck on the first night This is for my bitches with the style and grace Who ain't hear nothin' talkin' but the bitch in their face I'm doing this one for my niggas who be keepin' it tight Only lovin' dime bitches that fuck on the first night This is for my bitches with the style and grace Who ain't hear nothin' talkin' but the bitch in their face   I ain't bullshittin', I trick 'em and run up in their kitty If she ain't a nine or better, my niggas then I'm splittin' Get a code-red, hop in the Jag and fled Bumpin' N.O.R.E number six, ""Bitch give me some head"" And for you niggas out there who be jacking the wrist Got a new group for ya, Nina Ross and the Clips And from the hip I shoot, if you wanna get loot 'Bout ta tell ya the truth I'm more focused I'm born in the Lou'   I'm doing this one for my niggas who be keepin' it tight Only lovin' dime bitches that fuck on the first night This is for my bitches with the style and grace Who ain't hear nothin' talkin' but the bitch in their face I'm doing this one for my niggas who be keepin' it tight Only lovin' dime bitches that fuck on the first night This is for my bitches with the style and grace Who ain't hear nothin' talkin' but the bitch in their face  [Verse 4: Lil' Wayne] I ain't no busta nigga Came up out that Hollygrove dungeon, nigga Flame up and toast let it get sparkin' up in here You don't make it out alive very often up in here I'ma speak on behalf of the C.M.B. partna I'm a sweep off ya Ave if its any beef partna I skeet off a bag of the dilly-D partna Slip me on a mask hit the Benz wit three choppers Weezy-Wee partna   Four karats in my earring, five around my knuckle Six wrap the wrist, check the belt buckle Leave them wit it look like Nelly I didn't know If you was the Jackie Frost why didn't you say so Somebody gotta shine my nigga why not me Even my dentist told me floss 7 days a week Freeza burnt out the piece Gucci and hat sweet Butter soft leather seats for trash talkin' freaks   I'm doing this one for my niggas who be keepin' it tight Only lovin' dime bitches that fuck on the first night This is for my bitches with the style and grace Who ain't hear nothin' talkin' but the bitch in their face I'm doing this one for my niggas who be keepin' it tight Only lovin' dime bitches that fuck on the first night This is for my bitches with the style and grace Who ain't hear nothin' talkin' but the bitch in their face I'm doing this one for my niggas   Uh, uh, ha bet ya no were ready for that one hu, ha, ha We know ya didn't see that one comin' Uh, uh E.I Uh, uh wodie",27,6,24,29,6,36,18,26,6,7,-0.999
39,39,/songs/3630091,Nelly,Freaky With You,https://genius.com/Nelly-freaky-with-you-lyrics,http://api.genius.com/songs/3630091,None,2018-04-06," Let me lick you up and down 'Til you say stop Let me play with your body, baby Make you real hot Let me do all the things that a nigga wan' do Tell me why 'Cause tonight, baby, I wanna get freaky with you   Uh, yeah Pretty lady, nice to meet you My name is Nelly and you're? She said, ""Baby, you don't need to You know I know who you are"" Soon as you pulled up, I peeped you Lace dress, all see through Get to talkin' 'bout her boyfriend Ain't tryna hear 'bout other people Think she said he was a ball player But all his plays under review Foreplay, that's a preview Round two, that's the sequel Baby, I can keep a secret He ain't gotta know what we do We low as the ground Call me when he ain't around   Let me lick you up and down 'Til you say stop, stop (woo) Let me play with your body, baby Make you real hot (you hot, woo) Let me do all the things that a nigga wan' do Tell me why 'Cause tonight, baby, I wanna get freaky with you   Uh, uh, yeah Quit tryna hide all that freakin', yeah I'm fantasizin' 'bout freakin' you I'ma need 'bout a week or two Pretty pussy playin' peekaboo Got some ideas on what we can do I'm talkin' 'bout the unspeakable You're sendin' your silhouette It's amazin' we ain't on a pillow yet 'Cause the way that you got me hypnotized You came with your girls and I'm with the guys Girl, call the valet, they go get the ride Then it's straight to my place for a different vibe I swear I ain't never seen thicker thighs Got plans, unless you wanna improvise Right now, don't make a sound You know who wearin' the crown   Let me lick you up and down 'Til you say stop (no, I never gon' stop, never gon' stop) Let me play with your body, baby Make you real hot (make you hot, make you hot, make you hot) Let me do all the things that a nigga wan' do (that a nigga wan' do) Tell me why 'Cause tonight, baby, I wanna get freaky with you   You, I know I know what you like You, shawty, you ain't gotta hide it Pull that to the side, and let me get inside   Let me lick you up and down 'Til you say stop (no, I never gon' stop, never gon' stop) Let me play with your body, baby Make you real hot (make you hot, make you hot, make you hot) Let me do all the things that a nigga wan' do Tell me why 'Cause tonight, baby, I wanna get freaky with you",17,5,4,9,12,18,23,6,1,12,-0.5023
40,40,/songs/1055557,Nelly,Fuck It Then,https://genius.com/Nelly-fuck-it-then-lyrics,http://api.genius.com/songs/1055557,Nellyville,2005-06-25,"[Cedric walks up the stairs, goes into the house & shuts the door]   Where have you been?  Damn, dam girl. Why didn't you tell me the elevator was broke?  What took you so long?  Had to climb 3, 4 flights of steps. What's up?  All I asked you to do was to get the Nellyville CD  Yeah, yeah, I got it, I got it, I got it  How hard was that?  Why you actin' mad? I'm the one runnin' around lookin' for the album...  Because I've been in this apartment for a long time waitin' on your Ass. I don't watch Jenny Jones, Montel, Judge Judy...  What you mean it took so long? I've only been gone for...shit what? 1, 2, 3 hours, I wasn't even gone for that long  What you had to go to St. Louis to get the muthafuckin' CD?  Okay, okay look baby, I got it, just calm down  What was so hard about that?  Drink some champaign  I don't want no damn champaign. Where's is the Nellyville?  Sayin' bubble bath, Gettin' it on, I hit that ass...(sniffles)  Whatever. Where's the CD?  Everybody Just chill out, You' know what I mean? yeah I got the Nelly for you'Yeah, I got it I'm gonna put this on... yeah, I hope you don't mind the clean version  The clean version?!  What?  What?!  Man, this is all they had  What you think this is rated PG?  Look baby, look I can cuss, I can cuss for everybody Don't you worry about the cussin'  You think we at the Prom... What the fuck is wrong with you?  There's gonna be plenty of bad words sayin' up in...  Whatever. You know what? Where's my shit at? Get me out of this small ass, hot ass apartment anyways!  Where your goin""? Oh, so your just gonna leave me like that!  Where's is my shit? Give me my coat, I'm ready to go Man: Oh. So your just gonna Nsync a bro, Your just...  BYE!  Well go ahead & just go. & the truth remains. Your Hey, that's arite-Cause I hope you fall down them stairs, you & your gucci shoes!",9,11,8,6,6,15,16,6,3,11,-0.9362
41,41,/songs/35273,Nelly,Getcha Getcha,https://genius.com/Nelly-getcha-getcha-lyrics,http://api.genius.com/songs/35273,Sweat,2004-09-13,"(HO!)  (HEY!)   See the band played on (Getcha, getcha, getcha, I better getcha) And they was singin my song (Getcha, getcha, getcha, gonna getcha, right?) (Repeat x4)  Watch the band play on   I got them folks on the left, man they going like (HO!) I got them folks on the right, and they be screaming like (HEY!) I got them folks in the back, man they be yelling like (HO!) I got them folks down front, waving they hands like (HEY!)   What we gonna do about the middle, man? (HO!) They get it swinging, juke jumping, a little man (HEY!) I'm from the middle man, watch dirty entertain (HO!) Capacity ten thousand, we packed the whole thing (HEY!)   To get the spot leaning That's what we trying for We all we got, that's why we rhyme so I feel we the best, no sense in lying, though Now, all together, watch the crowd go   I'm just a dirty from the Lou, I got a whole lot of (HO!) Smoking on some shit from a barn they call (HEY!) I don't pay for no pussy, I try to stay away from (HO!) If I do pay for something, you know what I'm on   I get a hundred-fifty thou' to make the crowd go (HO!) I might fly by you in that Diablo (HEY!) I'm leaving St. Louis, smashing that throttle (HO!) In three hours flat, I hit Chicago (HEY!)   Black stacks and 'Lacs, it's what I earned so far (HO!) This copycatting thing is going too far (HEY!) Cheefing, reefing, no more burning the 'gar (HO!) Sipping Pinot Bridgio while I'm churching at bars (HEY!)   Derrty ENT screaming at our show (HO!) I'm catching to freak something to die for (HEY!) I stick twenty, twenty-four, that's how high I go (HO!) And smoke like a chimney, puffing that hydro (HEY!)   Now, every time I'm up on that stage, somebody screaming (HO!) Every time that my back is turned, somebody saying (HEY!) When I'm up in the club, it's so easy to get a (HO!) But I'd rather get a young lady that's cool with the...   I'm sick of wannabe gangsters that be pretending they not a (HO!) Talking behind your back, but when they see you they like (HEY!) I don't pay no attention, I'm only there to steal your (HO!) And I ain't got to like your ass, I'll still smoke your (HEY!)   No music, no weed, what should we ride for? (HO!) We roll with them Twista like we Chicago (HEY!) Shout out to OPEC rolls up the five four (HO!) The streets of St. Louis call it survival (HEY!)   Your game ain't tight, no you ain't pimping kin (HO!) You see the Cutlass Supreme I'm sitting in? (HEY!) Lime green chinchilla, ooh that's a different skin (HO!) Where I'm from, we wear blue and gold like we Michigan (HEY!)   I know you a lady, but tonight, can you be a (HO!) Is that your man chasing you down, behind you yelling (HEY!) He cussing like a motherfucker, calling her a (HO!) She asking me what she should do, I just look like...   - 2X  Watch the band play on",10,10,8,9,7,15,14,6,2,9,-0.7762
42,42,/songs/174384,Nelly,Get Like Me,https://genius.com/Nelly-get-like-me-lyrics,http://api.genius.com/songs/174384,M.O.,2013-07-02,"   All y'all niggas wanna get like me Surrounded by bitches that look like these You know it, you know it You know it, you know it All my niggas be blowin on trees Hands so sick so they throwin up keys You know it, you know it You know it, you know it   I say all y'all niggas wanna get like me (All y'all niggas wanna get like me) Now who run the show go look and see And then count the bitches, nigga - 1, 2, 3 I said and if you feel like something else there Then tell her that you down for something else yea And if she say, ""Kissin' far as it goes"" Dont worry, she straight like a actors nose You can ball and ball, do it wall to wall Just sayin that you cant do it small is all You can floss Rolex over Audemar Om the arm and Im outshining all of y'all Can you feel it? Hey, hey Do you want more? Hey, hey Til yo back sore Hey, hey So lets go, lets go - AOOOWWW~!   All y'all niggas wanna get like me Surrounded by bitches that look like these You know it, you know it You know it, you know it All my niggas be blowin on trees Hands so sick so they throwin up keys You know it, you know it You know it, you know it   Uh! I'm the shizzniyee You should follow my example - bitch, i.e Cuz I'm front row, Isaac Mizrahi In the truck but I ain't suck diznayee All these hoes wanna get like me Get their own speakers and some prose like me When I'm at the game, all the pros like me Bitch I'm a pro, ain't a ho like me Bitches ain't stuntin' in the cold like me Some call me bitchie, so Necole like me Pull up in the ghost, East Coast like me My nigga spend money like the cold price free Uhn! Bon voyage, Nicki M. Baby, Buns Minaj Back of the Bach slumpty, Humpty Dumpty On the back of the bike, these stunts be comfy   All y'all niggas wanna get like me Surrounded by bitches that look like these You know it, you know it You know it, you know it All my niggas be blowin on trees Hands so sick so they throwin up keys You know it, you know it You know it, you know it   You wrong Why you dance so low to this song? Where your boyfriend at, he gone? Is that a napkin you put your number on? You so wrong Drop down shawty, get your eagle on Tell your boyfriend you stayin with Simone Matter of fact, put your number in my phone   Im a fly nigga tatted up with the fade Yea I was rocking waves when them niggas had braids It was Air Force 1s then I took em all to J's Now they wanna play dumb like they from the Bay I was tourin overseas, 2-50 everyday Just came back in the middle of the may In the Maybach with this chick named May Wanna know if she can do me, Shawty yes you may See the whole rap game sounded like me Put that on the drums but it sounded like P Shawty say she horny, sound like me Say she wanna bring her partner, okay that sound like 3 Fresh off the yacht, feet in the sand Walk in the club, me in demand Got a whip on the lot, 'bout 400 grand Gold 'round my neck, pistol close at hand 'cause   All y'all niggas wanna get like me Surrounded by bitches that look like these You know it, you know it You know it, you know it All my niggas be blowin on trees Hands so sick so they throwin up keys You know it, you know it You know it, you know it",19,7,17,11,7,28,13,15,5,12,-0.7369
43,43,/songs/965799,Nelly,Gettin' It Started,https://genius.com/Nelly-gettin-it-started-lyrics,http://api.genius.com/songs/965799,Nellyville,2002-06-25,"   Hey, alright, come on in. What's up baby?  Hey, Boo. What's up?  You lookin' good  Thank You  What's them, are they some gucci?  Well, you know, you know  You lookin' good wit it, fo' sho'. Yeah everything is nice, I'm lookin' good, I'm feelin' good  Everything is good  We gonna have a good time this evening  No doubt  Just chillin' got a little champaign over here. Want somethin' to drink?  Yeah, I'm thirsty. Damn baby!  Excuse me, I already--  You smell like bologna! Ew!  Excuse me, I already been drinkin' a little somethin'. You know?  Uh uh  Nah, that's my bad, don't even trip  Alright  I just had a little somethin' earlier, excuse me. Wait. What you need?  I need that new Nellyville  The new Nelly. Huh?  Yeah, yeah now that right there get's me real loose  You want that new Nelly, the new Nellyville, right? I think I got that, hold on  I need that Nellyville  Let me look over here, I don't know, I'm almost sure I got that, I got it here baby  Alright baby, okay, alright  I got all the hot stuff, I usually have everything new, let me see  Damn baby my auntie gotta couch just like that  You talkin 'bout... you want Nelly though. Right?  Oh. Yeah the Nellyville  You Nelly, not The Lunatics, Nelly  What's wrong? You ain't got it?  Uh oh, uh oh, uh oh  Yeah  I got you  Okay  I think um, let me see, god damn  How much you pay for rent in this spot?  I ain't got Nelly, I got Ocanelly, I got...  Put it in yo' mouth  There will be none of that tonight, uh uh, no baby  A'lright, cool, I'm not lyin' maybe later on, ain't nuttin' to it, hopefully, hopefully  Na eh  Look  What's the problem?  So that's what you need though?  Nellyville is what I need, Nel-ly-ville  That's what you need?  Uh huh  I got you don't even trip  Okay  I want you to stay & I'm a run to the store, real quick, I'm a just run down to the street, right down  Hurry up, hurry up  I want you to sit here, look good  Nellyville  Look delicious, like yourself  Uh uh  I'll be right back, you keep it hot for me  Okay  I'm goin' to get that Nellyville for you  Uh uh  Right away  Hurry up  I'll be right back, don't go nowhere  Nellyville  I mean that  & I'm sayin' you got some food in this spot? I'm hungry  ",9,16,6,5,17,17,26,4,10,17,0.9921
