,api_path,primary_artist,title,url,song_endpoint,album,release_date,lyrics,polarity,anger,anticipation,disgust,fear,joy,negative,positive,sadness,surprise,trust
59,/songs/3855899,Shawn Mendes,Patience (MTV Unplugged),https://genius.com/Shawn-mendes-patience-mtv-unplugged-lyrics,http://api.genius.com/songs/3855899,MTV Unplugged,2017-11-03," Really sing this one out   You hit me up, it's late at night This is the same old story Your friends should take your phone away I always give in when you tell me lies to reassure me I always make the same mistake   Ooh, you give me a little taste Lure me in, then you take it from me Oh, I hate that I love it 'Cause you're driving me--sing it out!   First you say you love me, then you say you don’t I wake up in the mornin', and I'm all alone Tell me that you're willing, then you say you won't Can you make your mind up? Please, I'm losin' my patience You know I'm losin' my patience, yeah   I'm in your room, it's just us two I feel you're getting closer You rest your head upon my chest Deep down I know that this should be the last time I come over You always leave me such a mess   Ooh, you give me a little taste Lure me in, then you take it from me Oh, I hate that I love it 'Cause you're drive--scream it out!   First you say you love me, then you say you don’t I wake up in the mornin', and I'm all alone Tell me that you willing, then you say you won't Can you make your mind up? Please I'm losin' my patience Yeah, yeah   And you gotta stop, if you know So I can start, letting go 'Cause it's drivin' me crazy Yeah, you keep drivin' me crazy   When you say you love me, then you say you don’t I wake up in the mornin', and I'm all alone Tell me that you willing (beautiful), then you say you won't Yeah, you're driving me crazy   First you say you love me, then you say you don’t I wake up in the mornin', and I'm all alone Tell me that you willing, then you say you won't Can you make your mind up? Please I'm losin' my patience Love me, then you say you don’t I wake up in the mornin', and I'm all alone Tell me that you willing, then you say you won't Can you make your mind up? Please I'm losin' my patience Yeah, yeah Oh no no You know I'm losin' my patience baby Oh no no Can you make your mind up? Please I'm losing my patience",0.9692,9,11,5,6,12,15,26,12,2,16
60,/songs/3677122,Shawn Mendes,Perfectly Wrong,https://genius.com/Shawn-mendes-perfectly-wrong-lyrics,http://api.genius.com/songs/3677122,Shawn Mendes,2018-05-25," Taste the poison from your lips Lately, we're as good as gone Oh, our love is drunk and it's Singing me my favorite song   Me and you We were made to break I know the truth But it's much too late   You're perfectly wrong for me And that's why it's so hard to leave Yeah, you're perfectly wrong for me You're perfectly wrong for me All the stars in the sky could see Why you're perfectly wrong for me   Oh, you know how much it hurts Every time you say you hate me But when we're making love, you make it worth it I can't believe the places that you take me   There's no use We were made to break I know the truth And it's much too late   You're perfectly wrong for me And that's why it's so hard to leave Yeah, you're perfectly wrong for me Oh, you're perfectly wrong for me All the stars in the sky could see Why you're perfectly wrong for me   Oh, and why can't I quit When you break my heart open I need you more than I know Oh, and I can't resist When you're up against my skin I never want to let you go   You're perfectly wrong for me And that's why it's so hard for me Yeah, you're perfectly wrong for me, mhm Yeah, you're perfectly wrong for me Hate that you know that I won't leave Yeah, you're perfectly wrong for me, oh Yeah, you're perfectly wrong for me And that's why it's so hard for me Yeah, you're perfectly wrong for me, yeah Oh, you're perfectly wrong for me Hate that you know that I won't leave Yeah, you're perfectly wrong for me Yeah, you're perfectly wrong for me",0.9923,5,4,4,5,6,30,11,11,8,6
61,/songs/3665896,Shawn Mendes,Psycho,https://genius.com/Shawn-mendes-psycho-lyrics,http://api.genius.com/songs/3665896,None,2018-04-22," Damn, my AP goin' psycho, lil' mama bad like Michael Can't really trust nobody with all this jewelry on My roof look like a no-show, got diamonds by the boat Come with the Tony Romo for clowns and all the bozos My AP goin' psycho, lil' mama bad like Michael Can't really trust nobody with all this jewelry on My roof look like a no-show, got diamonds by the boat Don't act like you my friend when we rollin' through my ends, though   You stuck in the friend zone, I tell that four-five the fifth, ay Hundred bands inside my shorts, DeChino in it, ay Try to stuff it all in, but it don't even fit, yay Know that I been with the hits ever since a jit, ay I made my first million, I'm like, ""Woah, this is it,"" ayy 30 for a walkthrough, man, we had that is lit, ayy Had so many bottles, gave every girl a sip Out the window of the Benzo, we get seen in the rent' And I'm like ""Whoa, man, my neck so goddamn cold” Diamonds wet, my t-shirt soaked I got homies, let it go, oh My money thick, won't ever fold She said, ""Can I have some to hold?"" And I can't ever tell you no   Damn, my AP goin' psycho, lil' mama bad like Michael Can't really trust nobody with all this jewelry on you My roof look like a no-show, got diamonds by the boatload Come with the Tony Romo for clowns and all the bozos My AP goin' psycho, lil' mama bad like Michael Can't really trust nobody with all this jewelry on you My roof look like a no-show, got diamonds by the boatload Don't act like you my friend when I'm rollin' through my ends, though  And I'm like ""Woah, damn, my neck so goddamn cold” Diamonds weigh, my teeths is sore I got homies, let it blow, oh, no ho My money thick, won't ever fold She said, ""Can I have some to hold?"" Yeah I can't ever tell her no My money thick, won't ever fold She said, ""Can I have some to hold?"" Yeah I can't ever tell you no I can't ever tell you no",-0.9785,12,6,7,4,14,11,20,5,5,18
62,/songs/3677126,Shawn Mendes,Queen,https://genius.com/Shawn-mendes-queen-lyrics,http://api.genius.com/songs/3677126,Shawn Mendes,2018-05-25," It's hard to believe You don't remember me at all Am I hard to recognize? You say ""nice to meet you"" every time Yeah, and I made you laugh I still remember what I said Guess I shouldn't be surprised You say ""nice to meet you"" every time   I know we got a lot of mutual friends Don't say my name, don't come up in your conversations, yeah   Who crowned you queen of You think you're too cool Making beautiful look ugly The way you put yourself above me You treat me Like I got nothin' on you Making beautiful look ugly You ain't the ruler of no country Who made you the queen?   I shouldn't stress about The fact you're not impressed Are you playing hard to get? Or maybe you're not interested I don't understand Why everybody thinks you're sweet 'Cause I see the opposite No, you're not so innocent   I see the way you're lookin' through me right now To see if there's somebody cooler around, yeah   Who crowned you queen of You think you're too cool Making beautiful look ugly The way you put yourself above me You treat me Like I got nothin' on you Making beautiful look ugly You ain't the ruler of no country Who made you the queen?   No, no, no, no, no Who made you the queen? Who made you the queen?   Who crowned you queen of You think you're too cool Making beautiful look ugly The way you put yourself above me (yeah, nah, yeah) You treat me Like I got nothin' on you Making beautiful look ugly (making beautiful look ugly) You ain't the ruler of no country (you ain't the ruler of no country, babe)   Who made you the queen? Who made you the queen? Yeah, you think you're too cool, no Who made you the queen? Who made you the queen?",0.9811,3,6,11,3,13,11,24,4,7,11
63,/songs/2853899,Shawn Mendes,Roses,https://genius.com/Shawn-mendes-roses-lyrics,http://api.genius.com/songs/2853899,Illuminate,2016-09-23," It's not that I'm afraid I'm not enough for her It's not that I can't find the words to say But when she's with him, she seems happier And I don't want to take that away   How many times can I see your face? How many times will you walk away? I just have to let you know   I'm not tryna start a fire, with this flame But I'm worried that your heart might feel the same And I have to be honest with you baby Tell me if I'm wrong, and this is crazy But I got you this rose And I need to know Will you let it die or let it grow? Die or let it go?   It's not that I don't care about the love you have It's not that I don't want to see you smile But there's no way that he can feel the same 'Cause when I think of you my mind goes wild   How many times can I see your face? How many times will you walk away? I just have to let you know   I'm not tryna start a fire, with this flame But I'm worried that your heart might feel the same And I have to be honest with you baby Tell me if I'm wrong, this is crazy But I got you this rose And I need to know Will you let it die or let it grow?   You can tell me stop, if you already know Though I'm not sure my heart can take it But the look on your face says, don't let me go   I'm not tryna start a fire, with this flame But I'm worried that your heart might feel the same And I have to be honest with you baby Tell me if I'm wrong, this is crazy But I got you this rose And I need to know Will you let it die or let it go? I'm not tryna start a fire, with this flame But I'm worried that your heart might feel the same And I have to be honest with you baby Tell me if I'm wrong, this is crazy But I got you this rose And I need to know Will you let it die or let it grow?",-0.9874,8,11,4,18,13,19,18,17,2,13
64,/songs/3855901,Shawn Mendes,Roses (MTV Unplugged),https://genius.com/Shawn-mendes-roses-mtv-unplugged-lyrics,http://api.genius.com/songs/3855901,MTV Unplugged,2017-11-03," It's not that I'm afraid I'm not enough for her It's not that I can't find the words to say But when she's with him, she seems happier And I don't want to take that away   And how many times will I see your face? How many times will you walk away? Oh, I just have to let you know   That I'm not tryna start a fire, with this flame But I'm worried that your heart might feel the same And I have to be honest with you baby Tell me if I'm wrong, and this is crazy But I got you this rose And I need to know Will you let it die or let it grow? No no, hey   It's not that I don't care about the love you have, yeah It's not that I don't want to see you smile, woah But there's no way that he can feel the same, no no no no 'Cause when I think of you, my mind goes wild   And how many times will I see your face? How many times will you walk away? Oh, I just have to let you know Sing it out   And I'm not tryna start a fire, with this flame, yeah But I'm worried that your heart might feel the same And I have to be honest with you baby Tell me if I'm wrong, and this is crazy But I got you this rose And I need to know Say it Will you let it die or let it grow?   You can tell me stop, if you already know Though I'm not sure my heart can take it But the look on your face says, don't let me go, no   I'm not tryna start a fire, with this flame But I'm worried that your heart might feel the same And I have to be honest with you baby Tell me if I'm wrong, and this is crazy But I got you this rose And I need to know Scream it out! Will you let it die or let it grow? I'm not tryna start a fire, with this flame But I'm worried that your heart, it might feel the same Tell me if I'm wrong, this is crazy But I got you this rose And I need to know Will you let it die? Will you let it die or let it grow?   Oh, no no Thank you",-0.9955,8,13,4,18,13,20,18,17,3,14
65,/songs/2811145,Shawn Mendes,Ruin,https://genius.com/Shawn-mendes-ruin-lyrics,http://api.genius.com/songs/2811145,Illuminate,2016-07-08," Do ya, do you think about me? And do ya, do you feel the same way? And do ya, do you remember how it felt? Cause I do, so listen to me, baby   And I'm not tryna ruin your happiness But darling, don't you know that I'm the only one for ya? And I'm not tryna ruin your happiness, baby But darling, don't you know that I'm the only one? Yeah   And do ya, do you think about me at all? And do you, do you feel the same way? Oh, tell me babe And do ya, do you remember how it felt? Cause I do, so listen to me now, oh oh   And I'm not tryna ruin your happiness But darling, don't you know that I'm the only one for ya? And I'm not tryna ruin your happiness, baby But darling, don't you know that I'm the only one?   Do I ever cross your mind? Do I ever cross your mind? Do I ever cross your mind? Do I ever cross your mind? Oh   And I'm not tryna ruin your happiness But darling, don't you know that I'm the only one for ya? And I don't wanna, I don't wanna ruin your happiness, baby But darling, don't you know that I'm the only one? Yeah   Oh-oh Do I ever, said I Do I ever, said I, do I? Do I ever, said I Do I ever, said I, oh-oh-oh-ohhh? Do I ever, do I ever cross your mind? Not tryna ruin your happiness at all",0.9986,5,7,0,12,17,12,25,12,0,14
66,/songs/3334284,Shawn Mendes,Ruin (MTV Unplugged),https://genius.com/Shawn-mendes-ruin-mtv-unplugged-lyrics,http://api.genius.com/songs/3334284,MTV Unplugged,2017-11-03," Do ya, do you think about me? And do ya, do you feel the same way? And do ya, do you remember how it felt, baby? Cause I do, yeah yeah yeah, so listen to me, now Woah, woah-oah, yeah sing!   And I'm not tryna ruin your happiness, baby But darling, don't you know that I'm the only one for ya? No, no And I'm not tryna ruin your happiness, baby But darling, don't you know that I'm the only one? Yeah   And do ya, think about me at all? And do you, yeah yeah yeah, do you feel the same way? No, no, no, yeah, now scream it out with me And do ya, do you remember how it felt? Cause I do, yeah yeah yeah, so listen to me now, sing! Woah, woah-oah   And I'm not tryna ruin your happiness, baby But darling, don't you know that I'm the only one for ya? And I'm not tryna ruin your happiness, baby But darling, don't you know I'm the only one?   How you guys feeling tonight? Oh, no no no no no, yeah yeah yeah Do I ever cross your mind? Woah-oah, yeah   And I'm not tryna ruin your happiness, baby But darling, don't you know I'm the only one for ya? And I'm not tryna, ruin your happiness, baby But darling, don't you know I'm the only one? Yeah   Please give it up for my incredible band behind me tonight Oh, no no no no no, yeah yeah yeah Alright I got a little sing-along for you, just repeat after me   Sing, do I ever cross your mind? (Do I ever cross your mind?) Beautiful Sing, do I ever cross your mind? (Do I ever cross your mind?) Wonderful Sing, do I ever cross your mind? (Do I ever cross your mind?) Louder! Sing, do I ever cross your mind? (Do I ever cross your mind?) Sing, do I ever cross your mind, baby? Scream it out! (Do I ever cross your mind?) Sing, do I ever cross your mind? As loud as you can! (Do I ever cross your mind?) And do I ever cross your mind? (Do I ever cross your mind?) Sing, do I ever cross your mind? (Do I ever cross your mind?) Sing, do I ever cross your mind? No, no, no no no   And do I ever, said I Do I ever, said I, do I? Yeah Do I ever, said I Do I ever, said I, oh oh, ohh And do I ever, do I ever cross your mind? Yeah Oh, no, nah, yeah  , do I ever cross your mind? (Do I ever cross your mind?) Wonderful Sing, do I ever cross your mind? (Do I ever cross your mind?) Sing, do I ever cross your mind, baby? (Do I ever cross your mind, baby?) Sing, do I ever cross your mind? (Do I ever cross your mind?) Now bring it down real low Sing, do I ever cross your mind? (Do I ever cross your mind?) Do I ever cross your mind? (Do I ever cross your mind)  [Outro} Cause I'm not tryna, I'm not tryna ruin your happiness at all   Thank you so much",0.9989,34,23,3,41,42,41,49,54,5,31
67,/songs/2374020,Shawn Mendes,Running Low,https://genius.com/Shawn-mendes-running-low-lyrics,http://api.genius.com/songs/2374020,Handwritten Revisited,2015-11-20," Weeks on end, I'm on the road I start to lose my sense of home I should've called so many times but I I just sat next to my phone   Just know it takes it from me To end this darling, oh   And I know you'll find someone who Gives you the time I didn't give to you I'm running low I'm sorry, but I have to go And maybe I will never feel You gave me something so real I'm running low I'm sorry, but I have to go   Thinking back to every night That we just laid there for a while And when I looked into your eyes I never thought I'd say goodbye   Just know it takes it from me To end this darling, oh   And I know you'll find someone who Gives you the time I didn't give to you I'm running low I'm sorry, but I have to go And maybe I will never feel You gave me something so real I'm running low I'm sorry, but I have to go   Just needed time to, to find my own But I promise someone will give you all you want Can give you all you need And you just gotta see I never meant to hurt you, no   And I know you'll find someone who Gives you the time I didn't give to you I'm running low I'm sorry, but I have to go And maybe I will never feel You gave me something so real I'm sorry, but I have to go",0.4523,2,7,1,2,3,2,7,2,1,6
68,/songs/3601706,Shawn Mendes,Say Something,https://genius.com/Shawn-mendes-say-something-lyrics,http://api.genius.com/songs/3601706,None,2014-01-01,"Say something, I'm giving up on you I'll be the one if you want me to Anywhere I could have followed you  Say something, I'm giving up on you  And I am feeling so small It was over my head I know nothing at all  And I will stumble and fall I'm still learning love Just starting to crawl  Say something, I'm giving up on you I'm sorry that I couldn't get to you Anywhere I would have followed you Say something, I'm giving up on you  And I will swallow my pride You are the one that I want And I'm saying goodbye  Say something, I'm giving up on you And I'll be the one if you want me too Anywhere I could have followed you Say something, I'm giving up on you Say something, I'm giving up on you I'll be the one if you want me too Anywhere I could have followed you Say something I'm giving up on you",0.9756,1,1,2,1,3,5,12,2,1,1
69,/songs/3601647,Shawn Mendes,She Looks So Perfect,https://genius.com/Shawn-mendes-she-looks-so-perfect-lyrics,http://api.genius.com/songs/3601647,None,2014-07-09," Hey, hey, hey, hey Hey, hey, hey, hey hey   Simmer down, simmer down They say we’re too young now to amount to anything else But look around We worked too damn hard for this just to give it up now If you don’t swim, you’ll drown But don’t move, honey   Because you look so perfect standing there In my American Apparel underwear And I know now that I’m so down Your lipstick stain is a work of art I got your name tattooed in an arrow heart And I know now that I’m so down Hey, hey Hey, hey, hey, hey Hey, hey, hey, hey   Let’s get out, let’s get out 'Cause this deadbeat town’s only here just to keep us down While I was out I found myself alone just thinking If I showed up with a plane ticket And a shiny diamond ring with your name on it Would you wanna run away too? 'Cause all I really want is you   And you look so perfect standing there In my American Apparel underwear And I know now that I’m so down I made a mixtape straight out of ‘94 I’ve got your ripped skinny jeans lying on the floor And I know now that I’m so down Hey, hey Hey, hey, hey, hey Hey, hey, hey, hey",0.6443,4,7,3,2,7,4,12,2,2,5
70,/songs/484034,Shawn Mendes,Show You,https://genius.com/Shawn-mendes-show-you-lyrics,http://api.genius.com/songs/484034,The Shawn Mendes - EP,2014-07-28," You can’t walk the streets at night You're way too short to get on this ride No I'm not, no I'm not, they're tryna tell me that I I gotta be home when the street lights glow? You can’t watch your TV show I will watch what I wanna watch No, I won’t listen to you, do what I wanna do   And I will walk this road ahead One hundred miles on my hands Do I need to show you? Guess I gotta show you And if you don't believe me now I'll flip the whole world upside down Do I need to show you? Guess I gotta show you   Watch me swim across this lake Fly through the sky in my Superman cape Watch me walk across this wire Tip toe through the coals of a blazing fire Watch me fly this kite in the rain I’ll jump rope with my ball and chain Come by and knock on my house of cards If it falls I will build it from the start I won’t listen to you, do what I wanna do   And I will walk this road ahead One hundred miles on my hands Do I need to show you? Guess I gotta show you And if you don't believe me now I'll flip the whole world upside down Do I need to show you? Guess I gotta show you   Do I really gotta show you now? Really, really, gotta show you now? Do I really gotta spell it out? I-T, I spelled it out Do you really wanna see me now? Watch me walk across the clouds I don’t know what you heard about, listen to me yell it loud Do I really gotta show you now? Really, really, gotta show you now? Do I really gotta spell it out? I-T, I spelled it out Do you really wanna see me now? Watch me walk across the clouds I don’t know what you heard about, see that door I'll knock it down   And I will walk this road ahead One hundred miles on my hands Do I need to show you? Guess I gotta show you And if you don't believe me now I'll flip the whole world upside down Do I need to show you? Guess I gotta show you   Do I really gotta show you now? Really, really, gotta show you now? Do I really gotta spell it out? I-T, I spelled it out Do you really wanna see me now? Watch me walk across the clouds Do I need to show you? Guess I gotta show you",-0.707,1,12,1,12,4,3,14,1,8,28
71,/songs/3601775,Shawn Mendes,Skyscraper,https://genius.com/Shawn-mendes-skyscraper-lyrics,http://api.genius.com/songs/3601775,None,2014-01-01,"Skies are crying, I am watching Catching tear drops in my hands Only silence as it's ending Like we never had a chance Do you have to make me feel like There's nothing left of me?  You can take everything I have You can break everything I am Like I'm made of glass Like I'm made of paper Go on and try to tear me down I will be rising from the ground Like a skyscraper Like a skyscraper  As the smoke clears, I awaken And untangle you from me Would it make you feel better To watch me while I bleed? All my windows still are broken But I'm standing on my feet You can take everything i have You can break everything i am Like im made of glass Like im made of paper  Go on and try to tear me down I will be rising from the ground Like a skyscraper, like a skyscraper Go, run, run, run Im gonna stay right Here Watch you disappear Go, run, run, run Yeah its a Long way down, but i am closer to the clouds up here You can take everything i have You can break everthing i am Like im made of glass, like im made of paper Oh, oh  Go on and try to tear me down I will be rising from the ground Like a skyscraper Like a skyscraper (Like a skyscraper) Like a skyscraper Like a skyscraper",0.9894,1,6,0,4,3,2,5,2,4,3
72,/songs/572392,Shawn Mendes,Something Big,https://genius.com/Shawn-mendes-something-big-lyrics,http://api.genius.com/songs/572392,Handwritten,2014-11-07," One, two, three, four... Oh, woah, woah, oh, woah Oh, woah, woah, oh, woah   Play the Lotto, you might win it It's like 25 to life so you bust outta prison Something's in the air, something's in the air It's like that feeling when you're just about to kill it Take your last shot, you know you're gonna hit it Something's in the air, something's in the air, woah   Something big, I feel it happening Out of my control Pushing, pulling and it's grabbing me Feel it in my bones Like oh, woah, woah, oh, woah Something big, I feel it happening Oh, woah, woah, oh, woah Something big   It's like that feeling when you're about to win the medal And you worked so hard, that you knew you wouldn't settle Hands are in the air, hands are in the air When they hear you when you thought they wouldn't listen It's like an anthem that the whole world's singing Hands are in the air, hands are in the air, woah   Something big, I feel it happening Out of my control Pushing, pulling and it's grabbing me Feel it in my bones Like oh, woah, woah, oh, woah Something big, I feel it happening Oh, woah, woah, oh, woah Something big   Woah, yeah, yeah If we stomp our feet, the ground will shake If we clap our hands, the walls will break Yell so loud, won't forget our names 'Cause something big is happening Take this spark and start a fire Raise this up, we're feeling higher They can't tell us anything Something big is happening   Something big, I feel it happening Out of my control Pushing, pulling and it's grabbing me Feel it in my bones Like oh, woah, woah, oh, woah Something big is happening, oh Oh, woah, woah, oh, woah Something big, I feel it happening, oh",0.9738,7,7,3,8,5,9,5,6,7,6
