,api_path,primary_artist,title,url,song_endpoint,album,release_date,lyrics,polarity,anger,anticipation,disgust,fear,joy,negative,positive,sadness,surprise,trust
45,/songs/3592379,Shawn Mendes,Lost in Japan,https://genius.com/Shawn-mendes-lost-in-japan-lyrics,http://api.genius.com/songs/3592379,Shawn Mendes,2018-03-23," All it'd take is one flight We'd be in the same time zone Looking through your timeline Seeing all the rainbows, I I got an idea And I know that it sounds crazy I just wanna see ya Oh, I gotta ask   Do you got plans tonight? I'm a couple hundred miles from Japan, and I I was thinking I could fly to your hotel tonight 'Cause I-I-I can't get you off my mind Can't get you off my mind Can't get you off my mind (oh)   I could feel the tension We could cut it with a knife I know it's more than just a friendship I can hear you think I'm right, yeah Do I gotta convince you That you shouldn't fall asleep? It'll only be a couple hours And I'm about to leave   Do you got plans tonight? I'm a couple hundred miles from Japan, and I I was thinking I could fly to your hotel tonight 'Cause I-I-I can't get you off my mind Can't get you off my mind Can't get you off my mind Do you got plans tonight? I was hoping I could get lost in your paradise The only thing I'm thinking 'bout is you and I 'Cause I-I-I can't get you off my mind Can't get you off my mind I can't seem to get you off my mind   Let's get lost tonight (oh) Let's get lost tonight Baby, you and I can't seem to get you off my mind Let's get lost tonight Let's get lost tonight Baby, you and I can't seem to get you off my mind Oh-oh-oh-oh   Do you got plans tonight? I'm a couple hundred miles from Japan, and I I was thinking I could fly to your hotel tonight 'Cause I-I-I can't get you off my mind I can't get you off my mind Do you got plans tonight, baby? I was hoping I could get lost in your paradise The only thing I'm thinking 'bout is you and I And I-I-I can't get you off my mind Can't get you off my mind I can't seem to get you off my mind, yeah   Let's get lost tonight (oh) Let's get lost tonight (oh) Baby, you and I can't seem to get you off my mind Let's get lost tonight (oh) Let's get lost tonight (oh) Baby, you and I can't seem to get you off my mind",-0.5262,4,7,0,1,6,15,7,13,1,2
46,/songs/4090480,Shawn Mendes,Lost in Japan - Recorded at Spotify Studios NYC,https://genius.com/Shawn-mendes-lost-in-japan-recorded-at-spotify-studios-nyc-lyrics,http://api.genius.com/songs/4090480,Spotify Singles,2018-11-14," All it'd take is one flight We'd be in the same time zone, yeah Looking through your timeline Seeing all the rainbows, I I got an idea And I know that it sounds crazy, baby I just wanna see ya All I gotta ask   Do you got plans tonight? I'm a couple hundred miles from Japan, and I I was thinking I could fly to your hotel tonight baby 'Cause I-I-I can't get you off my mind Can't get you off my mind Can't get you off my mind (yeah)   I could feel the tension We could cut it with a knife I know it's more than just a friendship I can hear you think I'm right, yeah Do I gotta convince you That you shouldn't fall asleep? It'll only be a couple hours And I'm about to leave yeah No I'm about to leave   Do you got plans tonight baby? I'm a couple hundred miles from Japan, and I I was thinking I could fly to your hotel tonight baby 'Cause I-I-I can't get you off my mind Can't get you off my mind Can't get you off my mind Do you got plans tonight? I was hoping I could get lost in your paradise And the only thing I'm thinking 'bout is you and I (oh) 'Cause I-I-I can't get you off my mind Can't get you off my mind I can't seem to get you off my mind yeah   Let's get lost tonight (oh) Let's get lost tonight Baby, you and I can't seem to get you off my mind Let's get lost tonight Let's get lost tonight Baby, you and I can't seem to get you off my mind yeah Oh-oh-oh-oh   Do you got plans tonight baby? I'm a couple hundred miles from Japan, and I I was thinking I could fly to your hotel tonight, yeah 'Cause I-I-I can't get you off my mind Said I can't get you off my mind Do you got plans tonight, baby? I was hoping I could get lost in your paradise The only thing I'm thinking 'bout is you and I 'Cause I-I-I can't get you off my mind Can't get you off my mind I can't seem to get you off my mind, yeah   Let's get lost tonight (oh) Let's get lost tonight (oh) No I can't seem to get you off my mind Let's get lost tonight (oh) Let's get lost tonight (oh) Baby, you and I can't seem to get you off my mind",0.6025,4,7,0,1,10,16,11,14,2,2
47,/songs/3727209,Shawn Mendes,Love Me Or Leave Me,https://genius.com/Shawn-mendes-love-me-or-leave-me-lyrics,http://api.genius.com/songs/3727209,None,2019-03-08," Love me or leave me, hm Swear I want to be there, be there, be there If I told you my secrets And I showed you my weakness  Things that I think about Can I let it out?  The air in my lungs when I can't breathe And sometimes...",0.3182,0,0,0,0,1,2,2,1,1,2
48,/songs/2357419,Shawn Mendes,Memories,https://genius.com/Shawn-mendes-memories-lyrics,http://api.genius.com/songs/2357419,Handwritten Revisited,2015-11-20," When I wake up to your footsteps As you get up out of bed They make a song that sounds so simple But it dances in my head A melody so perfect That it gets me through the day And the thought of us forever Is one that won't ever go away   All I need to know is Where to start Take my hand and show me forever So never will I ever let you go   So let's hold on together To this paper and this pen And write down every letter To every word we've ever said   All I need to know is Where to start Take my hand and show me forever So never will I ever let you go   Let's write our story And let's sing our song Let's hang our pictures on the wall All these precious moments That we carved in stone Are only memories after all Memories after all Memories after all   You know You gave me hope But I've got to let go I've got to let go, oh It's taking its toll Deep in my soul Now I've got to let go   We wrote our story And we sang our songs We hung our pictures on the wall Now those precious moments That we carved in stone Are only memories after all",0.9863,2,9,0,0,6,2,7,1,3,7
49,/songs/3855902,Shawn Mendes,Mercy (MTV Unplugged),https://genius.com/Shawn-mendes-mercy-mtv-unplugged-lyrics,http://api.genius.com/songs/3855902,MTV Unplugged,2017-11-03," You've got a hold on me Don't even know your power I stand a hundred feet But I fall when I'm around ya Show me an open door And you go and slam it on me And I can't take any more   I'm saying Baby, please have mercy on me And take it easy on my heart Even though you don't mean to hurt me No, you keep tearing me apart Would you please have mercy, mercy on my heart? Would you please have mercy, mercy, yeah, on my heart?   I'd drive through the night Just to be near you, baby (say it) Heart open, testify Tell me that I'm not crazy I'm not askin' for a lot Just that you're honest with me And my pride is all I got   So I'm saying Baby, please have mercy on me And take it easy on my heart Even though you don't mean to hurt me No, you keep tearing me apart Would you please have mercy on me? And I'm a puppet on your strings And even though you got good intentions No, I need you to set me free Would you please have mercy, mercy, yeah, on my heart? Would you please have mercy, oh mercy yeah, on my heart?   Consuming all the air inside my lungs Ripping all the skin from off my bones I'm prepared to sacrifice my life I would gladly do it twice Consuming all the air inside my lungs Ripping all the skin from off my bones I'm prepared to sacrifice my life I would gladly do it twice   Oh, please have mercy on me, yeah Take it easy on my heart Even though you don't mean to hurt me, say it! You keep tearing me apart Would you please have mercy on me? And I'm a puppet on your string No, And even though you got good intentions I need you to set me free I'm begging you for mercy, yeah, yeah Would you please have mercy, yeah, mercy, oh",0.9993,6,4,1,6,7,7,29,6,3,10
50,/songs/3601757,Shawn Mendes,Moving Too Fast,https://genius.com/Shawn-mendes-moving-too-fast-lyrics,http://api.genius.com/songs/3601757,None,2013-01-01,"Did I just hear an alarm start ringing? Did I see sirens go flying past? Though I don't know what tomorrow's bringing I've got a singular impression Things are moving too fast  I'm gliding smooth as a figure skater I'm riding hot as a rocket blast I just expected it ten years later I've got a singular impression Things are moving too fast  And you say oh no Step on the brakes Do whatever it takes But stop this train Slow, slow the lights turning red  But I say no no Whatever I do I barrel on though And I don't complain No matter what I try I'm flying full speed ahead  I'm never worried to walk the wire I won't do anything just half assed But with the states getting somewhat higher I've got a singular impression Things are moving too fast  I found a woman I love And I found an agent who loves me Things might get brumby but some people analyze every detail Some people stall when they can't see the trail Some people freeze out of fear that they'll fail But I keep rollin' on  Some people can't get success with their art Some people never feel love in their heart Some people can't tell the two things apart But I keep rollin' on  And oh, maybe I can't follow through But oh, what else am I supposed to do?  I dreamed of writing like the high and mighty Now I'm the subject of a bidding war I met my personal Aphrodite I'm doing things I never dreamed of before  We start to take the next step together Found an apartment on seventy-third The Atlantic Mounthly's printing my first chapter Two thousand bucks without rewriting one word  I left Columbia and I don't regret it I wrote a book and Sonny Mehta read it My heart's been stolen My ego's rolling I just keep rollin' along...  And I think Well, well, what else is in store? Got all this and more before twenty-four It's hard not to be sure I'm spinning out of control Out of control  I'm feeling panicked and rushed and hurried I'm feeling outmaneuvered and outclassed But I'm so happy I can't get worried About this singular impression I've got a singular impression things are moving too fast",0.9346,9,11,3,11,12,15,27,7,6,12
51,/songs/3677125,Shawn Mendes,Mutual,https://genius.com/Shawn-mendes-mutual-lyrics,http://api.genius.com/songs/3677125,Shawn Mendes,2018-05-25," I want you close to me I want you close, I want you closer But when you're here with me It's hard to tell just what you're after   You say, you want all of me today But tomorrow's not the same My feelings never change What do you want from me? What do you want, uh?   I need to know If this is mutual Before I go And get way too involved I want you bad Can you reciprocate? No, I don't want to have to leave But half of you's not enough for me   This inconsistency, what does it mean? You got me questioning, the way you act and take it back Do I mean anything? Just tell me honestly   You say, you want all of me today But tomorrow's not the same My feelings never change What do you want from me? What do you want, uh?   I need to know If this is mutual Before I go And get way too involved I want you bad Can you reciprocate? No, I don't want to have to leave But half of you's not enough for me   Are you playin' me, is this a game? When you show up late, say love at 2 A.M Then tell me you can't stay, girl, yeah What do you want from me? Baby, oh   I need to know If this is mutual Before I go And get way too involved I want you bad, baby Can you reciprocate? No, I don't want to have to leave But half of you's not enough for me",-0.8733,5,4,5,7,5,10,14,9,5,6
52,/songs/3677109,Shawn Mendes,Nervous,https://genius.com/Shawn-mendes-nervous-lyrics,http://api.genius.com/songs/3677109,Shawn Mendes,2018-05-23," I saw you on a Sunday in a café And all you did was look my way And my heart started to race And my hands started to shake, yeah I heard you asked about me through a friend My adrenaline kicked in 'Cause I've been askin' 'bout you too And now we're right here in this room   I get a little bit nervous around you Get a little bit stressed out when I think about you Get a little excited Baby, when I think about you, yeah Talk a little too much around you (I talk a little too much, yeah) Get a little self-conscious when I think about you (I get a little self-conscious) Get a little excited (I get a little excited) Baby, when I think about you, yeah Yeah, when I think about you, babe   We walked in the rain a couple blocks to your apartment You told me to come inside, caught me staring in your eyes And I'm not usually like this But I like what you're doing to me, ah, what you're doing to me   I get a little bit nervous around you (I get a little bit nervous) Get a little bit stressed out when I think about you (I get a little bit stressed out) Get a little excited (I get a little excited) Baby, when I think about you, yeah Yeah, when I think about you, babe (oh yeah) Talk a little too much around you (I talk a little too much, yeah) Get a little self-conscious when I think about you (I get a little self-conscious) Get a little excited (I get a little excited) Baby, when I think about you Yeah, when I think about you, babe   You got me acting like I've never done this before I promise I'll be ready when I walk through the door And I don't know why No, I don't know why Yeah   I get a little bit nervous around you (I get a little bit nervous) Get a little bit stressed out when I think about you (I get a little bit stressed out) Get a little excited (I get a little excited) Baby, when I think about you, yeah Yeah, when I think about you, babe Talk a little too much around you (I talk a little too much, baby) Get a little self-conscious when I think about you (I get a little self-conscious) Get a little excited (I get a little excited) Baby, when I think about you Yeah, when I think about you, babe",0.9663,1,17,0,5,20,7,28,0,11,15
53,/songs/3855903,Shawn Mendes,Never Be Alone (MTV Unplugged),https://genius.com/Shawn-mendes-never-be-alone-mtv-unplugged-lyrics,http://api.genius.com/songs/3855903,MTV Unplugged,2017-11-03," Thank you guys so much I think uh, I don't, I don't really know how to explain this I guess it's actually pretty simple, but Um, when I'm onstage, and I'm performing, uh A lot of the time, this is a very intimidating thing to do As you could imagine, um, but You guys are always so incredible every single time I perform Singing your hearts out, and As a performer And more than that, as a person, that means the world to me And it helps me, and I love it, and thank you so much for that So yeah, I just wanna say that   Oh oh oh oh oh Oh oh oh oh oh   I promise that one day I'll be around I'll keep you safe, I'll keep you sound Right now it's pretty crazy And I don't know how to stop or slow it down   Hey, I know there are some things we need to talk about But I can't stay, so let me hold you for a little longer now   Take a piece of my heart and make it all your own So when we are apart, you'll never be alone You'll never be alone   Oh oh oh oh oh Oh oh oh oh oh   You'll never be alone When you miss me close your eyes I may be far, but never gone When you fall asleep tonight, just remember that we lay under the same stars   Hey, I know there are some things we need to talk about But I can't stay, so let me hold you for a little longer now   And take a piece of my heart and make it all your own So when we are apart, you'll never be alone You'll never be alone   Oh oh oh oh oh Oh oh oh oh oh You'll never be alone Oh oh oh oh oh Oh oh oh oh oh   Take a piece of my heart and make it all your own So when we are apart, you'll never be alone You'll never be alone",0.9861,1,5,0,1,6,2,13,2,1,9
54,/songs/3601773,Shawn Mendes,Never Let Me Go,https://genius.com/Shawn-mendes-never-let-me-go-lyrics,http://api.genius.com/songs/3601773,None,2014-01-01,"I'm... Making my way down this road Feel the chill to the road And I can barely see the lights Wonder if she'll be here tonight  When I see her in my dreams There's flowers blooming these are the tree's Been searching for so long, yeah I think it's bout time that I found this girl  And if you come with me Promise you'll never bleed I'm never gonna let you gooo  Let me take you home I'll be the one you want You'll never wanna see me gooo  Life can pass you by so quick I didn't know it but my line is growing thick And now I think I found the one, yeah That I've been searching for so long  And if you come with me Promise you'll never bleed I'm never gonna let you gooo  Let me take you home I'll be the one you want You'll never wanna see me gooo  Just push the roads aside Wanted to see you smile And now I'm feeling so strong Done walking down this road Got what I want  And you're coming with me  And if you come with me Promise you'll never bleed I'm never gonna let you gooo  Let me take you home I'll be the one you want You'll never wanna see me go  And if you come with me Promise you'll never bleed I'm never gonna let you gooo  Let me take you home I'll be the one you want You'll never wanna see me go",0.9837,3,6,2,1,9,2,9,1,3,9
55,/songs/2853888,Shawn Mendes,No Promises,https://genius.com/Shawn-mendes-no-promises-lyrics,http://api.genius.com/songs/2853888,Illuminate,2015-09-23," Staring out my hotel window Too much on my mind Maybe we should keep it simple We don't have to decide   Oh no, we don't need to overcomplicate it Cause I've been here once before don't even say It   Baby please no promises Cause we won't keep our promises And I know the consequences So baby please, baby please no promises   I've never been a fan of heartbreak So tell me what you want Take my hands across your body We don't have to hold on   Oh no, we don't need to overcomplicate it Cause I've been here once before, don't even say It   Baby please no promises Cause we won't keep our promises And I know the consequences So baby please, baby please no promises   Cause I've been living only for this moment And I don't wanna let it slip away I've been living only for this moment And I don't know how much that I can take, yeah   Baby please no promises Cause we won't keep our promises And I know the consequences So baby please, baby please no promises Yeah baby, please no promises Baby please no promises Baby please Baby please no promises",0.9848,0,0,0,0,25,2,33,0,1,20
56,/songs/486030,Shawn Mendes,One of Those Nights,https://genius.com/Shawn-mendes-one-of-those-nights-lyrics,http://api.genius.com/songs/486030,The Shawn Mendes - EP,2014-07-28," Time warp in the middle of a daydream Call you up ‘cause the time is wasting Last drive, we got nowhere to go Fear not, yeah, welcome to the jungle Think fast, move quick, don’t stumble We can’t do this alone   Where do we go? We don’t know Follow the wind, where it blows Let’s make mistakes and don’t look back It’s now or never   One of those nights we felt invincible And every glass was full, one of those nights One of those nights, dancing in the stars Thought that the world was ours, one of those nights   We’re young livin' with no fear Kids runnin' wild, girls cryin' drunk tears We don’t have this time for long Yeah, we make big plans, spending all our change Caught up in the night, oh, we missed the last train It’s that time, and we’re leaving, home   Where do we go? We don’t know Follow the wind, where it blows Let’s make mistakes and don’t look back It’s now or never   One of those nights we felt invincible And every glass was full, one of those nights One of those nights, dancing in the stars Thought that the world was ours, one of those nights   I wanna hold on tight to a little of this The kinda night you don’t wanna miss Time of our lives, one of those nights I wanna hold on tight to a little of this The kinda night you don’t wanna miss Time of our lives, one of those nights   Go home it’s over, but it’s not the end Don’t wait ‘til you’re older to begin Keep your composure and innocence Where do we go? We don’t know One of those nights, we’re driving around In this boring ass town One of those nights   I wanna hold on tight to a little of this The kinda night you don’t wanna miss Time of our lives, one of those nights   One of those nights we felt invincible And every glass was full, one of those nights One of those nights, dancing in the stars Thought that the world was ours, one of those nights   I wanna hold on tight to a little of this The kinda night you don’t wanna miss Time of our lives, one of those nights One of those nights, where she turns the lights down And it’s only us now, one of those nights",-0.849,3,18,1,5,4,10,21,5,2,15
57,/songs/3677139,Shawn Mendes,Particular Taste,https://genius.com/Shawn-mendes-particular-taste-lyrics,http://api.genius.com/songs/3677139,Shawn Mendes,2018-05-25," She don't listen to a thing, 'less it feels right Only dances when it's Kanye She could take you one-on-one if she feels like You'll be begging her for mercy, mercy   Ooh, she'll take your name and number Then she'll hit erase and walk away But ooh, she's so specific when she's at my place At my place   She's got particular taste, yeah She's so obsessed with the chase, yeah She don't waste time on conversations, no She just goes right for the face, yeah She's so particular   Never pickin' up her phone 'less it rings twice Only answers with a question, ""Mhm?"" If I try to play it cool, it never goes right Got me drownin', drownin', ah   Ooh, she'll take your name and number Then she'll hit erase and walk away But ooh, she's so specific when she's at my place At my place   She's got particular taste, yeah She's so obsessed with the chase, yeah She don't waste time on conversations, no She just goes right for the face, yeah (she just goes, she)   She's so particular I'm so obsessed with her, yeah She's so particular I'm so obsessed with her, yeah She's so particular   She's the best at getcha' thinkin' that she don't care Knows exactly what she wants, uhh Now she's runnin' all her fingers right through my hair And it means that   She's got particular taste (she's got particular taste) She's so obsessed with the chase, yeah She don't waste time on conversations, no She just goes right for the face, yeah (she just goes, she)   She's so particular I'm so obsessed with her, yeah She's so particular (she just goes, she) I'm so obsessed with her, yeah (she's so particular, she just goes) She's got particular taste",0.9835,2,3,3,2,1,11,10,0,0,6
58,/songs/2853895,Shawn Mendes,Patience,https://genius.com/Shawn-mendes-patience-lyrics,http://api.genius.com/songs/2853895,Illuminate,2016-09-23," You hit me up, it's late at night This is the same old story Your friends should take your phone away I always give in when you tell me lies to reassure me I always make the same mistakes, yeah   Ooh, you give me a little taste Lure me in, then you take it from me Oh, I hate that I love it 'Cause you're driving me crazy   First you say you love me, then you say you don’t I wake up in the mornin', and I'm all alone Tell me that you willing, then you say you won't Can you make your mind up? Please, I'm losin' my patience You know I'm losin' my patience, yeah   I'm in your room, it's just us two I feel you getting closer You rest your head upon my chest, yeah Deep down I know that this should be the last time I come over You always leave me such a mess   Ooh, you give me a little taste Lure me in, then you take it from me Oh, I hate that I love it 'Cause you're driving me crazy   First you say you love me, then you say you don’t I wake up in the mornin', and I'm all alone Tell me that you willing, then you say you won't Can you make your mind up? Please I'm losin' my patience You know I'm losin' my patience, yeah   And you gotta stop, if you know So I can start, letting go 'Cause it's drivin' me crazy Yeah, you keep drivin' me crazy   When you say you love me, then you say you don’t I wake up in the mornin', and I'm all alone Tell me that you willing, then you say you won't Yeah, you're driving me crazy   First you say you love me, then you say you don’t I wake up in the mornin', and I'm all alone Tell me that you willing, then you say you won't Can you make your mind up? Please I'm losin' my patience You know I'm losin' my patience, yeah Please, I'm losing my patience, yeah",0.963,10,9,4,7,7,16,20,12,1,13
