,api_path,primary_artist,title,url,song_endpoint,album,release_date,lyrics,polarity,anger,anticipation,disgust,fear,joy,negative,positive,sadness,surprise,trust
31,/songs/3601797,Shawn Mendes,Here,https://genius.com/Shawn-mendes-here-lyrics,http://api.genius.com/songs/3601797,None,2014-01-01,"I'm sorry if I seem uninterested No I'm not listenin' or I'm indifferent And truly, I ain't got no business here But since my friends are here I just came to kick it but really I would rather be at home all by myself not in this room With people who don't even care about my well-being I don't dance, don't ask, I don't need a girlfriend So you can go back, please enjoy your party I'll be here, somewhere in the corner waiting for this to be over With this girl who's hollering I can hardly hear Over this music I don't listen to and I don't wanna get with you So tell my friends that I'll be over here  Oh oh oh here oh oh oh here oh oh oh I ask myself what am I doing here? Oh oh oh here oh oh oh here And I can't wait till we can break up outta he-  Excuse me if I seem a little unimpressed with this An anti-social pessimist but usually I don't mess with this And I know you mean only the best and Your intentions aren't to bother me But honestly I'd rather be Somewhere with my people we just kick it and just listen To some music with the message like we usually do And we'll discuss our big dreams How we plan to take over the planet So pardon my manners, I hope you'll understand it That I'll be here Not there in the kitchen with this girl Who's always gossiping about her friends So tell them I'll be here Right next to this boy who's throwing up cause He can't take what's in his cup no more Oh God why am I here?  Oh oh oh here oh oh oh here oh oh oh I ask myself what am I doing here? Oh oh oh here oh oh oh here And I can't wait till we can break up outta here  Hours later congregating next to the refrigerator Some girl's talking bout her haters She ain't got none How did it ever come to this I shoulda never come to this So holla at me I'll be in the car when you're done I'm standoffish, don't want what you're offering And I'm done talking Awfully sad it had to be this way So tell my people that I'm ready when their ready And I'm standing by the TV with my beanie low Yo I'll be over here  And I'll be over here No I'll be over here No I'll be over here",0.9897,3,8,2,2,9,12,19,4,3,16
32,/songs/2853898,Shawn Mendes,Hold On,https://genius.com/Shawn-mendes-hold-on-lyrics,http://api.genius.com/songs/2853898,Illuminate,2016-09-23," Stop, take it in And I breathe for a minute I think too much when I'm alone I never win when I Keep all my thoughts inside So I'll pick up the phone   And my dad says, ""Shawn, stay with me Everything will be alright I know I haven’t seen you lately But you’re always on my mind""   I don't know what You’re going through But there’s so much life Ahead of you And it won’t slow down No matter what you do So you just gotta hold on All we can do is hold on, yeah   These days are flying by Weeks feel like minutes I can't remember being small I try to figure it out I can't seem to find out how I guess I don't know much at all   And my dad says ""Shawn, stay with me Everything will be alright I know I haven’t seen you lately But you’re always on my mind""   I don't know what You’re going through But there’s so much life Ahead of you And it won’t slow down No matter what you do So you just gotta hold on All we can do is hold on, yeah   All we can do is hold on Yeah, you just gotta hold on Just, just hold on Just hold on for me   And my dad says ""Shawn, stay with me Everything will be alright.""   I don't know what You’re going through But there’s so much life Ahead of you And it won’t slow down No matter what you do So you just gotta hold on All we can do is hold on, yeah Yeah, you just gotta hold on Just hold on for me",0.8467,0,1,0,1,0,1,11,0,1,6
33,/songs/2853893,Shawn Mendes,Honest,https://genius.com/Shawn-mendes-honest-lyrics,http://api.genius.com/songs/2853893,Illuminate,2016-09-23," Hey, how's it going? Can you meet me down on Adelaide Street? Can you talk for a moment? There's no way to say this that easily And everything I said, I swear I meant it I need to tell you that this isn't your fault And I know that I'll probably regret it And it kills me cause the worst part of all   Is that I hate to hurt you But I got to be honest I can't give you what you need, oh You deserve more than I can promise And I'm just tryna, I'm just tryna Baby, I'm just tryna be honest, yeah I'm tryna be honest with ya You know that I'm sorry But I'm tryna be honest with ya   Hey, can you listen? I swear to God to you, there's nobody else You're gonna say that I'm lying When I tell you every feeling I felt Was honest and sincere in that you were different And when we kissed I felt like that kid in love, yeah And I know that I'll probably regret it I might wish I never said this at all   Oh I hate to hurt you But I got to be honest I can't give you what you need, oh You deserve more than I can promise And I'm just tryna, I'm just tryna Baby, I'm just tryna be honest, yeah I'm tryna be honest with ya You know that I'm sorry But I'm tryna be honest with ya   Oh, oh, oh I don't wanna see you cry Oh, oh, oh Swear that I don't wanna see you cry   'Cause I hate to hurt you But I got to be honest I can't give you what you need, oh You deserve more than I can promise And I'm just tryna, I'm just tryna Baby I'm just tryna be honest I hate to hurt you But I got to be honest I can't give you what you need, oh You deserve more than I can promise And I'm just tryna, I'm just tryna Baby I'm just tryna be honest",0.9939,27,6,19,24,24,16,35,28,1,29
34,/songs/745062,Shawn Mendes,I Don't Even Know Your Name,https://genius.com/Shawn-mendes-i-dont-even-know-your-name-lyrics,http://api.genius.com/songs/745062,Handwritten,2015-04-14," Oh, you waited so long Sometimes it's hard to stand out And you don't have to do anything else But be yourself You, you dressed up so nice But all I could see was your eyes Then the crowd came and pulled you away Then you were gone   And I don't even know your name All I remember is that smile on your face And it'll kill me every day Cause I don't even know your name   Everywhere that I go I see your face and it kills me to know That you'll never know what you did to me And now you're gone, yeah, I can't stop thinking about you   Cause I don't even know your name All I remember is that smile on your face And it'll kill me every day Cause I don't even know your name Yeah I don't even know your name   I'm running, I'm searching, and I don't know where to start I'm dying, my love, you punched a hole right through my heart And I won't stop, stop looking until I hold you in my arms Cause I'm running, I'm running, I'm running I'm running, I'm searching, and I don't know where to start I'm dying, my love, you punched a hole right through my heart And I won't stop, stop looking until I hold you in my arms Cause I'm running, I'm running, I'm running   And I don't even know your name All I remember is that smile on your face And it'll kill me every day Cause I don't even know your name",0.9317,2,3,2,6,5,6,15,6,3,13
35,/songs/4507577,Shawn Mendes,If I Can't Have You,https://genius.com/Shawn-mendes-if-i-cant-have-you-lyrics,http://api.genius.com/songs/4507577,SM4*,2019-05-03," I can't write one song that's not about you Can't drink without thinking about you Is it too late to tell you that Everything means nothing if I can't have you?   I'm in Toronto and I got this view But I might as well be in a hotel room, yeah It doesn't matter 'cause I'm so consumed Spending all my nights reading texts from you   Oh, I'm good at keeping my distance I know that you're the feeling I'm missing You know that I hate to admit it But everything means nothing if I can't have you   I can't write one song that's not about you Can't drink without thinking about you Is it too late to tell you that Everything means nothing if I can't have you? I can't write one song that's not about you Can't drink without thinking about you Is it too late to tell you that Everything means nothing if I can't have you?   I'm so sorry that my timing's off But I can't move on if we're still gonna talk Is it wrong for me to not want half? I want all of you, all the strings attached   Oh, I'm good at keeping my distance I know that you're the feeling I'm missing You know that I hate to admit it But everything means nothing if I can't have you   I can't write one song that's not about you Can't drink without thinking about you Is it too late to tell you that Everything means nothing if I can't have you? I can't write one song that's not about you Can't drink without thinking about you Is it too late to tell you that Everything means nothing if I can't have you?   I'm trying to move on, forget you, but I hold on Everything means nothing, everything means nothing, babe I'm trying to move on, forget you, but I hold on Everything means nothing if I can't have you, no   I can't write one song that's not about you Can't drink without thinking about you Is it too late to tell you that Everything means nothing if I can't have you? (Can't have you) I can't write one song that's not about you Can't drink without thinking about you Is it too late to tell you that Everything means nothing if I can't have you?",-0.8409,4,4,4,6,4,16,6,13,4,4
36,/songs/745068,Shawn Mendes,Imagination,https://genius.com/Shawn-mendes-imagination-lyrics,http://api.genius.com/songs/745068,Handwritten,2015-04-14," Oh, there she goes again, every morning it's the same You walk on by my house, I wanna call out your name I wanna tell you how beautiful you are from where I'm standin' You got me thinkin' me what we could be 'cause   I keep craving, craving, you don't know it but it's true Can't get my mouth to say the words they wanna say to you This is typical of love, I can't wait anymore, won't wait I need to tell you how I feel when I see us together forever   In my dreams you're with me, we'll be everything I want us to be And from there, who knows? Maybe this will be the night that we kiss for the first time Or is that just me and my imagination?   We walk, we laugh, we spend our time walking by the ocean side Our hands are gently intertwined, a feeling I just can't describe And all this time we spent alone thinkin' we cannot belong To something so damn beautiful, so damn beautiful   I keep craving, craving, you don't know it but it's true Can't get my mouth to say the words they wanna say to you This is typical of love, I can't wait anymore, won't wait I need to tell you how I feel when I see us together forever   In my dreams you're with me, we'll be everything I want us to be And from there, who knows? Maybe this will be the night that we kiss for the first time Or is that just me and my imagination? (Woah, oh)   Imagination (Woah, oh, woah, oh) Imagination (Woah, oh) (Woah, oh, woah, oh, woah, oh, ooh)   In my dreams you're with me, we'll be everything I want us to be And from there, who knows? Maybe this will be the night that we kiss for the first time Or is that just me and my imagination?   I keep craving, craving, you don't know it but it's true Can't get my mouth to say the words they wanna say to you",0.9962,3,19,3,1,13,8,19,1,8,10
37,/songs/2478114,Shawn Mendes,Island,https://genius.com/Shawn-mendes-island-lyrics,http://api.genius.com/songs/2478114,None,2016-06-03,"Lyrics will be available when ""Island"" is released on June 3rd, 2016. Stay tuned and check back in when it's released for lyrics and annotations!   I won't lie to you",0.0,1,0,1,0,0,1,0,1,0,0
38,/songs/740708,Shawn Mendes,Kid in Love,https://genius.com/Shawn-mendes-kid-in-love-lyrics,http://api.genius.com/songs/740708,Handwritten,2015-04-14," I know that we just met and maybe this is dumb But it feels like there was something from the moment that we touched Cause it’s alright, it’s alright I wanna make you mine The way you’re lighting up the room caught the corner of my eye We can both sneak out the back door, we don’t have to say goodbye Cause it’s alright, it’s alright To waste time tonight   Maybe I’m just a kid in love Maybe I’m just a kid in love, oh baby If this is what it’s like falling in love Then I don’t ever wanna grow up Maybe I’m just a kid in love Maybe I’m just a kid in love, oh baby It’d be cool if it was the two of us But I don’t ever wanna grow up Cause I got it all and I got it all But I don’t ever wanna grow up   Said your place is kinda close and your 'rents are out of town Baby there’s no pressure, but if you’re down I’m down Cause it’s alright, it’s alright To just talk tonight If you’re feeling kinda crazy, turn down the lights We can take our time, do whatever you like It’s alright, it’s alright I wanna make you mine   Maybe I’m just a kid in love Maybe I’m just a kid in love, oh baby If this is what it’s like falling in love Then I don’t ever wanna grow up Maybe I’m just a kid in love Maybe I’m just a kid in love, oh baby It’d be fine if it was the two of us But I don’t ever wanna grow up Cause I got it all and I got it all But I don’t ever wanna grow up Cause I got it all and I got it all But I don’t ever wanna grow up   You make me feel like I got it all And you make me feel like I’m just a kid in love And you make me feel like I got it all And you make me feel like I don’t ever wanna grow up   Maybe we’re just kids in love Maybe we’re just kids in love, oh baby If this is what it’s like falling in love Then we don’t ever have to grow up Maybe we’re just kids in love Maybe we’re just kids in love, oh baby When we’re alone and it’s the two of us I can’t get enough I’ve got it all, yeah yeah, I’ve got it all, yeah And I’ve got it, and I’ve got it all And I’ve got it, and we’ve got it all And I’ve got it, and I’ve got it all, but I don’t ever wanna grow up",0.9993,3,13,2,3,34,10,47,5,2,22
39,/songs/2223715,Shawn Mendes,Kid In Love - Preview,https://genius.com/Shawn-mendes-kid-in-love-preview-lyrics,http://api.genius.com/songs/2223715,None,2019-03-08,"And I know that we just met And maybe this is dumb But it feels like there was something From the moment that we touched 'Cause, it's alright, it's alright I wanna make you mine The way you're lightin' up the room Caught the corner of my eye We can both sneak out the back door We don't have to say goodbye 'Cause, it's alright, it's alright To waste time tonight Maybe I'm just a kid in love Maybe I'm just a kid in love Oh, baby If this is what it's like falling in love Then I don't ever wanna grow up Maybe I'm just a kid in love Maybe I'm just a kid in love Oh, baby It'd be cool if it's the two of us But I don't ever wanna grow up 'Cause I got it all Oh And I got it all But I don't ever wanna grow up Said, your place is kinda cozy Your 'rents are out of town Baby, there's no pressure But if you're down, I'm down 'Cause, it's alright, it's alright Just start tonight If you're feeling kinda crazy Turn down the lights We can take our time Do whatever you like It's alright, it's alright I wanna make you mine Maybe I'm just a kid in love Maybe I'm just a kid in love Oh, baby If this is what it's like falling in love Then I don't ever wanna grow up Maybe I'm just a kid in love Maybe I'm just a kid in love Oh, baby It'd be fine if it's the two of us But I don't ever wanna grow up 'Cause I got it all Oh And I got it all And I don't ever wanna grow up 'Cause I got it all Oh And I got it all But I don't ever wanna grow up You make me feel like I got it all, yeah And you make me feel like I'm just a kid in love And you make me feel like I got it all And you make me feel like I don't ever wanna grow up Maybe we're just kids in love Maybe we're just kids in love Oh baby If this is what it's like falling in love Then we don't ever have to grow up Maybe we're just kids in love Maybe we're just kids in love Oh baby When we're alone and it's the two of us I can't get enough I've got it all, yeah I've got it all, yeah And I've got it, and I've got it all And I've got it, and we've got it all And I've got it, and I've got it all But I don't ever wanna grow up, ooh yeah",0.9993,3,14,2,3,34,10,46,5,2,22
40,/songs/461200,Shawn Mendes,Life of the Party,https://genius.com/Shawn-mendes-life-of-the-party-lyrics,http://api.genius.com/songs/461200,Handwritten,2014-06-26," I love it when you just don't care I love it when you dance like there's nobody there So when it gets hard, don't be afraid We don't care what them people say I love it when you don't take no I love it when you do what you want 'cause you just said so Let them all go home, we out late We don't care what them people say   We don't have to be ordinary Make your best mistakes 'Cause we don't have the time to be sorry So baby be the life of the party I'm telling you to take your shot it might be scary Hearts are gonna break 'Cause we don't have the time to be sorry So baby be the life of the party   Together we can just let go Pretend like there's no one else here that we know Slow dance fall in love as the club track plays We don't care what them people say   We don't have to be ordinary Make your best mistakes 'Cause we don't have the time to be sorry So baby be the life of the party I'm telling you to take your shot it might be scary Hearts are gonna break 'Cause we don't have the time to be sorry So baby be the life of the party   Come out tonight, come out tonight There's no one standing in your way Come out tonight, come out tonight We don't care what them people say We don't care what them people say   We don't have to be ordinary Make your best mistakes 'Cause we don't have the time to be sorry So baby be the life of the party I'm telling you to take your shot it might be scary Hearts are gonna break 'Cause we don't have the time to be sorry So baby be the life of the party   Yeah, yeah, yeah Life of the party So don't let them keep you down Oh you know you can't give up 'Cause we don’t have the time to be sorry So baby be the life of the party",0.9891,3,8,0,4,14,10,34,8,6,21
41,/songs/2853891,Shawn Mendes,Lights On,https://genius.com/Shawn-mendes-lights-on-lyrics,http://api.genius.com/songs/2853891,Illuminate,2016-09-23," Damn, you look so good with your clothes on And I'm not trying to come off too strong But you know that I can't help It Cause girl you're beautiful I can't deny I want your body But I'm a gentleman so I'll be The one who takes it slowly Cause girl you're so beautiful   I wanna love you with the lights on Keep you up all night long Darling, I wanna see every inch of you I get lost in the way you move I wanna love you with the lights on And hold you 'til the nights gone Darling, I wanna see every inch of you I get lost in the way you move I wanna love you with the lights on Hey, hey, no   I like the vibe in this hotel room And I'd really like to get to know you Start discovering your secrets Underneath these very sheets Your skin's so perfect up against me Your lips are talking when we don't speak And I never wanna leave this Cause there's so much left to see   I wanna love you with the lights on Keep you up all night long Darling, I wanna see every inch of you I get lost in the way you move I wanna love you with the lights on And hold you 'til the nights gone Darling, I wanna see every inch of you I get lost in the way you move I wanna love you with the lights on Keep you up all night long Darling, I wanna see every inch of you I get lost in the way you move I wanna love you with the lights on Hold you 'til the nights gone Darling, I wanna see every inch of you I get lost in the way you move I wanna love you with the lights on Keep you up all night long Darling, I wanna see every inch of you I get lost in the way you move I wanna love you with the lights on (I wanna love you) And hold you 'til the nights gone Darling, I wanna see every inch of you I get lost in the way you move I wanna love you with the lights on Love you with the lights on Love you with the lights on",0.9993,2,7,1,0,25,11,27,9,2,13
42,/songs/2461041,Shawn Mendes,Like This,https://genius.com/Shawn-mendes-like-this-lyrics,http://api.genius.com/songs/2461041,Illuminate,2016-09-23," You say it's not supposed to be Tell me not to waste my time This was never up to me But if it was I wouldn't mind And I'm trying to ignore you I try to go on with my day, hey But I still pick up the phone, yeah And get lost in what you say   I can try to stop it, all I like Hands down I've lost this fight Thought I was strong, enough for you But I just can't hide the truth So I guess I'm going down I guess I'm going down, like this   And I love it how she's honest You don't find that nowadays She's not even drop dead gorgeous But she kills me anyway, oh   I can try to stop it, all I like Hands down I've lost this fight Thought I was strong, enough for you But I just can't hide the truth   I guess I'm going down I guess I'm going down I guess I'm going down like this   I can try to stop it, all I like Hands down I've lost this fight Thought I was strong, enough for you But I just can't hide the truth   I can try to stop it, all I like Hands down I've lost this fight And I thought I was strong, enough for you But I just can't hide the truth So I guess I'm going down, like this",0.9519,5,5,2,10,3,12,9,7,6,6
43,/songs/3676955,Shawn Mendes,Like to Be You,https://genius.com/Shawn-mendes-like-to-be-you-lyrics,http://api.genius.com/songs/3676955,Shawn Mendes,2018-05-25," ""Don't cry"" - or do, whatever makes you comfortable I’m tired too, there's nothin' left to say Let’s call the truce, 'cause I don't really wanna go to Bed like this   I'm so sorry That we're still stuck in the middle I'm so sorry 'Cause in the moment I   I don't know what it’s like to be you I don’t know what it's like but I’m dying to If I could put myself in your shoes Then I'd know what it's like to be you   Can I kiss you or not? 'Cause I’m not really sure right now of What you want, are you still mad at me? I'm hopin' not, 'cause maybe we could go to the movies I know that always cheers us up, hey  [Pre-Chorus: Shawn Mendes & Julia Michaels] I'm so sorry That we're still stuck in the middle Yeah, I'm so sorry 'Cause in the moment I   I don't know what it's like to be you I don't know what it's like but I'm dying to If I could put myself in your shoes Then I'd know what it's like to be you Tell me what's inside of your head No matter what you say I won't love you less And I'd be lying if I said that I do I don't know what it's like to be you I don't know what it's like to be you   I get worried I might lose you a little Every time we Every time we argue and get caught up in the moment   I don't know what it's like to be you I don't know what it's like but I'm dying to If I could put myself in your shoes Then I'd know what it's like to be you So tell me what's inside of your head No matter what you say I won't love you less And I'd be lying if I said that I do I don't know what it's like to be you I don't know what it's like to be you I don't know what it's like",0.765,8,4,7,5,5,11,19,7,3,15
44,/songs/745082,Shawn Mendes,Lost,https://genius.com/Shawn-mendes-lost-lyrics,http://api.genius.com/songs/745082,Handwritten,2015-04-14," I walk down the street and all I can see is people taking pictures of what they're 'bout to eat Did you even notice the girl sitting across from you? Sit in your room with nothing to do, victim to the screens between me and you Guess there's somebody else that you'd rather be talking to   Hold on, time out, help me   Cause right now I wanna get lost in this moment, keep both my eyes open Nothing to prove, let's keep this to ourselves And yeah, disconnection has caught my attention I don't wanna share this with anybody else I wanna get lost, and I wanna get lost   We go out to shows but why do we go If we're only gonna see it through the screen on our phones? If we're all here together then why are we watching alone? The world's so much bigger than posing for pictures If all that we need's at the tips of our fingers then how did this happen that we all fell so out of touch?   Hold on, time out, help me   Cause right now I wanna get lost in this moment, keep both my eyes open Nothing to prove, let's keep this to ourselves And yeah, disconnection has caught my attention I don't wanna share this with anybody else I wanna get lost   Tell me how it feels cause I know the hardest part Is when you're holding something real, you can see it in the dark I'll tell you how it feels and here's the hardest part If you wanna reach for something real, you gotta see it in the dark   I wanna get lost in this moment, keep both my eyes open Nothing to prove, let's keep this to ourselves And yeah, disconnection has caught my attention I don't wanna share this with anybody else I wanna get lost in this moment, keep both my eyes open Nothing to prove, let's keep this to ourselves And yeah, disconnection has caught my attention I don't wanna share this with anybody else I wanna get lost, I wanna get lost, and I wanna get lost",-0.9555,2,7,0,1,4,17,19,14,1,11
