,Unnamed: 0,api_path,primary_artist,title,url,song_endpoint,album,release_date,lyrics,anger,anticipation,disgust,fear,joy,negative,positive,sadness,surprise,trust,polarity
16,16,/songs/2841050,Tom Misch,Karma,https://genius.com/Tom-misch-karma-lyrics,http://api.genius.com/songs/2841050,None,2014-01-01," You said I was different Right from the start You gave me your trust and gave me your heart With you I would fly in a special place Cruising the sky and outer space And then karma police shot me down Stealing you, without making a sound I think of us, even today But losing you was the price I had to pay   I've tightened up Need to get my mind loose Have a little dip Slip into the right mood The night's new Rhymes still the type to Stride 'til it's gettin' light Smile and surprise you I might do, I might do Looking for trouble I might find you I might do Maybe I like you Uh, maybe I might do   And my head starts to spin As I see you with him Do you see me standing here An empty soul with no idea Cause I still feel your head On my shoulder On my shoulder On my shoulder   I've tightened up Need to get my mind loose Have a little dip Slip into the right mood The night's new Rhymes still the type to Stride 'til it's gettin' light Smile and surprise you I might do, I might do Looking for trouble I might find you I might do Maybe I like you Uh, maybe I might do   Her voice flicking through the mist In the moonlight Maroon eyes Shimmers 'til I soon rise To move wise Bruised and cocooned Quite right Out of sight Like the night That confused mind Removed mine Blue 'til the two twine Mood too true To conclude where the truth lies Saying you might move Tell me you might do suttin' You couldn't choose But the dude's like You, so I be seeing nothin' but no Coughing my soul In the puff of her smoke Broke, bluffing a joke As I nuzzle her nose Ruffle her toes Ain't suttin' supposed As love grows",3,3,3,6,8,10,16,5,7,10,0.8934
17,17,/songs/3555887,Tom Misch,Lost in Paris,https://genius.com/Tom-misch-lost-in-paris-lyrics,http://api.genius.com/songs/3555887,Geography,2018-04-03," I know that I need you now The key that I won't forget You're lost in Paris (You're lost in Paris) Lost in Paris I hope that you're warm and safe The memory I can't replace You're lost in Paris (You're lost in Paris)   It was over in day All the things I used to say You've kept the same All the places we would go All the songs we got to know You held it all   I know that I need you now The key that I won't forget You're lost in Paris (You're lost in Paris) I hope that you're warm and safe The memory that I can't replace You're lost in Paris (You're lost in Paris)   Young young, all in love in a lost place God damn, got me runnin' 'round in a rat's race Say grace, but I fell in love with a small waist Uh, never start, yeah right, yeah uh Bang, uh, shot me in my heart and it hurt gage She so fly like a dove, that's a dove face Thunder what she get now but this ain't her birthplace​ Tom, don't tell her, but it's Paris for her birthday   I know that I need you now The key that I won't forget You're lost in Paris (You're lost in Paris) I hope that you're warm and safe The memory I can't replace You're lost in Paris (You're lost in Paris) I know that I need you now The key that I won't forget You're lost in Paris (You're lost in Paris) I hope that you're warm and safe The memory I can't replace You're lost in Paris (You're lost in Paris)   I know that I need you now The key that I won't forget You're lost in Paris (You're lost in Paris) I hope that you're warm and safe The memory I can't replace You're lost in Paris (You're lost in Paris)",5,12,3,5,18,35,20,26,10,15,0.997
18,18,/songs/3555892,Tom Misch,Man Like You,https://genius.com/Tom-misch-man-like-you-lyrics,http://api.genius.com/songs/3555892,Geography,2018-04-06," I knew a boy who was swallowed by the sky By the flashing lights I knew a man who got lost in the big dark blue He came out alive I knew a boy, I knew a man that looked a lot like you   I knew a time that you could stand still beside Never rushing by I knew a place you'd go if you had to explore Into peace of mind I knew a boy, I knew a man that looked a lot like you I knew a time, I knew a place that felt a lot like you   I knew a boy who was swallowed by the sky By the flashing lights I knew a man who got lost in the big dark blue He came out alive I knew a boy, I knew a man that looked a lot like you I knew a time, I knew a place that felt a lot like You",0,7,5,0,3,7,5,6,0,3,0.9393
19,19,/songs/484106,Tom Misch,Memory,https://genius.com/Tom-misch-memory-lyrics,http://api.genius.com/songs/484106,None,2014-06-30," So tonight I'm sleeping under the stars Cuz I feel it And you're climbing up with me  Your absence used to rip me apart When I close my eyes You're still climbing up with me   Tonight, I'm sleeping under the stars Cuz I feel it And you're climbing up with me  Your absence used to rip me apart When I close my eyes You're climbing up with me  In my Memory ",0,2,0,2,2,2,2,2,0,2,0.0
20,20,/songs/3300945,Tom Misch,Movie,https://genius.com/Tom-misch-movie-lyrics,http://api.genius.com/songs/3300945,Geography,2017-11-02," ""My cheek brushes against his Smooth on stubble for a moment And then it's gone He walks along the platform as if in a dream Every fiber in me wants to shout and scream 'Stop!' To run across to him, to take him in my arms To tell him, 'I love you! You silly, silly man, I love you!' But instead I stand still Heart cracking Those little curls on the back of his head bouncing As he steps out of my life, forever.""   I hope that the fire we both made Still burns a little in you I wrote to you everyday Did my letters find their way? Our memories on my screen Two lovers in this mystic dream Baby, come back to me, come back to me Too much time on my phone Baby, do you still sleep alone? Come back to me, come back to me   Remember me Fresh out a black and white movie, movie On every screen But would you realize What you meant to me or was it mystery? Remember me Fresh out a black and white movie, movie On every screen But would you realize What you meant to me or was it mystery?   I heard that you moved somewhere far away Is your number the same as before? I can't ignore The time may have changed your ways Does my record still hang on your wall? Such a sentimental way to groove I hope it still touches you Baby, come back to me, come back to me It kills me to see you leave So I came home and made this beat Baby, come back to me, come back to me   Remember me Fresh out a black and white movie, movie On every screen But would you realize What you meant to me or was it mystery? Remember me Fresh out a black and white movie, movie On every screen But would you realize What you meant to me or was it mystery?   Remember me, let's set the scene You and me, what could've been Still swimming in a lover's dream Still playing on the movie screens Remember me, let's set the scene You and me, what could've been Still swimming in a lover's dream Still playing on the movie screens Remember me, let's set the scene You and me, what could've been Still swimming in a lover's dream Still playing on the movie screens Remember me, let's set the scene You and me, what could've been Still swimming in a lover's dream Still playing on the movie screens",2,18,1,3,19,11,19,6,10,11,0.9921
21,21,/songs/2459257,Tom Misch,Nightgowns,https://genius.com/Tom-misch-nightgowns-lyrics,http://api.genius.com/songs/2459257,Beat Tape 2,2015-08-28,"  There was something 'bout her face Something 'bout the way that they would taste Little lips after slipping everything she shouldn't say Saying everything that couldn't wait Saying wouldn't it be great A little bait heard a little late Years of trying me, finally, im a slip her on a date Saying wait, the day will break Trying to play it straight But she was saying wake me up at eight Now im talking late Jack way back when I get eczema on my elbows Before she found shelter in the shelt holes We felt those, lows That Heaven in the hell holes Waiting for a situation saying we should quote those feelings We're feeling, cause I dont get no ease in the evening Release when Im dreaming And she would say she can't believe what shes reading Cause everthing I write has been misleading, she needs him   She, needs him Uh-uh she needs him X3 She, needs him   It be the, friday night Filling it with fifa I got that Slum village seeping through the speaker I need her Deeper than the reasons had to leave her But she ain't thinking 'bout me I ain't thinking 'bout her neither either Believe her or let it go It seems the latter looks like losing over setting stone Best to bell her phone I'd rather see her but shes never home So I start to moan Alone, grab her breath and groan speak after the tone like Ayo its me what you saying Its been a week I was playing I know this isnt good for you but another night your staying So help me Im just tryna find a way It ain't no early morning lay it low no more They say the situations straying You're delaying, I ain't praying no more What you playing those for I played my cards right, twice, for nothing No I ain't waiting no more    Fin",12,8,7,5,5,21,10,9,8,7,0.9
22,22,/songs/3667268,Tom Misch,Now,https://genius.com/Tom-misch-now-lyrics,http://api.genius.com/songs/3667268,Beat Tape 2 (Extended Edition),2015-10-12,"Now…  Once I was alright, alright baby Once I was Alright, alright baby Once I was Alright, now…  Once I was alright, alright baby Once I was Alright, alright baby Once I was Alright, now…  Once I was alright, alright baby Once I was Alright, alright baby Once I was Alright, now…",0,0,0,0,6,0,6,0,0,0,0.9682
23,23,/songs/3645621,Tom Misch,Oh Baby,https://genius.com/Tom-misch-oh-baby-lyrics,http://api.genius.com/songs/3645621,Beat Tape 2 (Extended Edition),2015-10-12,Sometimes I wake up in the middle of the night And your stars away from me Oh Let me take you from the middle of your dreams To my mystery baby  Wake up in the middle of the night And your stars away from me Oh Let me take you from the middle of your dreams To my mystery baby You sleep so deep in the middle of the night And your stars away from me Oh Let me take you from the middle of your dreams To my mystery baby You sleep so deep in the middle of the night And your stars away from me Oh Let me take you from the middle of your dreams To my mystery baby You sleep so deep in the middle of the night And your stars away from me Oh Let me take you from the middle of your dreams To my mystery baby  You get me caught in the middle of my own emotions Caught in the middle of my own emotions Caught in the middle of my own emotions Caught in the middle of my own emotions Caught in the middle of my own emotions Caught in the middle of my own emotions Caught in the middle of my own emotions Caught in the middle of my own emotions Caught in the middle of my own emotions Caught in the middle of my own emotions Caught in the middle of my own emotions Caught in the middle of my own emotions Caught in the middle of my own emotions Caught in the middle of my own emotions Caught in the middle of my own emotions  Wake up in the middle of the night And your stars away from me Oh Let me take you from the middle of your dreams To my mystery baby You sleep so deep in the middle of the night And your stars away from me Oh Let me take you from the middle of your dreams To my mystery baby You sleep so deep in the middle of the night And your stars away from me Oh Let me take you from the middle of your dreams To my mystery baby You sleep so deep in the middle of the night And your stars away from me Oh Let me take you from the middle of your dreams To my mystery baby You sleep so deep in the middle of the night,0,18,0,0,18,0,18,0,9,9,0.9694
24,24,/songs/2437068,Tom Misch,On My Mind,https://genius.com/Tom-misch-on-my-mind-lyrics,http://api.genius.com/songs/2437068,None,2014-10-02," Baby remember when we turned on to a rainy day Baby remember when we turned on to a rainy day Baby remember when we turned on to a rainy day Baby remember when we turned on to a rainy day   And as the sun goes down and as the stars come out to play I bet tomorrow I'll be sleeping, sleeping all day And this fire I feel, why is it burning so slowly? I can't stop thinking of you like the five pounds you owed me   Cause you're on my mind, mind, mind You're on my mind You're all I can find, find, find You're all I can find Cause you're on my mind, mind, mind You're on my mind You're all I can find, find, find Please give me the time   Please tell me that you feel the same That we're on the same train If you're a little bit late and miss it That will be a great shame I miss your sweet, sweet kisses and loving When they were mine When are you down? What makes your mind in doubt?   Cause you're on my mind, mind, mind You're on my mind You're all I can find, find, find You're all I can find Cause you're on my mind, mind, mind You're on my mind You're all I can find, find, find Please give me the time  (Guitar Solo)   Cause you're on my mind, mind, mind You're on my mind You're all I can find, find, find You're all I can find Cause you're on my mind, mind, mind",1,8,1,3,10,4,10,7,4,6,0.9586
25,25,/songs/3643714,Tom Misch,Outro,https://genius.com/Tom-misch-outro-lyrics,http://api.genius.com/songs/3643714,Out To Sea - EP,2014-12-08,"[Verse 1: Tom Misch & Carmody] I watched you move away Little dead i felt that day You were all in my mind I'm not trying to be unkind   You disappeared at the shore line Before the touch of your hand wrapped in mine, wrapped in mine   I scatter every piece of you I cross gray waters than you I felt your ghost leaving me I couldn't hold to your memory, memory   Tenderly smile and wave goodbye As a small tear falls from your eyes This love that was coming from me became harder to see   As I let go all of all of you It was lost to the days out the blue  [Chorus 2: Tom Misch & Carmody] I scatter every piece of you (If you leave me, how you leave me?) I cross gray waters than you (If you leave me, how you leave me?) I felt your ghost leaving me (If you leave me, how you leave me? If you leave me, how you leave me?) I couldn't hold to your memory, memory (If you leave me, how you leave me? If you leave me, if you leave)",3,1,3,5,2,18,3,20,13,1,-0.6208
26,26,/songs/2234864,Tom Misch,Paper Planes,https://genius.com/Tom-misch-paper-planes-lyrics,http://api.genius.com/songs/2234864,Out To Sea - EP,2014-12-09,"Making paper planes for you Making paper planes for you Making paper planes for you Making paper planes for you  Do you see me I found you there Skimming pebbles into the air Do you see me I found you there A humming bird without a care By the sea By the sea  Making paper planes for you Making paper planes for you Making paper planes for you Making paper planes for you  Do you see me I found you here Moving closer in this atmosphere Do you see me I found you here Wishing that I would appear By the sea By the sea  Making paper planes for you Making paper planes for you Making paper planes for you Making paper planes for you  Following the sky Leaving you and I Following the sky Disappear to the night, to the night, to the night, to the night  Making paper planes Making paper planes for you Making paper planes for you Making paper planes for you  Making paper planes for you Making paper planes for you Making paper planes for you Making paper planes for you",0,0,0,1,4,0,10,0,0,4,-0.3875
27,27,/songs/3252965,Tom Misch,Raise Your Hands,https://genius.com/Tom-misch-raise-your-hands-lyrics,http://api.genius.com/songs/3252965,Beat Tape 2 (Extended Edition),2015-08-28," 'Cause that's where I'm supposed to be, like I'm supposed to be where I'm tryna take the listener You know what I mean, like if I'm.. I can't say it from that vibration down there, yeah Uh, yeah It's Illa J Oh, yeah Give me that soul, uh Let's go , uh Ya , uh, yeah   Religion and tradition don't belong in the same sentence Soon as it becomes a routine spirit is missing, uh Are you people listening? Soon as it becomes a routine, spirit is missing If you want your soul to be cleansed You need to listen To this lyrical soul that I am spitting This individual soul is on a mission To show you miracles so you would pay attention To dip divinity that flows for infinity Some of ya'll already there Some pretend to be Righteous with your head wrapped Tryna be Erykah Badu And you don't really do that Claiming that you love soul food R&B and Hip Hop But you don't really shouldn't And wouldn't do that If you had a chance Anyway, Let's proceed to the dance, uh It's Illa J on the rap Tom Misch on the beat And we killing that shit A hundred grand, uh You got, Ben on the drums Jesse on the bass Danny on guitar That's my mans, uh Is everybody is a star And everybody going far So everybody raise your mother fucking hands 'Cause everybody is a star And everybody going hard So everybody raise your mother fucking hands (wave your hands)   Everybody raise your mother fucking (wave ya hands) Everybody raise your mother fucking (wave ya hands) Everybody raise your mother fucking (wave ya hands)",3,11,2,4,14,11,25,9,2,19,0.2542
28,28,/songs/2231029,Tom Misch,Release You,https://genius.com/Tom-misch-release-you-lyrics,http://api.genius.com/songs/2231029,Out To Sea - EP,2014-12-09," Once there was a melody That came from the depths of me That's how it starts... It came from another place Trail I can never trace No matter how hard And it's strange how the story's yours now As it leaves my voice There was not a choice But to release you...   There was a time Oh, to release you When you were mine Oh, to release you And now you're free Oh, to release you 'Cause I released you Oh, to release you (repeat)   Once there was too much too say Though I should've find a way And that's how it starts Sorrows and ecstasy Grow all these words to me No matter how hard And it's strange how The story's yours now As it leaves my voice There was not a choice But to release you   There was a time Oh, to release you When you were mine Oh, to release you And now you're free Oh, to release you 'Cause I released you Oh, to release you (repeat)  And now you lay In another's mind... And you look like a stranger to me  And now you lay In another's mind... And you look like a stranger to me To me, yeah   There was a time Oh, to release you When you were mine Oh, to release you And now you're free Oh, to release you 'Cause I released you Oh, to release you (repeat)",0,7,0,3,2,3,6,1,0,3,0.9782
29,29,/songs/3204845,Tom Misch,So Close,https://genius.com/Tom-misch-so-close-lyrics,http://api.genius.com/songs/3204845,Out To Sea - EP,2014-12-04,I’ll let you real near to my heart So close that you can feel beats As they move apart I’ll let you real near to my mind So close that all our empty thoughts Are intertwined  Sitting by the edge of the world I know it’s true That we wrote a language just for me and you Stayed in that place and spent all of our day The flashes of colour that lit right through the grey  Stay here and we’ll align Your shadow passes into mine Stay here and we’ll align Your shadow passes into mine  I’ll let you real near to my heat So close that all the broken things Feel so concrete I’ll let you real near to my soul So close that you have a love You can’t control  Sitting by the edge of the world I know it’s true That we wrote a language just for me and you Stayed in that place and spent all of our day The flashes of colour that lit right through the grey  Stay here and we’ll align Your shadow passes into mine Stay here and we’ll align Your shadow passes into mine  Stay here and we’ll align Your shadow passes into mine Stay here and we’ll align Your shadow passes into mine,1,1,0,1,3,3,7,1,0,6,0.743
30,30,/songs/3145128,Tom Misch,South of the River,https://genius.com/Tom-misch-south-of-the-river-lyrics,http://api.genius.com/songs/3145128,Geography,2017-07-04,"I want to stay South of the River With the chains and the gold We could be out here together; But, you have places to go  Watching the sunshine blaze the gray I don't know why you wouldn't stay You should come South of the River Where the loving is gold  You should come South of the River This is where it all starts I think that we could stay here forever Lie on the roof til' it's dark  And when the last bus pulls away I swear that I almost heard you say ""I should move South of the River."" I want to get to know I want to get to know, oh  I want to stay South of the River  ",2,1,2,0,2,2,7,3,0,3,0.9161
31,31,/songs/2275793,Tom Misch,Sunshine,https://genius.com/Tom-misch-sunshine-lyrics,http://api.genius.com/songs/2275793,None,2015-06-15," Cause you know girl That every little thing you do Even when i'm feeling blue Oh, It makes me smile   As we going through some stormy weather Bless the fact we still move together Cause I know we'll find the light on the other side   Cause we’ll be just fine If we take our time Let the sun shine Cause we’ll be just fine Cause we’ll be just fine If we take our time Let the sun shine Cause we’ll be just fine   Even when I’m going underwater I can breathe just fine Cause you got me in my prime girl And it feels so good   As we going through some stormy weather Bless the fact we still move together Cause I know we'll find the light on the other side   Cause we’ll be just fine If we take our time Let the sun shine Cause we’ll be just fine   Let the sun shine Let the sun shine Let the sun shine Let the sun shine Let the sun shine Let the sun shine Let the sun shine Let the sun shine Let the sun shine Let the sun shine Let the sun shine Let the sun shine Let the sun shine Let the sun shine Let the sun shine Let the sun shine   Cause we’ll be just fine If we take our time Let the sun shine Cause we’ll be just fine  Cause we’ll be just fine If we take our time Let the sun shine Cause we’ll be just fine Just fine Just fine",1,30,1,3,26,3,48,2,24,28,0.9793
32,32,/songs/2418046,Tom Misch,Wake Up This Day,https://genius.com/Tom-misch-wake-up-this-day-lyrics,http://api.genius.com/songs/2418046,Beat Tape 2,2015-08-28," It don't wait for me to cast away The feelings of poor taste Knowing that, I'm channeling my few and hasty lovers Loving in me grows older Through its style and grace Never floated off to find some real escape   Today, saying it right away Going for the eternal flame I'ma do whatever it takes Oh today, saying it right away Going for the eternal flame I'ma do whatever it takes Takes... Takes... Takes... Takes...  I'ma do whatever it takes, yeah  Said that I'm gonna No...   When I woke up this day There was no one around Telling me what I say The energy is profound And I woke up that day Put my feet on the ground Telling me what I say The energy is profound   Today, saying it right away Going for the eternal flame I'ma do whatever it takes, o-oh... Today, saying it right away Going for the eternal flame I'ma do whatever it takes Takes... Takes... Takes... Takes... Takes... Takes... Takes... Takes... Takes... Takes... Takes...",1,4,1,2,3,4,8,2,1,6,0.8979
33,33,/songs/2911505,Tom Misch,Wander With Me,https://genius.com/Tom-misch-wander-with-me-lyrics,http://api.genius.com/songs/2911505,Beat Tape 2,2015-01-01," Wander with me, we can disappear Hands still touching So you know I'm near Wander with me, streets will hold us down Leave it all now 'Cause I need you around, around, around...   And baby it's alright with me I can be all that you need Baby it's alright with me Wander, wander, wander And baby, it's alright with me I can be all that you need Baby, it's alright with me It's alright, it's alright, it's alright   Wander with me, need to call you home You felt nothing Now you never feel alone Wander with me, winter won't let go A dream of sunlight Lining your shadow   And baby it's alright with me I can be all that you need Baby it's alright with me Wander, wander, wander And baby, it's alright with me I can be all that you need Baby, it's alright with me It's alright, it's alright, it's alright",0,0,0,1,8,1,8,1,1,0,0.9578
34,34,/songs/2480970,Tom Misch,Watch Me Dance,https://genius.com/Tom-misch-watch-me-dance-lyrics,http://api.genius.com/songs/2480970,Reverie EP,2017-03-31," Remember every move you made as if it was still true It's there I am king, there I feel brand new   ‘Cause you’re in my soul, can’t let you go, fighting for you And in my dreams, I’ll make you appear, oh oh oh As we move closer and I groove with you Blue and green rays, they shine through, hey Feel the energy, you don’t have to try You can see it in our bodies, you can see it in our eyes   Watch me dance with this memory Just as real, just as heavenly Watch me dance in my reverie The lights decay but the love remains Watch me dance with this memory Just as real, just as heavenly Watch me dance in my reverie The lights decay but my love remains   In the mist of the crowded room, you might have flown But all I see is you and you alone   ‘Cause you’re in my soul, can’t let you go, fighting for you And in my dreams, I’ll make you appear As we move closer and I grove with you Blue and green rays, they shine through Feel the energy, you don’t have to try You can see it in our bodies, you can see it in our eyes   Watch me dance with this memory Just as real, just as heavenly Watch me dance in my reverie The lights decay but the love remains Watch me dance with this memory Just as real, just as heavenly Watch me dance in my reverie The lights decay but my love remains   It remains Hey, hey, hey, hey Hey, hey, hey, hey....",2,12,5,17,23,11,37,6,0,30,0.9904
