,Unnamed: 0,api_path,primary_artist,title,url,song_endpoint,album,release_date,lyrics,anger,anticipation,disgust,fear,joy,negative,positive,sadness,surprise,trust,polarity
35,35,/songs/3458461,Tom Misch,Water Baby,https://genius.com/Tom-misch-water-baby-lyrics,http://api.genius.com/songs/3458461,Geography,2018-01-22," 'Cause I was born a water baby Swimming with these times The grooves that turn the grey to sunshine 'Cause I will live through days that break me Swimming with these times The grooves that turn the grey to sunshine   I'm still tryna write the story as I see it The trouble is when I say it, they don't believe it They reckon I only say it but I don't mean it I'm tryna tell 'em I'd only say it if I can feel it 'Cause money's tight, maybe tighter than it was before I'm helping out on a mortgage I really can't afford Family breaking north, I cover the trips abroad Shakin', I'm making another loss on another tour But what I done it for? To see my mother in the sun abroad I run into trouble, that was coming for her My little brother got the hunger for All the exact same pain That makes the rain in my stomach pour So let me paint it broader This for any dude who's got a daughter Living off lines that your papa taught her Ain't got no time to be coming for you Go with the flow of this running water   Go with the flow of this Go with the flow of this Go with the flow of this   Don't you worry Two leaves won't grow the same And people might forget your name Doesn't matter if they do Don't you hurry When the hot coffee pours will stain And when the Uber left you in the rain Your time will come around to you Despite the stress of spending so much time alone 'Cause this ge-o-gra-phy is keeping me at home And I don't know the way to go I move with the flow of this running water, this running water   'Cause I was born a water baby Swimming with these times The grooves that turn the grey to sunshine 'Cause I will live through days that break me Swimming with these times The grooves that turn the grey to sunshine   Go with the flow of this running water",3,15,2,4,11,7,24,4,5,12,0.6349
36,36,/songs/3555895,Tom Misch,We've Come So Far,https://genius.com/Tom-misch-weve-come-so-far-lyrics,http://api.genius.com/songs/3555895,Geography,2018-04-06," Far, we’ve come so far   We’ve come so far We’ve come so far We’ve come so far We’ve come so far We’ve come so far We’ve come so far We’ve come so far We’ve come so far We’ve come so far We’ve come so far We’ve come so far We’ve come so far We’ve come so far We’ve come so far We’ve come so far We’ve come so far We’ve come so far We’ve come so far We’ve come so far We’ve come so far We’ve come so far We’ve come so far We’ve come so far We’ve come so far   We’ve come so We’ve come so We’ve come so",0,0,0,0,0,0,0,0,0,0,0.0
37,37,/songs/2316169,Tom Misch,With You,https://genius.com/Tom-misch-with-you-lyrics,http://api.genius.com/songs/2316169,Out To Sea - EP,2014-12-09,"With you I stand, but for how long? For how long? But for how long... With you my colors raged, but for how long? For how long? For how long... With you, I am harbor With you there was no distance For how long? But for how long... With you we drew no lines With you there was no divide But for how long? For how long?   Cause I wouldn't watch you go and leave all that we know But love's so hard to hold... Cause I wouldn't watch you go and leave all that we know But love's so hard to hold...  With you I rest, but for how long? For how long? For how long... With you I've loved, but how love goes? How love goes? How it goes... With you I built a tower With you it stretched to the sun But how it crumbles? How it's gone... With you my voice would carry and drift on through the air But how it falters, when you're not there...    You held me close As I fell through your arms And you held me close (Fell through your arms, fell through your arms...) As I fell through your arms (Fell through your arms, fell through your arms...) And you held me close (Fell through your arms, fell through your arms...) As I fell through your arms (Fell through your arms, I fell through your arms--)  ",0,16,0,3,5,14,7,13,3,2,0.6498
38,38,/songs/3555893,Tom Misch,You're On My Mind,https://genius.com/Tom-misch-youre-on-my-mind-lyrics,http://api.genius.com/songs/3555893,Geography,2018-04-09," And as the sun goes down And the stars come out to play I bet tomorrow I’ll be sleeping Sleeping all day And this fire I feel Why is it burning so slowly? I can’t stop thinking of you Like the five pounds you owe me   'Cause you’re on my mind 'Cause you’re on my mind You’re all I can find 'Cause you’re on my mind   Please tell me that you feel the same That we're on the same train If you're a little bit late and miss it That would be a great shame I miss your sweet, sweet kisses and lovin’ When they were mine When are you down? Make sure I’m in town   'Cause you’re on my mind 'Cause you’re on my mind You’re all I can find 'Cause you’re on my mind  'Cause you’re on my mind 'Cause you’re on my mind You’re all I can find 'Cause you’re on my mind   All the colours they shine through Night time, and I’m thinking of you Each storm of every day You’re on my mind   You’re on my mind You’re on my mind You’re all I can find You’re on my mind  You’re on my mind You’re on my mind You’re all I can find You’re on my mind  You’re on my mind You’re on my mind You’re on my mind You’re on my mind",2,7,1,2,5,4,6,2,4,4,0.9144
39,39,/songs/2688382,Tom Misch,Your Love,https://genius.com/Tom-misch-your-love-lyrics,http://api.genius.com/songs/2688382,Beat Tape 2,2015-08-28," Hear me now, I'm sober out If you want it, then I'm down Here and now, we bless the sound   Feeling right, so hold tight You and I darling, it's so fine Feeling right, you can't deny Your love is, your love is mine   Never letting go, let's purify Take a look and feel the sunshine Still floating high, we sway at night   Your love is, your love is mine  Hear me now, I'm sober out If you want it, then I'm down Hear me now, we bless the sound   Feeling right, so hold tight You and I darling, it's so fine Feeling right, you can't deny Your love is, your love it's mine   Never letting go, let's purify Take a look out for you, the sunshine Still floating high, we sway at night   Your love is, your love is mine ",6,6,4,4,20,6,20,4,4,10,0.3641
