api_path,primary_artist,title,url,song_endpoint,album,release_date,lyrics
/songs/117392,Andy Grammer,Keep Your Head Up,https://genius.com/Andy-grammer-keep-your-head-up-lyrics,http://api.genius.com/songs/117392,Andy Grammer,2011-06-14," I've been waiting on a sunset Bills on my mindset I can't deny they're getting high Higher than my income, income's bread crumbs I've been trying to survive The glow that sun gets right around sunset Helps me to realize This is just a journey Drop your worries, you are gonna turn out fine Oh... You turn out fine Fine, oh, you turn out fine   But, you gotta keep your head up, oh oh And you can let your hair down, eh eh But, you gotta keep your head up, oh oh And you can let your hair down, eh eh I know it's hard (know it's hard) To remember sometimes But, you gotta keep your head up, oh oh And you can let your hair down, eh eh eh eh   I got my hands in my pockets kicking these rocks It's kinda hard to watch this life go by I'm buying into skeptics Skeptics mess with the confidence in my eyes I'm seeing all the angles thoughts get tangled I start to compromise my life and my purpose Is it all worth it? Am I gonna turn out fine? Oh oh, you turn out fine Fine, oh oh you turn out fine   But, you gotta keep your head up, oh oh And you can let your hair down, eh eh But, you gotta keep your head up, oh oh And you can let your hair down, eh eh I know it's hard (know it's hard) To remember sometimes But, you gotta keep your head up, oh oh And you can let your hair down, eh eh eh eh   Only rainbows after rain The sun will always come again and It's a circle, circling Around again It comes around again Only rainbows after rain The sun will always come again and It's a circle, circling Around again It comes around  Only rainbows after rain The sun will always come again and It's a circle, circling Around again It comes around again Only rainbows after rain The sun will always come again and It's a circle, circling Around again It comes around   But, you gotta keep your head up, oh oh And you can let your hair down, eh eh But, you gotta keep your head up, oh oh And you can let your hair down, eh eh I know it's hard (know it's hard) To remember sometimes But, you gotta keep your head up, oh oh And you can let your hair down, eh eh eh eh   Keep your head up Oh oh And you can let your hair down Eh eh Keep your head up Oh oh And you can let your hair down Eh eh Keep your head up Oh oh And you can let your hair down Eh eh"
/songs/2012710,Andy Grammer,Keep Your Head Up (Relve la tte) en duo avec Melissa Nkonda,https://genius.com/Andy-grammer-keep-your-head-up-relve-la-tte-en-duo-avec-melissa-nkonda-lyrics,http://api.genius.com/songs/2012710,None,2007-01-01,"I've been waiting on the sunset Bills on my mindset I can get deny they're getting high Higher than my income My income's bread crumbs I've been trying to survive  The glow that the sun gives Right around sunset Helps me realize This is just a journey  Drop your worries You are gonna turn out fine Oh, you'll turn out fine Fine, oh, you'll turn out fine  But you gotta keep your head up, oh And you can let your hair down, eh You gotta keep your head up, oh And you can let your hair down, eh  I know it's hard, know it's hard To remember sometimes But you gotta keep your head up, oh And you can let your hair down, eh  I've got my hands in my pockets Kickin' these rocks It's kinda hard to watch this life go by I'm buyin' in the skeptics  Skeptics mess with the confidence in my eyes I'm seeing all the angles, starts to get tangled I start to compromise My life and the purpose  Is it all worth it? Am I gonna turn out fine? Oh, you'll turn out fine Fine, oh, you'll turn out fine  But you gotta keep your head up, oh And you can let your hair down, eh You gotta keep your head up, oh And you can let your hair down, eh  I know it's hard, know it's hard To remember sometimes But you gotta keep your head up, oh And you can let your hair down, eh  Only rainbows after rain The sun will always come again It's a circle circling Around again, it comes around again  Only rainbows after rain The sun will always come again It's a circle circling Around again, it comes around  But you gotta keep your head up, oh And you can let your hair down, eh You gotta keep your head up, oh And you can let your hair down, eh  I know it's hard, know it's hard To remember sometimes But you gotta keep your head up, oh And you can let your hair down, eh  Keep your head up, oh And you can let your hair down, eh Keep your head up, oh And you can let your hair down, eh Keep your head up, oh And you can let your hair down"
/songs/607646,Andy Grammer,Kiss You Slow,https://genius.com/Andy-grammer-kiss-you-slow-lyrics,http://api.genius.com/songs/607646,Magazines or Novels,2014-08-05," I know you didn't think loving me meant so much time alone Dinner for one on the couch, another movie on your own You know that I'm never gonna be a 9 to 5, that was never me I was born with a compass in my hand and a restless soul   But when it hurts, when you can't take it And when the rubber band feels like it's breaking   You hear the kick drum, that's my heart right there Let the melody run its fingers through your hair And my piano will kiss you slow tonight And my vocals tickle your ear And you almost can feel me here And my piano will kiss you slow tonight   As far as ladies go, baby, you should know you're so patient You're a thick-skin definition of low maintenance But if enough time goes by, you can't help but dim your light An empty house can make a cold heart feel so naked   But when it hurts, when you can't take it And when the rubber band feels like it's breaking   You hear the kick drum, that's my heart right there Let the melody run its fingers through your hair And my piano will kiss you slow tonight And my vocals tickle your ear And you almost can feel me here And my piano will kiss you slow tonight   Oh, let the audio be your second home for a while And hold on to every note Baby, listen close for me inside And hear the kick drum, that's my heart right there Let the melody run its fingers through your hair And my piano will kiss you slow   And hear the kick drum, that's my heart right there Let the melody run its fingers through your hair And my piano will kiss you slow tonight And my vocals tickle your ear And you almost can feel me here And my piano will kiss you slow tonight Will kiss you slow tonight"
/songs/152436,Andy Grammer,Ladies,https://genius.com/Andy-grammer-ladies-lyrics,http://api.genius.com/songs/152436,Andy Grammer,2011-06-14," My mother told me, she said, ""Andy You'll be a man soon, so understand me Most of this world sees women like candy You'll be a man who will be standing for me""   My sisters, my daughters and wives Girls who are learning how to shine their light Dedicate some of your life, stand for them all"" Singing out, ""Me, my sisters, my daughters and wives Girls who are learning how to shine their light Dedicate some of your life, you will stand for them all"" Singing out   Ladies, you are beautiful, you are beautiful You don't even have to try Oh ladies, you are beautiful, you are beautiful More than you could realize   My mother told me, she said, ""Andy I know this all may seem demanding But I'll be leaving and will be handing All of my love to you, you will be standing for me   My sisters, my daughters and wives Girls who are learning how to shine their light Dedicate some of your life, stand for them all"" Singing out   Ladies, you are beautiful, you are beautiful You don't even have to try Oh ladies, you are beautiful, you are beautiful More than you could realize   I'm not sure if I'm the best one to carry this torch I'm a mess and my nose is sore Falling on my face, tryna break the norm, but I still conform And I know you see mistakes I make And wait patiently for me to replace them And I can't quite seem to be the perfect man you needed me to be I need you to believe that I'll be standing here I got my sword, I got my shield And you keep ringing in my ear Oh no, talking 'bout   ""Me, my sisters, my daughters and wives Girls learning how to shine their light Dedicate some of your life, stand for them all"" Singing out   Ladies, you are beautiful, you are beautiful You don't even have to try Oh ladies, you are beautiful, you are beautiful More than you could realize Ladies, you are beautiful, you are beautiful You don't even have to try Oh ladies, you are beautiful, you are beautiful More than you could realize"
/songs/152437,Andy Grammer,Love Love Love (Let You Go),https://genius.com/Andy-grammer-love-love-love-let-you-go-lyrics,http://api.genius.com/songs/152437,Andy Grammer,2011-06-14,"It's like   I've been feeling like a helium balloon You know, I'm always on the rise Or is this love, love, love, love, love? Dead winter but it feels like June With smile I can't hide Is this love, love, love, love, love?   Ooh-wee No defenses, I'm Too deep For common sense Well it's love, love, love, love, love (yeah) Oh my So delighted, I Don't try To even fight it And I think that you should know That I will never let you go   Ooohhh I won't, I won't let you go I won't let you go Ooohhh I won't, I won't let you go I won't let you go Said I won't let you go now   I've been feeling like you're swimming through my head You know, you're always on my mind Is this love, love, love, love, love? Dead broke, feeling like a millionaire With a twinkle in my eye Is this love, love, love, love, love?     I've been sleeping on a cloud called ""Number Nine"" Walking on the air and staring at the sky I can't remember ever feeling so alive It's like you brought me back to life Well, you turned on all the lights somehow  It's like: Ooh-wee No defenses, I'm Too deep For common sense Well, it's love, love, love, love, love...    No, singing that  "
/songs/152433,Andy Grammer,Lunatic,https://genius.com/Andy-grammer-lunatic-lyrics,http://api.genius.com/songs/152433,Andy Grammer,2011-06-14," I got five bucks sitting at a coffee shop I just wrote a lyric that made me stop To think about the world and what I got It's a beautiful, beautiful day   I got dreams for food and hope for drink A new chance coming every time I blink Sunset dripping off the thoughts I think It's a beautiful, beautiful day   And maybe I should care more about safety But I can't ignore or betray these Voices singing   You can do this You can do this You are not a lu-lunatic Crazy would be changing your mind You can do this You can do this You are not a lu-lunatic Crazy would be leaving it behind   I got five bucks waiting on a matinee I love to see films in the middle of the day Same movie seen a different way I don't think that makes me crazy   And I start work on the opposite side Of the clock, tick-tock, clubs open at nine I'd like to rock till the early day light Write music till five This is my life     I will wiggle in a strait jacket forever This is not some slight disease we can try and cure This is one thing in my life that I know for sure There is no turning back now  Oh    Would be leaving it behind Would be leaving it behind Would be leaving it behind Would be leaving it behind"
/songs/607623,Andy Grammer,Masterpiece,https://genius.com/Andy-grammer-masterpiece-lyrics,http://api.genius.com/songs/607623,Magazines or Novels,2014-08-05," Life is a canvas I'm painting in my mind Colors dance, spill outside the lines I refuse to settle, never the black and white Rock the neons until the day I die I'm on a constant search to make my heart swell Bite off too much, chew like hell Half my nights spent in a hotel Price I pay to escape the conveyor belt   One, you get one heartbeat some Take it seriously   This is your masterpiece Don't forget to dream and taste the colors In the air you breathe It's your masterpiece Go ahead and feel it all Don't stop till it is beautiful Don't stop till it is beautiful Don't stop till it is beautiful   Close my eyelids, take a deep breath Feel the lightning down in my chest I'm just a piece of art and the paint's fresh Cause I'm not near finished yet I got a pregnant mind that wants to give birth Breathe life into these big words I can hear the universe, in my ear she whispers   One, you get one heartbeat some Take it seriously   This is your masterpiece Don't forget to dream and taste the colors In the air you breathe It's your masterpiece Go ahead and feel it all Don't stop till it is beautiful Don't stop till it is beautiful Don't stop till it is beautiful   And you can settle for the normal life Say you're afraid of heights But you were meant to light the sky   This is your masterpiece Don't forget to dream and taste the colors In the air you breathe It's your masterpiece Go ahead and feel it all Don't stop till it is beautiful Don't stop till it is beautiful Don't stop till it is beautiful"
/songs/117401,Andy Grammer,Miss Me,https://genius.com/Andy-grammer-miss-me-lyrics,http://api.genius.com/songs/117401,Andy Grammer,2011-06-14,"I wake up and I'm sober Don't even know you anymore Punch drunk on a feeling Lost in believing, I was sure I don't care what you have to say Damn words get in the way I don't want to know I know there will come a time When I look you in the eyes and say I told you so   And I promise you this you're going to miss me, miss me As long as you live you're going to miss me, miss me  Set me up for the falling Gave me no warning you were gone Let me down I was reeling I can't believe what you've done Go do what you got to do Damn words will follow you everywhere you go And I know there will come a time When I look you in the yes and say I told you so    I believe in my heart, when something is wrong Say it's wrong I can deal with the part where something is wrong If we both stay strong I know there will come a time When I look you in the eyes and say I told you so    I wake up and I'm sober"
/songs/3344384,Andy Grammer,Pendulum,https://genius.com/Andy-grammer-pendulum-lyrics,http://api.genius.com/songs/3344384,The Good Parts,2017-12-01," One minute, I'm the king Then the lowest name on the list of this totem pole It's hard to reach out to pieces Tryin' to keep my belief in myself   I been roll, I been rollin' on These emo-, these emotions been pulling me over the edge Changing the size of my head Back and forth, back and forth and now, I'm exposed My ego is like, oh no, here we go again Leraning to live with the swing of this pendulum   So fragile, I could break any minute Then I'll go run my mouth like I'm some shit It's so hard to be all of these things Tryin' to keep my belief in myself   I been roll, I been rollin' on These emo-, these emotions been pulling me over the edge Changing the size of my head Back and forth, back and forth and now, I'm exposed My ego is like, oh no, here we go again Leraning to live with the swing of this pendulum   Oh, oh, oh, ooh, ooh Oh, oh, oh, ooh, ooh   One day, when it swings, I'll laugh and say That I don't care anyway and I will mean it One day, I'll be a bigger man than this Will not be so sensitive, yeah, I can see it 'Til then   I been roll, I been rollin' on These emo-, these emotions been pulling me over the edge Changing the size of my head Back and forth, back and forth and now, I'm exposed My ego is like, oh no, here we go again Leraning to live with the swing of this pendulum I been roll, I been rollin' on These emo-, these emotions been pulling me over the edge Changing the size of my head Back and forth, back and forth and now, I'm exposed My ego is like, oh no, here we go again Leraning to live with the swing of this pendulum   Oh, oh, oh, ooh, ooh Oh, oh, oh, ooh, ooh"
/songs/491429,Andy Grammer,Pushing,https://genius.com/Andy-grammer-pushing-lyrics,http://api.genius.com/songs/491429,Magazines or Novels,2014-08-05," I've been pushing all my life, all my life, all my life I've been pushing all my life I've been pushing all my life, all my life, all my life I've been pushing all my life   For someone to see right through All the false alarms I pull For someone to stand their ground When I start to tear them down For someone to outlast The hold ups that hold me back For someone to make it past The guards of a cynical heart, si-singing out   Oh, I always jump ship But we are closer than I've ever been I say we stay in the fire And hope we can burn our way out The road to my heart gets hot as hell   I've been pushing all my life, all my life, all my life I've been pushing all my life I've been pushing all my life, all my life, all my life I've been pushing all my life   For someone to call me out When I start to run my mouth For someone to talk me down Off ledges that I have found For someone to hold me close When I'm screaming to let go For someone to make it past The guards of a cynical heart, si-singing out   Oh, I always jump ship But we are closer than I've ever been I say we stay in the fire And hope we can burn our way out The road to my heart gets hot as hell I've been pushing all my life, all my life, all my life I've been pushing all my life I've been pushing all my life, all my life, all my life I've been pushing all my life   I know that it's not fair To think that you'll still be there I know that it's not fair But if you leave well the pattern repeats I'm pushing you away but that's not what I mean Oh, I'm ashamed and I cannot believe That this is what it take just to get close to me Is this what it takes just to get close to me Oh, I always jump ship But we are closer than I've ever been   Oh, I always jump ship But we are closer than I've ever been I say we stay in the fire And hope we can burn our way out The road to my heart gets hot as hell   I've been pushing all my life, all my life, all my life I've been pushing all my life I've been pushing all my life, all my life, all my life I've been pushing all my life"
/songs/607633,Andy Grammer,Red Eye,https://genius.com/Andy-grammer-red-eye-lyrics,http://api.genius.com/songs/607633,Magazines or Novels,2014-08-05," I lost perspective of who I was, I hit the wall I knew that it would take a lot, but it took it all No, you don't come this far to turn around Covered too many miles No, you don't get this close to breaking out Just to close your eyes   While the world sleeps under my feet tonight I'm chasing myself in the sky While the world sleeps under my feet tonight I'll be up here learning to fly When you love what you can't let go And your heart, it already knows Sure it'll hurt, but it's worth every burn Cause one day you'll get home Still it feels like I am always on the red eye   This time around it's not even about getting paid I'm just an addict for the moment when the magic is made When you are who you are, who you really are It can put you through hell Spend a day in the skin that you want to live in And see how it feels   While the world sleeps under my feet tonight I'm chasing myself in the sky While the world sleeps under my feet tonight I'll be up here learning to fly When you love what you can't let go And your heart, it already knows Sure it'll hurt, but it's worth every burn Cause one day you'll get home Still it feels like I am always on the red Feels like I am always on the red eye   Finding myself these days Looking down from the window seat I'm counting lights on houses When I should be counting sheep Truth is that I can't complain I'll do it over and over again And over again   While the world sleeps under my feet tonight I'm chasing myself in the sky While the world sleeps under my feet tonight I'll be up here learning to fly While the world sleeps under my feet tonight I'm chasing myself in the sky While the world sleeps under my feet tonight I'll be up here learning to fly When you love what you can't let go And your heart, it already knows Sure it'll hurt, but it's worth every burn Cause one day you'll get home Still it feels like I am always on the red Feels like I am always on the red eye"
/songs/607620,Andy Grammer,Remind You,https://genius.com/Andy-grammer-remind-you-lyrics,http://api.genius.com/songs/607620,Magazines or Novels,2014-08-05," It doesn't mean you're weak Or that you got low self esteem We all got hearts that forget why they beat We are brilliant We are unique But we forget so effortlessly   And when you're questioning your worth In the way that we all do And your version of amnesia starts to seep on through And you know that you are great, but you can't remember why I will be there by your side   I will remind you, I will remind you I will be, I'll be your memory I will remind you, I will remind you All you need is someone else to see I will remind you, I will remind you I will be, I'll be your memory I will remind you, I will remind you All you need is someone else to see And it reminds you   We get a little bit lost Like ships at sea We don't remember We're right where we're supposed to be   And when you're questioning your worth In the way that we all do And your version of amnesia starts to seep on through And you know that you are great, but you can't remember why I will be there by your side   I will remind you, I will remind you I will be, I'll be your memory I will remind you, I will remind you All you need is someone else to see I will remind you, I will remind you I will be, I'll be your memory I will remind you, I will remind you All you need is someone else to see And it reminds you   A little bit of love from someone you trust Can bring you back to life, a little bit of love A little bit of love from someone you trust Can bring you back to life, a little bit of love A little bit of love from someone you trust Can bring you back to life, a little bit of love A little bit of love from someone you trust Can bring you back to life, a little bit of love   I will remind you, I will remind you I will be, I'll be your memory I will remind you, I will remind you All you need is someone else to see I will remind you, I will remind you I will be, I'll be your memory I will remind you, I will remind you All you need is someone else to see And it reminds you"
/songs/607625,Andy Grammer,Sinner,https://genius.com/Andy-grammer-sinner-lyrics,http://api.genius.com/songs/607625,Magazines or Novels,2014-08-05," I've been throwing stones, waiting by the river I've been on my own, praying like a sinner And you've been gone too long I'm waiting out the winter And I've been on my knees, praying like Praying like a sinner   Well you built a city right in me And brick by brick and piece by piece And love in both your hands Tried to make an honest man From when I woke until I went to sleep You planned my life so carefully Sculpted me like clay, I can see you in my face And I never thought I'd live this life without your guiding light   I've been throwing stones, waiting by the river I've been on my own, praying like a sinner And you've been gone too long I'm waiting out the winter And I've been on my knees, praying like Praying like a sinner   And I heard the walls are paper thin From where you are to where I am But I don't feel a thing If you all keep pulling strings Send on a down a message please Light a bulb or haunt my dreams I'd just like to know that you hear me, that you're close And I never thought I'd live this life without your guiding light   I've been throwing stones, waiting by the river I've been on my own, praying like a sinner And you've been gone too long I'm waiting out the winter And I've been on my knees, praying like Praying like a sinner   You've been gone for too long, oh, oh You've been gone for too long, oh, oh   I've been throwing stones, waiting by the river I've been on my own, praying like a sinner And you've been gone too long I'm waiting out the winter And I've been on my knees, praying like  I've been throwing stones, waiting by the river I've been on my own, praying like a sinner And you've been gone too long I'm waiting out the winter And I've been on my knees, praying like Praying like a sinner  Praying like a sinner  I've been throwing stones, waiting by the river I've been on my own, praying like a sinner And you've been gone too long I'm waiting out the winter And I've been on my knees, praying like Praying like a sinner"
/songs/152428,Andy Grammer,Slow,https://genius.com/Andy-grammer-slow-lyrics,http://api.genius.com/songs/152428,Andy Grammer,2011-06-14," A charcoal heart that you can't ignore Cuz you've been burned before You tell me everything that's good will end You were building castles in the air But they fell to the ground, there was nothing there You said you'll never get so close again   And lately It's yellow lights and you're breaking Say you just wanna wait and See it all unfold But baby When you find what you're seeking Something you can believe in You just gotta go   So let's not take is slow Let's not take it slow I don't wanna take it slow Let's not take it slow   I don't wanna rush your love But I can never get get enough I'm sitting outside your door I'll give you everything you need Sunshine, the world and all your dreams So what are we waiting for?  Oh   BUT lately...   Waiting for The perfect storm We've been slowly chasing love But now it's time To cross the line And I want more  Oh   BUT lately...    Slow-oh-oh Oh..."
