api_path,primary_artist,title,url,song_endpoint,album,release_date,lyrics
/songs/3301934,Andy Grammer,Smoke Clears,https://genius.com/Andy-grammer-smoke-clears-lyrics,http://api.genius.com/songs/3301934,The Good Parts,2017-11-03," ""You and I, against the world,"" that's what she told me That night, in the terminal as we were boarding And I know you meant it, holding my hand so tight as We flew, from Lafayette back to Pacific time   And you lay your head on my shoulder Couple tears were shed over Arizona An emotional roller coaster, yeah   We ride the highs and lows We ride the highs and lows You'll never be alone even when your world explodes 'Cause after all the smoke clears, I will be right here   I will be right here when the smoke clears I will be right here when the smoke clears   And when I hit the wall back in December I took my hardest fall, but we fell together And we spent the weekend pacing the hotel room at The Westin in Dublin, never felt so close to you   And I laid my head on your shoulder By the time we left we were ten years older An emotional roller coaster, yeah   We ride the highs and lows We ride the highs and lows You'll never be alone even when your world explodes 'Cause after all the smoke clears, I will be right here   I will be right here when the smoke clears I will be right here when the smoke clears   ""You and I, against the world,"" that's what you told me   We ride the highs and lows We ride the highs and lows You'll never be alone even when your world explodes 'Cause after all the smoke clears, I will be right here   I will be right here when the smoke clears I will be right here when the smoke clears"
/songs/3302294,Andy Grammer,Spaceship,https://genius.com/Andy-grammer-spaceship-lyrics,http://api.genius.com/songs/3302294,The Good Parts,2017-12-01," Yeah, your mom threw up three times again Having a hard time keeping down the vitamins Goes from laughing to crying to smiling Couple times, real close to being violent, hey oh We're not really parents, but we kinda are You're gonna call me ""Dad,"" shit, that's bizarre Yesterday, couple kids making out in cars Now I'm staring at a screen of your beating heart   She been in the lab, cooking you up Damn, you growing fast, it's like you in a rush Don't know if you can hear, that's why I get close Singing to her belly just to let you know   Somebody loves you, you got a friend Even if you don't know it yet Somebody loves you, we're making plans Waiting for your spaceship to land   I still cook most dinners in the microwave And my plants all died over the holidays And I don't know how I'm gonna ever pay For the Ivy League school you gon' graduate And I'ma be there learning right beside you Probably teach me more than I can teach you But I promise you I'm always gonna show up Might be the only thing that I'm really sure of   Is you'll become a kid, and I'll become a man But first, we're gonna crawl, together we'll stand Ain't sure if you can hear, that's why I get close Singing to her belly just to let you know   Somebody loves you, you got a friend Even if you don't know it yet Somebody loves you, we're making plans Waiting for your spaceship to land   Yeah, it's crazy, 'cause if I'm singing to you Then my mom up in heaven's probably singing to me, too Edges of the world makes some damn good music Gotta close your eyes and listen to it Yeah, it's crazy, 'cause if I'm singing to you Then my mom up in heaven's probably singing to me, too Edges of the world makes some damn good music Gotta close your eyes and listen to it   She been in the lab, cooking you up Damn, you growing fast, it's like you in a rush Don't know if you can hear, that's why I get close Singing to her belly just to let you know   Somebody loves you, you got a friend Even if you don't know it yet Somebody loves you, we're making plans Waiting for your spaceship to land   Whoa, waiting, whoa, waiting Waiting for your spaceship to land Whoa, whoa, whoa, just waiting, whoa, waiting Waiting for your spaceship to land"
/songs/3113863,Andy Grammer,The Good Parts,https://genius.com/Andy-grammer-the-good-parts-lyrics,http://api.genius.com/songs/3113863,The Good Parts,2017-11-03," I'm sorry if I seem impatient I'm not a fan of pleasantries See, I get bored with the weather and what's in the news The topics we all hide beneath Could not care less about your day job The gossip or ordinary stress See, every relationship I've ever loved It starts when someone says   Show me where it hurts and give me something real And lead me to the part of you that never really heals And say the words that burn when they leave your mouth Tell me your story, but don't leave the good parts out   And tell me all about your failures The little things that make you cry And tell me the acts that you preach but cannot seem to practice That leave you compromised   Show me where it hurts and give me something real And lead me to the part of you that never really heals And say the words that burn when they leave your mouth Tell me your story, but don't leave the good parts out   I've seen your trophies, your highlight reels You know I would love you still if you lost it all And I love the castle that you have built But I am asking still to let down the walls   Show me where it hurts and give me something real And lead me to the part of you that never really heals And say the words that burn when they leave your mouth Tell me your story Show me where it hurts, yeah Oh, to the part of you that never really heals And show me where it hurts, woah Tell me your story But don't leave the good parts out Don't leave the good parts out"
/songs/152434,Andy Grammer,The Pocket,https://genius.com/Andy-grammer-the-pocket-lyrics,http://api.genius.com/songs/152434,Andy Grammer,2011-06-14," Do you wanna be My love, my sight My heart and my eyes My world, my pride My stars in my sky? I am looking for a queen who's more than gorgeous on a movie screen I am looking for the cover girl of Dignified Beauty magazine I want dimples and simple symbols that she's sweet Wrinkles on her nose expose what I mean I am looking for a four-course meal that isn't based in base desire I am looking for a lady who knows the soul is more than an appetizer   Oh, just one more thing, yeah Oh, just one more thing, no   Do we fit in the pocket? Can we fit, sit back in the pocket? When the dreams and the drums start rocking Can we dance with our knees not knocking? Not knocking, no See, I, I want a lady I can put stock in I want a bass and back beat to lock in I wanna know real love's not forgotten, not forgotten   I want a teacher who's eager to speak her mind Delicate features, sweet with her tongue so kind I am looking for the markers that say ""permanent"" so we can share I am looking for a love that's still alive and well in rocking chairs I want faithful and stable, able to grow Beauty that moves me, improves my soul I am looking for a shining light who likes to fight and persevere I am looking for a lady who wants to make me part of her atmosphere   Oh, just one more thing Oh, just one more thing, no   Do we fit in the pocket? Can we fit, sit back in the pocket? When the dreams and the drums start rocking Can we dance with our knees not knocking? Not knocking, no See, I, I want a lady I can put stock in I want a bass and back beat to lock in I wanna know real love's not forgotten, not forgotten   Said all I need to know is All I need to know is All I need to know is Are you clear on who you are? Do you love it? When this world starts getting hard Will you rise above it, rise above it?   In the pocket? Can we fit, sit back in the pocket? When the dreams and the drums start rocking Can we dance with our knees not knocking? Not knocking, no See, I, I want a lady I can put stock in I want a bass and back beat to lock in I wanna know real love's not forgotten, not forgotten I said the pocket Can we fit, sit back in the pocket? When the dreams and the drums start rocking Can we dance with our knees not knocking? Not knocking, no See, I, I want a lady I can put stock in I want a bass and back beat to lock in I wanna know real love's not forgotten, not forgotten   Sayin', ""Ohh, na na na na na"" Singing out, ""Ohh ohh"""
/songs/3343898,Andy Grammer,The World Is Yours,https://genius.com/Andy-grammer-the-world-is-yours-lyrics,http://api.genius.com/songs/3343898,The World Is Yours,2007-09-29," This is the song that you throw on when life is feeling rather long And you're longing for confidence to make it And these are the words that make you feel That all your dreams aren't dreams But real events that simply haven't taken place yet   But if you stare high The sky will come right down and kiss you If you keep your head towards the stars, they will assist you The world is yours, the world is yours   This is the time of night When all the streetlights rub their waking eyes The day and night find compromise in dark blue This is the magic in the air That whispers, ""You are almost there"" The worries, cares, and daydreamers will leave soon   But if you stare high The sky will come right down and kiss you If you keep your head towards the stars, they will assist you The world is yours, the world is yours   This is the song that you throw on when life is feeling rather long And you're longing for confidence to make it And these are the words that make you feel That all your dreams aren't dreams But real events that simply haven't taken place yet   But if you stare high The sky will come right down and kiss you If you keep your head towards the stars, they will assist you The world is yours, the world is yours What you waiting for? The world is yours, the world is yours"
/songs/3302299,Andy Grammer,This Ain't Love,https://genius.com/Andy-grammer-this-aint-love-lyrics,http://api.genius.com/songs/3302299,The Good Parts,2017-12-01," This ain't love This ain't love I never understood the game Forever awkward when I tried to play it I get too deep with everything But every now and then I get impatient   So I told that angel on my shoulder You go home, won't need you tonight Grabbed your waist and pulled you closer in so tight Now we're faking sleep here on your sofa Like we do this all of the time One thing's running over and over in my mind   This ain't love I may have fooled myself again This ain't love I've always been too sensitive To have a good night To have a good time Because my heart can't handle it If it ain't love If this ain't love   I never understood the game I care too much about my reputation You know it's just how I was made But I'm tired of trying to explain it   So I told that angel on my shoulder You go home, won't need you tonight Grabbed your waist and pulled you closer in so tight Now we're faking sleep here on your sofa Like we do this all of the time One thing's running over and over in my mind   This ain't love I may have fooled myself again This ain't love I've always been too sensitive To have a good night To have a good time Because my heart can't handle it If it ain't love If this ain't love   So I told that angel on my shoulder You go home, don't need you tonight Grabbed your waist and pulled you closer in so tight Now we're faking sleep here on your sofa Like we do this all of the time One thing's running over and over in my mind   This ain't love I may have fooled myself again This ain't love I've always been too sensitive To have a good night To have a good time Because my heart can't handle it If it ain't love If this ain't love   This ain't love I may have fooled myself again This ain't love I've always been too sensitive To have a good night To have a good time Because my heart can't handle it If it ain't love If this ain't love"
/songs/3302297,Andy Grammer,Workin On It,https://genius.com/Andy-grammer-workin-on-it-lyrics,http://api.genius.com/songs/3302297,The Good Parts,2017-12-01," You know we're just working on it No leaderboard keeping score Long as you woke up this morning And see you're working on it It might be taking forever, but it's better than never   Smoking two packs a day, down to one It don't sound like much, but for him, that's a revelation You shoulda seen the pride in his eyes When he said how far he's come from where he was   I'm like, oh yeah, I get it, it's alright We all got our monsters that don't see the day light I'm like, oh yeah, I get it, it's alright Skeletons you're hiding ain't gon' leave overnight   You know we're just working on it No leaderboard keeping score Long as you woke up this morning And see you're working on it It might be taking forever, but it's better than never So go easy, easy Everybody got ugly, ugly You know we're just working on it We're working on it, working on it   Last night, you left the bar all alone First time in a while you slept at home And now you're back to chasing that watered-down love You already know that ain't what you want   And I'm like, oh yeah, I get it, it's alright We all got our monsters that don't see the day light I'm like, oh yeah, I get it, it's alright Skeletons you're hiding ain't gon' leave overnight   You know we're just working on it No leaderboard keeping score Long as you woke up this morning And see you're working on it It might be taking forever, but it's better than never So go easy, easy Everybody got ugly, ugly You know we're just working on it We're working on it, working on it   You know we're just working on it We're working on it, working on it   Put a magnifying glass to my life Believe me, you will find some shit Your eyes should unsee, ears unhear Let's be clear, we all shady Day by day, we fight the good fight Maybe once in a while, we find the strength to be okay And find some patience for ourselves Don't be so hard upon yourself Show some love to yourself   You know we're just working on it No leaderboard keeping score Long as you woke up this morning And see you're working on it It might be taking forever, but it's better than never So go easy, easy Everybody got ugly, ugly You know we're just working on it We're working on it, working on it   Go easy, easy Everybody got ugly, ugly You know we're just working on it We're working on it, working on it"
/songs/152430,Andy Grammer,You Should Know Better,https://genius.com/Andy-grammer-you-should-know-better-lyrics,http://api.genius.com/songs/152430,Andy Grammer,2011-06-14," I'm on the phone You turn your back on me and We're all alone Why is this happening? I I never thought I would be questioning the one I One I love   But here we are Rapped up in silence Can we Sound the alarm? Most of it fighting I don't Know where to start I keep colliding with the one I One I love   Don't make it so hard for me to stay You should know better than that   And before You go on breaking my heart And I fall Even deeper in love And my lungs Screaming out ""can you hear me?"" You should know better than that  Here we are Here we are Whoa   If I could leave I would be leaving cuz I Cannot believe What I am hearing tell me How can it be? I'm second-guessing on the one I One I love    Here we are Here we are Whoa Here we are Here we are Again   Some forgive just to forget I've not forgotten yet I still believe in you But there's a crack in our cement This time it's permanent Permanent  You should know You should know better than that    And here we are Here we are Whoa And here we are Here we are Again  You should know better than that  And here we are Here we are Whoa And here we are Here we are Again  You should know better than that"
