api_path,primary_artist,title,url,song_endpoint,album,release_date,lyrics
/songs/2374230,Andy Grammer,Fences,https://genius.com/Andy-grammer-fences-lyrics,http://api.genius.com/songs/2374230,Magazines or Novels (Deluxe Edition),2015-11-20," Down to earth in the dirt Used 'em up so I'm out of words Barely breathing Still alive as samurais cut me up and then down the sides Stop the bleeding   Did I say, say I know anything? 'Cause I don't But I will pay, pay double just to get what I want   I keep swinging for the fences, ah, for the fences, ah I keep swinging Makes no sense, but I go again 'Cause I, I might just be dumb enough to keep on trying 'til I die And I keep swinging for the fences, ah, for the fences, ah   Steady odds in the eyes, out of luck, but I roll the dice Still believing Keep the faith, no time to pray, warming up for a Hail Mary Got that feeling   Did I say, say I know anything? 'Cause I don't Yeah, but playing safe, safe isn't really playing at all At all   I keep swinging for the fences, ah, for the fences, ah I keep swinging Makes no sense, but I go again 'Cause I, I might be just dumb enough to keep on trying 'til I die And I keep swinging for the fences, ah, for the fences   And it's hard when the fire keeps crawling up your sleeves And it's harder than you ever thought that it could ever be And a light in the dark is all you wanna see, you wanna see And it's hard when the fire keeps crawling up your sleeves And it's harder than you ever thought that it could ever be And a light in the dark is all you wanna see, all you wanna see   I keep swinging for the fences, ah, for the fences, ah I keep swinging Makes no sense, but I go again 'Cause I, I might be just dumb enough to keep on trying 'til I die And I keep swinging for the fences, ah, for the fences, ah I keep swinging for the fences, ah, for the fences, ah I keep swinging Makes no sense, but I go again 'Cause I, I might be just dumb enough to keep on trying 'til I die And I keep swinging for the fences, ah, for the fences"
/songs/117397,Andy Grammer,Fine By Me,https://genius.com/Andy-grammer-fine-by-me-lyrics,http://api.genius.com/songs/117397,Andy Grammer,2011-06-14," You're not the type, type a girl To remain with a guy, with a guy too shy too afraid To say he'll give his heart to you forever I'm not the boy who will fall to his knees With his hands clasped tight beggin' beggin' you please To stay with him for worse or for better   But I'm staring at you now There's no one else around I'm thinking you're the girl for me   I'm just saying it's fine by me If you never leave And we can live like this forever It's fine by me   In the past I would try Try hard to commit to a girl Wouldn't get too far It always somehow seemed to fall apart But with you I can see what I need I can dream realistically I knew that this was different from the start And it seems that every time we're eye to eye I can find another piece of you, that I don't want to lose   And I'm staring at you now There's no one else around I'm thinking you're the girl I need   I'm just saying it's fine by me If you never leave And we can live like this forever It's fine by me I'm just saying it's fine by me If you never leave And we can live like this forever It's fine by me   And it's never easy But darling believe me I'm as skeptical as you But when I think of life without us It seems like what we're supposed to do But I don't wanna come on too strong   I'm just saying it's fine by me If you never leave And we can live like this forever It's fine by me It's fine by me If you never leave And we can live like this forever It's fine by me I'm just saying it's fine by me If we never leave And we can live like this forever It's fine by me"
/songs/1612119,Andy Grammer,Fine By Me (EP),https://genius.com/Andy-grammer-fine-by-me-ep-lyrics,http://api.genius.com/songs/1612119,None,2007-01-01,"You're not the type Type of girl to remain With the guy, with the guy too shy Too afraid to say, he'll give his heart to you forever I'm not the boy that will fall to his knees With his hands clenched tight Begging, begging you please To stay with? him for worse and for better But I'm staring at you now There's no one else around I'm thinking you're the girl for me I'm just saying it's fine by me If you never leave And? we can live like this forever It's fine by me In the past I would try Try hard to commit to a girl Wouldn't get too far And it always somehow seemed to fall apart And with you, you, you I can see what I need I can dream realistically I knew that this was different from the start And it seems that every time We're eye to eye I can find another piece of you That I don't wanna lose And? I'm staring at you now There's no one else around I'm thinking you're the girl I need I'm just saying it's fine by me If you never leave And we can live like this forever It's fine by me I'm just saying it's fine by me If you never leave And we can live like this forever It's fine by me And it's never easy Darling, believe me I'm as sceptical as you When I think of life without 'us' She's like ""what we supposed to do?"" But I don't wanna come on too strong I'm just saying it's fine by me If you never leave We can live like this forever It's fine by me It's fine by me if you never leave And we can live? like this forever It's fine by me I'm just saying it's fine by me If we never leave And we can live like this forever It's fine by me"
/songs/491442,Andy Grammer,Forever,https://genius.com/Andy-grammer-forever-lyrics,http://api.genius.com/songs/491442,Magazines or Novels,2014-08-05," It's amazing the time that it's taken For you to come out here I don't know what you do in there Only so many ways you can change How light will hit your face Or how you can fix your hair   You only got two eyes, two lips, so why It shouldn't really take long at all But when you finally smile cause it's just right Damn, you look beautiful   You take forever, ever, ever, ever But you're always worth waiting for You take forever, ever, ever, ever I guess I'll wait a little more Now, I know it's time I realize I will be waiting half my life With my back up against the door Cause you take forever, ever, ever, ever, ever, ever, ever But you're always worth waiting for   And you lie through your teeth When you try to convince me that you'll be That you'll be out in less than five Cause we both know that the only way you will ever leave Is if we set the whole place on fire   You already said you had the perfect dress So why you got to try them all No matter how late it gets, I must confess Damn, you look beautiful   You take forever, ever, ever, ever But you're always worth waiting for You take forever, ever, ever, ever I guess I'll wait a little more Now, I know it's time I realize I will be waiting half my life With my back up against the door Cause you take forever, ever, ever, ever, ever, ever, ever But you're always worth waiting for   You take forever, ever, ever, ever I guess I'll wait a little more Na na na, whoa, oh, whoa, yeah Whoa, oh, whoa I guess I'll wait a little more"
/songs/3302293,Andy Grammer,Freeze,https://genius.com/Andy-grammer-freeze-lyrics,http://api.genius.com/songs/3302293,The Good Parts,2017-11-17," Too good, it makes me nervous That we could ever keep this pace And I know that's probably stupid But that's my brain Oh, I know that nothing's perfect But we are in a perfect place And I don't wanna lose it I don't want the stars to fade   You make me wanna hit freeze Stay forever in this moment Polaroid, I wanna hold it You make me want to, you make me want to hit freeze Time is slipping through my fingers Tryna check the universe Can we, we   I just want to hit freeze right now, now, now Oh, I just want you and me right now, now, now Oh, I just want to hit freeze right now, now, now I wanna hit freeze   'Cause if nothing is for certain But I'ma keep you up all night Tryin' to get every word in While we have time Heaven knows that the seasons change We might be in our golden age Forever will look different every day Not trying to live in yesterday But there are some things that should stay the same Oh, slow and steady, this is not a race   You make me wanna hit freeze Stay forever in this moment Polaroid, I wanna hold it You make me want to, you make me want to hit freeze Time is slipping through my fingers Tryna check the universe Can we, we   I just want to hit freeze right now, now, now Oh, I just want you and me right now, now, now Oh, I just want to hit freeze right now, now, now I wanna hit freeze   You make me never wanna leave Stay forever in this moment Polaroid, I wanna hold it You make me want to, you make me want to be me Time is slipping through my fingers Tryna check the universe Can we   You make me wanna hit freeze Stay forever in this moment Polaroid, I wanna hold it Make me want to, you make me want to hit freeze Time is slipping through my fingers Tryna check the universe Can we, we   I just want to hit freeze right now, now, now Oh, I just want you and me right now, now, now Oh, I just want to hit freeze right now, now, now I wanna hit freeze"
/songs/2828050,Andy Grammer,Fresh Eyes,https://genius.com/Andy-grammer-fresh-eyes-lyrics,http://api.genius.com/songs/2828050,The Good Parts,2016-07-29," I got these fresh eyes, never seen you before like this My God, you're beautiful It's like the first time when we opened the door 'Fore we got used to usual   It might seem superficial Stereotypical, man You dress up just a little and I'm like, ""Oh, damn""   So suddenly, I'm in love with a stranger I can't believe that she's mine Now all I see is you with fresh eyes, fresh eyes So suddenly, I'm in love with a stranger I can't believe that she's mine, yeah And now all I see is you with fresh eyes, fresh eyes   Appreciation, well, it comes and it goes But I, I'll ride that wave with you It's human nature to miss what's under your nose 'Til you, 'til you remind a fool   Maybe all of this is simple My heart's unconditional, yeah You dress up just a little and I'm like, ""Oh, damn""   So suddenly, I'm in love with a stranger I can't believe that she's mine Now all I see is you with fresh eyes, fresh eyes So suddenly, I'm in love with a stranger I can't believe that she's mine, yeah And now all I see is you with fresh eyes, fresh eyes   If I could bottle this up, bottle, bottle this up, I would I would bottle this up, bottle, bottle this up, I would 'Cause you're gorgeous in this moment If I could bottle this up, I would   So suddenly, I'm in love with a stranger I can't believe that she's mine Now all I see is you with fresh eyes, fresh eyes So suddenly, I'm in love with a stranger I can't believe that she's mine, yeah And now all I see is you with fresh eyes, fresh eyes"
/songs/3113836,Andy Grammer,Give Love,https://genius.com/Andy-grammer-give-love-lyrics,http://api.genius.com/songs/3113836,The Good Parts,2017-06-09," My, my, my mother was a sunshine soldier Everyday was a dream come true She said that we were blessed by the breath deep inside us She could make the colors in the sky turn blue   She said, ""Honey, whatcha gonna  do today? You're second guessing every single move you make You're definitely gonna have some very hard days But I'll be right here for you"" And she said, ""Before I go There is one thing you should know""   ""I give love to all of my people All of my people need love, I give some I give love to all of my people All of my people need love, I give some I give love to all of my people All of my people need love, I give some 'Cause in the end, the love we take's Got nothing on the love we make So give love, so give love, so give love""   She, she said, ""You're gonna be a light in a cold world You got extra love pumping up your veins"" To my people feeling down and my people feeling empty I got so much of this love, I gotta give it away   ""Hey, honey, whatcha gonna do today? You're second guessing every single move you make You're definitely gonna have some very hard days But I'll be right here for you"" And she said, ""Before I go There is one thing you should know""   ""I give love to all of my people All of my people need love, I give some I give love to all of my people All of my people need love, I give some I give love to all of my people All of my people need love, I give some 'Cause in the end, the love we take's Got nothing on the love we make So give love (Yuh) So give love (Andy, you know I got you!) So give love (Yeah, yeah)""   Put this on repeat, it's so elementary This that 1 + 1 is 2, you sprinkle love, that equal 3 Maybe that's the remedy, blind man, he can even see If you wanna cook it up, well, then I know the recipe It's the L-O-V-E, (ah) now you see me (ride) Down the avenue, they hate I'm throwin' the peace (sign) That my own reply, you know I don't even try Yeah, I give that love, I get that love, I know the reason why   ""I give love to all of my people All of my people need love, I give some I give love to all of my people All of my people need love, I give some I give love to all of my people All of my people need love, I give some 'Cause in the end, the love we take's Got nothing on the love we make So give love So give love So give love"""
/songs/3302301,Andy Grammer,Grow,https://genius.com/Andy-grammer-grow-lyrics,http://api.genius.com/songs/3302301,The Good Parts,2017-12-01," Good and grown, Lord knows I still ain't got it figured out yet Maybe 30 more years, I'll know the answer to it all Told myself I'd be like Mike, six rings on my fingers And I'd be sipping on something somewhere, escaping from it all   I work hard (Damn right), I get bored (Sometimes) Do it big (All night), still want more We ain't made to have it made So what I'm trying to say, what I'm trying to say   Is you gotta grow Love yourself and be kind, water your soul Celebrate and find your light It don't matter who you are, where you're going, young or old We all know, yeah, we all know Gotta grow   Hearts all break, you're gonna break Hearts just learn when it happens When you plant your seeds, be careful reaping what you sewed Don't feel lost in the weeds, don't count your medals, stay humble And if you're gonna live fast, strap up, not everything is gold   I work hard (Damn right), I get bored (Sometimes) Do it big (All night), still want more We ain't made to have it made So what I'm trying to say, what I'm trying to say (What I'm trying to say)   Is you gotta grow Love yourself and be kind, water your soul Celebrate and find your light It don't matter who you are, where you're going, young or old We all know, yeah, we all know Gotta grow   Whoa, Lord knows I still ain't got it figured out yet Ain't got it figured out yet, no   I work hard (Damn right), I get bored (Sometimes) Do it big (All night), still want more We ain't made to have it made So what I'm trying to say, what I'm trying to say (What I'm trying to say)   Is you gotta grow Love yourself and be kind, water your soul Celebrate and find your light It don't matter who you are, where you're going, young or old We all know, yeah, we all know Is you gotta grow Love yourself and be kind, water your soul Celebrate and find your light It don't matter who you are, where you're going, young or old We all know, yeah, we all know Gotta grow, gotta grow, gotta grow"
/songs/3302298,Andy Grammer,Grown Ass Man Child,https://genius.com/Andy-grammer-grown-ass-man-child-lyrics,http://api.genius.com/songs/3302298,The Good Parts,2017-12-01," I crush brunch like a mother, hold the bread like a hustler Wife was the light of my life, but we fight 'Cause she backseat drives like no other Yo, and I don't know about you, but I'm feeling 32 So a couple hairs gray in the mirror yesterday But I'm still enjoying the view   This is what it feels like, whoa oh oh oh oh I said, this is what it feels like, whoa oh oh oh oh I pay the bills, I make deals But I still know how to get wild 'Cause I'm a grown-ass man I'm a grown-ass man child, baby (Whoa oh oh oh oh) Child, mama (Whoa oh oh oh oh) I'm Peter Pan with a Cuban in my hand I'm a grown-ass man child, mama (Whoa oh oh oh oh)   I know a little too much now I look but don't touch now Young enough to fly, old enough to realize The sky got nothing on the ground I'm not afraid to be a human Know my flaws and I use them Been through the fire and I burned out fine But I cry with the right type of music   This is what it feels like, whoa oh oh oh oh I said, this is what it feels like, whoa oh oh oh oh I pay the bills, I make deals But I still know how to get wild 'Cause I'm a grown-ass man I'm a grown-ass man child, baby (Whoa oh oh oh oh) Child, mama (Whoa oh oh oh oh) I'm Peter Pan with a Cuban in my hand I'm a grown-ass man child, mama (Whoa oh oh oh oh)   I'll have a second bowl of Oreo a la mode Watching my favorite show, rocking custom socks and boxers Flash Pass at Six Flags, I'm a master Monopoly badass Loser grows a mustache and must wear it to her parents (No)   I'm a grown-ass man child, baby (Whoa oh oh oh oh) Child, mama (Whoa oh oh oh oh) I'm Peter Pan with a Cuban in my hand I'm a grown-ass man child, mama (Whoa oh oh oh oh) Child, baby (Whoa oh oh oh oh) Child, mama (Whoa oh oh oh oh) Belated kid in a Mercedes-Benz I'm a grown-ass man child"
/songs/532299,Andy Grammer,Holding Out,https://genius.com/Andy-grammer-holding-out-lyrics,http://api.genius.com/songs/532299,Magazines or Novels,2015-11-20," When I met you, love, I hadn't done the dirty yet (Seriously?) Called me a unicorn, said that I didn't exist Truth is my card was torn, the V had a couple of rips But I was still holding on to the edge with my finger tips   With a little bit of prayer, a little bit of porn (Sorry) Couple long nights sleeping on my own Waiting for the right one to come along Waiting for the right one and now I know that   I was holding out for you Yeah, I was holding out for you And the neighbors, yeah they all hate us Cause they say that we go too loud I've been holding out for you, oh yeah   And a couple times, thought I might not make it Laying on the bed, both of us half naked Looking in her eyes, something in my heart said save it Here we go again, another awkward conversation   With a little bit of prayer, a little bit of porn (Sorry) Couple long nights sleeping on my own Waiting for the right one to come along Waiting for the right one and now I know that   I was holding out for you Yeah, I was holding out for you And the neighbors, yeah they all hate us Cause they say that we go too loud I've been holding out for you, oh yeah   Cupid's secret is love starts before you need it Cupid's secret is love starts before you need it Cupid's secret is love starts before you need it Cupid's secret is love starts before you need it   With a little bit of prayer, a little bit of porn (Sorry) Couple long nights sleeping on my own Waiting for the right one to come along Waiting for the right one and now I know that   I was holding out for you Yeah, I was holding out for you And the neighbors, yeah they all hate us Cause they say that we go too loud I've been holding out for you, oh yeah   Holding out for you (Love starts before you need it) I was holding out for you (Love starts before you need it) And the neighbors yeah they all hate us Cause they say that we go too loud (Love starts before you need it) Been holding out for you, oh yeah (Love starts before you...)"
/songs/491416,Andy Grammer,"Honey, I'm Good.",https://genius.com/Andy-grammer-honey-im-good-lyrics,http://api.genius.com/songs/491416,Magazines or Novels,2014-08-05," Nah, nah, honey, I'm good I could have another but I probably should not I got somebody at home, home, home, home   It's been a long night here and a long night there And these long, long legs are damn near everywhere Hold up now You look good, I will not lie But if you ask where I'm staying tonight, I gotta be like   Oh baby, nah baby You got me all wrong, baby My baby's already got all of my love So nah, nah, honey, I'm good I could have another but I probably should not I got somebody at home and if I stay I might not leave alone Nah, honey, I'm good I could have another but I probably should not I gotta bid you adieu, to another I will stay true I will stay true, I will stay true   Now, better men than me have failed Drinking from that unholy grail Now check it out I got her and she got me and you got that ass But I kindly gotta be like   Oh baby, nah baby You got me all wrong, baby My baby's already got all of my love So nah, nah, honey, I'm good I could have another but I probably should not I got somebody at home and if I stay I might not leave alone Nah, honey, I'm good I could have another but I probably should not I gotta bid you adieu, to another I will stay true I will stay true, I will stay true   Oh, I'm sure you, sure you will make somebody's night But oh, I assure you, assure you it sure as hell's not mine   Oh no, honey, I'm good I could have another but I probably should not I got somebody at home and if I stay I might not leave alone Nah, honey, I'm good I could have another but I probably should not I gotta bid you adieu, to another I will stay true Nah, nah, honey, I'm good I could have another but I probably should not I got somebody at home and if I stay I might not leave alone Nah, honey, I'm good I could have another but I probably should not I gotta bid you adieu, to another I will stay true I will stay true, I will stay true, I will stay true"
/songs/875830,Andy Grammer,I Choose You,https://genius.com/Andy-grammer-i-choose-you-lyrics,http://api.genius.com/songs/875830,Crazy Beautiful - EP,2013-05-21," When we're born into this world We don't really get a say Little boys and little girls handed the brand new families There comes a time in life when we finally get to choose And I choose you, I choose you We can't give our two cents of how tall we want to be We don't get an opinion on our ethnicity But the one we spend our life with that we get to choose And I choose you, I choose you   I choose you to be by my side I choose you to hold me at night It's the biggest decision I'm about to get right I choose you, I choose you   Everybody has one, a choice they get to make Half human, half heaven that decides the family tree Now we all pick the branches that then become the roots I choose you, I choose you   I choose you to be by my side I choose you to hold me at night It's the biggest decision I'm about to get right And I choose you, I choose you   And I was worried I would not know what to do If I was in these shoes But standing here, it's clearer than the sky is blue That I choose you, I choose you With so little we control, thank God it's in the rules We get to choose, and I choose you   I choose you to be by my side I choose you to hold me at night It's the biggest decision I'm about to get right I choose you, I choose you I choose you, I choose you"
/songs/2271507,Andy Grammer,Kamikaze,https://genius.com/Andy-grammer-kamikaze-lyrics,http://api.genius.com/songs/2271507,Magazines or Novels (Deluxe Edition),2015-05-18," I take a knife, cut a hole in my chest Pull my beating heart out Throw it down on the desk And then roll the dice and let go I'd rather fall, fall flat on my face Than fall short of what could've been a masterpiece And I know it takes a bit of my soul   See, I, I'm not ashamed of the scars from the battles I've lost, so fire away   'Cause my heart's always wide open I'll never close it I won't go down in a place of love 'Cause my heart's always wide open I'll never close it I won't go down in a place of love   'Cause I am I'm a kamika-, I'm a kamikaze I'm a kamika-, I'm a kamikaze I'm a kamika-, I'm a kamikaze   Look at me, look at me It's not hard to see I got a nice long list of insecurities But, oh, a smile I show But you can't, can't be afraid Of mistakes that you haven't even tried to make So let go, scars and all   See, I, I'm not ashamed of the scars from the battles I've lost, so fire away   'Cause my heart's always wide open I'll never close it I won't go down in a place of love 'Cause my heart's always wide open I'll never close it I won't go down in a place of love   'Cause I am I'm a kamika-, I'm a kamikaze I'm a kamika-, I'm a kamikaze I'm a kamika-, I'm a kamikaze Said I'm a kamika-, I'm a kamikaze I'm a kamika-, I'm a kamikaze I'm a kamika-, I'm a kamikaze   'Cause my heart's always wide open I'll never close it I won't go down in a place of love 'Cause my heart's always wide open I'll never close it I won't go down in a place of love   'Cause I am I'm a kamika-, I'm a kamikaze I'm a kamika-, I'm a kamikaze I'm a kamika-, I'm a kamikaze Said I'm a kamika-, I'm a kamikaze I'm a kamika-, I'm a kamikaze I'm a kamika-, I'm a kamikaze"
