api_path,primary_artist,title,url,song_endpoint,album,release_date,lyrics
/songs/3990793,Billie Eilish,6.18.18,https://genius.com/Billie-eilish-61818-lyrics,http://api.genius.com/songs/3990793,None,2019-03-29," Our time is up Your eyes are shut I won't get to tell you what I needed you to know It's dark enough The moonlight doesn't show And all my love Could never bring you home   There's no more stars to find And I'm too far behind And I'd love to let you go I'd love to let you go You're all that's on my mind I called a thousand times And I have to let you go But I love you more and more than you could know   I sat alone Awaited your reply Was driven home When I started to cry I should've known I should've said goodbye I only hoped I would've had more time   There's no more stars to find And I'm too far behind And I'd love to let you go I'd love to let you go You're always on my mind And I called a thousand times And I have to let you go But I love you more and more than you could know   We're both too young To live and die this way A sunny summer day With so much left to say Not 21 The 18th out of pain The day you couldn't stay You made me wanna pray But I think God's fake   There's no more stars to find And I'm too far behind And I'd love to let you go I'd love to let you go You're all that's on my mind When I called a thousand times And I have to let you go But I love you more and more and more and more and more More and more, more and more and more than you will ever know You will never know You will never know"
/songs/4271785,Billie Eilish,8,https://genius.com/Billie-eilish-8-lyrics,http://api.genius.com/songs/4271785,"WHEN WE ALL FALL ASLEEP, WHERE DO WE GO? (Japanese Import)",2019-03-29," Wait a minute, let me finish I know you don't care But can you listen? I came committed, guess I overdid it Wore my heart out on a chain Around my neck, but now it's missin', hmm   Da-da-da-da-da-da (Hmm) Da-da-da-da-da-da-da (Hmm, hmm, hmm, hmm) Oh, hmm, hmm   So I think I better go I never really know how to please you You're lookin' at me like I'm see-through I guess I'm gonna go I just never know how you feel Do you even feel anything?   Da-da-da-da-da-da Da-da-da-da-da-da-da Oh, hmm, hmm   You said, ""Don't treat me badly"" But you said it so sadly So I did the best I could Not thinkin' you would have left me gladly I know you're not sorry Why should you be? 'Cause who am I to be in love When your love never is for me? Me   Da-da-da-da-da-da (Hmm) Da-da-da-da-da-da-da (Hmm, hmm, hmm, hmm) Oh, hmm, hmm   So I think I better go I never really know how to please you You're lookin' at me like I'm see-through I guess I'm gonna go I just never know how you feel Do you even feel anything?"
/songs/4194252,Billie Eilish,​aliens on earth*,https://genius.com/Billie-eilish-aliens-on-earth-lyrics,http://api.genius.com/songs/4194252,None,2019-03-29," Don't believe their lies And look into the skies The Little green men want to hurt me, babe They've been gone for far too long and They're here now Aliens on Earth (bitch) Aliens on Earth (oh fuck dude)"
/songs/4186971,Billie Eilish,​all the good girls go to hell,https://genius.com/Billie-eilish-all-the-good-girls-go-to-hell-lyrics,http://api.genius.com/songs/4186971,"WHEN WE ALL FALL ASLEEP, WHERE DO WE GO? (Japanese Import)",2019-03-29," My Lucifer is lonely   Standing there, killing time Can't commit to anything but a crime Peter's on vacation, an open invitation Animals, evidence Pearly Gates look more like a picket fence Once you get inside 'em Got friends but can't invite them   Hills burn in California My turn to ignore ya Don't say I didn't warn ya   All the good girls go to Hell 'Cause even God herself has enemies And once the water starts to rise And Heaven's out of sight She'll want the Devil on her team   My Lucifer is lonely   Look at you needing me You know I'm not your friend without some greenery Walk in wearin' fetters Peter should know better Your cover up is caving in Man is such a fool, why are we saving him? Poisoning themselves now Begging for our help, wow   Hills burn in California My turn to ignore ya Don't say I didn't warn ya   All the good girls go to Hell 'Cause even God herself has enemies And once the water starts to rise And Heaven's out of sight She'll want the Devil on her team   My Lucifer is lonely There's nothing left to save now My god is gonna owe me There's nothing left to save now   Haha! I cannot do this snowflake"
/songs/3143255,Billie Eilish,​another stupid song*,https://genius.com/Billie-eilish-another-stupid-song-lyrics,http://api.genius.com/songs/3143255,None,2019-03-29," You're saying that you miss me, oh well Never even got a kiss without a countdown It's time to face the facts You treat me like a snack Only text back when you're hungry Your love's so insecure You're never really sure Boy, you never listen   I'm not gonna write another stupid song about you, baby   You're saying that you're sorry, so what? You ask me what I want, for you to shut up It's time to come to terms Put myself first When your bubble bursts got soap in your eye Telling you it's wrong to break into my songs Boy, you gotta listen   I'm not gonna write another stupid song about you, baby   So take this as my last reply And play it when you're lonely Don't you say I didn't try to reach Your hand to hold me I just wanna walk the line Press record and hit rewind I've made up my mind to erase you Oh, to erase you Oh, to erase you Oh, oh"
/songs/3508974,Billie Eilish,Bad,https://genius.com/Billie-eilish-bad-lyrics,http://api.genius.com/songs/3508974,triple j Like a Version 14,2018-02-09," Your butt is mine, I'm gonna tell you right Just show your face in broad daylight I'm telling you on how I feel Gonna hurt your mind, don't shoot to kill I'm giving you on count of three To show your stuff or let it be 'Cause I'm telling you just watch your mouth I know your game what you're about   Well they say the sky's the limit And to me that's really true But my friend you have seen nothing So just wait till I get through   Because I'm bad, I'm bad, c'mon You know I'm big, I'm bad, you know You know I'm big, I'm bad, I'm really really bad And the whole world's got has to answer right now Just to tell you once again Who's bad?   The word is out, you're doing wrong Gonna lock you up before too long Your lying eyes gonna tell you right So listen up, don't make a fight Your talk is cheap, you're not a man You're throwing stones to hide your hands   Well they say the sky's the limit And to me that's really true But my friend you have seen nothing So just wait till I get through   Because I'm big, I'm bad, c'mon You know I'm big, I'm bad, you know You know I'm big, I'm bad, I'm really really bad And the whole world's got to answer right now Just to tell you once again Who's bad?"
/songs/3846446,Billie Eilish,​bad company / so n so*,https://genius.com/Billie-eilish-bad-company-so-n-so-lyrics,http://api.genius.com/songs/3846446,None,2018-05-01," I've got a man that doesn't love me He's got a girl that doesn't love him She's got a brother down in Cali He's got a tattoo for his cousin   Another picture perfect family Shoulda known they'd keep bad company Another house on fire by Venice beach She's got a man she doesn't love who doesn't  love me   I don't need to know Who you ""can't let go"" Cry 'bout ""so and so"" (She's got a man, got a man, doesn't love me)   I'll dance along to your heartbeat To your heart, I've broke before 'Cause I love when you want me Get you begging on all fours   Dirty Wednesday Sun was shining I grab the gun and shot our love down I don't care 'cause I want you And I love how you want me too   I don't need to know Who you ""can't let go"" Cry 'bout ""so and so"" (She's got a man, got a man, doesn't love me)"
/songs/4271772,Billie Eilish,​bad guy,https://genius.com/Billie-eilish-bad-guy-lyrics,http://api.genius.com/songs/4271772,"WHEN WE ALL FALL ASLEEP, WHERE DO WE GO? (Japanese Import)",2019-03-29," White shirt now red, my bloody nose Sleepin', you're on your tippy toes Creepin' around like no one knows Think you're so criminal Bruises on both my knees for you Don't say thank you or please I do what I want when I'm wanting to My soul? So cynical   So you're a tough guy Like it really rough guy Just can't get enough guy Chest always so puffed guy I'm that bad type Make your mama sad type Make your girlfriend mad tight Might seduce your dad type I'm the bad guy Duh   I'm the bad guy   I like it when you take control Even if you know that you don't Own me, I'll let you play the role I'll be your animal My mommy likes to sing along with me But she won't sing this song If she reads all the lyrics She'll pity the men I know   So you're a tough guy Like it really rough guy Just can't get enough guy Chest always so puffed guy I'm that bad type Make your mama sad type Make your girlfriend mad tight Might seduce your dad type I'm the bad guy Duh   I'm the bad guy, duh I'm only good at bein' bad, bad   I like when you get mad I guess I'm pretty glad that you're alone You said she's scared of me? I mean, I don't see what she sees But maybe it's 'cause I'm wearing your cologne   I'm a bad guy I'm a bad guy Bad guy, bad guy I'm a bad"
/songs/4099614,Billie Eilish,​because i'm in love with you*,https://genius.com/Billie-eilish-because-im-in-love-with-you-lyrics,http://api.genius.com/songs/4099614,None,2019-03-29," -want you I swear I'd stop breathing If it would benefit you If that’s all I had to do I'll give up everything Because I'm in love with you Yes, I’m in love with you  I'll give up everything If it would benefit you If thats all i had to do"
/songs/3001600,Billie Eilish,​bellyache,https://genius.com/Billie-eilish-bellyache-lyrics,http://api.genius.com/songs/3001600,dont smile at me - EP,2017-02-24," Mind Mind   Sittin' all alone Mouth full of gum In the driveway My friends aren't far In the back of my car Lay their bodies   Where's my mind? Where's my mind?   They'll be here pretty soon Lookin' through my room For the money I'm bitin' my nails I'm too young to go to jail It's kinda funny   Where's my mind? Where's my mind? Where's my mind? Where's my mind?   Maybe it's in the gutter Where I left my lover What an expensive fake My V is for Vendetta Thought that I'd feel better But now I got a bellyache (Mind)   Everything I do The way I wear my noose Like a necklace I wanna make 'em scared Like I could be anywhere Like I'm reckless   I lost my mind I don't mind Where's my mind? Where's my mind?   Maybe it's in the gutter Where I left my lover What an expensive fake My V is for Vendetta Thought that I'd feel better But now I got a bellyache (Bellyache, bellyache, bellyache, bellyache Bellyache, bellyache) Maybe it's in the gutter Where I left my lover What an expensive fake My V is for Vendetta Thought that I'd feel better But now I got a bellyache"
/songs/3319759,Billie Eilish,​bitches broken hearts,https://genius.com/Billie-eilish-bitches-broken-hearts-lyrics,http://api.genius.com/songs/3319759,dont smile at me (Japanese Import),2018-03-30," You can pretend you don't miss me (Me) You can pretend you don't care All you wanna do is kiss me (Me) Oh, what a shame, I'm not there You can pretend you don't miss me (Me) You can pretend you don't care All you wanna do is kiss me (Me) Well, what a shame, I'm not there   What is it you want? You can lie, but I know that you're not fine Every time you talk It's all 'bout me, but you swear I'm not on your mind   You can pretend you don't miss me (Me) You can pretend you don't care All you wanna do is kiss me (Me) Oh, what a shame, I'm not there   Everybody knows You and I are suicide and stolen art (Art) Pretty mama sews Stitches into all your bitches broken hearts   You can pretend you don't miss me (Me) You can pretend you don't care All you wanna do is kiss me (Me) Oh, what a shame, I'm not there   Somebody new Is gonna comfort you like you want me to Somebody new Is gonna comfort me like you never do   Every now and then, it hits me That I'm the one that got away But I guess being lonely fits me And you were made for begging, ""stay"""
/songs/3038886,Billie Eilish,Bored,https://genius.com/Billie-eilish-bored-lyrics,http://api.genius.com/songs/3038886,13 Reasons Why (A Netflix Original Series Soundtrack),2017-03-30," Aah Aah   The games you played were never fun You'd say you'd stay but then you'd run Aah   Giving you what you're begging for Giving you what you say I need I don't want any settled scores I just want you to set me free Giving you what you're begging for Giving you what you say I need, say I need   I'm not afraid anymore What makes you sure you're all I need? (I need) Forget about it When you walk out the door and leave me torn You're teaching me to live without it Bored, I'm so bored, I'm so bored, so bored   I'm home alone, you're God knows where I hope you don't think that shit's fair   Giving you all you want and more Giving you every piece of me I don't want love I can't afford I just want you to love for free Can't you see that I'm getting bored? Giving you every piece of me, piece of me   I'm not afraid anymore What makes you sure you're all I need? Forget about it When you walk out the door and leave me torn You're teaching me to live without it Bored, I'm so bored, I'm so bored, so bored   Giving you what you're begging for Giving you what you say I need I don't want any settled scores I just want you to set me free Giving you what you're begging for Giving you what you say I need, say I need   I'm not afraid anymore What makes you sure you're all I need? Forget about it And when you walk out the door and leave me torn You're teaching me to live without it"
/songs/4266880,Billie Eilish,​bury a friend,https://genius.com/Billie-eilish-bury-a-friend-lyrics,http://api.genius.com/songs/4266880,"WHEN WE ALL FALL ASLEEP, WHERE DO WE GO? (Japanese Import)",2019-01-30," Billie   What do you want from me? Why don't you run from me? What are you wondering? What do you know? Why aren't you scared of me? Why do you care for me? When we all fall asleep, where do we go?  [Verse 1: Billie Eilish & Mehki Raine] Come here Say it, spit it out, what is it exactly You're payin'? Is the amount cleanin' you out? Am I satisfactory? Today, I'm thinkin' about the things that are deadly The way I'm drinkin' you down Like I wanna drown, like I wanna end me   Step on the glass, staple your tongue (Ahh) Bury a friend, try to wake up (Ah-ahh) Cannibal class, killing the son (Ahh) Bury a friend, I wanna end me   I wanna end me I wanna, I wanna, I wanna… end me I wanna, I wanna, I wanna…   What do you want from me? Why don't you run from me? What are you wondering? What do you know? Why aren't you scared of me? Why do you care for me? When we all fall asleep, where do we go?  [Verse 2: Billie Eilish & Mehki Raine] Listen Keep you in the dark, what had you expected? Me to make you my art and make you a star And get you connected? I'll meet you in the park, I'll be calm and collected But we knew right from the start that you'd fall apart 'Cause I'm too expensive It's probably somethin' that shouldn't be said out loud Honestly, I thought that I would be dead by now (Wow) Calling security, keepin' my head held down Bury the hatchet or bury a friend right now   The debt I owe, gotta sell my soul 'Cause I can't say no, no, I can't say no Then my limbs all froze and my eyes won't close And I can't say no, I can't say no Careful   Step on the glass, staple your tongue (Ahh) Bury a friend, try to wake up (Ah-ahh) Cannibal class, killing the son (Ahh) Bury a friend, I wanna end me   I wanna end me I wanna, I wanna, I wanna… end me I wanna, I wanna, I wanna…   What do you want from me? Why don't you run from me? What are you wondering? What do you know? Why aren't you scared of me? Why do you care for me? When we all fall asleep, where do we go?"
/songs/3742186,Billie Eilish,​call me back,https://genius.com/Billie-eilish-call-me-back-lyrics,http://api.genius.com/songs/3742186,None,2018-03-22," Wait time is the worst I can hardly sit No one has the time Someone's always late I look for you And you look for me Whoa, oh, oh, oh, oh   I don't know why I came down I hold your phone Don't wake up I hear a voice In the ground   Tell me, don't tell me The hard part is telling You something that you would not like me to tell you   Wait time is to blame Mat top frame's a trip We all have the time Someone's always fed I look for you, and you look away Oh, oh, oh, oh, oh Oh, oh, oh, oh   I don't know why I came down I hold your phone Don't wake up I hear a voice In the ground   Waking up is so much fun to do (Tell me, don't tell me, there's something that you would not like me to tell you) '80 movie make out party with you (Tell me, don't tell me, there's something that you would not like me to tell you)"
/songs/4390095,Billie Eilish,Cant Help Falling In Love,https://genius.com/Billie-eilish-cant-help-falling-in-love-lyrics,http://api.genius.com/songs/4390095,None,2017-12-22,"Wise men say only fools rush in But I can't help falling in love with you Shall I stay? Would it be a sin If I can’t help falling in love with you?  -(Oh, here's when it gets hard) Like a- wait Like a river flows Like a river flows -(I'm just gonna not play it) Surely to the sea My darling so it goes Some things are meant to be Take my hand, take my whole life too For I can’t help falling in love with you"
/songs/4105029,Billie Eilish,​​come out and play,https://genius.com/Billie-eilish-come-out-and-play-lyrics,http://api.genius.com/songs/4105029,"WHEN WE ALL FALL ASLEEP, WHERE DO WE GO? (Japanese Import)",2018-11-20," Hmm-mm   Wake up and smell the coffee Is your cup half full or empty? When we talk, you say it softly But I love it when you're awfully quiet Hmm-mm, quiet Hmm-mm   You see the piece of paper Could be a little greater Show me what you could make her You'll never know until you try it Hmm-mm And you don't have to keep it quiet   And I know it makes you nervous But I promise you, it's worth it To show 'em everything you kept inside Don't hide, don't hide Too shy to say, but I hope you stay Don't hide away Come out and play   Look up, out of your window See snow, won't let it in though Leave home, feel the wind blow 'Cause it's colder here inside in silence And you don't have to keep it quiet   Yeah, I know it makes you nervous But I promise you, it's worth it To show 'em everything you kept inside Don't hide, don't hide Too shy to say but I hope you stay Don't hide away Come out and play"
/songs/3143254,Billie Eilish,COPYCAT,https://genius.com/Billie-eilish-copycat-lyrics,http://api.genius.com/songs/3143254,dont smile at me - EP,2017-07-14," Don't be cautious, don't be kind You committed, I'm your crime Push my button anytime You got your finger on the trigger, but your trigger finger's mine   Silver dollar, golden flame Dirty water, poison rain Perfect murder, take your aim I don't belong to anyone, but everybody knows my name   By the way, you've been uninvited 'Cause all you say are all the same things I did   Copycat tryna cop my manner Watch your back when you can't watch mine Copycat tryna cop my glamor Why so sad, bunny? Can't have mine   Call me calloused, call me cold You're italic, I'm in bold Call me cocky, watch your tone You better love me, 'cause you're just a clone   By the way, you've been uninvited 'Cause all you say are all the same things I did   Copycat tryna cop my manner Watch your back when you can't watch mine Copycat tryna cop my glamor Why so sad, bunny? Can't have mine   Mine I would hate to see you go Hate to be the one that told you so You just crossed the line You've run out of time I'm so sorry, now you know Sorry I'm the one that told you so Sorry, sorry, I'm sorry, sorry Psych   By the way, you've been uninvited 'Cause all you say are all the same things I did   Copycat tryna cop my manner Watch your back when you can't watch mine Copycat tryna cop my glamor Why so sad, bunny? Can't have mine"
/songs/3846431,Billie Eilish,​daddy*,https://genius.com/Billie-eilish-daddy-lyrics,http://api.genius.com/songs/3846431,None,2017-12-28," You make me sad, boy Well look who’s sad, daddy   Bitch, [?] or a kisses (I would) Wanna lay down with your misses (Oh yeah) Wanna hear your heartbeat (listen up) When we're apart we [?]   Cause we don't really talk I cry and you console But you can't make me stop Cause I won't take control You got me on all fours The only play I roll There's nothing I love more Than doing what I'm told"
/songs/3373824,Billie Eilish,​dancing on my own,https://genius.com/Billie-eilish-dancing-on-my-own-lyrics,http://api.genius.com/songs/3373824,None,2019-03-29," Somebody said you got a new friend Does she love you better than l can? There's a big black sky over my town I know where you're at, l bet she's around   Yeah, I know it's stupid I just gotta see it for myself I'm in the corner, watching you kiss her, oh I'm right over here, why can't you see me, oh I'm giving it my all, but I'm not the girl you're taking home, oh I keep dancing on my own I keep dancing on my own   Somebody said you got a new friend Does she love you better than l can? There's a big black sky over my town I know where you're at, l bet she's around   Yeah, I know it's stupid I just gotta see it for myself I'm in the corner, watching you kiss her, oh I'm right over here, why can't you see me, oh I've given my all, but I'm not the girl you're taking home, oh I keep dancing on my own I keep dancing on my own"
/songs/4185418,Billie Eilish,​dead*,https://genius.com/Billie-eilish-dead-lyrics,http://api.genius.com/songs/4185418,None,2019-03-29, Dead That how you want me? Would That make you happy? Do You wanna hurt me?  I could take a pill Use a knife Or a gun If I stay still You gonna get the job done?  I’ll do Whatever to please you
/songs/4363292,Billie Eilish,Eres Tú,https://genius.com/Billie-eilish-eres-tu-lyrics,http://api.genius.com/songs/4363292,None,2017-09-25," Hoy desperté con ganas de besarte Tengo una sed de acariciarte Enredarme a ti y no soltarte Eres tan embriagante Eres tú Eres tú   Quiero contemplarte sin contar el tiempo Dibujarte con mis puros recuerdos En mi mente marcarme tus labios, tus besos Estar aquí otro momento Eres tú Eres tú Eres tú"
/songs/2855333,Billie Eilish,Fingers Crossed,https://genius.com/Billie-eilish-fingers-crossed-lyrics,http://api.genius.com/songs/2855333,None,2015-09-14," In the end, when they're all gone When the world is silent and the days are long Just you and I, we'll be alive We made it on our own   'Cause everybody makes it 'till they don't And everybody wants to think they won't 'Cause everybody makes it 'till they don't And everybody seems to think they won't, they won't, they won't, they won't   Baby, I'm still alive but my heart is beating slow Baby, tell me I gotta know Are you okay? You seem too far gone Infected, standing there all alone   'Cause everybody makes it 'till they don't And everybody wants to think they won't And everybody makes it 'till they don't And everybody seems to think they won't, they won't, they won't, they won't   The best of me, the best of me is you The best of me, the best of me was you   Whoa, whoa, whoa, whoa Ladum, badum, mmmm"
/songs/4437867,Billie Eilish,Genius Traduzione Italiana- listen before i go,https://genius.com/Billie-eilish-genius-traduzione-italiana-listen-before-i-go-lyrics,http://api.genius.com/songs/4437867,None,2019-03-29," Portami al tetto Voglio vedere il mondo quando smetto di respirare Diventando blu Dimmi che l'amore è senza fine, non essere così pretenzioso Lasciami come fai sempre (Come fai sempre)   Se hai bisogno di me, mi vuoi vedere Ti conviene sbrigarti perché me ne andrò tra poco   Scusa, non puoi salvarmi adesso Scusa, non so come Scusa, non c’è via di uscita (Scusa) Tranne che giù Hmm, giù   Assaggiami, le lacrime salate sulla mia guancia Questo è quello che ti fa un mal di testa lungo un anno Non sto bene, mi sento così disperso Non dirmi che sono tutto ciò che importa Lasciami, déjà vu (Hmm)   Se hai bisogno di me, mi vuoi vedere Ti conviene sbrigarti, me ne vado tra poco   Scusa, non puoi salvarmi adesso (Scusa) Scusa, non so come (Scusa) Scusa, non c'è via di uscita (Scusa) Tranne che giù Hmm, giù   Chiama i miei amici e digli che gli voglio bene E che mi mancheranno Ma non sono dispiaciuta Chiama i miei amici e digli che gli voglio bene E che mi mancheranno Scusa"
/songs/4271789,Billie Eilish,​goodbye,https://genius.com/Billie-eilish-goodbye-lyrics,http://api.genius.com/songs/4271789,"WHEN WE ALL FALL ASLEEP, WHERE DO WE GO? (Japanese Import)",2019-03-29," Please, please Don't leave﻿ me be   It's not true Take me to the rooftop Told you not to worry What do you want from me? Don't ask questions Wait a minute Don't you know I'm no good for you? Baby, I don't feel so good And all the good girls go ﻿to Hell Bite my tongue, bide my time What is it about them? I'm the bad guy"
/songs/4437007,Billie Eilish,Goodbye (Spanish Translation),https://genius.com/Billie-eilish-goodbye-spanish-translation-lyrics,http://api.genius.com/songs/4437007,None,2019-03-29,"  Por favor, Por favor No me dejes estar    No es verdad Llevame a la azotea Te dije que no te preocuparas ¿Qué quieres de mí? No preguntes nada Espera un minuto ¿Qué no sabes que no soy bueno para ti? Bebé, no me siento tan bien Y todas las chicas buenas se van al infierno Muerde mi lengua, espera mi tiempo ¿Qué hay con ellos? Soy el chico malo"
