api_path,primary_artist,title,url,song_endpoint,album,release_date,lyrics
/songs/185603,Blake Shelton,Draggin' The River,https://genius.com/Blake-shelton-draggin-the-river-lyrics,http://api.genius.com/songs/185603,All About Tonight EP,None," Hey, baby I just asked your daddy If I could take your hand He said, ""Boy, over my dead body"" Guess I aren’t his kind of man  But I love you and you love me So, baby I got to plan We'll push my truck off of Red Top Bridge Right below the Jackson Dam   Hey, they'll be dragging the river Catching nothing but an old catfish They'll be dragging the river That'll show that son of a bitch   It's been raining for the last two weeks So the water's up good and high We'll just wait 'til it's good n' late So there aren’t nobody passing by  I'll call my cousin He'll pick us up an' take us to the Greyhound Bus We'll be standing in front of that preacher By the time they're looking for us   And they'll be dragging the river But they aren’t going to find a thing They'll be dragging the river I'll be wearing me a diamond ring  Ah, we're going to show them   I know that it might sound crazy Just a little bit too extreme But to get some of your sweet loving Baby, I'd do anything  Sooner or later They'll find my letter saying that we're alright We'll be rocking at the Red Roof Inn This time tomorrow night   And they'll be dragging the river Saying, ""Lord, what a crying' shame"" They'll be dragging the river We'll be running', they'll never see it coming   They'll be dragging the river They'll be dragging the river But they aren’t going to find a thing  Sorry about calling your dad a son of a bitch earlier Hey, do you think he'll still hire me? Whoa, that thing's little The diamond, I mean"
/songs/185886,Blake Shelton,Drink On It,https://genius.com/Blake-shelton-drink-on-it-lyrics,http://api.genius.com/songs/185886,Red River Blue,2012-01-09," Hey girl, hey where you going? Come back and sit back down You look too good to be heading home so early now You say you got to work tomorrow Got a lot on your mind Let me buy another round Girl I think you and I should just   Drink on it Put our heads together and think on it Maybe later on we can sleep on it But for right now Girl we just need to drink on it   We can talk rocket science Jesus or politics How your boyfriend cheated on you Man he sounds like such a prick I could use another whiskey And your Cosmo's getting low While we're trying to figure out The next place we should go   We can drink on it Put our heads together and think on it Maybe later on we can sleep on it But for right now Girl we just need to drink on it   This place is closing down But I don't want to quit Got to good thing going girl Let's find out what it is   And drink on it Your place or mine Girl we can drink on it Dust off a bottle and drink on it Feels like we're doing something right Let's find a corner of the night Where you and I can just drink on it Put our heads together and think on it Maybe later on we can sleep on it But for right now Girl we just need to drink on it   Might make a memory that we won't forget   So let's just drink on it Yeah Mm Drink on it Sleep on it We can just drink on it"
/songs/2475916,Blake Shelton,Every Goodbye,https://genius.com/Blake-shelton-every-goodbye-lyrics,http://api.genius.com/songs/2475916,If I'm Honest,2016-05-20," Wrong side of town on the second floor Couple blocks down from the liquor store I got a love seat and a couple DVD's we can watch ...or not I can call a car it will be two minutes 'Til it's at the bar and we hop in it It's pretty clear that we're both here to get over someone   So if you wanna come over, come on If you need a shoulder, it's on I know you got your past and baby I got mine   But every goodbye Can be the start of something new Maybe that starts with me and you We got all night To get to know each other better And try moving on together, together I could kill the pain that you’ve been in You can be my heartbreak medicine Proof that even dark clouds have a silver lining Every goodbye Can be the start of something new I wanna start something with you   There's a reason that we're both here right now And a reason everything didn't work out We're two sets of previous relationships at the same time   Every goodbye Can be the start of something new Maybe that starts with me and you We got all night To get to know each other better And try moving on together, together I could kill the pain that you’ve been in You can be my heartbreak medicine Proof that even dark clouds have a silver lining Every goodbye Can be the start of something new I wanna start something with you   So baby come over, come on If you need a shoulder, it's on I know you got your past and I got mine   But every goodbye Can be the start of something new Maybe that starts with me and you We got all night To get to know each other better And try moving on together, together   So baby come over, come on If you need a shoulder, it's on I know you got your past and I got mine But every goodbye"
/songs/2470267,Blake Shelton,Every Time I Hear That Song,https://genius.com/Blake-shelton-every-time-i-hear-that-song-lyrics,http://api.genius.com/songs/2470267,If I'm Honest,2016-05-20," There's something 'bout yesterday How fast it all flies away I don't know what it is about a goodbye kiss That makes you wanna stay We were crazy then we were over We were breaking up, making love, a runaway roller coaster   Every time I hear that song I’m standing in the pouring rain On your front lawn and oh-oh-oh I still think about you oh-oh-oh Every time I hear that song It's like the first time it came on and oh-oh-oh I still think about you oh-oh-oh I still think about you   There’s something in the bittersweet The feeling of a memory Right there in the moment All I ever wanted was you and me We were crying, we were wasted We were dying when they played it   Every time I hear that song I’m standing in the pouring rain On your front lawn and oh-oh-oh I still think about you oh-oh-oh Every time I hear that song It's like the first time it came on and oh-oh-oh I still think about you oh-oh-oh I still think about you Oh I still think about you   There's a soundtrack in my mind That takes me back in time When I hear that melody I think about you and me   Every time I hear that song I’m standing in the pouring rain On your front lawn and oh-oh-oh I still think about you oh-oh-oh Every time I hear that song It's like the first time it came on and oh-oh-oh I still think about you oh-oh-oh I still think about you Oh, I still think about you I still think about you Yeah, I still think about you   There's a soundtrack in my mind That takes me back in time When I hear that melody"
/songs/185342,Blake Shelton,Every Time I Look At You,https://genius.com/Blake-shelton-every-time-i-look-at-you-lyrics,http://api.genius.com/songs/185342,Blake Shelton,2001-07-31," It brings back an old feeling Running into you like this I'm really not afraid of hurting But I can't stand the awkwardness Do I laugh Do I cry Do I dare look in your eyes   Oh no, here it goes My hands start to shake My heart's going to show Like the day we met To the night you said we're through Every time I look at you   You seem to be a bit distracted I wish that I could feel the same You never were too good at acting Baby some things never change I can't keep from letting go It's something that I can't control   Oh no, here it goes My hands start to shake My heart's going to show Like the day we met To the night you said we're through Every time I look at you   You stand there looking sweet and innocent But how can you be so cruel and confident At my expense   Oh no, here it goes My hands start to shake My heart's going to show Like the day we met To the night you said we're through Every time I look at you Oh no, here it goes My hands start to shake My heart's going to show Like the day we met To the night you said we're through Every time I look at you   Oh yeah, every time I look at you"
/songs/185998,Blake Shelton,Footloose,https://genius.com/Blake-shelton-footloose-lyrics,http://api.genius.com/songs/185998,Red River Blue,2011-11-08," Ooh-oh-oh Ooh-oh-oh Yeah Ooh-oh-oh O-oh-oh O-oh-oh   I've been working so hard I'm punching my card Eight hours for what Oh, tell me what I got I get this feeling Times just holding me down I'll hit the ceiling Or else I'll tear up this town   Tonight I got to cut loose, footloose Kick off your Sunday shoes Please, Louise, pull me off of my knees Jack, get back, come on before we crack Lose your blues, everybody cut loose   You're playing so cool Obeying every rule Deep way down in your heart You're burning yearning for some Somebody to tell you That life aren’t passing you by I'm trying to tell you It will if you don't even try You'll get by if you'd only   Cut loose, footloose Kick off your Sunday shoes O-wee Marie, shake it, shake it for me Whoa, Milo, come on, come on let's go Lose your blues, everybody cut loose   Ooh-oh-oh (Cut footloose) Ooh-oh-oh (Cut footloose) Ooh-oh-oh (Cut footloose) Ooh   We've got to turn you around And put your feet on the ground Now take a hold of your soul  I'm turning it loose   Footloose, kick off the Sunday shoes Please, Louise, pull me off of my knees Jack, get back, come on before we crack Lose your blues, everybody cut loose (Footloose) footloose   Kick off the Sunday shoes Please, Louise, pull me off of my knees Jack, get back, come on before we crack Lose your blues, everybody cut, everybody cut Everybody cut, everybody cut Everybody cut, everybody cut   (Everybody) everybody cut loose"
/songs/185997,Blake Shelton,Frame Of Mine,https://genius.com/Blake-shelton-frame-of-mine-lyrics,http://api.genius.com/songs/185997,Based on a True Story...,2014-01-06," There's a picture of you on my dresser And it's been there since you said goodbye And when I look in its direction You're strain my heart straight in the eye   It just sits there smiling at me Taking me back in time And before I know it I'm all caught up in That old frame of mine   I wish I could tear it to pieces And I've tried with all of my might But somehow I can't find courage Oh, to let you out of my sight   It just sits there smiling at me Taking me back in time And before I know it I'm all caught up in That old frame of mine   Yea before I know it I'm all caught up in That old frame of mine"
/songs/2451944,Blake Shelton,Friends,https://genius.com/Blake-shelton-friends-lyrics,http://api.genius.com/songs/2451944,If I'm Honest,2016-04-08," There's a moment in this journey that I gave up My boots just couldn't walk another mile And that cloud above me had no silver lining I couldn't buy a break with my last dime Oh, but when I saw you standing in the corner I'da never thought that you would have my back But then we rolled in like the thunder and the lightening Threw some punches then we had a laugh   Just some roughed up desperadoes Hanging tough through thick and thin Kicking up dust wherever we go I can see that you and me are gonna be friends   Who'da thought we'd wind up here together? It's crazy that we're standing side by side Fighting just like two birds of a feather Who's gonna tell us now that we can't fly?   Just some roughed up desperadoes Hanging tough through thick and thin Kicking up dust where ever we go I can see that you and me are gonna be friends To the end you and me are gonna be friends   Yeah, here we go Hey, hey you and me Different as different can be You like to rock, I like to roll You take the high and I'll take the low Woah, woah-oh, woah, woah-oh   Just some roughed up desperadoes Hanging tough through thick and thin Kicking up dust wherever we go I can see that you and me are gonna be friends To the end you and me are gonna be friends   I can see that you and me are gonna be friends, yeah"
/songs/185378,Blake Shelton,Georgia In A Jug,https://genius.com/Blake-shelton-georgia-in-a-jug-lyrics,http://api.genius.com/songs/185378,The Dreamer,2003-02-04, Mason jars on the dresser Filled with quarters and dollars saving them for our trip around the world But now you've changed your tune There'll be no honeymoon So I'm going there without you girl   I'm going down to Mexico in a glass of tequila Going down to Purto Rico in a bottle of rum Going to Honolulu in a mai tai mug Then I'm coming back home to Georgia in a jug   We'll never ride that bus to Mexico City It's a pity we'll never sail our ship into Waikiki and We'll never share that brick suburban home Today I'm taking that money out of the jar Tonight I'll buy my ticket down at the corner bar   I'm going down to Mexico in a glass of tequila Going down to Purto Rico in a bottle of rum Going to Honolulu in a mai tai mug Then I'm coming back home to Georgia in a jug
/songs/185885,Blake Shelton,Get Some,https://genius.com/Blake-shelton-get-some-lyrics,http://api.genius.com/songs/185885,Red River Blue,2012-01-09," You get up You get coffee You get paid You get off You get gas You get beer You get drunk You get weird You get drove home You get up thrown You get hungry You get chicken Your guitar needs picking You get tan You get pale You get sick You get well You get dressed up You get messed up   Everybody say, God Almighty it's Friday Everybody get sideways to have a little fun Everybody's living Everybody's trying Everybody's dying To get some   You get lost You get saved You get waxed You get shaved You get high, real high Forget your next line You get drive-thru, dollar menu   Everybody say, God Almighty it's Friday Everybody get sideways to have a little fun Everybody's living Everybody's trying Everybody's dying To get some   You get the girl You get the one You get her home You get her done You get hitched You get mad She gets a lawyer She gets half You get banged up You got to raise up That red Dixie cup   And everybody say, God Almighty it's Friday Everybody get sideways to have a little fun Everybody's living Everybody's trying Everybody's dying to get some Everybody's dying to get some Dying to get some"
/songs/2469899,Blake Shelton,Go Ahead and Break My Heart,https://genius.com/Blake-shelton-go-ahead-and-break-my-heart-lyrics,http://api.genius.com/songs/2469899,If I'm Honest,2016-05-09," The sun is setting on your last good try Here I am again with half a goodbye Wonder if you're really gone this time Just when I'm about to lose my mind There you are again on my phone The moon is rising and you're all alone Maybe we could just hang a while Maybe we can make each other smile   Oh no, here I go   Why don't you go ahead and break my heart? Why are you waiting, is it way too hard? If moving on is what you wanna do Why don't you do it? Why don't you do it, baby? You can't tell me that we'll still be friends And maybe someday we can try again If you really need a brand new start Why don't you go ahead and break my heart?   I'd never ever meant to get so into you Thought I was using you just to get me through You know I'm broken, I don't trust anyone Last thing I needed was to fall in love You've got me dreaming, got me thinking, I've got some hope There is nobody else I wanna get to know But I'm so scared, I don't know what to do How did you get me so into you?   Oh no, here I go   Why don't you go ahead and break my heart? Why are you waiting, is it way too hard? If moving on is what you wanna do Why don't you do it? Why don't you do it, baby? You can't tell me that we'll still be friends And maybe someday we can try again If you really need a brand new start Why don't you go ahead and break my heart?   There's your reasons There's your cards What are you waiting for? The one to break my heart   Yeah, you can't tell me that we'll still be friends And maybe someday we can try again If you really need a brand new start Why don't you go ahead and break my heart? Oh, go on and break, go on and break my heart Go on and break, go on and break my heart"
/songs/185884,Blake Shelton,God Gave Me You,https://genius.com/Blake-shelton-god-gave-me-you-lyrics,http://api.genius.com/songs/185884,Red River Blue,2012-01-09," I've been a walking heartache I've made a mess of me The person that I've been lately Aren’t who I want to be  But you stay here right beside me Watch as the storm blows through And I need you   Cause God gave me you for the ups and downs God gave me you for the days of doubt And for when I think I've lost my way There are no words here left to say, it's true God gave me you   There's more here than what we’re seeing A divine conspiracy That you, an angel lovely Could somehow fall for me You'll always be love's great martyr And I'll be the flattered fool And I need you Yeah!   God gave me you for the ups and downs God gave me you for the days of doubt And for when I think I've lost my way There are no words here left to say, it's true God gave me you   On my own I'm only Half of what I could be I can't do without you We are stitched together And what love has tethered I pray we never undo   Cause God gave me you for the ups and downs God gave me you for the days of doubt God gave me you for the ups and downs God gave me you for the days of doubt And for when I think I've lost my way There are no words here left to say, it's true God gave me you, gave me you He gave me you"
/songs/4421811,Blake Shelton,God's Country,https://genius.com/Blake-shelton-gods-country-lyrics,http://api.genius.com/songs/4421811,None,2019-03-29," Right outside of this one church town There's a gold dirt road to a whole lot of nothin' Got a deed to the land, but it ain't my ground This is God's country We pray for rain, and thank Him when it's fallen 'Cause it brings a grain and a little bit of money We put it back in the plate I guess that's why they call it God's country   I saw the light in the sunrise Sittin' back in the 40 on the muddy riverside Gettin' baptized in holy water and shine With the dogs runnin' Saved by the sound of the been found Dixie whistled in the wind, that'll get you Heaven bound The devil went down to Georgia, but he didn't stick around This is God's country   We turned the dirt and worked until the week's done We take a break and break bread on Sunday And then do it all again 'Cause we're proud to be from God's country (Yeah, yeah)   I saw the light in the sunrise Sittin' back in the 40 on the muddy riverside Gettin' baptized in holy water and shine With the dogs runnin' Saved by the sound of the been found Dixie whistled in the wind, that'll get you Heaven bound The devil went down to Georgia but he didn't stick around This is God's country (Yeah)   (This is God's country) God's country   I don't care what my headstone reads Or what kind of pine wood box I end up in When it's my time, lay me six feet deep In God's country (Yeah, yeah)   I saw the light in the sunrise Sittin' back in the 40 on the muddy riverside Gettin' baptized in holy water and shine With the dogs runnin' Saved by the sound of the been found Dixie whistled in the wind, that'll get you Heaven bound The devil went down to Georgia but he didn't stick around This is God's country (God's country) Yeah, I saw the light in the sunrise Sittin' back in the 40 on the muddy riverside Gettin' baptized in holy water and shine With the dogs runnin' Saved by the sound of the been found Dixie whistled in the wind, that'll get you Heaven bound The devil went down to Georgia but he didn't stick around This is God's country"
/songs/523392,Blake Shelton,Gonna,https://genius.com/Blake-shelton-gonna-lyrics,http://api.genius.com/songs/523392,Bringing Back the Sunshine,2015-08-03," I'm gonna take you for a date Take you for a ride Gonna get you over there on the passenger's side I'm gonna put the radio on your favorite song I'm gonna crank it on up and get you singing along   Hey, hey (hey, hey) Alright (alright) Girl I'm digging on hittin' on you tonight It ain't a maybe, it's hopin' I, wishin' I wanna It's the damn right, hold you tight, baby I'm gonna   So what's it gonna take? What's it gonna be? We can pump it on the boulevard Or kick it in the country Me and you, you and me Money back, guaranteed Love you every night in Daytona, I'm gonna   Hey, hey (hey, hey) Alright (alright) Girl I'm digging on hittin' on you tonight It ain't a maybe, it's hopin' I, wishin' I wanna It's the damn right, hold you tight, baby I'm gonna   Love you all night long Till the crickets start chirpin' Girl I ain’t just flirting, I’m certain I’m working on a long term plan Gonna be your man Gonna put a little rock steady on your hand   Hey, hey (hey, hey) Alright (alright) Girl I'm digging on hittin' on you tonight It ain't a maybe, it's hopin' I, wishin' I wanna It's the damn right, hold you tight, baby I'm gonna   Hey, hey (hey, hey) Alright (alright) Girl I'm digging on hittin' on you tonight It ain't a maybe, it's hopin' I, wishin' I wanna It's the damn right, hold you tight, baby I'm gonna   Hey, hey (hey, hey) Alright (alright) Oooh Hey, hey (hey, hey) Alright (alright)"
/songs/185462,Blake Shelton,Good At Startin' Fires,https://genius.com/Blake-shelton-good-at-startin-fires-lyrics,http://api.genius.com/songs/185462,Startin' Fires,2016-05-20, She’s got her new jeans on Looking so right it’s wrong Ummm everybody stares as she walks on by  See those double takes Hear those slamming breaks Yeah when she smiles you can see the sparks fly   My baby's gotten good Good at starting fires Hearts burn for her But I know I’m walking beside her Yeah maybe baby’s gotten good at starting fires But I’m the only one Aren’t no doubt Only one that puts them out   She’s got her long red dress And boy I must confess Ummm when you see her she'll take your breath away When we're out on the town Eyes look her up and down Yeah she makes the night time hotter than a summer day   My baby's gotten good Good at starting fires Hearts burn for her But I know I’m walking beside her Yeah maybe baby’s gotten good at starting fires But I’m the only one Aren’t no doubt Only one that puts them out   I’m a lucky man and I know it’s true Her fire burns for me Yeah that’s just so cool   My baby's gotten good Good at starting fires Hearts burn for her But I know I’m walking beside her Yeah maybe baby’s gotten good at starting fires But I’m the only one Aren’t no doubt Only one that puts them out My baby's gotten good Good at starting fires Hearts burn for her But I know I’m walking beside her Yeah maybe baby’s gotten good at starting fires But I’m the only one Aren’t no doubt Only one that puts them out
/songs/185408,Blake Shelton,Goodbye Time,https://genius.com/Blake-shelton-goodbye-time-lyrics,http://api.genius.com/songs/185408,Blake Shelton's Barn & Grill,None," It's your life, you say you need a change Don't all the dreams we've seen come true mean anything You say it's different now and you keep starin' at the door How can you walk away, don't I matter anymore   If bein' free's worth what you leave behind And if it's too late for love to change your mind Then it's goodbye time   If we had known our love would come to this We could have saved our hearts the hurt of wasted years Well it's been fun, what else can I say If the feeling's gone words won't stop you anyway   If bein' free's worth what you leave behind And if it's too late for love to change your mind Then it's goodbye time   Goodbye, Baby"
/songs/566180,Blake Shelton,Good Country Song,https://genius.com/Blake-shelton-good-country-song-lyrics,http://api.genius.com/songs/566180,Bringing Back the Sunshine,2015-08-03," Shotgun in my daddy's truck Eight years old and acting tough He smiled at me and said, ""You shift the gears"" He would search that FM dial And I would count down every mile Til the station out of Tulsa came in clear It was old Thomas Conley on the radio It punched me in the gut, man, it rattled my soul   I'm talking bout a good country song Makes you smile, makes you hurt Leaves you hanging on every word A good country song Makes you love, makes you leave Raise some hell or hit your knees All I know is I think of home Grab my guitar and strum along Kick on back and sip me something strong When I hear a good country song   While hip-hop, rap, and rock were cool I was in my basement getting schooled On George and Keith and Vernon Alabama I was learning bout those neon lights Wasted days and wasted nights And honky-tonks from Texas to Montana And when my fingers found the fret board I close my eyes and sing I swear that beat up guitar only played one thing   I'm talking bout a good country song Makes you smile, makes you hurt Leaves you hanging on every word A good country song Makes you love, makes you leave Raise some hell or hit your knees All I know is I think of home Grab my guitar and strum along Kick on back and sip me something strong When I hear a good country song   Yeah, it makes me think of days long gone Miss my dad and call my mom Run, laugh, and pray, and drink til dawn When I hear a good country A good old country, a good country song"
