api_path,primary_artist,title,url,song_endpoint,album,release_date,lyrics
/songs/185465,Blake Shelton,She Wouldn't Be Gone,https://genius.com/Blake-shelton-she-wouldnt-be-gone-lyrics,http://api.genius.com/songs/185465,Startin' Fires,2016-05-20," Red roadside wild flower if I'd only picked you Took you home set you on the counter Oh, at least a time or two Maybe she'd thought it through  Yellow sunset slowly dipping down in the rear view Oh, how she'd love to sit and watch you I could have done that a whole lot more If I hadn't been so stubborn, been so selfish Thought about her more, thought about me less Joked and maked her laugh, held her when she cried A little more that.. maybe I...   Wouldn't be driving like hell flying like crazy down the highway Calling everyone we know stopping any place she might be Going any place she might go beating on the dash Screaming out her name at the windshield tears soaking up my face If I had loved her this much all along, maybe maybe, yeaa maybe... She wouldn't be gone.. she wouldn't be gone..   She warned me it was coming said if I didn't change She was leaving I just didn't believe she would ever really walk out God, I believe her now Called her mamma, cried like a baby to her best friend If they've seen her, they ain't sayin', they ain't sayin'... Now, I'm cursing like a fool, praying it ain't too late All I wanna do is fix my mistakes   Find her beg her for one more try, until then damn it I""ll.. Be driving like hell flying like crazy down the highway Calling everyone we know stopping any place she might be Going any place she might go beating on the dash Screaming out her name at the windshield tears soaking up my face If I had loved her this much all along, maybe maybe, yeaa maybe... She wouldn't be gone..   I wouldn't be beating on the dash Screaming out her name at the windshield tears soaking up my face If I had loved her this much all along, maybe maybe, yeaa maybe... She wouldn't be gone..  Red roadside wild flower if I'd only picked you Took you home set you on the counter, oh at least a time or two Maybe she'd thought it through..."
/songs/1965072,Blake Shelton,Silent Night (feat. Sheryl Crow),https://genius.com/Blake-shelton-silent-night-feat-sheryl-crow-lyrics,http://api.genius.com/songs/1965072,Gift Wrapped - 20 Songs That Keep On Giving!,None,"Silent night, holy night All is calm, all is bright Round yon Virgin Mother and Child Holy Infant so tender and mild Sleep in heavenly peace Sleep in heavenly peace Silent night, holy night! Shepherds quake at the sight Glories stream from heaven afar Heavenly hosts sing Alleluia! Christ, the Saviour is born Christ, the Saviour is born Silent night, holy night Son of God, love's pure light Radiant beams from Thy holy face With the dawn of redeeming grace Jesus, Lord, at Thy birth Jesus, Lord, at Thy birth Sleep in heavenly peace"
/songs/185920,Blake Shelton,Silver Bells,https://genius.com/Blake-shelton-silver-bells-lyrics,http://api.genius.com/songs/185920,"Cheers, It's Christmas",2012-10-02," Christmas makes you feel emotional It may bring parties or thoughts devotional Whatever happens or what may be Here is what Christmas time means to me  City sidewalk, busy sidewalks Dressed in holiday style In the air there's A feeling of Christmas  Children laughing, people passing Meeting smile after smile And on every street corner you'll hear   Silver bells, silver bells It's Christmas time in the city Ring-a-ling, hear them ring Soon it will be Christmas day   City street lights Even stop lights Blink a bright red and green As the shoppers rush home With their treasures  Hear the snow crunch See the kids bunch This is Santa's big scene And above all this bustle you'll hear  "
/songs/185944,Blake Shelton,Small Town Big Time,https://genius.com/Blake-shelton-small-town-big-time-lyrics,http://api.genius.com/songs/185944,Based on a True Story...,2014-01-06," Yea, Hollywood Boulevard Looking down, seeing stars 90210, Rodeo is Rodeo Glad I hit it, glad I did it and I'd do it again Yea, and hang with my friends  With them red Maserati's and them tuned up bodies And everybody going to be the next somebody Yea, this place is a trip Hey but meanwhile back in the sticks   Somebody's having a small town big time night Somebody's rocking the main street with red tail lights Somebody's cranking it up or falling in love Or keeping the buzz sipping on a little moonlight   Yea, they know how to rock Out in the boondocks Cause believe me I've been there Somebody's having a small town big time night, somewhere  Yea, two lane town squares Cotton queens, county fairs With a water tank Got 100 girls' names under the paint  Glad I hit it, glad I did it and I'd do it again Yea, I miss my friends  With them pick them up trucks and them dirt road ruts And all them country girls get to strutting their stuff East, west, north or south Yea you better believe that right about now   Somebody's having a small town big time night Somebody's rocking the main street with red tail lights Somebody's cranking it up or falling in love Or lighting it up with a KC spotlight   Yea, they all got the swerve Down back in their hometown I wish that I was there Somebody's having a small town big time night, somewhere   Somebody's having a small town big time night Somebody's rocking the main street with red tail lights Somebody's cranking it up or falling in love And twisting it up and dodging them blue lights   Yea, they know how to kick it Way out past the limits Cause baby I've been there Somebody's having a small town big time night, somewhere  Yea, somebody's having a small town big time night, somewhere I wish that I was there Yea, I wish that I was there"
/songs/185395,Blake Shelton,Some Beach,https://genius.com/Blake-shelton-some-beach-lyrics,http://api.genius.com/songs/185395,Blake Shelton's Barn & Grill,None," Driving down the interstate Running thirty minutes late Singing Margaritaville and minding my own Some foreign car driving dude with the road rage attitude Pulled up beside me talking on his cell phone He started yelling at me like I did something wrong He flipped me the bird and then he was gone   Some beach, somewhere There's a big umbrella casting shade over an empty chair Palm trees are growing and a warm breezes a blowing I picture myself right there On some beach, somewhere   I circled the parking lot trying to find a spot Just big enough I could park my old truck A man with a big cigar was getting into his car I stopped and I waited for him to back up But from out of nowhere a Mercedes Benz Came cruising up and whipped right in   Some beach, somewhere There's nowhere to go when you got all day to get there There's cold margaritas and hot señioritas smiling with long dark hair On some beach, somewhere   I sat in that waiting room It seemed like all afternoon The nurse finally said doc's ready for you You’re not going to feel a thing we'll give you some Novocain That tooth will be fine in a minute or two But he stuck that needle down deep in my gum And he started drilling before I was numb   Some beach, somewhere There's a beautiful sunset burning up that atmosphere There's music and dancing and lovers romancing In the salty evening air On some beach, somewhere On some beach, somewhere"
/songs/185383,Blake Shelton,Someday,https://genius.com/Blake-shelton-someday-lyrics,http://api.genius.com/songs/185383,The Dreamer,2003-02-04, If time has no end and if time has no end A billion years a trillion years what then is infinity A circle an eternal loop It can drive you crazy searching for the truth   Someday will we know all about it Have no reason to doubt it Someday   Before we were babies There's nothing we recall and when we go back Will it fade to black and that's all Or could we be destined for some other time and place And have we lived other lives our memories have erased   Someday will we know all about it Have no reason to doubt it Someday   Will we see Jesus coming as the sunshine fills the night Or when we die will we fly into the light Will we all be reunited with the ones who've gone away And will we love each other the way we do today I believe Someday we'll know all about it Have no reason to doubt it Someday
/songs/1134565,Blake Shelton,Still Got A Finger,https://genius.com/Blake-shelton-still-got-a-finger-lyrics,http://api.genius.com/songs/1134565,None,2019-03-29,"Well it must've been 100 in that summer sun And I've been in it all day Putting up with that prick of an owner's son Making me some hillbilly pay Working right through lunch, busting my hump Helping his daddy stay rich So when he kept me behind to pull some overtime I told that little son of a bitch Hey I've been punching your clock, giving all I got Putting up with your pain in the rear Adios, I'm done, you can find me son Between a hottie and an ice cold beer Hey I've been breaking my butt but it's never enough Ain't a part of me that doesn't hurt Hey but lucky for me you can easily see I still got a finger that works Yea I've been dragging home almost every night 'Bout the time that you're going out Wearing something way too short and tight Leaving me and the dog on a couch Yea, now word's getting round you've been sneaking downtown Dancing way too risky Well I got a few dirty dance moves too And a cute little one finger wave Hey I've been punching your clock, giving all I got Putting up with your pain in the rear Adios, I'm done, you can find me hun Between a hottie and an ice cold beer Well I've been breaking my hump but it's never enough Ain't a part of me that doesn't hurt Hey but lucky for me you can easily see I still got a finger that works Here it comes Hey I've been punching your clock, giving all I got Putting up with your pain in the rear Adios, I'm done, you can find me hun Between a hottie and an ice cold beer Hey I've been busting my ass, you don't care about that Ain't a part of me that doesn't hurt Hey but lucky for me you can easily see I still got a finger that works Oh yea Woo! Yes I do Look at that thing You know you're number one, baby"
/songs/2470263,Blake Shelton,Straight Outta Cold Beer,https://genius.com/Blake-shelton-straight-outta-cold-beer-lyrics,http://api.genius.com/songs/2470263,If I'm Honest,2016-05-20," Just a bunch of poor boys, daddy's girls Children of the corn field Tryna turn a shift job into a dollar bill We wear them muddy boots Stay true to how we're raised Ain't nothin' bout us fake   You know we're straight out of that dirty south Dirty roads, nobody got no money Got them shined up pickup trucks Whistlin' at them honies From the country, yes sir You know we're straight out of that long week work At night, everybody wanna party All night long, bonfire on the back 40 In the middle of nowhere, ain't nobody leavin' here Til we're straight out of cold beer, straight out of cold beer   Just a bunch of John Deere junkies Gettin' funky to some old Hank Nothin' been stuck in the mud that we can't Hook up to a rusty chain in the summer or in the rain Yeah, it's a kind of thing   You know we're straight out of that dirty south Dirty roads, nobody got no money Got them shined up pickup trucks Whistlin' at them honies From the country, yes sir You know we're straight out of that long week work At night, everybody wanna party All night long, bonfire on the back 40 In the middle of nowhere, ain't nobody leavin' here Til we're straight out of cold beer, straight out of cold beer   You know we're straight out of that dirty south Dirty roads, nobody got no money Got them shined up pickup trucks Whistlin' at them honies From the country, yes sir You know we're straight out of that long week work At night, everybody wanna party All night long, bonfire on the back 40 In the middle of nowhere, ain't nobody leavin' here Til we're straight out of cold beer, straight out of cold beer"
/songs/185878,Blake Shelton,Suffocating,https://genius.com/Blake-shelton-suffocating-lyrics,http://api.genius.com/songs/185878,All About Tonight EP,None," Pain is growing like a vine stanglin' my heart When I think the worst is over, that's right when it starts Someone says your name, sometimes I don't feel a thing But then there's days like today, whoa, that are suffocating   When I think it's dead and gone Then it starts to rain, oh, and it grows again I find myself out in your driveway My hands are frozen on the wheel and I can feel your love still suffocating   The memory of what used to be cuts me like a thorn Loneliness starts rollin' in like thunder from a storm My strength starts to sway, I feel the winds of change It's such a paralyzing place, oh, and it's suffocating   Let the rain wash it all away Can't you love me another day? I curse myself Cause nothing’s changed, nothing’s changed  "
/songs/185889,Blake Shelton,Sunny In Seattle,https://genius.com/Blake-shelton-sunny-in-seattle-lyrics,http://api.genius.com/songs/185889,Red River Blue,2012-01-09," When it's sunny in Seattle and it's snowing down in New Orleans And them boys from Amarillo stop wearing those boots and jeans When Memphis aren’t got the blues That's when I'll stop loving you When it's sunny in Seattle and it's snowing down in New Orleans   Baby, I don't mind you asking If there's going to come a day When I'll say goodbye Maybe, I guess anything could happen But it's as close to never As you're ever going to find   When it's sunny in Seattle and it's snowing down in New Orleans And them boys from Amarillo stop wearing those boots and jeans When there's no tequila in Mexico That's when I'm going to let you go When it's sunny in Seattle and it's snowing down in New Orleans   Darling, some things won't ever change My love is one of those things   When New York is a one horse town That's when I won't need you 'round When it's sunny in Seattle and it's snowing down in New Orleans When it's sunny in Seattle and it's snowing down in New Orleans"
/songs/122517,Blake Shelton,Sure Be Cool If You Did,https://genius.com/Blake-shelton-sure-be-cool-if-you-did-lyrics,http://api.genius.com/songs/122517,Based on a True Story...,2013-01-08,"[Click here to read Blake’s story behind “Sure Be Cool If You Did”]   I was gonna keep it real like chill like only have a drink or two But it turned into a party when I started talking to you Now you're standing in the neon looking like a high I wanna be on Baby it's your call, no pressure at all   You don’t have to throw back your pretty pink lemonade shooter and lean a little closer You don’t have to keep on smiling that smile that’s driving me wild and when the night is almost over Meet me in the middle of a moonlit Chevy bench seat and do a little bit of country song, hanging on You don’t have to keep me fallin’ like this But it’d sure be cool if you did   You can’t shoot me down cause you already knocked me dead Got me falling apart with my heart talking out of my head Let your mind take a little back road Just as far as you wanna go Baby I’ll do whatever you wanna do   You don't have to throw back your pretty pink lemonade shooter And lean a little closer You don't have to keep on smiling that smile that's driving me wild And when the night is almost over Meet me in the middle of a moonlit Chevy bench seat And do a little bit of country song, hanging on You don't have to keep me falling like this But it'd sure be cool if you did   Have a night that you'll never forget And now you're standing in the neon Looking like a high I wanna be on   You don't have to throw back your pretty pink lemonade shooter And lean a little closer You don't have to keep on smiling that smile that's driving me wild And when the night is almost over Meet me in the middle of a moonlit Chevy bench seat And do a little bit of country song, hanging on You don't have to keep me falling like this But it'd sure be cool if you did"
/songs/185964,Blake Shelton,Ten Times Crazier,https://genius.com/Blake-shelton-ten-times-crazier-lyrics,http://api.genius.com/songs/185964,Based on a True Story...,2014-01-06," Well I'm crazy about fast cars, football and guitars All them old country songs Daddy used to play I'm crazy about Friday nights, cold beer and good times Crazy about a summer day out on the lake   But I'm ten times crazier without about your love, girl I'd do about anything you ask me to I'm just plain crazy about a lot of things baby But I'm ten times crazier about you   Well I'm all about a weekend, kicking with my good friends Every now and then I like to make a little noise But don't you go thinking' that I won't leave them hanging Cause even though I'm crazy about them good old boys   I'm ten times crazier about your loving girl I'd do about anything you ask me to I'm just plain crazy about a lot of things baby But I'm ten times crazier about you   I know you love me girl that's easy to see But as crazy as you say you are about me   I'm ten times crazier about your loving girl I'd do about anything you ask me to I'm just plain crazy about a lot of things baby But I'm ten times crazier about you  I'm ten times crazier about your loving girl I'd do about anything you ask me to I'm just plain crazy about a lot of things baby But I'm ten times crazier about you"
/songs/185357,Blake Shelton,That's What I Call Home,https://genius.com/Blake-shelton-thats-what-i-call-home-lyrics,http://api.genius.com/songs/185357,Blake Shelton,2001-07-31, There's a house that's a little run down This city aren’t never found It's miles and miles from a paved road That's where we grew up Seven children raised on love When life gets hard that's where we go   Daddy don't know a stranger A handshake and he's your friend Oh and Mama she's an angel She'll hold you tight till the heartache ends Just a place made of nails and wood But it's the love that makes you feel so good That's what I call That's what I call home   Daddy built it with his own two hands Overlooking his grandpa's land Now through the years a lot has changed But driving up this gravel road I get that feeling in my soul I thank God some things still remain   Daddy don't know a stranger A handshake and he's your friend Oh and Mama she's an angel She'll hold you tight till the heartache ends Just a place made of nails and wood But it's the love that makes you feel so good That's what I call That's what I call home   Once I get myself through that old screen door The world can't touch me anymore   Daddy don't know a stranger A handshake and he's your friend Oh and Mama she's an angel She'll hold you tight till the heartache ends Just a place made of nails and wood But it's the love that makes you feel so good That's what I call That's what I call home   That's what I call home That's what I call home
/songs/185594,Blake Shelton,That Thing We Do,https://genius.com/Blake-shelton-that-thing-we-do-lyrics,http://api.genius.com/songs/185594,All About Tonight EP,None," Get up, put your clothes on, baby Come on, let's do something crazy Take a midnight drive down An old dirt road  I want to see your bare feet on my dash The night wind blowing your hair back Slide across that seat And sit real close  Baby, let's go   Snuggled up in my truck Windows down, radio up Just you and me, nothing between us But jeans and with a little luck  We'll kick them off before the night is through And we'll be doing' that thing we do   We'll take some blankets and we'll make a spread I'll tuck you into my pick-up bed We'll watch the country stars Putting on a show  I want to see your bare skin in the moonlight Kiss your lips, girl, and hold you all night Make a lot of love And make it real slow  Baby, let's go    We'll shuck them off before the night is through And we'll be doing that thing we do  We've been running 'round doing this and that It's time we got back to what we're good at   We'll shuck them off before the night is through And we'll be doing that thing we do Yeah, we'll be doing that thing we do Doing that thing we do  Get up, put your clothes on, baby Come on, let's do something crazy Take a midnight drive down"
/songs/185366,Blake Shelton,The Baby,https://genius.com/Blake-shelton-the-baby-lyrics,http://api.genius.com/songs/185366,The Dreamer,2002-10-28,"[Click here to read Blake’s story about “The Baby”]   My brother said that I Was rotten to the core I was the youngest child So I got by with more   I guess she was tired by The time I came along She'd laugh until she cried I could do no wrong She would always save me Because I was her baby   I worked a factory in Ohio A shrimp boat in the Bayou I drove a truck in Birmingham Turned 21 in Cincinnati I called home to mom and daddy I said ""Your boy is now a man"" She said ""I don't care if you're 80 You’ll always be my baby""   She loved that photograph Of our whole family She'd always point us out For all her friends to see   That's Greg he's doing great He really loves his job And Ronnie with his 2 kids How about that wife he's got And that one's kind of crazy But that one is my baby   I got a call in Alabama Said come on home to Louisiana And come as fast as you can fly Cause your mamma really needs you And says she's got to see you She might not make it through the night The whole way I drove 80 So she could see her baby   She looked like she was sleeping And my family had been weeping By the time that I got to her side And I knew that she'd been taken And my heart it was breaking I never got to say goodbye   I softly kissed that lady And cried just like a baby"
/songs/185415,Blake Shelton,The Bartender,https://genius.com/Blake-shelton-the-bartender-lyrics,http://api.genius.com/songs/185415,Blake Shelton's Barn & Grill,None, Mr. Bourbon and Coke laughs At all of my jokes when he's drinking Mr. Martini stares and he Never shares what he's thinking  Miss Sexy Red Wine tells me at closing time That she'll phone me Mr. Whiskey Shot Glass watches hookers Walk past when he's lonely   I'm a bartender I pour the drinkers Laugh with the sinners And cry with the saints And even if they don't remember I try to make their bar tender   Mr. Never Does Tip says That none of his kids ever call home Mrs. Chews On Her Lip tells someone She's at work on her cell phone  Mrs. Husband Just Died always Breaks down and cries on the weekends Just another long night in a Bartender's life with some good friends   And even if they don't remember I try to make their bar tender
/songs/185914,Blake Shelton,The Christmas Song,https://genius.com/Blake-shelton-the-christmas-song-lyrics,http://api.genius.com/songs/185914,"Cheers, It's Christmas",2012-10-02," Chestnuts roasting on an open fire Jack Frost nipping at your nose Yule-tide carols being sung by a choir And folks dressed up like Eskimos   Everybody knows a turkey And some mistletoe Help to make the season bright Tiny tots with their eyes all aglow Will find it hard to sleep tonight   They know that Santa's on his way He's loaded lots of toys And goodies on his sleigh And every mother's child is going to spy To see if reindeer Really know how to fly   And so I'm offering this simple phrase To kids from one to ninety-two Although it's been said Many times, many ways Merry Christmas to you"
/songs/185369,Blake Shelton,The Dreamer,https://genius.com/Blake-shelton-the-dreamer-lyrics,http://api.genius.com/songs/185369,The Dreamer,2003-02-04, Funny thing about dreamers When the dream is in their sights Just to get where they're going They leave a lot of good things behind  Guess you could call me a dreamer And I've seen it all come true So I smile when I need to look happy And do all the things they tell me to Yeah I'm a big self-made man And a fool who can't understand   I thought I needed fortune I thought I needed fame But all I need is to hear you Whisper my name   If I could only make the future An extension of my past I'd take these broken memories And make those moments last Now that my ship has come I wonder what have I done   I thought I needed fortune I thought I needed fame But all I need is to hear you Whisper my name I thought I needed fortune I thought I needed fame But all I need is to hear you Whisper my name   Oh yeah whisper baby
