api_path,primary_artist,title,url,song_endpoint,album,release_date,lyrics
/songs/1970959,Blake Shelton,I Can't Walk Away,https://genius.com/Blake-shelton-i-cant-walk-away-lyrics,http://api.genius.com/songs/1970959,Pure BS,2008-02-04," This morning when I woke up And man I had a bad backache And my head felt like it took new form Last night I stuck an ice pack where I sat on the maniac 2000 pounds of muscle and horn I remember smilin’ as we kicked up mud Out in the bright lights and I recall A cussin’ when I lost control And he sent me on a high flight   Hey, I don’t do this for the money I don’t do it for the fame It’s cause he threw me to the ground all bloody That’s the reason I can’t walk away   I stumbled out to my pick-up My joints popped in ten different places One I never knew I had I’m out here on the highway My one track mind sticks in replay And I start to get real mad Seems I’ve lost track of all the buckles and the big checks But I remember every time I’ve landed in a pile of B.S   Hey, I don’t do this for the money I don’t do it for the fame It’s cause he threw me to the ground all bloody That’s the reason I can’t walk away Hey, I don’t do this for the money I don’t do it for the fame It’s cause he threw me to the ground all bloody That’s the reason I can’t walk away I can’t walk away I can’t walk away I can’t walk away"
/songs/185437,Blake Shelton,I Don't Care,https://genius.com/Blake-shelton-i-dont-care-lyrics,http://api.genius.com/songs/185437,Pure BS,2008-02-04," There she was... laughin', talkin', window shopping with a new guy An' I'd heard about him... I heard she found him right around when we said goodbye And I came real close and almost lost my temper But I bit my tongue, kept my cool, 'cause I remembered   I don't care, she don't matter I don't love her anymore, he can have her I don't know why it slips my mind, I tell myself all the time Guess I forgot again, for a second there, that I don't care   Almost 10:00... should've known his car would still be parked in her drive Almost pulled in... knocked on her door and gave her a piece of my mind Oh, but I just kept on drivin' back to my place Wonderin' why I went so far out of my way, when...   I don't care, she don't matter I don't love her anymore, he can have her I don't know why it slips my mind, I tell myself all the time Guess I forgot again, for a second there, that I don't care   I got home the light was blinkin' on that old machine She said, ""My brother's been in town, but he just left, and I miss you. Give me a ring""   I still care, she's all that matters I still love her just like always, gotta have her I never got her off my mind, been hopin' she would call sometime I know it's late, to be drivin' over there, but I don't care I don't care"
/songs/185416,Blake Shelton,I Drink,https://genius.com/Blake-shelton-i-drink-lyrics,http://api.genius.com/songs/185416,Blake Shelton's Barn & Grill,None," He'd get home at five-thirty Fix a drink and sit down in his chair Pick a fight with momma Complain about the kids getting in his hair At night he'd sit alone and smoke I'd see his frown behind the lighters flame Now that same frowns in my mirror I got my daddy's blood inside my veins   Fish swim, birds fly Daddy’s' yell, momma’s cry Old men sit and think I Drink   Chicken TV dinner Six minutes on defrost three on high Beer to wash it down then another Some whiskey on the side It's not so bad alone here It don't bother me that every nights the same I don't need another lover hanging around Trying to make me change   Fish swim, birds fly Lovers leave, by and by Old men sit and think I Drink   I know, what I am But I don't, give a damn   Fish swim, birds fly Daddy’s yell, momma’s cry Old men sit and think I Drink   I Drink"
/songs/185360,Blake Shelton,If I Was Your Man,https://genius.com/Blake-shelton-if-i-was-your-man-lyrics,http://api.genius.com/songs/185360,Blake Shelton,2001-07-31," If I was a cloud, I'd make baby raindrops And they'd feed the treetops If I was a cloud If I was the sun, I'd shine on the flowers And pass on the power If I was the sun If I was the moon, I'd caress every ocean In celestial motion If I was the moon If I was a star, charmed and enchanted All wishes would be granted If I was a star   If I was your man, the kisses would linger I'd melt in your fingers If I was your man If I was your man, we'd share every shower And wash away the hours baby If I was your man   If I was a song, I'd reach all the people From barrooms to steeples If I was a song If I was a dream, I'd be sweeter than honey I'd be bigger than money If I was a dream   If I was your man, we'd dance through the daisies They'd say we were crazy girl If I was your man If I was your man, I'd pump you with this passion You'd get more than fashion baby   If I-I-I-I-I was your man   You would not have to hurry I'd rub away your worries girl If I was your man If I was your man, then we'd be together Now and forever baby If I was your man   And if we were love, we'd heal every nation We'd be on everybody's station If we were love   If I was your man, sweet loving man If I was your man If I was your man"
/songs/185994,Blake Shelton,I Found Someone,https://genius.com/Blake-shelton-i-found-someone-lyrics,http://api.genius.com/songs/185994,Based on a True Story...,2014-01-06," I picked up the phone She said hey it's me I know it feels like forever Since I've heard your voice But I guess that's how it had to be So we talked awhile Still, she said I better go But before we hung up she said There's something you need to know   I found someone It just happened outta the blue Even though I'm moving on It don't mean that I don't still love you You'll always have A place here in my heart But somewhere in this new life I've begun I found someone   Well I wasn't surprised Still, it hit me kind of hard It's hard to believe a little space and time Could turn into miles and worlds apart I said I'm happy for you You deserve the very best Since you've been gone I've done some praying Some searching for myself   And I found someone It just happened outta the blue And even though I'm moving on It don't mean that I don't still love you You'll always have A place here in my heart But somewhere in this new life I've begun I found someone   But it took tears and time down on my knees And it's not who you'd ever guess Or who I dreamed it'd be But in the mirror one morning looking back at me   I found someone Just happened out of the blue And it took everything I had It took me losing you But you'll always have A place here in my heart But somewhere in this new life I've begun Looking for my place under the sun I found someone"
/songs/185446,Blake Shelton,I Have Been Lonely,https://genius.com/Blake-shelton-i-have-been-lonely-lyrics,http://api.genius.com/songs/185446,Pure BS,2008-02-04," You told me I'd regret it On the day I left you I had the nerve to laugh As I walked away Well, it’s been six months And eighteen days Feeling nothing but this empty pain  And I just had to tell you  Even if there's nothing Left to say   I felt the burning on the hurting side Of a love that didn't work out right The empty longing on a long cold night I have been lonely I've leaned on no one when the times got tough When it comes to heartaches lord I've had enough Know what it's like to live without your love I have been lonely I was going to show you That I didn't need you Now I need to show you I was wrong Here I am knees to the floor I don't want to live like this no more I'm heartbeat in misery Now all my pride is gone   I felt the burning on the hurting side Of a love that didn't work out right The empty longing on a long cold night I have been lonely I've leaned on no one when the times got tough When it comes to heartaches lord I've had enough Know what it's like to live without your love I have been lonely I have been lonely I have been lonely"
/songs/185918,Blake Shelton,I'll Be Home For Christmas,https://genius.com/Blake-shelton-ill-be-home-for-christmas-lyrics,http://api.genius.com/songs/185918,"Cheers, It's Christmas",2012-10-02, I'll be home for Christmas You can count on me Please have snow and mistletoe And presents under tree   Christmas Eve will find me Where the love light gleams I'll be home for Christmas If only in my dreams     If only in my dreams
/songs/185463,Blake Shelton,I'll Just Hold On,https://genius.com/Blake-shelton-ill-just-hold-on-lyrics,http://api.genius.com/songs/185463,Startin' Fires,2016-05-20, I can taste your kiss on my lips And I'm wrapped around your finger tips As I watch the moonlight dancing on your skin Your green eyes and the sweet red wine Go to my head girl every time And I get drunk on you I lose control and then And here I go again   I'm falling for you even though I know your only playing with my heart Tomorrow might be hell But a night or two of loving you is better than never at all And I can't help myself So I'll just hold on I'll just hold on I'll just hold on Until you’re gone   Girl I know you're a gypsy soul And I'm just a stop along your road And you hang around long enough to blow my mind If I had a star for every scar You tattooed on my heart I could fill up the Oklahoma sky So girl I don't know why   I'm falling for you even though I know your only playing with my heart Tomorrow might be hell But a night or two of loving you is better than never at all And I can't help myself So I'll just hold on I'll just hold on I'll just hold on Until you’re gone  I'll just hold on I'll just hold on I'll just hold on Till you’re gone   I look down and my cell phone rings And I see your name and I know what that means But I don't care I'll just hold on Till your gone  Every time you need to take it home? Seeing you there just breaks my heart? I don't care I'll just hold on Till you’re gone  Your green eyes and that sweet red wine Go to my head girl every time But I don't care I'll just hold on Till you’re gone
/songs/3224817,Blake Shelton,I'll Name the Dogs,https://genius.com/Blake-shelton-ill-name-the-dogs-lyrics,http://api.genius.com/songs/3224817,Texoma Shore,2017-09-08," Girl, it's high time I tell ya No more messin' around Time to lay these cards on the table And just throw it on out I'm talkin' you and me with the same street name Same last name, same everything It's a real thing, a how I feel thing So I'm a go on and take a swing   You find the spot and I'll find the money You be the pretty and I'll be the funny You plant the flowers, I'll plant the kisses Baby, let's get right down to business I'll hang the pictures, you hang the stars You pick the paint, I'll pick a guitar Sing you a song out there with the crickets and the frogs You name the babies and I'll name the dogs, yeah   You can park your car in the driveway I'll park my truck in the grass I'll put a little swing on the front porch If you put a little tea in my glass Watch a sunset from a gravel road Kiss me in the kitchen on your tippy toes Still lovin' on you when the rooster crows Watchin' way more than the garden grow   You find the spot and I'll find the money You be the pretty and I'll be the funny You plant the flowers, I'll plant the kisses Baby, let's get right down to business I'll hang the pictures, you hang the stars You pick the paint, I'll pick a guitar Sing you a song out there with the crickets and the frogs You name the babies and I'll name the dogs   Yeah, layin' next to you every night Sounds like a damn good life   You find the spot and I'll find the money You be the pretty and I'll be the funny You plant the flowers, I'll plant the kisses Baby, let's get right down to business I'll hang the pictures, you hang the stars You pick the paint, I'll pick a guitar Sing you a song out there with the crickets and the frogs You name the babies and I'll name the dogs   Yeah, I'll name the dogs You name the babies and I'll name the dogs Yeah, I'll name the dogs"
/songs/185888,Blake Shelton,I'm Sorry,https://genius.com/Blake-shelton-im-sorry-lyrics,http://api.genius.com/songs/185888,Red River Blue,2012-01-09," You say you don't know what you were thinking Well neither do I And after the time we spent together You think you deserve another try  Well girl I don't know what it is That you're expecting Just because you looked me in the eye   And say you're sorry Oh, you're sorry You want it back the way it was Well I'm sorry But sometimes sorry Just aren’t good enough   You say you never meant to hurt me Well that might be true But do you really think I should forgive you For what you put me through  Oh, I remember every time you said you loved me But I know now your love was just a lie   Oh, girl I don't know what it is That you're expecting Just because you looked me in the eye  And say you're sorry   Oh, you're sorry So sorry And you want it back the way it was Well I'm sorry But sometimes sorry Just aren’t good enough"
/songs/566179,Blake Shelton,I Need My Girl,https://genius.com/Blake-shelton-i-need-my-girl-lyrics,http://api.genius.com/songs/566179,Bringing Back the Sunshine,2015-08-03," I don't need another drink of Johnny Walker Red And I don't need another drag off a Marlboro cigarette And I don't need me telling myself everything's gonna be alright And I don't need me lying here alone again tonight   I need my girl, I need my baby I need you, ninety miles an hour down the interstate Headlights shining in the driveway In my arms, and I need you right now I don't need nothing else, baby, in this world I just need my girl   I don't need those buddies of mine taking me on the town Or a TV preacher warning me bout the road I'm going down I don't need to let 'I'm sorry' not roll off my lips And I don't need to let my pride talk me out of this   I need my girl, I need my baby I need you, ninety miles an hour down the interstate Headlights shining in the driveway In my arms, and I need you right now I don't need nothing else, baby, in this world I just need my girl   Like I never needed anything before Like my life depends on you walking through that door I need you, girl Oh, I need you, girl   I need my girl, I need my baby I need you, ninety miles an hour down the interstate Headlights shining in the driveway In my arms, and I need you right now I don't need nothing else, baby, in this world I just need my girl   I just need my girl I just need my girl I just need my girl"
/songs/185368,Blake Shelton,In My Heaven,https://genius.com/Blake-shelton-in-my-heaven-lyrics,http://api.genius.com/songs/185368,The Dreamer,2003-02-04," In my heaven there aren’t no lawyers Don't need names on dotted lines Folks do business like they ought to A good firm handshake works just fine We feed lawyers to the lions  In my heaven there aren’t no children Toting' loaded guns to school Aren’t no such thing as peer pressure Being who you are is cool They still teach that golden rule   In my heaven we hurt no one No lying, crying, or dying young No one's lonely, no one's scared And anyone is welcome there In my heaven   In my heaven I can sing like Elvis Play guitar like B. B. King Slide a fastball past Hank Aaron Batter, batter, batter swing I can do most anything   I know that it's God's decision What my heaven's going to be And I aren’t telling him his business But if he left it up to me   Then in my heaven There's football with no referees In my heaven There's never been an injury In my heaven Angels yodel when they sing In my heaven The fish will bite most anything In my heaven In my heaven In my heaven"
/songs/185956,Blake Shelton,I Still Got A Finger,https://genius.com/Blake-shelton-i-still-got-a-finger-lyrics,http://api.genius.com/songs/185956,Based on a True Story...,2014-01-06," Well it must've been 100 in that summer sun And I've been in it all day Putting up with that prick of an owner's son Making me some hillbilly pay  Working right through lunch, busting my hump Helping his daddy stay rich So when he kept me behind to pull some overtime I told that little son of a bitch   Hey I've been punching your clock, giving all I got Putting up with your pain in the rear Adios, I'm done, you can find me son Between a hottie and an ice cold beer   Hey I've been breaking my hump but it's never enough Aren’t a part of me that doesn't hurt Hey but lucky for me you can easily see I still got a finger that works   Yea I've been dragging home almost every night 'Bout the time that you're going out Wearing something way too short and tight Leaving me and the dog on a couch  Yea, now word's getting round you've been sneaking downtown Dancing way too risky Well I got a few dirty dance moves too And a cute little one finger wave     Here it comes     Oh yea Woo! Yes I do Look at that thing You know you're number one, baby"
/songs/2470269,Blake Shelton,It Ain't Easy,https://genius.com/Blake-shelton-it-aint-easy-lyrics,http://api.genius.com/songs/2470269,If I'm Honest,2016-05-20," Easy, easy, easy, easy It ain't easy, it ain't easy Easy, easy, easy...   Yeah I used to be alright just saying goodnight Maybe see you tomorrow Yeah I could go a couple of days Just doing my thing Whatever I wanted But now, your kisses hit me like lightning Can’t fight it, girl you put it on me Yeah you stone me, when you ain’t with me I ain’t nothing but lonely   It ain't easy anymore When I'm walking out your door My feet drag across the floor And it just about kills me I hate picking up my keys I hate kissing you goodbye No i ain't gonna lie With that look in your eyes And your arms around me Girl believe me It ain't easy anymore No it ain't easy, that's for sure   Something different 'bout a Friday night And the neon lights if you ain't beside me Now I love it when you call me on the phone Saying ""hurry on home"" you got something special on And it's just for me Damn you make it hard to leave   It ain't easy anymore When I'm walking out your door My feet drag across the floor And it just about kills me I hate picking up my keys I hate kissing you goodbye No i ain't gonna lie With that look in your eyes And your arms around me Girl believe me   It ain't easy leaving my baby in the bed And driving away knowing the last thing you said Was ""don't go, don't leave, lay here with me"" Girl you're making me crazy It ain't easy, no, no, no, it ain't easy It sure ain't baby, yeah baby   It ain't easy anymore When I'm walking out your door My feet drag across the floor And it just about kills me I hate picking up my keys I hate kissing you goodbye No i ain't gonna lie With that look in your eyes And your arms around me Girl believe me It ain't easy anymore   No it ain't easy, walking out your door Mmm, no it ain't easy, no, no No it ain't easy walking out your door It ain't easy, oh, it ain't easy"
/songs/185442,Blake Shelton,It Ain't Easy Bein' Me,https://genius.com/Blake-shelton-it-aint-easy-bein-me-lyrics,http://api.genius.com/songs/185442,Pure BS,2008-02-04," There ought to be a town somewhere Named for how I feel Yeah I could be the mayor down there And say welcome to SorryVille It wouldn't be on a map nowhere You might say that it doesn't exist But if you make enough wrong turns It'd be hard to miss  There ought to be a bridge somewhere They could dedicate to me I'd probably come through the ceremony With a can of gasoline Walk on over to the other side And there I'd light a match And sit and stare through the smoke and the flames Wondering how I'm going to get back   Why do I do the things I do? Was I born this way? Am I a self-made fool? I shoot the lights and I curse the dark I need your love but I break your heart And I know the words that'll bring you back But I don't say nothing' as I watch you pack I had to work to be the jerk I've come to be It ain't easy being' me   Ought to be a side show act for freaks like me Yeah I could be the star of the show With my name on the marquee In a room with a big red button that says ""Danger: Do Not Touch"" And twice a day I'd mash it down And you could watch me self-destruct   Why do I do the things I do? Was I born this way? Am I a self-made fool? I shoot the lights and I curse the dark I need your love but I break your heart And I know the words that'll bring you back But I don't say nothing' as I watch you pack I had to work to be the jerk I've come to be It ain't easy being' me It ain't easy being me"
/songs/185354,Blake Shelton,I Thought There Was Time,https://genius.com/Blake-shelton-i-thought-there-was-time-lyrics,http://api.genius.com/songs/185354,Blake Shelton,2001-07-31, I knew something was the matter It really needed my attention And I had planned to look into it someday But I was busy making money I wanted you to be proud of me Now I wish I could turn the clock back some way   I thought there was time   I never thought that you would leave me I always thought that I could find you Somewhere near a phone to answer when I call Now you have my full attention Now you're all that I can think of This is not what I expected at all   I thought there was time I thought there was time   Are you even on this planet Can you see these pretty flowers Or am I standing here just talking to the wind How I wish that I had told you How I wish that I had shouted I love you I love you I love you I love you back then   I thought there was time I thought there was time I thought there was time I thought there was time
/songs/3731541,Blake Shelton,I Won't Back Down,https://genius.com/Blake-shelton-i-wont-back-down-lyrics,http://api.genius.com/songs/3731541,None,2011-01-01," Well, I won't back down No, I won't back down You can stand me up at the gates of hell But I won't back down   No, I'll stand my ground Won't be turned around And I'll keep this world from draggin' me down Gonna stand my ground And I won't back down   I won't back down Hey baby, there ain't no easy way out I won't back down Hey I will stand my ground And I won't back down   Well I know what's right I got just one life In a world that keeps on pushin' me around But I stand my ground And I won't back down   I won't back down Hey baby, there ain't no easy way out I won't back down Hey, I will stand my ground And I won't back down I won't back down Hey baby, there ain't no easy way out I won't back down Hey, I will stand my ground And I won't back down No, I won't back down"
/songs/185899,Blake Shelton,Jingle Bell Rock,https://genius.com/Blake-shelton-jingle-bell-rock-lyrics,http://api.genius.com/songs/185899,"Cheers, It's Christmas",2012-10-02," Jingle bell, jingle bell, jingle bell rock Jingle bells swing and jingle bells ring Snowing and blowing up bushels of fun Now, the jingle hop has begun  Jingle bell, jingle bell, jingle bell twist Jingle bells chime in jingle bell time Dancing and prancing in Jingle Bell Square In the frosty air   What a bright time, it's the right time To rock the night away Jingle bell time is a swell time To go riding in a one-horse sleigh   Giddy-up jingle horse, pick up your feet Jingle around the clock Mix and a-mingle in the jingling feet That's the jingle bell rock   Giddy-up jingle horse, pick up your feet Jingle around the clock Mix and a-mingle in the jingling feet That's the jingle bell That’s the jingle bell That’s the jingle bell That’s the jingle bell rock"
/songs/566183,Blake Shelton,Just Gettin' Started,https://genius.com/Blake-shelton-just-gettin-started-lyrics,http://api.genius.com/songs/566183,Bringing Back the Sunshine,2015-08-03," Sun just dropped off the face of the Earth World just washed off a hard day's work Band's about to kick off the night and the first song (One, two, three, four) There's a seven-forty-seven cutting cross the sky Granny and her slippers kissing pa goodnight Gonna lock down the hatch til the first butt crack of dawn   And we're just gettin' started Drinking, picking, singing Dropping our lines and hitting on strangers If you're down, get up, if you're in, get out Pop a top and fire up this party Hey, hey, we're just gettin' started   We the people of the midnight hour Silver bullet proof full of whiskey power Gettin' louder and louder as the night rolls on And gettin' drunk and stoned We're the all night owls and the neon lighters Liquored up lovers and bar room fighters And we ain't slowing down When the light weight crowd goes home   Cause we're just gettin' started Drinking, picking, singing Dropping our lines and hitting on strangers If you're down, get up, if you're in, get out Pop a top and fire up this party Hey, hey, we're just gettin' started   Yeah, don't you hate it when the night runs out of time And you still got some moon in a jug of shine Birds are singing and bringing on daylight   And we're just gettin' started Drinking, picking, singing Dropping our lines and hitting on strangers If you're down, get up, if you're in, get out Pop a top and fire up this party Hey, hey, we're just gettin' started Oh, yeah, we're just gettin' started"
