api_path,primary_artist,title,url,song_endpoint,album,release_date,lyrics
/songs/2308634,Ellie Goulding,Aftertaste,https://genius.com/Ellie-goulding-aftertaste-lyrics,http://api.genius.com/songs/2308634,Delirium,2015-11-06," Hold me like nobody else does Do I get the best of your love? Even when our bodies are drunk Is it me you're stumbling from? Forget the words that you said With your fingers spell out my name Take away the sky in our breath Remember love is a game, love is a game   Don't break, don't fade While we're not real, we're never too late Make time, it won’t hurt Said I’ll go now, but you said it first   I know there's nothing that I can do to make you stay But one thing I know that will always remain And that's the aftertaste The aftertaste The aftertaste The aftertaste The aftertaste   In the midst I'm seeing your face And I can't believe this is fake Blow the blossom into your room As you throw me in disarray There's a button that I need to press There's a face that I need to kiss Come on, give me your heart and your head Make you conscious never resist, never resist   Don't break, don't fade While we're not real, we're never too late Make time, it won’t hurt Said I’ll go now, but you said it first   I know there's nothing that I can do to make you stay But one thing I know that will always remain And that's the aftertaste The aftertaste The aftertaste The aftertaste The aftertaste I know there's nothing that I can do to make you stay But one thing I know that will always remain And that's the aftertaste The aftertaste The aftertaste The aftertaste The aftertaste The aftertaste The aftertaste The aftertaste The aftertaste"
/songs/3617754,Ellie Goulding,All I Want,https://genius.com/Ellie-goulding-all-i-want-lyrics,http://api.genius.com/songs/3617754,None,2019-01-31," All I want is nothing more To hear you knocking at my door 'Cause if I could see your face once more I'd die a happy woman, I'm sure When you said your last goodbye I died a little bit inside I lay in tears in bed all night Alone without you by my side   But if you loved me, why'd you leave me? Take my body, take my body All I want is, and all I need is To find somebody, I'll find somebody Like you, like you, like you-ou   'Cause you brought out the best of me Part of me you've never seen You took my soul and wiped it clean Our love was made for movie screens   But if you loved me, why'd you leave me? Take my body, take my body All I want is, and all I need is To find somebody, I'll find somebody   If you loved me, why'd you leave me? Take my body, take my body All I want is, and all I need is To find somebody, I'll find somebody Like you"
/songs/198878,Ellie Goulding,Animal,https://genius.com/Ellie-goulding-animal-lyrics,http://api.genius.com/songs/198878,Bright Lights,2010-11-29," I'll show you all of the places I'm dreaming of I'll take you to the ocean, I'll bring the sun We are seventeen, we have just begun I have love to fight for and then some But you are the one The one, the one, the one, the one, the one, the one, the one   Wake up in the morning, we're paralyzed We'll fly into the garden like butterflies There will be no blood and there'll be no pain I want to fall in love with you again Again again again again again again again again again   You have stolen all my senses There's a fever in my heart And you are taking my defenses You are pulling me apart Forever we're young and we are dying And we will be spilling all our blood So I will take away my feelings I will be an animal An animal An animal   I'll tie you in my arms, I will smother you We'll tell each other lies like we tell the truth I'll colour in the sky and I'll colour you I want to draw on your skin again Again again again again again again again again   You have stolen all my senses There's a fever in my heart And you are taking my defenses You are pulling me apart Forever we're young and we are dying And we will be spilling all our blood So I will take away my feelings I will be an animal An animal An animal   We will run away from danger We will run away   You have stolen all my senses There's a fever in my heart And you are taking my defenses You are pulling me apart Forever we're young and we are dying And we will be spilling all our blood So I will take away my feelings I will be an animal An animal An animal"
/songs/2342647,Ellie Goulding,Army,https://genius.com/Ellie-goulding-army-lyrics,http://api.genius.com/songs/2342647,Delirium,2016-01-09,"   I know that I've been messed up You never let me give up All the nights and the fights And the blood and the breakups You're always there to call up I'm a pain, I'm a child, I'm afraid But yeah, you understand Yeah like no one can I know that we don't look like much But no one fucks it up like us   16 and you never even judged me Matter of fact I always thought you were too cool for me Sitting there in the caravan All the nights we've been drunk on the floor And yeah you understand Yeah like no one can We both know what they say about us But they don't stand a chance because   When I'm with you When I'm with you I'm standing with an army I'm standing with an army When I'm with you When I'm with you I'm standing with an army Standing with an army   Dark times, you can always find the bright side I'm amazed by the things that you would sacrifice Just to be there for me How you cringe when you sing out of tune And yeah it's everything So don't change a thing We both know what they say about us But they don't stand a chance because   When I'm with you When I'm with you I'm standing with an army I'm standing with an army When I'm with you When I'm with you I'm standing with an army Standing with an army   Standing with an army Standing with an army Standing with an army Standing with an army (I'll be yours) Standing with an army Standing with an army I'm standing with an army   Yeah you understand Yeah like no one can We both know what they say about us   When I'm with you When I'm with you I'm standing with an army I'm standing with an army When I'm with you When I'm with you I'm standing with an army They don't have a chance either   Standing with an army Standing with an army Standing with an army Standing with an army Standing with an army Standing with an army Standing near you Standing with an army Standing with an army Standing with an army Standing with an army Standing with an army Standing with an army When I'm with you Standing with an army"
/songs/2308649,Ellie Goulding,Around U,https://genius.com/Ellie-goulding-around-u-lyrics,http://api.genius.com/songs/2308649,Delirium,2015-11-06," I just want to be around you Is that too much to ask? I just want to be around you Is that too much to ask?   When I look into your eyes Boy, I'm feeling delirious But you know this is serious I'm sticking to you like glue Only see you now and then, but I know we could have it all Because before I was cynical, baby you were just cool   I just want to be around you Is that too much to ask? Don't tell I'm wrong, I could be there Don't tell I'm wrong, I could be there I just want to be around you Is that too much to ask? Don't tell I'm wrong, I could be there Don't tell I'm wrong I could be, I could be, I could be there If only you’d let me in, I could be there Just tell me where and tell me when So tired of these roads going nowhere But I know your love takes me somewhere   Still looking up and down while you're being mysterious I see really big things for us We just need to break through, break through, break through Everything that you say, god I wish I had said it first And forgetting I had ever hurt Your love is pulling me through, me  through, me through   I just want to be around you Is that too much to ask? Don't tell I'm wrong, I could be there Don't tell I'm wrong, I could be there I just want to be around you Is that too much to ask? Don't tell I'm wrong, I could be there Don't tell I'm wrong   You are all I want So take me home The more you been thinking about us Open up, don't let me go The more you been thinking about   I just want to be around you Is that too much to ask? Don't tell I'm wrong, I could be there Don't tell I'm wrong, I could be there I just want to be around you Is that too much to ask? Don't tell I'm wrong, I could be there Don't tell I'm wrong I could be, I could be, I could be there If only you’d let me in, I could be there Just tell me where and tell me when So tired of these roads going nowhere But I know your love takes me somewhere"
/songs/198915,Ellie Goulding,Atlantis,https://genius.com/Ellie-goulding-atlantis-lyrics,http://api.genius.com/songs/198915,Halcyon,2012-10-05," This is new Feels unused I've never met anyone like you  Frightening Feeling naked Sense in searching something sacred   I'll forget you not I'll forget you not I'll forget you not I'll wait for you maybe   Where did you go? Where did you go? Where did you go? Where did you go? Where did you go? Where did you go?   Go? Where did you go? Where did you go? Where did you go? Where did you go? Where did you go?   I'm exhausted with loving No fight in me- I'm defeated I know I'm fooled, I can't help it You make my heart so helpless   I'll forget you not I'll forget you not I'll wait for you... for you... maybe I'll forget you not... I'll forget you not I'll wait for you maybe   Where did you go? Where did you go? Where did you go? Where did you go? Where did you go? Where did you go?   Go? Where did you go? Where did you go? Where did you go? Where did you go? Where did you go?   Where did you go? Where did you go? Where did you go? Where did you go? Where did you go? Where did you go?   Go? Where did you go? Where did you go? Where did you go? Where did you go? Where did you go?"
/songs/369476,Ellie Goulding,Beating Heart,https://genius.com/Ellie-goulding-beating-heart-lyrics,http://api.genius.com/songs/369476,Halcyon Days,2014-03-11," Eyes make their peace in difficulties With wounded lips and salted cheeks And finally, we step to leave To the departure lounge of disbelief   And I don't know where I'm going But I know it's gonna be a long time And I'll be leaving in the morning Come the white wine, bitter sunlight   Wanna hear your beating heart tonight Before the bleeding sun comes alive I want to make the best of what is left, hold tight And hear my beating heart one last time Before daylight   And the canyon underneath the trees Behind the dark sky, you looked at me I fell for you, like autumn leaves Never faded, evergreen   And I don't know where I'm going But I know it's gonna be a long time Cause I'll be leaving in the morning Come the white wine, bitter sunlight   Wanna hear your beating heart tonight Before the bleeding sun comes alive I want to make the best of what is left, hold tight And hear my beating heart one last time   I can't face this, now everything has changed I just wanna be by your side Here's hoping we collide Here's hoping we collide Here's hoping we collide   Wanna hear your beating heart tonight Before the bleeding sun comes alive I want to make the best of what is left, hold tight And hear my beating heart one last time   Wanna hear your beating heart, tonight"
/songs/2112985,Ellie Goulding,Beating heart - taken from the divergent soundtrack,https://genius.com/Ellie-goulding-beating-heart-taken-from-the-divergent-soundtrack-lyrics,http://api.genius.com/songs/2112985,None,2019-01-31,"Eyes make their peace in difficulties with wounded lips and salted cheeks And finally we step to leave to the departure lounge of disbelief And I don't know where I'm going but I know it's gonna be a long time And I'll be leaving in the morning come to the white wine bitter sunlight Wanna hear your beating heart tonight Before the bleeding sun comes alive I want to make the best of what is left hold tight And hear my beating heart one last time before daylight And the canyon underneath the trees Behind the dark sky you looked at me I fell for you like autumn leaves Never faded evergreen And I don't know where I'm going but I know it's gonna be a long time 'Cause I'll be leaving in the morning come to the white wine bitter sunlight Wanna hear your beating heart tonight Before the bleeding sun comes alive I want to make the best of what is left hold tight And hear my beating heart one last time I can't face, now everything has changed I just wanna be by your side Here's hoping we collide Here's hoping we collide Here's hoping we collide Wanna hear your beating heart tonight Before the bleeding sun comes alive I wanna make the best of what is left hold tight And hear my beating heart one last time Wanna hear your beating heart tonight"
/songs/2482266,Ellie Goulding,Beautifully Numb,https://genius.com/Ellie-goulding-beautifully-numb-lyrics,http://api.genius.com/songs/2482266,None,2016-05-29,I watched your feet As you walk in I wait for my hairs to rise on my skin But they don't  I'm just numb You gimme this small talk I could be anyone And there's blood And no cut No cut  Oh-ah-o-oh I should be be crying There's too much you never said The only face I won't forget  No-ah-o-oh I should be screaming But it's so hard to miss An empty space like this  So I drive away Without the brakes Beautifully numb (Beautifully numb x8)  Tell me what Did you expect Am I in love like you I forget It's like someone Cut the wires  Pulling the stitches thread by thread And there's blood And no cut No cut  Oh-ah-o-oh I should be be crying There's too much you never said The only face I won't forget  No-ah-o-oh I should be be screaming But it's so hard to miss In an empty space like this  So I drive away Without the brakes Beautifully numb (Beautifully numb x8)  Where did the love go? Where did the love go? It was only a heart that was broke  And No-ah-o-oh I should be be crying There's too much you never said The only face I won't forget  No-ah-o-oh I should be screaming But it's so hard to miss An empty space like this  So I drive away Without the brakes Beautifully numb
/songs/198879,Ellie Goulding,Believe Me,https://genius.com/Ellie-goulding-believe-me-lyrics,http://api.genius.com/songs/198879,Bright Lights,2010-11-29," Listen, I can hear the voice I need a helping hand Just to beat the void I need a mission A dream to stop me talking to myself And now the silence is broken And my soul is to sell I need to pick up the pieces To scatter to the wind Hold the city to your ears You can hear the wind come in   But you can't change the world with a song And you can't make it right when it's wrong   I can't stop this music traveling round with me wherever I go It's playing for you I can't stop this voice unraveling round me whatever I do It's talking to you The world dances to the rhythm of its own heart beating for you However you lose So speak to me Believe, believe, believe me   Don't let it slip through your fingertips When there's a ghost Don't try to reason with it Because now I'm tired, I'm wired So I won't miss a thing I wrote my words out to dry And I've forgotten what to sing   But you can't change the world with a song And you can't make it right when it's wrong   I can't stop this music traveling round with me wherever I go It's playing for you I can't stop this voice unraveling round me whatever I do It's talking to you The world dances to the rhythm of its own heart beating for you However you lose So speak to me Believe, believe, believe me   If that's what it was to you Then that's what it was to me If that's what it was to you Then that's what it was to me If that's what it was to you Then that's what it was to me   But you can't change the world with a song And you can't make it right when it's wrong   I can't stop this music traveling round with me wherever I go It's playing for you I can't stop this voice unraveling round me whatever I do It's talking to you The world dances to the rhythm of its own heart beating for you However you lose So speak to me Believe, believe, believe me"
/songs/198898,Ellie Goulding,Be Mine,https://genius.com/Ellie-goulding-be-mine-lyrics,http://api.genius.com/songs/198898,None,2019-01-31," It's a good thing tears never show in the pouring rain As if a good thing ever could make up for all the pain There'll be no last chance to promise to never mess it up again Just a sweet pain of watching your back as you walk As I'm watching you walk away   And now you're gone it's like an echo in my head And I remember every word you said  It's a cruel thing you'll never know all the ways I tried It's a hard thing faking a smile when I feel like I'm falling apart inside   And now you're gone it's like an echo in my head And I remember every word you said  And you never were And you never will be mine No you were never were And you never will be mine   For the first time there is no mercy in your eyes And the cold winds hitting my face and you're gone And you're walking away, away And I am helpless sometimes Wishing's just no good Cause you don't see me like I wish you would   Cause you never were and you never will be mine No you never were and you never will be mine   There's a moment to seize every time we meet But you always keep passing me by But you never were and you never will be mine No you were never were and you never will be mine   There's a moment to seize every time that we meet But you always keep passing me by But you never were and you never will be mine"
/songs/198899,Ellie Goulding,Bittersweet,https://genius.com/Ellie-goulding-bittersweet-lyrics,http://api.genius.com/songs/198899,The Twilight Saga: Breaking Dawn – Part 2 (Original Motion Picture Soundtrack),2012-11-09," Your arms around me come undone Makes my heart beat like a drum See the panic in my eyes Kiss me only when I cry   'Cause you always want what you're running from And you know this is more than you can take   Baby don't forget my name When the morning breaks us Baby please don't look away When the morning breaks us Oh your touch, so bittersweet, ah, ah, ah, ah Baby don't forget my name When the morning breaks us   Your cheek is softly by the sun Makes my heart beat like a drum I know it hurts you, I know it burns you Hot and cold in a lonely hotel room Look into me, tell me why you're crying I need to know   'Cause you always want what you're running from And it's always been that way, oh, oh   Baby don't forget my name When the morning breaks us Baby please don't look away When the morning breaks us Oh your touch, so bittersweet, ah, ah, ah, ah Baby don't forget my name When the morning breaks us   'Cause you always want what you're running from   Baby don't forget my name When the morning breaks us Baby please don't look away When the morning breaks us Oh your touch, so bittersweet, ah, ah, ah, ah Baby don't forget my name When the morning breaks us"
/songs/883498,Ellie Goulding,Burn (Citizen's Late Nite Dub),https://genius.com/Ellie-goulding-burn-citizens-late-nite-dub-lyrics,http://api.genius.com/songs/883498,Burn (Remixes),None," We, we don't have to worry 'bout nothing 'Cause we got the fire And we're burning one hell of a something They, they gonna see us from outer space Outer space, light it up Like we're the stars of the human race, human race We, we don't have to worry 'bout nothing 'Cause we got the fire And we're burning one hell of a something They, they gonna see us from outer space Outer space, light it up Like we're the stars of the human race, human race We, we don't have to worry 'bout nothing 'Cause we got the fire And we're burning one hell of a something They, they gonna see us from outer space Outer space, light it up Like we're the stars of the human race, human race"
/songs/2471235,Ellie Goulding,Closed For Love,https://genius.com/Ellie-goulding-closed-for-love-lyrics,http://api.genius.com/songs/2471235,None,2019-01-31,In the quiet I heard a siren Passing by I shut my eyes  Are you hurting? I lock my door I'm closed for love Don't wanna cry no more  Who will kiss my tears away? You only made them fall And it's crazy to hold on What I'm holding on is gone So now I'm closed for love  Who will kiss my tears away? You only ever made them fall So now I'm closed for love  You dropped me To the ground You stood right by Said I should fly  Always flirting Smiles soul Those stroke my heart It doesn't beat no more  And who will kiss my tears away? You only made them fall And it's crazy to hold on When you won't open So now I'm closed for love  Who will kiss my tears away? You only ever made them fall So now I'm closed for love  Friday morning I had no warning Friday night I lost the fight  Were you aiming? I wasn't sure If I had first I'm glad my back was turned  And who kiss my tears away? You only made them fall And it's crazy to hold on When you won't open So now I'm closed for love  Who will kiss my tears away? You only ever made them fall So now I'm closed for love Who will kiss my tears away? You only ever made them fall You only ever made them fall You only ever made them fall
/songs/4169784,Ellie Goulding,Close to Me (Solo),https://genius.com/Ellie-goulding-close-to-me-solo-lyrics,http://api.genius.com/songs/4169784,None,2018-10-24," Even though we both know we're liars and we start each other's fires We just know that we'll be alright Even though we're kicked out the party 'cause we both hate everybody We're the ones they wanna be like   So don't let me down Keep me in trouble Born to be wild Out in the jungle   And I don't wanna be somebody without your body Close to me And if it wasn't you, I wouldn't want anybody Close to me 'Cause I'm an animal, animal-al Like animal, like you And I don't wanna be somebody without your body Close to me   Let's be honest We only break up 'cause we love the way we make up Naked, rolling round on broken plates Let's be honest We were together because we both predators In this superficial world, we're okay   So don't let me down Keep me in trouble Born to be wild Out in the jungle   And I don't wanna be somebody without your body Close to me And if it wasn't you, I wouldn't want anybody Close to me 'Cause I'm an animal, animal-al Like animal, like you And I don't wanna be somebody without your body Close to me Close to me   Close to me Yeah, close to me   'Cuz i'm an animal, animal-al Like animal, like you   And I don't wanna be somebody without your body Close to me And if it wasn't you, I wouldn't want anybody Close to me Because I'm an animal, animal-al Like animal, like you And I don't wanna be somebody without your body Close to me Close to me   (To me) Close to me"
/songs/2308655,Ellie Goulding,Codes,https://genius.com/Ellie-goulding-codes-lyrics,http://api.genius.com/songs/2308655,Delirium,2015-11-06," Damn, boy you make it hard Shouldn't need a riddle to unlock your heart So, say what's on your mind We got other things that we could do with our Time, we could rule the world Know you say you never need another girl But, you're not making sense Trying to keep it moving while you're on the fence   Tell me black and white Why I'm here tonight I can't read the signs   Stop talking in codes, stop talking in codes Let me know what's up, can't do it no more I need a love to celebrate Stop talking in codes, stop talking in codes Let me know what's up, can’t do it no more So baby, take it all the way Stop talking in codes   It's a mystery I know that something happened in your history Oh, it's too much to risk You give me some, but you've been holding most of it Back, so it's no surprise Everything you do, I over analyze Breathe, in and out Baby, give me something new to think about   Tell me black and white Why I'm here tonight I can't read the signs   Stop talking in codes, stop talking in codes Let me know what's up, can't do it no more I need a love to celebrate Stop talking in codes, stop talking in codes Let me know what's up, can’t do it no more So baby, take it all the way Stop talking in codes   Tell me black and white Why I'm here tonight I can't read the signs   Stop talking in codes, stop talking in codes Let me know what's up, can't do it no more I need a love to celebrate Stop talking in codes, stop talking in codes Let me know what's up, can’t do it no more So baby, take it all the way Stop talking in codes Stop talking in codes, stop talking in codes Let me know what's up, can't do it no more I need a love to celebrate Stop talking in codes, stop talking in codes Let me know what's up, can’t do it no more So baby, take it all the way Stop talking in codes"
/songs/198916,Ellie Goulding,Dead In the Water,https://genius.com/Ellie-goulding-dead-in-the-water-lyrics,http://api.genius.com/songs/198916,Halcyon,2012-10-05," If I was not myself And you were someone else I'd say so much to you And I would tell the truth 'Cause I can hardly breathe When your hands let go of me The ice is thinning out And my feet brace themselves   I'm there in the water Still looking for you I'm there in the water Can't you see? Can't you see?   You've seen this all before A life left on the shore We're smiling all the same You sail away again   I'm there in the water Still looking for you I'm there in the water Can't you see? Can't you see?   (Oh, yeah, I'm dead) Dead in the water (I'm dead in the water) Still looking for you (Oh, still looking for you, for you) I'm dead in the water Can't you see? Can't you see? I'm dead in the water Still looking for you I'm dead in the water Can't you see?   I'm dead in the water Still looking for you I'm dead in the water Can't you see? Can't you see?"
