api_path,primary_artist,title,url,song_endpoint,album,release_date,lyrics
/songs/1093924,Ellie Goulding,Only Girl (In The World),https://genius.com/Ellie-goulding-only-girl-in-the-world-lyrics,http://api.genius.com/songs/1093924,None,2019-01-31,"I want to love me, like I'm a hot ride Be thinkin' of me, doin' what you like So boy forget About the world cause its only me and you tonight I wanna make your bed for ya, then Imma make you swallow the pride Want you to make me feel like I'm the only girl in the world Like I'm the one that you'll ever love Like I'm the only one who knows your heart Only girl in the world... Like I'm the only one that's in command Cuz I'm the only one who understands how to make you feel like a man Want you to make me feel like I'm the only girl in the world Like I'm the only girl you'll ever love Like I'm the only girl who knows your heart Only one.. Want you to take me like a thief in the night Hold me like a pillow, make me feel right Baby I'll tell you all my secrets that I'm keepin', you can come inside And when you enter, you ain't leavin', be my prisoner for the night ! Want you to make me feel like I'm the only girl in the world Like I'm the only one that you'll ever love Like I'm the who knows your heart Only girl in the world... Like the only one that's in command Cuz I'm the only one who understands Like I'm the only one who knows your heart, Only one... Take me for a ride Oh baby, take me high Let me make you first Oh make it last all night Take me for a ride Oh baby, take me high Let me make you first Make it last all night Want you t make me feel like I'm the only girl in the world Like I'm the only one that you'll ever love Like I'm the only one who knows your heart Only girl in the world... Like I'm the only one that's in command Cuz I'm the only one who understands how to make you feel like a man Only girl in the world... Girl in the world... Only girl in the world... Girl in the world..."
/songs/198887,Ellie Goulding,Only You,https://genius.com/Ellie-goulding-only-you-lyrics,http://api.genius.com/songs/198887,Halcyon,2012-10-05," Only you can be the aching in my heart My enemy, the only animal I couldn't fight You hold me in the dark when storms arrive Only you   Only you can see the emptiness I feel When you're with me When everything you say I'm on my knees Baby I'm on my knees Baby I'm on my knees Baby I'm on my knees When everything you say I'm on my knees Baby I'm on my knees Baby I'm on my knees Baby I'm on my knees   Only you can be the aching in my heart My enemy, the only animal I couldn't fight You hold me in the dark when storms arrive Only you   Only you can see the emptiness I feel When you're with me When everything you say I'm on my knees Baby I'm on my knees Baby I'm on my knees Baby I'm on my knees When everything you say I'm on my knees Baby I'm on my knees Baby I'm on my knees Baby I'm on my knees  Only you Only you Only you   Only you can be the aching in my heart My enemy, the only animal I couldn't fight You hold me in the dark when storms arrive Only you Only you can be the aching in my heart My enemy, the only animal I couldn't fight You hold me in the dark when storms arrive Only you"
/songs/2308684,Ellie Goulding,Paradise,https://genius.com/Ellie-goulding-paradise-lyrics,http://api.genius.com/songs/2308684,Delirium,2015-11-06," I've been filling in the blanks You left me with your open hands I never knew what I had to do Stumbling out in the dark You left me with a question mark You said the bridges had to be burned   And it's a pain that only we know Oh and you lost all on your own Always has to be a new scare To keep us falling over the edge   So, have another drink Have another drink, call me If this is what it takes If it's what it takes, baby Dream another dream Because you're killing it, honey This is what we do to get by   We're always chasing that paradise Paradise, paradise, paradise   There's a place we try to reach Impossible as it would seem I heard you crying out in your sleep I see that look you save for me I pull you back upon your feet I know you always need something more, more   And it's a thing that only we know Oh and you lost all on your own Always has to be a new scare To keep us falling over the edge   So, have another drink Have another drink, call me If this is what it takes If it's what it takes, baby Dream another dream Because you're killing it, honey This is what we do to get by   We're always chasing that paradise, paradise We're always chasing that paradise, paradise   I know we're headed for a moment, baby We made sense of it I know I struck you so reckless, honey We gave into it I know we're headed for a moment, baby We made sense of it I know I struck you so reckless, honey We gave in   So, have another drink Have another drink, call me If this is what it takes If it's what it takes, baby Dream another dream Because you're killing it, honey This is what we do to get by   We're always chasing that paradise, paradise We're always chasing that paradise, paradise"
/songs/3057574,Ellie Goulding,President,https://genius.com/Ellie-goulding-president-lyrics,http://api.genius.com/songs/3057574,None,2019-01-31," Hold back, the grudge, won’t let you be the judge There’s no room for it Just throw some love on it You watch me, my walk, my I don’t give a If I get enough of it I’ll throw some love on it  Uh uh uhhhh, uh uh uhhhh Don’t hold back, go throw some love on it   On it, on it, on it Throw it, throw it, throw it Get it, get it, get it I do it like I, I-I got it   I remember what they used to say I remember what they used to say Why they always tryin’ to talk me straight No sir, no sir, no way way way There is nothing that this heart can’t do There is nothing that this heart can’t do Why they always tryin’ to talk me straight No sir, no sir, no way way way   My make up, my cut, my innocent They tough enough they throw me off I throw it back at them Slap back, like ah, like really, really off Put a lid on it I’ll throw some love on it  Uh uh uhhhh, uh uh uhhhh Don’t hold back, go throw some love on it   On it, on it, on it Throw it, throw it, throw it Get it, get it, get it I do it like I, I-I got it   I remember what they used to say I remember what they used to say Why they always tryin’ to talk me straight No sir, no sir, no way way way There is nothing that this heart can’t do There is nothing that this heart can’t do Why they always tryin’ to talk me straight No sir, no sir, no way way way   Don’t call her princess, call her president, president  Don’t call her princess, call her president, president   Everyone used to tell me to get my shit together But did I get my shit together? Ehm, (laugh)   I remember what they used to say I remember what they used to say Why they always tryin’ to talk me straight No sir, no sir, no way way way (way, ay ay) There is nothing that this heart can’t do There is nothing that this heart can’t do Why they always tryin’ to talk me straight No sir, no sir, no way way way   Way, ay ay Way, ay ay Way, ay ay"
/songs/198922,Ellie Goulding,Ritual,https://genius.com/Ellie-goulding-ritual-lyrics,http://api.genius.com/songs/198922,Halcyon,2012-10-05," We run into a blazing fire We hold our heads up high tonight And we breathe the smoke, the fear real We let our hearts subside tonight  But it marks my skin because I know I’ve sinned And it plagues the air, on my house looming There’s a sound out here in the darkest woods And I know my fears are understood   It’s a ritual, and I know you feel it It’s a ritual, and I know you see it It’s a ritual, and I know you feel it You feel it, you feel it, you feel it   We move into the devil’s shoes It’s far too late to be rescued From highway seas and thunder skies We see our fate, you hear our cries  They go, oh oh oh oh And it won't stop here, echo in my ear There's a raging fire, and it burns so near But I'm ready now, but I’m ready now     The ritual, we lose it all The ritual, we lose it all The ritual, we lose it all The ritual, we lose it all   Oh we lose it all We lose it all    "
/songs/1839822,Ellie Goulding,Roscoe,https://genius.com/Ellie-goulding-roscoe-lyrics,http://api.genius.com/songs/1839822,An Introduction to Ellie Goulding,2009-12-20,"Stonecutters made them from stones Chosen specially for you and I Who will live inside  The mountaineers gathered tinder piled high In which to take along Driving many miles, knowing they'd get here  When they got here, all exhausted On the roof leaks they got started And now when the rain comes, we can be thankful  Ooh, ah, ooh When the mountaineers saw that everything fit They were glad, and so they took off  Thought we were due For a change or two Around this place  When they get back, they're all mixed up with no one to stay with  The village used to be all one really needs Now it's filled with hundreds and hundreds of chemicals That mostly surround you You wish to flee, but it's not like you So listen to me, listen to me  Oh, oh, and when the morning comes We will step outside We will not find another man in sight We like the newness, the newness of all That has grown in our garden soaking for so long  Whenever I was a child I wondered what if my name had changed Into something more productive like Roscoe Been born in 1891 Waiting with my Aunt Rosaline  Thought we were due For a change or two Around this place  When they get back, they're all mixed up with no one to stay with  Oh  1891 They roamed around and foraged They made their house from cedars They made their house from stone  Oh, they're a little like you And they're a little like me We have all we need  Thought we were due For a change or two Around this place This place, this place  When they get back, they're all mixed up with no one to stay with When they get back, they're all mixed up with no one to stay with"
/songs/870505,Ellie Goulding,Run Into the Light Medley,https://genius.com/Ellie-goulding-run-into-the-light-medley-lyrics,http://api.genius.com/songs/870505,Run Into the Light,None,"Who are we to be emotional? Who are we to play with hearts? And throw away it all Who are we to turn each others heads? Who are we to find ourselves in other people's beds? I don't like the way I never listen to myself I feel like I'm on fire, I'm too shy to cry for help  I don't think you know me much at all  This love is be and end all This love will be your downfall I'm feeling down about this love  Who are you to make me feel so good? Who are we to tell ourselves that we're misunderstood? Oh who am I to say I'm always yours Who am I to choose the boy that everyone adores I don't see a reason why we can't just be apart Now we're falling on each other like we're always in the dark  I don't think you warned me much at all  This love is be and end all This love will be your downfall  This love is not what you want This heart will never be yours This love is be and end all This love will be your downfall  This love is be and end all This love will be your downfall  You're so quiet But it doesn't faze me You're on time You move so fast Makes me feel lazy  And let's join forces We've got our guns and horses I know you've been burnt But every fire is a lesson learnt  I left my house Left my clothes Door wide open Heaven knows You're so worth it, you are  But I wish I could feel it all for you I wish I could be it all for you If I could erase the pain And maybe you'd feel the same I'd do it all for you I would, I would, I would, I would, I would  Let’s tie words 'Cause they amount to nothing Play it down Pretend you can't take what you've found But you found me On a screen you sit at permanently  I left my house Left my clothes Door wide open Heaven knows You're so worth it, you are  But I wish I could feel it all for you I wish I could be it all for you If I could erase the pain And maybe you'd feel the same I'd do it all for you I would, I would, I would, I would  It's time to come clean and make sense of everything It's time that we found out who we are 'Cause when I'm standing here in the dark I see your face in every star  But I wish I could feel it all for you I wish I could be it all for you If I could erase the pain And maybe you'd feel the same I'd do it all for you I would, I would, I would, I would, I would  I'd do it all for you, I would I'd do it all for you, I would I'd do it all for you, I would I'd do it all for you, I would I'd do it all for you  I had a way then Losing it all on my own I had a heart then But the queen has been overthrown And I'm not sleeping now The dark is too hard to beat And I'm not keeping up The strength I need to push me  You show the lights that stop me turn to stone You shine them when I'm alone And so I tell myself that I'll be strong And dreaming when they're gone Cuz they're calling, calling, calling me home Calling, calling, calling home You show the lights that stop me turn to stone You shine them when I'm alone  Noises, I play within my head Touch my own skin And hope they'll still be there And I think back to when My brother and my sister slept In another place The only time I feel safe  You show the lights that stop me turn to stone You shine them when I'm alone And so I tell myself that I'll be strong And dreaming when they're gone Cuz they're calling, calling, calling me home Calling, calling, calling home You show the lights that stop me turn to stone You shine them when I'm alone  Lights, lights Lights, lights Lights, lights Lights, lights Lights, lights Lights, lights Lights, lights Lights, lights Lights, lights Lights, lights Lights, lights Lights, lights Lights, lights Lights, lights  You show the lights that stop me turn to stone You shine them when I'm alone And so I tell myself that I'll be strong And dreaming when they're gone Cuz they're calling, calling, calling me home Calling, calling, calling home You show the lights that stop me turn to stone You shine them when I'm alone  Home, home (Lights, lights, lights)...  You're as sharp as a knife and you fit like a glove That is no way to live that is no way to love Full of fear in your skin and the weakness in giving in  Stabbed in the back but you feel no pain Push the heaviest doors that you can't open Yeah they tied me up and my body lies still, again  You're as bright as the sun and as bold as the moon I don't know when you'll break but it's gonna be soon If my will caves in, I'll be in the same boat as you  I've got the salt skin Running to where he is Never going to give in Even with the strength  He's stealing salt skin Telling me I'm winning wars they Created just to understand ""The meaning of""  Hands on strings and my mouth open Find the perfect words that I've not spoken And I won't tell the truth unless you want me to  For all of the times that I lost my head When it rolled to the floor and I found it again But when it came back I didn't know my own name  I've got the salt skin Running to where he is Never going to give in Even with the strength  He's stealing salt skin Telling me I'm winning wars they Created just to understand ""The meaning of""  I've got the salt skin Running to where he is Never going to give in Even with the strength  He's stealing salt skin Telling me I'm winning wars they Created just to understand  I've got the salt skin Running to where he is Never going to give in Even with the strength  He's stealing salt skin Telling me I'm winning wars they Created just to understand... ""the meaning of""  Oh, oh, starry eyed Hit, hit, hit, hit, hit me with lightning  Handle bars That I let go, let go For anyone Take me in And I'll throw out my heart And get a new one  Next thing, we're touching You look at me it's like you hit me with lightning  Oh Everybody's starry eyed And everybody glows Oh Everybody's starry eyed And my body goes  So we burst Into colours Colours And carousels Fall head first Like paper planes and playground games  Next thing, we're touching You look at me it's like you hit me with lightning  Oh Everybody's starry eyed And everybody glows Oh Everybody's starry eyed And my body goes  Next thing, we're touching Next thing, we're touching (We come and we go) Next thing, we're touching Next thing, we're touching (But we're not in love) Next thing, we're touching Next thing, we're touching (We come and we go) (But we're not in love) Next thing, we're touching Next thing, we're touching Hit me with lightning  Oh Everybody's starry eyed And everybody glows Oh Everybody's starry eyed And my body goes  Oh Everybody's starry eyed And everybody glows Oh Everybody's starry eyed And my body goes  Like all the boys before, like all the boys, boys, boys Like all the boys before, like all the boys, boys, boys  You left your blood stain on the floor You set your sights on him You left a hand print on the door Like all the boys before, like all the boys before (boys boys boys boys)  This is our luck, baby, running out Her clothes were never off We still have hours to run about To scale the map, scale the map, to get us back on track I've seen you in a fight you lost, I’ve seen you in a fii-ii-ii-ii-ght  Were under the sheets and you're killing me In our house made of paper, your words all over me Were under the sheets and you’re killin me  Like all the boys before, like all the boys, boys, boys Like all the boys before, like all the boys, boys, boys  In here the world won’t bring us down Our plan is golden Out there a lonely girl could drown In here were frozen  Where did the people go? My hands are empty You're not the answer I should know Like all the boys before, like all the boys before (whoa, whoa, whoa, whoa,)  Were in a mess baby, were in a mess babe Your more is less babe (oh, oh) Were in a mess baby, were in a mess babe Your more is less babe (oh, oh!)  Were under the sheets and you're killin me In our house made of paper, and you're words all over me We're under the sheets and you’re killin' me (I've seen you in a fight you lost) Like all the boys before, like all the boys before Were under the sheets and your killing me Our house full of paper and you're words all over me Were under the sheets and you’re killing me (Oh you’re killin me, your killin me!!)  Were under the sheets and you're killing me In our house made of paper, your words all over me Were under the sheets and you’re killin me (killin me, killin me, killin me) Killin me, killin me, killin me  Oh, oh, starry eyed Hit, hit, hit, hit, hit me with lightning  Handle bars That I let go, let go For anyone Take me in And I'll throw out my heart And get a new one  Next thing, we're touching You look at me it's like you hit me with lightning  Oh Everybody's starry eyed And everybody glows Oh Everybody's starry eyed And my body goes  So we burst Into colours Colours And carousels Fall head first Like paper planes and playground games  Next thing, we're touching You look at me it's like you hit me with lightning  Oh Everybody's starry eyed And everybody glows Oh Everybody's starry eyed And my body goes  Next thing, we're touching Next thing, we're touching (We come and we go) Next thing, we're touching Next thing, we're touching (But we're not in love) Next thing, we're touching Next thing, we're touching (We come and we go) (But we're not in love) Next thing, we're touching Next thing, we're touching Hit me with lightning  Oh Everybody's starry eyed And everybody glows Oh Everybody's starry eyed And my body goes  Oh Everybody's starry eyed And everybody glows Oh Everybody's starry eyed And my body goes"
/songs/198871,Ellie Goulding,Salt Skin,https://genius.com/Ellie-goulding-salt-skin-lyrics,http://api.genius.com/songs/198871,Lights,2010-02-26," You're as sharp as a knife and you fit like a glove That is no way to live, that is no way to love Full of fear in your skin and the weakness is giving in  You're stabbed in the back, but you feel no pain Push the heaviest doors that you can't open Yeah they tied me up and my body lies still again  You're as bright as the sun and as calm as the moon I don't know when you'll break, but it's going to be soon If my will caves in, I'll be in the same boat as you   I've got the salt skin, running to where he is Never going to give in, even with the strength He's stealing salt skin Telling me I'm winning wars they created Just to understand... ""the meaning of""   Hands on strings and my mouth open Find the perfect words that I've not spoken And I won't tell the truth, unless you want me to For all of the time that I lost my head When it rolled to the floor and I found it again But when it came back No, I didn't know my own name   I've got the salt skin, running to where he is Never going to give in, even with the strength He's stealing salt skin Telling me I'm winning wars they created Just to understand... ""the meaning of""   I've got the salt skin, running to where he is Never going to give in, even with the strength He's stealing salt skin Telling me I'm winning wars they created Just to understand...  I've got the salt skin, running to where he is Never going to give in, even with the strength He's stealing salt skin Telling me I'm winning wars they created Just to understand... ""the meaning of"""
/songs/2308674,Ellie Goulding,Scream It Out,https://genius.com/Ellie-goulding-scream-it-out-lyrics,http://api.genius.com/songs/2308674,Delirium,2015-11-06,"   I think I'll let fate just take me home Because over pain, love is outgrown I've never won a fight to understand I just move as my heart commands   I've always had a thing for silence But lately I just need a voice I recognise Baby, it's perfect timing now to...   Scream it out, out I won't let you down, down So scream it out, out I won't let you down, down   Have you found peace with your mistakes? Breathing on the glass as it breaks Have you found the words to save her And keep your heart out of danger?   I've always had a thing for silence But lately I just need a voice I recognise Baby, it's perfect timing now to....   Scream it out, out I won't let you down, down So scream it out, out I won't let you down, down   I've always had a thing for silence But lately I just need a voice I recognise Baby, it's perfect timing now to...   Scream it out, out I won't let you down, down So scream it out, out I won't let you down, down"
/songs/4427896,Ellie Goulding,Sixteen,https://genius.com/Ellie-goulding-sixteen-lyrics,http://api.genius.com/songs/4427896,Flux,2019-04-12," Do you remember when we moved out? My mum said, ""I love you, but it's a small house"" So we changed up and saved up Gave up our town We were dangerous, couldn't tame us What's missing now?   Time Suddenly, we got no time We're so busy doing life That I miss your eyes on mine, mine   If you just focus on me Like we were sixteen And plotting our lives Can I wear your t-shirt And sleep on you While I dream of all the good times? When we were sixteen   Like we were sixteen Like we were sixteen   Do you remember the teacher said ""You're too young, too stupid, don't lose your head"" But years gone and we held on with the best intent Just two kids who kicked it on MSN   Oh, time Suddenly, we got no time We're so busy doing life That I miss your eyes on mine, mine   Oh, if you just focus on me Like we were sixteen And plotting our lives (When we were plotting our lives) Can I wear your t-shirt And sleep on you While I dream of all the good times? When we were sixteen   Like we were sixteen Like we were sixteen   Let's take the love that we found And give it back to ourselves Sometimes these things don't work out Sometimes there'll be no one else They said we'd never even make it this far But here we are And we're still counting stars Like we were sixteen   Oh, when we were sixteen We're still counting stars like we were sixteen We're still counting stars like we were sixteen"
/songs/546685,Ellie Goulding,Slow Down,https://genius.com/Ellie-goulding-slow-down-lyrics,http://api.genius.com/songs/546685,None,2019-01-31, Nothing changes That’s all I ever wanted Wishing you were closer But there is so much in between This feels different With you I’ve never been so sure You reel me in I’d never been that far before That’s what I found That’s what I found That’s what I found   These days slow down Nothing but air and oceans between us Weighing me down I wish that we had nothing in common Then there would be no distance to dwell on   I am waiting but what good is another day I’ve got too much time But never time enough to say You’re all I wanted You are all I wanted You’re all I found You’re what I found   You give me all The time that you have But you’re still away In no way I'm glad 'cause I’ve got more time So I can work out All the places we’ll go And what we’ll talk about Oh when you’re back   I wish that we had nothing in common Then there would be no distance to dwell on”
