api_path,primary_artist,title,url,song_endpoint,album,release_date,lyrics
/songs/198910,Ellie Goulding,Joy,https://genius.com/Ellie-goulding-joy-lyrics,http://api.genius.com/songs/198910,Halcyon,2012-10-05," Stood in the rain and watched you go I feel a lump in my throat And this is far from joy  I never seemed to learn That high makes things harder That high I get from you   I've figured out that joy is not in your arms I know I'll always ache with an empty heart I think it's time to run because I'm seeing stars I'm seeing stars watch me fall apart   I think of dying all the time But I've got joy to take my side Fear is my favorite ride ooh hey Hoh   I've figured out that joy is not in your arms I know I'll always ache with an empty heart I think it's time to run because I'm seeing stars I'm seeing stars watch me fall apart   And then you see, ooh   I've figured out that joy is not in your arms I know I'll always ache with an empty heart I think it's time to run because I'm seeing stars I'm seeing stars watch me fall apart"
/songs/2401829,Ellie Goulding,Just In Case,https://genius.com/Ellie-goulding-just-in-case-lyrics,http://api.genius.com/songs/2401829,None,2019-01-31," Think of how we made love almost anywhere Haven't I taken you almost everywhere? Think of all the things that, that we shared Then imagine me not there, oh   Giving you more carrots than the rabbit Got you living lavish Anything I've got, you can have it Baby I'll do magic I'll do all I can to keep you satisfied So just in case I don't make it home tonight, baby   Just in case I don't make it home tonight Maybe make love to you for the last time, baby Just in case, just in case Wanna cherish each moment like the last Cause baby you're all that I have, so just in case Just in case I don't make it home tonight Maybe make love to you for the last time, baby Wanna cherish each moment like the last Cause baby you're all that I have, so just in case   Case, night, I don't make it Case, night Case, night, I don't make it Case, night, I don't make it Case, night, I don't make it Case, night, I don't make it   Just in case I don't make it home tonight Maybe make love to you for the last time, baby Just in case, just in case Wanna cherish each moment like the last Cause baby you're all that I have, so just in case   There's something you need to know Just in case I don't make it home tonight Maybe make love to you for the last time, baby Wanna cherish each moment like the last Cause baby you're all that I have, so just in case You're my heart, you're my soul Your heart makes me whole Oh oh oh Hmm Oh oh oh Come on Oh oh oh"
/songs/2308643,Ellie Goulding,Keep on Dancin',https://genius.com/Ellie-goulding-keep-on-dancin-lyrics,http://api.genius.com/songs/2308643,Delirium,2015-11-06," People like to talk because they don't know what to say Running from the truth because the truth's too much to take I keep raising glasses cause I only got today I just keep moving, I just keep moving   You can hurt me, I'll find another You can love me, you'll be my lover Happy, in rain or thunder Baby I keep I keep on, I keep on, I just keep on dancing I just keep on dancing I just keep on dancing   Can you see my, see my headlights You can come ride shotgun with me Whatever you like, ever you like Every time I look at those stars Know they ain't got the answers for me But I'll be alright, I'll be alright   You can hurt me, I'll find another You can love me, you'll be my lover Happy, in rain or thunder Baby I keep I keep on, I keep on, I just keep on dancing I just keep on dancing I just keep on dancing You can hurt me, I'll find another You can love me, you'll be my lover I just keep on dancing"
/songs/2460643,Ellie Goulding,Kingdom,https://genius.com/Ellie-goulding-kingdom-lyrics,http://api.genius.com/songs/2460643,None,2016-01-01," I see flames in your eyes And I don't recognise what you said, how you said it Words just terrorize And my heart radiates but with you, froze to ice Empty in disguise   Keep singing it louder, louder Break the hearts you win Just bring yourself higher, higher Hanging by a string  And there was no love here to save   So be a king now for a day I'll be the queen of my mistakes And when you sing out all your pain You wear the crown  Feel no shame in your, your, your, your, your kingdom Don't, don't, don't, don't, hide in your kingdom Your, your, your, your, your kingdom Don't, don't, don't, don't, woah   Did you think you were fair To say you never cared Now you sit on your throne A lonely love affair   And you are singing it louder, louder To break the hearts you lose Just build yourself higher, higher I got nothing to prove  'Cause there was no love here to save   So be a king now for a day I'll be the queen of my mistakes And when you sing out all your pain You wear the crown  Feel no shame in your, your, your, your, your kingdom Don't, don't, don't, don't, hide in your kingdom Your, your, your, your, your kingdom Don't, don't, don't, don't, woah   Your, your, your, your, your kingdom Don't, don't, don't, don't, hide in your kingdom Your, your, your, your, your kingdom Don't, don't, don't, don't, woah   So be a king now for a day I'll be the queen of my mistakes And when you sing out all your pain You wear the crown  Feel no shame in your, your, your, your, your kingdom Don't, don't, don't, don't, hide in your kingdom Your, your, your, your, your kingdom Don't, don't, don't, don't, woah"
/songs/2325415,Ellie Goulding,Let It Die,https://genius.com/Ellie-goulding-let-it-die-lyrics,http://api.genius.com/songs/2325415,Delirium,2015-11-06," Headlights flashing, cold eyes Know your bullets fly through the night Broken doors falling, and hotel floors I was never yours, never mine   All I said was ""Hello, hello"" You just stood and watched me cry to pass the time And all I said was ""Hello, hello"" Tell me how to say ""goodbye,"" cause it's goodbye   I can't stay on my knees Give me some mercy, please It's alright, let it die I wanted everything More than your love could give It's alright, let it die   See change whispers in the waves Watch my sorrows drown peacefully And empires crumble to the shores I was never yours, never mine   All I said was ""Hello, hello"" You just stood and watched me cry to pass the time And all I said was ""Hello, hello"" Tell me how to say ""goodbye,"" cause it's goodbye   I can't stay on my knees Give me some mercy, please It's alright, let it die I wanted everything More than your love could give It's alright, let it die   I can't stay on my knees Give me some mercy, please It's alright, let it die I wanted everything More than your love could give It's alright, let it die I can't stay on my knees Give me some mercy, please It's alright, let it die I wanted everything More than your love could give It's alright, let it die"
/songs/354049,Ellie Goulding,Life Round Here,https://genius.com/Ellie-goulding-life-round-here-lyrics,http://api.genius.com/songs/354049,None,2019-01-31,"(x4) Part time love is the life round here We're never done Everything feels like touchdown on a rainy day   Now we're at square one And we wait too long Til' we’re at square one  (x2) Part time love is the life round here We're never done Everything feels like touchdown on a rainy day   I wonder how you'd feel if you were lost in my mind Since you barely understand my thoughts sometimes Little bit of depth and a little bit of God Cause I swear that I be livin' in the dark sometimes And it sets in here, nobody gets let in 'Til I let my emotions out on every single page and instrumental I'm left with Shit, I wonder, will I ever really feel shit? And if it all takes time and I ask why, will time eventually reveal this? Cause... the remedy, I'm searchin' for the remedy Cause I'm fucked up and my heart's just another ghost of my memory Knock real hard on real real wood Things still feel bad when they real real good And my brain just a vessel and the knowledge suppose to heal But the more you fuckin' know, less things feel real Less things feel real, and the time shifts And my mind shifts and ain't really anyone or anything I can really vibe with Cause... I'm searchin', but I'm terrified That by the time I find what I'm lookin' for, I'll be dead inside   Cause part time love is the life round here We're never done (We're never done)"
/songs/1426627,Ellie Goulding,Lights (MK Charlee dub),https://genius.com/Ellie-goulding-lights-mk-charlee-dub-lyrics,http://api.genius.com/songs/1426627,None,2019-01-31,"I had a way then losing it all on my own I had a heart then but the queen has been overthrown And I'm not sleeping now the dark is too hard to beat And I'm not keeping up the strength I need to push me  You show the lights that stop me turn to stone You shine it when I'm alone And so I tell myself that I'll be strong And dreaming when they're gone  'Cause they're calling, calling, calling me home Calling, calling, calling home You show the lights that stop me turn to stone You shine them when I'm alone  Home  Noises, I play within my head Touch my own skin and hope that I'm still breathing And I think back to when my brother and my sister slept In an unlocked place the only time I feel safe  You show the lights that stop me turn to stone You shine it when I'm alone And so I tell myself that I'll be strong And dreaming when they're gone  'Cause they're calling, calling, calling me home Calling, calling, calling home You show the lights that stop me turn to stone You shine them when I'm alone  Home  Light, lights, lights, lights Light, lights, lights, lights Light, lights, lights, lights Light, lights  You show the lights that stop me turn to stone You shine it when I'm alone And so I tell myself that I'll be strong And dreaming when they're gone  'Cause they're calling, calling, calling me home Calling, calling, calling home You show the lights that stop me turn to stone You shine them when I'm alone  Home, home Light, lights, lights, lights Light, lights, lights, lights  Home, home Light, lights, lights, lights Light, lights, lights, lights  Home, home Light, lights, lights, lights Light, lights, lights, lights  Home, home Light, lights, lights, lights Light, lights, lights, lights"
/songs/198875,Ellie Goulding,Little Dreams,https://genius.com/Ellie-goulding-little-dreams-lyrics,http://api.genius.com/songs/198875,Bright Lights,2010-11-29," If a plane crashed into my room I wouldn't even flinch, I couldn't try to move My mind is on you My mind is on you  If the streetlight smashed above me I wouldn't move an inch Turn the glass into stars and your face is the moon And the night turns to you 'cause my mind is on you   You've got me caught in a place Panic for a minute Got my brain in a daze I wish you weren't in it There are so many ways to lose your attention You can break everything, but so what? I can take anything I can take anything, I can take anything   If electric charges shock me, I'd smile And fold my arms, I'd feel nothing new Because my mind is for you My mind is on you  And if the floor gave way to my shoes I wouldn't try to fly, I can't explain what it Would feel, I just feel you I feel, feel you   You've got me caught in a place Panic for a minute Got my brain in a daze I wish you weren't in it There are so many ways to lose your attention You can break everything, but so what? I can take anything   You're the heat in my bones But you break me with stones You're the heat in my bones But you break me with your stones   If a plane crashed into my room I wouldn't even flinch, I couldn't try to move My mind is always on you My mind is always on you   Caught in a place Panic for a minute Got my brain in a daze I wish you weren't in it There are so many ways to lose your attention You can break everything, but so what? Even when I'm caught in a place Panic for a minute Got my brain in a daze I wish you weren't in it There are so many ways to lose your attention You can break everything, but so what? I can take anything"
/songs/2308671,Ellie Goulding,Lost and Found,https://genius.com/Ellie-goulding-lost-and-found-lyrics,http://api.genius.com/songs/2308671,Delirium,2015-10-23," Gotta love this field and the cherry sky Under blossom clouds though it's late July You don't even try; still, you look so cool Like a cover boy when you light the moon   Near the countryside but I just forgot All the things that matter I forget a lot I get so caught up in the city cloud But this place is still my first love   Is there anybody out there waiting for me on my way? If that somebody is you, then baby, I just wanna say Tonight, nothing will bring us down Tonight, we're at the lost and found   Guess I need to run, take me to the bus But don't let me go, no, don't let me on Gotta hold me tight, won't put up a fight Of course I'll stay, I'll stay the night   Is there anybody out there waiting for me on my way? If that somebody is you, then baby, I just wanna say Tonight, nothing will bring us down Tonight, we're at the lost and found   We're at the lost and found We're at the lost and found   Is there anybody out there waiting for me on my way? If that somebody is you, then baby, I just wanna say Tonight, nothing will bring us down Tonight, we're at the lost and found   We're at the lost and found We're at the lost and found"
/songs/665379,Ellie Goulding,Love Me Like You Do,https://genius.com/Ellie-goulding-love-me-like-you-do-lyrics,http://api.genius.com/songs/665379,Delirium,2015-01-07,"   You're the light, you're the night You're the colour of my blood You're the cure, you're the pain You're the only thing I wanna touch Never knew that it could mean so much, so much   You're the fear, I don't care Cause I've never been so high Follow me through the dark Let me take you past the satellites You can see the world you brought to life, to life   So love me like you do, la-la-love me like you do Love me like you do, la-la-love me like you do Touch me like you do, ta-ta-touch me like you do What are you waiting for?   Fading in, fading out On the edge of paradise Every inch of your skin is a Holy Grail I've got to find Only you can set my heart on fire, on fire Yeah   I'll let you set the pace Cause I'm not thinking straight My head's spinning around, I can't see clear no more What are you waiting for?   Love me like you do, la-la-love me like you do Love me like you do, la-la-love me like you do Touch me like you do, ta-ta-touch me like you do What are you waiting for? Love me like you do, la-la-love me like you do Love me like you do, la-la-love me like you do Touch me like you do, ta-ta-touch me like you do What are you waiting for?   I'll let you set the pace Cause I'm not thinking straight My head's spinning around, I can't see clear no more What are you waiting for?   Love me like you do, la-la-love me like you do Love me like you do, la-la-love me like you do Touch me like you do, ta-ta-touch me like you do What are you waiting for? Love me like you do, la-la-love me like you do Love me like you do, la-la-love me like you do Touch me like you do, ta-ta-touch me like you do What are you waiting for?"
/songs/204449,Ellie Goulding,Midas Touch,https://genius.com/Ellie-goulding-midas-touch-lyrics,http://api.genius.com/songs/204449,Halcyon Days,2013-08-23," You say you’re going through changes Every day it seems your life is up and down And you say that you’re looking for an answer Everywhere you look it seems you can't be found  Like searching, trying to find the rainbow No ones ever found it, yet it's told to be But if you’re looking for a lover Everything you need, yeah, you can find right here with me   I’ve got the Midas touch Everything I touch turns to gold, oh, sugar I’ve got the Midas touch Baby, let me touch your body and your soul   I’ve got the Midas touch Everything I touch turns to gold, oh, sugar I’ve got the Midas touch Baby, let me touch your body and your soul   Now you’ve been trapped by love Someone takes your heart and then says goodbye So you say that you’ll never love another Tired of playing games and that’s the reason why  But now whenever were together There’s a certain feeling, that we both agree And it's time that you’ve opened up to love Cause if you don’t ever try, then baby, you may never see   I’ve got the Midas touch Everything I touch turns to gold, oh, sugar I’ve got the Midas touch Baby, let me touch your body and your soul   Together, you and I were meant to be I'll be right beside whenever you need me This love we have will never fade away You can count on me 'cause I here to stay   I’ve got the Midas touch Everything I touch turns to gold, oh, sugar I’ve got the Midas touch Baby, let me touch your body and your soul"
/songs/283654,Ellie Goulding,Mirror,https://genius.com/Ellie-goulding-mirror-lyrics,http://api.genius.com/songs/283654,The Hunger Games: Catching Fire (Original Motion Picture Soundtrack),2013-11-15,: Is this our world? I look in the mirror I can't get over you  Is this our world? Is it someone else? Is it someone else?   I look in the mirror And I try to see myself My head full of terror From the games I played so well I try to see clearer I try to forget the fires I started I try to be nearer To where you are To where you are   Are we star crossed lovers? Did I really want you gone? If I'm really a winner Where do these demons come from?   I was the girl who was on fire I was the girl who was on fire Only a bird could get much higher I look in the mirror 'Cause I was the girl who was on fire   I look in the mirror And I try to understand And piece it together Wash the blood from both my hands I can't see the ending There are people who know my every secret I'm tired of pretending You're in my heart You're in my heart   Are we star crossed lovers? Did I really want you gone? If I'm really a winner Where do these demons come from?   I was the girl who was on fire I was the girl who was on fire Only a bird could get much higher I look in the mirror 'Cause I was the girl who was on fire
/songs/1182207,Ellie Goulding,Mirrors,https://genius.com/Ellie-goulding-mirrors-lyrics,http://api.genius.com/songs/1182207,BBC Radio 1's Live Lounge 2013,None,Is this our world? I look in the mirror I can't get over you Is this our world? Is it someone else? Is it someone else? I look in the mirror And I try to see myself Wherever look terror From the games I played so well I try to see clearer I try to forget the thoughts I started I try to be nearer To where you are To where you are Are we star crossed lovers? Did I really want you gone? If I'm really a winner Where do these demons come from? I was the girl who was on fire I was the girl who was on fire Only a bird could get much higher (I look in the mirror) 'Cuz I was the girl who was on fire I look in the mirror And I try to understand And piece it together Watch the blood from both my hands I can't see the ending There are people who know my every secret I'm tired of pretending You read my heart You read my heart Are we star crossed lovers? Did I really want you gone? If I'm really a winner Where do these demons come from? I was the girl who was on fire I was the girl who was on fire Only a bird could get much higher 'Cuz I was the girl who was on fire
/songs/198905,Ellie Goulding,Mosaic,https://genius.com/Ellie-goulding-mosaic-lyrics,http://api.genius.com/songs/198905,None,2019-01-31," I am a mosaic That was found at The bottom of your garden I'm just wondering but the cracks begin to show Look closely and then you'll know Then you'll know   I am a beauty that once was Delicate intrigue, never something special But never out of your league, I've Battled with this twice now He came to me said ""Here's how"" Spoke a single line While we dance in our scene I'll just die in your arms And my life is complete   I am a mosaic That was found when you didn't know any better I am broken now  And image that's scattered Around and  around A million ways that I, I Didn't have to hurt  Battled with this twice And now he came to me, said ""Here's how"" Spoke a single line We danced in our scene I'll just die in your arms and my life is complete   Cradled your legs And took to your feet You're the strongest love I ever did meet Spoke a single line While we danced in our scene I'll just die in your arms and my life is complete"
/songs/180443,Ellie Goulding,My Blood,https://genius.com/Ellie-goulding-my-blood-lyrics,http://api.genius.com/songs/180443,Halcyon,2012-10-05," That feeling that doesn't go away just did And I walked a thousand miles to prove it And I'm caught in the crossfire of my own thoughts The color of my blood is all I see on the rocks As you sail from me   Alarms will ring for eternity The waves will break every chain on me My bones will bleach My flesh will flee So help my lifeless frame to breathe   And God knows, I'm not dying but I bleed now And God knows, it's the only way to heal now With all the blood I lost with you It drowns the love I thought I knew   The lost dreams are buried in my sleep for him And this was the ecstasy of a love forgotten And I'm thrown in the gunfire of empty bullets And my blood is all I see As you steal my soul from me   Alarms will ring for eternity The waves will break every chain on me   And God knows, I'm not dying but I bleed now And God knows, it's the only way to heal now With all the blood I lost with you It drowns the love I thought I knew   And God knows, I'm not dying but I bleed now And God knows, it's the only way to heal now With all the blood I lost with you It drowns the love I thought I knew And God knows, I'm not dying but I bleed now And God knows, it's the only way to heal now With all the blood I lost with you (I lost with you, I lost with you) It drowns the love I thought I knew (I thought I knew, I thought I)"
/songs/198906,Ellie Goulding,Not Following You,https://genius.com/Ellie-goulding-not-following-you-lyrics,http://api.genius.com/songs/198906,None,2019-01-31," If I'm catching your eye It was an accident If I looked at you strange Its not what I meant I wanted to talk But you're occupied I tried to explain But I'm tongue tied I'll wait in the wings again 'til you find me out What is the hold-up   Ooo oo oo oo I'm not following you Ooo oo oo oo Walking this way too Ooo oo oo oo I've had enough of dreaming And all my dreams are you   If I sat next to you That wasn't my intent And if my hand falls on yours It was coincidence I'd stay in the room Until you're gone I'd switch to the chair That you sat on I'd sit there alone again 'til you find me out What is the hold-up   I wish you would notice me If not now, eventually Then I wouldn't have To follow you around And hunt you down Hu-hu-hunt you down Hunt you down   Promise we'll get along If you talk to me We'll tell eachother our stories Imperfectly Imperfectly I I wanted to talk You're occupied I tried to explain but I'm tongue tied I'll wait in the wings again 'til you find me out See, what is the hold-up   Ooo oo oo oo I'm not following you Ooo oo oo oo Walking this way too Ooo oo oo oo I've had enough of dreaming And all my dreams are you"
/songs/2123773,Ellie Goulding,Of The Night,https://genius.com/Ellie-goulding-of-the-night-lyrics,http://api.genius.com/songs/2123773,None,2019-01-31," Rhythm is a dancer It's a souls companion People feel it everywhere Lift your hands and voices Free your mind and join us You can feel it in the air Oh oh, it's a passion Oh oh, you can feel it in the air Oh oh, It's a passion Oh oh, oh, oh, oh  (This is the rhythm)  You can put some joy up on my face Oh sunshine in an empty place Take me too, turn to and babe I'll make you stay Oh, I can ease you of your pain Feel you give me love again Round and round we go Each time I hear you say   This is the rhythm of the night The night, oh yeah The rhythm of the night This is the rhythm of my life My life, oh yeah The rhythm of my life   This is the rhythm of the night The night, oh yeah The rhythm of the night This is the rhythm of my life My life, oh yeah The rhythm of my life   Won't you teach me how to love and learn? There'll be nothing left for me to yearn Think of me and burn and let me hold your hand I don't want to face the world in tears Please think again, I'm on my knees Sing that song to me, no reason to repent   This is the rhythm of the night The night, oh yeah The rhythm of the night This is the rhythm of my life My life, oh yeah The rhythm of my life   This is the rhythm of the night The night, oh yeah The rhythm of the night This is the rhythm of my life My life, oh yeah The rhythm of my life   This is the rhythm of the night The night, oh yeah The rhythm of the night This is the rhythm of my life My life, oh yeah The rhythm of my life   This is the rhythm of the night The night, oh yeah"
/songs/2391601,Ellie Goulding,O Holy Night,https://genius.com/Ellie-goulding-o-holy-night-lyrics,http://api.genius.com/songs/2391601,None,2017-12-08," O Holy Night The stars are brightly shining It is the night of our dear Savior's birth Long lay the world in sin and ever pining Til He appeared and the spirit felt its worth A thrill of hope, the weary world rejoices For yonder breaks a new and glorious morn   Fall on your knees O hear the angel voices O night divine O the night when Christ was born O Holy Night The stars are brightly shining   Truly He taught us to love one another His law is love and His gospel is peace Chains He shall break for the slave is our brother And in His name all oppression shall cease O the world, the star is sweetly gleaming Sweet hymns of joy in grateful chorus raise we   Fall on your knees O hear the angel voices O night divine O the night when Christ was born O night divine   O the night when Christ was born When Christ was born When Christ was born"
