api_path,primary_artist,title,url,song_endpoint,album,release_date,lyrics
/songs/198888,Ellie Goulding,Halcyon,https://genius.com/Ellie-goulding-halcyon-lyrics,http://api.genius.com/songs/198888,Halcyon,2012-10-05," I know it's not over, baby I worked this out for sure It's going to be colder, now you've forced open the door I know you better than I ever have before I know you  I know you're a fighter But you never fought for me when I was a shelter So you're not heading home to me  We could be closer, we could be closer We could be   When it's just us You show me what it feels like to be lonely You show me what it feels like to be lost I take your hand for you to let it go Let it go, let it go, let it go   When it's just us You show me what it feels like to be lonely You show me what it feels like to be lost I take your hand for you to let it go Let it go, let it go, let it go   It's going to be, it's gonna be better It's going to be better, it's gonna be better It's going to be better It's going to be better It's going to be better It's going to be It's going to be better It's going to be better   We'll take a long walk, down the alleys of these houses And we'll talk, see what conversation rouses when we're alone When we're alone, it could be home   When it's just us You show me what it feels like to be lonely You show me what it feels like to be lost I take your hand for you to let it go Let it go, let it go, let it go   It's going to be, it's gonna be better It's going to be better, it's gonna be better It's going to be better It's going to be better It's going to be better It's going to be It's going to be better It's going to be better"
/songs/81038,Ellie Goulding,Hanging On,https://genius.com/Ellie-goulding-hanging-on-lyrics,http://api.genius.com/songs/81038,Halcyon,2012-07-12," You know we can get away Because I'm calling your name Every day I feel this pain But you just turn and walk away   No, I just can't keep hanging on To you and me I just don't know what is wrong With you and me   Touch me and then turn away And put your hands into the flame Tell me if you feel this pain Cause I don't wanna be a ball and chain   No, I just can't keep hanging on To you and... I just don't know what is wrong   Yeah, give me that respect, forgive me and forget You've got to get a grip, living on the edge I barely even know this fucking woman in my bed And if there is too much on my plate then I ain't finishing my veg And if anybody said the grass is greener on the other side Well it ain't, swear on my mother's life You got me wrapped up in your shit, I'm feeling mummified I've only ever had this fucking feeling in my stomach twice You gave me what I needed and I gave her everything she wanted There's something 'bout your cleavage, now I can't put my fingers on it Been taking me the deepest, I thought that she was gonna vomit If all women are from Venus then I guess I really got a rocket You've got a noose around my neck but I'm still hanging on We've nearly reached the finish line up in our marathon I spat a verse, she sang a song She broke my heart, I took some Gaviscon   I just can't keep hanging on To you and me With you and me With you and"
/songs/198903,Ellie Goulding,Have Yourself A Merry Little Christmas,https://genius.com/Ellie-goulding-have-yourself-a-merry-little-christmas-lyrics,http://api.genius.com/songs/198903,None,2019-01-31," Have yourself a merry little Christmas Let your heart be light From now on your troubles will be out, of sight  Have yourself a merry little Christmas Let the yuletide gay From now on your troubles will be miles away   Here we are, as in olden days Happy golden days, of yore Faithful friends, who are dear to us Gather near to us, once more  Someday soon, we all will be together If the fates allow Until then, we'll have to muddle through, somehow   And have yourself a merry little Christmas, now"
/songs/2308688,Ellie Goulding,Heal,https://genius.com/Ellie-goulding-heal-lyrics,http://api.genius.com/songs/2308688,Delirium,2015-11-06," When you appeared I was just lonely I was just in need of a friend Spend your days Thinking if only Thinking if only you and me made sense For any love Quit the pain you feel You won't let it go You won't let it heal Baby, it's clear You don't know me You don't know me   And I don't have the heart that you think I do And you give me so much, it's too much to lose You know I'm not the one Baby, I'm not the one I can't show you my love that you showed to me When it isn't enough, I won't make-believe You know I'm not the one Baby, leave love alone Let it heal Let it heal   It's in your eyes I can see that you're broken I know you're lost because I am too It's in your voice I hear you choking When did the illusion take the truth I think you're in love With the pain you feel You won't let it go You won't let it heal Baby it's clear You don't even know me You don't even know me   And I don't have the heart that you think I do And you give me so much, it's too much to lose You know I'm not the one Baby, I'm not the one I can't show you my love that you showed to me When it isn't enough, I won't make-believe You know I'm not the one Baby, leave love alone Let it heal Let it heal   You lit the fire and you held it in your hands until it flickered out It wasn't innocent, you've measured every inch of love you've given now You lit the fire and you held it in your hands until it flickered out It wasn't innocent, you've measured every inch of love you've given now   And I don't have the heart that you think I do And you give me so much, it's too much to lose You know I'm not the one Baby, I'm not the one I can't show you my love that you showed to me When it isn't enough, I won't make-believe You know I'm not the one Baby, leave love alone Let it heal Let it heal"
/songs/210028,Ellie Goulding,Hearts Without Chains,https://genius.com/Ellie-goulding-hearts-without-chains-lyrics,http://api.genius.com/songs/210028,Halcyon Days,2013-08-23," You wake up, I know it's time to go With a spinning head, I lie and watch you smoke Chase the hands on my watch and hold you close This misery is weightless as a stone   Have you lost the same things I have lost? Do you know that panic I know? And would I see the terror in your face? Do you know that fever I know?   I wish time was still We'd stay right here With time to kill In our hearts without chains If time was still We'd have no fear Or scars to heal In our hearts without chains In our hearts without chains   You left everything behind except yourself All I see is question marks and nothing else You must have landed in New York by now Please don't bring this love down   Have you lost the same things I have lost? Do you know that panic I know? And would I see the terror in your face? Do you know that fever I know?   I wish time was still We'd stay right here With time to kill In our hearts without chains If time was still We'd have no fear Or scars to heal In our hearts without chains In our hearts without chains   Don't bring this love down Don't bring this love down Don't bring this love down Don't bring this love down   I wish time was still We'd stay right here With time to kill In our hearts without chains If time was still We'd have no fear Or scars to heal In our hearts without chains In our hearts without chains"
/songs/2425590,Ellie Goulding,Here's to Us,https://genius.com/Ellie-goulding-heres-to-us-lyrics,http://api.genius.com/songs/2425590,"Girls, Vol. 3 (Music from the HBO Original Series)",2016-03-29," You're falling at your feet, giving everything up There's something in the way, love is never enough I see your sorry hand putting down the gun With a war in your mind that never wants to be won I catch you in a light no one else can see I know you see her, and you'll never see me She makes you feel the most, keep your souls alive But what we had, it never really died   And this is what I'll say if I had any words Wish we hadn't messed up, now your heart is with hers And I know that your love wasn't here to stay I gave you all of mine but you gave it away And now you're the one who hurts You had to love someone else just to know your worth But here's to us Here's to us Here's to us   Yeah, this is just a phase, pretty sure of that And one day, you and I, we will never look back You kept me in the flames but the fire was out, the fire was out, the fire was out   And this is what I'll say if I had any words Wish we hadn't messed up, now your heart is with hers And I know that your love wasn't here to stay I gave you all of mine but you gave it away And now you're the one who hurts You had to love someone else just to know your worth   Ooh ooh Ah ah Ooh ooh Ah ah Ooh ooh Ah ah Ooh ooh Ah ah Ooh ooh   And this is what I'll say if I had any words Wish we hadn't messed up, now your heart is with hers And I know that your love wasn't here to stay I gave you all of mine but you gave it away And now you're the one who hurts You had to love someone else just to know your worth But here's to us Here's to us Here's to us"
/songs/1272138,Ellie Goulding,High for This,https://genius.com/Ellie-goulding-high-for-this-lyrics,http://api.genius.com/songs/1272138,Halcyon,2012-10-05," Whoa-oh-oh Whoa-oh-oh Whoa-oh-oh Whoa-oh-oh   You don't know what's in store But you know what you're here for Close your eyes Lay yourself beside me Hold tight for this ride We don't need no protection Come alone we don't need attention   Open your hand Take a glass Don't be scared I'm right here Even though you don't roll Trust me, boy You wanna be high for this   Whoa-oh-oh Whoa-oh-oh Whoa-oh-oh Whoa-oh-oh   Take it off You want it off 'Cause I know what you're feeling It's ok Boy, I feel it too Let it be Baby, breathe I swear I am right here We'll be good I promise we'll be so good   Oh, open your hand Take a glass Don't be scared I'm right here Even though you don't roll Trust me, boy You wanna be high for this   Whoa-oh-oh Whoa-oh-oh Whoa-oh-oh Whoa-oh-oh"
/songs/2308657,Ellie Goulding,Holding on for Life,https://genius.com/Ellie-goulding-holding-on-for-life-lyrics,http://api.genius.com/songs/2308657,Delirium,2015-11-06," Enemy, used to be Part of you, bittersweet But now you tell me lies Up and down, cold and hot Swear to God, got to stop Because I can't sleep at night   If you wanted love like this Blowing up with every kiss Should've known better Because you find yourself alone Chilling you right to the bone No, should've known better   You and me just Running towards the light Giving up the fight Hoping we survive You and me just Strangers in the night Giving up the fight Waiting to ignite Holding on for life Holding on for life Holding on for life Holding on for life Holding on for life Holding on for life Holding on for life Holding on for life   Lost in you, lost in me Afraid of love, in too deep So we just run and hide Lightning fast, felt the crash Scared to lose, fear attacks We only know goodbye   You and me just Running towards the light Giving up the fight Hoping we survive You and me just Strangers in the night Giving up the fight Waiting to ignite Holding on for life Holding on for life Holding on for life Holding on for life Holding on for life Holding on for life Holding on for life Holding on for life   If you wanted love like this Blowing up with every kiss Should've known better Because you find yourself alone Chilling you right to the bone No, should've known better   Hopelessly holding on To all those perfect nights Let's pretend it's not gone And say we'll never die   You and me just Running towards the light Giving up the fight Hoping we survive You and me just Strangers in the night Giving up the fight Waiting to ignite Holding on for life Holding on for life Holding on for life Holding on for life Holding on for life Holding on for life Holding on for life Holding on for life Holding on for life Holding on for life Holding on for life Holding on for life Holding on for life Holding on for life Holding on for life Holding on for life   Hopelessly holding on To all those perfect nights Let's pretend it's not gone And say we'll never die Say we'll never die"
/songs/4480961,Ellie Goulding,Hollow Crown,https://genius.com/Ellie-goulding-hollow-crown-lyrics,http://api.genius.com/songs/4480961,For the Throne (Music Inspired by the HBO Series Game of Thrones),2019-04-26," You know you're fighting in a losing battle Making a noose out of your hollow crown I hold a match up to your paper castle And watch it all burn down, down, down You know you’re fighting in a losing battle Making a noose out of your hollow crown I hold a match up to your paper castle And watch it all burn down, down, down Down, down, down   T-tell me what you see, my dear, my dear Is there anyone you trust 'round here, 'round here Keep a knife under your pillow, the sharks and the minnows Smell blood in the water ’round here, 'round here And tell me who you're fighting right now, right now You got everyone against you somehow, somehow It's become an obsession, look at your reflection And look who you're becoming right now, right now (Oh)   I could've been who you trusted (Oh) I could've been who you need right now (Oh) But you pushed me away, yeah, you lost me (Oh) And now you're lost   You know you’re fighting in a losing battle Making a noose out of your hollow crown I hold a match up to your paper castle And watch it all burn down, down, down You know you’re fighting in a losing battle Making a noose out of your hollow crown I hold a match up to your paper castle And watch it all burn down, down, down Down, down, down   A funny kind of love, my dear, my dear Got a kick out of the taste of my tears out here Thought you had to play a villain, running from your feelings But I'm walking on my own, no fear, no fear (Oh)   I could’ve been who you trusted (Oh) (I could've been who you trusted) I could've been who you need right now (Oh) But you pushed me away, yeah, you lost me (Oh) And now you're lost   You know you’re fighting in a losing battle Making a noose out of your hollow crown I hold a match up to your paper castle And watch it all burn down, down, down You know you're fighting in a losing battle Making a noose out of your hollow crown I hold a match up to your paper castle And watch it all burn down, down, down Down, down, down"
/songs/198877,Ellie Goulding,Home,https://genius.com/Ellie-goulding-home-lyrics,http://api.genius.com/songs/198877,Bright Lights,2010-11-29," Lonely thoughts they seep, into mind Into me Pushing deep Wash the dirt, a hard days work Know my place   On my own No poison in my bones On my own   This is where I build my home My home This will always be my home   I work until it's late Walk in and close the gate I look in the window And I gaze at my face Every line and every abrasion This took my life to make This took my life to make   On my own No poison in my bones On my own   This is where I build my home My home This will always be my home  I need someone, to hold I need someone, to hold   My home This will always be my home This will always be my home"
/songs/218421,Ellie Goulding,How Long Will I Love You,https://genius.com/Ellie-goulding-how-long-will-i-love-you-lyrics,http://api.genius.com/songs/218421,Halcyon Days,2013-08-23,How long will I love you As long as stars are above you And longer if I can How long will I need you As long as the seasons need to Follow their plan  How long will I be with you As long as the sea is bound to Wash up on the sand  How long will I want you As long as you want me to And longer by far How long will I hold you As long as your father told you As long as you can  How long will I give to you As long as I live through you However long you say  How long will I love you As long as stars are above you And longer if I may   We're all traveling through time together Every day of our lives All we can do is do our best To relish this remarkable ride
/songs/198872,Ellie Goulding,Human,https://genius.com/Ellie-goulding-human-lyrics,http://api.genius.com/songs/198872,Bright Lights,2010-11-29," Human behave yourself You have burst at the seams Let it all fall out, open your mouth Often I lay wide awake, think of things I can make But I don't seem to have the parts to build them   Human, I wonder why you're a better make than I could ever build or create You know not love or hate I am so scared of what will kill me in the end For I am not prepared I hope I will get the chance   To be someone To be human Look what we've done Look what we've done   I would give my life to be human I would give my life to be human I would give my life to be human I would give my life to be...   Human, I'm trying to come clean I will be a better me I will not drink until I'm dead I'll make the most of it I don't know what it's like to be alive To say goodbye To cry a thousand times because my ears won't listen   Human, I'm trying not to lose my faith in you I've sussed out all that I've seen through I've sailed an ocean I am so scared of what I'll look like in the end For I am not prepared I hope I will get the chance   To be someone To be human Look what we've done Look what we've done   I would give my life to be human I would give my life to be human I would give my life to be human I would give my life to be...   I used to hear it all so loud, the sound of my heart breaking The truth is waiting to be found, I trust that I will take it  ]Hook] I would give my life I would give my life. (hu-u-uman) I would give my life. (hu~u~uman) I would give my life. (hu-u-uman)   I would give my life to be human I would give my life to be human I would give my life to be human I would give my life to be human..."
/songs/2308681,Ellie Goulding,I Do What I Love,https://genius.com/Ellie-goulding-i-do-what-i-love-lyrics,http://api.genius.com/songs/2308681,Delirium,2015-11-06," I do what I love I do what I love and I love what I do   How many times do I need to Need to fight you baby Just to get that it's no good And I know that I'm strong But my mind's almost gone And it's getting on my mood And all this buzzing you been doing See you got me hanging up See you really got me worse   But I got to move on, baby Because bitches got to eat Got to get back to work I can't ask for your permission I can't wait for it Because I was born free I ain't taking shit   I do what I love and I love what I do Stop me, stop me I'm stopping you Get the move right, baby, I'll show what I mean Don't stop me, stop me, I like how it feels I do what I love and I love what I do Stop me, stop me I'm stopping you Get the move right, baby, I'll show what I mean Don't stop me, stop me, I like how it feels   How many hits do you need for Me to get it in you Get it in you And I'm strong and my heart In my heart it won't change For anyone or anything And if you're crying about your lover Because your lover is a dick This will get you over it   But you got to move on, baby Because bitches got to eat Got to get back to work I can't ask for your permission I can't wait for it Because I was born free I ain't taking this   I do what I love and I love what I do Stop me, stop me I'm stopping you Get the move right, baby, I'll show what I mean Don't stop me, stop me, I like how it feels   I do what I love and I love what I do I do what I love and I love what I do Get move right baby, I'll show what I mean Get move right baby, I'll show what I mean   I do what I love and I love what I do Stop me, stop me I'm stopping you Get the move right, baby, I'll show what I mean Don't stop me, stop me, I like how it feels I do what I love and I love what I do Stop me, stop me I'm stopping you Get the move right, baby, I'll show what I mean Don't stop me, stop me, I like how it feels   I do what I love and I love what I do"
/songs/198913,Ellie Goulding,I Know You Care,https://genius.com/Ellie-goulding-i-know-you-care-lyrics,http://api.genius.com/songs/198913,Halcyon,2012-10-05," Clinging to me Like a last breath you would breathe You were like home to me I don't recognize the street  Please don't close your eyes Don't know where to look without them Outside the cars speed by I'd never heard them until now   I know you care I know it is always been there But there's trouble ahead, I can feel it You are just saving yourself when you hide it Yeah, I know you care I see it in the way that you stare As if there was trouble ahead and you knew it I'll be saving myself from the ruin And I know you care   I used to run down the stairs To the door when I thought you were there Do you shape through the comfort of us Two lovers locked out of love   Oh, but I know you care I know it has always been there But there's trouble ahead, I can feel it You are just saving yourself when you hide it Yeah, I know you care I see it in the way that you stare As if there was trouble ahead and you knew it I'll be saving myself from the ruin   I know it wasn't always wrong But I've never known a winter so cold Now I don't warm my hands in your coat But I still hope 'cause this is how things ought to have been And I know the worst of it wasn't all that it seemed Why can't I dream? And why can't I dream?   Because I know you care And I know you care I know you care I know you care I know it's always been there"
/songs/198870,Ellie Goulding,I'll Hold My Breath,https://genius.com/Ellie-goulding-ill-hold-my-breath-lyrics,http://api.genius.com/songs/198870,Lights,2010-02-26," Breathe air you're not used to Tread floors you don't fall through Make waves, you crash a symbol hard Follow no one, always play the wrong card Waste days in foreign places Shed light on your better side Reassure me that you'll wait for me Wait for me as long as it takes And I'll hold my breath, I'll hold my breath   Until you see me in your dreams We'll stay awake beneath the trees We'll watch the buildings turn to dust A sky of diamonds just for us You are the risk I'll always take The only branch I'll never break Those fears we'll blow them all away We'll blow them all away   Fight fires in your best clothes Touch skin with your eyes closed Chase thunder with the volume down Pack a suitcase, wander to the next town Force quit on your losing streak Solve a riddle in a magazine, be tongue in cheek Tell me that we're still too young That we're still too young and I'll hold my tongue   Until you see me in your dreams We'll stay awake beneath the trees We'll watch the buildings turn to dust A sky of diamonds just for us You are the risk I'll always take The only branch I'll never break Those fears we'll blow them all away We'll blow them all away   I'm here, I'm here to take you I'll swim, I'll swim to save you No fall, I'm here to catch you I'll swim, I'll swim to save you   Until you see me in your dreams We'll stay awake beneath the trees We'll watch the buildings turn to dust A sky of diamonds just for us You are the risk I'll always take The only branch I'll never break Those fears we'll blow them all away We'll blow them all away"
/songs/198923,Ellie Goulding,In My City,https://genius.com/Ellie-goulding-in-my-city-lyrics,http://api.genius.com/songs/198923,Halcyon,2012-10-05," If I ever had a wish in the whole world I would’ve listened to my brother when he spoke to me And I never would’ve played with my conscience In the fields where I was in their company   But you gave me wings and I used them I used them, I used them on my youth And you gave me wings and I used them I used them, and I won’t lose them   Now I found my feet, count to 1, 2, 3 And I’m taking off tonight, now I’m free As I walk my feet on the cold concrete And I, and I, and I   I can feel my dreams when I’m in my city I fall on my knees for my, for my city We’re going off the dream in my, in my city And that’s where I’ll stay And that’s where I’ll stay In my city   Rolling down the streets in my new town With the lights blinding and my heart weighed down I think I’ll get a job with stealing people’s thunder But the folks back home, I’ll make them proud   But you gave me wings and I used them I used them, I used them on my youth Yeah, you gave me wings and I used them I used them, and I won’t lose them (I don't wanna lose them)   I can feel my dreams when I’m in my city I fall on my knees for my, for my city We’re going off the dream in my, in my city And that’s where I’ll stay And that’s where I’ll stay In my city   Shoulders ache for wanted wings My city shakes, the fear in me   I can feel my dreams when I’m in my city I fall on my knees for my, for my city We’re going off the dream in my, in my city And that’s where I’ll stay And that’s where I’ll stay In my city"
/songs/1839846,Ellie Goulding,Jolene (Dolly Parton cover),https://genius.com/Ellie-goulding-jolene-dolly-parton-cover-lyrics,http://api.genius.com/songs/1839846,None,2019-01-31,"Jolene, Jolene, Jolene, Jolene I'm begging of you please don't take my man Jolene, Jolene, Jolene, Jolene Please don't take him just because you can Your beauty is beyond compare With flaming locks of auburn hair With ivory skin and eyes of emerald green Your smile is like a breath of spring Your voice is soft like summer rain And I cannot compete with you, Jolene He talks about you in his sleep There's nothing I can do to keep From crying when he calls your name, Jolene And I can easily understand How you could easily take my man But you don't know what he means to me, Jolene Jolene, Jolene, Jolene, Jolene I'm begging of you please don't take my man Jolene, Jolene, Jolene, Jolene Please don't take him just because you can You could have your choice of men But I could never love again He's the only one for me, Jolene I had to have this talk with you My happiness depends on you And whatever you decide to do, Jolene Jolene, Jolene, Jolene, Jolene I'm begging of you please don't take my man Jolene, Jolene, Jolene, Jolene Please don't take him even though you can Jolene, Jolene"
