api_path,primary_artist,title,url,song_endpoint,album,release_date,lyrics
/songs/3069711,Halsey,Eyes Closed,https://genius.com/Halsey-eyes-closed-lyrics,http://api.genius.com/songs/3069711,hopeless fountain kingdom,2017-05-04," I, I know where to lay I know what to say It's all the same And I, I know how to play I know this game It's all the same   Now if I keep my eyes closed, he looks just like you But he'll never stay, they never do Now if I keep my eyes closed, he feels just like you But you've been replaced I'm face to face with someone new   Would've gave it all for you, cared for you So tell me where I went wrong Would've gave it all for you, cared for you (My lover, my liar) Would've traded all for you, there for you So tell me how to move on Would've traded all for you, cared for you (My lover, my liar)   Now if I keep my eyes closed, he looks just like you But he'll never stay, they never do Now if I keep my eyes closed, he feels just like you But you've been replaced I'm face to face with someone new   He don't realize that I'm thinkin' about you It's nothing new, it's nothing new   Now if I keep my eyes closed, he looks just like you But he'll never stay, they never do Now if I keep my eyes closed, he feels just like you But you've been replaced I'm face to face with someone new"
/songs/2424783,Halsey,Garden,https://genius.com/Halsey-garden-lyrics,http://api.genius.com/songs/2424783,None,2019-04-24," Ah, ah, ah, ah Ah, ah, ah, ah Ah, ah, ah, ah Ah, ah, ah, ah   He said, ""Darling, who you praying to? Was anybody answering you? Because I've done my part for twelve years now And I can't seem to get through""  He said, ""I really don't care if you cut your hair And I really wouldn't mind if we don't go anywhere Cause I've got you, yeah, I've got you now I've got you""   And you think my bruised knees are sort of pretty And I think your tired eyes are kind of nice And when I first met you, there was a garden Growing from a black hole in my mind   Ah, ah, ah, ah Ah, ah, ah, ah Ah, ah, ah, ah Ah, ah, ah, ah   He said, ""Darling, what's it coming to? And have you got a lighter on you? Been trying put these down for ages now But I can't seem to come through""  He said, ""I really don't mind if we take our time Cause I've got a couple bottles of your favorite wine Cause I've got you, yeah, I've got you now I've got you""   And you think my bruised knees are sort of pretty And I think your tired eyes are kind of nice And when I first met you, there was a garden Growing from a black hole in my mind   Said I love everything that you've got, boy Tell me, would you be mine? Be mine, be mine Sick, sweet nothing's you're tryna talk, boy Tell me would you be mine? Be mine, be mine   And you think my bruised knees are sort of pretty And I think your tired eyes are kind of nice And when I first met you, there was a garden Growing from a black hole in my mind"
/songs/2286804,Halsey,Gasoline,https://genius.com/Halsey-gasoline-lyrics,http://api.genius.com/songs/2286804,BADLANDS (Deluxe Edition),2015-08-28," Are you insane like me? Been in pain like me? Bought a hundred dollar bottle of champagne like me? Just to pour that motherfucker down the drain like me? Would you use your water bill to dry the stain like me? Are you high enough without the Mary Jane like me? Do you tear yourself apart to entertain like me? Do the people whisper ‘bout you on the train like me? Saying that ""you shouldn't waste your pretty face"" like me?   And all the people say ""You can't wake up, this is not a dream You're part of a machine, you are not a human being With your face all made up, living on a screen Low on self esteem, so you run on gasoline""   (Oh, ooh oh, ooh oh, oh) I think there’s a flaw in my code (Oh, ooh oh, ooh oh, oh) These voices won’t leave me alone Well my heart is gold and my hands are cold   Are you deranged like me? Are you strange like me? Lighting matches just to swallow up the flame like me? Do you call yourself a fucking hurricane like me? Pointing fingers cause you'll never take the blame like me?   And all the people say ""You can't wake up, this is not a dream You're part of a machine, you are not a human being With your face all made up, living on a screen Low on self esteem, so you run on gasoline""   (Oh, ooh oh, ooh oh, oh) I think there’s a flaw in my code (Oh, ooh oh, ooh oh, oh) These voices won’t leave me alone Well my heart is gold and my hands are cold"
/songs/519309,Halsey,Ghost,https://genius.com/Halsey-ghost-lyrics,http://api.genius.com/songs/519309,BADLANDS (Deluxe Edition),2014-01-28," I'm searching for something that I can't reach   I don't like them innocent, I don't want no face fresh Want them wearing leather, begging, let me be your taste test I like the sad eyes, bad guys, mouth full of white lies Kiss me in the corridor, but quick to tell me goodbye   You say that you're no good for me 'Cause I'm always tugging at your sleeve And I swear I hate you when you leave But I like it anyway   My ghost, where'd you go? I can't find you in the body sleeping next to me My ghost, where'd you go? What happened to the soul that you used to be?   You're a Rolling Stone boy, never-sleep-alone boy Got a million numbers and they're filling up your phone, boy I'm off the deep end, sleeping all night through the weekend Saying that I love him but I know I'm gonna leave him   You say that you're no good for me 'Cause I'm always tugging at your sleeve And I swear I hate you when you leave But I like it anyway   My ghost, where'd you go? I can't find you in the body sleeping next to me My ghost, where'd you go? What happened to the soul that you used to be?   I'm searching for something that I can't reach   My ghost, where'd you go? I can't find you in the body sleeping next to me My ghost, where'd you go? What happened to the soul that you used to be?"
/songs/3069720,Halsey,Good Mourning,https://genius.com/Halsey-good-mourning-lyrics,http://api.genius.com/songs/3069720,hopeless fountain kingdom,2017-06-02," They told me once, ""There's a place where love conquers all"" A city with the streets full of milk and honey I haven't found it yet, but I'm still searching All I know is a hopeless place that flows with the blood of my kin Perhaps hopeless isn't a place, nothing but a state of mind They told me once, ""Don't trust the moon, she's always changing"" The shores bend and break for her And she begs to be loved, but nothing here is as it seems   Sun is coming up oh, why, oh, why, oh, why... Sun is coming up oh, why, oh, why, oh, why... Sun is coming up oh, why, oh, why, oh, why... Sun is coming up oh, why, oh, why, oh, why... Sun is coming up oh, why, oh, why, oh, why... Sun is coming up oh, why, oh, why, oh, why... Sun is coming up oh, why, oh, why, oh, why..."
/songs/824116,Halsey,Haunting,https://genius.com/Halsey-haunting-lyrics,http://api.genius.com/songs/824116,BADLANDS (Deluxe Edition),2015-08-28," Keep on haunting Keep on haunting me Keep on haunting Keep on haunting me   I was as pure as a river But now I think I'm possessed You put a fever inside me And I've been cold since you left I've got a boyfriend now and he's made of gold And you've got your own mistakes in a bed at home I'm hoping you could save me now, but you break and fold You've got a fire inside, but your heart's so cold   Cause I've done some things that I can't speak And I've tried to wash you away, but you just won't leave So won't you take a breath and dive in deep? Cause I came here so you'd come for me   I'm begging you to keep on haunting I'm begging you to keep on haunting me I'm begging you to keep on haunting I know you're gonna keep on haunting me   We walk as tall as the skyline And we have roots like the trees But then your eyes had to wander Cause they weren't looking at me You weren't looking for me   Cause I've done some things that I can't speak And I've tried to wash you away, but you just won't leave So won't you take a breath and dive in deep? Cause I came here so you'd come for me   I'm begging you to keep on haunting I'm begging you to keep on haunting me I'm begging you to keep on haunting I know you're gonna keep on haunting me   Cause I've done some things that I can't speak And I've tried to wash you away, but you just won't leave So won't you take a breath and dive in deep? Cause I came here so you'd come for me   I'm begging you to keep on haunting I'm begging you to keep on haunting me I'm begging you to keep on haunting I know you're gonna keep on haunting me"
/songs/3069712,Halsey,Heaven in Hiding,https://genius.com/Halsey-heaven-in-hiding-lyrics,http://api.genius.com/songs/3069712,hopeless fountain kingdom,2017-06-02," Sittin' on the counter in your kitchen Can you hear my heartbeat fucking kickin'? Your eyes light up 'cause you best believe that I got something up my sleeve I walk my talk, no time for wishful thinking I push up on my toes, you call me ""sweet thing"" I'm breathing down your neck, your body screaming And you thought that you were the boss tonight, but I can put up one good fight I flip the script like I can take a beating   And when you start to feel the rush A crimson headache, aching blush And you surrender to the touch, you'll know I can put on a show, I can put on a show Don't you see what you're finding? This is Heaven in hiding, oh And when you start to look at me, a physical fatality And you surrender to the heat, you'll know I can put on a show, I can put on a show Don't you see what you're finding? This is Heaven in hiding This is Heaven in hiding, oh   Sitting on the concrete in your basement But I don't have no time for conversation Said, ""This ain't what you usually do, and a girl like me is new for you"" And I can tell you mean it 'cause you're shaking   And when you start to feel the rush A crimson headache, aching blush And you surrender to the touch, you'll know I can put on a show, I can put on a show Don't you see what you're finding? This is Heaven in hiding, oh And when you start to look at me, a physical fatality And you surrender to the heat, you'll know I can put on a show, I can put on a show Don't you see what you're finding? This is Heaven in hiding This is Heaven in hiding, oh   Oh, oh, oh, oh, oh Oh, oh, oh, oh, oh Oh, oh, oh, oh, oh (Ooh) Oh, oh, oh, oh, oh   And when you start to feel the rush A crimson headache, aching blush And you surrender to the touch, you'll know I can put on a show, I can put on a show Don't you see what you're finding? This is Heaven in hiding, oh And when you start to look at me, a physical fatality And you surrender to the heat, you'll know I can put on a show, I can put on a show Don't you see what you're finding? This is Heaven in hiding This is Heaven in hiding This is Heaven in hiding, oh   Oh, this is Heaven in hiding This is Heaven in hiding 'Cause I'm Heaven in hiding"
/songs/726667,Halsey,Hold Me Down,https://genius.com/Halsey-hold-me-down-lyrics,http://api.genius.com/songs/726667,BADLANDS (Deluxe Edition),2015-06-02," My demons are begging me to open up my mouth I need them Mechanically make the words come out They fight me, vigorous and angry Watch them pounce Ignite me Licking up the flames they bring about   I sold my soul to a three-piece And he told me I was holy He’s got me down on both knees But it’s the devil that's tryna...   Hold me down, hold me down Sneaking out the back door, make no sound Knock me out, knock me out Saying that I want more, this is what I live for Hold me down, hold me down Throw me in the deep end, watch me drown Knock me out, knock me out Saying that I want more, this is what I live for   Selfish Taking what I want, and call it mine I’m helpless Clinging to a little bit of spine They rush me Telling me I’m running out of time They shush me (Shh) Walking me across a fragile line   I sold my soul to a three-piece And he told me I was holy He’s got me down on both knees But it’s the devil that's tryna...   Hold me down, hold me down Sneaking out the back door, make no sound Knock me out, knock me out Saying that I want more, this is what I live for Hold me down, hold me down Throw me in the deep end, watch me drown Knock me out, knock me out Saying that I want more, this is what I live for   Hold me down now Hold me down now Hold me do-o-o-o-own   I sold my soul to a three-piece And he told me I was holy He’s got me down on both knees But it’s the devil that's tryna...   Hold me down, hold me down Sneaking out the back door, make no sound Knock me out, knock me out Saying that I want more, this is what I live for Hold me down, hold me down Throw me in the deep end, watch me drown Knock me out, knock me out Saying that I want more, this is what I live for"
/songs/3069735,Halsey,Hopeless,https://genius.com/Halsey-hopeless-lyrics,http://api.genius.com/songs/3069735,hopeless fountain kingdom,2017-06-02," Boy, you make it look so easy Promise that I'm gonna call you back in five Sorry, baby girl, but I can't tonight, oh Boy, you make it look so simple, mm Yeah, I've known that girl for like my whole life Back in my hotel and I'm alone inside, oh   'Cause you know the truth hurts, but secrets kill Can't help thinkin' that I love it still Still here, there must be something real 'Cause you know the good die young, but so did this And so it must be better than I think it is Gimme those eyes, it's easy to forgive   Oh-oh-oh Oh-ooh Oh-oh-oh Oh-ooh Oh-ooh Oh-ooh Oh-oh-oh-oh Oh-ooh   You and all your friends all hate me, oh Thinkin' that you're better when I'm not around Hear me on the radio and turn it down, oh I can't help the way you made me Hope that she believin' in the truth you found Thinkin' that you want us 'cause I can't find out, oh   'Cause you know the truth hurts, but secrets kill Can't help thinkin' that I love it still Still here, there must be something real 'Cause you know the good die young But so did this, and so it must be better than I think it is Gimme those eyes, it's easy to forgive   Oh-oh-oh Oh-ooh Oh-oh-oh I hope hopeless Oh-ooh Changes over time Oh-ooh I hope hopeless Oh-ooh Changes over time Oh-ooh I hope hopeless Oh-ooh Changes over time"
/songs/534519,Halsey,Hurricane,https://genius.com/Halsey-hurricane-lyrics,http://api.genius.com/songs/534519,BADLANDS (Deluxe Edition),2014-09-24," There's a place way down in Bed Stuy Where a boy lives behind bricks He's got an eye for girls of eighteen And he turns them out like tricks I went down to a place in Bed Stuy A little liquor on my lips I let him climb inside my body And held him captive in my kiss   And there's a storm you're starting now And there's a storm you're starting now And there's a storm you're starting   I'm a wanderess, I'm a one night stand Don't belong to no city, don't belong to no man I'm the violence in the pouring rain I'm a hurricane Ha ah ah, ha ah ah, ahh I'm a hurricane Ha ah ah, ha ah ah, ahh I'm a hurricane   I went down to a place in Brooklyn Where ya tripped on LSD And I found myself reminded To keep you far away from me   And there's a storm you're starting now And there's a storm you're starting now And there's a storm you're starting   I'm a wanderess, I'm a one night stand Don't belong to no city, don't belong to no man I'm the violence in the pouring rain I'm a hurricane Ha ah ah, ha ah ah, ahh I'm a hurricane Ha ah ah, ha ah ah, ahh I'm a hurricane   He says, ""Oh, baby, beggin' you to save me Though lately, I like 'em crazy Oh, maybe, you could devastate me Little lady, come and fade me""   I'm a wanderess, I'm a one night stand Don't belong to no city, don't belong to no man I'm the violence in the pouring rain Come and fade me Come and fade me I'm a hurricane"
/songs/3085298,Halsey,I'm The One (DJ Khaled Cover),https://genius.com/Halsey-im-the-one-dj-khaled-cover-lyrics,http://api.genius.com/songs/3085298,None,2017-05-05," You see, you're lookin' at the truth, the money never lie, no I'm the one, yeah I'm the one Early mornin' in the dawn, know you wanna ride now I'm the one, yeah I'm the one, yeah I know you're sick of all those other imitators Don't let the only real one intimidate ya Know you watchin', don't run outta time now I'm the one, yeah   Oh-eh-oh-eh-oh, eh-oh, I'm the one Oh-eh-oh-eh-oh, eh-oh, the only one Oh-eh-oh-eh-oh, eh-oh, I'm the one Oh-eh-oh-eh-oh, eh-oh   'Cause I'm the one that hit that same spot Sold out arenas but I do it in a tank top, yeah See, 100 got that new drop We makin' records, breakin' records off a laptop Feelin' good when I wake up Listen to Khaled when I'm puttin' on my make up Me and my mans would always fight and then we'd break up So I moved on and put some zeroes on my pay stubs I lost some things, then I found them I got some day ones and I always stick around them This summer droppin' and I know we gon' astound them And plus I went and I put Quavo on the album   You're lookin' at the truth, the money never lie, no I'm the one, yeah I'm the one Early mornin' in the dawn, know you wanna ride now I'm the one, yeah I'm the one, yeah I know you're sick of all those other imitators Don't let the only real one intimidate ya Know you watchin', don't run outta time now I'm the one, yeah   Oh-eh-oh-eh-oh, eh-oh, I'm the one Oh-eh-oh-eh-oh, eh-oh, the only one Oh-eh-oh-eh-oh, eh-oh, I'm the one Oh-eh-oh-eh-oh, eh-oh   Just got myself a baby blue Chanel I used it twice, despite the price, and put it on the shelf And when I roll up in the club, no one can ever tell Stay in the back, so I can grab all on his Gucci belt (ha!) But we don't got no label Don't really want bottles Nothing in my nasal Wanna keep it lowkey Sneak under the table DJ play The Weekend, tell me are you Abel? (okay though) Love, love, love, makin' love still It's been a minute, but he always get it rough, still He callin', ask if we can do it in the tub still And so I pull up (brrrt-brrrt)   You know you're lookin' at the truth, the money never lie, no I'm the one, yeah I'm the one Early mornin' in the dawn, know you wanna ride now I'm the one, yeah I'm the one, yeah I know you're sick of all those other imitators Don't let the only real one intimidate ya Know you watchin', don't run outta time now I'm the one, yeah   Don't you know girl, don't you know girl I am the one for you Don't you know girl, don't you know girl I am the one for you Don't you know girl, don't you know girl I am the one for you Don't you know girl, don't you know girl I am the one for you"
/songs/655510,Halsey,Is There Somewhere,https://genius.com/Halsey-is-there-somewhere-lyrics,http://api.genius.com/songs/655510,Room 93 - EP,2014-10-26," You were dancing in your tube socks in our hotel room Flashing those eyes like highway signs Light one up and hand it over, rest your head upon my shoulder I just wanna feel your lips against my skin   White sheets, bright lights, crooked teeth, and the nightlife You told me this is right where it begins But your lips hang heavy underneath me And I promised myself I wouldn’t let you complete me   I’m trying not to let it show, that I don’t want to let this go Is there somewhere you can meet me? Cause I clutched your arms like stairway railings And you clutched my brain and eased my ailing   You’re writing lines about me, romantic poetry Your girl's got red in her cheeks Cause we’re something she can’t see And I try to refrain but you’re stuck in my brain All I do is cry and complain, because second’s not the same   I’m sorry but I fell in love tonight I didn't mean to fall in love tonight You’re looking like you fell in love tonight Could we pretend that we’re in love? I’m sorry but I fell in love tonight I didn't mean to fall in love tonight You’re looking like you fell in love tonight Could we pretend that we’re in love?"
/songs/2144963,Halsey,I Walk The Line,https://genius.com/Halsey-i-walk-the-line-lyrics,http://api.genius.com/songs/2144963,BADLANDS (Deluxe Edition),2015-08-28," I keep a close watch on this heart of mine I keep my eyes wide open all the time I keep the ends out for the tie that binds Because you're mine, I walk the line   I find it very, very easy to be true I find myself alone when each day is through Yes, I'll admit that I'm a fool for you   Because you're mine, I walk the line Because you're mine, I walk the line   You've got a way to keep me on your side You give me cause for love that I can't hide For you I know I'd even try to turn the tide   Because you're mine, I walk the line Because you're mine, I walk the line Because you're mine, I walk the line   Because you're mine, I walk the line Because you're mine, I walk the line"
/songs/3069723,Halsey,Lie,https://genius.com/Halsey-lie-lyrics,http://api.genius.com/songs/3069723,hopeless fountain kingdom,2017-06-02," Oh   Breakfast is cold, as cold as our bed I'm watching you choke down the words that you said I watch you devour, mistake me for bread Well boy, is you fed? Or are you misled? I gave you the messiest head You give me the messiest head Oh, you're turnin' red 'Cause I'm tryna give the impression that I get the message you wish I was dead   See you 'bouta break a sweat (I, I, I) I won't let us finish yet (I, I, I) Please don't take this as a threat (I, I, I) All I'm sayin' is if you don't love me no more, then   Lie, lie Lie, lie   (Quavo) I heard what you said (What she say?) You talk about your head game (Oh) I know that it's fire flame (Fire) Your mouth make a hurricane (Splash) You notice that we in love (Love) That's something we cannot change (No) It's the plans we should arrange (Plans) Treat her right and she won't complain (Yeah) Bring back the title (Bring it back) She tall like the Eiffel (Yeah) Got no one to lie to (No) There's no need to lie no more (Ayy) Bring me a trial (Bring) Every move's vital (Ooh) What you gon' die for When everything you told lies? Alright   Lie, lie Lie, lie Lie, lie Lie, lie"
/songs/2966401,Halsey,Love Yourself,https://genius.com/Halsey-love-yourself-lyrics,http://api.genius.com/songs/2966401,"triple j's Hottest 100, Vol. 24",2016-02-04," For all the times that you rained on my parade And all the clubs you get in using my name You think you broke my heart, oh girl for goodness sake You think I'm crying on my own, well I ain't   And I didn't wanna write a song 'Cause I didn't want everyone thinking I still care I don't but, you still hit my phone up And baby I'll be movin' on And I think you should be somethin' I don't wanna hold back Maybe you should know that   My mama don't like you and she likes everyone And I never like to admit that I was wrong But I been so caught up in my job, didn't see what's going on And now I know, I'm better sleeping on my own   'Cause if you like the way you look that much Oh baby you should go and fuck yourself And if you think that I'm still holdin' on to somethin' You should go and fuck yourself   And when you told me that you hated my friends The only problem was with you and not them And when you tried to tell me my opinion was wrong Then tried to make me forget where I came from   And I didn't wanna write a song 'Cause I didn't want everyone thinking I still care I don't but, you still hit my phone up And baby I'll be movin' on And I think you should be somethin' I don't wanna hold back Baby you should know that   My mama don't like you and she likes everyone And I never like to admit that I was wrong But I been so caught up in my job, didn't see what's going on And now I know, I'm better sleeping on my own   'Cause if you like the way you look that much Oh baby you should go and fuck yourself And if you think that I'm still holdin' on to somethin' You should go and fuck yourself   For all the times that you made me feel small I fell in love, now I feel nothin' at all I never felt so low and I was vulnerable Was I a fool to let you break down these walls?   'Cause if you like the way you look that much Oh baby you should go and fuck yourself And if you think that I'm still holdin' on to somethin' You should go and fuck yourself 'Cause if you like the way you look that much Oh baby you should go and fuck yourself And if you think that I'm still holdin' on to somethin' You should go and fuck yourself 'Cause if you like the way you look that much Oh baby you should go and fuck yourself And if you think that I'm still holdin' on to somethin' You should go and fuck yourself 'Cause if you like the way you look that much Well baby you should go and fuck yourself"
/songs/733666,Halsey,New Americana,https://genius.com/Halsey-new-americana-lyrics,http://api.genius.com/songs/733666,BADLANDS (Deluxe Edition),2015-07-10," Cigarettes and tiny liquor bottles Just what you’d expect inside her new Balenciaga Viral mess, turned dreams into an empire Self-made success, now she rolls with Roc-A-Fellas   Survival of the richest, the city’s ours until the fall They're Monaco and Hamptons bound But we don’t feel like outsiders at all   We are the new Americana High on legal marijuana (Sky high) Raised on Biggie and Nirvana We are the new Americana   Young James Dean, some say he looks just like his father But he could never love somebody’s daughter Football team loved more than just the game So he vowed to be his husband at the altar   Survival of the richest, the city’s ours until the fall They're Monaco and Hamptons bound But we don’t feel like outsiders at all   We are the new Americana High on legal marijuana (Sky high) Raised on Biggie and Nirvana We are the new Americana   We know very well who we are So we hold it down when summer starts What kind of dough have you been spending? What kind of bubblegum have you been blowing lately?   We are the new Americana High on legal marijuana (Sky high) Raised on Biggie and Nirvana We are the new Americana  We are the new Americana High on legal marijuana (Sky high) Raised on Biggie and Nirvana We are the new Americana"
