api_path,primary_artist,title,url,song_endpoint,album,release_date,lyrics
/songs/4541747,Halsey,Nightmare,https://genius.com/Halsey-nightmare-lyrics,http://api.genius.com/songs/4541747,H3*,2019-05-17," Now I lay me down to sleep I pray the Lord, my soul to keep If I shall die before I 'wake I pray the Lord, my soul to take   I, I keep a record of the wreckage in my life I gotta recognize the weapon in my mind They talk shit, but I love it every time And I realize   I've tasted blood and it is sweet I've had the rug pulled beneath my feet I've trusted lies and trusted men Broke down and put myself back together again Stared in the mirror and punched it to shatters Collected the pieces and picked out a dagger I've pinched my skin in between my two fingers And wished I could cut some parts off with some scissors   ""Come on, little lady, give us a smile"" No, I ain't got nothin' to smile about I got no one to smile for, I waited a while for A moment to say I don't owe you a goddamn thing   I, I keep a record of the wreckage in my life I gotta recognize the weapon in my mind They talk shit, but I love it every time And I realize   I'm no sweet dream, but I'm a hell of a night That I'm no sweet dream, but I'm a hell of a night   No, I won't smile, but I'll show you my teeth And I'ma let you speak if you just let me breathe I've been polite, but won't be caught dead Lettin' a man tell me what I should do in my bed Keep my exes in check in my basement 'Cause kindness is weakness, or worse, you're complacent I could play nice or I could be a bully I'm tired and angry, but somebody should be   ""Come on, little lady, give us a smile"" No, I ain't got nothin' to smile about I got no one to smile for, I waited a while for A moment to say I don't owe you a goddamn thing   I, I keep a record of the wreckage in my life I gotta recognize the weapon in my mind They talk shit, but I love it every time And I realize I, I keep a record of the wreckage in my life I gotta recognize the weapon in my mind They talk shit, but I love it every time And I realize   Someone like me can be a real nightmare, completely aware But I'd rather be a real nightmare, than die unaware, yeah Someone like me can be a real nightmare, completely aware But I'm glad to be a real nightmare, so save me your prayers   I, I keep a record of the wreckage in my life I gotta recognize the weapon in my mind They talk shit, but I love it every time And I realize I, I keep a record of the wreckage in my life I gotta recognize the weapon in my mind They talk shit, but I love it every time And I realize   I'm no sweet dream, but I'm a hell of a night That I'm no sweet dream, but I'm a hell of a night"
/songs/2953972,Halsey,Not Afraid Anymore,https://genius.com/Halsey-not-afraid-anymore-lyrics,http://api.genius.com/songs/2953972,Fifty Shades Darker (Original Motion Picture Soundtrack),2017-01-13," I am not afraid anymore Standing in the eye of the storm Ready to face this, dying to taste this, sick sweet warmth I am not afraid anymore I want what you got in store I'm ready to feed now, get in your seat now   And touch me like you never And push me like you never And touch me like you never 'Cause I am not afraid, I am not afraid anymore No no no   No no no No no no No no no No no no   I am not ashamed anymore I want something so impure You better impress now, watching my dress now fall to the floor Crawling underneath my skin, sweet talk with a hint of sin Begging you to take me Devil underneath your grin, sweet thing, but she play to win, heaven gonna hate me   And touch me like you never And push me like you never And touch me like you never 'Cause I am not afraid, I am not afraid anymore No no no   Crawling underneath my skin, sweet talk with a hint of sin Begging you to take me Devil underneath your grin, sweet thing, but she play to win, heaven gonna hate me   And touch me like you never And push me like you never And touch me like you never 'Cause I am not afraid, I am not afraid anymore No no no"
/songs/1930330,Halsey,Roman Holiday,https://genius.com/Halsey-roman-holiday-lyrics,http://api.genius.com/songs/1930330,BADLANDS (Deluxe Edition),2015-08-28," Do you remember the taste of my lips that night I stole a bit of my mother's perfume? 'Cause I remember when my father put his fist through the wall That separated the dining room And I remember the fear in your eyes The very first time we snuck into the city pool Late December, with my heart in my chest And the clouds of my breath Didn't know where we were running to But don't look back   Oh, we'll be looking for sunlight, or the headlights 'Til our wide eyes burn blind We'll be lacing the same shoes that we've worn through To the bottom of the line And we know that we're headstrong And our heart's gone And the timing's never right But for now let's get away On a Roman holiday   Could you imagine the taste of your lips if we never tried to kiss on the drive to Queens? 'Cause I imagine the weight of your ribs if you lied between my hips in the backseat I imagine the tears in your eyes The very first night I'll sleep without you And when it happens I'll be miles away And a few months late Didn't know where I was running to But I won't look back   Oh, we'll be looking for sunlight, or the headlights 'Til our wide eyes burn blind We'll be lacing the same shoes that we've worn through To the bottom of the line And we know that we're headstrong And our heart's gone And the timing's never right So for now let's get away On a Roman holiday   Feet first, don't fall Or we'll be running again Keep close, stand tall   Oh, we'll be looking for sunlight, or the headlights 'Til our wide eyes burn blind We'll be lacing the same shoes that we've worn through To the bottom of the line And we know that we're headstrong And our heart's gone And the timing's never right But for now let's get away On a Roman holiday"
/songs/4504043,Halsey,Solo (Frank Ocean Cover),https://genius.com/Halsey-solo-frank-ocean-cover-lyrics,http://api.genius.com/songs/4504043,None,2019-04-24,"One, two, one, two, three...   Hand me a towel, I'm dirty dancing by myself Gone off tabs of that acid Form me a circle, watch my Jagger Might lose my jacket and hit a solo, one time We too loud in public, them police turned down the function Now we outside and the timing's perfect Forgot to tell you, gotta tell you how much I vibe with you And we don't gotta be solo Now stay away from highways My eyes like them red lights Right now I prefer yellow Redbone, so mellow Fuck around, be cutting you Think we were better off solo I got that act right in the Windy City that night No trees to blow through but blow me and I owe you Two grams when the sun rise Smoking good, rolling solo Solo, solo, solo Solo, solo, solo   It's hell on Earth and the city's on fire Inhale, in hell there's heaven There's a bull and a matador dueling in the sky Inhale, in hell there's heaven (Oh, oh, oh, oh Oh, oh, oh, oh) Solo, solo, solo   I'm skipping showers and switching socks, sleeping good and long Bones feeling dense as fuck, wish somebody would cross And catch a solo, on time White leaf on my boxers, green leaf turn to vapors for the low And that mean cheap, 'cause ain't shit free and I know it Even love ain't, 'cause this nut cost, that clinic killed my soul But you gotta hit the pussy raw though Now your baby momma ain't so vicious All she want is her picket fence And you protest and you picket sign But them courts won't side with you Won't let you fly solo I wanted that act right in Colorado that night I brought trees to blow through, but it's just me and no you Stayed up 'til my phone died, smoking big, rolling solo   It's hell on Earth and the city's on fire Inhale, in hell there's heaven There's a bull and a matador dueling in the sky Inhale, in hell there's heaven (Oh, oh, oh, oh Oh, oh, oh, oh, yeah) Solo, solo, solo, solo"
/songs/3069716,Halsey,Sorry,https://genius.com/Halsey-sorry-lyrics,http://api.genius.com/songs/3069716,hopeless fountain kingdom,2017-06-02, I've missed your calls for months it seems Don't realize how mean I can be 'Cause I can sometimes treat the people That I love like jewelry 'Cause I can change my mind each day I didn't mean to try you on But I still know your birthday And your mother's favorite song   So I'm sorry to my unknown lover Sorry that I can't believe That anybody ever really Starts to fall in love with me Sorry to my unknown lover Sorry I could be so blind Didn't mean to leave you And all of the things that we had behind   I run away when things are good And never really understood The way you laid your eyes on me In ways that no one ever could And so it seems I broke your heart My ignorance has struck again I failed to see it from the start And tore you open 'til the end   And I'm sorry to my unknown lover Sorry that I can't believe That anybody ever really Starts to fall in love with me Sorry to my unknown lover Sorry I could be so blind Didn't mean to leave you And all of the things that we had behind   And someone will love you Someone will love you Someone will love you But someone isn't me Someone will love you Someone will love you Someone will love you But someone isn't me   Sorry to my unknown lover Sorry that I can't believe That anybody ever really Starts to fall in love with me Sorry to my unknown lover Sorry I could be so blind Didn't mean to leave you And all of the things that we had behind   And someone will love you Someone will love you Someone will love you But someone isn't me And someone will love you Someone will love you Someone will love you But someone isn't me
/songs/2288681,Halsey,Strange Love,https://genius.com/Halsey-strange-love-lyrics,http://api.genius.com/songs/2288681,BADLANDS (Deluxe Edition),2015-08-28," Everybody wants to know If we fucked on the bathroom sink How your hands felt in my hair If we were high on amphetamines  And everybody wants to hear How we chain-smoked until three And how you laughed when you said my name And how you gripped my hips so mean   We wrote a story in the fog on the windows that night But the ending is the same every damn time, no, no, no We wrote a story in the fog on the windows that night But the ending is the same every damn time   They think I'm insane, they think my lover is strange But I don't have to fucking tell them anything, anything And I'm gonna write it all down, and I'm gonna sing it on stage But I don't have to fucking tell you anything, anything   That's the beauty of a secret You know you're supposed to keep it That's the beauty of a secret Oh, wa-oh, wa-oh, wa-oh, wa-oh That's the beauty of a secret You know you're supposed to keep it But I don't have to fucking tell you anything, anything   Everybody's waiting up to hear if I dare speak your name Put it deep beneath the track, like the hole you left in me And everybody wants to know 'bout how it felt to hear you scream They know you walk like you're a God, they can't believe I made you weak   We wrote a story in the fog on the windows that night But the ending is the same every damn time, no, no, no We wrote a story in the fog on the windows that night But the ending is the same every damn time   They think I'm insane, they think my lover is strange But I don't have to fucking tell them anything, anything And I'm gonna write it all down, and I'm gonna sing it on stage But I don't have to fucking tell you anything, anything   That's the beauty of a secret You know you're supposed to keep it That's the beauty of a secret Oh, wa-oh, wa-oh, wa-oh, wa-oh That's the beauty of a secret You know you're supposed to keep it But I don't have to fucking tell you anything, anything   These days I can't seem to get along with anyone Get by with anyone These days I can't seem to make this right Well, is this fine? Will it be alright?   They think I'm insane, they think my lover is strange But I don't have to fucking tell them anything, anything And I'm gonna write it all down, and I'm gonna sing it on stage But I don't have to fucking tell you anything, anything   That's the beauty of a secret You know you're supposed to keep it That's the beauty of a secret Oh, wa-oh, wa-oh, wa-oh, wa-oh That's the beauty of a secret You know you're supposed to keep it But I don't have to fucking tell you anything, anything"
/songs/3069705,Halsey,Strangers,https://genius.com/Halsey-strangers-lyrics,http://api.genius.com/songs/3069705,hopeless fountain kingdom,2017-05-26," She doesn't kiss me on the mouth anymore 'Cause it's more intimate, than she thinks we should get She doesn't look me in the eyes anymore Too scared of what she'll see, somebody holding me   When I wake up all alone And I'm thinking of your skin I remember, I remember what you told me  [Chorus 1: Halsey & Lauren Jauregui] Said that we're not lovers, we're just strangers With the same damn hunger To be touched, to be loved, to feel anything at all We're not lovers, we're just strangers With the same damn hunger To be touched, to be loved, to feel anything at all   She doesn't call me on the phone anymore She's never listening, she says it's innocent She doesn't let me have control anymore I must've crossed a line, I must've lost my mind   When I wake up all alone And I'm thinking of your skin I remember, I remember what you told me  [Chorus 1: Halsey & Lauren Jauregui] Said that we're not lovers, we're just strangers With the same damn hunger To be touched, to be loved, to feel anything at all We're not lovers, we're just strangers With the same damn hunger To be touched, to be loved, to feel anything at all  [Bridge: Halsey, Lauren Jauregui & both] I miss the mornings with you laying in my bed I miss the memories replaying in my head I miss the thought of a forever, you and me But all you're missing is my body, oh  [Chorus 2: Halsey, Lauren Jauregui & both] Said we're not lovers (we're not lovers) 'Cause we're just strangers With the same damn hunger To be touched, to be loved, to feel anything at all We're not lovers, we're just strangers With the same damn hunger To be touched, to be loved, to feel anything at all (anything)   To feel anything at all To feel anything at all (You lost it) (You lost it) (You lost it)"
/songs/3110560,Halsey,Strangers (Stripped),https://genius.com/Halsey-strangers-stripped-lyrics,http://api.genius.com/songs/3110560,None,2017-06-02," She doesn't kiss me on the mouth anymore 'Cause it's more intimate, than she thinks we should get She doesn't look me in the eyes anymore Too scared of what she'll see, somebody holding me   When I wake up all alone And I'm thinking of your skin I remember, I remember what you told me   Said that we're not lovers, we're just strangers With the same damn hunger To be touched, to be loved, to feel anything at all We're not lovers, we're just strangers With the same damn hunger To be touched, to be loved, to feel anything at all   She doesn't call me on the phone anymore She's never listening, she says it's innocent She doesn't let me have control anymore I must've crossed a line, I must've lost my mind   When I wake up all alone And I'm thinking of your skin I remember, I remember what you told me   Said that we're not lovers, we're just strangers With the same damn hunger To be touched, to be loved, to feel anything at all We're not lovers, we're just strangers With the same damn hunger To be touched, to be loved, to feel anything at all   I miss the mornings with you laying in my bed I miss the memories replaying in my head I miss the thought of a forever, you and me But all you're missing is my body, oh   'Cause we're just strangers With the same damn hunger To be touched, to be loved, to feel anything at all We're not lovers, we're just strangers With the same damn hunger To be touched, to be loved, to feel anything at all (anything)   To feel anything at all To feel anything at all"
/songs/3069708,Halsey,The Prologue,https://genius.com/Halsey-the-prologue-lyrics,http://api.genius.com/songs/3069708,hopeless fountain kingdom,2017-06-02," Two households, both alike in dignity In fair Verona, where we lay our scene From ancient grudge break to new mutiny Where civil blood makes civil hands unclean From forth the fatal loins of these two foes A pair of star-cross'd lovers take their life; Whose misadventured piteous overthrows Do with their death bury their parents' strife The fearful passage of their death-mark'd love And the continuance of their parents' rage Which, but their children's end, nought could remove Is now the two hours' traffic of our stage; The which if you with patient ears attend What here shall miss, our toil shall strive to mend   I am a child of a Money hungry, prideful country Grass is green and it's always sunny Hands so bloody, tastes like honey I'm finding it hard to leave I am a child of a Money hungry, prideful country Grass is green and it's always sunny Hands so bloody, tastes like honey I'm finding it hard to leave"
/songs/2430292,Halsey,The Sound (The 1975 Cover),https://genius.com/Halsey-the-sound-the-1975-cover-lyrics,http://api.genius.com/songs/2430292,None,2016-02-25," Yeah, I know when you're around Cause I know the sound, I know the sound of your heart Yeah, I know when you're around Cause I know the sound, I know the sound of your heart   Can't believe you forgot my name Oh babe, I made you cum again He said, ""I've got a problem with your shoes And your tunes, but I might move in And I thought that you were straight, now I'm wonderin'""  Oh and you say I'm such a cliche I can't see the difference in it anyway And we left things to protect my mental health But I'll call you when you're bored or you're playing with yourself   You're so conceited, I said ""I don't love you"" What does it matter if I lie to you? I don't regret it, but I'm glad that we're through So don't you tell me that you just don't get it Cause I know you do   Know when you're around Cause I know the sound, I know the sound of your heart Yeah, I know when you're around Cause I know the sound, I know the sound of your heart   It's not about reciprocation, it's just all about me I'm sympathetic, poetic, dramatic, but I wanna be And there's so much skin to see A simple Epicurean philosophy   You're so conceited, you said you don't love me What does it matter if you lie to me? And I don't regret it, but I still can't sleep So don't you tell me that you're sorry Cause I know you did it purposely   Know when you're around Cause I know the sound, I know the sound of your heart Yeah, I know when you're around Cause I know the sound, I know the sound of your heart   And I feel your heart beat to the beat of the drums Oh what a shame that you came here with someone So while you're here in my arms Let's make the most of the night like we're gonna die young We're gonna die young  I feel your heartbeat Cause I know the sound, I know the sound of your heart I feel your heartbeat Cause I know the sound, I know the sound of your heart   Yeah, I know when you're around Cause I know the sound, I know the sound Yeah, I know when you're around Cause I know the sound, I know the sound"
/songs/598240,Halsey,Trouble (Stripped),https://genius.com/Halsey-trouble-stripped-lyrics,http://api.genius.com/songs/598240,Room 93 - EP,2014-10-26," Would you bleed for me? Lick it off my lips like you needed me? Would you sit me on a couch with your fingers in my mouth? You look so cool when you're reading me   Let's cause a little trouble Oh, you make me feel so weak I bet you kiss your knuckles Right before they touch my cheek   But I've got my mind made up this time 'Cause there's a menace in my bed Can you see his silhouette? Can you see his silhouette? Can you see his silhouette? And I've got my mind made up this time Go on and light a cigarette Set a fire in my head Set a fire in my head tonight   Would you lie for me? Cross your sorry heart and hope to die for me? Would you pin me to a wall? Would you beg or would you crawl? Stick a needle in your hungry eyes for me?   Let's cause a little trouble Oh, you make me feel so weak I bet you kiss your knuckles Right before they touch my cheek   But I've got my mind made up this time 'Cause there's a menace in my bed Can you see his silhouette? Can you see his silhouette? Can you see his silhouette? And I've got my mind made up this time Go on and light a cigarette Set a fire in my head Set a fire in my head tonight   Don't forget me, don't forget me I wouldn't leave you if you'd let me When you met me, when you met me You told me you were gonna get me Don't forget me, don't forget me I wouldn't leave you if you'd   And I've got my mind made up this time 'Cause there's a menace in my bed Can you see his silhouette? Can you see his silhouette? Can you see his silhouette? And I've got my mind made up this time Go on and light a cigarette Set a fire in my head Set a fire in my head tonight, tonight, tonight   Set a fire in my head tonight"
/songs/3069724,Halsey,Walls Could Talk,https://genius.com/Halsey-walls-could-talk-lyrics,http://api.genius.com/songs/3069724,hopeless fountain kingdom,2017-06-02," Been about three days and I'm comin' back I'm about four minutes from a heart attack And I think you make me a maniac But you don't know, oh Two years and we in between But we both been here since we seventeen Here we go, fist fight in a limousine But they don't know   And we both hope there's something But we bo-both keep fronting And it's a closed discussion And I'm thinking, ""Damn, if these walls could talk""   (Oh-oh-oh) Well, they'd be like (Oh-oh-oh) ""Shit is crazy, right?"" (Oh-oh-oh) ""That ain't your baby no more""   Been about two weeks since you went away I'm about halfway through a Cabernet There I go, I'm wastin' a Saturday, sittin' at ho-home Told my new roommate not to let you in But you're so damn good with a bobby pin Now you gon' play me like a violin, hittin' these notes   And we both hope there's something But we bo-both keep fronting And it's a closed discussion And I'm thinking, ""Damn, if these walls could talk""   (Oh-oh-oh) Well, they'd be like (Oh-oh-oh) ""Shit is crazy, right?"" (Oh-oh-oh) ""That ain't your baby no more"" (Oh-oh-oh) Hey (Oh-oh-oh) No more (Oh-oh-oh) ""That ain't your baby no more"""
/songs/2404405,Halsey,Wasting Time,https://genius.com/Halsey-wasting-time-lyrics,http://api.genius.com/songs/2404405,None,2019-04-24," Wasting time, lost in love We can go when no one will ever find us So let's waste time While we're young We can drive til the morning sun comes up   We've got no place to go But we can make it all on our own We're drivin' slowly, down a country road We can keep on through the night If I got you by my side I see the stars reflecting in your eyes   Think we got something special Living life like we are rebels You know we've got potential   Wasting time, lost in love We can go when no one will ever find us So let's waste time While we're young We can drive til the morning sun comes up   If the road gets tough Being with you is enough We're singing all the songs we used to love We've got nothing to lose And we're out with something new But it all feels like home when I'm with you   Think we got something special Living life like we are rebels You know we've got potential   Wasting time, lost in love We can go when no one will ever find us So let's waste time While we're young We can drive til the morning sun comes up"
/songs/2862253,Halsey,What Do You Mean / Often / Young God,https://genius.com/Halsey-what-do-you-mean-often-young-god-lyrics,http://api.genius.com/songs/2862253,None,2015-09-01," You're so indecisive, what I'm saying Tryna catch the beat, make up your heart Don't know if you're happy or complaining Don't want for us to end where do I start   First you wanna go to the left then you wanna turn right You wanna argue all day, makin' love all night First you're up them you're down then you're between Oh I really wanna know what do you mean When you nod your head yes but you wanna say no What do you mean When you don't want me to move but you tell me to go What do you-   Asked me if I do this everyday I said often Asked how many times she rode the wave Not so often She down to do it either way Often Baby I can make that, make that rain Often Often Often Girl I do this often Make that, make that poppin' Do it how I want it Often Often Girl I do this often Make that, make that poppin' Do it how I want it   But you're overprotective when I'm leavin' Tryna compromise but I can't win You wanna make a point but you keep preachin' You had me from the start, won't let this end   First you wanna go to the left then you wanna turn right You wanna argue all day makin' love all night First you're up them you're down then you’re between Oh I really wanna know what do you mean When you nod your head yes but you wanna say no What do you mean When you don't want me to move but you tell me to go What do you mean   In my city I'm a young god, that kill be so vicious My god white he be my pocket He got me redder than the devil till I go nauseous Asked me if I do this everyday I said often Asked how many times she rode the wave Not so often She down to do it either way Often Baby I can make that, make that rain Often   In my city I'm a young god-god-god-god But do you feel like a young god, you know the two of us are just young gods And we'll be flying through the street with the people underneath and they're runnin' runnin' runnin' But do you feel like a young god, you know the two of us are just young gods And we'll be flying through the street with the people underneath and they're runnin' runnin' runnin'   What do you mean What do you mean Said we're runnin' out if time What do you mean, oh oh oh What do you mean Better make up your mind What do you mean  And we'll be runnin' runnin' runnin' Again Runnin' out of time And we'll be runnin' runnin' runnin' again..."
