api_path,primary_artist,title,url,song_endpoint,album,release_date,lyrics
/songs/2280221,James Bay,Incomplete,https://genius.com/James-bay-incomplete-lyrics,http://api.genius.com/songs/2280221,Chaos and the Calm,2015-03-23," I breathe in slow to compose myself But the bleeding heart I left on the shelf Started speeding round, beating half to death Cause you're here and you're all mine  So I press my lips down into your neck And I stay there and I reconnect Bravery I've been trying to be perfect It can wait for a while   Scared of hope in my head It's been making me sweat but it turns out You're here with your head on my chest I should've guessed   The world will turn and we'll grow We'll learn how to be To be incomplete   I breathe out now and we fall back in Just like before we can re-begin Let your lungs push slow up against my skin Let it all feel just fine   Gone is the emptiness We just take what's best and we move on All that the hurt gets left I should've guessed   That the world will turn and we'll grow We'll learn how to be To be incomplete This here now, it's where we touch down You and me let's be incomplete   How'd we go without I don't know it's look like we've made it again Tell me you'll never look down, down And the world will turn and we'll grow We'll learn how to be To be incom...  I don't wanna look down I don't want us to break up in the cloud All I want is to stay us, to stay with you now I don't wanna look down I don't want us to break up in the clouds All I want is to stay us, to stay with you now   And the world will turn and we'll grow We'll learn how to be To be incomplete And this here now it's where we touch down You and me let's be incomplete"
/songs/3446631,James Bay,In My Head,https://genius.com/James-bay-in-my-head-lyrics,http://api.genius.com/songs/3446631,Electric Light,2018-05-18," I'm gonna get you in my head, in my head, in my head I'm gonna get you in my head 'til I can't forget   I'm fed up with this profile I don't sleep, I'm obsessed I get worn out by my words 'Cause they sounded so good in my head   I'm confused and I'm lonely So is everyone else Where are you in this ocean Of static and nothing much else?   I swear I got somethin' worth heart I know you could find it   Say that you can see me, I'll speak up I swear But I need a second light Now that you exist, I'm in your atmosphere I'm going out my mind   I'm gonna get you in my head, in my head, in my head I'm gonna get you in my head 'til I can't forget   I feel so lost in this city In all its traffic and tricks As if we didn't have enough Of our own problems to fix   And now we're lost and lonely I'll be lost 'til you want me Take me home, take me home, take me home I'll go   Say that you can see me, I'll speak up I swear But I need a second light Now that you exist, I'm in your atmosphere I'm going out my mind   I'm gonna get you in my head whether I like it or not I'm gonna get you in my head 'til I can't forget I'm gonna get you in my head, in my head, in my head I'm gonna get you in my head 'til I can't forget   I swear I got somethin' worth heart I know you could find it   Say that you can see me, I'll speak up I swear But I need a second light Now that you exist, I'm in your atmosphere I'm going out my mind   I'm gonna get you in my head, in my head, in my head I'm gonna get you in my head 'til I can't forget I'm gonna get you in my head, in my head, in my head I'm gonna get you in my head 'til I can't forget I'm gonna get you in my head, in my head, in my head I'm gonna get you in my head 'til I can't forget I'm gonna get you in my head, in my head, in my head I'm gonna get you in my head 'til I can't forget"
/songs/3568471,James Bay,Intro,https://genius.com/James-bay-intro-lyrics,http://api.genius.com/songs/3568471,Electric Light,2018-05-18," Sorry ma'am, excuse me, excuse me Hey! Hey What's up? Uh, nothing Really? OK, what's going on in your head? You're like, being weird I don't... I don't know how I... I feel about... this... us Is it me or you? No, it isn't you. Um, you should go No. Come on, let's go back"
/songs/3568473,James Bay,Just For Tonight,https://genius.com/James-bay-just-for-tonight-lyrics,http://api.genius.com/songs/3568473,Electric Light,2018-05-18," Waking up in the middle of the night Blurry eyes into my telephone light All your words in disguise Makin' me think like you're mine   We were such a pretty picture in a frame Now it's like you don't remember my name Let me in, where you've been? What we gonna be this time?   Just for tonight, just for tonight Forget who we are, give up and ignite Go with me through the dark For tonight   What you mean when you say you're better now? All these clothes like you still want me around I can't give you this for nothing, help me out   Just for tonight, just for tonight Forget who we are, give up and ignite Go with me through the dark For tonight Just for tonight, just for tonight Forget who we are, give up and ignite Go with me through the dark For tonight   Make me believe that you need me most Be the real thing, don't be just a ghost I try to call but I can't get ahold Call me right back, call me right back You told me no matter, everywhere we go I was your rock, was it just a joke? If I come-a-lookin' would you even know? Call me right back, call me right back Make me believe that you need me most Be the real thing, don't be just a ghost I try to call but I can't get ahold Call me right back, call me right back   Just for tonight, just for tonight Forget who we are, give up and ignite Go with me through the dark For tonight Just for tonight, just for tonight Forget who we are, give up and ignite Go with me through the dark For tonight Just for tonight Just for tonight Just for tonight Just for tonight   You told me no matter, everywhere we go I was your rock, was it just a joke? If I come-a-lookin' would you even know? Call me right back, just for tonight Call me right back, just for tonight Be the real thing, don't be just a ghost Why can I call but I can't get hope? Call me right back, call me right back"
/songs/3123789,James Bay,Kings Highway,https://genius.com/James-bay-kings-highway-lyrics,http://api.genius.com/songs/3123789,Cars 3 (Original Motion Picture Soundtrack),2017-06-16,"When the time gets right I'm gonna pick you up And take you far way From trouble my love Under a big ol' sky Out in a field of green There's gotta be something left for us to believe  Oh, I await the day Good fortune comes our way And we ride down the kings highway  No you can't hide out In a six gun town We wanna hold our heads up But we gotta stay down I don't wanna end up In a room all alone Don't wanna end up someone That I don't even know  Lover, I await the day Good fortune comes our way And we ride down the Kings Highway"
/songs/3925593,James Bay,Loveless Life,https://genius.com/James-bay-loveless-life-lyrics,http://api.genius.com/songs/3925593,None,2015-03-23," Just a number, another one I stand And you wonder, why you feel so sad? Something missing, you're an empty man Maybe it's time that you move on I'm so tired, superficial things Your lips are moving, but it don't mean anything Who'd you think you're fooling? Lying to yourself in this material world   I'm holding up for something real Oh, yeah   How can we live lonely? (low, low, low) How can we live when no one cares? (low, low, low) 'Cause it's a loveless life (it's a loveless life) It's a loveless life (it's a loveless life) And I'd rather die (and I'd rather die) When live in a loveless life (a loveless life) Hmm, and never be   Say you're lonely, but you're never unlone Fake conversations, just to get her home All these broken pieces, they won't make you hold And fire to your soul We can make it on our own   How can we live lonely? (low, low, low) How can we live when no one cares? (low, low, low) 'Cause it's a loveless life (it's a loveless life) It's a loveless life (it's a loveless life) And I'd rather die (and I'd rather die) When live in a loveless life (a loveless life) How can we live? (Low, low, low) Never gonna live a loveless life (low, low, low) It's a loveless life (low, low, low) And I'd rather die (low, low, low) How can we live? (Low, low, low)   Never, never, never Never gonna live a loveless life Never gonna, never, never Never gonna live a loveless life   How can we live lonely? (low, low, low) How can we live when no one cares? (low, low, low) 'Cause it's a loveless life (it's a loveless life) It's a loveless life (it's a loveless life) And I'd rather die (and I'd rather die) When live in a loveless life (a loveless life) How can we live? (Low, low, low) How can we live? (Low, low, low) How can we live? (Low, low, low) And I'd rather die (low, low, low) It's a loveless life (it's a loveless life) And I'd rather die (and I'd rather die) When live in a loveless life (a loveless life) How can we live? (Low, low, low)"
/songs/2256067,James Bay,Move Together,https://genius.com/James-bay-move-together-lyrics,http://api.genius.com/songs/2256067,Chaos and the Calm,2013-07-18," Home now, end of the night It's colder to turn on your side And I know you're up in two hours But we didn't get tonight We don't have tomorrow So don't ruin now   How we gonna move together? Just come closer If we don't move together, just come closer How we gonna breathe? How we gonna be together? Just keeping the peace Between the sheets   And I creep in, and everything's loud I'm sorry, I've woken you now And we'll argue the tiniest thing But we didn't get tonight We don't have tomorrow So I'm done whispering, done whispering   How we gonna move together? Just come closer If we don't move together, just come closer How we gonna breathe? How we gonna be together? Just keeping the peace Between the sheets   So maybe don't give me cold, cold shoulder Before you go, turn around, let me hold you And let me stay in the dark of the morning Just more one thing   How we gonna move together? Just come closer If we don't move together, come closer How we gonna breathe? How we gonna be together? Just keeping the peace, just keeping the peace Just keeping the peace Between these sheets"
/songs/730318,James Bay,Need the Sun to Break,https://genius.com/James-bay-need-the-sun-to-break-lyrics,http://api.genius.com/songs/730318,Chaos and the Calm,2014-03-12," I'm halfway gone Sleepless, I'm battle worn And you're all I want So bring me the dawn   I need the sun to break You've woken up my heart I'm shaking, oh My luck could change Been in the dark for weeks and I've realized you're all I need I hope that I'm not too late I hope I'm not too late   Back of the room How come my friends already know you? I feel like a kid Too shy to speak up so I keep it hid Oh, butterflies You steal my sleep each night   I need the sun to break You've woken up my heart I'm shaking, oh My luck could change Been in the dark for weeks and I've realized you're all I need I hope that I'm not too late I hope I'm not too late I need the sun to break You've woken up my heart I'm shaking, oh My luck could change Been in the dark for weeks and I've realized you're all I need I hope that I'm not too late I hope I'm not too late"
/songs/4325026,James Bay,Peer Pressure,https://genius.com/James-bay-peer-pressure-lyrics,http://api.genius.com/songs/4325026,Oh My Messy Mind - EP,2019-02-22," Seven texts, 2AM Halfway dressed, they're all saying, ""Call me up"" You can’t sleep, you're testing me Bad but sweet and I'm just tryna keep it together, oh And now you’re sayin'...   Put your hands on my body just like you think you know me Want your heart beating on me, don't leave me hot and lonely I don't usually give in to peer pressure But I'll give in to yours  [Verse 2: James Bay, James Bay & Julia Michaels] When we met, innocent Now I'm dead every time you're touchin' me You’re dancing around on my mind every second I’m under control till you're in front of me Maybe I’m scared, I don't care, I'm addicted I'm in it And you say...  [Chorus: James Bay & Julia Michaels, James Bay] Put your hands on my body just like you think you know me Want your heart beating on me, don’t leave me hot and lonely I don't usually give in to peer pressure But I'll give in to yours So I give you my everything and you keep on teasing With that look in your eyes 'cause you know I believe it I don't usually give in to peer pressure But I'll give in to yours  [Post-Chorus: James Bay & Julia Michaels] Ooh-ooh-ooh, ooh-ooh-ooh Oh, I'll give in to yours Ooh-ooh-ooh, ooh-ooh-ooh   When we met, innocent Now I'm dead and you're sayin'...   Put your hands on my body just like you think you know me Want your heart beating on me, don't leave me hot and lonely I don't usually give in to peer pressure But I'll give in to yours So I give you my everything and you keep on teasing With that look in your eyes 'cause you know I believe it I don't usually give in to peer pressure Oh, but I'll give in to yours  [Post-Chorus: James Bay & Julia Michaels] Ooh-ooh-ooh, ooh-ooh-ooh Mmm, yeah, I'll give in to yours Ooh-ooh-ooh, ooh-ooh-ooh Oh, oh   You're dancing around on my mind every second I'm under control till you're in front of me Maybe I'm scared, I don't care, I'm addicted I'm in it"
/songs/3446628,James Bay,Pink Lemonade,https://genius.com/James-bay-pink-lemonade-lyrics,http://api.genius.com/songs/3446628,Electric Light,2018-03-07," Don't fall into my arms Don't ask me to repeat it Don't suffocate my heart I don't know what I'm feeling   ""Do you wanna talk? Do you wanna talk it through?"" Swear I ain't got anything on my mind I don't wanna talk to you Don't ask me ""Do you wanna talk? Do you wanna talk it through?"" Swear I ain't got anything on my mind I don't wanna talk to you   Don't fall into my arms I'll only disappoint you, I'll let you down Don't go soundin' the alarms When all I do is want you   So don't ask me ""Do you wanna talk? Do you wanna talk it through?"" Swear I ain't got anything on my mind I don't wanna talk to you Don't ask me ""Do you wanna talk? Do you wanna talk it through?"" Swear I ain't got anything on my mind I don't wanna talk to you   Let me wake up heavy head Lying in my bed with you naked Go put that song on, that you love On repeat, until we can't take it I wanna drink pink lemonade Watching movie trailers 'til it's late And let's remember all the words That we think are gonna make our hearts break   Don't ask me ""Do you wanna talk? Do you wanna talk it through?"" Swear I ain't got anything on my mind I don't wanna talk to you Don't ask me ""Do you wanna talk? Do you wanna talk it through?"" Swear I ain't got anything on my mind I don't wanna talk to you   Thinking of you Thinking of you I'm just thinking of you Thinking of you  Thinking of you Thinking of you I'm just thinking of you Thinking of you  I'm protecting you, I'm protecting you I'm protecting you to what I don't wanna have to say I'm protecting you, I'm protecting you I'm protecting us 'cause I don't wanna walk away  You Thinking of you I'm just thinking of you Thinking of you"
/songs/4540296,James Bay,Rescue,https://genius.com/James-bay-rescue-lyrics,http://api.genius.com/songs/4540296,Oh My Messy Mind - EP,2019-05-10," I found you all alone I came to warm your bones There were twenty million tears in your hands You found me in the dark You came to heal my scars I was slipping, sinking through the sand   They say the more you love, the harder you fall But I would rather hurt than nothing at all Through the good, through the bad Through the lonely I always rescue you You always rescue me   We never draw the line But only 'cause you're mine Only 'cause you promise me I'm yours You made me fall apart My sewn together heart Is better when you're walking through the door You know you keep me alive, oh   They say the more you love, the harder you fall But I would rather hurt than nothing at all Through the good, through the bad Through the lonely I always rescue you You always rescue me   I rescue you And you rescue me   I shelter you, you guide me I lose myself, you find me I shelter you, you guide me I shelter you   They say the more you love, the harder you fall But I would rather hurt than nothing at all Through the good, through the bad Through the lonely I always rescue you You always rescue me   I always rescue you I rescue you You always rescue me You rescue me I always rescue you I rescue you Oh, I always rescue you You always rescue me"
/songs/2292544,James Bay,Running,https://genius.com/James-bay-running-lyrics,http://api.genius.com/songs/2292544,Chaos and the Calm,2014-09-15," When my heart is ready to burst When the world spins in reverse I'll keep running To the place where I belong   When you go to turn down the light And no one's there to hold you in the night I'll keep running To the place where I belong   When you think you're on your own I'm still coming home   When our picture fades in the Sun And all the colors blur into one I'll keep running To the place where I belong   When you think you're on your own I'm still coming home   When your hope gets blinded When you fold with the cards No, I'll never stop fighting To get to where you are   Wherever we go Wherever we go Wherever we go Wherever we go Wherever we go Wherever we go   When the lights are faded to black And only stars are guiding me back I'll keep running To the place I belong   When you think you're on your own I'm still coming home When you think you're on your own I'm still coming home"
/songs/1786681,James Bay,Scars,https://genius.com/James-bay-scars-lyrics,http://api.genius.com/songs/1786681,Chaos and the Calm,2015-01-08," You're setting off It's time to go, the engine's running My mind is lost We always knew this day was coming And now it's more frightening than it's ever gonna be  We grow apart I watch you on the red horizon Your lion's heart Will protect you under stormy skies And I will always be listening for your laughter and your tears   And as soon as I can hold you once again I won't let go of you, I swear   We live through scars this time But I've made up my mind We can't leave us behind anymore   Your hands are cold Your lips are turning blue, you're shaking This fragile heart So heavy in my chest, it's breaking And in the dark, you try to make a pay phone call to me  But you're miles away You're breaking up, you're on your own It's hard to take I need an hour just to say hello And I can't make the truth of this work out for you or me   And for all the pennies in your pocket We barely get a second just to speak   We live through scars this time But I've made up my mind We can't leave us behind anymore We'll have to hurt for now But next time there's no doubt Cause I can't go without you anymore  Oh, no Oh, oh, oh, oh Oh, no, oh We get hurt   We live through scars this time But I've made up my mind No, we can't leave us behind anymore We'll have to hurt for now But next time, there's no doubt Cause I can't go without you anymore No, I can't go without you anymore"
/songs/3568478,James Bay,Slide,https://genius.com/James-bay-slide-lyrics,http://api.genius.com/songs/3568478,Electric Light,2018-05-18," From the hot strobe lights and the spiked punch bliss And the long walks home in the dark we'll miss Nobody teaches you how to reminisce Nobody teaches you to hurt like this   Then we slide into the arms of someone else Yeah, we slide into the arms of someone else   No more coked up, broke, nocturnal kids Was that ever even us? Do we know what we missed? Nobody teaches you how to win big Nobody said there's no reverse on this   Then we slide into the arms of someone else Yeah, we slide into the arms of someone else In disguise, we get a little better at controlling ourselves around midnight Then we slide into the arms of someone else   Nobody wants to, nobody wants to Nobody wants to, nobody wants to Nobody wants to wake up alone   Then we slide into the arms of someone else Then we slide into the arms of someone else In disguise, we get a little better at controlling ourselves around midnight But then we slide into the arms of some, someone else   The weight of the world is love Under the burden of solitude, under the burden of dissatisfaction the weight, the weight we carry is love And so must rest in the arms of love at last, must rest in the arms of love"
/songs/2272363,James Bay,Sparks,https://genius.com/James-bay-sparks-lyrics,http://api.genius.com/songs/2272363,Hold Back The River,2014-11-07," If I told you about my favorite dream The one without you Would you spit fire at me Or would you burn to know Every single by blow?  I don't know her Maybe she isn't real She didn't hold back When you were lying next to me This can't be all we are Silent and in the dark   We could be making sparks But we don't ignite, don't ignite We could be making sparks But we need to fight, need to fight   Come a little closer Remember when we used to sway Trembling in the covers Taking it with an only grey This can't be all we are Silent and in the dark   We could be making sparks But we don't ignite, don't ignite We could be making sparks But we need to fight, need to fight   No, I never saw the walls falling on us like this Now I'm hanging from a rope holding my hope, my hope I don't need it, I just want it more than anything else I can't do this alone, no, no   We could be making sparks But we don't ignite, don't ignite We could be making sparks But we don't ignite, don't ignite We could be making sparks But we need to fight, need to fight"
/songs/3568476,James Bay,Stand Up,https://genius.com/James-bay-stand-up-lyrics,http://api.genius.com/songs/3568476,Electric Light,2018-05-18," We were kids Lookin' out into nothin' Lookin' for a way to get around at night We were kids Holdin' out for a dream We were born to be wild and free Or sit alone online   But I don't wanna wait Sit the other side of these flood lights Dreaming up a way to escape Anyone around? Get me mission control, give me a sound on the radio   Stand up and be counted Before we slip away out here Before we slip away, slip away Don't ever doubt it Even if we're surrounded Don't wanna slip away, slip away   Slip away (slip) Slip away (slip)   We were Kings We were Queens of an empire We were made out on these streets We were all desire   So, if we're gonna break If we're gonna tumble in the gunfire Promise we'll be side by side Say you'll be there when the school gates close Say you'll be there when the rest don't show   Stand up and be counted Before we slip away out here Before we slip away, slip away Don't ever doubt it Even if we're surrounded Don't wanna slip away, slip away   High on hope and high on fear We were heartbreak of the year We were stackin' up to fall (oh, oh) We were summers in the street We were sunlight through the trees We were born for silver screens (oh, oh) We were whispers in the dark We were sleeping under stars Singing, ""all of this is ours"" (oh oh) We were rollercoaster screams 'Til our hearts burst at the seams We're not gonna let it all go up in smoke   Stand up and be counted Before we slip away out here Before we slip away, slip away"
/songs/740593,James Bay,Stealing Cars,https://genius.com/James-bay-stealing-cars-lyrics,http://api.genius.com/songs/740593,Chaos and the Calm,2014-05-12," All we need is a spark A second chance, a lifeline Waiting out in the dark Holding out for a search light   No, I don't know why seasons change Or how we fell so far Before our hearts go up in flames Let's go throwing stones And stealing cars   Let the heat of the sun Reignite your memory 'Cause if we just turn and run Let them fire the gun   No I don't know why seasons change Or how we fell so far Before our hearts go up in flames Let's go throwing stones And stealing cars   Sirens and smoke remind us Maybe the world won't find us Fall to the Earth in red light 'til it's gone Gone   No I don't know why seasons change How we get back to the start Before our hearts go up in flames Let's go throwing stones And stealing cars Let's go throwing stones And stealing cars   Oh tonight these streets are ours to roam Oh tonight these streets are ours to roam"
/songs/3568475,James Bay,Sugar Drunk High,https://genius.com/James-bay-sugar-drunk-high-lyrics,http://api.genius.com/songs/3568475,Electric Light,2018-05-18," We shed tears for movie scenes No real fears, fake feelings It's a sentimental wasteland We're young enough to lose teeth But not old enough for enemies Still steering with both hands   We were just kids living young and naïve Running round streets like the King and the Queen Gas light flicker in your eye, what are hopeless dreams? Staying out waiting 'til they call off the search Chewing gum, cherry coke until our brains burned A sugar drunk high, we were the only ones, oh   The bitter taste of nicotine Still alive on my coat and jeans But you were the light that I saw standing in front of the sun You were the girl on the hill singing all night, all night   We were just kids living young and naïve Running round streets like the King and the Queen Gas light flicker in your eye, what are hopeless dreams? Staying out waiting 'til they call off the search Chewing gum, cherry coke until our brains burned A sugar drunk high, we were the only ones   Maybe never be found Like a drop in the ocean If we ever grow up We'll be gone in the moment   Sugar drunk high Sugar drunk high Sugar drunk high We were living on a sugar drunk high Sugar drunk high Sugar drunk high Sugar drunk high   We were just kids living young and naïve Running round streets like the King and the Queen Gas light flicker in your eye, what are hopeless dreams? Staying out waiting 'til they call off the search Chewing gum, cherry coke until our brains burned A sugar drunk high, we were the only ones   Maybe never be found Like a drop in the ocean If we ever grow up We'll be gone in the moment"
