api_path,primary_artist,title,url,song_endpoint,album,release_date,lyrics
/songs/3885976,James Bay,The Best,https://genius.com/James-bay-the-best-lyrics,http://api.genius.com/songs/3885976,Spotify Singles,2018-08-01," I call you when I need you When your heart's on fire You come to me, come to me Wild and wired   You come to me Give me everything I need   Give me a lifetime of promises And a world of dreams Speak the language of love Like you know what it means   It can't be wrong Take my heart and make it strong, baby   You're simply the best Better than all the rest Better than anyone Anyone I've ever met I'm stuck on your heart Hang on every word you say Tear us apart Baby, I would rather be dead   In your heart I see the start Of every night and every day And in your eyes I get lost I get washed away   Just as long as I'm here in your arms I could be in no better place   You're simply the best Better than all the rest Better than anyone Anyone I've ever met I'm stuck on your heart Hang on every word you say Tear us apart Baby, I would rather be dead   Each time you leave me I start losing control You're walking away with my heart and my soul I can feel you even when I'm alone Oh, baby   Oh oh, yeah You're simply the best Better than all the rest Better than anyone Anyone I've ever met I'm stuck on your heart Hang on every word you say Tear us apart Baby, I would rather be dead Oh, you're the best"
/songs/3446630,James Bay,Us,https://genius.com/James-bay-us-lyrics,http://api.genius.com/songs/3446630,Electric Light,2018-03-29," Sometimes I'm beaten Sometimes I'm broke ‘Cause sometimes this city is nothing but smoke Is there a secret? Is there a code? Can we make it better? 'Cause I'm losing hope   Tell me how to be in this world Tell me how to breathe in and feel no hurt Tell me how 'cause I believe in something I believe in us   After the wreckage After the dust I still hear the howling, I still feel the rush Over the riots, above all the noise Through all the worry, I still hear your voice   So, tell me how to be in this world Tell me how to breathe in and feel no hurt Tell me how ‘cause I believe in something I believe in us Tell me when the light goes down That even in the dark we will find a way out Tell me now 'cause I believe in something I believe in us   We used to be kids living just for kicks In cinema seats, learning how to kiss Running through streets that were painted gold We never believed we'd grow up like this   So tell me how to be in this world Tell me how to breathe in and feel no hurt Tell me how 'cause I believe in something I believe in us Tell me when the light goes down That even in the dark we can find a way out Tell me now 'cause I believe in something I believe in us I believe in something And I believe in us"
/songs/1854313,James Bay,Wait in Line,https://genius.com/James-bay-wait-in-line-lyrics,http://api.genius.com/songs/1854313,Hold Back The River,2014-11-07," I can't shake this feeling At the end of each day That I keep on working hard But all I do is get payed Though I keep believing There's a light up ahead Cause it's only getting darker And I could stay in my bed   It's a fight, it takes so long But I've learned to hold my own   So I stand and I wait in line With a heavy head and this bottle of wine And I watch as they steal my time I stand and I wait in line I stand and I wait in line   I walk home in the shadows I carry my cage And I hope they notice What I brought to the stage   Cause its a fight and it takes so long But I've learned to hold my own   So I stand and I wait in line With a heavy head and this bottle of wine And I watch as they steal my time I stand and I wait in line I stand and I wait in line   Ooh whenever it gets inside It gets so hard to hide Whenever it gets inside Ooh I know you'll turn out right Giving it all my life I know you'll turn out right   And I stand and I wait in line With a heavy head and this bottle of wine And I vow as they steal my time I know one day I'll get mine And I stand here and wait in line I stand and I wait in line I stand and I wait in line"
/songs/3446629,James Bay,Wanderlust,https://genius.com/James-bay-wanderlust-lyrics,http://api.genius.com/songs/3446629,Electric Light,2018-05-18," You get me high, love No matter where I go, you're the first thing on my mind We started to fade I know I was supposed to call, I wasn't alone And it was late in different time zones You've got eleven, I was on your side I was only waking up I just need to see you, need to feel that rush Again and again and again   Come on over and mend my heart   I didn't want to be here I didn't want to be here without you Want to be here But everyone of us, every one of us got wanderlust   You get me high love I don't wanna feel this mess You're still the best I loved And I'm still on the outside   Standing on a corner in the rainy, hot night Wonderin' if you were at home My pockets full of someone else's cigarettes And I don't even smoke (I don't even smoke)   Come on over and mend my heart Come on over and mend my heart   I didn't want to be here I didn't want to be here without you Want to be here But everyone of us, every one of us got wanderlust (got wanderlust)   I just wanna be in Be in the light, light that surrounds you I just wanna be in Be in the light, be in that light I just wanna be in Be in the light, light that surrounds you I just wanna be in Be in the light, be in that light I just wanna be in Be in the light, light that surrounds you And I just wanna be in, be in the light You get me high, love We're always out of time   I didn't want to be here I didn't want to be here without you Want to be here But everyone of us, every one of us got wanderlust   Every one of us got wanderlust Every one of us got wanderlust Every one of us got wanderlust Every one of us got wanderlust"
/songs/3446624,James Bay,Wasted On Each Other,https://genius.com/James-bay-wasted-on-each-other-lyrics,http://api.genius.com/songs/3446624,Electric Light,2018-05-18," Hold onto something, I can feel the floor leaving We're done with coming up and way past coming down My body shakes, a part of missing you I know you miss me too, I know you do   Is it a sane desire? Is it insane to try? We let this runaway train catch fire (I don't care) I don't care, all I want is you   We can try to stop this bruising, we can be like novacaine There's a high we keep on choosing, we don't wanna change it Everybody calls us foolish, they don't know how foolish tastes Every time we try to fight it, we just end up wasted Wasted on each other Wasted on each other   Put your hands up! We've both got people tryna creep in, policing Since when was this thing so indecent? Stop acting like everything's understood I know you miss me, too   We can try to stop this bruising, we can be like novacaine There's a high we keep on choosing, we don't wanna change it Everybody calls us foolish, they don't know how foolish tastes Every time we try to fight it, we just end up wasted Wasted on each other   You build me up and in the same breath you knock me down You turn me on, and just as quick, you might kick me out Can't find a way to get away So we might as well stay for another night   We can try to stop this bruising, we can be like novacaine There's a high we keep on choosing, we don't wanna change it Everybody calls us foolish, they don't know how foolish tastes Every time we try to fight it, we just end up wasted   We can try to stop this bruising, we can be like novacaine There's a high we keep on choosing, we don't wanna change it Everybody calls us foolish, they don't know how foolish tastes Every time we try to fight it, we just end up wasted Wasted on each other   Wasted on each other Wasted on each other"
/songs/700512,James Bay,When We Were On Fire,https://genius.com/James-bay-when-we-were-on-fire-lyrics,http://api.genius.com/songs/700512,Chaos and the Calm,2014-05-12," Drifting apart, getting harder to hold you Days getting dark and the nights are growing cold Are we burning out? Swept out of sight, rolling out on an ocean Let's cut all the ropes and get lost in the moment If our hearts are alive, maybe then they might Send us back to the sun   Now I know, I know We're losing light, our love is dying Out cold on the floor Like a fallen star that shines no more Take, take me back to where it was before When we were on fire Fire   Heading down, heading underground feeling wasted Cold to the bone, so alone I can taste it Let's light it up Street's are alive now and everything's bracing You're on my mind, running in my veins Fueling the flame, let's start it again (start it again)   Now I know, I know We're losing light, our love is dying Out cold on the floor Like a fallen star that shines no more Take, take me back to where it was before When we were on fire Fire We were on fire Fire, oh   Oh woah-oh oh woah-oh oh Now don't tell me no, that we're burning down Oh woah-oh oh woah-oh oh And don't tell me no, that we're burning now   Cause I know, I know That we're losing light and our love is dying Take, take me home Back to where it was before When we were on fire Fire   Now I know, I know We're losing light, our love is dying Out cold on the floor Like a fallen star that shines no more Take, take me back to where it was before When we were on fire Fire When we were on fire Fire"
/songs/3419383,James Bay,Wild Love,https://genius.com/James-bay-wild-love-lyrics,http://api.genius.com/songs/3419383,Electric Light,2018-02-08," Don't know what to say to you now Standing right in front of you Don't know how to fade in and out Don't know how to play it cool Lose a little guard, let it down We don't have to think it through We've got to let go   I wanna give you wild love The kind that never slows down I wanna take you high up Let our hearts be the only sound I wanna go where the lights burn low and you're only mine I wanna give you wild love   Tried to call you, to feel you close From a runway in Tokyo Let's leave the atmosphere, disappear There's always something left to lose   But I wanna give you wild love The kind that never slows down I wanna take you high up Let our hearts be the only sound I wanna go where the lights burn low and you're only mine I wanna give you wild love I wanna give you wild love   (I wanna give you wild love) (I wanna give you wild love) Let's be reckless, unaffected Running out until we're breathless Let's be hopeful, don't be broken Let's stay caught up in the moment   But I wanna give you wild love The kind that never slows down I wanna take you high up Let our hearts be the only sound I wanna go where the lights burn low and you're only mine I wanna give you wild love Oh I said I wanna give you wild love   Give you wild love Wild love Wild love Wild love"
/songs/3587688,James Bay,Young Hearts In the Dark,https://genius.com/James-bay-young-hearts-in-the-dark-lyrics,http://api.genius.com/songs/3587688,Electric Light (Target Exclusive),2018-07-13," Shut the light out Come in close Press against me and don't let go No more talkin', no more words We both know that they just don't work   I wanna be your only soldier I wanna set your world alight   Don't say you want me Don't say you need me Just stay, just stay Wherever we are, let's be young hearts in the dark   No distractions, no alarms Just you and I in a nervous calm Kill the phone light, cut the cord Bets are off, we don't share no more   Don't say you want me Don't say you need me Just stay, just stay Wherever we are, let's be young hearts in the dark   Don't blink and miss No, we'll never know a life like this Don't blink and miss Did you ever know a life like Did you ever know a life like this?   Don't say that you want me Don't say you need me Just stay, just stay Wherever we are we'll be (young hearts in the dark) Don't say that you want me Don't say you need me Just stay, just stay Wherever we are we'll be (young hearts in the dark) (Young hearts in the dark) (Don't say you want me) (Don't say you need me)   Kick the covers, drop the blinds Lock the door so that no one finds us"
