api_path,primary_artist,title,url,song_endpoint,album,release_date,lyrics
/songs/1937349,Kid Ink,Roll Out (Instrumental) - Instrumental,https://genius.com/Kid-ink-roll-out-instrumental-instrumental-lyrics,http://api.genius.com/songs/1937349,None,2018-08-17,"I know, they ain't know what I'm on Sorry, excuse me, how I'm feeling right now Soon they gonna understand it Tried to do it like me You can tell 'em I'm a beast I'm a dog, then let me off the leash Now I'm coming for 'em all Man I need another drink It's the last call Just give me a minute Let me show 'em how I ball And we'll roll out Let's roll out Let's roll out Let's roll out We can roll out  Live, reporting from the cockpit Red eyes but I'm trying to get my mind clear Celebratin' like we just won a contest No contest, motherfuckers couldn't digest What I'm on, man on my own Benz on deck, you ain't gotta blow my horn Paint a perfect picture like Frida Kahlo Red or green pill, don't trip just swallow that And gon' have the time in your life On me, no strings, up high as a kite Watch a Molly turn a straight girl Right into a dike soon you will understand By the end of the night, tell 'em  I know they ain't know what I'm all Sorry, excuse me, I'm feeling right now Soon they gonna understand it Tried to do it like me You can tell 'em I'm a beast I'm a dog, then let me off the leash Now I'm coming for 'em all Man I need another drink It's the last call Just give me a minute Let me show 'em how I bought And we'll roll out Let's roll out Let's roll out Let's roll out We can roll out  Just sayin', I need to get a point across Somebody find these niggas 'cause they fucking lost Tryin' to be the boss, couldn't pay the cost Let my chain speak for me, we ain't gotta talk I go, to the bottles, hallow, smoking on diablo Smelling like patrone, and Mark Jacobs calogne Up and away new generation apolishing So ready to roll, and rock out These lames can't ball like the NBA lockout Hit em' in the head, might pull a knot out Show these motherfuckers what they not 'bout Tell 'em  I know they ain't know what I'm all Sorry, excuse me, I'm feeling right now Soon they gonna understand it Tried to do it like me You can tell 'em I'm a beast I'm a dog, then let me off the leash Now I'm coming for 'em all Man I need another drink It's the last call Just give me a minute Let me show 'em how I bought And we'll roll out Let's roll out Let's roll out Let's roll out"
/songs/692670,Kid Ink,Round Here,https://genius.com/Kid-ink-round-here-lyrics,http://api.genius.com/songs/692670,Full Speed,2015-01-30,"(Shit on) (Yeah) Ahh yeah Ahh   Round here, yeah on the D-low Niggas 'round here call me Deebo Round here, yo bitch'll get stole nigga That's your section, not no more nigga Yeah for real, round here niggas know I'm Deebo Yeah, she know, he know, I'm Deebo   Niggas round here call me Deebo Take a nigga girl, she reporting like I'm PO Turn her from a 6, put the 1 before the 0 It ain't nothin' when I'm done You know I cancel like Nino Hoes ain't loyal but they free load I remember when you used to give it up for free though Now all you want is free dough Something that your man lack, he can hold your hand But he can't buy you no handbag Cuff yo chick, you better tuck yo chain, round here I'm Deebo and every day is Friday, round here Said I'ma get you high girl, gon' slow it down Just rolled up, took one hit, you got knocked the fuck out, okay   Round here, yeah on the D-low Niggas 'round here call me Deebo Round here, yo bitch'll get stole nigga That's your section, not no more nigga Yeah for real, round here niggas know I'm Deebo Yeah, she know, he know, I'm Deebo   Might pull up on the bike and skrrt skrrt Sup red-red bone, pocket check her ass first First off don't be greedy if you tryna stay the night Sippin' on champagne, you can't even say it right Hate when niggas tryna battle, won't see the daylight Know I'm winnin' like Floyd, you ain't gotta see the fight No decision, when I roll up it's precision Need a minute, lookin' hurt up in that corner that you sittin' It's me and all my niggas, make you feel intimidated No intention, we been payin' everybody too sedated round here We been in here for a hour workin' on round ten Nigga 10-4 this ain't no Nintendo   Round here, yeah on the D-low Niggas 'round here call me Deebo Round here, yo bitch'll get stole nigga That's your section, not no more nigga Yeah for real, round here niggas know I'm Deebo Round here Yeah, she know, he know, I'm Deebo nigga"
/songs/2411602,Kid Ink,Rounds,https://genius.com/Kid-ink-rounds-lyrics,http://api.genius.com/songs/2411602,None,2016-01-24," I'm trynna leave with somebody (You 'bout it, uh-huh) I love the way that you move (What you doing, keep going) I got all these hoes on me (They choosing, aw yeah) All I want is you (You know how it go!) Mustard on the beat, ho!   I'm trynna leave when you wanna The car outside straight out Daytona Just take it easy on marijuana Cuz I'mma need you up, ain't no sleeping 'till the morning girl We goin' the rounds like Mayweather Swear you looking like Aaliyah, 4 page letter And you lookin' at a pot of gold Runnin' my city like it's cardio, I do Tell her, bring it back show me that it's working Drop to your knees like worship You know how the story goes, hoes be hoes Don't let 'em make you mad The minute I'mma take you back Turn that ass 'round, break your back Gotta good girl high, I'm breaking bad Hit corners to the crib like the breaks is bad, oh!   I'm trynna leave with somebody, I love the way that you move I got all these hoes on me, all I want is you Go and back it up on me Can't help everytime you come around, I take you down Girl we go for rounds Girl we go, girl we go, girl we go for rounds G-Girl we go, girl we go, girl we go for rounds   Let's get it! I come for rounds when I come around And I don't fuck around with them fuck arounds Now bring yo ass around let yo ass round All these Audemars round, order more rounds Throw it back, get your shot, throw it back You throw it at me, I'mma throw it back Playin' catch, go get it, we playin' fetch (get it girl) I'm naughty by nature shout out to Treach Yea Yea, I'm now an OP-P I got too much dick, I got that OD-D I got that OG-G And you know I brought some dough with me (shit) Even your girls want you to flow with me And bitches be hating cuz they alone Talking about but who gonna take me home But you deserve rounds you deserve rounds Told the bitches in the way had to swerve around   I'm trynna leave with somebody, I love the way that you move I got all these hoes on me, all I want is you Go and back it up on me Can't help everytime you come around, take it down Girl we do it for rounds Girl we do it, girl we do it, girl we do it for rounds G-Girl we do it, girl we do it, girl we do it for rounds   I'm trynna leave with somebody, I love the way that you move I got all these hoes on me, all I want is you Go and back it up on me Can't help everytime you come around, take it down Girl we do it for rounds"
/songs/78995,Kid Ink,Rumpshaker,https://genius.com/Kid-ink-rumpshaker-lyrics,http://api.genius.com/songs/78995,Up & Away,2012-08-12," You got that Wreckx-N-Effects, rumpshaker I just wanna see you move your moneymaker Get stupid let me see you act a fool with it Yeah you got it girl but what you gon' do with it Yeah you got it girl but what you gon' do with it Yeah you got it girl but what you gon' do with it   It's 11: 45 at night Just start my day Looking for the party Work hard to play Walk in the club Lights all over the place But these haters can't see me Cause your ass all in my way That cake,cake Let me get a taste I don't need a plate Eat it with my face Just keep it real girl Give a fuck if it's fake As long as it's round Not pointy like a stake Yeah you got it But what you gonna do with it Just one song come and give me 2 minutes Please don't be mad if I grab it You get it from your momma and your granny   You got that Wreckx-N-Effects, rumpshaker I just wanna see you move your moneymaker Get stupid let me see you act a fool with it Yeah you got it girl but what you gon' do with it Yeah you got it girl but what you gon' do with it Yeah you got it girl but what you gon' do with it Get stupid let me see you act a fool with it Yeah you got it girl but what you gon' do   We up late like the sandman Let me take a seat back Think I need a lap dance Lost in a trance I can barely take my eyes off Stuck like glue, make it work No time-off With that fat ass and them C cups Bouncing like Baywatch Nicky from her butt down Can't fit in them jeans much Twerk some, if you back it up Might hurt something Where you get all that from I'm ready for the show Act 1 Now Have fun, shots coming You can have two Tryin' to hop on it But I think I need a saddle And thick like sizzurp and I'm lit Like a matchbox Don't throw it up Ba-donka-donk You can meet me at the blacktop    You got that Wreckx-N-Effects, rumpshaker I just wanna see you move your moneymaker Get stupid let me see you act a fool with it Yeah you got it girl but what you gon' do with it Yeah you got it girl but what you gon' do with it Yeah you got it girl but what you gon' do with it Get stupid let me see you act a fool with it Yeah you got it girl but what you gon' do"
/songs/1944281,Kid Ink,Rumpshaker (Instrumental) - Instrumental,https://genius.com/Kid-ink-rumpshaker-instrumental-instrumental-lyrics,http://api.genius.com/songs/1944281,None,2018-08-17,"You got that Racks in effects, rumpshaker I just wanna see you move your moneymaker Get stupid let me see you act a fool with it Yeah you got it girl but what you gonna do with it What you gonna do Yeah you got it girl but what you gonna do with it What you gonna do Yeah you got it girl but what you gonna do with it  What you gonna do...  What you gonna, uh  It's 11: 45 at night Just started my day Looking for the party Work hard to play Go, Walk in the club Lights all over the place But these haters can't see me 'Cause your ass all in my way That cake, cake Let me get a taste I don't need a plate Eat it with my face Just keep it real Give a fuck if it's fake As long as it's round Not pointy like a stake Uh, yeah you got it But what you gonna do with it Just one song come and give me 2 minutes Please don't be mad if I grab it Get it from your momma and your granny  You got that Racks in effects, rumpshaker I just wanna see you move your moneymaker Get stupid let me see you act a fool with it Yeah you got it girl but what you gonna do with it What you gonna do Yeah you got it girl but what you gonna do with it What you gonna do Get stupid let me see you act a fool Yeah you got it girl but what you gonna do  We, up late like the sand-man Let me take a seat back Think I need a lap dance Lost in a trance I can barely take my eyes off Stuck like glue, make it work No time-off With them fat ass and them C cups Bouncing like Bay Watch Nicky from her butt down Can't fit in them jeans much Twerk sumthin, if you back it up Might hurt some Where you get all that from I'm ready for the show Act 1 Now Have fun, shots come You can have two Tryin' hop on it But I think I need a sec though You thick like sizzurp and I'm lit Like a matchbox, Gona throw it up Ba-donka-donk you can meet me at the black top  You got that, B-Ballin! Racks in a effects, rumpshaker I just wanna see you move your moneymaker Get stupid let me see you act a fool with it Yeah you got it girl but what you gonna do with it What you gonna do Yeah you got it girl but what you gonna do with it What you gonna do Yeah you got it girl but what you gonna do with it What you gonna do Get stupid let me see you acting fool with it Yeah you got it girl but what you gonna do"
/songs/52119,Kid Ink,Run This,https://genius.com/Kid-ink-run-this-lyrics,http://api.genius.com/songs/52119,Crash Landing,2011-03-27," You don't want none with this, not only do I run but I lunge this shit Smoke like I don't need lungs and shit, spit lit like two rubbing sticks Wipe me down, better call Charmin, cuff yo chick kid so charming I'mma make my way in Marlin, hit it and she gon' come back, karma It's murder better call the coroner, they ain't wanna let me in they circle so I corner When I'm done baby you can go on an put a fork in 'em, don't talk money then you sound like a foreigner In my limelight I'm the sun of you, any list I'm the one and number two No restroom, up all night, check the bottom of my shoes I don't walk I   Yeah, I got 'em, you know I Leggo, yeah, I got 'em, you know I   I say what I want no censor, paper getting real long like a center To the money soon as I enter, we know you ain't getting paid, interns Being fly as a pre-set, everything on froze reset You can't fuck with me you just celibate, with so many hoes mother fucker I can sell a bitch Sick fever, right upside the head treat the beat like Teila Member when I use to work the scales like leavers? Rap now but I'm still ducking the Zebras You can never pass me gon' just face it, riding that beat like a motherfucking bass hit I don't give a fuck who you run with I know they know who run this shit   Kill 'em, aye, you know I Go, uh"
/songs/2397015,Kid Ink,Same Day,https://genius.com/Kid-ink-same-day-lyrics,http://api.genius.com/songs/2397015,Summer In The Winter,2015-12-25," It's a blessing (And now we make it) No questions now   I went from rags to riches To fucking with the baddest bitch (fucking with baddest) In my section It's a blessing, no questions, egh Got paid, fucked it all, in the same day Pool party in the club, in the same day Just met and I could hit it, in the same day Land in your city, take off, in the same day (in the same day) I got paid fucked her all, in the same day (same day) Pool party in the club   We, in this bitch all night Been doing this all day I know The way that my car rides (alright) Feel like back to the future I go Got everything on ice Feel like it's 40 below I just need her like Swear when you hit this shit girl you gon' flow Go ahead, suck it up Just got paid tryna fuck it up My bottle like your bottle 'til you drunk enough Any time you need a piece baby chunk it up And when you trying to leave baby hit the deuce And a seven nigga bitches and I hit at you Valet ticket then I hit the coup If you ain't in my circle, you ain't in the loop   I went from rags to riches To fucking with the baddest bitch (fucking with baddest) In my section It's a blessing, no questions, egh Got paid, fucked it all, in the same day Pool party in the club, in the same day Just met and I could hit it, in the same day Land in your city, take off, in the same day (in the same day) I got paid fucked her all, in the same day (same day) Pool party in the club   I just might hit both She brought her friend, just might hit both (uh-uh) In the same day, shots up, gameface You better get your bank cause she ain't safe With me and all my niggas in the same place We went from rags to getting fast money Ain´t nothing but a traffic ticket You niggas still crashing the game You still need a pass in the city I see them trying to catch my way I hit them with the pass in the face Started, star, was on my yard Smelling like money and we get my order No sticks and no seeds on my flowers Spent your whole weekend in 24 hours   I went from rags to riches To fucking with the baddest bitch (fucking with baddest) In my section It's a blessing, no questions, egh Got paid, fucked it all, in the same day Pool party in the club, in the same day Just met and I could hit it, in the same day Land in your city, take off, in the same day (in the same day) I got paid fucked her all, in the same day (same day) Pool party in the club"
/songs/457548,Kid Ink,"Sex, Drugs, & Rock N Roll",https://genius.com/Kid-ink-sex-drugs-and-rock-n-roll-lyrics,http://api.genius.com/songs/457548,Crash Landing,2011-03-27,"(INTRO:K-Young)  I mean you remind me of somethin' I just can't think of what it is  (Hook:K-Young)  You remind me of the fire in my gun and Kinda like my guitar the way ya body be strumming Ooohh keep it coming cause I'm in need of yaaa  Your sex, drugs and rock n roll Like oooohhh (I need it, I need it, I need it baby) Your sex, drugs and rock n roll Oooohhh (I need it, I need it, I need it baby) Your sex, drugs and rock n roll  (Verse 1: Kid Ink)  Yea, I'm addicted to your lifestyle Love junkie and I need to hit you right now You got that right sound I can turn these lights down And play you all night Girl is that all right Me, I'm more than alright I'm the best at what I do that sound like your type And girl I'm on you like I'm white and you're rice Sound complicated big girl you got me faded You on fire baby I can ash you And Imma face it no never pass you You know I love the way that ass move You can tell them you wit me if they ask boo Keep it strummin', I, I keep it comin' Why I keep you comin', beat it like a drumma Eat it like a glutton we done got into something I need it I need it I want it  (Hook:K-Young)  You remind me of the fire in my gun and Kinda like my guitar the way ya body be strumming Ooohh keep it coming cause I'm in need of yaaa  Your sex, drugs and rock n roll Like oooohhh (I need it, I need it, I need it baby) Your sex, drugs and rock n roll Oooohhh (I need it, I need it, I need it baby) Your sex, drugs and rock n roll  (Verse 2:Kid Ink)  Yeah, baby girl I need a fixin' You keep me rollin' like the sixties And got me open like its Christmas You so persistent I can't resist it Yea she cause it but I can risk it Death kiss feel the fire in her lipstick Might be the baddest bitch ever invented You might not ever see it but god as my witness I swear he paid attention when he came and made her Gotta thank the savior for doin' me this favor Watch out she danger she'll come with a waiver But I can take her but fate her Keep it comin', yeah I keep it flowin' While I keep you comin', beat it like you punished Eat it like I'm hungry, we done got into somethin I need it, I need it, I want it  (Hook: K-Young)  You remind me of the fire in my gun and Kinda like my guitar the way ya body be strumming Ooohh keep it coming cause I'm in need of yaaa  Your sex, drugs and rock n roll Like oooohhh (I need it, I need it, I need it baby) Your sex, drugs and rock n roll Oooohhh (I need it, I need it, I need it baby) Your sex, drugs and rock n roll"
/songs/3326549,Kid Ink,Shakin' (No No No Freestyle),https://genius.com/Kid-ink-shakin-no-no-no-freestyle-lyrics,http://api.genius.com/songs/3326549,None,2017-11-19," Oh yeah Bankroll got it Oh, [??]   Ah, picture me rollin' Walk in the room and just sniff the cologne Lookin' the sky, see me picking a pose Think I'm so high I need mission control Niggas so cold I had to lay on my clothes Diamond are dancing away with the stroke Bird watching, I stay away from the crows [??] popping, just wait 'till it close We gon' keep goin' and goin' again Know you came here just to roll with your friends Came in the game and was playin' your role Now you actin' like you got some plans on your own Shootin' and picking and reachin' Your shit is more that just kicking and speakin' You had that night of your life so we're even I might disappear and I say when I'm leaving (yeah)   Tried to keep it light (light) But I might just be on fire Whatever I say tonight Please do not remind me (oh yeah) Wow, just passed the light (light) I'm tryna hit the fire, say whatever I do tonight (oh yeah) Please do not remind me, yeah   Niggas, my posse drop in this bitch like it's Mission Impossible Got her ridin' like pimpin', tell 'em no limits,these bitches is optional I hurt a haters feelin' so bad, might send 'em to the hospital Know they see, hear I'm eatin', the way that I'm movin', I need my shit hot to go (woo) Pop and zip, shut this bitch down and I hop and skip Gave her a wave and she hop and [??] For you she's playin' so hard to get For me, that's the way, the players just play Give me some room while I'm paving the way [??] in here high, no space in my J's Standin' too close'll get you smoke in your face   Tried to keep it light (light) But I might just be on fire Whatever I say tonight Please do not remind me (oh yeah) Wow, just passed the light (light) I'm tryna hit the fire, say whatever I do tonight (oh yeah) Please do not remind me, yeah"
/songs/52212,Kid Ink,She's A Playa,https://genius.com/Kid-ink-shes-a-playa-lyrics,http://api.genius.com/songs/52212,Daydreamer,2013-01-01," Tell her she's a PLAYER, never trust her, she's a PIMPPO, must have a been a girl that I met on the low PLAYER, don't give her nothing, she's a PIMPPO, never give her money cause you know she a stunner PLAYER never trust her, she's a PIMPOO, must have a been a girl that I met on the low PLAYER, don't give her nothing, she's a PIMPPO, never give her money cause you know she a stunner   Nah, you can never trust her Cute face but, down-deep she a hustler Know just how to walk, how to talk, how to touch you Make a nigga fall in love, it's a wrap, you a sucker now Every time I come around It's money season and she tryna hunt me down So I gotta move it carefully, but every time I leave She pulls me right back in like gravity It's crazy, even have my lady tell me that she's bad too Fucking with a attitude So you know I had to do what I had to do Got 'em at the same time watch it when it's game time   Said she's a superwoman, got pussy powers Man-eater, don't get devoured Watch out, it could be trouble She know how to break it down, turn you into rubble Never on that bull, money's the agenda And her calendar is full, get it how she got to And she never lose her cool, got you niggas fooled Know how to play a role, she deserve a Golden Globe, tell 'em I know how to handle her Get her to my room and dismantle her Take her from the bed to the mantle Hit the floor, knock the lights out, better get a candle  "
/songs/2258719,Kid Ink,"She Twerkin (feat. Cash Out, Lil Boosie, Juicy J & Ty Dolla $ign)",https://genius.com/Kid-ink-she-twerkin-feat-cash-out-lil-boosie-juicy-j-and-ty-dolla-sign-lyrics,http://api.genius.com/songs/2258719,None,2018-08-17,"See me grabbin' on my tooly  She told me smack her on the booty  She say I got too many hoes  She say I got too many shows  But she twerkin' Shawty gon' toss that pussy at me like an alley-oop  There's some bitches in this club, but ain't none as bad as you  With an ass as fat as yours, watch me make it thunder storm  Flyer than a G-6, come on shawty come aboard  You deserve an award or a trophy, I ain't jokin'  Looking at it from the front and I can see that ass pokin'  Out your dress  Thirty minutes have you coming out your dress  Spend a one night stand with me, make you change your address  Get it on the first night, baby, I ain't here to judge  Say you want that dope dick, I can be your plug  We can get it in this club, we can get it in the whip  First you gotta show them lips if you tryna get a tip  It's some big booty bitches in the building, ooh-wee  The way she clap her hands, the way she clap her booty  And I'm like ""oh my God Becky, look at her butt""  Got called the trashman ‘cause she got some junk in her trunk  She put that arch in her back, she started throwing it back  You know I'm watching it wiggle, I let her grab on my missile  She say I'm fucking tonight, she let me know it's official  The way she sluprin' and twerkin' she might just get her a Birkins  Grabbing on that tooly, smackin' on that booty  I told her ""twerk"" she say ""why"" I say ""why? because I'm Boosie""  I walked off in that club, walked up and I approached her  First she say I was a dog, now she twerkin' up in my Rover  Surfing up in my Rover, showing off like she supposed to  She ain't have to tell me smack her ass, I smacked it ‘fore she told me  Got too many hoes, I'm loaded, she twerk on the pole so perfect  Sassy mouth every time she talk, but she show me that she worth it  Twerk  She twerk it, she twerk, dropping that ass all the way to the dirt  You know she bad twerkin' it all in my pants, twerkin' it all in my shirt  Aww fuck, say she got a man, I'm like ""so what?""  Toot it up for a real one with a million, oh yeah (okay)  I got her on that D'Usse  Told her pop that oochie coochie, smack her on the booty  Do it for the Vine, do it for the dollar sign  Pull them panties to the side, girl don't sigh  She twerkin', go ‘head, don't be nervous  Club hot, it's the furnace, I know your feet hurtin'  In them heels, so high, no lie for certain  Get away from them squares and throw that in a circle  See me grabbing on the booty, my goonies got the tooly  Said it's Kid Ink, baby, who the fuck is you confusing?  Bust it, bust it, bust it down bust it bus side of the Bendo  Used to be my old ho, now she acting brand new  Shawty from the hood, tell from her tattoo  Both sides go up, I just call her Lambo  Left, right, l-left, right I hit that Tina Ike  She drop down and twerk it and now I see the light"
