api_path,primary_artist,title,url,song_endpoint,album,release_date,lyrics
/songs/4256462,Lukas Graham,Love Someone (Spotify Singles),https://genius.com/Lukas-graham-love-someone-spotify-singles-lyrics,http://api.genius.com/songs/4256462,Spotify Singles,2019-01-25,"[Verse 1: Lukas Graham & Sabina Ddumba] There are days I wake up and I pinch myself You're with me, not someone else And I’m scared, yeah, I'm still scared That it's all a dream  [Pre-Chorus: Lukas Graham & Sabina Ddumba] ’Cause you still look perfect as days go by Even the worst ones, you make me smile I'd stop the world if it gave us time   'Cause when you love someone You open up your heart When you love someone You make room If you love someone And you're not afraid to lose 'em You probably never loved someone like I do You probably never loved someone like I do  [Verse 2: Sabina Ddumba, Lukas Graham & Both] When you say You love the way I make you feel Everything becomes so real (Ooh) Don't be scared, no, don't be scared (No, no, no, no) 'Cause you’re all I need  [Pre-Chorus: Lukas Graham & Sabina Ddumba] And you still look perfect as days go by Even the worst ones, you make me smile I’d stop the world if it gave us time   'Cause when you love someone (Love someone) You open up your heart When you love someone You make room If you love someone And you’re not afraid to lose 'em You probably never loved someone like I do You probably never loved someone like I do  [Bridge: Lukas Graham, Sabina Ddumba & Both] All my life (All my life) I thought it'd be hard to find The one, 'til I found you (’Til I found you) And I find it bittersweet 'Cause you gave me something to lose  [Chorus: Lukas Graham, Sabina Ddumba & Both] But when you love someone (When you love someone) You open up your heart When you love someone You make room If you love someone (If you love) And you're not afraid to lose 'em You probably never loved someone like I do (Someone like I do) You probably never loved someone like I do You probably never loved someone like I do"
/songs/3858811,Lukas Graham,Lullaby,https://genius.com/Lukas-graham-lullaby-lyrics,http://api.genius.com/songs/3858811,3 (The Purple Album),2018-10-26," I'll give you everything I never had I hope you know that But now I have it, I don't need it, it's important that you see it Money often makes a never-home dad Is it worth all the times when I'm never here? Is it worth it when daddy can't dry your tears? Is it life or just a living? Kids and wife is not a given I wish I could be a stay-at-home dad   And all the dreams I had I still see them in your eyes   Now you can hurt me more than I've ever been hurt before And I've been hurt before I live, I live, I live I live like this forever I still have all the wounds he left but they don't hurt no more Like they hurt before I wish, I wish, I wish I wish that he could have seen you   I'm gonna miss the most important things And I know that Your first words, a couple steps, at least we got so many left Your mom's so good, she never make me look bad 'Cause she knows all the times when I'm far from home In a room full of people but all alone It gets me thinking when we're smoking and we're drinking I wish I could be a stay-at-home dad   And all the dreams I had I still see them in your eyes   Now you can hurt me more than I've ever been hurt before And I've been hurt before I live, I live, I live I live like this forever I still have all the wounds he left but they don't hurt no more Like they hurt before I wish, I wish, I wish I wish that he could have seen you   Oh-oh-oh-oh-oh-oh, oh-oh-oh Oh-oh-oh-oh-oh-oh I wish that he could have seen you   Now you can hurt me more than I've ever been hurt before And I've been hurt before I live, I live, I live I live like this forever I still have all the wounds he left but they don't hurt no more Like they hurt before I wish, I wish, I wish I wish that he could have seen you   Oh-oh-oh-oh-oh-oh-oh Oh-oh-oh-oh-oh-oh-oh"
/songs/2276535,Lukas Graham,Mama Said,https://genius.com/Lukas-graham-mama-said-lyrics,http://api.genius.com/songs/2276535,Lukas Graham (Blue Album),2014-06-23, When Mama said that it was okay Mama said that it was quite alright Our kind of people had a bed for the night And it was ok Mama told us we are good kids And daddy told us never listen to the ones Pointing nasty fingers and making fun ´Cause we were good kids   Remember asking both my mom and dad Why we never travelled to exotic lands We only ever really visit friends Nothing to tell when the summer ends We never really went buying clothes Folks were passing on this stuff plenty loads New shoes once a year and then Out to play ball so we could ruin them   When mama said that it was okay Mama said that it was quite alright Our kind of people had a bed for the night And it was ok Mama told us we were good kids And daddy told us never listen to the ones Pointing nasty fingers and making fun 'Cause we were good kids   Don’t get me wrong I didn’t have it bad I got enough loving from my mom and dad But I don’t think they really understood When I said that I wanted the deal in Hollywood I told them I´ll be singing on TV The other kids were calling me a wannabe The older kids they started bugging me But now they all standing right in front of me   When mama said that it was okay Mama said that it was quite alright Our kind of people had a bed for the night And it was ok Mama told us we were good kids And daddy told us never listen to the ones Pointing nasty fingers and making fun ‘Cause we were good kids   I know which place I'm from I know my home When I’m in doubt and struggling That’s where I go An old friend can give advice When new friends only know a half story That’s why I’m always keep them tight And why I´m okay … I said I'm OK You know what my mama said You know what she told me   My mama said that it was ok Mama said that it was quite alright Our kind of people had a bed for the night And it was ok Mama told us we were good kids And daddy told us never listen to the ones Pointing nasty fingers and making fun ‘Cause we were good kids   When mama said that it was okay Dabdadadabdadad bdaaa... Dabdadadabdadad bdaaa... Dabdadabdadadbdadabdaaaaa... When mama said that it was okay Dabdadadabdadad bdaaa... Dabdadadabdadad bdaaa... Dabdadabdadadbdadabdaaaaa... When mama said that it was okay
/songs/189731,Lukas Graham,Moving Alone,https://genius.com/Lukas-graham-moving-alone-lyrics,http://api.genius.com/songs/189731,Lukas Graham [International Edition],2012-03-26," I was still in my teens The biggest man in my life went and shattered my dreams How could you do it to mom? I swore back then I wouldn't be like you And it hurt like hell you didn't tell us the truth How could you do it to mom?   I don't even know if you know that you hurt us From all I understand, it seems like you just don't care Now I'm walking alone with my burden A burden to bear that can never belong to me   I'm just a chip off the block, never too far from you Tell me, daddy, what to do Tell me, is it destiny to start fooling around And keep fooling around? Did you know that I knew, knew about her and you And I felt so confused? I even considered to tell mummy the truth, tell mummy the truth, tell mummy the truth Tell mummy the truth, tell mummy the truth   But I'm just like him Now the circle starts over, starts over again I realize, the story's not over at all I thought the cheating would have ended with him But I'm cheating, now I'm cheating on my own girlfriend Truth be told, I guess she wasn't special at all   She doesn't even know if I know that I hurt her From all she understands, it seems like I just don't care Now I'm walking alone with my burden A burden I bear now because it belongs to me   I'm just a chip off the block, never too far from you Tell me, daddy, what to do Tell me, is it destiny to start fooling around And keep fooling around? Did you know that I knew, knew about her and you And I felt so confused? I even considered to tell mummy the truth, tell mummy the truth, tell mummy the truth Tell mummy the truth, tell mummy the truth   Everybody’s walking alone Everybody’s walking alone Everybody’s walking alone I said Everybody’s walking alone Everybody’s walking alone I know that everybody's walking alone   I'm just a chip off the block, never too far from you Tell me, daddy, what to do Tell me, is it destiny to start fooling around And keep fooling around? Did you know that I knew, knew about her and you And I felt so confused? I even considered to tell mummy the truth, tell mummy the truth, tell mummy the truth Tell mummy the truth, tell mummy the truth"
/songs/189733,Lukas Graham,Never Let Me Down,https://genius.com/Lukas-graham-never-let-me-down-lyrics,http://api.genius.com/songs/189733,Lukas Graham [International Edition],2012-03-26," There's just something about her She got me working harder She is always on my mind Oh-oh-oh, I tell ya She's got something that's better It holds my world together When she's a with me I'm alright   And everywhere I go empty handed Feeling we've been parted for so long That's why I keep you right here in my palm   You never let me down Swear you're a blessing, oh Ain't you the best thing, wow Love everlasting, never get me wrong Oh, you let me be, be, be You gotta love me Come on, come on   Back at the bar, I was having my drink Talking to my lady, never needed a shrink Somebody sent me a smile then she threw me a wink She asked, ""Are you single?"", I said, ""What do you think?""   Girl, everywhere I go empty handed Feeling we’ve been parted for so long That's why I keep you right here on my arm   You never let me down Swear you're a blessing, oh Ain't you the best thing, wow Love everlasting, never get me wrong Oh, you let me be, be, be You gotta love me Come on   I like to mix it Girl, I'd like to twist it with you I like to shake it Girl, I think I'll make it with you I like to mix it Girl, I'd like to twist it with you, you, you   You never let me down Swear you're a blessing, oh Ain't you the best thing, wow Love everlasting, never get me wrong Oh, you let me be, be, be You gotta love me Come on, come on, come on"
/songs/189726,Lukas Graham,Nice Guy,https://genius.com/Lukas-graham-nice-guy-lyrics,http://api.genius.com/songs/189726,Lukas Graham [International Edition],2012-03-26," Boy, I tried to tell you, but you just wouldn't hear We've got the house full of ladies and you're acting all queer We've got your female friends, but you can't get anywhere I'll tell you one last time, boy, life isn't fair, na-na-na   If you feel ashamed, step up your game You see, she's calling my name, 'cause she's getting bored She thinks you're a fool for not making moves God damn, it could have been you, oh, so you're the nice guy?   I'm gon' get my la-la-la He's gon' get some la-la-la All of my boys gon' get their la-la-la You won't get no na-na-na, nice guy I'm gon' get my la-la-la He's gon' get some la-la-la All of my boys gon' get their la-la-la You won't get no na-na-na, nice guy   I told you many times before but, boy, you did it again You met a hot-ass girl and turned her into your friend You bought her drinks, oh Lord, you were ready to spend I brought her home that night and I should thank you again 'Cause you're the nice guy   If you feel ashamed, step up your game You see, she's calling my name, 'cause she's getting bored She thinks you're a fool for not making moves God damn, it could have been you, oh, so you're the nice guy?   I'm gon' get my la-la-la He's gon' get some la-la-la All of my boys gon' get their la-la-la You won't get no na-na-na, nice guy I'm gon' get my la-la-la He's gon' get some la-la-la All of my boys gon' get their la-la-la You won't get no na-na-na, nice guy   Rule number one, don't ever do it her way 'Cause if you make her do it your way you might do it today And, rule number two don't ever buy in the bar 'Cause if you buy in the bar, the next thing she wants a car 'Cause you're the nice guy 'Cause you're the nice guy, yeah 'Cause you're the nice guy 'Cause you're the nice guy, yeah Oh, so you're the nice guy?   I'm gon' get my la-la-la He's gon' get some la-la-la All of my boys gon' get their la-la-la You won't get no na-na-na, nice guy I'm gon' get my la-la-la He's gon' get some la-la-la All of my boys gon' get their la-la-la You won't get no na-na-na, nice guy   Yeah, you're fucking up for everybody else, nice guy You're making life a living hell for the rest of us, you know Being all nasty, them ladies and shit, buying them stuff You know what? You should start being a little less nice Learn how to be a real man When you go out you should talk to the ladies like a real man Don't be all that nice guy Don't tell me you didn't, 'cause I know you did, nice guy"
/songs/3858860,Lukas Graham,Not A Damn Thing Changed,https://genius.com/Lukas-graham-not-a-damn-thing-changed-lyrics,http://api.genius.com/songs/3858860,3 (The Purple Album),2018-10-12," Not a damn thing changed All the boys that grew up back to back still do the same things Now they're rewarding our records But we still do the same things I'm just spittin' words out my mouth I made it, I still don't know how Damn it, my stage show can light up the clouds Now I'm gonna blow it until I go out Bring it Not a damn thing changed Just the funerals that follow death and some more pain We're drinking beers and we're lighting up joints in the cold rain I'm glad I got somewhere to go I know a few souls without hope Brother, you know you can call if you're broke Damn it, I pray you won't reach for that rope   So pour out a shot for me Keep pouring out the bottle for the real ones I lost Who can no longer walk with me For the ones still right here, yeah, for the ones who still care Yeah, we still feel the same way Just pushing in the same lane Tryna sit still, keep looking at the main aim Always doing me so I have to maintain Not a damn thing changed, just sticking to the game plan   Not a damn thing changed Got my team from day one, there's not one I could replace Staying true to the way I grew up, how we were raised My boys, they go in and go out I'm just spittin' words out my mouth So far away but I still make them proud Damn it, I hope we all make it somehow Bring it Not a damn thing changed I'm just tryna put feelings into words on this damn page Some of my friends started leaving this life 'cause they couldn't wait They know how it feels without hope I'm glad I got somewhere to go Stick to my people, that's people I know They feel the same, we all follow that code   Now pour out a shot for me Keep pouring out the bottle for the real ones I lost Who can no longer walk with me For the ones still right here, yeah, for the ones who still care Yeah, we still feel the same way Just pushing in the same lane Tryna sit still, keep looking at the main aim Always doing me so I have to maintain Not a damn thing changed, just sticking to the game plan   Not a damn thing changed Won't forget where I'm from but for me there's just one way It's a habit of beating the goals that we once made I got a few records to break I know we all got what it takes The team is the team, same as back in the day The team is the team, same as back in the day Not a damn thing changed If I wanted to turn back, it's already too late Yeah, we just grew up too quick 'cause we 'Cause we couldn't wait Pushing in the same lane Tryna sit still, keep looking at the main aim Always doing me so I have to maintain Not a damn thing changed, just sticking to the game plan"
/songs/3236519,Lukas Graham,Off To See the World,https://genius.com/Lukas-graham-off-to-see-the-world-lyrics,http://api.genius.com/songs/3236519,My Little Pony: The Movie (Original Motion Picture Soundtrack),2017-09-22," So, we wanna stay But can't find peace while sittin' still I guess we never will We're underway We won't hurry back again The journey is the end   (Oh-oh) I love this very moment We're speeding up not slowing We might know we can't win But we're dumb enough to try We're going, there's no maybe That's why they call us crazy And we'll say if anybody asks us   Hey, where you gonna go? We're off to see the world We don't need to know, oh Hey, where you gonna go? We're off to see the world We don't need to know   We never need to know Seeking boundaries to break Let's forget the ones we've made So we carry on Don't let good things pass us by The time we're gone will be the Best time of our life   I love this very moment We're speeding up not slowing We might know we can't win But we're dumb enough to try We're going, there's no maybe That's why they call us crazy And we'll say if anybody asks us   Hey, where you gonna go? We're off to see the world We don't need to know, oh Hey, where you gonna go? We're off to see the world We don't need to know   So go tell 'em we won't stop We know they can't change us We're gonna go way off the map To get ourselves back on the track Go tell 'em we won't stop We know they can't change us No need to worry so much We do whatever we want, oh   Hey, where you gonna go? We're off to see the world We don't need to know, oh Hey, where you gonna go? We're off to see the world We don't need to know   Oh, oh-oh-oh-oh Oh, oh-oh-oh-oh Oh, oh-oh-oh-oh Oh, oh-oh-oh-oh"
/songs/2298564,Lukas Graham,Only One,https://genius.com/Lukas-graham-only-one-lyrics,http://api.genius.com/songs/2298564,None,None,"So you ´gon marry me? No, can't do You´re not the first girl thinking That you want it to There are way more things that I just gotta see And you've got way too much lovin´ for me  I ain't no one woman man, barely use the same bed You've got that heart of gold, you're so innocent That's why you've got to know Baby I've got to go You want more than one night But baby I won't be back for more I've just been having You They say I've been a bad I left for someone new But don't be sad ?cause I left her too and now she's mad I'm rolling, I'm rolling, I ain't coming back for her No, I ain't coming back for her  Girl don't worry See I've got to go I, saw this chick out your window I just got to know And there are way more things that I just gotta see And you've got way too much lovin' for me I ain't no one woman man, barely use the same bed You've got that heart of gold You're so innocent That's why you've got to know Baby I've got to go You want more than one night But baby I won't we back for more I've just been having you They say I've been a bad I left for someone new But don't be sad, cause I left her too And now she's mad I'm rolling, I'm rolling I ain't coming back for her No I ain't coming back for her  There's no looking back, It will give me bad luck If I turn around now In the moment I'm stuck See I follow my path, and believe in my luck ?..I'l be roming a plane as a ..? I've just been having you They say I've been a bad I left for someone new, but don't be sad Cause I left her too and now she's mad I' m rolling, I'm rolling I ain't coming back for her No I ain't coming back for her 4x"
/songs/189732,Lukas Graham,Oohhh (Interlude),https://genius.com/Lukas-graham-oohhh-interlude-lyrics,http://api.genius.com/songs/189732,Lukas Graham [International Edition],2012-03-26," Oh, she's got me screaming for more Damn, she can blow, get your knees on the floor And let's go, let's see how deep I can go I wanted to blow my load, but I thought ""no"""
/songs/189722,Lukas Graham,Ordinary Things,https://genius.com/Lukas-graham-ordinary-things-lyrics,http://api.genius.com/songs/189722,Lukas Graham [International Edition],2011-10-17," You thought that I could change But I'm all the same, girl, I'm all the same You thought that you could work me out, ooh-ooh   It's just that all these ordinary things, ordinary things Seemed to hunt you, making me wanna dump you Just that all these ordinary things, ordinary things Seems a lot, why don't we just break it up, hey   You had me in your hand, and I don't understand Why you tripping 'cause I ain't slipping, baby, I'm your man You text excessively, you can't leave me be I don't ask you what you're up to, but you keep calling me You have got to stop these things I need someone with confidence Confidence ain't buying rings And ask me where I drink my drinks I don't need you To tell me what to do It's all up in your head And I'm just sorry that   These ordinary things, ordinary things Seemed to hunt you, making me wanna dump you Just that all these ordinary things, ordinary things Seems a lot, why don't we just break it up, hey   We've got to end this show, I've got to let you go I can't stand it, you're too demanding, such a jealous ho' You put it in my head, like a bullet made of lead Baby, stop it, you've got to drop it there   You should know what happens When you say them things you say Your value falls, girl, it falls Don't blame me for shit I didn't do Maybe I should have gone out cheating on you   You have got to stop these things I need someone with confidence Confidence ain't buying rings And ask me where I drink my drinks I don't need you To tell me what to do It's all up in your head And I ain't sorry that   Them ordinary things, them ordinary things Used to hunt you, 'cause baby now I dumped you And all them ordinary things, them ordinary things Were too much, 'cause now I broke it up"
/songs/2276688,Lukas Graham,Playtime,https://genius.com/Lukas-graham-playtime-lyrics,http://api.genius.com/songs/2276688,Lukas Graham (Blue Album),2015-06-16," We started with a clean slate Came to stake our claim Looking for a good time On the streets that reek of fame  Where everybody looks good They're better dressed than me The waitress brings us cold beers But she wants to see ID  I swear she saw me coming Well maybe in an hour or two She said: ""Boy do you like downtown?"" What else was I to do?   You know I tipped her, and Slipped, slipped her the number I said I just got into town and I wanna Hang out and light up some marijuana You wanna? You wanna? You?   She said when I get off it's playtime I'll show you where to go on late nights And later I'll give you the bed ride And maybe I can make you beg right She said when I get off it's playtime I'll show you where to go on late nights And later I'll give you the bed ride Oh baby I'm gon' make you beg right   She took me to a dive bar The kind that never close The cheapest drink was Bourbon shots So we loaded up on those Her friend was serving all night I liked her serving slow When locking up she told me: ""sit"" While she told the rest to go   So I tipped her and Slipped, slipped her the number I said I just got into town and I wanna Hang out and light up some marijuana You wanna? You wanna? You?   She said when I get off it's playtime I'll show you where to go on late nights And later I'll give you the bed ride And maybe I can make you beg right She said when I get off it's playtime I'll show you where to go on late nights And later I'll give you the bed ride Oh baby I'm gon' make you beg right   If a girl has got to go And work all day (work all day) I'm gonna do my best to help her find a little time to play   She said when I get off it's playtime I'll show you where to go on late nights And later I'll give you the bed ride And maybe I can make you beg right She said when I get off it's playtime I'll show you where to go on late nights And later I'll give you the bed ride Oh baby I'm gon' make you beg right"
/songs/3944405,Lukas Graham,Promise,https://genius.com/Lukas-graham-promise-lyrics,http://api.genius.com/songs/3944405,3 (The Purple Album),2018-10-26," I've been on the road, bringing back money Yeah, I've been digging gold, I hope you still want me I know I've been gone a little too long But money don't grow, so I gotta go I've been chasing dimes It's been so lonely, yeah, I've been in the mines I'm sorry my hours don't work out right I know I keep you up at night   'Cause ain't much changed but my age The man you love is the same Don't you know that hearts can break easy? I gave you the best of my pieces   Promise me you'll let me come back home Keep my bed warm 'Cause I'm bringing it all back to you Only say you'll be there when I do   Promise you get the best of me Only you get the rest of me Got my mind on your waist You're the life of my party Got a lot to do, can't stay in one place too long I've been on the move, I know you've been waiting But here's the truth I want someone to come home to   'Cause ain't much changed but my age The man you love is the same And don't you know that hearts can break easy? I gave you the best of my pieces   Promise me you'll let me come back home Keep my bed warm 'Cause I'm bringing it all back to you (Back to you) Only say you'll be there when I do   Promise me, we're not gonna lose this 'Cause I'm on my way right now It's only home with you in it Now I'm so close, it's unfair   'Cause ain't much changed but my age The man you love is the same And don't you know that hearts can break easy? I gave you the best of my pieces   Promise me you'll let me come back home Keep my bed warm 'Cause I'm bringing it all back to you (Back to you) Only say you'll be there when I do   Promise me Promise me Promise you get the best of me Only you get that recipe Got my mind on your waist"
