api_path,primary_artist,title,url,song_endpoint,album,release_date,lyrics
/songs/2167155,MAGIC!,Sunday Funday,https://genius.com/Magic-sunday-funday-lyrics,http://api.genius.com/songs/2167155,None,2015-07-17," (Hey!, come on up)   Another manic Monday, praying for the week to go by While Jimmy's at the golf course, smoking on a Cuban Delight   Now money, money, we all got to make it, yeah But right now, I could use a vacation   I wish it was Sunday, Sunday funday A Monday-to-Monday Sunday funday I wish it was Sunday, Sunday funday A Monday-to-Monday Sunday funday Sunday funday   Another torture Tuesday; I cannot seem to open my eyes While Suzie's at the dayspa getting ready for Jimmy tonight   Now money, money, we all got to make it, yeah But right now, I just need a vacation   I wish it was Sunday, Sunday funday A Monday-to-Monday Sunday funday I wish it was Sunday, Sunday funday A Monday-to-Monday Sunday funday Sunday funday    (Ooooh, Ooooh, Ooooh) We don't wanna work no more (Ooooh, Ooooh, Ooooh) Life is just too short   Now money, money, we all got to make it, yeah But everyday  should be a vacation   I wish it was Sunday, Sunday funday A Monday-to-Monday Sunday funday I wish it was Sunday, Sunday funday A Monday-to-Monday Sunday funday Sunday funday (Ooooh, Ooooh, Ooooh, sunday funday, ah yeah)   We don't wanna work no more (sunday funday) Life is just too short (sunday funday)"
/songs/2714745,MAGIC!,The Way God Made Me,https://genius.com/Magic-the-way-god-made-me-lyrics,http://api.genius.com/songs/2714745,Primary Colours,2016-07-01,"They said change your name in Hollywood Say, hide your head since they may think you're no good But I ain't ever changing what my mama gave me I'm gonna live my life the way God made me  Said the way God made me Yes, the way God me The way God me, the way God me Said the way God made me Yes, the way God me The way God me, the way God me  They say you don't look like what we want Do you want me to dye my hair platinum blonde But I ain't ever gonna change what my mama gave me I'm gonna live my life the way God made me  Said the way God made me Yes, the way God me The way God me, the way God me Said the way God made me Yes, the way God me The way God me, the way God me  So I will not throw away traditions 'Cause you lack in cultural visions I'm living my destiny the way God made me And I will not judge you 'cause you're different So my children see no difference This is our chance, chance to be free  Said the way God made me Yes, the way God me The way God me, the way God me Said the way God made me Yes, the way God me The way God me, the way God me  The way, said the way Yes, the way God me, the way God me Yes, the way God me, that's the way God me Yes, the way God me Yes, the way God me The way God me, the way God me Yes, the way God me"
/songs/3878017,MAGIC!,Things You Say,https://genius.com/Magic-things-you-say-lyrics,http://api.genius.com/songs/3878017,Expectations,2018-09-07," The things you say Could help me re-think every choice I ever made Turn my sunshine into dark and gloomy days But just to turn a phrase, oh no, yeah   The things you say Could take my broken, shattered, lonely melody And turn them into perfect dances, symphonies Shooting like the stars in the night sky Beautiful like heaven in daylight You got me hanging on to your every word So be careful with the things you say   The things you say Could have me questioning my own reality Turn my glory into jealousy and rage Oh the power of the things you say   The things you say Could take the sky to tired weakest parts of me And turn 'em into [?] I never [?] Breaking through the limits of my pride Sever me for reasons to not try Got me hanging onto your every word So be careful with the things you say   Everywhere, everywhere You say, you say Everywhere, everywhere You say, you say, you say   The things you say Can make me love you in the most amazing ways Or fill my heart with only loneliness and pain 'Cause I listen to the things you say"
/songs/1084945,MAGIC!,This Is Our Time (Agora É A Nossa Hora),https://genius.com/Magic-this-is-our-time-agora-e-a-nossa-hora-lyrics,http://api.genius.com/songs/1084945,"One Love, One Rhythm – The 2014 FIFA World Cup Official Album",None,"Agora é a nossa hora É mano, Brazil! There's a lot going on in the world today (Hey-ey) People moving so fast like an airplane (Hey-ey-ey) Madness in the air trying to chase the sun (Hey-ey)  I was thinking for tonight we can take you to the stars It doesn't matter where you're from It's all for one dream You never be the same Once you become a champion  So hey-ey, hey-ey This is our time Agora é a nossa hora Hey-ey, hey-ey This is our time Agora é a nossa hora  Surround yourself with the ones you love (Hey-ey come together) Hands up in the air to the sky above (Hey-ey, no matter the weather) No stress no pain in your heart tonight (Hey-ey) Let the strength inside you multiply (Don't you know, don't you know)  It doesn't matter where you're from It's all for one dream You'll never be the same Once you become a champion  So hey-ey, hey-ey This is our time Agora é a nossa hora Hey-ey, hey-ey This is our time Agora é a nossa hora  Can you feel it? (Whoa) Can you feel it hey-ey? (Whoa) Can you feel it? (Agora é a nossa hora) Can you feel it? (Whoa) Can you feel it hey-ey? (Whoa) Can you feel it? (Agora é a nossa hora)  So hey-ey, hey-ey This is our time Agora é a nossa hora Hey-ey, hey-ey This is our time Agora é a nossa hora  Saúde to my beautiful people Let us all unite Under one light, one light, Brazil!  Saúde to my beautiful people Let us all unite Under one light, one light, one light (Brazil, Brazil, Brazil)"
/songs/3877236,MAGIC!,When The Trust Is Gone,https://genius.com/Magic-when-the-trust-is-gone-lyrics,http://api.genius.com/songs/3877236,Expectations,2018-09-07," When the trust is gone (when the trust is gone) So is the love (so is the love), so is the love (so is the love) When the trust is gone, yeah (when the trust is gone) Nothing's enough (nothing's enough), oh, nothing's enough   I really hate the way you look at me lately It's like a stranger sitting right in my bed You built an invisible wall that surrounds me From every stupid little thing that I did   And I know that you want to be Closer to me, baby   But when the trust is gone (when the trust is gone) So is the love (so is the love), so is the love (so is the love) When the trust is gone (when the trust is gone) Oh, nothing's enough (nothing's enough), nothing's enough   And I know that you want to be Closer to me, baby   But when the trust is gone (is gone, is gone) Yeah, so is the love (is gone), so is the love When the trust is gone (is gone, is gone) Oh, nothing's enough (nothing's enough), nothing's enough   I really hate the way you look at me lately Oh no, when the trust is gone I really hate the way you look at me lately Oh no, when the trust is gone When the trust is gone When the trust is gone"
/songs/1730433,MAGIC!,You Ain't A Baller,https://genius.com/Magic-you-aint-a-baller-lyrics,http://api.genius.com/songs/1730433,No Limit All Stars: Who U Wit?,None,"(Magic & Master P) I'm just saying brah Can you palm the ball (Like this) But can you shoot the ball (All day) But can you dunk the ball (Like this) Basketball (That's good enough?) Ha ha ha ha  (Magic) Where the ballers at huh huh Where the ballers at huh huh Y'all where the ballers at Let's get ready to rumbbbbble! Cal, I want you to escort all the imposters off the floor  (Hook: Magic) I'll be done shot a three-pointer Whoosh! I done been slam dunked on ya You did a lot better on the corner Cause I can tell by your game, you ain't a baller uh I done be shot the three-pointer (Whoosh!) I done been slam dunked on ya You did a lot better on the corner Cause I can tell by your game you ain't a baller uh  (Magic} Well it's the first of the month and I just got paid So I'm trying to go home and catch a game on cable Something about the NBA keeps me watching Everytime I see em' play I'm hypnotized All that slam dunking, oops left em' in they shoes All night, got you feeling like you was born to lose It's going down, somebody going to be high tonight Dennis Rodman might fight tonight Somebody getting slammed on, so stop complaining Play the game like a man boy Is you mad cause you got, juke juked Somebody left you stuck in suspense Broke your confidence, got you looking for the bench While the world is watching you Alright moms, I had a bad game got dunked on about four times Better luck tomorrow But to beat this squad, you gots to be a baller, what  (Hook) (Magic) Who remembers Mo Cheeks, David Johnson Elvin Hayes and Bill Walton Ball handling from the Earl the Pearl And the three-point shots from Larry Bird Check out passes passed from Pistol Pete And the way Dr. J made everything look so sweet What about the tower called Wilt Chamberlain And Kareem, got us in the game again Bill Russell, won eleven NBA championships Walt Frazier, he could be better known as a pimp Elgin Baylor, made shooting three-pointers look easy Magic Johnson, in my opinion there was no better leading Michael Jordan, he's amazing how does he jump so far No matches perfect, so I think he might be from the planet Mars And to you upcoming stars, you know who you are Feel blessed and thank the Lord that you's a baller  (Hook x2) (Magic) Where the ballers at huh huh Where the ballers at what what Where the ballers at huh huh Where the ballers at what what Where the ballers at huh huh Where the ballers at what what Where the ballers at huh huh Where the baller at whatttttt!"
