api_path,primary_artist,title,url,song_endpoint,album,release_date,lyrics
/songs/3877237,MAGIC!,A Little Bit Of Love,https://genius.com/Magic-a-little-bit-of-love-lyrics,http://api.genius.com/songs/3877237,Expectations,2018-09-07," Come on, come on, this isn't right This ain't the way you live a life This ain't the way you sacrifice Come on, come on Hold on, hold on but don't forget These [?] you got across the chest And darkness and light [?] We'd hold on, hold on (it's not over yet)   With a little bit of love, we can heal the pain and mend the distance With a little bit of love, we can breathe again With a little bit of love, we can fill the emptiness in our hearts With a little bit of love, we could feel again   With a little bit of love With a little bit of love With a little bit of love With a little bit of love   Come on, come on, it's not too late This ain't the time to separate This is a chance to elevate Come on, come on Hold on, hold on and don't you go I don't believe we've lost it all There is a chance to get back home Hold on, hold on ('cause you're not alone)   With a little bit of love, we can heal the pain and mend the distance With a little bit of love, we can breathe again With a little bit of love, we can fill the emptiness in our hearts With a little bit of love, we could feel again   With a little bit of love With a little bit of love With a little bit of love With a little bit of love   You and me, don't you know we can be Better than this (so much better than this) Darling, you and me, don't you know we can be Happier than this You and me, don't you know we can be Better than this (so much better than this) You and me, don't you know we can be Happier than this   With a little bit of love With a little bit of love With a little bit of love With a little bit of love"
/songs/3877231,MAGIC!,Appreciate You,https://genius.com/Magic-appreciate-you-lyrics,http://api.genius.com/songs/3877231,Expectations,2018-09-07," Ooh-ooh-ooh Ooh-ooh-ooh   See, we all need to be loved A human needs to be loved There's no gift I can buy That could make you feel that kind of high That lifts your heart So we all want to feel special (special) Truly, deeply special (special) There's no words I can say That will deeply, truly compensate So here's where I'll start   Just want you to know that I appreciate you I don't always show it but I swear that it's true See, I love the beautiful things I know that you do (you do) Just want you to know that I appreciate you   I recognize your strength (I recognize your strength) Your confidence style in place (your confidence style in place) Oh darling, without you near (without you near) I'd be a mess right now, it's clear, so clear, so clear   Just want you to know that I appreciate you I don't always show it but I swear that it's true All of the beautiful things I know that you do (you do) Said, I want you to know that I appreciate you   Tomorrow, nobody knows What may not come or go Just in case we divide on this winding road I need you to know   Said, I need to know (that I appreciate you) I don't always show it (but I swear that it's true) All of the beautiful things I know that you do (you do) Just want you to know that I appreciate you   Said I do, I do, I do (I do, I do, I do), oh-oh-oh And I do, I do, I do (I do, I do, I do) No matter where I'll go or what'll do (I do) I will appreciate you   Ooh-ooh-ooh Ooh-ooh-ooh Ooh-ooh-ooh Ooh-ooh-ooh"
/songs/3877229,MAGIC!,Core,https://genius.com/Magic-core-lyrics,http://api.genius.com/songs/3877229,Expectations,2018-09-07," And I know we said, one more fight and we separate And I know we said, can't keep living our lives this way And I know we made ten-thousand other real promises But what we said, it's easier said than done   'Cause I don't wanna give up any more Even though you're standing at the door I'm saving numbers, never know for sure Darling, I just feel it, feel it   I feel it in my core My core, my core Just like I did before, before In my core Don't give up now   I feel it in my core, my core My core, my core   And I know they say, never let go the past ol' pain And I know they say, life is a little too short to waste And I know I say, I don't give a damn about what they say 'Cause luck can change even the brightest smiles   'Cause I don't wanna give up any more Even though you're standing at the door I'm saving numbers, never know for sure Darling, I just feel it, feel it   I feel it in my core My core, my core Just like I did before, before In my core Don't give up now   Said I feel it in my core, my core My core, my core (don't you feel it in your core?) My core, my core (don't you feel it in your core?)   And I know we said, one more fight and we separate And I know we said, can't keep living our lives in pain But you want to take that first step out the door I hope you feel the same way as me in your core Your core"
/songs/2714741,MAGIC!,Dance Monkey,https://genius.com/Magic-dance-monkey-lyrics,http://api.genius.com/songs/2714741,Primary Colours,2016-07-01," I was in the wild Living life from tree to tree So I learned a simple song And sang it in a jamboree   And the people came and cheered Thought that I was finally free Till they sold me to a man That had another plan for me   He said dance monkey, dance (Dance monkey) Play that song I know, oh, oh He said dance monkey, dance (Dance monkey) In this yellow coat   Dance, dance, dance monkey Dance, dance, dance monkey Dance, dance, dance monkey   Saved up just enough Enough to buy a new guitar And I wrote a simple song An honest message from my hear   When I sang it to the crowd It was not the same applause I could hear them screaming out You know what we came here for   They said dance monkey, dance (Dance monkey) Play that song I know, oh, oh They said dance monkey, dance (Dance monkey) In your flower coat   Dance, dance, dance monkey Dance, dance, dance monkey   It doesn't matter what the people say You can take my house way Cause I know that I'll never be no Dance, dance, dance monkey It doesn't matter what the people say You can take my house way Cause I know that I'll never be no Dance, dance, dance monkey"
/songs/3280146,MAGIC!,Darts In the Dark,https://genius.com/Magic-darts-in-the-dark-lyrics,http://api.genius.com/songs/3280146,Expectations,2017-10-20," I don't know the way back to the place where our love lies Blindfolded, it feels, when we try to see out to the sunlight   I used to love with my eyes closed But now it seems that we just keep   So we just keep dancing around every day And we just keep playing the same guessing games And we both know we'll never go back to the start If we just keep throwing darts in the dark   Darts in the dark I don't know the way back to your heart I don't know the way back to the dark   I remember you, I just cannot seem to find your love 'Cause lately, darling, darkness is the moon between us   I used to love with my eyes closed But now it seems that we just keep   So we just keep dancing around every day And we just keep playing the same guessing games And we both know we'll never go back to the start If we just keep throwing darts in the dark   Darts in the dark I don't know the way back to your heart I don't know the way back to the dark   Throwing darts in the dark, somebody's gonna get hurt Throwing darts in the dark, only gonna make things worse I will never find the center of your heart If I keep throwing darts in the dark, throwing darts in the dark   my heart Darts in the dark I will never find the center of your heart If we don't stop, if we don't stop shooting darts in the dark I will never find the center of your heart I will never find the center of your heart"
/songs/1064923,MAGIC!,Don't Kill the Magic,https://genius.com/Magic-dont-kill-the-magic-lyrics,http://api.genius.com/songs/1064923,Don't Kill The Magic,2014-04-04,"If you want space (you could have it) If you want change (you could have it) Sleep on your bed (you could have it) Pull it to my head (you could have it)  If you want love (you could have it) The way that you love (you could have it) If you want time (you could have it) I'll tell you no lie (you could have it)  Just don't kill, don't kill the magic Just don't kill, don't kill the magic I'm not ready to give up just yet We could stay until we both forget So baby, don’t kill (don't kill) Don't kill the magic  If you want space (you could have it) If you want change (I'll make it drastic) Sleep on your bed (I'll be your mattress) Pull it to my head (you could blast it)  Ohhh, if you want love (I'll be tragic) The way that you love (I can match it) If you want time (I'll be elastic) And tell you no lie (You can have it) No lie  Just don't kill, don't kill the magic Just don't kill, don't kill the magic I'm not ready to give up just yet We could stay until we both forget So baby, don't kill (don't kill) Don't kill the magic  Take my arms, take my legs, take my vision Take my tongue, take my lungs, if you need it Hold my knees, hold my knees, hold my knees, I beg Hey  You know I said I'm trying fix this baby Let me be in my heart god's pleasure I will do, I will do anything instead  Just don't kill, don't kill the magic Just don't kill, don't kill the magic I'm not ready to give up just yet We could stay until we both forget So baby, don't kill (don't kill) Don't kill the magic  You could have it You could have it You could have it You could have it You could have it You could have it"
/songs/3875955,MAGIC!,Expectations,https://genius.com/Magic-expectations-lyrics,http://api.genius.com/songs/3875955,Expectations,2018-08-02," Expectations (expectations) Can make you believe (can make you believe) That what you desire (what you desire) Is what you need   And I'm thinking What if we just stop livin' in the moment? And I'm thinking And maybe we both will be way less disappointed   From all these e-e-e-e-e-expectations E-e-e-e-e-expectations So many e-e-e-e-e-expectations E-e-e-e-e-expectations, yeah   Expectations (expectations) Babe, I know you don't mean (said I know you don't mean) To make small situations (make small situations) Bigger than they should be, than they should be   And I'm thinking What if we just stop living in the present? And I'm thinking And maybe we both will be way less disconnected   From all these e-e-e-e-e-expectations E-e-e-e-e-expectations So many e-e-e-e-e-expectations E-e-e-e-e-expectations   I cannot read your mind and I don't want to I cannot read your mind and I don't want to I cannot read your mind and I don't want to I cannot read your mind and I don't want to So many e-e-e-e-e-expectations"
/songs/3877232,MAGIC!,Eyes Don't Tell Lies (Interlude),https://genius.com/Magic-eyes-dont-tell-lies-interlude-lyrics,http://api.genius.com/songs/3877232,Expectations,2018-09-07," Eyes, eyes, eyes, eyes, eyes, eyes Eyes, eyes, eyes, eyes, eyes, eyes Eyes, eyes, eyes, eyes, eyes, eyes Don't tell lies, don't tell lies Bear with your mind's correction But that doesn't make it more convincing Every word just sounds like fiction 'Til I see it in those eyes"
/songs/2714739,MAGIC!,Gloria,https://genius.com/Magic-gloria-lyrics,http://api.genius.com/songs/2714739,Primary Colours,2016-07-01," Gloria   My friends told me not to trust that Gloria She’s got ill intentions right from the start I said you don’t understand my Gloria Complicated yes, but pure at the heart Today I  came home a little early To find a stranger in my bed And I said...   Gloria Why do you play with me? If  I’m the only one Then who the hell is he? Did you have sex all day? Just to tease me all night Whoa oh-oh, Gloria Can you just tell me why?   Why? Gloria, why? Gloria, why? Gloria, why?   I decided to forgive my Gloria Said she would never do it again So I went on a ten day cruise with Gloria Hoping to get back to where we began Then one night I came back with some red wine Just to find two sailors in my bed And I said...   Gloria Why do you play with me? If I ’m the only one Then who the hell is he? Did you have sex all day? How could I be so blind? Whoa oh-oh gloria Can you just tell me why?   Why? Gloria, why? Gloria, why? Gloria, why?   Why, why, why, why? Woo, woo, woo, woo My friends told me not to trust that Gloria She’s got ill intentions right from the start    Gloria Why do you play with me? (Said, why do you play with me?) If I'm the only one Then who the hell is he? (Said, who the hell is he?) Did you have sex all day? (Can you just tell me?) How could I be so blind? (Can you just tell me?) Whoa oh-oh gloria Can you just tell me why?   Why? Gloria, why? Gloria, why? Gloria, why? Gloria, why? Gloria, why? Gloria, why? Gloria, why? Gloria, why? Gloria, why? Gloria, why? Gloria, why? Gloria, why?"
/songs/2714737,MAGIC!,Have It All,https://genius.com/Magic-have-it-all-lyrics,http://api.genius.com/songs/2714737,Primary Colours,2016-07-01," It’s a mystery, our destiny Like a caveman and technology Like an alien from outer space Are they really green? We’ll find out one day   So you and me don't have to You and me don't have to You and me don't have to know it all As long as we can stay true As long as we can stay true As long as love don't change We can have it all   Misunderstood, the human heart It can fill you up, it can fall apart So I will try with every beat To love you with the best of me   So you and me don't have to You and me don't have to You and me don't have to know it all As long as we can stay true As long as we can stay true As long as love don't change We can have it all   It’s a mystery, our destiny Like a caveman and technology   So you and me don't have to You and me don't have to You and me don't have to know it all As long as we can stay true As long as we can stay true As long as love don't change We can have it all"
/songs/1369348,MAGIC!,How Do You Want to Be Remembered,https://genius.com/Magic-how-do-you-want-to-be-remembered-lyrics,http://api.genius.com/songs/1369348,Don't Kill The Magic,2014-06-30,"How do you want to be remembered? As a sinner or a saint, as a hero or a villain? Think about the steps you take How do you want to be remembered When they're standing at your grave? On your tombstone, what is written? Think about the steps you take  All my life I've been searching for the answers How did I lose so much of the things that really matter? Is there no paradise, cause I feel no joy or laughter Seems everything I touch only turns into disaster So I ask myself...  How do you want to be remembered? As a sinner or a saint, as a hero or a villain? Think about the steps you take How do you want to be remembered When your children come to aid And they need some inspiration? Think about the steps you take  Do I reach for love (do I reach for love) only when she says she's leaving? (only when she says goodbye) Do I pray above (do I pray above) only when I feel I'm needing? See I can't sleep at night, when my sheep turn into demons There's no alibi when the jury knows your secret So I ask myself...  How do you want to be remembered? As a sinner or a saint, as a hero or a villain? Think about the steps you take How do you want to be remembered When your children come to aid And they need some inspiration? Think about the steps you take  Cause on the day when you face judgement You better have your story straight (you better have your story straight) Were you a good friend and a husband To the wife that gives you love, love, love You love, love, love, oh  How do you want to be remembered? As a sinner or a saint, as a hero or a villain? Think about the steps you take How do you want to be remembered When they're standing at your grave? On your tombstone, what is written? Think about the steps you take  How do you want to be remembered? How do you want to be remembered? Think about the steps you take How do you want to be remembered? How do you want to be remembered?"
/songs/3877235,MAGIC!,How You Remember Me,https://genius.com/Magic-how-you-remember-me-lyrics,http://api.genius.com/songs/3877235,Expectations,2018-09-07," She says she loves another Says she loves another man Ooh, and she says she wants to see him Says she wants to see him again She says she looks at me with love Every time if that's what you have I said I know the one you're talking about He's not coming back   'Cause I will never be How you remember me (how you remember me) No, I will never be How you remember me (how you remember me) And you can only see The man I have come to be (man I have come to be) 'Cause I'll never be How you remember me (how you remember me)   I saw you from the mirror, staring at a photograph Ooh, and something about that moment Always seems to make you laugh I know that I joke a little less than I did It seems some days I left and I just cannot forget We cannot move forward if you're stuck in the past (Darling, come back)   'Cause I will never be How you remember me (how you remember me) No, I will never be How you remember me (how you remember me) And you can only see The man I have come to be (man I have come to be) 'Cause I will never be How you remember me (how you remember me)   And you can only see, and you can only see What I've come to be And you can only see, and you can only see What I've come to be On your heart, it isn't easy And I'm sorry if you've been flirting or you've been sneezing If I'm changing, then I'm changing for a reason I need just your heart   And it's not what you expected But at least my love for you is still protected You're the only one that I have not rejected But you'll never be the way you remember me"
/songs/2714743,MAGIC!,I Need You,https://genius.com/Magic-i-need-you-lyrics,http://api.genius.com/songs/2714743,Primary Colours,2016-07-01," I think it's time to come home Been in this desert too long Thought I could make it without it But now I forever know that I need you   I need you, I need you I need you like my last drop of water I need you, I need you, I need you, oh   I cannot change who I am And I might mess this up again But I'll live in vain here without you My heart is taking a stand cause I need you   I need you, I need you I need you like my last drop of water I need you, I need you, I need you, oh   I need you, I need you I need you like my last drop of water Said I need you, said I need you, I need you Come on, said I need you, I need you  [Outro I'm coming home, I'm coming home today I'm coming home"
/songs/2821686,MAGIC!,I Would,https://genius.com/Magic-i-would-lyrics,http://api.genius.com/songs/2821686,Don't Kill The Magic,2014-06-30," I know a girl Halfway around the world She's been feeling lost and alone No place to call her own All she ever wanted was peace Caught in a family Tell me how we got so cold Only heaven knows   If I could sail above the ocean On a spaceship made of faith Up on a two way trip to heaven To rearrange our destiny   You know I would I would I would I would I would You know I would I would I would I would I would, hey You know I would I would I would I would I would You know I would I would I would I would I would   I know a boy Lost all of the joy Living in the shadows of fear With the devil in his ear All he ever wanted was peace Caught in a family Tell me how we got so cold Only heaven knows   If I could sail above the ocean On a spaceship made of faith Up on a two way trip to heaven To rearrange our destiny   You know I would I would I would I would I would You know I would I would I would I would I would, hey You know I would I would I would I would I would You know I would I would I would I would I would   If I could sail above the ocean On a spaceship made of faith Up on a two way trip to heaven To rearrange our destiny Oh, if I could jump in the DeLorean And go back to yesterday You know I'll change how the story ends And you'll be right here next to me   You know I would I would I would I would I would You know I would I would I would I would I would You know I would I would I would I would I would You know I would I would I would I would I would You know I would I would I would I would I would You know I would I would I would I would I would You know I would I would I would I would I would You know I would I would I would I would I would You know I would"
/songs/3768662,MAGIC!,Kiss Me,https://genius.com/Magic-kiss-me-lyrics,http://api.genius.com/songs/3768662,Expectations,2018-06-08," Kiss me darling, a-one more time With everything that you've got inside Kiss me darling, a-one more time 'Cause love's the only thing we leave behind   I've been thinking about my life a lot these days As I'm stumbling through the paths that I have made Wondering where did I put my time and energy 'Cause what I wanted, girl, means nothing now to me   I want to share with you, I want to bear with you I want to care for you, I want to be there for you I want to stare at you like nobody's there but you So hurry up, hurry up   Kiss me darling, a-one more time With everything that you've got inside Kiss me darling, a-one more time 'Cause love's the only thing we leave behind   Said I've been thinking about my life for all these nights As I'm wishing on the stars up in the sky Wondering where does our love fit in this design Did I constellate your light right next to mine?   I want to share with you, I want to bear with you I want to care for you, I want to be there for you I want to stare at you like nobody's there but you So hurry up, hurry up   Kiss me darling, a-one more time With everything that you've got inside Kiss me darling, a-one more time 'Cause love's the only thing we leave behind   Kiss me darling, a-one more time Kiss me darling, a-one more time Kiss me darling, a-one more time Said kiss me, yeah, kiss me, darling Kiss me darling, a-one more time 'Cause it feels so right Kiss me darling, a-one more time I want to feel it Kiss me darling, a-one more time I want to feel it"
/songs/2444693,MAGIC!,Lay You Down Easy,https://genius.com/Magic-lay-you-down-easy-lyrics,http://api.genius.com/songs/2444693,Primary Colours,2016-03-25," I'm trying to lay you down easy Check me out, girl I'm at the magic floor; check my world   Now I know you don't believe me when I say I do it right (trust me) My confidence is peaking to be close to you tonight Baby, this is human nature; let's turn up that guitar (guitar!) Smoke a little vapor and stay up til the sun   I'm trying to lay you down easy (La la la la la la lay you down easy, eh, yeah) So love, I'm trying to lay you down easy (follow me, girl) (L-l-lay, la la la la lay you down easy) Yeah B-b-bang, bang, bang, bang  [Verse 2: MAGIC! & Sean Paul] Now I know you don't believe me when I say I mean no harm (no harm) Uncertainty is fleeting; I'm inspired by your charm (haha) (inspired by your charm) Imagine how I'm feeling falling inches from your grace I feel like Robert Marley got me waitin' here in vain Said I'm...   I'm trying (please, gyal) to lay you down easy (La la la la la la lay you down easy, eh, yeah) (B-b-bang, b-b-bang) So love, I'm trying to lay you down easy (La la la la la la lay you down easy) Yeah (B-b-bang, bang, bang, bang, yeah)   Baby girl, don’t ya know that’s my style? Easy breezy, mi gi yo all the while Rub-a-dub-ah, we ah dance all night Lovin' that shape, I'ma love your profile Gyal, your body so hot; number one for my clock And you, my bod tick with the night I want you rub up on me, you’re insane, I’m magic Love how you keep it tight   I'm trying to lay you down easy (follow me, girl) (La la la la la la lay you down easy, eh, yeah) So love, I'm trying to lay you down easy (follow me, girl) (La la la la la la lay you down) Yeah (Bang bang, yeah, eh)   Lay you down, lay you down easy (lay you down easy) Lay you down, lay you down easy (lay you down, lay you down, baby girl) Lay you down, lay you down easy (lay you down easy) Lay you down, lay you down easy (lay you down, lay you down, baby girl)"
/songs/476683,MAGIC!,Let Your Hair Down,https://genius.com/Magic-let-your-hair-down-lyrics,http://api.genius.com/songs/476683,Don't Kill The Magic,2014-06-30," There she goes, there she goes, there she goes There's nothing better than my beautiful woman Even though, even though, even though It's not always Heaven, we still fly together   To me you are more than just skin and bones You are elegance and freedom and everything I know So come on and   Baby let your hair down, let me run my fingers through it We can be ourselves now, go ahead be foolish No one's on the clock now, lying in this simple moment You don't gotta worry now, just let your hair down   Tell me when, tell me when, tell me when I can steal a sweet kiss right from you I'm diving in, I'm diving in, I'm diving in The water's warm right here       You don't have to worry, yeah, oh Let your hair down, woah It's only us here, only us here, only us here (x3)"
