api_path,primary_artist,title,url,song_endpoint,album,release_date,lyrics
/songs/1276633,MAGIC!,Little Girl Big World,https://genius.com/Magic-little-girl-big-world-lyrics,http://api.genius.com/songs/1276633,Don't Kill The Magic,2014-06-30,"I know you're coming from another generation. (What?) Cause you can see no demons in my conversation. (What?) It's on me that I lack communication. (Whoa, oh oh oh) I cannot offer you a diamond or a mortgage. (What?) All I wanted was a home-cooked sandwich (What?) But your greedy little fingers couldn't manage (No, oh oh oh)  Long live the queen of all exaggeration, long live the queen Cause you're just a little girl in a big, big, big, big world Let it do, let it do, let it do, do You're just a little girl in a big, big, big, big world Let it do, let it do, let it do, do Let it do, let it do, let it do, do  You're sleeping every day for twenty-seven hours (What?) Get a real job, baby take a shower (Whoa) (Whoa, oh oh oh) Parking ticket on your car is not an issue (What?) Why you screaming on the corner like they hit you? (What?) Sweetheart, don't you know I'm trying to fix you? (Whoa, oh oh oh)  Long live the queen of all exaggeration, long live the queen Cause you're just a little girl in a big, big, big, big world Let it do, let it do, let it do, do You're just a little girl in a big, big, big, big world Let it do, let it do, let it do, do Let it do, let it do, let it do, do  If I was your father I would lock you up inside of your room Until you figure out exactly how to think of someone but you If I was your father I would spank you 'til you know what you did Let it do, let it do Let it do, let it do, let it do, let it do do Long live the queen of all exaggeration, long live the queen Cause you're just a little girl in a big, big, big, big world Let it do, let it do, let it do, do You're just a little girl in a big, big, big, big world Let it do, let it do, let it do, do Let it do, let it do, let it do, do Let it do, let it do, let it do, do Let it do, let it do, let it do, do"
/songs/887222,MAGIC!,Mama Didn't Raise No Fool,https://genius.com/Magic-mama-didnt-raise-no-fool-lyrics,http://api.genius.com/songs/887222,Don't Kill The Magic,2014-06-30,"Mama says, ""Love is once in a lifetime How you gonna find love at Nights for the one time?"" See the thing about me, it's just not the right time Mama says, ""Son, you can't fight the sunshine""  I did not come here tonight To be struck by your light But here I stand in your glow Should I stay? Should I go?  I wanna run, I wanna run from you But mama didn't raise no fool Mama didn't raise no fool (no fool) I wanna run, I wanna run from you But mama didn't raise no fool Mama didn't raise no fool (no fool)  Mama says, ""Lately I don't recognize you But if this is who you wanna be you've got the right to"" (You buried your heart so guilt could never find you) But mama says, ""Love will find the boy that I knew""  I did not come here tonight To be brought back to life But here I stand in my grave Second chance is your name  I wanna run, I wanna run from you But mama didn't raise no fool Mama didn't raise no fool (no fool) I wanna run, I wanna run from you But mama didn't raise no fool Mama didn't raise no fool (no fool)  I loved you since I said, ""Hello"" I need you much more than I know I did not come here tonight To be struck by your light But here I stand in your glow Should I stay? Should I go?  I wanna run, I wanna run from you But mama didn't raise no fool Mama didn't raise no fool (no fool) I wanna run, I wanna run from you But mama didn't raise no fool Mama didn't raise no fool (no fool)  Mama didn't raise, mama didn't raise, no Mama didn't raise no fool Mama didn't raise, mama didn't raise, no Mama didn't raise no fool Mama didn't raise, mama didn't raise, no Mama didn't raise no fool Mama didn't raise, mama didn't raise, no Mama didn't raise no fool  Mama didn't raise, mama didn't raise, no Mama didn't raise no fool Mama didn't raise, mama didn't raise, no Mama didn't raise no fool Mama didn't raise, mama didn't raise, no Mama didn't raise no fool Mama didn't raise, mama didn't raise, no Mama didn't raise no fool"
/songs/3877230,MAGIC!,More Of You,https://genius.com/Magic-more-of-you-lyrics,http://api.genius.com/songs/3877230,Expectations,2018-09-07," I stare at you, sometimes at night Wishing I could just press rewind 'Cause I just want more I get confused, sometimes my skin Can't tell where yours stops and mine begins In anything, and I just want more   More of your days More of your nights More of your wrongs More of your rights Whatever you got, I'll take two I just want more, more of you Ooh, more of you Ooh   What is this hold you got on me? Stronger force than gravity 'Cause I just want more 'Cause I could spend centuries beside you, behind you Inside you, forever love It's not enough, I just want more   More of your days More of your nights More of your dark More of your light If you had a clone, I would love her too I just want more, more of you I just want more, more of you Ooh, more of you Ooh   More of your days More of your nights More of your dark More of your light Whatever you got, darling give me two I just want more, darling, more of you   More of your laughs More of your cries More of that wisdom That lives in your eyes In my next life, I'll be looking for you 'Cause I just want more, more of you Ooh, more of you Ooh, more of you   Ooh"
/songs/3877233,MAGIC!,Motions,https://genius.com/Magic-motions-lyrics,http://api.genius.com/songs/3877233,Expectations,2018-08-31," Every day, the same routine Operating like machines On and on we live this way With no spontaneity   What happened to the wild ones? No sense of the hours What happened to the freedom? Can we get that back?   So we're going, going through the motions We're just going, going through the motions We used to live like waves in the oceans Now we're going, going through the motions   What if I said, ""Let's run away""? A one-way ticket to an exotic place Dance and scream and shout in the pouring rain Find serenity in the great escape   What happened to the wild ones? No sense of the hours What happened to the freedom? Can we get that back?   'Cause we're going, going through the motions We're just going, going through the motions We used to live like waves in the oceans Now we're going, going through the motions   I can't keep going, I can't keep going I can't keep going, I can't keep going I can't keep going, I can't keep going I can't keep going, I can't I can't, I can't, I can't   Said, I can't keep going, going through the motions You can't keep going, going through the motions We used to live life with so much emotion Can't keep going, going through the motions"
/songs/476674,MAGIC!,No Evil,https://genius.com/Magic-no-evil-lyrics,http://api.genius.com/songs/476674,Don't Kill The Magic,2014-06-30," Woke up in the morning to another perfect stranger Jumped into the shower to wash off the situation I can't tell the difference if I'm crying or it's raining Either way I know that there is something in the changes   And all I could think of is you in that sundress And if there's a chance to be with you I promise   That I will speak no evil And I will see no darkness And I will only only hear your voice 'Til the demons go back to where they belong (Speak no, see no, hear no evil) 'Til the demons go back to where they belong (Speak no, see no, hear no evil)   Can you take me somewhere where the devil cannot find us Rid me of the poison that has only paralyzed us I don't want to waste another moment here without love And I hope there's still a space in your heart for me   And all I could think of is you in that sundress And if there's a chance to be with you I promise  That I will speak no evil And I will see no darkness And I will only only hear your voice 'Til the demons go back to where they belong (Speak no, see no, hear no evil) 'Til the demons go back to where they belong (Speak no, see no, hear no evil)  (oh,oh, no evil) (oh,oh, no evil) (oh,oh, no evil)   And all I could think of is you in that sundress And if there's a chance to be with you I promise  That I will speak no evil And I will see no darkness And I will only only hear your voice 'Til the demons go back to where they belong (Speak no, see no, hear no evil) 'Til the demons go back to where they belong (Speak no, see no, hear no evil)   Oh, put on your sundress and meet me in the sunshine Oh, put on the sundress and meet me in the sunlight (Speak no, see no, hear no evil) No evil, woah (Speak no, see no, hear no evil)"
/songs/2714740,MAGIC!,No Regrets,https://genius.com/Magic-no-regrets-lyrics,http://api.genius.com/songs/2714740,Primary Colours,2016-07-01," The world isn't over yet We've still got a chance to place our bets We both made a little mess Nothing our two hearts can't put back I'll never love you less Don't let your worries second guess Let's start over fresh, living a life with no regrets Living a life with no regrets   I've got my issues, I admit that You got some things that hold you back But we are acting like we're children Looking to blame for what we lack   Before we lose everything we have tomorrow Can we forget what went wrong yesterday   The world isn't over yet We've still got a chance to place our bets We both made a little mess Nothing our two hearts can't put back I'll never love you less Don't let your worries second guess Let's start over fresh, living a life with no regrets Living a life with no regrets   I know you're driving yourself crazy Thinking that time has passed you by And you're not close to where you said you'd be But tell me, who is in this life?   Before we lose everything we have tomorrow Can we forget what went wrong yesterday? So darling   The world isn't over yet We've still got a chance to place our bets We both made a little mess Nothing our two hearts can't put back I'll never love you less Don't let your worries second guess Let's start over fresh, living a life with no regrets Living a life with no regrets   The world isn't over We could always start over No weight on our shoulders The world isn't over, darling The world isn't over We could always start over No weight on our shoulders The world isn't over, darling"
/songs/2714742,MAGIC!,No Sleep,https://genius.com/Magic-no-sleep-lyrics,http://api.genius.com/songs/2714742,Primary Colours,2016-07-01," I get no sleep, I get no sleep I get no sleep, I'm wide awake I get no sleep, I get no sleep I get no sleep, I'm wide awake   It's four o'clock in the morning I can't sleep cause the dog keeps snoring And then the baby starts crying Waking up my girl, she's trying to get a couple hours in Before we gotta make them breakfast Then rush to the school again, every damn day   And I get no sleep, I get no sleep I get no sleep, I'm wide awake I get no sleep, I get no sleep I get no sleep, I'm wide awake   Two kids and a mortgage We had to put our old life in storage Our single friends don't call us Cause we'd rather grab drinks at Starbucks   We go to the zoo a lot We've watched every Disney movie We love everything we got But I swear these days   That all I wanna do is lie in bed with you   But no, I get no sleep, I get no sleep I get no sleep, I'm wide awake I get no sleep, I get no sleep I get no sleep, I'm wide awake I said I get no sleep   I get no sleep, I get no sleep I get no sleep, I'm wide awake I get no sleep, I get no sleep I get no sleep, I'm wide awake"
/songs/722661,MAGIC!,No Way No,https://genius.com/Magic-no-way-no-lyrics,http://api.genius.com/songs/722661,Don't Kill The Magic,2014-06-03," Hey baby, baby Your heart's too big to be treated small So please don't blame me, blame me For trying to be the one who could have it all And I know they've been stupid, stupid Telling you it's dark when you see the light And I know you ain't foolish, foolish Just give me one chance, I could treat you right So I say...   Will I ever be too far away when you feel alone? No way, no Will I ever back down my sword to protect our home? No way, no Will I ever spend a day not telling you you're beautiful? No way, no No way, no way, no No way, no way, no   My sister, sister told me that ""If love ever hits your eye I promise you'll miss her, miss her The second that she walks right out of your sight"" So we should just do it Cause I don't wanna risk her being right Let's not be foolish Don't you know that family never lies? I promise that...   Will I ever be too far away when you feel alone? No way, no Will I ever back down my sword to protect our home? No way, no Will I ever spend a day not telling you you're beautiful? No way, no No way, no way, no No way, no way, no   Hey lady, lady Life's too short to be waiting long So let's not waste it, waste it When we both know you're the one   Will I ever be too far away when you feel alone? No way, no Will I ever back down my sword to protect our home? No way, no Will I ever spend a day not telling you you're beautiful? No way, no No way, no way, no No way, no way, no   No way, no way, no No way, no way, no No way, no way, no No way, no way, no No way, no way, no No way, no way, no No way, no way, no No way, no way, no No way, no way, no No way, no way, no No way, no way, no No way, no way, no No way, no way, no No way, no way, no No way, no way, no No way, no way, no No way, no way, no No way, no way, no No way, no way, no No way, no way, no No way, no way, no No way, no way, no No way, no way, no No way, no way, no No way, no way, no No way, no way, no No way, no way, no No way, no way, no No way, no way, no No way, no way, no No way, no way, no No way, no way, no"
/songs/1427982,MAGIC!,One Woman One Man,https://genius.com/Magic-one-woman-one-man-lyrics,http://api.genius.com/songs/1427982,Don't Kill The Magic,2014-06-30,"I am a sinner, as cold as the winter She is the sun, she is the queen of love I am a burden, always uncertain She is a raft, only believes in us  And I know that she cries by the red in her eyes She's been waiting for signs that never come All she ever really wanted was...  One woman, one man That's all that she asks No other demands One woman, one man, yeah  I am a loser, I only confuse her She is the sail, no matter where we go Tradition innovates passed down The way I live is for tonight Oh I wish it wasn't so (Lord I wish it wasn't so)  I know that she cries by the red in her eyes She's been waiting for signs that never come All she ever really wanted was...  One woman, one man That's all that she asks No other demands One woman, one man, yeah  One woman, one man That's all that she asks  One woman, one man..."
/songs/1018772,MAGIC!,Paradise,https://genius.com/Magic-paradise-lyrics,http://api.genius.com/songs/1018772,Don't Kill The Magic,2014-06-30,"Once upon a time a lonely boy with vision (vision) Heard about a little mermaid cast away (cast away) Saw a little bitty fin and started swimming (swimming) She disappeared with the sunlight once again (once again)  He prayed unto his father As his lungs filled up with water  Oh won't you take me to your paradise? (I wanna go) Can I come play with you under the tide? (I wanna go) I want to swim inside your ocean eyes (I wanna go) Oh won't you take me to your paradise? (I wanna go)  When he woke up on the dry-land he saw visions (visions) Of the life with the mermaid cast away (what a life, what a life it would be) Couldn't tell if it was love or just impatience (patience) Headed back with the black sun hits the waves (hits the waves)  And there she was in color And with all his strength he called her  Oh won't you take me to your paradise? (I wanna go) Can I come play with you under the tide? (I wanna go) I want to swim inside your ocean eyes (I wanna go) Oh won't you take me to your paradise?  Please don't drift away Please don't drift away Please don't drift away Please don't drift away Please don't drift away Please don't drift away  Oh won't you take me to your paradise? (I wanna go) Can I come play with you under the tide? (I wanna go) I want to swim inside your ocean eyes (I wanna go) Oh won't you take me to your paradise?  Oh won't you take me to your paradise? (I wanna go) I've got to be with you, I don't know why (I wanna go) Oh won't you take me to your paradise? (I wanna go) I've got to be with you, I've got to be with you (I wanna go, I wanna go) Paradise, paradise, paradise, paradise (I wanna go) Paradise, paradise, paradise, paradise Paradise, paradise, paradise, paradise Paradise, paradise, paradise, paradise"
/songs/2714744,MAGIC!,Primary Colours,https://genius.com/Magic-primary-colours-lyrics,http://api.genius.com/songs/2714744,Primary Colours,2016-07-01," Your fuchsia’s confusion Your teal is unclear Your aqua’s a hard one To read, yes I feel You’re painting the future So far from the past Can we get back to basics To make this thing last   Back to the primary colors So we can blend together again Back to the primary colors A little blue, yellow and red Back to the primary colors So we can blend together again Back to the primary colors A little blue, yellow and red   Your violet is silent Your beige is a maze Your canary is scary So much I can’t take Creative evolution You’re moving too fast Can we count a little one, two, three To make this thing last   Back to the primary colors So we can blend together again Back to the primary colors A little blue, yellow and red Back to the primary colors Back to the primary colors Don’t want to confuse you You know that I choose you But before I lose you Can we go back Back to the primary colors So we can blend together again Back to the primary colors A little blue, yellow and red   Red, red, red, red, red, red, red Blue, yellow and red Red, red, red, red, red, red, red Blue, yellow and red Red, red, red, red, red, red, red Blue, yellow and red Red, red, red, red, red, red, red Back to the primary colors Back to the primary colors The one;s that confuse you Enough that I choose you Before I lose you Please come back   Back to the primary colors So we can blend together again Back to the primary colors A little blue, yellow and red Back to the primary colors Back to the primary colors Don’t want to confuse you You know that I choose you But before I lose you Can we go back Back to the primary colors So we can blend together again Back to the primary colors A little blue, yellow and red"
/songs/2494565,MAGIC!,Red Dress,https://genius.com/Magic-red-dress-lyrics,http://api.genius.com/songs/2494565,Primary Colours,2016-06-09," She’s tried on everything Everything little thing inside her closet And she knows it’s getting late Knows that I’ve been waiting and I’m starving Cause we’ve been working overtime She wants to make a night that we’ll remember And I’m staring at the time Thinking it’s alright, put on whatever   But I’ve been on my best behavior Pacing back and forth And ten thousand lifetimes later When she walks through the door, I say...   I said hey you with the red dress on I gotta find a way to take it off I got a lot of love and it's growing strong When I see you with your red dress on You in that red dress You in that red dress   It’s hard to concentrate ""Finish up your plate"" She whispers to me But I’ve got one thing on my mind As they pour the wine And it consumes me   But I’ve been on my best behavior Not to cause a scene But when we finally get home later It’s just you and me, and I say   And I said hey you with the red dress on I gotta find a way to take it off I got a lot of love and it's growing strong When I see you with your red dress on Hey you with the red dress on I gotta find a way to take it off I got a lot of love and it's growing strong When I see you with your red dress on You in that red dress You   Hey you with the red dress on I said hey you with the red dress on   Hey you with the red dress on I gotta find a way to take it off I got a lot of love and it's growing strong When I see you with your red dress on You in that red dress You with that red dress on You with that red dress on"
/songs/380162,MAGIC!,Rude,https://genius.com/Magic-rude-lyrics,http://api.genius.com/songs/380162,Don't Kill The Magic,2013-10-11," Saturday mornin', jumped outta bed and put on my best suit Got in my car and raced like a jet all the way to you Knocked on your door with heart in my hand to ask you a question 'Cause I know that you're an old-fashioned man, yeah (yeah)   Can I have your daughter for the rest of my life? Say yes, say yes 'cause I need to know You say I'll never get your blessin' till the day I die ""Tough luck, my friend, but the answer is no!""   Why you gotta be so rude? Don't you know I'm human too? Why you gotta be so rude? I'm gonna marry her anyway (marry that girl) Marry her anyway (marry that girl) Yeah, no matter what you say (marry that girl) And we'll be a family Why you gotta be so rude?   I hate to do this, you leave no choice, can't live without her Love me or hate me, we will be boys, standin' at that altar Or we will run away to another galaxy, you know You know she's in love with me, she will go anywhere I go   Can I have your daughter for the rest of my life? Say yes, say yes 'cause I need to know You say I'll never get your blessin' till the day I die ""Tough luck, my friend, cause the answer's still no!""   Why you gotta be so rude? Don't you know I'm human too? Why you gotta be so rude? I'm gonna marry her anyway (marry that girl) Marry her anyway (marry that girl) Yeah, no matter what you say (marry that girl) And we'll be a family Why you gotta be so rude? Yeah (so rude)   Can I have your daughter for the rest of my life? Say yes, say yes 'cause I need to know You say I'll never get your blessin' till the day I die ""Tough luck, my friend, but no still means no!""   Why you gotta be so rude? Don't you know I'm human too? Why you gotta be so rude? I'm gonna marry her anyway (marry that girl) Marry her anyway (marry that girl) Yeah, no matter what you say (marry that girl) And we'll be a family Why you gotta be so rude? Why, why, why, why? (Say) Say, why you gotta be so rude?"
/songs/3877234,MAGIC!,Space (Interlude),https://genius.com/Magic-space-interlude-lyrics,http://api.genius.com/songs/3877234,Expectations,2018-09-07," Space is keeping us together Space is making bad things better There's a time and all on us, pleasure And we can make it last Make it last forever   We're just in our space We're just in our space We're just in our space We're just in our space We're just in our space We're just in our space Ohhh, ohhh"
/songs/967459,MAGIC!,Stupid Me,https://genius.com/Magic-stupid-me-lyrics,http://api.genius.com/songs/967459,Don't Kill The Magic,2014-06-30," Oh oh oh, oh oh, oh oh Oh oh oh, oh oh, oh oh Oh oh oh, oh oh, oh oh   Stupid me, I don't know how to slow down Felt your touch and now I want it all now (oh) Waiting by the phone begging for a call now Centuries go by, and still there's no sound   Why do you play with my heart, why do do do you? (Do do do you, do do do you) When you know that I see right through through through you? (oh)   But if you don't love me the way I love you And if you don't want me the way I want you And if you don't need me the way I need you (oh) I just got one thing to say to you Fuck you   Stupid you, you don't know how to act right Gave you the best sleep you ever had in your life (oh) And all you had to do was kiss me goodnight I swear to you a man like me you won't find (oh)   Why do you play with my heart, why do do do you? (Do do do you, do do do you) When you know that I see right through through through you? (oh)   But if you don't love me the way I love you And if you don't want me the way I want you And if you don't need me the way I need you (oh) I just got one thing to say to you Fuck you   Oh oh oh, oh oh, oh oh Oh oh oh, oh oh, oh oh Oh oh oh, oh oh, oh oh Oh oh oh, oh oh, oh oh   So why do you play with my heart, why do do do you? (Do do do you, do do do you) When you know that I see right through through through you? (oh)   But if you don't love me the way I love you And if you don't want me the way I want you And if you don't need me the way I need you (oh) I just got one thing to say to you Fuck you, aye Fuck you, oh oh oh Stupid me for falling for you Stupid me for falling for you"
/songs/3741933,MAGIC!,Sugar Joiko,https://genius.com/Magic-sugar-joiko-lyrics,http://api.genius.com/songs/3741933,Motionless,2016-10-18,"What's this controlling This spell has got my body in a bind I'm smitten by the sorcery (Mmmmm)  (Aaah) What's this spell controlling me Illusions got my body in a bind I'm smitten by the sorcery (Ooooo)  I can feel my face turning red But my body feels no harm I'm imprisoned by the rune on my bed (Mmmmm)  Chorus:  There's a fire that you can't describe You bite your lips and roll your eyes It's magic, m m m m magic  Conjuration calling through your thighs You bo Before you realize It's magic, m m m m magic  Verse 2: It's too late for me now I'm  so warm I can barely breathe I surrender  Exhaltation, rapture of life Fascination, claim your delight It only consumes you, the harder you fight You're running out of time  Chorus:  There's a fire that you can't describe You bite your lips and roll your eyes It's magic, m m m m magic  Conjuration calling through your thighs You bo Before you realize It's magic, m m m m magic"
