api_path,primary_artist,title,url,song_endpoint,album,release_date,lyrics
/songs/1011688,Monica,In 3D,https://genius.com/Monica-in-3d-lyrics,http://api.genius.com/songs/1011688,New Life,2012-04-06,"La, la, la, la, la La, la, la, la, la, la, la, oh  I kinda feel like time is passing us by But it's killing me to leave you 'lone Cry all day long Baby I'm so sure that we belong Look in my eyes, they never lie  I see it so clear right now I'm riding shotgun, we're headed there If I should disappear right now You wouldn't notice it or care Not at all!  Baby you don't see nothing You must be blind, out your mind, out your something I see us so clearly, it's like twenty-twenty I see us in love, like the people on TV I see us in 3D I see us in 3D I see us together, it looks like forever I see us in love, now don't it look better? In 3D  La, la, la, la, la La, la, la, la, la, la, la ooh  Lately it seems like you don't even try I feel you wanna be left alone (like I did something wrong) Baby come back to my door (door) You'll feel so close in my sight (oh I, oh I, oh I) Open your eyes  I see it so clear right now I'm riding shotgun, we're headed there If I should disappear right now You wouldn't notice it or care (Notice me or care) Not at all!  Baby you don't see nothing You must be blind, out your mind, out your something I see us so clearly, it's like twenty-twenty I see us in love, like the people on TV I see us in 3D I see us in 3D I see us together, it looks like forever I see us in love, now don't it look better? In 3D  La, la, la, la, la La, la, la, la, la, la, la oh  Baby I can see us from a mile away (Cause love is right in front of my face) And it's so close I can touch it Oh baby give us a chance We will see  Baby you don't see nothing You must be blind, out your mind, out your something I see us so clearly, it's like twenty-twenty I see us in love, like the people on TV I see us in 3D I see us in 3D I see us together, it looks like forever I see us in love, now don't it look better? In 3D  La, la, la, la, la La, la, la, la, la, la, la"
/songs/1746359,Monica,Inside,https://genius.com/Monica-inside-lyrics,http://api.genius.com/songs/1746359,The Boy is Mine,1999-03-01,"Inside... Inside... Inside... Inside... Last night when I saw you With somebody new You asked how I've been And I I told you I was fine And as you held each other close I smiled and said it's good to see you And you didn't know Inside I'm cryin' baby Inside I'm dyin' baby I don't wanna let you see Baby what you've done to me So I keep it all inside (inside) Inside (inside) Sometimes when you call me I don't know what to say You say I've been on your mind And we'll talk again sometime You say you're glad we can be friends I say I'm over all the heartache But it's all pretend  Inside I'm cryin' baby Inside I'm dyin' baby I don't wanna let you see Baby what you've done to me So I keep it all inside Inside Outside I'm smilin' baby Outside these tears just can't be found But I'm just breaking down INSIDE Don't you know that I am dyin' baby (dyin' baby) I don't wanna let you see Baby what you've done to me So I'll keep it all INSIDE Yeah, I'm cryin' baby Inside I'm dyin' baby I don't wanna let you see Baby what you've done to me So I'll keep it all inside I'll just keep it all inside Inside... Inside..."
/songs/1006742,Monica,Intro,https://genius.com/Monica-intro-lyrics,http://api.genius.com/songs/1006742,After the Storm,2003-06-17,"- Come on, get out the way! - The light's green. Move! - I hate these gangsta singers with their music loud. Ma'am! Ma'am, can you please turn your rap music down? You just woke my baby up. Dammit! O.K. I just called the cops  *baby crying* *sirens*  - Don't you ever interrupt me when I'm listening to a Monica record. (Oh)   Yeah, straight out the slumming streets of A-T-L I know you waited for her arrival Through the hurricanes, torandoes, and thunderstorms The climate has now changed And the storm is now over I repeat the storm is now over Let us begin Hey, yo, Monica turn the volume up!"
/songs/71051,Monica,It All Belongs to Me,https://genius.com/Monica-it-all-belongs-to-me-lyrics,http://api.genius.com/songs/71051,New Life,2012-02-14," Loving you is hard I feel like I'm about to hurt myself And I don't want to do it, baby I'm loving you so hard And the way you act ain't been no help So no no no sugar (Yeah, you got it sweet, don't you?)   You must be blind You must be dumb You must be trippin' You must be crazy (You must be out yo damn mind) To think that I'ma let you off that easy   I know you're mad, can't take no more But put that back, that ain't yours Have a fit, slam the door But leave them bags on the floor That shit belongs to me Those clothes, those cars, those rings Yeah, that MacBook That shit belongs to me So log off your Facebook It all belongs to me   All you do is talk Never knew you do too nothing else You ain't good for nothing baby  It's like you got no heart Cold as ice, and nothing can make you melt No no no baby Hold on one minute baby     Ain't nothing leaving this house Unless it's over my dead body, baby So pack up all the things you came with Cause loving you is just too dangerous  I know you're mad Can't take no more But put that back, that ain't yours Have a fit, slam the door But leave them bags on the floor That shit belongs to me  Those clothes, those cars, those rings And that macbook, that shit belongs to me So log off your facebook It all belongs to me, to me It all belongs to me, to me It all belongs to me, to me It all belongs to me"
/songs/1822956,Monica,I've Got To Have It,https://genius.com/Monica-ive-got-to-have-it-lyrics,http://api.genius.com/songs/1822956,None,2016-08-16,"(JD)(Monica) Uh-huh, oh (Oh) Uh-huh, oh So So Def (I've got to have it) See this is what it's all about right her Understand me see my life's real I don't know about yours Everything I do is an event (I've got to have it) Nas, Monica, and me (I've got to have it) When it comes to my honeys in the strip club (oh) Sumpin' on dubs in the middle of the block Like what? (What?)  (Nas)(Monica) When you see me with the crispy fade Icing it out, glowing with the lights is out (hmm) Yo say my name! (Ooh) When you see a Bentley or Ferrari, a Mazuradi It's probably me (ooh, oh) Say my name! When your hear this song bump in the club When you're chillin' on the corner with your thugs Say my name! I make it hot and take your block Who they wanna be and hate they not Yo say my name! When your girl don't call you when you beep her And you hit it and her thing feel deeper Say my name! Pull on her hair, spankin' her rear While I'm in 'em bitches all I wanna hear is you say my name Squeeze my gats beef is done Police come you know the game Don't say my name Dipped out crazy, Timbs chicken and gravy Q.B., Dupri baby  1 - (JD) (Monica) When it comes to the clubs packed, Cristal flowin' (I've got to have it) When it comes to homes plushed out chrome stuck out in traffic (I've got to have it) When it comes to a neck full of glow And a check full of O's, you know (I've got to have it) When it comes to my honeys in the strip club Sumpin' on dubs in the middle of the block Like what? Say my name! (I've got to have it)  (Monica) Gotta have my tied up Iceberg Gucci Rolley Bezzled up, bezzled up Gotta have me a double O With a six in the front And a bump-bump in the truck Gotta have me an escalade My house is laid A man that keeps my bills paid My records play every day What can I say? I've got to have it  Repeat 1  (JD) When you see a black do-rag through the tint Of a black Bent going too fast Say my name When you talk about longevity And niggas who know how to keep gettin' that cash Say my name When you're sick of your songs Sittin' on the right And wanna know what the top feel like Say my name If you wanna know what being hot feel like And shuttin' down the spot feel like Say my name! JD from the home where the bowls get thrown And the dough get gone real quick like Keep niggas sick like 40 karats and a chain Foolish ain't it? Say my name! Everything you did I've done did double If you hate to see flash then your ass is in trouble Scram now and don't look back Cause until I die it's like that  Repeat 1  (Monica) I've got to have it.."
/songs/223003,Monica,I Was There,https://genius.com/Monica-i-was-there-lyrics,http://api.genius.com/songs/223003,None,2013-09-21," Faithful ,Loyal I Trust Him Scared Around Him now we all custom He gave me what I need Independent I got my own cheese  Every Nigga Needs a bitch Like Meeeeee Every Nigga Needs a Bitch Like Meeeeee   He got a pack holding sacks I throw it back for him Graduated front roll I'm the one who clapped for him When he came home I'm the one that he laid on Still hold him down Even know that he stay gone YEAH   This go to the hoes and nigga Who said we was fake I can't go a day With out seeing my bay face Me and him forever Ion every wanna count the days Ima hold him down Shit ain't gone ever change EVERY NIGGA NEED A BITCH LIKE MEE EVERY NIGGA NEEDS A BITCH LIKEE MEEE   He got a pack holding sacks I throw it back for him Graduated front roll I'm the one who clapped for him When he came home I'm the one that he laid on Still hold him down Even know that he stay gone YEAH!"
/songs/723309,Monica,I Wrote This Song,https://genius.com/Monica-i-wrote-this-song-lyrics,http://api.genius.com/songs/723309,All Eyez on Me ,2002-10-21," I can't believe he's gone Why'd you leave? Sometimes it hurts so bad   He's the kind of guy that runs the street But he treats me good And he makes his dough illegally That's how he's taking care of me And I respect the fact That he's chosen that life But it keeps me up late at night And I just can't spend my time Wondering: Where he's at? Is he okay? Wanna be by his side But I commit a crime, Bonnie to his Clyde And I don't wanna live that way   I love my baby so But he's not here no more (no more) Hard for me to understand (understand) So I wrote him this song (wrote him this song) When I look him in his eyes Knew I couldn't change his mind So I wrote this melody And I'm saying sweet goodbye   Though he promised that He could never put me in harm's way That it is something that he can't control 'Cause the game remains the same And now he says he wants out of it But he's in too deep And the only way that he would go Is killing him or leaving me So this is where I'm at And it hurts so bad That I had to choose If I wanna live or die with you   I love my baby so But he's not here no more (not here, babe) Hard for me to understand So I wrote him this song (I wrote you this song) When I look him in his eyes Knew I couldn't change his mind So I wrote this melody And I'm saying sweet goodbye I love my baby so But he's not here no more (why did you go?) Hard for me to understand So I wrote him this song (wrote him this song) When I look him in his eyes Knew I couldn't change his mind So I wrote this melody And I'm saying sweet goodbye   I tried to give him hope And promised him my life But I don't know What made him want to leave this life And as he went away A tear fell from my eye And there's no turning back There's only goodbye   I love my baby so (oh, baby) But he's not here no more Hard for me to understand So I wrote him this song (I wrote you this song) When I look him in his eyes Knew I couldn't change his mind (oh, he cried) So I wrote this melody And I'm saying sweet goodbye (I need you) I love my baby so But he's not here no more (he's not here) Hard for me to understand So I wrote him this song (I wrote this song) When I look him in his eyes Knew I couldn't change his mind So I wrote this melody And I'm saying sweet goodbye   I love you so (I love you) I need you so It's hard to imagine my life here without you (I love you) I love you so (It hurts so bad) I need you so It's hard to imagine my life here without you"
/songs/723342,Monica,Just Another Girl,https://genius.com/Monica-just-another-girl-lyrics,http://api.genius.com/songs/723342,All Eyez on Me ,2001-02-20," You think you're slick in every way Changing up on your calls On your phone every day  Is there something that You're trying to hide from me? I never gave you reason to Run and take your calls in the other room   Am I the only one Or is somebody else kissing at you? Is this my imagination? Things ain't always what they seem 'Cause I don't want to be   Just another name in your little black book Just another face in the crowd And it's got me shook I've got to mean a little more to you Than a space in your list of things to do  Another g-shock gun in your Benz Another dime piece That you can show all your friends You can call me crazy Say I'm insecure But I don't wanna be just another girl  Ooooh Ohhhh Ohhh Mmm, hhmmm   Strange how you claim to tell all the truth When the passenger seat In your car has been moved  And you swore that there was no one else but you And something else you can't explain Why'd you called me by somebody else's name?   You say it's history Your player days are through Or so you say Is this my imagination? Things ain't always what they seem 'Cause I don't want to be   Tell me how you lie Or is it my suspicious mind I've gotta know the truth If I am just another girl you treated wrong Another one you string along  Is it you and me? Is it two or three? 'Cause I don't want to be  "
/songs/1869955,Monica,Just Right for Me,https://genius.com/Monica-just-right-for-me-lyrics,http://api.genius.com/songs/1869955,Code Red,2015-05-04,"[Verse 1: Lil' Wayne] She so good for me Mr. good stuff, Mrs. good stuffin', good lovin' Watch me pull up 'til I pull somethin' on a full stomach Take her out to eat like, ""I'm hungry if you're hungry"" Hoppin' it off, then droppin' her off Then toppin' it off with a muah on her jaw And a smack on the ass, and a call me tomorrow And a walk to the door and a honk on the horn Got Monica on my playlist and she on my bae list But since I got a situation, I use imagination, alright  [Verse 2: Monica & Lil' Wayne] Baby, baby, baby, baby (Tunechi) Can't no one come take me from my baby (One, two, three, four) Like I can give my heart and all my time (Alright) Gotta keep my lovin' on your mind (Yeah)  [Pre-Chorus: Monica & Lil' Wayne] Oh, you got me goin' (Woo, I'm goin', I'm goin', I'm goin', I'm goin') So far and deep (I'm deep, I'm deep, I'm deep) I can't control it (No, I can't control it, control it, control it, control it) Meant to be together through the times   'Cause you're just right for me (Baby, I) Boy, you know your love's the best And it's just right for me (Baby, I am sure) And I don't care about your past 'Cause you're just right for me (Baby, I-I-I) Just right for me, me-me, me (Baby, I know it) And I don't care about your past, hey  [Verse 2: Monica & Lil' Wayne] Baby, baby, baby, baby It's like you're always tryna keep me happy So you know what a wife like me gon' do Got me thankin' on the two that made you (Thank you, baby)  [Pre-Chorus: Monica & Lil' Wayne] Oh, you got me goin' (Woo, uh) so far and deep (So far, so deep) I can't control it (I can't control it, no) Meant to be together through the times (Meant to be, ayy)   'Cause you're just right for me (Baby, you know) Boy, you know your love's the best (The best, yeah) And it's just right for me (Baby, I will show you) And I don't care about your past 'Cause you're just right for me   You know it Oh, oh, you got my attention Boy, you never lose 'cause you know I miss it (You know) The things we do, my king, you're my best friend   And it's just right for me (For me) And I don't care about your past 'Cause you're just right for me (Just right for me) Baby, I will show you (Uh huh, just right for me) Just right for me Just right, my time The only one in my life (Ohh, oh-oh) Baby and you know it Ooh, you’re just right for me (Baby, baby, baby, baby, baby) Just right for me, oh"
/songs/32481,Monica,Knock Knock,https://genius.com/Monica-knock-knock-lyrics,http://api.genius.com/songs/32481,After the Storm,2003-06-17," It's funny how the tables turn, turn, turn, turn   (Monica) Uhhh uhhh (ohhhh-ooohh) and it's sooo, woo (Wooooo-oooo, yeah) This that hot (Wooooo-ooooo, yeahhhh) Uh huhhh, yeah! New Monica!   {Missy} It's funny how the tables turn Now it's you running after me {huhhh} Didn't wanna spend quality time Didn't think I would ever leave {woooo} You got way too comfortable {ohhh} Now you say you want me in your life {huhhh} Cuz I've packed up all my shh {woooo} I'm moving in my new place tonight   {Missy} So don't you, knock knock knock Stop knockin' (stop knockin') Don't come knockin' on my door (yeahhh) (Oooo yeahhhhh) Ring ring ring (ring) Let the phone stop (oohhh) I don't want you calling me no mo'  {Uh huhhhh, soooo, sooo}   {Missy} Boy, it's a dangerous game To try and play a chick like me {huhhh} Wanna go out and do ya thing I'll be out 'fore you count to three So do just what you want Any time that you really like I put a payment on my place You'll be sleeping alone tonight   {Missy} So don't you, knock knock knock (knockin', ooohhh) Stop knockin', don't come knockin' on my door (Don't you come knockin' at, wooaayy) Ring ring ring (ring) Let the phone stop (oohhh) I don't want you calling me no mo'  {Uh huhhhh, soooo, sooo} (yeah)  [Verse Three: Monica (*rapping*)] {Missy} I used to be So Gone, you were someone I could lean on My life support system And I thought I couldn't breathe, uhh uhh When you used to leave, yup yup (yeahhhh) {ohhh} I see you got your clean on Big chains, gold teeth and your gleam on All night wanna be gone Wanna tell me stay home like I got a uhh ring on {wooo} Then you say I'm not your wife, right right {huhh} So why should I be chillin', goodnight goodnight {huhh} Now pack up my things for a flight {ohhh} I got a place and it's fixed up nice {come on!} So don't come knockin' on my door {yeah!} I got company coming 'round four {uhh huhh} So, whoa, heh heh, yeah {oohh}   {Missy} I don't want you calling me no mo' Knock knock knock {oohhh} Stop knockin', don't come knockin' on my door (Ring ring ring) ring ring ring Let the phone stop (please won't it stop) I don't want you calling me no mo'   {Missy} ""Don't come knockin' on my door"" {Uh huhhhh, sooo, soooo} ""Don't come knockin' on my door"" Ooohh oooh uhh, ooohh oohh uhh ""Don't come knockin' on my door"" (Oohh ohh uhh, yeah, yeah, yeahh) ""Don't come knockin' on my door"" Ooohh oooh uhh (changed my locks) oohh uhhh (to my crib) ""Don't come knockin' on my door"" Ohhh (can't come in, oohh) Ohhhh ""I don't want you calling me no mo'"" ""Don't come knockin' on my door"" (changed my locks, to my crib) ""Don't come knockin' on my door"" (can't come in, uhhh) Ooooohhh  I don't want you calling me no mo'"
/songs/2044145,Monica,Lesson Learned,https://genius.com/Monica-lesson-learned-lyrics,http://api.genius.com/songs/2044145,None,2016-08-16,"Verse 1  Lately we haven't had a chance to speak Cus you really ain't had no time for me Maybe there's somewhere else you'd rather be And I don't understand it at all If I recall I gave you everything But I can't remember one time you sacrificed for me And I'm starting to feel like im losing myself So I think that I'll just live with whats left  (Chorus) Why did you treat me like the girl on the side? Why did you have to go and make me cry? Boy tell me, you could have walked away Rather than cause me pain Baby I ain't really need it at all And I can't make you love me, (so I ain't trying that) You won't make a fool of me (so you can forget that) But I will remain a lady thats how my mama raised me Take the stripes that I've earned a lesson learned  Verse 2  Why did you have to go and lie to me?  When you were out there running in the streets Well I'm tired calling your cellphone 4 o'clock in the morning you pick it up and all I hear is ... If I was too much woman all you had to say was That you wasn't ready and I would've understood Well let me calm down, why should I be mad when honestly it ain't something you're stressin' bout  Chorus  Verse 3  Gave so many chances you blew it over again Time and time I wonder why you put me after your friends? You couldn't tell me the real? boy do you know how it feels? When I call your phone and you don't call back? I know you can't be for real uh uh So I pack my bags And ain't coming back Treat me like I don't know you what part of the game is that? Boy I ain't turning around this is no place for me to be You never meant enough for me  Chorus"
/songs/1375332,Monica,Let's Straighten it Out,https://genius.com/Monica-lets-straighten-it-out-lyrics,http://api.genius.com/songs/1375332,Miss Thang,1995-07-18,"Monica: Sit yourself down boy and talk to me Tell me what's on your mind Don't keep on telling me everything's okay Cause if it was then you wouldn't be crying You been acting real funny when I see you lately Sitting around poutin' all day long Now how in the world do you expect me to understand When I not even know what's wrong  Chorus: Straighten it out, let's straighten it out Let's straighten it out(Monica: Baby) Let's straighten it out(Monica: Out....) Let's straighten it out Usher: For the last few days when I saw you baby Oh I admit something just wasn't right It's so many things going through my head I didn't want to start another fight But if your tired of people being bothered baby In the world we'd be all alone Instead of being apart of a problem baby You and me otta be getting along, yeah....  Chorus: Straighten it out, Let's straighten it out(Usher: We need to straighten it out) Let's straighten it out(Usher: Me and you, you and me baby, Monica: Baby) Let's straighten it out(Monica: Out, ah ahhh, yeah, Usher: Hey) Let's straighten it out(Usher: Woo, woo, woo, woo, woo, woo, Monica: Yeah) Straighten it out, Let's straighten it out(Usher: Let's Straighten it out, let's straighten it out baby) Let's straighten it out(Usher: I think it's time for you and me to straighten it out) Let's straighten it out(Usher: Yeah, yeah, yeah) Let's straighten it out Together: Now how in the world you expect me to understand Monica: Umm, when I don't even know what's wrong Together: Baby, baby, baby  Chorus: Straighten it out, Let's straighten it out(Usher: Yeahhh........, Monica: Yeah.....ooh) Let's straighten it out(Usher: Can we Straighten, can you help me babe, Monica: Baby, baby, baby) Let's straighten it out(Usher: Can you help me sing, sing it baby, Together: Yeah, yeah....., Monica: Oh yeah, Usher: Yeah) Let's straighten it out(Monica: Let's Straighten it out, Usher: I want to Straighten it out with you baby, Monica: Come on, Usher: Come on) Together: Let's straighten it out........(Monica: Oh yeah) Let's Straighten it out(Monica: Let's Straighten it out, Usher: Come on, come on, come on) Straighten it out, let's straighten it out(Usher: Oohhh.....oh, yeah) Let's straighten it out(Usher: We need to straighten it out ...) Let's straighten it out Let's straighten it out"
