api_path,primary_artist,title,url,song_endpoint,album,release_date,lyrics
/songs/2403361,Monica,Ocean of Tears,https://genius.com/Monica-ocean-of-tears-lyrics,http://api.genius.com/songs/2403361,Code Red,2015-12-18,"Intro: No one will love you better than I Cried an ocean of tears to give back to you No one will love you better than I If I could have you again, I'd...  Verse 1: Love, where have you been I've been searching Where are you hiding And love, I need you here Nothing's been clear Tell me why did you disappear  B-sec: It's so hard for me to function When you're not here by my side It's gettin' harder just to breathe Without you, need you in my life  Hook: And oooh I've wasted so many tears, I Cried an ocean of tears to get back to you And oooh If I could have you again I'd give you all that I am and I'd try No one will love you better than I I, I, I, I, I, I  Verse 2: Joy, where have you gone Won't you come home Won't make you presents, no 'Cause time it is getting away Every day is another I spend alone  B-sec: repeat  Hook: repeat  Bridge: My heart don't beat the same no more And everyday without you I'm like the walking dead, I'm not living The sun don't shine without love Give me a reason to wake up I can't live without your truth So I surrender me to you  Hook: I've wasted so many years, I Cried an ocean of tears to get back to you And oooh, if I could have you again I'd give you all that I am and I'd try No one will love you better than I I, I, I, I, I, I  Outro: No one will love you better than I If I could have you again, I'd No one will love you better than I"
/songs/1702461,Monica,One in a Lifetime,https://genius.com/Monica-one-in-a-lifetime-lyrics,http://api.genius.com/songs/1702461,Still Standing,2010-03-19,"They say when you find the one There'll be no second guessing You'd feel it deep in your heart You'll know that it was destined  The feelin' inside will let you know Something that you can't deny, just let it grow They say it's better to love then never love at all To appreciate all the good sometimes you gotta fall  But I was foolish, I shouldn't let you go But now I miss you, I gotta let you know  I need you back, back in my life I need your kiss, kiss in my life And it's been so long since you been gone Baby, won't you come back home? You only get one One love, one in a lifetime You only get one One love, one in a lifetime  And I can't believe that I almost missed the signs Right in front of my eyes And now I know the love is real, it's hard to say why  You only get one, one love One in a lifetime And that one is you  They say that pleasure Comes with pain And I'm so used to being whole It's hard to be half again  And you gotta feel the same way My tears are steady falling like a pouring rain Tell me, will the forecast change?  If you love somebody, gotta let 'em know Tomorrow's never promised, you gotta let it show If you love somebody you gotta let 'em know Tomorrow's never promised, you gotta let it show  I need you back, back in my life I need your kiss, kiss in my life And it's been so long since you been gone Baby, won't you come back home?  You only get one One love, one in a lifetime You only get one One love, one in a lifetime  Can't believe that I almost missed the signs Right in front of my eyes And now I know the love is real, it's hard to say why  You only get one One love, one in a lifetime  And that one is you And that one is you And that one is you And that one is you, is you  I will climb the highest mountain Swim the deepest oceans for you, you, you I will walk across the desert Just to get that message to you, you, you  There ain't a thing in this world that I wouldn't do Right hand to the man, boy, I'm tellin' the truth So all my ladies, if you feel me then put your hands up For that one, for that one  You only get one One love, one in a lifetime You only get one One love, one in a lifetime  And I can't believe that I almost missed the signs Right in front of my eyes And now I know the love is real, it's hard to say why  You only get one, one love One in a lifetime One in a lifetime  That one That one That one That one  You only get one One love, one in a lifetime You only get one One love, one in a lifetime  And I can't believe that I almost missed the signs Right in front of my eyes And now I know the love is real, it's hard to say why  You only get one One love One in a lifetime One in a lifetime"
/songs/345463,Monica,Outro,https://genius.com/Monica-outro-lyrics,http://api.genius.com/songs/345463,After the Storm,2003-06-17," (Monica) (Remix), whoo, yeah (remix), oh, new Monica, so sick (remix, hey hey) Oh, it's remix player it don't get no hotter than that (remix) Uh, a hot beat on some wax, Monica what you say about that Uh (hey hey)   (Missy) I'm Monica, I got people out on every block And them say you been cheatin', what the blood clot Them rude boys, why you think youse a hot shot You'll come back like them addicts look for crack spots You must've fucked up, how dare you got me on lock You got me open like a chest with pneumonia I'm quick to run up on ya, you and your chicks I came to warn ya I'm crazy like them gangs in California (hey hey, uh)   (Missy) Silly of me, uh, devoted so much time (yeah) To find you unfaithful boy, I nearly lost my mind (whoo, uh) Drive past your house every night in an unmarked car Wondering what she had on me, to make you break my heart, yeah (come on, whoo)   (Monica) {Missy} You make me feel (you, you, you, you, you) So unreal {yeah} (you make) You make me feel {oh} (oh, I) So unreal (yeah, yeah, yeah, yeah, yeha) hey hey {whoo}   (Missy) Nights I couldn't sleep (uh), you let the sun beat you home (ok) I asked myself over again what am I doing wrong (oh) To make you stay out all night (oh), and not think to call (uh) What does she have over me to make him not think to call home (whoo)   (Monica) {Missy} You make me feel (baby you make me feel) {oh} (I'm so gone off you ey) so unreal {ah} (oh you) Oh you make me feel {yeah} (I'm gone, I) So unreal {uh}  [M = Monica, B = Busta] (Monica) {Missy} M = Ey Busta Rhymes let me know a man's point of view (yeah) M = Cause I think all men are dogs and that's including you (aha) B = Well Monica, look closer, tell me what you see {uh} B = Correct yourself cause dog backwards spelt G-O-D M = See I'm so gone and I be slappin' any kinda chick (yeah, uh) M = And I will step to any bitch I think he messin' with (aha) {oh} B = Watch what you say and what you do, sometimes I can't ignore it {mm} B = From how you rap and spaz over your dude and love you for it {whoo} M = Well I'm a singer not a fighter but don't test me (yeah) M = I'm a razor blade under the tongue as a security (oh yeah) {aha} B = Now what you sayin', first of all you know you're still my baby B = My lady, what's with this razor shit you talkin' crazy M = See Bus I'm down for my man if he act right M = But if he out, freakin' yeah, I'm on the first flight (aha) {come on} B = I know that youse a hot head girl let me continue B = I don't mean to patronize but I love the sexy thug in you, you crazy   (Monica) {Missy} You make me feel (no, no, no, no, I'm so gone) So unreal (so gone, so gone on you, you know you make me) You make me feel (I'm gonna love you, love you baby, I'm so gone) So unreal (so tell me what she did to you, you) {come on}   What she do, I do better What she do to make you love her, oh is it Is it real or forever Baby please can't we stay together   What she do, I do better, whoo oh, ohh What she do to make you love her Is it real or forever Baby please can't we stay together   (Missy) Ohh, ohh (I'm a hit you with a hot remix), remix Ohh, ohh (I'm a hit you with a hot remix), yeah, eh Ohh, ohh"
/songs/1295952,Monica,Raw,https://genius.com/Monica-raw-lyrics,http://api.genius.com/songs/1295952,The Makings of Me,2006-10-03,"Ya want that, ya gotta have that. I know you need that, you gotta have that Ya want that, ya gotta have that. I know you need that, you gotta have that  Now get that paper, make the paper, you know I'm a come and save ya You know where I live, I got them million dollar neighbors I came through your block lookin so clean, the chicks like damn, he got the shoulder lean You can touch it, you can grab it, if you like it you can have it We flyin way far, girl I make that your habit. I'm caked out to def , you rocked out to def, I make ya spend it all til it ain't nothing left  (Course) I'm a have to spit it like this, say the same thing with a little twist Soft sweet ain't workin no more No. I'm fittin to give it to ya raw so Your 22's ain't nothing new. You out hustelin, you better bring it in Soft sweet ain't workin no more No. I'm fittin to give it to ya raw so  Now you can say bye, to me being lady like. Say peace to me trying to keep the peace It ain't work then, you only heard me. But now you listening when I go crazy Get in line, when I lose my mind. I found out, I gotta get you mad, for you to make me glad  (Course) Soooo I'm I'm a have to spit it like this, say the same thing with a little twist Soft sweet ain't workin no more No. I'm fittin to give it to ya raw so  Your 22's ain't nothing new. You out hustelin, you better bring it in Soft sweet ain't workin no more No. I'm fittin to give it to ya raw so raw  Since your so street, I'm a bring it to your level Imagine I'm you're new connect you bout to meet tomorrows Keeping me happy is so important 'cause I'm the one who can keep us ballin You need to take that, apply to us.(apply it to us) All that hard work, apply to us.(apply it to us) If you want me to be the girl that you love  (Course) Soooo I'm I'm a have to spit it like this, say the same thing with a little twist Soft sweet ain't workin no more No. I'm fittin to give it to ya raw so Your 22's ain't nothing new. You out hustlin, you better bring it in Soft sweet ain't workin no more No. I'm fittin to give it to ya raw so  I'm fittin to give it to ya raw so. All my girls just give it to em raw so Them boys with no game we ain't foe  (Chrous)"
/songs/1822575,Monica,Right Here Waiting,https://genius.com/Monica-right-here-waiting-lyrics,http://api.genius.com/songs/1822575,The Boy is Mine,1999-12-14," Oceans apart Day after day and I slowly go insane I hear your voice, on the line But it doesn't stop the pain I see you next to me, yeah How can we stay forever   Whatever you do I will be right here waiting for you Whatever it takes I will be right here waiting for you   I took for granted, all the time That I thought would last somehow I hear the laughter and I taste the tears But I can't get near you now Oh can't you see it baby You've got me going crazy   Wherever you go Whatever you do I will be right here waiting for you Whatever it takes Or how my heart breaks I will be right here waiting for you   (I wonder how we can survive) This romance But in the end I'm with you I'll take the chance (I'll take the chance)   Baby, baby yeah (Wherever you go, whatever you do) I'll be, I'll be right here waiting on you, yeah (Whatever it takes, or how my heart breaks) And I will be right here waiting for you   Oh, I love you Oh, whatever it takes Whatever you do Wherever you go I'm never leaving you I'm gonna be right here I'll be right here waiting for you, oh you"
/songs/1772205,Monica,Ring da Bell,https://genius.com/Monica-ring-da-bell-lyrics,http://api.genius.com/songs/1772205,The Boy is Mine,1998-07-14," I've been talkin' to Some friends of mine about you, boy They say you're 'bout to have a child When you gonna tell me 'bout it? This other chick you're sleepin with Now you gotta deal with it Hope you've found happiness I've found myself in such a mess   With you And I put way too much love Into you Though that one day We'll be true And time after time I stuck with you But now I'm too through   'Cause I've been the fool Sittin' round too long I think it's about time that I Ring the bell and carry on Forgave you before (Yes, I did, yes, I did, yes, I did) But it's too far gone I think its about time that I Ring the bell and move along   You said it was a mistake On the night you saw her late Must've been for pure affection Boy, you didn't have protection You had to think of me But you did never see Yourself in this predicament You never thought that it would catch up   With you Put way too much love Into you Though that one day We'll be true And time after time I stuck with you But now I'm too through   'Cause I've been the fool Sittin' round too long I think it's about time that I Ring the bell and carry on Forgave you before But it's too far gone I think it's about time that I Ring the bell and move along   'Cause I've been the fool (Baby) Sittin' round too long (Baby, baby, baby) I think it's about time that I Ring the bell and move along Forgave you before (I forgave you before, baby) But it's too far gone I think it's about time that I Ring the bell and move along   How awful the way You treated me Gave you everything (I gave you everything) So hurt to say (I'm so hurt) You didn't tell me Can't wait to leave Baby, yeah   'Cause I've been the fool (I don't really want to know baby) Sittin' round too long (You did never really care for me) I think it's about time (I don't really want to know baby) That I ring the bell and carry on (You did never really care for me) I forgave you before But it's too far gone I think it's about time That I ring the bell and move along   'Cause I've been the fool (There goes my man) Sittin' round too long (You're a fool, sittin' all around)"
/songs/2403380,Monica,Saints & Sinners,https://genius.com/Monica-saints-and-sinners-lyrics,http://api.genius.com/songs/2403380,Code Red,2015-12-18,"Intro: Your grace makes all Saints out of Sinners...  Verse 1: Guide my heart, hold my hand As I try to walk the path So much potential, so many thoughts Lead me so I don't get lost But if I get lost, along the way I need your grace, I need your grace  B-sec: Something I'm feeling just takes over me Just wanna give up Know how it is when you lose everything Something about your love Lets me know the story's not over it's just the start And in my darkest hour, you know my heart  Chorus: We all need you preachers, deacons, thugs, and drug dealers Your grace makes all Saints out of Sinners  Verse 2: Now I've tried my ways But the way that I need is yours I look to you when it's all right I look to you when it's all wrong Please, remind me when I get low What you see when you look at me What you know I can be  B-sec: Something I'm feeling just takes over me I just wanna give up Know how it feels when you lose everything Something about your love Lets me know that the story's not over it's just the start And in my darkest hour, you know my heart  Chorus: We all need you preachers, deacons, thugs, and drug dealers Your grace makes all Saints out of Sinners  Bridge: You said you would never go So I need you to walk, I need you to talk I need you to hold me close Please be my fence, Lord In those darkest times I see One set of foot steps Walking in the sand I know that you carry me One thing I know that I'm sure  B-sec: The story's not over, it's just the start And in my darkest hours, you know my heart  Chorus: We all need you preachers, deacons, thugs, and drug dealers Your grace makes all Saints out of Sinners  Outro: Your grace, your grace, your grace and mercy Need your joy We need your love Joy, love, peace, Happiness is in you Only your grace and mercy can see me through Your grace, your love Saints & Sinners All the same until we claim your name"
/songs/723328,Monica,Searchin',https://genius.com/Monica-searchin-lyrics,http://api.genius.com/songs/723328,All Eyez on Me ,2002-10-21,"When I hear the children of today They're questioning me the way The way that they should live  I often wonder Wonder what to do To help them make it through In a world that's gone astray  Open my heart To see that it's up to me Searching for the answers to these problems  I'm always facing things That are trying me Testing all the things that I believe  Sometimes I feel so down And no one here's around But you You never left me lonely  And now I see What a true friend means And I trust that you would always be here for me Lord, I give you all  Open my heart To see that this lies with me Searching for the answers to these problems  I'm always facing things That are trying me (I'm standing right here)  Testing all the things that I believe Now I'm here before you So tell me what to do (Guess I will open my heart)  My heart to you Here I am Searching for all the answers to my problems  Lord, I'm facing things Can you help me? You're trying all that I need The things I believe Lord No, no, no, no  Here I am Here I am I'm searching for Searching for it  Lord, I need, need, need That's trying me Testing all the things that I believe  No, no, here I am Lacking all the understanding The things I can't see I am your child Ooh, oh, oh That're trying me  Can you help me I'm lacking understanding I'm your child no matter what they say I'm yours every day Protect me every day Protect me Oh, oh"
/songs/989872,Monica,Sick and Tired,https://genius.com/Monica-sick-and-tired-lyrics,http://api.genius.com/songs/989872,Tyler Perry's Diary of a Mad Black Woman,2005-04-19,"There were times when we used to go out Now all we do is scream and shout You used to buy me things and give me compliments Now everything's an argument Tell me when it ever went wrong 'Cause I don't wanna be another couple that you hear in a sad song How can we communicate Before it's much too late and I  I'm sick of playing games I'm sick of waiting by Other times we're cool And half the times we're not I'm sick of crying all these nights I'm sick of being sick and tired  And I'm sick of all these rules I'm sick of all these lies Half the times we're cool The other times we're not I'm sick of waiting all my life I'm sick of being sick and tired  Remember when we used to have fun I know you can't even remember the last time I know you're seeing someone 'Cause you've been walking 'round like everything is just fine What the hell have I done For you to have me feeling like I'm losing my mind? I don't wanna be with no one But doing this many don't feel nice  I'm sick of playing games I'm sick of waiting by Other times we're cool And half the times we're not I'm sick of crying all these nights I'm sick of being sick and tired  I'm sick of all these rules I'm sick of all these lies Half the times we're cool And other times we're not I'm sick of waiting all my life I'm sick of being sick and tired  I never did ask for nothing But I can tell you're going through something Now why would you risk me leaving our home I hope you put your thoughts into this 'Cause when I'm gone, I know that you'll miss All of my love 'cause, baby, when it's gone, I'm gone gone gone gone gone I'm gone gone gone I'm gone  I said that I'm sick and tired of all the lies I can't do it no more I said, I can't do it no more I'm so so so so tired Ladies, ladies, ladies, help me sing  I'm sick of playing games I'm sick of waiting by Other times we're cool And half the times we're not I'm sick of crying all these nights I'm sick of being sick and tired  I'm sick of all these rules I'm sick of all these lies Half the times we're cool And other times we're not I'm sick of waiting all my life I'm sick of being sick and tired  I'm sick of playing games I'm sick of waiting by Other times we're cool And half the times we're not I'm sick of crying all these nights I'm sick of being sick and tired ...."
/songs/1410689,Monica,Sideline Ho,https://genius.com/Monica-sideline-ho-lyrics,http://api.genius.com/songs/1410689,The Makings of Me,2006-10-03,"Ho, ho, sideline ho You's a ho, you's a ho, sideline ho   When you called his phone, did he pick it up? No, cause we was makin love Did you meet his moms? Have you met his kid? No! Did you know my kid was his?   Get your shit together you're makin a fool of yourself yeah It don't matter if he spends the night His home is somewhere else Ain't you tired of being on the side line? Tired of getting yours after I gets mine Baby, second place don't get a prize When you gonna realize you wasting your time? Baby, ain't you tired of him gettin in Hittin it real quick then rollin? And ain't you tired of you need a little change And he lie about what he holdin Ain't you tired of spending all the holidays alone Tired of being his little sideline ho?   Do he take you out? Do he foot your bills? No, 'cause I know what his balance is Have you been to his church? Do he ask you to pray? No, 'cause Sundays family day   Get your shit together you're makin a fool of yourself yeah It don't matter if he spends the night His home is somewhere else Ain't you tired of being on the side line? Tired of getting yours after I gets mine Baby, second place don't get a prize When you gonna realize you wasting your time? Baby, ain't you tired of him gettin in Hittin it real quick then rollin? And ain't you tired of you need a little change And he lie about what he holdin Ain't you tired of spending all the holidays alone Tired of being his little sideline ho?   Do you got benefits? No! Credit cards? No! house keys? No! Then you's a sideline ho Do you get pillow talk? No! Held at night? No! If you don't make his breakfast you's a sideline ho Do you got benefits? No! Credit cards? No! house keys? No! Then you's a sideline ho Do you get pillow talk? No! Held at night? No! If you don't make his breakfast you's a sideline ho   Get your shit together you're makin a fool of yourself yeah It don't matter if he spends the night His home is somewhere else Ain't you tired of being on the side line? Tired of getting yours after I gets mine Baby, second place don't get a prize When you gonna realize you wasting your time? Baby, ain't you tired of him gettin in Hittin it real quick then rollin? And ain't you tired of you need a little change And he lie about what he holdin Ain't you tired of spending all the holidays alone Tired of being his little sideline ho?  You's a ho, you's a ho, sideline ho You's a ho, you's a ho, sideline ho You's a ho, you's a ho, sideline ho"
/songs/723819,Monica,Skate,https://genius.com/Monica-skate-lyrics,http://api.genius.com/songs/723819,Miss Thang,1995-07-18," Everybody skate to the music Put your hands in the air Don't stop 'til it grooves ya And you feel it everywhere  Just skate to the music 'Til you feel it going on Don't stop 'til ya lose it, baby Everybody skate   It's Sunday night And we're about to have a ball The place is packed Been thinking bout it all day long  People are jamming and waiting For their favorite song With everyone in a world of their own   Can't wait to get up on the floor And bounce around to the sounds Don't just sit up on the wall Get down, baby Get down   The beat is bumping The lights are moving to the groove All in the light We roll until the night is through  Only a minute Before it puts you in the mood And from there It's all up to you  "
/songs/2852716,Monica,So Gone Challenge,https://genius.com/Monica-so-gone-challenge-lyrics,http://api.genius.com/songs/2852716,None,2016-08-16,"VERSE 1  Memba that!!?? When I used to scrap!??... Use to had to rap or slap!!... All them chicks for talking smack !! ... Monica would still snap!.. Kick down doors until my hills crack! Now I'm making racks, while they rapping On my old tracks ....  so gone, y'all the type Of chicks I keep my eyes on.... Aye! girl get your own man !!! ....  leave mines alone! Mrs, brown gone make me had to bring the ''ME''! ..  back I snatch off yo' edges..! make u wonder where Yo' weaves at?!  ... believe that, I'm The M.O.N.I.C.A free-styling 1 take I represent the (A) .... heard it was a so gone challenge Man! I said no way!?? Song still bang, like we In 20.0-3 . Yeah!  When I walk up in the booth They way I spit my rhyme I kick the freestyle all the time  The world lost they mind Yeahh! The world lost they mind;....  Oooooooo....."
/songs/2864389,Monica,Stand In Front Of Me Baby,https://genius.com/Monica-stand-in-front-of-me-baby-lyrics,http://api.genius.com/songs/2864389,None,2016-08-16,Your not Rused I'm glad You went to fun Events how about stayin come with Me and talk with Me here We look at eatch other I wana to look at You I really can know You hey You don't have to walk away I'll tell You what Table I'm At would You like to meet Me cause I want to talk with You  Hooooo a hooooo hoooo wooooo a wooo stand in front of Me Baby Hooooo a hooooo hoooo wooooo a wooo stand in front of Me Baby   I'm glad Your having so much  fun Eating with Your Friends You can tell Me about You Your standing by the Door I can tell You want to take a walk with Me I'll take a walk with You I'm going to ask You if You want a Cup of Coke    Hooooo a hooooo hoooo wooooo a wooo stand in front of Me Baby Hooooo a hooooo hoooo wooooo a wooo stand in front of Me Baby   We Will recognize eatch other the first thing You will tell Me is Your not Far Away From Me Would You like to Meet Me cause I can really know You would You like to Meet Me Would You like to Meet Me cause I can really know You
