api_path,primary_artist,title,url,song_endpoint,album,release_date,lyrics
/songs/32190,Monica,Don't Gotta Go Home,https://genius.com/Monica-dont-gotta-go-home-lyrics,http://api.genius.com/songs/32190,After the Storm,2003-06-17," Ain't no sense whining about it now I mean we knew what it was when we became apart of it, feel me   Yeah   It's Like   There's something on your mind, I can see right through you I know your girl been treating you wrong But she ain't no good for you, why do u hold it inside Boy you should let me know, I just want to make you right Be the one you could cry on   Baby, its like Baby, it's like I love my wife We going through things and I ain't going home tonight You got time for a nigga or is he still with you Wanna meet at the same spot or should I come get you I'll be there in 10, be in the front I been getting what I need so imma give you what you want One on one cuz you know how to talk to dog You walk the dog and understand that New York is hard  DMX) You ain't gotta go home tonight You can stay right here with me (I ain't goin nowhere when you wake up I'm gonna be right there) Don't you worry bout a thing (I ain't worried about shit) You're here with me (Look It's like I love my wife We going through things and I ain't going home tonight alright)   It's kinda strange when you call she is never home Now your there all alone and you deserve so much more Baby, I can treat you better than she can It doesn't make sense to keep on loving and keep on trusting When in return all you get is nothing   Damn, you got me fucked up and im feeling it more Never had a mistress distressed before Come on ma, like it ain't that deep Like there ain't no love there like I don't hate that I gotta creep We go to sleep in each others arms And I feel like this is where I belong And if loving you is right  then I ain't  wrong This is the same ol' song, wife and fam Gotta be a father and husband but I am still ya man Baby  DMX) You ain't gotta go home tonight You can stay right here with me (I ain't goin nowhere when you wake up I'm gonna be right there) Don't you worry bout a thing (I ain't worried about shit) You're here with me (Look It's like I love my wife We going through things and I ain't going home tonight alright)  DMX) This situation is getting critical (uh huh!) I watch so many tears fall (uh huh!) I know she not what you want So why do u keep holding on When im right here (What!) All you need to do is call (What!) Don't be afraid cuz she won't know it  DMX) You ain't gotta go home tonight You can stay right here with me (I ain't goin nowhere when you wake up I'm gonna be right there) Don't you worry bout a thing (I ain't worried about shit) You're here with me (Look It's like I love my wife We going through things and I ain't going home tonight alright)  DMX) You ain't gotta go home tonight You can stay right here with me (I ain't goin nowhere when you wake up I'm gonna be right there) Don't you worry bout a thing (I ain't worried about shit) You're here with me (Look It's like I love my wife We going through things and I ain't going home tonight alright)"
/songs/339167,Monica,Don't Take it Personal (Just One of Dem Days),https://genius.com/Monica-dont-take-it-personal-just-one-of-dem-days-lyrics,http://api.genius.com/songs/339167,Miss Thang,1995-04-10," It's just one of them days when I wanna be all alone It's just one of them days when I gotta be all alone It's just one of them days, don't take it personal I just wanna be all alone, and you think I treat you wrong  I wanna take some time out to think things through I know it always feels like I'm doing you wrong But I'm so in love with you So understand that I'm only in love You're the only one I need So have no thought that I want to leave And baby, trust me please   Just one of them days That a girl goes through When I'm angry inside Don't want to take it out on you Just one of them days Don't take it personal I just wanna be all alone And you think I treat you wrong Don't take it personal Baby, baby, baby, baby, don't take it personal  I see and I think about every thing we do And I find myself in misery and that ain't cool Hey now, I really want to be with you the whole way through But the way you make me feel inside keeps me confused As I swing back from mood to mood it's not because of you I never want you to be insecure So won't you understand that I'm only in love? You're the only one I need I'll be there for you when you need me, boy So baby, don't you leave   Just one of them days That a girl goes through When I'm angry inside Don't want to take it out on you Just one of them days Don't take it personal I just wanna be all alone And you think I treat you wrong Don't take it personal Baby, baby, baby, baby, don't take it personal Just one of them days That a girl goes through When I'm angry inside Don't want to take it out on you Just one of them days Don't take it personal I just wanna be all alone And you think I treat you wrong Don't take it personal Baby, baby, baby, baby, don't take it personal  Just one of them days Just one of them days Just one of them days a girls goes through  Don't take it personal Baby, baby, baby, baby, don't take it personal Don't take it personal, yeah , don't take it personal   Don't take it personal baby Personal baby, personal baby, personal baby Personal baby, personal baby"
/songs/1365224,Monica,Down 4 Whatever,https://genius.com/Monica-down-4-whatever-lyrics,http://api.genius.com/songs/1365224,After the Storm,2003-06-17,"If I told you I'll be the one to make all your dreams true If I gave you All the things that make a man feel so good If I need you To come here before I give it to you If I had to I would change the world and make it feel love for you   If you do what say do I promise we can do whateva' You want to cause I want you Say love me & I'm down 4 whateva'   Now that it's clear I hope you understand the way I'm feelin And now that you're here you can't stop thinking of what I want to hear Now that it's true I can stop holdin' back and do what I do And when we're through I lay in your arms and say I love you  I believe we can be Whateva we want to no matter the dilemma And I believe that you will see it may take forever But we finally got together And I believe it will be all about us cause baby I love you And then they will see what we mean When we say we were together for eternity   Tell me what happens when you think of me Do you think of the things I'm feeling Cause when I see you I start trembling My knees start shakin' just glad to be with you Tell me your love will always be with me Promise me you would never leave And then take me where I want to be Cause I need you baby, I'm needing you crazy (ohoh!I!!)  "
/songs/1778922,Monica,Everything to Me,https://genius.com/Monica-everything-to-me-lyrics,http://api.genius.com/songs/1778922,Still Standing,2010-02-09,": Boy if you ever left my My side It'd be like taking the sun from The sky I'd probably die without You in My life Cause I need you to Shine, shine Your light Oooohhhhhhh  : You're everything to me, heey The air that I breathe, oohhh A sign so I'll see, oh Lord You're everything to me  : I can't repay you for all that you've done Always come first and second to none The love that you give me is equal to ten My peace, my joy You are my My strength, ooohhhh  You're everything to me, whoa The air that I breathe, ooooohhh A sign so I'll see, ohhh that You're everything to me  : (Boy I never thought) Never thought I'd feel a love like this Better than our first date Sweeter than our first kiss (and you) Ain't no other person for me You're my best friend My lover (Baby you're) My everything  You're everything to me, whoa The air that I breathe, ooooohhh My sight, so I see, oh You're everything to me  I need you, I need you, I need you..."
/songs/32062,Monica,Everytime tha Beat Drop,https://genius.com/Monica-everytime-tha-beat-drop-lyrics,http://api.genius.com/songs/32062,The Makings of Me,2006-07-24," Ro-Ro-Ro-Rock then bend my knees Every time the beat drop Uh, uh, haha Ro-Ro-Ro-Rock then bend my knees Every time the beat drop So-So Def!   You know pimpin' make the beat drop, fuckin' with a laptop I make em do it do it, as soon as the beat drop Might throw my towels out like Nick I like to wild out I'ma stay in the game until I fall out First I lean grab a ball and then I pop wit it (I pop wit it) When they bring the mics the crowd I rock wit it (I rock wit it) I never hittin' licks, trying to get it quick When the songs come on they, like that's my shit   I can't help who I'm is, when they play my shh I just love to dance, every time the beat drop I love to wild out damn right, shake it all night Hey, that's my jam, every time the beat drop I said, ooh, all the ladies in the club grab a dude And you work it real slow, you can do it Move it, 'til you make him lose it Ro-Ro-Ro-Rock then bend my knees Every time the beat drop He gon' be a fan, every time the beat drop   I know you used to seeing Mo laid back So for the most part you think I'm like that (dig this) You about to get a glimpse of the fit I'm giving niggas on the floor, man When I hit the door, man 'Cause I ain't one of these too boogie broads Always in the club holding up the wall (now dig this) You about to get a taste of the way That we do it down here in the A Let me say   I can't help who I'm is, when they play my shh I just love to dance, every time the beat drop I love to wild out damn right, shake it all night Hey, that's my jam, every time the beat drop I said, ooh, all the ladies in the club grab a dude And you work it real slow, you can do it Move it, 'til you make him lose it Ro-Ro-Ro-Rock then bend my knees Every time the beat drop He gon' be a fan, every time the beat drop   Now I ain't talking bout a little two step (Whatcha talkin' about?) I'm talking bout some that'll make you sweat And when I talk well I'm through talking I'm about to do some move some let you see something When I say get gutta it's enough said Do the bounce like you over on Bank head And if anybody got a problem with the way you doin you Look em dead in the face and you say   I can't help who I'm is, when they play my shh I just love to dance, every time the beat drop I love to wild out damn right, shake it all night Hey, that's my jam, every time the beat drop I said, ooh, all the ladies in the club grab a dude And you work it real slow, you can do it Move it, 'til you make him lose it Ro-Ro-Ro-Rock then bend my knees Every time the beat drop He gon' be a fan, every time the beat drop   I trick stats like candles and I blow that money I'm drunk off the goose so I throw that money I spendin' white T cash, yea that throwback money When I step off in this spot like I know that's money And my chain so styling, how colors diamonds you need, man? I bow low we, you wanna bow low in the week-end Damn! And you ain't fresh azimiz It's DFB, bitch, and I can, I can   I can't help who I'm is, when they play my shh I just love to dance, every time the beat drop I love to wild out damn right, shake it all night Hey, that's my jam, every time the beat drop I said, ooh, all the ladies in the club grab a dude And you work it real slow, you can do it Move it, 'til you make him lose it Ro-Ro-Ro-Rock then bend my knees Every time the beat drop He gon' be a fan, every time the beat drop  Y'all know what this is DFB, Monica Every time the beat drop Let's get it Every time the beat drop"
/songs/1459100,Monica,Forever Always,https://genius.com/Monica-forever-always-lyrics,http://api.genius.com/songs/1459100,Miss Thang,1995-07-18,"Spoken: Forever always  Verse 1: Oh baby baby, let's talk it out Cause you're so special and mean so much to me Baby boy, there've been times, you dogged me out I should have left you but stayed right by your side I chose to love you only But you won't let me you pushed my love away Don't be so selfish with your love (ooohh ooohh)  Chorus: Forever always I'm going to love you until my dying day Forever Always A love so special it'll never fade away  Verse 2: The other day you saw me out You had no reason to trip or have a doubt Baby boy, he's nothing but a friend of mine You don't have to be afraid If I ever lose you I'd throw my heart away I chose to love you only But you're so jealous you pushed my love away Don't be so selfish with your love (ooohhh)  Chorus  Babe, it's forever, always It's forever always babe It's forever, always...  Chorus till fade"
/songs/521688,Monica,For You I Will,https://genius.com/Monica-for-you-i-will-lyrics,http://api.genius.com/songs/521688,The Boy is Mine,1997-02-25," When you're feeling lost in the night When you feel your world just ain't right Call on me, I will be waiting Count on me, I will be there Anytime the times get too tough Anytime your best ain't enough I'll be the one to make it better I'll be there to protect you See you through I'll be there and there is nothing I won't do   I will cross the ocean for you I will go and bring you the moon I will be your hero your strength Anything you need I will be the sun in your sky I will light your way for all time Promise you For you I will   I will shield your heart from the rain I will let no harm come your way Oh these arms will be your shelter No these arms won't let you down If there is a mountain to move I will move that mountain for you I'm here for you, I'm here forever I will be your fortress, tall and strong I'll keep you safe I'll stand beside you, right or wrong   I will cross the ocean for you I will go and bring you the moon (yeah, yeah) I will be your hero your strength Anything you need (I will be..) I will be the sun in your sky I will light your way for all time Promise you For you I will   For you I will, lay my life on the line For you I will fight, oooooh For you I will die With every breath, with all my soul I'll give my world I'll give it all Put your faith in me (put you're faith in me) And I'll do anything   I will cross the ocean for you (I will cross the ocean for you) I will go and bring you the moon I will be your hero your strength Anything you need I will be the sun in your sky I will light your way for all time Promise you (Promise you) For you I will, I will, I will, I will  I will cross the ocean for you I will go and bring you the moon I will be your hero your strength Anything you need, (Anything you need) I will be the sun in your sky (yeah, yeah) I will let you wait for all times Promise you (I promise you) For you I will (Ooooh) I promise you For you I will"
/songs/1758832,Monica,Getaway,https://genius.com/Monica-getaway-lyrics,http://api.genius.com/songs/1758832,The Makings of Me,2006-10-03," Started as a little girl Singing soul changed my world Flipped my world upside down I got lost and I couldn't be found So much on my shoulders And so much on my mind Seems no one can help me I think i just need some time   Sometimes I wish I could fly away Looking for a place to getaway Get away from all the heartache and pain That life can bring I really don't wanna sound Like I can't hold my ground But everybody need some time That they can getaway   Sometimes I wish I was invisible 'Cause then no one would know where I am To ask me for anything 'Cause I've given so much of me When is it time for me to receive? 'Cause Monica has her needs Who's gonna look out for me?   Sometimes I wish I could hide away Looking for a place to getaway Get away from all the heartache and pain That life can bring I really don't wanna sound Like I can't hold my ground But everybody need some time That they can getaway   You know, I'm not superwoman And I'm not made of steel I try my best to handle All I have to deal with Not as easy as it seems And to think this was my dream Now for everything I have I'm grateful But sometimes I wanna getaway   Sometimes I wish I could hide away Looking for a place to getaway Get away from all the heartache and pain That life can bring I really don't wanna sound Like I can't hold my ground But everybody need some time That they can getaway Sometimes I wish I could hide away Looking for a place to getaway Get away from all the heartache and pain That life can bring I really don't wanna sound Like I can't stand my ground But everybody need some time That they can getaway"
/songs/723806,Monica,Get Down,https://genius.com/Monica-get-down-lyrics,http://api.genius.com/songs/723806,Miss Thang,1995-07-18," I don't want to make this sound so cold But every now and then I'm gonna let you know, ohh  There's gotta be something giving to me All you need to know is That I'm a fly young lady   So do what you got to do If it's me you chose But I got the oohhh's, baby Ya, hear? Ohh  I'm gonna give up some time If it's worth my while 'Cause it's my world I'm playing my game   You gotta get down With the way I'm running things Or you won't be around You gotta get down with me, me  You gotta get down With the way it's gotta be Turn your frown to a smile You gotta get down with me, me  You gotta get down Ooh, baby Oh, you gotta get down with me  Down Hey Down Down Umm, yeah You gotta get down with me, me   I've heard you're kinda nice (What's yours now? It's that slow?) Take the time Learn the ways Then we can roll  Have you ever met a girl That knows her thang Looking kinda fly But baby Can you swang?      "
/songs/1686913,Monica,Get It Off,https://genius.com/Monica-get-it-off-lyrics,http://api.genius.com/songs/1686913,After the Storm,2003-06-17,"Yeah, Imma set it off C'mon now This that hot shit ya'll set it off New Monica shit C'mon   You remember when I was just a young one (c'mon) And I was to afraid to quickly let you show me thangs   Hol up, hol up Big show DJ's This joint so crazy Put the needle back on the record Let's do a double take   Now listen baby im a dirt bag I don't know the different faces, I can't take it But I got a jeep, so you lead and I'll follow Lunch up in a diner, if ya act right we dine in the Bahamas Now wow lil momma, im a gangsta Anywhere ya wanna go imma take ya Oh my god you caught my eyes like from 20 yards You so damn fine Listen I don't eat peaches but the way you look to night I just might take a bite Come closer, feel that It's a woman and a man and a latex Out the shower, hotel flowers on the bed Choice of wine white or red What more can I say Monica, DirtBag, ATL MIA   You remember when I was just a young one And I was to afraid to quickly let you show me thangs Not sure if I was ready for some good love And I'm 'bout to set it off Can you please be gental? 'Cause I am the fragile kind And even tho im ready for the move of my time Now buckle up yo seat while I set it off   Baby let me set it off (let me) Do you mind it I get it off? Set it off, set it off All it takes is one phone call If you wanna get it on Set it off (come on now), set it off   I know you're anxious But please let's make a compromise I'm so energized, all in my neck, my back, my thighs Make sure the lock is safe before I set it off   Baby let me set it off Do you mind it I get it off? Set it off, set it off All it takes is one phone call If you wanna get it on Set it off, set it off   Now I'ma get it , you can tell them Mo Said it And you betta not forget it, now don't sweat it And we can really go at it, if you let it let's protect it Now I bet it be good is you ready But the jump of heavy, my style varies The club down I shut it, how I do it I set it in me   Baby let me set it off Do you mind it I get it off? Set it off, set it off All it takes is one phone call If you wanna get it on Set it off, set it off  (Missy) Breakdown Here we go (Monica) I will set it off I will set it off I'll set it off I will set it off I'll set it I'll set it"
/songs/1478433,Monica,Gone Be Fine,https://genius.com/Monica-gone-be-fine-lyrics,http://api.genius.com/songs/1478433,The Boy is Mine,1998-07-14," We have (say what?) A whole lot of superstars, on this stage here tonight! We have, we have We have, we have We have, we have We have, we have We have (say what?) A whole lot superstars, on this stage here tonight   Can't believe you would leave me this way Feelin kinda bad from the last things we said today Can't believe you would turn and walk away I know we would do this again and again   You say you love me, I'll come back with ""I hate you"" Only takes me a day to realize I'm in love with you You say ""Oh, see ya"", I'll come back with ""Just stay, boy"" If you don't want my love, then I have no choice this time yeah yeah   Tell me baby what to do I ain't trippin over you Any any other time Remember I'm gone be fine I, I remain the same I don't know wassup with you Any any other time Remember I'm gone be fine   You said you didn't mean it, that's fine You wanna take it back cause you're havin a change of mind Sometimes sayin' sorry won't do And somedays I can't do without you   You say you love me, I'll come back with ""I hate you"" Only takes me a day to realize I'm in love with you You say ""Oh, see ya"", I'll come back with ""Just stay, boy"" If you don't want my love, then I have no choice this time yeah yeah   Tell me baby what to do I ain't trippin over you Any any other time Remember I'm gone be fine I, I remain the same I don't know wassup with you Any any other time Remember I'm gone be fine Tell me baby what to do I ain't trippin over you Any any other time Remember I'm gone be fine I, I remain the same I don't know wassup with you Any any other time Remember I'm gone be fine   Yeah, yeah Better roast the milkman delivered this everyday on the schedule Ain't good use in cryin' over spilled lactose when you got these vegetables Four Food Groups ain't nothin but fo' ways to keep fo' families paid Oprah Winfrey wa'n't lyin when she was tellin y'all silly ass bout them steaks   Yeah, so for one girl when I met you, I'mma say this, you was fine (fine) We traveled around the block, I let you drive the 'Lac one time Maybe your heart's at stake, some of the people 'round you actin' fake Cut your cake up, wake up, fix ya make-up cause you gon' be straight - like that   Tell me baby what to do I ain't trippin over you Any any other time Remember I'm gone be fine I, I remain the same I don't know wassup with you Any any other time Remember I'm gone be fine Tell me baby what to do I ain't trippin over you Any any other time Remember I'm gone be fine I, I remain the same I don't know wassup with you Any any other time Remember I'm gone be fine Tell me baby what to do I ain't trippin over you Any any other time Remember I'm gone be fine I, I remain the same I don't know wassup with you Any any other time Remember I'm gone be fine"
/songs/1322914,Monica,Go to Bed Mad,https://genius.com/Monica-go-to-bed-mad-lyrics,http://api.genius.com/songs/1322914,After the Storm,2003-06-17,"Hook: I think you're wrong you think your right And all that equals up to is a fight Let's compromise Before we go to bed tonight Cause if the fight don't die before the sun rise We may wake up on the Wrong side Lets not go to bed mad tonight  Verse: {Monica} Time is ticking, my eyes are getting Heavy but I know we got to squash this So boy what's poppin its time for dropping Copping attitudes right now It's not for nothing cause this ain't nothing Don't you know that I love you So start to stoppin', think about it You will see its stupid to  B Section: {Monica} Argue about things non critical And get heated over nothing And just hang up the phone See I won't Wanna talk in the morn See we need a resolution Like that Aaliyah song  Hook: Same  Verse 2: {Tyrese} What time is it? Im not on a mission To stay up with you all night It makes me so sick, to my stomach Every time we argue and fight I mean it girl my head gets light, this just ain't right I'm feed right up please Its two fifteen in the morning, there is no need baby, to  B Section 2: {Tyrese on leads} Argue about things non critical {And get heated over nothing} And just hang up the phone {Oh I won't} Wanna talk in the morn {See we need a resolution like that Aaliyah song}  Hook: Same  Bridge: {Tyrese & Monica} {Tyrese} I'm not trying to be mad at you Why you make me wanna not fool with you Can't you see I'm tired girl {Monica} Besides the fact, it's a quarter past two A girl like me got things to do So lets see each other's point of view Point of view, yeah, yeah  I think you're wrong you think your right; and all that equals up to is a fight Let's compromise before we go to bed tonight Cause if the fight don't die before the sun rise We may wake up on the wrong side, lets not go to bed mad tonight  I think you're wrong you think your right; and all that equals up to is a fight Let's compromise before we go to bed tonight Cause if the fight don't die before the sun rise We may wake up on the wrong side, lets not go to bed mad tonight  I think you're wrong you think your right; and all that equals up to is a fight Let's compromise before we go to bed tonight Cause if the fight don't die before the sun rise We may wake up on the wrong side, lets not go to bed mad tonight  Outro: {Tyrese & Monica} T: I just wanna love ya babe M: I place no one above ya babe T: You're the only one for me T & M: Lets not argue my baby T: Everything You want and need M: You are everything and everything is you T: You're my baby Come and take my hand I got you babe Let me be the man You want in your life baby M: Hey  ~"
