api_path,primary_artist,title,url,song_endpoint,album,release_date,lyrics
/songs/3050152,Nico & Vinz,1. Intro,https://genius.com/Nico-and-vinz-1-intro-lyrics,http://api.genius.com/songs/3050152,None,2012-04-27,"(oh, oh, oh, oh, oh) ([?] I tried, [?] I tried) (oh, oh, oh, oh, oh)   Uh, I dropped out of school to focus [?] I had to make a choice and it was takin' too much time You can call it a mistake, call it just a waste Alright, alright, to you, but I ain't doin' 9 to 5, see Yeah, it's time to go and I got things to see What's impossible for you may be possible for me So, no I won't sleep and let nobody steal my seat Disturb the peace, we won't stop until we peak, V   Don't hate, just envy, don't hate, just envy, don't hate, just envy, don't (don't) (oh, oh, oh, oh, oh) Don't hate, just envy, don't hate, just envy, don't hate, just envy, don't (don't) (oh, oh, oh, oh, oh) Don't hate, just envy, don't hate, just envy, don't hate, just envy, don't (don't) ([?] I tried, [?] I tried) Don't hate, just envy, don't hate, just envy, don't hate, just envy, don't (don't) (oh, oh, oh, oh, oh)   Yo, I was never the type to do what others do I did sports, so fuck the bus, I'll run to school Always determined to be somethin' that they could never see Now that we here, I swear, it feels good the way y'all envy me Don't tell me the only way to knowledge is college That sentence alone is symbolic, insinuates that your problems I won't stop for a soul, workin' day and night like cutty Here comes more than one song for y'all to love me, go   Don't hate, just envy, don't hate, just envy, don't hate, just envy, don't (don't) (oh, oh, oh, oh, oh) Don't hate, just envy, don't hate, just envy, don't hate, just envy, don't (don't) (oh, oh, oh, oh, oh) Don't hate, just envy, don't hate, just envy, don't hate, just envy, don't (don't) (oh, oh, oh, oh, oh) Don't hate, just envy, don't hate, just envy, don't hate, just envy, don't (don't) (oh, oh, oh, oh, oh)  (oh, oh, oh, oh, oh) ([?] I tried, [?] I tried) (oh, oh, oh, oh, oh)"
/songs/1154818,Nico & Vinz,A Cage It Falls Into,https://genius.com/Nico-and-vinz-a-cage-it-falls-into-lyrics,http://api.genius.com/songs/1154818,None,2018-09-07,"Recieving a head wind against the sky Falling, falling Pick those feathers up one by one Wandering, wandering  Hands of the man who waits for the end Are blue Travel forward and separate the Distance Sits on a chair, mouth sealed Vision warped and reflects the black  Future is overflowing with fear The Darkness goes on, the darkness gets Deeper Look back the mistakes in the Past Stack them up, stack them up  Throw up the meaning of overflowing Water strongly on to both of these Forgotten hands I won't abandon the smell of blood Flowing incessantly, eternally  We can still be disappointed We were again discouraged Abandon hope and became helpless Our arms are dragged by hope Pull and pulled back to the place we were  There I stop and lie down Stare at your back Loneliness of a smile Not to tell but to interrupt I laugh in a room and throw waste  Inside a tiny falling cage Down stream Depending on presents The darkness goes On. As long as it flows Winds go deeper Gouge out those false words Pile them up Wash away the footprints ahead Cajole us, make us forget and let us go In return for the presents We hand out"
/songs/1254540,Nico & Vinz,A Conviction that Speeds,https://genius.com/Nico-and-vinz-a-conviction-that-speeds-lyrics,http://api.genius.com/songs/1254540,None,2018-09-07,"A prvilege is circling in the sky in invisible speed Not knowing anything We are obliged only to follow With which authority can we refuse? If I dive off there It'll beyond me and everything goes forward I raise my arm, thinking I understood I follow this large line of people Conversation is the only way, I release and return Connected and go on The course to a conclution A beautiful time has passed Only the darkness and vivid red flash over the road The light is too small Can't see ahead We reach our hands to our destination  Who is to blame for this heart that killed Had a will to return, but he reproached me Solidly wait for a next chance Why he seems so gentle is because he is wrapped In a curtain and a shower of light And he hides the truth with the language He had barely studied. We don't wish to, but he talks The opposite. Holding the peace as an excuse Words he tells are vague. Acceptants don't bother to Replace them into their own words They just repeat what they're told Even truths are known Even everything is understood Reconciliation covers whole It changes the air. It changes the faces  Stare at only a moment ahead and hold on to tomorrow Not only the right things exist Crucial to think about it but the acceptants don't even think They pretend they are not listening They must have heard They must have seen Have a conviction but to be vanished deeply in grumble The time was surely beautiful It had been sunk into oblivion Standstill is an absolute necessity. I look around Despair and the speed overflow in my mind  (English translation)"
/songs/1536961,Nico & Vinz,A Cradle of Arguments and Anxiousness,https://genius.com/Nico-and-vinz-a-cradle-of-arguments-and-anxiousness-lyrics,http://api.genius.com/songs/1536961,None,2018-09-07,"You ask the significance of being Of being and you got lost In the way A moment of praise We find in hurting each other Tainted smile indicates Your position  Tie the pieces of memories you lost Together. You draw a loop in A heart running short Untie a tangle thread And talk about tomorrow Step on the stretching shadow And talk about tomorrow  Who did you put out for? You rise for the future Bring time into your mouth Ears not necessary Your eyes won't Reflect your heart anymore. Look down And wish for the sequel to dream Sequel to dream that you can pass out  ""When the time comes...""say the voice A shaking voice just before the last scene Shoulder the great ideology just like Carving those words on the heart  Take it back, give it, use it And render pointless What's repeated are the philosophy I've already learned I wish for another hapiness It brings despair and arguments at the Same time You said that you Can't come back are gone A blast blows me out"
/songs/139579,Nico & Vinz,Am I Wrong,https://genius.com/Nico-and-vinz-am-i-wrong-lyrics,http://api.genius.com/songs/139579,Black Star Elephant,2013-04-12," Ooh, ooh Ooh, ooh   Am I wrong for thinkin' out the box from where I stay? Am I wrong for sayin' that I choose another way? I ain't tryin' to do what everybody else doin' Just 'cause everybody doin' what they all do If one thing I know - I'll fall, but I'll grow I'm walking down this road of mine, this road that I call home   So am I wrong For thinkin' that we could be something for real? Now am I wrong For tryin' to reach the things that I can't see? But that's just how I feel (Ooh, ooh) That's just how I feel (Ooh, ooh) That's just how I feel Trying to reach the things that I can't see (Ooh, ooh, see, see)   Am I trippin' for having a vision? My prediction - I'ma be on top of the world Walk your walk, and don't look back Always do what you decide Don't let them control your life That's just how I feel, oh Fight for yours, and don't let go Don't let them compare you, no Don't worry, you're not alone That's just how we feel   Am I wrong (Am I wrong?) For thinkin' that we could be something for real? (Oh, yeah, yeah, yeah, yeah, oh) Now am I wrong (Am I wrong?) For tryin' to reach the things that I can't see? (Oh, yeah, yeah, yeah, yeah) But that's just how I feel (Ooh, ooh) That's just how I feel (Ooh, ooh) That's just how I feel Trying to reach the things that I can't see (Ooh, ooh, see, see)   If you tell me I'm wrong, wrong I don't wanna be right, right If you tell me I'm wrong, wrong I don't wanna be right If you tell me I'm wrong, wrong I don't wanna be right, right If you tell me I'm wrong, wrong I don't wanna be right   Am I wrong For thinkin' that we could be something for real? Now am I wrong For tryin' to reach the things that I can't see? But that's just how I feel (Ooh, ooh) That's just how I feel (Ooh, ooh) That's just how I feel Trying to reach the things that I can't see (Ooh, ooh, see, see)  So am I wrong (Am I wrong?) For thinkin' that we could be something for real? (Oh, yeah, yeah, yeah, yeah, oh) Now am I wrong (Am I wrong?) For trying to reach the things that I can't see? (Oh, yeah, yeah, yeah, yeah) But that's just how I feel  (Ooh, ooh) That's just how I feel  (Ooh, ooh) That's just how I feel Trying to reach the things that I can't see (Ooh, ooh, see, see)"
/songs/1798796,Nico & Vinz,Am I Wrong by Envy,https://genius.com/Nico-and-vinz-am-i-wrong-by-envy-lyrics,http://api.genius.com/songs/1798796,None,2018-09-07," Am I wrong for thinking out the box from where I stay? Am I wrong for saying that I'll choose another way? I ain't trying to do what everybody else doing Just cause everybody doing what they all do If one thing I know, how far would I grow? I'm walking down this road of mine, this road that I call home   So am I wrong for thinking that we could be something for real? Now am I wrong for trying to reach the things that I can't see? But that's just how I feel, that's just how I feel That's just how I feel trying to reach the things that I can't see   Am I tripping for having a vision? My prediction; I'mma be on the top of the world Hope you, hope you don't look back, always do what you decide Don't let them control your life, that's just how I feel Fight for yours and don't let go, don't let them compare you, no Don't worry, you're not alone, that's just how we feel   If you tell me I'm wrong, wrong I don't wanna be right, right If you tell me I'm wrong, wrong I don't wanna be right   --- ."
/songs/1599847,Nico & Vinz,Am I Wrong (Single),https://genius.com/Nico-and-vinz-am-i-wrong-single-lyrics,http://api.genius.com/songs/1599847,None,2018-09-07,"Am I wrong for thinking out the box from where I stay? Am I wrong for saying that I choose another way? I ain't trying to do what everybody else doing Just cause everybody doing what they all do If one thing I know, I'll fall but I'll grow I'm walking down this road of mine, this road that I call home So am I wrong? For thinking that we could be something for real? Now am I wrong? For trying to reach the things that I can't see? But that's just how I feel That's just how I feel That's just how I feel Trying to reach the things that I can't see Am I tripping for having a vision? My prediction: I'ma be on the top of the world Walk your walk and don't look back, always do what you decide Don't let them control your life, that's just how I feel Fight for yours and don't let go, don't let them compare you, no Don't worry, you're not alone, that's just how we feel Am I wrong? (Am I wrong?) For thinking that we could be something for real? (Oh yeah yeah yeah yeah oh) Now am I wrong? For trying to reach the things that I can't see? (Oh yeah yeah yeah yeah oh) But that's just how I feel That's just how I feel That's just how I feel Trying to reach the things that I can't see If you tell me I'm wrong, wrong I don't wanna be right, right If you tell me I'm wrong, wrong I don't wanna be right  Am I wrong? For thinking that we could be something for real? Now am I wrong? For trying to reach the things that I can't see? But that's just how I feel That's just how I feel That's just how I feel Trying to reach the things that I can't see So am I wrong? (Am I wrong?) For thinking that we could be something for real? (Oh yeah yeah yeah yeah oh) Now am I wrong? (Am I wrong?) For trying to reach the things that I can't see? (Oh yeah yeah yeah) But that's just how I feel That's just how I feel That's just how I feel Trying to reach the things that I can't see"
/songs/528864,Nico & Vinz,Another Day,https://genius.com/Nico-and-vinz-another-day-lyrics,http://api.genius.com/songs/528864,Black Star Elephant,2014-09-16," I used to pray every night when I was younger On my knees, folding hands with my mother And my mother used to say when she was younger She used to go to bed filled with hunger The same hunger got her working even harder Got her travelling to Norway from Ghana She said ""my son, we're blessed, now let's say Our Father"" Ups and downs, that's how life go What's high if you don't know low? So I try not to complain Appreciate life, man, I keep saying   Another day goes by, another day goes by And I thank God that I'm alive Another day goes by, another day goes by And I thank God that I'm alive   I think I was about ten years old Watching the news with my dad I didn't see nothing but tears and blood And a bunch of people looking so mad ""That's war"", I was told I said ""how? that ain't nothing like the games I have"" I couldn't grasp the sense of an innocent child Dying by the hands of a grown man And while some kids raised on cartoons Young girls making money in dark rooms We all deserve a decent meal Why his belly so soft? Why she holding that hard spoon? And where is my Head of State? If crime pays, talk peace, still engaging in heavy arms trade In the jungle that we call Sin City Wild life rules, survival of the fittest   Another day goes by, another day goes by And I thank God that I'm alive Another day goes by, another day goes by And I thank God that I'm alive   Oh, oh, oh, oh Oh yeah, yeah Why, why, why, why Yeah Eh, eh, eh, eh Thank God that I'm alive Oh, oh, oh, oh Oh yeah, yeah Why, why, why, why Yeah Eh, eh, eh, eh Thank God that I'm alive"
/songs/1026168,Nico & Vinz,A Red Wound Picture,https://genius.com/Nico-and-vinz-a-red-wound-picture-lyrics,http://api.genius.com/songs/1026168,None,2018-09-07,I look up at the bounded sky And imagine the linked pictures And then rub them off I carve the promises on my chest Words go on endlessly And eternity hides the end The sky keeps looking at the present I keep looking at the past Rend the clouds and cover my ears Vague words of the future. I won't listen See the eternal field with my eyes shut Imagine a destroyed picture Grasp the concocted stories They nail us up. They bind us up Scars seen after the strife Gentleness of the tears I shed Evil prickles on a tiny heart Redness of the blood I shed Redness of the blood I shed  (translated from Japanese)
/songs/700059,Nico & Vinz,Arrival (Interlude),https://genius.com/Nico-and-vinz-arrival-interlude-lyrics,http://api.genius.com/songs/700059,Black Star Elephant,2015-02-06,"Black Star Elephant. Now you're here. Don't look outside yourself. You have everything, you have everything inside there. Trust, have faith and be free. My son, use the knowledge and sing your song"
/songs/1573321,Nico & Vinz,A Warm Room,https://genius.com/Nico-and-vinz-a-warm-room-lyrics,http://api.genius.com/songs/1573321,None,2018-09-07,"Kokoro no kibo ha dare mi no daisho ne Kagami ni utsuru tsukare na egao Warui yume ha sugu ni kie te iki Mezami ta toki no koware ta sekai Bokura ha yogore o shokushi Imi o tsukuridashi Risei o yuuwaku Chisei o jizoku Kuruoshii hodo motome, kodoku o dakishimeru Wasure nai kioku Wasure nai yokogao  Muki au jikan o hahen de kaki Sukui dashi te ubugoe o kasaneru Hi ta sura kaki kangae umare ta Kawaru yochi Kawaru mono Mae de hibiku kamei to Tarun da kao Shikkaku no moji Boku ni todoku kana? Owari ga mie ta yo Ie ni kaero u"
/songs/1570637,Nico & Vinz,A Will Remains in the Ashes,https://genius.com/Nico-and-vinz-a-will-remains-in-the-ashes-lyrics,http://api.genius.com/songs/1570637,None,2018-09-07,"Lastly, stare at the sky and praise the will Reconciliations lying sprawled one on top of the other Action gets ahead of us Keep believing without realizing a long gone shadow Hide a voicless word I saved yesterday And lose track of it  Time goes on treasuring the fact in my mind That your pain has gone Grief repeats one way or the other Leave the door open with high thoughts Damage the present memories It stretches a complex maze Stray into it, pause for a moment And trace its shape deeply  A heart embeaces the courage and stops secretly It forgets the times. Fall asleep within the sound Leaving us behind  A face of darkness is so peaceful. We got a little envious of it I reflect my thoughts and prayed for my pain to stop I became naught for a will remains in the ashes My heart moves and gets high. My eyes freeze on My heart avoids the truth and the eyes And now the words echo. They were spelled by scraping my life Now the voice I kept screaming crossing my mind Cry only once and now I desperately ride on time Divided and found, I saw the end The answer I tell by ceasing Farewell is incomplete Believe and doubt The the beginning starts  (English translation)"
/songs/1172245,Nico & Vinz,Chain Wandering Deeply,https://genius.com/Nico-and-vinz-chain-wandering-deeply-lyrics,http://api.genius.com/songs/1172245,None,2018-09-07,Atemo naku samayou kotoni tsukare Motome iku jijitsu dakare ushinai Wakari au madeni ikudomo akirame Teni irete shitte ita Ori sosogu ameno itamiwo Nigedasu kotodatte dekita hazunanoni Hikitomete utsumuku Yamai no fukai rensan Udewo furikiri hashiridasu kimino hareta migiashi Sokode matsu ugokimo shinai Kotobawo morau hitono retsu Bokurawa itsumo rikaishi wakari aeta Onaji itamiwo ukeire udewo tsunagi Aruki tsuzuke sagashita yogoreta hidariashi Mitsuke dashita kokoroga Towani matsu basho Bokurawa matsukotoni Nare sugite Atae rareta tokiwo Mote amasu hodoni Joushikini nare sugite Saikoni sakebu kimiwo Tookude mitsumete Wasure sarareta ashitawo Omoi machi wabiru Tsukisaemo tsukameruto omotte ita Jibunni dekinai kotowa nakute Hitori dake no sekai wo tsukuri agete Mawariwa mude tsukuri ageta shindaiwa Risou wo kakage keshi Yatto sagashi dashita ryoashimo Imadewa seigyosare chigau hou he susumuyo Kimete nagare tsutaete rikaishitato Omoi konde susumu monjino raretsu Shizukade yasashii kotobano hibiki Sudeni modosenai Yutta shizumu monogatari
/songs/1261810,Nico & Vinz,Color of Fetters,https://genius.com/Nico-and-vinz-color-of-fetters-lyrics,http://api.genius.com/songs/1261810,None,2018-09-07,"Puzzled for long. Even at the dawn of the next day Sent back to the same spot again on a fixed hand  Couldn't tell I'm supported. Even I knew it Dreams I catch are superficial and childish. Lost a way to go rot Tighter fetters wear me out. Rob, robbed and disappear The remainder of obedience still chokes my neck and chest  What we found in time Hidden, never been understood Want other things for next Steal, breathe both past and future  What is epoch? What is today. The ties of life so fragile so vain Smashing each others mind. What is ideal. What is value Near nothing. The character is formed Wait not for tomorrow. People follow Slight expectation. Caved in and sunk  In the line of people receiving values A wond on my finger pictures the shadow A crack of breeze indicates tomorrow In a song, I curse. I set my mind higher  I smile without seeing the precious words of mind Fix my gaze upon the despair ahead. Am I sad... Dying as I live. Will I be in time...  Replace my memories with things I have forgotten Accept every distorted thing I see I go forward fearlessly for perfection My heart is in the other place Deserted my weakest voice  Familiar lonesome face also found what it means to think Wish for the end in my heart again and again  In sadness, a heavy will I hold humbly. Turn it into words And show it a little. Reflect the hope and shimmer on Darkness where the light reaches I feel a mind that walks all the way with the darkness An old memory driven mad  (English translation)"
/songs/2117827,Nico & Vinz,Come over,https://genius.com/Nico-and-vinz-come-over-lyrics,http://api.genius.com/songs/2117827,The Magic Soup And The Bittersweet Faces,2011-08-02,"I'm ready for war Come into town and I'll hide you on the rise In the city of gold Fighting the tower with my feelings aside When it's 2 in the night The fire's in my heart is gon' keep me alive And I'm ready for war The voice in my head It's telling me that I should stay in my bed 'Cause it's 2 in the night Why can't I sleep when it's 2 in the night 'Cause the fire in my soul, hey The fire in the soul got me ready to fight And I'm ready for war Climbed the streets And I found my way over You know I've been so lost in translation Like I'm fighting for truth in Babylon Tryna find my peace in this zone of war Even when the day comes Even when the day comes Even when the day comes Even when the day comes Even when the day comes Even when the day comes Even when the day comes I'll be ready when the day comes I'm ready for war I'm ready for action, now watch me kick in the door But what if the day comes when we go from sun to monsoon Who can I run to, run to, run to Will you be loyal, will you be true when I need you Say Climbed the streets And I found my way over You know I've been so lost in translation Like I'm fighting for truth in Babylon Tryna find my peace in this zone of war Even when the day comes Even when the day comes Even when the day comes Even when the day comes Even when the day comes Even when the day comes Even when the day comes I'll be ready when the day comes Even when the sky comes falling down I'll be ready when the sky comes falling down Today I will march for me Today You will march for you We raise our arms and hope for better wins We fight a million battles every day I don't wanna see us falling So we just gotta keep on running Even when the day comes calling I'm ready to march Even when the day comes Even when the day comes Even when the day comes Even when the day comes Even when the day comes Even when the day comes Even when the day comes I'll be ready when the day comes Even when the sky comes falling down I'll be ready when the sky comes falling down"
/songs/963258,Nico & Vinz,Conclusion Of Existence,https://genius.com/Nico-and-vinz-conclusion-of-existence-lyrics,http://api.genius.com/songs/963258,None,2018-09-07,"It is the origin of the language,it is the origin of creation Repeat the production.create miracles Relationship ends here.share the joy Preparation is the art.it is the conclusion of existence  Evidence is overflowing and confused.this is the very last evidence  The times of explotation go on.problems change their shapes and repeat themselves The increase changes everything.they interrupt in the middle of the conversation Inventions made and destroyed.the sins chase you at all times Dear you,the surface has been polished and the desire is swelling up"
/songs/1575313,Nico & Vinz,Crystallize,https://genius.com/Nico-and-vinz-crystallize-lyrics,http://api.genius.com/songs/1575313,None,2018-09-07,"English:  Countless dead eyes without Their dreams ever paid off The words of a poet reflect In a drift of daily life That had spit out Fragments of memory are on the way And they are supposed to be right The fact that it is 2 The silence swore to proceed till the end The crystallization of the time  Picture a light A personality on my mind Catch the ripped wishes With my hands Regulation and existence Even lost the meaning Fought with difference and The doubt was born A smile and an answer Filled with loneliness A warped mirror Shows the criticism  The group-mind is brightly decorated And erased its identity You speak and go beyond The present time to find eternity The times marked the painful eternity The same condition gained the pain  Suppress my mind And the last word falls  I stand where no one would see We make, and steal the process You who read and the standart are fair Not a single truth, so sleep on the ground"
/songs/1418660,Nico & Vinz,Distress of Ignorance,https://genius.com/Nico-and-vinz-distress-of-ignorance-lyrics,http://api.genius.com/songs/1418660,None,2018-09-07,"The cruel history is still holding The time raised this valuable theory Learning crushes the mistakes Only on the days we cry, we rip the times  And now, the background of the stories we tell and pass We know it and the truth at the bottom is crazed What our behavior means What comes from our knowledge? Though we wait, the answers won't come ahead  Cannot connect each person's thinking Everything is ill-matched and awkward High ideal. Sickness and poor minds Ignorance becomes a brag. Such a sad distance A miracle of sinful brains  Now switch. Dare tomorrow Hold a great force to avoid agony Left in a self-alienation Have faith in both erasing you out and loving you The origins play frightened in a small garden  (English translation)"
/songs/1031107,Nico & Vinz,Don't Let Go,https://genius.com/Nico-and-vinz-dont-let-go-lyrics,http://api.genius.com/songs/1031107,None,2018-09-07,"When it all comes crashing down And your world stops spinning round You feel like your falling from the clouds But you never hit the ground  So take this stretch of road We'll call it home Just run away with me tonight Just don't let go Of me  Can a love like ours survive In such cold uncertain times? I know that if you only hold me tight We can make it through tonight So let's run on down the interstate And across the sea Everywhere I go, I wanna take you with me  Don't let go Of me Don't let go Of me  When I close my eyes and I think of you We're going to make it babe We're going to make it through Just don't let go  Underneath black velvet skies Forever in your eyes I see reflections of the lights Just dance with me tonight Overhead the sky explodes And my heart it overloads Throw your arms around my neck And don't let go  We'll take this stretch of road We'll call it home Just run away with me Just don't let go Of me  Don't let go Of me Don't let go Of me  Don't let go Of me Just don't let go"
