api_path,primary_artist,title,url,song_endpoint,album,release_date,lyrics
/songs/2054506,Nico & Vinz,In your arms (dans tes bras),https://genius.com/Nico-and-vinz-in-your-arms-dans-tes-bras-lyrics,http://api.genius.com/songs/2054506,None,2018-09-07,"I feel like Superman They gonna remember me I think I know I can Who says it's hard to reach Who's gonna stop me on the road to success I don't know They tried to break me down But I'm still on my feet This city's full of life So why is it hard to breathe Oh why did God create this world so unfair I don't know Sometimes I feel like I can't run, I can't crawl And sometimes I feel like I ain't nothing at all Life is a journey where you stumble and fall But I'm okay When I lie down in your arms Oh oh oh oh oh Oh oh oh oh oh Oh oh oh oh oh When I lie down in your arms Oh oh oh oh oh Oh oh oh oh oh Oh oh oh oh oh When I lie down in your arms I feel like moving back Sometimes it's hard to dream The life I chose is past It's moving without me Who doesn't want a machine so they can go back in time I don't know My time went by too fast There's no one left but me I've got a nine to five And it gets the best of me This is the life I'm gonna live to the end But I'm okay When I lie down in your arms Oh oh oh oh oh Oh oh oh oh oh Oh oh oh oh oh When I lie down in your arms Oh oh oh oh oh Oh oh oh oh oh Oh oh oh oh oh When I lie down in your arms Sometimes I feel like I can't run, I can't crawl And sometimes I feel like I ain't nothing at all Life is a journey where you stumble and fall But I'm okay When I lie down in your arms Oh oh oh oh oh Oh oh oh oh oh Oh oh oh oh oh When I lie down in your arms Oh oh oh oh oh Oh oh oh oh oh Oh oh oh oh oh When I lie down in your arms Oh oh oh oh oh Oh oh oh oh oh Oh oh oh oh oh When I lie down in your arms Oh oh oh oh oh Oh oh oh oh oh Oh oh oh oh oh When I lie down in your arms"
/songs/970103,Nico & Vinz,Isolation Of A Light Source,https://genius.com/Nico-and-vinz-isolation-of-a-light-source-lyrics,http://api.genius.com/songs/970103,None,2018-09-07,"Memories I see in the direction I'm talking We speak words, our eyes go down We got flicked and have lips of isolation Drop our gaze and bound for farewell  Beyond that door I was scattered selflessly History changed the light into letters Present wounds separate the times The meaning hides under the shadow I cast I let the current take its own course and put out my thoughts Eternal smile is here  Rescued, cherished, I keep walking My fingers are cut while groping the dark Stain stays on the spinning thread Others tear for the closed manipulation  I have a wish in my hand with endless ideals Memories I put in the poem travels and arouses A man overflowed from the sand he seized Melted loop asks for the time The light behind me came to its senses yesterday I wonder and the wind is piercing  Options fit in a small space They vanish and float, and there is nothing to invent Azure silence gives prayers to the moon Reflect the passing seasons on your look on an eye It's wet and it's branded on Overflowing takes you to the stage for tragedy Whiteness of grass withering cold A smell of the rain speaks dull Seek the light source and reveal life Cross the vibration and a chance begins"
/songs/528846,Nico & Vinz,Know What I'm Not,https://genius.com/Nico-and-vinz-know-what-im-not-lyrics,http://api.genius.com/songs/528846,Black Star Elephant,2014-09-16," I look in the mirror and ask myself-self-self-self-self who I see Who I've become and if I will stand up for my-y-y-y-y beliefs Father told me to listen to my heart And don't do what doesn't feel right So my conclusion is I am who I am and everything that I am not   I've been wondering and wondering and trying to find the home With these questions I'm asking it feels like I know what I'm not   Yeah, I know what I'm not Yeah, I know what I'm not I keep searching, don't know if I'll stop Yes, I know, yes, I know, yes, I know what I'm not   I've been a victim of trying too hard, now I finally see That every person was fighting so bad I won't be who they want me to be The said that I should act a certain way And I would listen, what a great mistake It's my life and my choice to make Now I know what I'm not   I've been wondering and wondering and trying to find the home With these questions I'm asking it feels like I know what I'm not   Yeah, I know what I'm not Yeah, I know what I'm not I keep searching, don't know if I'll stop Yes, I know, yes, I know, yes, I know what I'm not Yeah, I know what I'm not Yeah, I know what I'm not I keep searching, don't know if I'll stop Yes, I know, yes, I know, yes, I know what I'm not   Put your worries on a plane Let them fly, let them fly, let them fly Send them on a helicopter Let them fly, let them fly, let them fly Pour all of your sorrows over board (over board) Tell 'em we don't need 'em anymore (anymore) Lift your feet up of the air Say goodbye, say goodbye to the past [?] don't look behind [?] won't pay your eyes [?] don't look behind [?] fly, baby, fly   Yeah, I know what I'm not Yeah, I know what I'm not I keep searching, don't know if I'll stop Yes, I know, yes, I know, yes, I know what I'm not Yeah, I know what I'm not Yeah, I know what I'm not I keep searching, don't know if I'll stop Yes, I know, yes, I know, yes, I know what I'm not"
/songs/1743495,Nico & Vinz,Kokadinye (Interlude),https://genius.com/Nico-and-vinz-kokadinye-interlude-lyrics,http://api.genius.com/songs/1743495,Black Star Elephant,2015-02-06,"Kokadinye nelephant Kokadinye nelephant Kokadinye nelephant Kokadinye nelephant Kokadinye, nyelepho, la la la la Kokadinye nelephant Kokadinye nelephant I'm, konadinye I'm, naolneme, phokechi I'ma ema, ayma I will always be there for you 'Cause, I love you, ema"
/songs/1849688,Nico & Vinz,Lakota,https://genius.com/Nico-and-vinz-lakota-lyrics,http://api.genius.com/songs/1849688,Black Star Elephant,2015-02-06,"She said where I'm at Ain't where I be My heart, my soul My all I give She said I'd be the one I got hopes and dreams For me, my son My only king  Imaa Imaa yeah Imaa Imaa yah Imaa Imaa yeah Imaa Imaa yah Imaa Imaa yeah Imaa Imaa yah Imaa Imaa yeah Imaa Imaa yah  You can plant a seed You can give a life You can help me grow Or you can turn your eyes One thing I know She took my side Through the fire, through the rain Your protector I remain, oh And I knew that one day I'd meet someone like you to save me Yeah, I knew that one day I'd meet someone like you to share with And I know that I'm okay As long as I got you to help me Hey now, hey ma, I hope I hold your  Imaa Imaa yeah Imaa Imaa yah Imaa Imaa yeah Imaa Imaa yah Imaa Imaa yeah Imaa Imaa yah Imaa Imaa yeah Imaa Imaa yah  I'mma scream out I'mma scream so my father hears me, yeah I'mm sing loud I'mma sing so my brothers hears it, yeah I'mma scream out I'mma scream so my mother hears me, yeah I'mma sing loud I'mma sing loud Imaa yeah I will prosper Imaa yeah Imaa yeah Look at me prosper Imaa yeah Imaa yeah We'll fight Imaa yeah Imaa yeah I love you Imaa yeah oh  Oh, oh  ? I don't know now, I've been looking I don't know now, I've been over, don't worry  Imaa Imaa yeah Imaa Imaa yah Imaa Imaa yeah Imaa Imaa yah Imaa Imaa yeah Imaa Imaa yah Imaa Imaa yeah Imaa Imaa yah Imaa Imaa yeah Imaa Imaa yah Imaa Imaa yeah Imaa Imaa yah Imaa Imaa yeah Imaa Imaa yah Imaa Imaa yeah Imaa Imaa yah  Imaa"
/songs/528744,Nico & Vinz,Last Time,https://genius.com/Nico-and-vinz-last-time-lyrics,http://api.genius.com/songs/528744,Black Star Elephant,2015-02-06," I see the stars in your eyes And you know you've lost your disguise When I hit that with a bang When I'm in that you're insane, oh (Work it, work it, work it)   In a cave, on the dock, on the roof, everywhere Under the clouds when it rains, I don't even care Nothing can keep me from your loving, no way Climb a mountain long as we got peace I can please you on a desert, the bottom of the sea No matter where we are   Tonight we're making love like our last time Like our last time Like our last time Like our last time Last time   You got what I need, yo, I know it might sound crazy But I'm drowning in your sea and I don't want nobody to save me Girl, something in your eyes making it hard for me to leave So hard for me to leave, you make it too hard for me to leave you, oh (Work it, ride it, work it) You make it hard for me to leave (Work it, ride it, work it) You make it hard for me to leave Dance on top, on top, on baby, just dance on top, on top Dance, don't stop, oh baby, let's dance all night, all night   In a cave, on the dock, on the roof, everywhere Under the clouds when it rains I can please you on a desert, the bottom of the sea No matter where we are   Tonight we're making love like our last time Like our last time Like our last time Like our last time Last time   I call it the two-by-two Good lovin', me and you I call it the two-by-two Good lovin', me and you I call it the two-by-two Good lovin', me and you I call it the two-by-two Good lovin', me and you   (Love the way you are) (Way you are, nah nah)   The way you call it The way you got me Way you call it The way you got me (Work it) (Work it) (Work it)   Tonight we're making love like our last time Like our last time Like our last time Like our last time Last time   I call it the two-by-two Good lovin', me and you I call it the two-by-two Good lovin', me and you I call it the two-by-two Good lovin', me and you I call it the two-by-two Good lovin', me and you"
/songs/2350819,Nico & Vinz,Lay a Little Closer,https://genius.com/Nico-and-vinz-lay-a-little-closer-lyrics,http://api.genius.com/songs/2350819,Cornerstone - EP,2016-10-30," Lay a little closer, lay a little closer And just take my hand and just take my hand Lay a little closer, lay a little closer And just take my hand, we will be okay  [Verse 1 - Nico & Vinz] You and I are not on different sides of the world You and I are not on different sides of the sea, no And I am crying for you, you are crying for me So lay your head down close to me, don't be afraid no   Lay a little closer, lay a litter closer And just take my hand and just take my hand Lay a little closer, lay a litter closer And just take my hand, we will be okay  [Verse 2 - Nico & Vinz] If I, if I, if I can't call you, can't call you My baby, my baby The sky keeps falling down, and I'm crying for you now So lay your head right next to me, don't be afraid no   Lay a little closer, lay a litter closer And just take my hand and just take my hand Lay a little closer, lay a litter closer And just take my hand, we will be okay   What you waiting on? What you waiting for? Are you ready? What you waiting on?"
/songs/1075900,Nico & Vinz,Left Hand,https://genius.com/Nico-and-vinz-left-hand-lyrics,http://api.genius.com/songs/1075900,None,2018-09-07,Emotion and forced to erase And I put it on a line A head to solve the deprived cipher And an earles cell are both torn off An intangible red arrow Penetrates the body  The refusal they make up disregard The minority opinion Responsibilities go up in the air Resistance collapse easily Then discrimination appears an Ungraspabale light penetrates my eye  A decomposed thumb in my cursed Left hand runs away quickly  Glare back the glaring eyes Armed with jarring noise Nothing happens Just a slight transition is on the way Only changes Only deserts Common knowledge simply go paralyzed Let loose the spellbinding
/songs/1058523,Nico & Vinz,"Lies, And Release From Silence",https://genius.com/Nico-and-vinz-lies-and-release-from-silence-lyrics,http://api.genius.com/songs/1058523,None,2018-09-07,"Scrape up the burned out body Put my feeling on to it Fix it and let it Flow in the stream of time  Give anxiety to the continuous rain Shake off the tainted ashes Advance, retrace, always raining At the beginning Rain an incantation of amnesia Fill in with felocity and imitation  For whom we travel? An opened wind vent is filled with The ready made articles Realized at the last moment Depth of affection, consequence Upon infatuation, shame of lacking Fake conversations The endless dependence on Top of my fist Let sound release it  Feet took off for the place Not to fear, only doubts keep swelling Forget to worry and keep remaining Liberation is to hold hands in the back And summon only words"
/songs/3300602,Nico & Vinz,Listen,https://genius.com/Nico-and-vinz-listen-lyrics,http://api.genius.com/songs/3300602,Elephant In The Room - EP,2017-11-03," Is it true what they say about you? Do you want me love? Are you playing me for a fool? See, I've been waiting far too long Darling, been feeling long to know I don't know what the future holds You're moving, the truth unfolds   Heard your hips don't lie I'mma listen to you This been on my mind All that we can do, yeah Your body's talking, it's talking loud Listen to it Your body's talking, it's talking loud Listen to it   Sexy lady, will you dance with me? Body talking like a tambourine Don't have to tell me 'cause I'm onto you I want it if you want me to Move your body, speak your mind Bodytalk, I know the signs Fire blazing, blow my mind Gitchi gitchi ya ya ya   Heard your hips don't lie I'mma listen to you This been on my mind All that we can do, yeah Your body's talking, it's talking loud Listen to it Your body's talking, it's talking loud Listen to it   Hold me, hold me Love me, save me tonight Hold me, hold me Love me, save me tonight You got me undone I can really feel it, baby, you're the one The way you move it, it's unreal It's all you, you're the one I want, yeah   Heard your hips don't lie I'mma listen to you This been on my mind All that we can do, yeah Your body's talking, it's talking loud Listen to it Your body's talking, it's talking loud Listen to it"
/songs/3301675,Nico & Vinz,Love 2 Feel,https://genius.com/Nico-and-vinz-love-2-feel-lyrics,http://api.genius.com/songs/3301675,Elephant In The Room - EP,2017-11-03," If you down, if you want to I got it ready for you I got it ready for you Any way that you want to Evoke the spirits in you Evoke the spirits in you Can't nobody to stop us now Can't nobody to slow us down I just feel like I know you now I'm focused now Can't nobody to stop us now Can't nobody to slow us down I just feel like I know you now Why you grinding so close right now   I decided that you Gotta be the one for me Baby, it's true I just love to feel how I feel around you I just love to feel how I feel around you I decided that you Gotta be the one for me Baby, it's true I just love to feel how I feel around you I just love to feel how I feel around you   I just gotta know what I'll be missing if I said no What if we try to go the distance, would it be wrong? Blinded by the loss of life, sees it now, baby, need you now We just need an open mind and we'll be fine Baby, ease your mind 'cause   I decided that you Gotta be the one for me Baby, it's true I just love to feel how I feel around you I just love to feel how I feel around you I decided that you Gotta be the one for me Baby, it's true I just love to feel how I feel around you I just love to feel how I feel around you   Baby, won't you talk to me? Baby, won't you talk to me? Baby, won't you talk to me? Baby, won't you talk to me? Oh, baby, hope it's not too crazy Us now, what's it all about? Oh, baby, hope it's not too crazy Us now, what's it all about? Oh, baby   I decided that you Gotta be the one for me Baby, it's true I just love to feel how I feel around you I just love to feel how I feel around you I decided that you Gotta be the one for me Baby, it's true I just love to feel how I feel around you I just love to feel how I feel around you"
/songs/528853,Nico & Vinz,Miracles,https://genius.com/Nico-and-vinz-miracles-lyrics,http://api.genius.com/songs/528853,Black Star Elephant,2014-09-16," Some gon' tell you one thing, but I'm gon' tell you different I wasn't born a rapper and I never was a singer Everything I know I picked up along the road Breaking hour after hour, man, I never let it go I never was the best, man, I wasn't even close I never had girls running everywhere I go I'm telling you this just to let you know that I believe it's all within us, reach to where it's at   It don't have to be miracles, oh The fire's within your soul You don't have to be big and tall, oh Just stand up and know your role So we say ah   I told my little brother keep on doing what you love To make it on the field is what he's been dreaming of So never stop evolving even though you know you're blessed Make sure that your next day will always be your best Oh, it's not a magic trick that'll get you there The only miracle cure is blood, sweat and tears The road is rocky, but don't you ever go astray You'll bring home a trophy if you walk it all the way   It don't have to be miracles, oh The fire's within your soul You don't have to be big and tall, oh Just stand up and know your role So we say ah   They say you are what you seek for At the end of the rainbow See the light at your window Don't be scared when the rain falls What is hard can be simple What is far can be so close At the end of the rainbow I see all that I dreamed of"
/songs/1782642,Nico & Vinz,My Melody,https://genius.com/Nico-and-vinz-my-melody-lyrics,http://api.genius.com/songs/1782642,Black Star Elephant,2015-02-06," x2 My melody [?] My melody [?] My melody [?] My melody [?]     Will you care for me, care for me? When nobody will me see me? Will you care for me, care for me? When nobody will me see me? Will you cover me gently? Let me sleep in your house tonight You know, you know, you know   By the depth of the well And the trunk of the tree That's where I waited So that you could comfort me, comfort me 'cause I needed to talk, you just walked But what's so wrong about it? My fam done kicked me out Society, I'm torn about it And you talk to me Like you know where I've been Talkin' 'bout, ""That's real life,"" I'm talkin' real dear, so what we talkin' 'bout? I can't inhale the air in the world, polluted with ignorance These lungs don't wanna read no more That's all I'm able to talk about If these my last words I would sing this And if I have to go Play this at my funeral So I'ma let the music play for every day that you're afraid We all cry but your tears ain't the same, I can see that Now we can't kill what is hard, ill and vicious But improve these statistics, enlighten our existence Believe that   x2"
/songs/1048701,Nico & Vinz,Mystery and Peace,https://genius.com/Nico-and-vinz-mystery-and-peace-lyrics,http://api.genius.com/songs/1048701,None,2018-09-07,"The end falls into a darkness called symbol The sound spreads in moments of evil  Silence sticks as we support and live Daily Winds blow and push out one after another The future we hold slips through and crush It shakes, dreads and it avoids us  A slow motion drip of blood Is almost black It arouses the mystery and peace To the harmed ground Secrets to be revealed Ambiguousness of words to be removed Pick up those filtered words and line them Up only with emotion  Burn the admirably adorned abandonment Into the eyelid Violated sound arguments Just go forward without difficulty Tomorrow long hoped for wouldn't Award anything It's nothing new, only cold A man desires for action A heart holds territory The walls are expanding  Show me the definite line ahead Put out the given hallucination  It doesn't wish to coexist Staring at tomorrow alone It talks and appeases us With the force incredibly fast which We can never catch up  Stall we have gone into Talk only about catching up Accept all and wait for the end Laughing"
/songs/1184613,Nico & Vinz,Never Wanna Lose This Feeling,https://genius.com/Nico-and-vinz-never-wanna-lose-this-feeling-lyrics,http://api.genius.com/songs/1184613,None,2018-09-07,"I never wanna lose This feeling here with you It's in the way you move Underneath the sky, the stars, the moon I can feel it in your touch The fire burning from your fingertips Oh baby what a rush The feeling of your heartbeat on my lips Without you I can't live  I never wanna lose this feeling It's keeping me alive I never wanna lose this feeling Laying here with you tonight I can feel your is beating And the magic's still alive I never wanna lose this feeling When I look into your eyes  I never wanna lose this feeling Here tonight And I don't wanna sleep I wanna take my time and do it right When I look into your eyes I see so clearly everything I need Oh how can we survive When the world outside will never let us be Without you I can't breathe  I never wanna lose this feeling It's keeping me alive I never wanna lose this feeling Laying here with you tonight I can feel your heart is beating  And the magic's still alive I never wanna lose this feeling When I look into your eyes  I never wanna lose wanna lose your precious touch I never wanna lose this lust I never wanna let you slip away I never wanna lose the love you bring I never wanna lose this feeling Without you I can't live  I never wanna lose this feeling It's keeping me alive I never wanna lost this feeling Laying here with you tonight I can feel your heart is beating And the magic's still alive I never wanna lose this feeling When I look into your eyes  I never wanna lose I never wanna lose I never wanna lose this feeling I never wanne lose this feeling Laying here with you tonight I can feel your heart is beating And the magic's still alive I never wanna lose this feeling When I look into your eyes"
/songs/1244680,Nico & Vinz,Night in Winter,https://genius.com/Nico-and-vinz-night-in-winter-lyrics,http://api.genius.com/songs/1244680,None,2018-09-07,English:  Refutation I shoot to Defend me all the way Your words float and flow They say they received them The mysteries of today tumbles down They should be announced Farewell for good Believing the kindness tommorow  Back to back with fear Reflect them in the tiny sky You behave against your look A lot of truths are here A long thought overflows only From one man's mouth and ears The intentions are the screen That starts with grief  One step ahead to the time of nothingness Get permission from you whom I have outlived Scattered infinity collected in my hands Eyes opened for the last sensed sign  Blessings. They are given To the world I turned my back The conversations can't heal The fate at the early stages
/songs/2350831,Nico & Vinz,Not for Nothing,https://genius.com/Nico-and-vinz-not-for-nothing-lyrics,http://api.genius.com/songs/2350831,Cornerstone - EP,2015-10-30," Why does a rose need water and a whole lot of sunshine? One more time Why does a rose need water and a whole lot of sunshine? Why does the night need moonlight? Tell me Oh not for nothing, not for nothing   Why do the wheels keep rolling? Oh Metal down to the floor yeah, tell me Why do we stop at a red light, oh I Not for nothing, oh not for nothing Freedom fighters, fighting in silence Oh but not for nothing, no not for nothing   Why do the hands keep ticking around the clock? Like the sand in a hourglass, so slow but so fast Why are we born into sinning just to be born again? Not for nothing, oh not for nothing Oh not for nothing, oh no Oh not for nothing, oh not for nothing   When you see my hands up and I say I can't breathe That's not for nothing, oh no When my hands are up high and I say I can't breathe It's not for nothing, it's not for nothing Oh not for nothing, oh not for nothing"
