api_path,primary_artist,title,url,song_endpoint,album,release_date,lyrics
/songs/4047616,Nico & Vinz,Envy x lazarus effect,https://genius.com/Nico-and-vinz-envy-x-lazarus-effect-lyrics,http://api.genius.com/songs/4047616,None,2018-09-07,Smoking drop yeah money long yeah not yet but my bitch wet who pose a threat bitch im coming next yeah probably next year. Most of these niggas be ass tho i wanna be ballin like kobe hoe i bet she watch me like kody tho cuz i got the fire stick throw u in a fire pit bitch i got the fire lit everybody wants a hand out a quiet nigga but i stand out young Nigga i wanna be the man now and i promise ill never back down yeah. It's a challenge i need a bitch and she valid yeah. Niggas gettin toss like some sald pause ima go hard for my team yeah i need that green ain't know stopping me she gon fuck my team yeah she a mascot. Ima get that money to the death of me ima cook a nigga up like recipe i gotta give the game the fucking rest of me ima break a nigga down like fraction all them niggas laughing back then ima cut em off like umbilical ain't know nobody feeling you she touching like a physical we gettin physical smoking strong yeah money long yeah not yet but my bitch no nigga don't pose a threat
/songs/1968156,Nico & Vinz,Everywhere,https://genius.com/Nico-and-vinz-everywhere-lyrics,http://api.genius.com/songs/1968156,The Magic Soup And The Bittersweet Faces,2011-08-02,"Yea, you everywhere Where you going girl Where you going girl Where you going girl Yeah Baby got passion for hitting the club Don't know what she's trying to prove When she's shaking that butt High heals, tinny skirts They won't bring you love (?) around the club I ain't fooled by the makeup, I can see the real you I know them dirty dudes all the boys that you into Poppin bottles causing cars (?) rental They want the brain girl, not their mental Haha, she just want to do the clubing With another nigga, but he got'a be bubblin Buzzin, she ain't got'a love him Let me think about cuff'em I'ma live for the moment If I need to be around her Even though she wildin Just something about it Can't leave without her Keep thinkin of her, she's the girl I admire Stop... I'm a mothafucking lier Everywhere you go And every party thrown You see her with somebody Somebody that you know Yea, you everywhere Where you going girl Where you going girl Where you going girl I see her everywhere I go With a smile and a drink on her toes Peppergirl, every girl haze on her low Pepergirl and every douche tryna poke Something about the glow, something about the lamb light"
/songs/1598406,Nico & Vinz,Farewell to Words,https://genius.com/Nico-and-vinz-farewell-to-words-lyrics,http://api.genius.com/songs/1598406,None,2018-09-07,An extinct trust A protected distress A terminated daybreak An established rule  Lies of legitimacy Cheated love Recieved the end now The sky reconciled  A world nothing but numbers Tradition remains behind it Laws to defeat Farewell to words  The ashes dyed in vermillion Pain from the nailmarks Surging anxiety Snatched answer  Toss in a mass of stacked Gloom to strangers who Abandoned the pain Imaginations Turn into a greatest sin Leaning only forward You can hear You lost your smile Love to the fingertip That's out of reach Another shadow drooping To the same direction But forgotten to Head straight  A left over head will bundle Everything up into one
/songs/1860918,Nico & Vinz,Find a Way,https://genius.com/Nico-and-vinz-find-a-way-lyrics,http://api.genius.com/songs/1860918,None,2018-09-07,"Made my way to the borderline Lookin' up toward the friendly skies Everything that I thought I had Taken right before my eyes Oh yeah Give me faith, give me love, Cause I need it! Show me grace, make me strong, let me feel it! Where to go, Can I walk to redemption Don't know how I'll be okay But I'll find a way Said I'll find a way Don't know. How I'll be okay But I'll find a way Do you remember, that when we used to play? Do you remember, when you put me in my place? Do you remember, when you told me I should go? And I left you fighting all alone? I see the writings on the walls I feel it coming. Yes I do Us together like before I don't know how we'll be okay But i'll find a way I don't know how we'll be okay But i'll find a way No matter way, No matter way I am gonna see any way No matter way, No matter way I am gonna see any way To lord your boar to lord your terror I pray To lord your boar to lord your terror I pray Cause I've waited finally shout To open up my mouth and let the truth come out Yes i'll say it without a doubt Don't know. How I'll be okay But I'll find a way (Say!) I will find a way (Say!) I will find a way (Say!) I will find a way (oh!) I will find a way (oh!) I will find a way (whoow!) I will find a way I will find a way (Oh! ...Oh!...oh!) (Say!) I will find a way (Say!) I will find a way (Say!) I will find a way (oh!)I will find a way (oh!) I will find a way (whoow!) I will find a way I will find a way (Oh! ...Oh!...oh! Say!) Said I Will find a way oh. oh Said I'll find a way oh... Oh I said I don't know how I'll be okay, but I'll find a way"
/songs/1279643,Nico & Vinz,Further Ahead of Warp,https://genius.com/Nico-and-vinz-further-ahead-of-warp-lyrics,http://api.genius.com/songs/1279643,None,2018-09-07,"English:  Painted all and spit out Stare at the air in the sound of rain A song & sleep to unknown you Reach out and doubt my lips  A crooked oath I write with my bare hand I turn my eyes away and write solitude Hold hands with a shapeless shadow And it always sways us to crush  The end of the day pops with the constant Wind and points its finger  Erase all and swallow Cleanse my mind under the sound of wind Connect the line that cuts me dead Wait for the quiet and peaceful tomorrow  Ahead of the absent life and the erased voice The secret of value goes freely The blank is colorless Hopes flash deep inside the opened eyes I refuse them  Conveyed the beloved words and eyes And the fading piece is sinking Run on the laid out road to a dead end Admit a lot, make the all clear sight As my raison d'etre Nameless mind My feeling rides on the scene..."
/songs/141516,Nico & Vinz,Go Loud,https://genius.com/Nico-and-vinz-go-loud-lyrics,http://api.genius.com/songs/141516,The Magic Soup And The Bittersweet Faces,2011-08-02,"This gone be are anthem Go loud and dance some (x2)  Hey what’s you need Oh yeah I got it We gone do it all Break the silence We gone make some noise Solve more problems So Let it go now Let it flow Let it all out  (Look)  I go hard Tell me if you go hard Motivation to the ceiling Cause my money is to the to the floor I don’t care bout no hater I don’t care bout them at all Barely sleep, cause you snooze you lose We living by the code Now all this label’s wanna be friends That’s cause all that we doing is win Couple hundreds thousand views And a double platinum Trust me I have seen some things They can't stop me now that I’m in Young and inspiring Rest in peace Benjamin  Shout to my boy's that's playing ball All the young blood’s that’s where I’m from Wouldn’t be nothing with none of yall All my top class student’s who did it against the odds And my real African friends working harder then all What’s up?  Ain’t no reason to pretend If I got this motivation it’s because of you (that's right) Ain’t no doubt we going in If I am just where I am it’s because of you I got this far  Hey what’s you need Oh yeah I got it We gone do it all Break the silence We gone make some noise Solve more problems So let it go now Let it flow Let it all out  And go loud Go loud for me Go loud for me Go loud for me Hey, whatcha you doing (whatcha doing) Go loud for me Go loud for me Go loud for me yeah  Now the place’s I can go I don’t wanna stay And I won't close my eyes and let them take it all away And I won't let them tell me I’m to late I won’t wait Life is working out And I’m in my best shape  You see I’m running And y'all can't never fit me in no box I be I be shooting stars From squares ain't got no shot Keep doing what’s you doing Til they see just what’s you got We be on it non stop Magic Soup inside that pot  Hey wall out Tryna do it all Whatever feels right Always on my toes Trying to stay off them heals like Man I ain’t trying to fall back We all that and then some This gone be are anthem Go loud and dance some  This gone be are anthem Go loud and dance some (x2)  Hey what’s you need Oh yeah I got it We gone do it all Break the silence We gone make some noise Solve more problems Let it go now Let it flow Let it all out  And go loud Go loud for me Go loud for me Go loud for me Hey whatcha you doing (whatcha doing) Go loud for me Go loud for me Go loud for me yeah  Yeah keep doing whatcha doing Go loud for me Go loud for me  We gone do it (do it) Like it’s nothing (nothing) Got to tell them go loud (x2)"
/songs/1055401,Nico & Vinz,Go Mad and Mark,https://genius.com/Nico-and-vinz-go-mad-and-mark-lyrics,http://api.genius.com/songs/1055401,None,2018-09-07,"You extend your heartbeat hoping to Satisfactiory circulation Forget the body you have entrusted Smile at the corner of memories  Even an accidental streaming voice won't touch tomorrow Awkwardly pile up the isolation with anxiety one by one It keeps talking without ceasing before me Even i can do little There is nothing i want to hear What is that i can do for now?  The times i saw the place i ended up I grasp the vision i found in the end  Shut everything up from the world again For a tiny ray of light Set it free from this anxiety Raise it carefully There is ntohing here Suffer for nothing as it is Walk around cause its entertaining Couldn't keep the promises to replace you I always carry it with me until the time comes I know you won't wait Because you are farther away from me Caught up only be earning Dont even try to let it go  At the end of the world i found out i can't turn back Staring with farewell. then comes the time the promise expects Someday...  Eyes that abandon individuality and hope you dislike Exhausted moment melts into a given sigh  This feeling goes on endlessley I obtained after a total transformation The map comes back into a faded color I tear it and stray The past, tomorrow, the future, its all fixed It goes on, intense, growl, it goes on Stop, eternally, calm, stop Reach ahead, stir, reach Mark today- go mad and mark  (English Translation)"
/songs/3300615,Nico & Vinz,Headlights,https://genius.com/Nico-and-vinz-headlights-lyrics,http://api.genius.com/songs/3300615,Elephant In The Room - EP,2017-11-03," Finding patience in this foul life When I can see no right With no hope inside Blind All the worries I bring home at night Suffocate all life Just wanna close my eyes I   I know, I know I see it, it all fades to black I know, I know this can't be light   So hold me tight, my maker Don't you let me go I've been close to falling off And I can't hear you anymore Hold me tight, my maker Don't you let me go I've been lost walking this road And I need you to show me home   Headlights Headlights Headlights Headlights Lead me through the darkness in these troubled times   I never know how much she meant to me And I will never be Who's gonna rescue me, now You must as much forgot my trees 'Cause all I got is fallen leaves I'm in way too deep, drown   I know, I know I see it, it all fades to black I know, I know this can't be light   So hold me tight, my maker Don't you let me go I been close to falling off And I can't hear you anymore Hold me tight, my Don't you let me go I been lost walking this road And I need you to show me home   Headlights Headlights Headlights Headlights Lead me through the darkness in these troubled times   I been thinking lately Asking if I'm doing grace by the ones who made me If I'm worthy of the title of the skincolor Queen Sheeba, my grandmother Pharaohs, my great grandfathers 'Cause now I'm deep in the vixen As looking Egyptian I saw from a far she was a star Brought her home and made her sweat in my manager's car Told my girl I'm working late She could call me tomorrow Man, it's been so many that I'm losing the count I'm singing sweet songs, guess I had to balance it out But yes, I been lost, I been down the wrong course Still most people would tell me the boss Put up a toast for the baddest man with the cash in hand And courage and all his kids to be bad as him Living the life that we used to be imagining Back when it made me grab the pen See, I used to be the no-go The dude in the back The school joe blow I made a million dollars Suddenly I had mojo Calling up girls I couldn't talk to in class And slept with them Even if they grew up out of their ass You couldn't tell me I was living too fast I'm living too fast And everyone applauds it But I'm hollow and sad So do I want the Marilyns or baby Sheba's I need some headlights Got to find the way 'fore I crash   Hold me tight, my maker Don't you let me go I been lost walking this road And I need you to show me home Headlights"
/songs/2405884,Nico & Vinz,Hold It Together,https://genius.com/Nico-and-vinz-hold-it-together-lyrics,http://api.genius.com/songs/2405884,None,2016-01-10," We knew from the first day That we never should have messed around And I learned in the worst way That there's a line between right and wrong   And girl, I'm sorry for dragging you into this You see, I worry that I'ma lose her now And it's been blurry, I sent my feelings away to mixed So let's just cut it after I leave tonight Just remember this   I hope I see you again Hope I see you again And I don't wanna call you a friend Got me thinkin' like Hold it together, hold it together Hold it together, hold it together but You're the one, you're the one, you're the one Got me singin' like Hold it together, hold it together Hold it together, hold it together but You're the one, you're the one I want oh   Perfect girl, wrong timing She the one, she the one I want I don't know where my mind went All I know that she gone, she gone   I said I'm sorry for dragging you into this But I been going through some things right now I been going through some things right now I said I'm sorry I been going through some things right now I been going through some, I been going through some   I hope I see you again I said I hope I will see you again Yeah, yeah And I don't wanna call you a friend I said I don't wanna call you a friend You know, you know Hold it together, hold it together Hold it together, hold it together but You're the one, you're the one, you're the one Got me singin' like Hold it together, hold it together Hold it together, hold it together but You're the one, you're the one I want   Yeah, yeah, yeah, yeah Hold it together Oh yeah, yeah, yeah Well you're the one I want My girl, what to do, what to do"
/songs/528905,Nico & Vinz,Homeless,https://genius.com/Nico-and-vinz-homeless-lyrics,http://api.genius.com/songs/528905,Black Star Elephant,2015-02-06," I'm caught in a Monday or is it a Sunday? Every damn day feels like the same day This job I've chosen is like a runway Where I'm displaying my life   But now I'm going Oh, oh I'm going Oh, oh Yeah, I'm going Oh, oh   But once I got there I felt as if I was homeless, homeless I felt as if I was homeless   Na na na Raised on Pluto, my parents from Venus Where am I from, sometimes I feel like I'm not from neither On my own little planet, that's where I've landed And I ain't searching no more   I was looking for Oh, oh Oh, oh Oh, oh   I am thinking home I am going home Where my heart has keys Where my soul will sing I am thinking home I am going home Where my heart has keys  "
/songs/528944,Nico & Vinz,Imaa Imaa,https://genius.com/Nico-and-vinz-imaa-imaa-lyrics,http://api.genius.com/songs/528944,Black Star Elephant,2015-02-06," She said where I'm at ain't where I be My heart, my soul, my all I give She said I'd be the one, I got hopes and dreams For me, my son, my only king   Imaa imaa yeah Imaa imaa yah   You can plant a seed, you can give a life You can help me grow or you can turn your eyes One thing I know, she took my side Through the fire, through the rain Your protector I remain, oh And I knew that one day I'd meet someone like you to save me Yeah, I knew that one day I'd meet someone like you to share with And I know that I'm okay as long as I got you to love me Hey now, hey ma, I hope I hold your     I'mma scream out I'mma scream so my Father hears me, yeah I'mm sing loud I'mma sing so my brothers hears it, yeah I'mma scream out I'mma scream so my mother hears me, yeah I'mma sing loud I'mma sing loud In my head I feel a prosper in my head In my head Look at me prosper in my head In my head We'll fight in my head In my head I love you in my head I don't know now, I've been looking I don't know now, I've been all over, don't worry  "
/songs/528881,Nico & Vinz,Imagine,https://genius.com/Nico-and-vinz-imagine-lyrics,http://api.genius.com/songs/528881,Black Star Elephant,2014-09-16," I see your tears in the night, lay it all on me You built a wall inside, just let it fall from me I feel your pain and lonely Don't be afraid to show me Let it rain upon me I'll be here for you   I met an old man once and he said to me ""The only thing that matters is what you believe"" If you don't stand for something you'll fall for anything In case you're wondering I'll be here for you   Aye, imagine - aye, imagine Ooh oh, imagine Could you ever imagine? Don't give up, don't give in Gotta fight through all of these fins Say yeah imagine Could you ever imagine?   Every melody can turn into a symphony instantly I know that you were meant for me Even though it was so hard to see I knew that we could be You did the same for me Now I'll be here for you   Aye, imagine - aye, imagine Ooh oh, imagine Could you ever imagine? Don't give up, don't give in Keep on until the end Say yeah imagine Could you ever imagine?   'm just a humble, little sail with too much to prove But my boat's so small and the ocean so huge And I don't wanna go half on a dream So I need you to be a part of my team I could never pretend or act like it's just me Without you where would I be? Imagine   Aye, imagine - aye, imagine Ooh oh, imagine Could you ever imagine? What you've done, now you're here And you fought through all of your fins Say yeah imagine Could you ever imagine?"
/songs/3130293,Nico & Vinz,Intrigued,https://genius.com/Nico-and-vinz-intrigued-lyrics,http://api.genius.com/songs/3130293,Elephant In The Room - EP,2017-06-22," It's the simple things that makes me wanna love ya The way you talk to me like nothing else matters The way you flip your hair when you come to say hi I'm already yours, you caught me by surprise There is something more than physique and design, oh yeah It's not the clothes you wear It's not the car you drive It's not your nails, not your hair, not your hips I'm talking 'bout It's right here in your chest Beneath your beautiful dress It's the love for yourself You're the one I can tell   There is something more Something more Than what I used to see Than what I used to see There is something more There's something more to you Than what I usually see On the side, on the side I'm intrigued by you I'm intrigued by you There's something more to you Something more to you I'm intrigued by you Oh, oh, oh, oh, oh, oh   I stopped believing in love So I've been forcing it out Said I been living a lie I knew it when I looked in your eyes I'm the king of the world when you stand by my side Can we fill the tank up and drive through the night? I've been saving up, I don't wanna waste time Leave it all behind, put it all on the line, oh Can you give me one more night? 'Cause I'm 'bout to make this right Tell me what you got to lose You're intrigued, you know it's true And we can see another day With no more lies and no mistakes Don't let the devil talk you through   There is something more Something more Than what I usually see Than what I usually see There is something more There's something more to you Than what I usually see On the side, on the side I'm intrigued by you I'm intrigued by you Intrigued by you There's something more to you Something more to you I'm intrigued by you Oh, oh, oh, oh, oh, oh"
/songs/1355809,Nico & Vinz,Invisible Thread,https://genius.com/Nico-and-vinz-invisible-thread-lyrics,http://api.genius.com/songs/1355809,None,2018-09-07,"Lost anxiety was meant to lose Feelings for the future were Burnt and gone  Only the things which move ahead are permitted A solid will to walk Enduring were excluded  You were made Wrecked, provided Controlled by a thread I've been glared at Lauged at but study And move on with a will  Found out in the end And sucked out Anticipate the next which Comes soon Being suspended Suspended Left ignorant  Only the ones who Went forward open their arms Line up and walk It's way too dazzling ahead Drown in the imitation Glittering ocean one by one Have no strength left to shut The red road opened too widely Better forget To take it back"
/songs/248631,Nico & Vinz,In Your Arms,https://genius.com/Nico-and-vinz-in-your-arms-lyrics,http://api.genius.com/songs/248631,Black Star Elephant,2013-10-21," I feel like Superman, they gon' remember me I think I know I can, who says it's hard to reach? Who's gonna stop me on the road to success? I don't know   They tried to break me down, but I'm still on my feet This city's full of life, so why is it hard to breathe? Oh, why did God create this world so unfair? I don't know   Sometimes I feel like I can't run, I can't crawl And sometimes I feel like I ain't nothing at all Life is a journey where you stumble and fall But I'm okay, when I lie down in your arms Oh-oh-oh-oh-oh Oh-oh-oh-oh-oh Oh-oh-oh-oh-oh When I lie down in your arms Oh-oh-oh-oh-oh Oh-oh-oh-oh-oh Oh-oh-oh-oh-oh When I lie down in your arms   I feel like moving back, sometimes it's hard to dream The life I chose is past, it's moving without me Who doesn't want a machine so they can go back in time? I don't know   My time went by too fast, there is no one left but me I have got a nine to five and it gets the best of me This is the life I'm gonna live to the end, but I'm okay   Sometimes I feel like I can't run, I can't crawl And sometimes I feel like I ain't nothing at all Life is a journey where you stumble and fall But I'm okay, when I lie down in your arms Oh-oh-oh-oh-oh Oh-oh-oh-oh-oh Oh-oh-oh-oh-oh When I lie down in your arms Oh-oh-oh-oh-oh Oh-oh-oh-oh-oh Oh-oh-oh-oh-oh When I lie down in your arms"
/songs/1821898,Nico & Vinz,In Your Arms by Envy,https://genius.com/Nico-and-vinz-in-your-arms-by-envy-lyrics,http://api.genius.com/songs/1821898,None,2018-09-07,"I feel like Superman They gonna remember me I think I know I can Who says it’s hard to reach Who’s gonna stop me on the road to success I don’t know They try to break me down But I’m still on my feet This city’s full of life So why’s it hard to breathe Oh why did God create this world so unfair I don’t know Sometimes I feel like I can’t run I can’t crawl And sometimes I feel like I ain’t nothing at all Life is a journey where you stumble and fall But I’m okay, when I lie down in your arms Oh oh oh oh oh Oh oh oh oh oh Oh oh oh oh oh When I lie down in your arms Oh oh oh oh oh Oh oh oh oh oh Oh oh oh oh oh When I lie down in your arms I feel like moving back Sometimes it’s hard to dream The life I chose is passed It’s moving without me Who doesn’t want a machine so they can go back in time I don’t know My time went by too fast There’s no-one left but me I’ve got a nine-to-five And it gets the best of me This is the life I’m gonna live to the end But I’m okay, when I lie down in your arms Oh oh oh oh oh Oh oh oh oh oh Oh oh oh oh oh When I lie down in your arms Oh oh oh oh oh Oh oh oh oh oh Oh oh oh oh oh When I lie down in your arms Sometimes I feel like I can’t run I can’t crawl And sometimes I feel like I ain’t nothing at all Life is a journey where you stumble and fall But I’m okay, when I lie down in your arms (Oh oh oh oh oh Oh oh oh oh oh Oh oh oh oh oh When I lie down in your arms Oh oh oh oh oh Oh oh oh oh oh Oh oh oh oh oh When I lie down in your arms) x2 ---"
