api_path,primary_artist,title,url,song_endpoint,album,release_date,lyrics
/songs/2317046,Thomas Rhett,Like It's the Last Time,https://genius.com/Thomas-rhett-like-its-the-last-time-lyrics,http://api.genius.com/songs/2317046,Tangled Up,2015-09-25," Throw on your boots and your jeans With the worn out seams And your goin' out shirt Put some shine on your truck Get it all cleaned up just to kick it in the dirt You point them high beam lights into drive, start comin' alive You point them high beam lights into Friday night And you swear this life never burns as bright As it does now   So soak it all up, let it sink in Crank it up loud, all the way to ten Raise your cup to the sky Tip 'em back to friends and let your party lights shine On top of the world, in the back of a truck Livin' like the sun ain't comin' back up Yeah, buddy tonight We're gonna do it up right Gonna do it up right Like it's the last time   Build you a fire, sing along To a feel good song At the top of your lungs Grab a jar, twist the top Hold your breath, take a shot Feel the fire on your tongue And let it drown your pride and your butterflies Tell the girl you like what you're feelin' tonight And pull her in tight, let the sparks ignite Like the fourth of July   So soak it all up, let it sink in Crank it up loud, all the way to ten Raise your cup to the sky Tip 'em back to friends and let your party lights shine On top of the world, in the back of a truck Livin' like the sun ain't comin' back up Yeah, buddy tonight We're gonna do it up right Gonna do it up right Like it's the last time   You'll be together like this Like it's the last time You're ever gonna taste that kiss   So soak it all up, let it sink in Crank it up loud, all the way to ten Raise your cup to the sky Tip 'em back to friends and let your party lights shine On top of the world, in the back of a truck Livin' like the sun ain't comin' back up Yeah, buddy tonight We're gonna do it up right Gonna do it up right Like it's the last time   Yeah buddy tonight We're gonna do it up right Gonna do it up right Whoa like it's the last time Yeah like it's the last time"
/songs/4339052,Thomas Rhett,Look What God Gave Her,https://genius.com/Thomas-rhett-look-what-god-gave-her-lyrics,http://api.genius.com/songs/4339052,Center Point Road,2019-03-01," Don't even want the attention But yeah, that's all that she's getting Her song is on and she's spinning around, yeah She got me drunk like Corona Heart racing like it's Daytona Ooh, I'm in Heaven, I swear, right now   And those eyes can hypnotize Was designed to blow my mind   Look what God gave her, how perfect He made her She walks in the room, it's like He answered my prayers The way that she moves, how could anybody blame her? I know she's got haters, but it ain't her fault, nah Look what God gave her   It's like I heard angels singing Like she came down from the ceiling When she walked in here this evening, I thought, yeah That girl one in seven billion Got everyone in here feeling Like there's a fire in this building, so hot   Got a smile on her angel face I know I'll never lose my faith   Look what God gave her, how perfect He made her She walks in the room, it's like He answered my prayers The way that she moves, how could anybody blame her? I know she's got haters, but it ain't her fault, nah Look what God gave her   Got that look in her eyes Swear she fell right out the sky Yeah, I think I've seen the light Every kiss, I could die It's like the heavens opened wide Man, I swear I've seen the light   Look what God gave her, how perfect He made her She walks in the room, it's like He answered my prayers The way that she moves, how could anybody blame her? I know she's got haters, but it ain't her fault, nah Look what God gave her   Ooh, ooh Ooh, look what God gave her (Look what God gave her) Ooh, ooh Oh yeah, look what God gave her"
/songs/4478077,Thomas Rhett,Love Sucks,https://genius.com/Thomas-rhett-love-sucks-lyrics,http://api.genius.com/songs/4478077,Unreleased Songs,None," Love sucks, blame it on me Oh well, maybe I'm crazy Who cares? I'mma turn up 'Cause love keeps bringing me down Love sucks, blame it on me Oh well, maybe I'm crazy Who cares? I'mma turn up 'Cause love keeps bringing me down   ran off with another man [?] [?] Don't care about love tonight [?] [?] [?] all together Gonna drink my love tonight   Love sucks, blame it on me Oh well, maybe I'm crazy Who cares? I'mma turn up 'Cause love keeps bringing me down Love sucks, blame it on me Oh well, maybe I'm crazy Who cares? I'mma turn up 'Cause love keeps bringing me down   We're out to [?]"
/songs/590980,Thomas Rhett,Make Me Wanna,https://genius.com/Thomas-rhett-make-me-wanna-lyrics,http://api.genius.com/songs/590980,It Goes Like This,2013-10-29," Windows down, country sound, FM on the radio Just me and you and the man on the moon Cruisin' down some old back road   Now baby don't you look at me that way Cause you know there's only so much I can take Cause you make me want to   Pull this truck to the side of the road Slide on over, let me hold you close And tell you everything I'm thinking Hop on out and let the tailgate fall Get drunk on you with no alcohol If you don't stop I'm gonna Girl you make me wanna   You know better than to wear that dress It oughta be against the law Plain and simple, girl, them dimples Know just how to turn me on   Now baby don't you look at me that way Cause you know there's only so much I can take Cause you make me wanna   Pull this truck to the side of the road Slide on over, let me hold you close And tell you everything I'm thinking Hop on out and let the tailgate fall Get drunk on you with no alcohol If you don't stop I'm gonna Girl you make me wanna   You make me wanna Wake up with you, in the bed of my truck And start over again when the sun comes up   You make me wanna Pull this truck to the side of the road Slide on over, let me hold you close And tell you everything I'm thinking Hop on out and let the tailgate fall Get drunk on you with no alcohol If you don't stop I'm gonna You make me wanna Pull this truck to the side of the road Slide on over, let me hold you close And tell you everything I'm thinking Hop on out and let the tailgate fall Get drunk on you with no alcohol If you don't stop I'm gonna Girl you make me wanna   Windows down, country sound, FM on the radio"
/songs/3174377,Thomas Rhett,Marry Me,https://genius.com/Thomas-rhett-marry-me-lyrics,http://api.genius.com/songs/3174377,Life Changes,2017-09-08," She wants to get married, she wants it perfect She wants her granddaddy preaching the service And she wants magnolias out in the country Not too many people, save her daddy some money   Ooh, she got it all planned out Yeah, I can see it all right now   I'll wear my black suit, black tie, hide out in the back I'll do a strong shot of whiskey straight out the flask I'll try to make it through without crying so nobody sees Yeah, she wanna get married But she don't wanna marry me   I remember the night when I almost kissed her Yeah, I kinda freaked out, we've been friends for forever And I'd always wonder if she felt the same way When I got the invite, I knew it was too late   And I know her daddy's been dreading this day Oh, but he don't know he ain't the only one giving her away   I'll wear my black suit, black tie, hide out in the back I'll do a strong shot of whiskey straight out the flask I'll try to make it through without crying so nobody sees Yeah, she wanna get married But she don't wanna marry me   Bet she got on her dress now, welcoming the guests now I could try to find her, get it off of my chest now But I ain't gonna mess it up, so I wish her the best now   So I'm in my black suit, black tie, hiding out in the back Doing a strong shot of whiskey straight out the flask I'll try to make it through without crying so nobody sees Yeah, she wanna get married Yeah, she gonna get married But she ain't gonna marry me Whoa, but she ain't gonna marry me, no"
/songs/2317816,Thomas Rhett,Playing With Fire,https://genius.com/Thomas-rhett-playing-with-fire-lyrics,http://api.genius.com/songs/2317816,Tangled Up,2015-09-25," I know I should let it go Take a different road When I'm driving home But I don't want to Delete your number from my phone Instead of calling Asking if you're all alone But I don't want to   Stay away From your side of town But it's too late I'm in your drive right now   I don't know, why I don't Put it out baby We kiss and the flames Just get higher But yeah I know When I hold onto you baby I'm all tangled up in barbed wire I get burned, I don't learn I'll be back, give it time Yeah, I know it sounds crazy But guess I like playing with fire   Ooo-ooo I could find a spot to Go hang out on Friday night Where you are gonna be But I don't want to, no Yeah, I could let it end Call it quits, call off All this on and off again But I just don't want to   Yeah that key Is right under the mat Come on in, baby Let's strike that match   I don't know, why I don't Put it out baby We kiss and the flames Just get higher But yeah I know When I hold onto you baby I'm all tangled up in barbed wire I get burned, I don't learn I'll be back, give it time Yeah, I know it sounds crazy But guess I like playing with fire Playing with fire   So let's fire it up one more time (Fire it up one more time) Baby just put your lips on mine (Lips on mine)   I don't know, why I don't Put it out baby We kiss and the flames Just get higher (We kiss and the flames Just get higher) But yeah I know When I hold onto you baby (Onto you baby) I'm all tangled up in barbed wire (All tangled up) (I'm all tangled up) I get burned, I don't learn I'll be back, give it time (Give it time) Yeah, I know it sounds crazy (Sounds crazy) But guess I like playing with fire (Playing with fire) Playing with fire (Playing with fire)   Playing with fire, huh"
/songs/4428639,Thomas Rhett,Remember You Young,https://genius.com/Thomas-rhett-remember-you-young-lyrics,http://api.genius.com/songs/4428639,Center Point Road,2019-04-19," Hey, buddies that I grew up with All straight-laced and married up now You ain't foolin' me, wasn't long ago We tore the roof off that one red light town And hey, darlin', sippin' that red wine All classy, kicked back on the couch You smile and I see ya shootin' tequila Us shuttin' them college bars down   And no matter how much time goes by And no matter how much we grow up For worse or for better, from now 'til forever I'll always remember you young   And hey, babies, crawlin’ on the carpet No, you won’t be that little for long One day, you’ll move away, but you’re still gonna stay This innocent after you’re gone   'Cause no matter how much time goes by And no matter how much we grow up For worse or for better, from now 'til forever I'll always remember you young   Whoa-oh-oh, whoa-oh-oh Whoa-oh-oh, oh, oh   Yeah, I hope when we get to Heaven He looks at us all like we're kids Shameless and painless and perfect and anxious Forgives all the wrong that we did   And no matter how much time goes by I know we'll never have to grow up We'll say for worse or for better, from now 'til forever I'll always remember you young   Whoa-oh-oh, oh I'll always remember you young"
/songs/3174419,Thomas Rhett,Renegades,https://genius.com/Thomas-rhett-renegades-lyrics,http://api.genius.com/songs/3174419,Life Changes,2017-09-08," Poor boy, rich girl, what a cliché One car, two hearts, wanna run away 'Cause they know it was meant to be His little bullet in the shotgun seat Poor boy, rich girl, bit like you and me So come on   Hey, yeah, I promise you your daddy gon' be alright Oh, baby, you were such a good girl all your life So what we cause a little trouble? So what we don't sleep tonight? Baby, I promise you your daddy's gonna be alright Gonna be alright   Little renegade love out there on the run Yeah, two innocent souls were the smoking gun Yeah, they were living the American dream His little beauty in some cut-off jeans, yeah Small town cliché, bit like you and me So come on   Hey, yeah, I promise you your daddy gon' be alright Oh, baby, you were such a good girl all your life So what we cause a little trouble? So what we don't sleep tonight? Baby, I promise you your daddy's gonna be alright Gonna be alright   Well, they can tell you what to think, yeah But they can't tell you who to love So, baby, come along with me, leave it in the dust Ay yeah, I promise you your daddy's gonna be alright So come on   Hey, yeah, I promise you your daddy gon' be alright Oh, baby, you were such a good girl all your life So what we cause a little trouble? So what we don't sleep tonight? Baby, I promise you your daddy's gonna be alright Gonna be alright   He's gonna be alright, oh, baby You've been a good girl all your life He's gonna be alright"
/songs/2316966,Thomas Rhett,Single Girl,https://genius.com/Thomas-rhett-single-girl-lyrics,http://api.genius.com/songs/2316966,Tangled Up,2015-09-25," Single girl I know you're out there on a run Out on a town baby havin' fun But don't you want someone Single girl How long you wanna be all alone Don't it get lonely baby on your own Like a rolling stone, well I   I think that I could be the guy Just what you're missin' baby in your life By your side When the nights get cold And I could be there for you to hold Oh baby ain't it gettin' old? Livin' in this lonely world When you don't have to be single girl   Single girl Aw you so pretty baby don't you know You can have anybody that you want So what you waitin' on Tell me girl That smile on your face is it for me Cause somethin' tells me that you're startin' to see How it could be When I   I think that I could be the guy Just what you're missin' baby in your life By your side When the nights get cold And I could be there for you to hold Oh baby ain't it gettin' old? Livin' in this lonely world When you don't have to be single girl   Oh single girl Don't wanna rush you girl But I promise you can trust me girl When I tell you, when I tell you That I   I think that I could be the guy Just what you're missin' baby in your life By your side When the nights get cold And I could be there for you to hold Oh baby ain't it gettin' old? Livin' in this lonely world When you don't have to be single girl   Oh no, you don't have to be single girl"
/songs/3174362,Thomas Rhett,Sixteen,https://genius.com/Thomas-rhett-sixteen-lyrics,http://api.genius.com/songs/3174362,Life Changes,2017-09-08," ""Take a left here, boy, take it slow Don't get distracted by that radio"" I just rolled my eyes and I said, ""Daddy, I know I'm fifteen, I ain't green like some ol' ten year old""   What I wouldn't give to be sixteen, wild and free Cruisin' up and down Main in my F-150 Roll the windows down, bass too loud from this burnt CD I'll be right where I wanna be when I'm sixteen, sixteen, yeah Sixteen   Now that I can drive, finally feel alive, but I got this curfew Sneakin' in late, smelling like my girlfriend's perfume People talkin' 'bout college and knowledge and that's alright But all I'm thinkin' 'bout is an unsupervised Saturday night   What I wouldn't give to be eighteen, wild and free Buzzin' off a can of that Grizzly wintergreen Lookin' old enough to pull off this fake ID I'll be right where I wanna be when I'm eighteen, eighteen Eighteen, yeah   I'm old enough to smoke, I'm old enough to vote But they turn me away when I go to the Cotton-Eyed Joe They say the grass is always greener, and I believe that's right But my friends are off to Vegas, and they're leavin' me behind   What I wouldn't give to be twenty one, wild and free Open up a cold one and drink it legally Chase a bunch of girls, go see the world, let my wild streak run I'll be right where I wanna be when I'm twenty one, twenty one Woah, when I'm twenty one Yeah, when I'm twenty one, it'll be alright Yeah, it'll all be alright when I'm twenty one   Now I'm twenty five, and I'm drinkin' wine with my wife at home Got a couple dogs and a couple songs on the radio And we sit around, and we laugh about how we used to be When all we cared about was turning sixteen"
/songs/3174382,Thomas Rhett,Smooth Like the Summer,https://genius.com/Thomas-rhett-smooth-like-the-summer-lyrics,http://api.genius.com/songs/3174382,Life Changes,2017-09-08," We don't ever go where the rich kids go, yeah We do our own thing We don't cut our hair 'cause we just don't care Smoke just about anything   Steal a kiss, act a fool, hop a fence, find a pool Flying free, like a drink, we're   Smooth like the summer Smooth like the summer, uh huh Go on and groove like a mother with your backseat lover Tear the clothes off each other all night And keeping it smooth like the summer Smooth like the summer, uh huh   We don't really care if our hands ain't stamped Yeah, we always find a way in The streets are so alive, yeah, we're running all the lights When they're flashing in the AM   Getting wild, wearing shades, living like we're renegades No matter what, we're gonna stay   Smooth like the summer Smooth like the summer, uh huh Go on and groove like a mother with your backseat lover Tearing clothes off each other all night And keeping it smooth like the summer Smooth like the summer, uh huh Smooth like the summer Smooth like the summer, uh huh Smooth like the summer Smooth like the summer, uh huh   Smooth like the summer Smooth like the summer, uh huh Go on and groove like a mother with your backseat lover Tearing clothes off each other all night And keeping it smooth like the summer Smooth like the summer, uh huh Go on and groove like a mother with your backseat lover Tear the clothes off each other all night And keeping it smooth like the summer Smooth like the summer, uh huh"
/songs/1188623,Thomas Rhett,Something to Do with My Hands,https://genius.com/Thomas-rhett-something-to-do-with-my-hands-lyrics,http://api.genius.com/songs/1188623,It Goes Like This,2012-02-21," Well I smoke and I fish But not near enough to satisfy an itch Of a girl, understand I need something to do with my hands   I don't work, on a car And I'm as bad at pool as I am at throwin' darts And golf, not a fan But I need something to do with my hands   So maybe I could stick 'em in your pockets Run 'em through your hair And we can get to rockin' There you are and baby, here I am And I need something to do with my hands   I can play you a song On this old guitar, if it turns you on If you want, we could dance But I need something to do with my hands   So maybe I could stick 'em in your pockets Run 'em through your hair And we can get to rockin' There you are and baby, here I am And I need something to do with my hands   Top off, in my jeep And we can go for a ride and I could drive with my knees I'll behave, best I can But I need something to do with my hands   So maybe I could stick 'em in your pockets Run 'em through your hair And we can get to rockin' There you are and baby, here I am  Yeah maybe I could stick 'em in your pockets Run 'em through your hair And we can get to rockin' There you are and baby, here I am And I need something to do with my hands I need something to do with my hands With my hands Something to do with my hands"
/songs/1847356,Thomas Rhett,Sorry for Partyin',https://genius.com/Thomas-rhett-sorry-for-partyin-lyrics,http://api.genius.com/songs/1847356,It Goes Like This,2013-10-29," Dear bosses and strangers, gossips and cops Ex-girlfriends and neighbors whose names I won't drop To anyone who disapproves of anything we're about to do   I'm sorry for partying and Bacardi'n What's happenin' in the back yard again It started with a couple friends and some dude in a cardigan Came rollin' in at 3 am I don't know when it's gonna end So for now, I'm sorry for... woah Partying, partying... woah Partying, partying   Dear judges and lawyers, to the kid that cuts my grass To the Mardi Gras martyrs stayin' up late at night pickin' up trash For anyone gettin' caught by a camera phone with your pants off   I'm sorry for partying and Bacardi'n What's happenin' in the back yard again It started with a couple friends and some dude in a cardigan Came rollin' in at 3 am I don't know when it's gonna end So for now, I'm sorry for... woah Partying, partying... woah Partying, partying   Dear Grandma in Georgia who ain't even up Yeah that picture wasn't for you Yeah, that's just my luck   I'm sorry for partying and Bacardi'n What's happenin' in the back yard again It started with a couple friends and some dude in a cardigan Came rollin' in at 3 am I don't know when it's gonna end So for now, I'm sorry for... woah Partying, partying... woah Partying, partying Woah... partying, partying Woah... partying, partying"
/songs/2274451,Thomas Rhett,South Side,https://genius.com/Thomas-rhett-south-side-lyrics,http://api.genius.com/songs/2274451,Tangled Up,2015-09-25," Please commence shaking your south side Thomas on that beat Yeah, it feels good   Ain't no place it ain't going on It's going around like a vagabond It gets in your bones like you caught the flu Nah, there ain't no cure You just gotta move when you feel the groove   Now people on the left, shake your south side People on the right, shake your south side Every single girl, shake your south side All around the world, shake your south side   Like Memphis, Tennessee, got in bed with CDB And had a baby and when the baby cried It made this sound, ain't no lie It was funkified   People on the left, shake your south side People on the right, shake your south side Every single girl, shake your south side All around the world, shake your south side (All around the world)   Oh, yeah Feels good, don't it? Let me break it down   Shake it like salt, shake it like pepper Shake it like champagne, number one record Shake it 'til you just can't shake it no more Shake that thing all the way to the floor, uh   People on the left shake your south side People on the right, shake your south side People on the left, shake your south side People on the right, shake your south side Every single girl, shake your south side All around the world, shake your south side (All around the world) People on the left, shake your south side (Oh, just shake your south side, baby) People on the right, shake your south side (Just shake your south side, baby) People on the left, shake your south side (I do it just like that, then do it again) People on the right, shake your south side (I do it just like that) Shake your south side   Is that a good one? That was a good one"
/songs/2870393,Thomas Rhett,Star of the Show,https://genius.com/Thomas-rhett-star-of-the-show-lyrics,http://api.genius.com/songs/2870393,Tangled Up (Deluxe Edition),2016-10-28," Walking down the street, hand in mine It don't keep them other guys And their wandering eyes from looking at you That's alright and that's okay Who can blame 'em anyway? You're so pretty, and you ain't even got a clue   Cause everywhere we go girl You're the star of the show And everybody's wondering and wanting to know What's your name? Who's that girl, with the prettiest smile in the world? Oh, what gets me the most is you don't even know That you are, you are, you are The star of the show You're the star of the show, yeah, baby   Friday night on the town We walk in and you draw a crowd Even the band seems to sing for you Ease on up, order a drink, barkeep says its all on me You look at me and laugh Like you don't know what to do Baby you're so cute   Cause everywhere we go girl You're the star of the show And everybody's wondering and wanting to know Whats your name? Who's that girl, with the prettiest smile in the world? Oh, what gets me the most is you don't even know That you are, you are, you are The star of the show, yeah You're the star of the show, baby, yeah yeah   Even in a ponytail in a pair of jeans you look like a cover Of a magazine, baby you're the only one who doesn't see   That everywhere we go girl You're the star of the show And everyone's wondering and wanting to know Whats your name? Who's that girl with the luckiest guy in the world? Oh, what gets me the most is you don't even know That you are, you are, you are You are, you are, you are, baby You are, you are, you are, you are The star of the show..   Don't you know, you're the star of the show, baby"
/songs/3174408,Thomas Rhett,Sweetheart,https://genius.com/Thomas-rhett-sweetheart-lyrics,http://api.genius.com/songs/3174408,Life Changes,2017-09-08," Sweetheart, God could've never made two Nobody quite like you   Woke up this morning to your sleepy smile I realized I haven't told you in a while That you're my life, you're my dream You're the reason for every song I sing You're my rock, you're my world You're my always and forever, girl   Sweetheart, God could've never made two Nobody quite like you Woah, sweetheart, one kiss and I come unglued You are the reason I fall to pieces 'Cause you're all that I adore You're the one my heart beats for And I can't believe you gave your sweet heart to me   Yeah, you're sweet like chocolate, hot like Sriracha Yeah, girl you got me right in your back pocket You're smooth like whiskey, fine like wine I love how you're making my blood sugar rise   My sweetheart, God could've never made two Nobody quite like you Woah, sweetheart, one kiss and I come unglued You are the reason I fall to pieces 'Cause you're all that I adore You're the one my heart beats for And I can't believe you gave your sweet heart to me   When the world gets cold on those sleepless nights Oh, girl, you should know that you will always be mine   My sweetheart, God could've never made two Nobody quite like you Woah, sweetheart, one kiss and I come unglued You are the reason I fall to pieces 'Cause you're all that I adore You're the one my heart beats for And I can't believe you gave your sweet heart to me   Oh, yeah, you gave your sweet heart to me Oh, yeah, you gave your sweet heart to me Oh, please give your sweet heart to me"
