api_path,primary_artist,title,url,song_endpoint,album,release_date,lyrics
/songs/1690179,Thomas Rhett,Take You Home,https://genius.com/Thomas-rhett-take-you-home-lyrics,http://api.genius.com/songs/1690179,It Goes Like This,2013-10-29,"Hey there honey, in your cut up jeans Whatcha drinkin' I was thinkin' you could save a sip for me I've been lookin' cross the party all night long At you movin' your hips with your pretty lips singin' along to a country song Climb on up here with me In my truck cause if we Don't go ridin' around I'm gonna run my battery down so  If you're ready to roll girl, just let me know girl I don't know who brought you here and he left you alone But he ain't worth the time you're spendin' Textin' him on the phone girl It's time to move on girl I got a radio and a shotgun seat And it's gettin' late It's time for me to take you home girl  It's alright if you live way out I got enough gas to take you all over this town yeah When we pull in the drive, I'll walk you up to the door I'm a good guy girl, I'll settle for a kiss on the porch unless you want one more Now he ain't payin' no attention Don't know what he's missin' So baby what do ya say Why don't you just walk this way  When you're ready to roll girl Just let me know girl I don't know who brought you here and he left you alone But he ain't worth the time you're spending textin' him on the phone It's time to move on girl I got a radio and a shotgun seat And it's getting late It's time to take you home girl  Come on let's go girl  So when you're ready to roll girl We can take it nice and slow girl Might even find a place to park Sit there and watch the stars Put on a show girl Hey I don't know girl I got a radio and a shotgun seat And it's getting late It's time for me to take you home girl You can be my home girl"
/songs/2317021,Thomas Rhett,Tangled,https://genius.com/Thomas-rhett-tangled-lyrics,http://api.genius.com/songs/2317021,Tangled Up,2015-09-25," I'm tangled in your arms And in my head and in my bed again And wreckin' me in pieces on the floor I'm tangled in your smile You drive me wild for just a while I think that I'll keep you from walkin' out that door I, I wanna say I want more than what this is My lips are busy kissin' you So I'd just like to stay One more night in paradise It feels so right to me cause girl   I'm tangled up I can't ever get too much I'm tangled up Ah, baby what you do to me I'm tangled up You give me just enough of your love To keep me tangled up And I don't wanna be free Girl you got me tangled Girl you got me tangled Girl you got me tangled Up I'm in   I'm tangled in your sheets I can't compete, your sugar tastes so sweet I want it girl again and again I, I wanna say I want more than what this is My lips are busy kissin' you So I'd just like to stay One more night in paradise It feels so right to me cause girl   I'm tangled up I can't ever get too much I'm tangled up Ah, baby what you do to me I'm tangled up You give me just enough of your love To keep me tangled up And I don't wanna be free Tangled up, oh Tangled up, oh Up So I'd just like to stay One more night in paradise It feels so right to me girl Baby   I'm tangled up I can't ever get too much I'm tangled up Ah, baby what you do to me I'm tangled up You give me just enough of your love To keep me tangled up And I don't wanna be free   Tangled up, oh Tangled up, oh Tangled up, oh (Girl you got me tangled, girl you got me tangled) Tangled up That's right I can't ever get too much I'm tangled up Tangled up That's right I can't ever get too much I'm tangled up"
/songs/4428628,Thomas Rhett,That Old Truck,https://genius.com/Thomas-rhett-that-old-truck-lyrics,http://api.genius.com/songs/4428628,Center Point Road,2019-03-29," Up and down streets of a no-name town Me and her with the windows down 35s rolling on the ground Loving every minute Skoal peach in the side of the door Coke cans rolling on the floor No, I never wanted nothing more Yeah, that was living   I drove her to work, drove her to school I drove her to PCB I jacked it up, loaded it down With all my friends and me   I grew up in it Yeah, I got stuck in it Playin' our song on the stereo Drivin' 'til we ran outta road Yeah, I broke up in it I fell in love in it Made a lifetime full of memories On a half tank of gasoline I learned just who I wasn't and who I was In that old truck, mmm In that old truck   I found a field, I put it in park Blanket and a girl and a billion stars Midnight buzz and a racing heart When I leaned in to kiss her I wrecked it good on some old back road Had to call daddy to get her towed Cussing out all that grass I mowed Just saving up to fix her   Had some luck, fogged it up And I ain't gonna lie She heard me laugh, heard me cry Heard me pray sometimes   I grew up in it Yeah, I got stuck in it Playin' our song on the stereo Drivin' 'til we ran out of road Yeah, I broke up in it I fell in love in it Made a lifetime full of memories On a half tank of gasoline I learned just who I wasn't and who I was In that old truck, mmm Yeah, in that old truck (Yeah)   Yeah, you might think it's crazy And you might not understand But that hand-me-down on four wheels Turned this boy into a man   Yeah, I grew up in it I got stuck in it Jamming our song on the stereo Drivin' 'til we ran out of road Yeah, I broke up in it I fell in love in it I made a lifetime full of memories On a half tank of gasoline Yeah, I learned who I wasn't and who I was But yeah, whoever's got it now, I hope they love That old truck, mmm Yeah, that old truck That old truck, mmm"
/songs/2316979,Thomas Rhett,The Day You Stop Lookin' Back,https://genius.com/Thomas-rhett-the-day-you-stop-lookin-back-lyrics,http://api.genius.com/songs/2316979,Tangled Up,2015-09-25," Stop starin' at the rearview You ain't checkin' your hair That wheel has spun and them lights are out There ain't nothin' for you back there Stop holdin' on so dang tight, 'bout time you let go But he's a heart breakin', let you down, son-of-a-gun But I ain't sayin' nothin' you don't know   The day you stop lookin' back You're gonna find that the future Sure beats the hell outta the past Now he ain't no good I guess he's good as gone The day you stop lookin' back, girl yeah Is the day you start movin' on   That sun's gonna come up It's gonna feel good And after all the rain and pain you've seen I hope you soak it up like you should Now and then it's gonna stir up When you hear that old song But don't let it get to ya baby It's only three and a half minutes long Well   The day you stop lookin' back You're gonna find that the future Sure beats the hell outta the past Now he ain't no good I guess he's good as gone The day you stop lookin' back, girl yeah Is the day you start movin' on   Is the day you start movin' on You ain't checkin' your hair That wheel is spun and them lights are out There ain't nothin' for you back there"
/songs/3922271,Thomas Rhett,The Way Things Go,https://genius.com/Thomas-rhett-the-way-things-go-lyrics,http://api.genius.com/songs/3922271,The Best of Me: Original Motion Picture Soundtrack,2014-10-17," You know when you’re young And you know everything The sky is the limit And the grass is a little more green Don’t matter where you are  Yeah I coulda swore back when I was 15 I’d go to college and get my business degree I never made it that far I got a big ol’ wrench in my plans And put this guitar in my hands   So much for crystal balls and wishing on stars As you're watchin' them fall to the ground Yeah you can dream big or you can dream small But it all comes down to the luck of the draw, so I’ve found Cause it’s gonna rain as soon as you wash your car And as sure as you go on and give up your heart. a curve gets thrown That’s the way things go   Yeah I would’ve tattooed her name on my arm If you woulda asked me I would’ve bet the whole dang farm, and more on us So much for her being my meant to be She changed her mind like the wind, and the joke was on me She left me in the dust If she hadn’t left my heart black and blue I would’ve never found you   So much for crystal balls and wishing on stars As you're watchin' them fall to the ground Yeah you can dream big or you can dream small But it all comes down to the luck of the draw, so I’ve found Cause it’s gonna rain as soon as you wash your car And as sure as you go on and give up your heart, a curve gets thrown That’s the way things go   You’ll never know if you took the right fork in the road Until you get where you’re going and it all unfolds   So much for crystal balls and wishing on stars As you're watchin' them fall to the ground Yeah you can dream big or you can dream small But it all comes down to the luck of the draw, so I’ve found Cause it’s gonna rain as soon as you wash your car And as sure as you go on and give up your heart, a curve gets thrown That’s the way things go"
/songs/2274310,Thomas Rhett,T-Shirt,https://genius.com/Thomas-rhett-t-shirt-lyrics,http://api.genius.com/songs/2274310,Tangled Up,2016-02-16," Get off work and we meet down at our spot We had a patio with a view of a parking lot It was two for one and four for two Had Christmas lights in the middle of June All hung up like I was on you   I said hey, hey baby, do you wanna come over You say, ""no way"" then you move in closer Next thing I know you were wearing my   T-shirt right there Your hair messed up like a Guns-N-Roses video Oh oh so hot Still got it up in my head You were moving around in the TV light I ain't ever seen anything like Your dress, my floor The way you wore my, my T-shirt Yeah, my t-shirt Oh yeah   We were walking up the stairs With the neighbors saying ""keep it down"" But it's hard to unlock the door When you're making out You know what I'm saying You've been saying that we've gotta quit doin' this So why you leanin' in for one more kiss And pretty soon you're sliding off what you've got on And slippin' into my   T-shirt right there Your hair messed up like a Guns-N-Roses video Oh oh so hot Still got it up in my head You were moving around in the TV light I ain't ever seen anything like Your dress, my floor The way you wore my, my t-shirt In my t-shirt Oh no, baby no, I can't lie Cause you sure look good in my t-shirt Oh no, baby no, I can't lie You look good on my mind   I said hey, hey baby, do you wanna come over You say, ""no way"" then you move in closer Next thing I know you were wearing my t-shirt Mmm, you look just so dang hot in my t-shirt I see you spinning around in my t-shirt Right there Your hair messed up like a Guns-N-Roses video Oh oh so hot   My t-shirt right there Your hair messed up like a Guns-N-Roses video Oh oh so hot Still got it up in my head You were moving around in the TV light I ain't ever seen anything like Your dress, my floor The way you wore my,my t-shirt In my t-shirt, yeah You look so good in my t-shirt My t-shirt Oh you look so good in my t-shirt"
/songs/3169110,Thomas Rhett,Unforgettable,https://genius.com/Thomas-rhett-unforgettable-lyrics,http://api.genius.com/songs/3169110,Life Changes,2017-07-28," It was the 14th of October Had that t-shirt off your shoulder I was drunk, said I was sober And you said yeah right We were talkin’ for a minute Then some guy tried to cut in You took my hand and we pretended Like I was your guy   Oh, then I tried to guess your middle name For 30 minutes bet we played that game   That mango-rita you were drinkin’ And that Coldplay song that you were singin’ And I bet right now you’re probably thinkin’ That it’s crazy I remember every detail, but I do From your blue jeans to your shoes Girl, that night was just like you Unforgettable   We were dancin’, we were buzzin’ Takin’ shots like it was nothin’ Did the runnin’ man, you loved it Yeah, you laughed out loud You brushed away your blonde hair And you kissed me out of nowhere I can still show you the spot Where everything went down   Oh, I told you I was gonna marry you You probably didn’t think that it was true   That mango-rita you were drinkin’ And that Coldplay song that you were singin’ And I bet right now you’re probably thinkin’ That it’s crazy I remember every detail, but I do I can still smell your perfume Girl, that night was just like you Unforgettable   Oh, that night was just like you, baby I can taste the mango-rita you were drinkin’ And it feels just like it was last weekend That we jumped in Right off the deep end   That mango-rita you were drinkin’ And that Coldplay song that you were singin’ And I bet right now you’re probably thinkin’ That it’s crazy I remember every detail, but I do I can still smell your perfume Girl, that night was just like you Unforgettable   From your blue jeans to your shoes Girl, that night was just like you Unforgettable"
/songs/2291859,Thomas Rhett,Vacation,https://genius.com/Thomas-rhett-vacation-lyrics,http://api.genius.com/songs/2291859,Tangled Up,2015-09-25," My girl is rocking that Billabong bikini like she’s sponsored Asking me if I can rub that Coppertone on her Got a couple bucks but I’m spending them like they pesos Might be Motel Sixing but it feels like Turks and Caicos   Put a little liquor in my coconut water Party all day like you at your alma mater Put a little liquor in my coconut water Ice has started melting cause it’s always getting hotter   Singing hey, let’s party like we on vacation Hey, let’s party like we on vacation I got my toes up in the sand Cold one in my hand Toes up in the sand Cold one in my hand Singing hey, let’s party like we on vacation   I got my Solo Cup amplifier, playing all my jams And my Walgreens beach chair working on my tan Feels like it’s Jamaica and I’m sippin' on some Red Stripe But I’m in Decatur, baby, crushing on that Busch light   Hey, let’s party like we on vacation Hey, let’s party like we on vacation (I got, I got, I got) Toes up in the sand Cold one in my hand Toes up in the sand Cold one in my hand Singing hey, let’s party like we on vacation   Put a little liquor in my coconut water Party all day like you at your alma mater Put a little liquor in my coconut water Ice has started melting so I’ll take another swallow   Singing hey, let’s party like we on vacation Hey, let’s party like we on vacation You know I got my toes up in the sand Cold one in my hand Toes up in the sand Cold one in my hand Singing hey, let’s party like we on vacation   (Oh-oh-oh, oh-oh-oh-oh) Party like I’m on vacation (Oh-oh-oh, oh-oh-oh-oh) Party like I’m on vacation (Oh-oh-oh, oh-oh-oh-oh) Party like I’m on vacation (Oh-oh-oh, oh-oh-oh-oh) I’m gonna rehydrate, while I dehydrate, you know   Hey, let’s party like we on vacation Hey, let’s party like we on vacation I got my toes up in the sand Cold one in my hand Toes up in the sand Cold one in my hand Singing hey, let’s party like we on vacation   Sing it to me Hey, let’s party like we on vacation Hey, party like we on vacation (Yeah dude, just party every time)"
/songs/1458496,Thomas Rhett,Whatcha Got in That Cup,https://genius.com/Thomas-rhett-whatcha-got-in-that-cup-lyrics,http://api.genius.com/songs/1458496,It Goes Like This,2012-08-28," Hey girl whatcha got in that cup Gimme a little sip and tell me what's up With your hey baby now come on don't be shy And wooo heee that sure is good You got me trippin' and thinkin' we should Get to talkin' and maybe hang out tonight   Cause I've been sippin' what you been sippin' on Never tasted something so sweet, never felt something so strong And my head's buzzin' baby feeling like I'm falling in love Hey girl whatcha got in that cup   Now hey girl whatcha got in that cup Did it come from the hills in the back of a truck Whatever it is, it's sure messin' me up tonight Now hey baby do you like this song Do you wanna go get a slow dance on Me and you just wrappin' each other tight   Cause I've been sippin' what you been sippin' on Never tasted something so sweet, never felt something so strong And my head's buzzin' baby feeling like I'm falling in love Hey girl whatcha got in that cup   Hey girl whatcha got in that cup A hundred proof, cause it's kickin' my butt Can't be jose, can't be jack Cause I had em before and never felt like that Hey baby whatcha got in here Can't be no jager, can't be no beer (nah) Can't be no kinda mad dog wine Must be love potion number 9   I've been sippin' what you been sippin' on Never tasted something so sweet, never felt something so strong And my head's buzzin' baby feeling like I'm falling in love Hey girl whatcha got in that cup Yeah, whatcha got in that cup"
/songs/1850165,Thomas Rhett,When I Was Your Man,https://genius.com/Thomas-rhett-when-i-was-your-man-lyrics,http://api.genius.com/songs/1850165,Big Machine Undercover,None,"Same bed but it feels just a little bit bigger now Our song on the radio but it don't sound the same When our friends talk about you All it does is just tear me down Cause my heart breaks a little when I hear your name  It all just sounds like oooooh… Mmm, too young, too dumb to realize That I should've bought you flowers And held your hand I should've gave you all my hours When I had the chance And take you to every party Cause all you wanted to do was dance And now my baby's dancing But she's dancing with another man  My pride, my ego, my needs and my selfish ways Caused a good strong woman like you to walk out my life Now I never, never get to clean up this mess I made, no… And it haunts me every time I close my eyes  It all just sounds like oooooh… Mmm, too young, too dumb to realize That I should've bought you flowers And held your hand I should've gave you all my hours When I had the chance And take you to every party Cause all you wanted to do was dance And now my baby's dancing But she's dancing with another man  Although it hurts I'll be the first to say that I was wrong Oh, I know I was probably much too late To try and apologize for my mistakes But I just want you to know  I hope he buys you flowers I hope he holds your hand Gives you all his hours When he has the chance Takes you to every party Cause I remember how much you loved to dance Do all the things I should have done When I was your man Do all the things I should have done When I was your man"
/songs/3234494,Thomas Rhett,When We're 80,https://genius.com/Thomas-rhett-when-were-80-lyrics,http://api.genius.com/songs/3234494,Life Changes,2017-09-08," Will you still roll your eyes when I tell dirty jokes? Will I still hold your hand when we're drivin' down the road? Will you still hide a bottle of wine in your purse when we're at the movie? Will you still slap my hand away when I try and smack your booty?   Hey, hey, hey, hey, hey Tell me it'll always be this way You'll be even more beautiful when you're gray and crazy We'll still kiss and we might cuss Just tell me that we'll still be us when we're 80 When we're 80   Will you still rub my feet when I put down the seat? Will you still call me honey if we run out of money tomorrow? Will we still walk the dogs, will I still take you fishin' And dance in the kitchen and listen and sway to Sinatra? Fly Me To The Moon, baby When we watch The Notebook, will we still get sentimental? Will I drop you off at the beauty shop in a Lincoln Continental, singin'   Hey, hey, hey, hey, hey Tell me it'll always be this way You'll be even more beautiful when you're gray and crazy We'll still kiss and we might cuss Just tell me that we'll still be us when we're 80 When we're 80   When we're 80 Won't you grow young with me, girl?   Hey, hey, hey, hey, hey Tell me it'll always be this way You'll be even more beautiful when you're gray and crazy We'll still kiss and we might cuss Just tell me that we'll still be us when we're 80 When we're 80"
/songs/3174390,Thomas Rhett,When You Look Like That,https://genius.com/Thomas-rhett-when-you-look-like-that-lyrics,http://api.genius.com/songs/3174390,Life Changes,2017-09-08," You said you only had time for one drink But that dress that you're wearing says a whole 'nother thing You laugh and you smile and you wink Got my head spinning 'round like a roller rink It's going places we've never been And it's getting better with every tonic and gin Got a Hollywood glow on your skin Wearin' that ""I will if you will"" grin   How are we not supposed to crawl to the next bar Make out on the dance floor Take it too far out the back door Leave an open tab, when you look like that? And tell me how am I supposed to keep my hands to myself When you're making my mind wander somewhere else? It's on a one-way track when you look like that   How am I supposed to play it cool With that sexy, adorable way you move? I love watching you break your own rules Come on, let me help you break a few   How are we not supposed to crawl to the next bar Make out on the dance floor Take it too far out the back door Leave an open tab, when you look like that? And tell me how am I supposed to keep my hands to myself When you're making my mind wander somewhere else? It's on a one-way track when you look like that   Like a couple million bucks, a bombshell deluxe Girl, you got it all together, why you messing me up? I'm seeing you and me as the honkey tonk dream Saying, ""Girl, we're on a roll""   And how are we not supposed to take another lap around the block And make a pit stop, your place, my place, any place? Wanna make it last when you look like When you look like that, yeah   When you look like that, baby When you look, when you look like that, whoa You just do something to my soul, I just can't describe it When you look like that, hoo Hey, yeah, yeah, yeah You drive me crazy when you, when you look like Just like that right there"
