api_path,primary_artist,title,url,song_endpoint,album,release_date,lyrics
/songs/4357574,Thomas Rhett,Don't Threaten Me With a Good Time,https://genius.com/Thomas-rhett-dont-threaten-me-with-a-good-time-lyrics,http://api.genius.com/songs/4357574,Center Point Road,2019-03-02,"[Verse 1: Thomas Rhett, Thomas Rhett & Little Big Town] I got a hankerin' for doin’ somethin' crazy Don't have to tell me, girl, yeah, I know that it’s Wednesday But you're lookin' so good, it feels like Friday night, huh That ripped up t-shirt makes me want you in the worst way Just take a sip and let's pretend like it's your birthday Just dive right in, girl, the tequila's fine, so fine She said, ""You know I love a party Don't threaten me with a good time  [Chorus: Thomas Rhett & Little Big Town] Hop on up on that counter Let me see how you move Let me up there beside ya Stand back, watch me cut loose Pour a little liquor, make this living room twirl Watch me set this night on fire Baby, you know I love a party Don't threaten me with a good time  [Verse 2: Thomas Rhett & Karen Fairchild] Girl, you know better than to think you can one-up me You try to match me shot for shot, it’s gon’ get ugly Boy, don't forget how I tore up those college Friday nights Baby, you know I love a party Don’t threaten me with a good time, no no Here we go  [Chorus: Thomas Rhett & Little Big Town] Hop on up on that counter Let me see how you move Let me up there beside ya Stand back, watch me cut loose Pour a little liquor, make this living room twirl Watch me set this night on fire Baby, you know I love a party Don't threaten me with a good time  [Bridge: Thomas Rhett, Karen Fairchild & Both] Baby, I been watchin' you dancin' Boy, I been watchin’ you move And I'm lovin' everything you do, baby Ooh, I'm just gettin' started Yeah, baby, me too But no, I won't be asleep 'til 2, 3, 4 in the mornin'  [Chorus: Thomas Rhett & Little Big Town] Hop on up on that counter Let me see how you move Let me up there beside ya Stand back, watch me cut loose Pour a little liquor, make this living room twirl Watch me set this night on fire Baby, you know I love a party Don't threaten me with a good time   Baby, you know I love a party Don't threaten me with a good time"
/songs/3174367,Thomas Rhett,Drink a Little Beer,https://genius.com/Thomas-rhett-drink-a-little-beer-lyrics,http://api.genius.com/songs/3174367,Life Changes,2017-09-08," Drink a little beer, play a little music And have a big time tonight   Got a Tennessee girl, a Rocky Top breeze And a big ol' yellow moon A new set of strings on my '69 And a Yeti full of iced-down booze Everybody 'round this sleepy little town Heading down Pinetucky Road Gonna leave our worries in a cloud of dust Right there by the old fence post   Yeah, we're gonna drink a little beer, play a little music And have a big time tonight A bunch of down home boys and some blue jean girls Kicking up the dirt and shooting out the lights Life can be an ol' briar patch Gotta dance your way through it sometimes So we're gonna drink a little beer, play a little music And have a big time tonight   Got a pig in the ground, stars in the sky And a jar full of lightning juice Got a worn-out path to the river bank Everybody coming out of them boots Gonna pick a few songs all night long Ones that we grew up on Some fishing in the dark, some Copperhead Road Everybody just sing along   Yeah, we're gonna drink a little beer, play a little music And have a big time tonight A bunch of down home boys and some blue jean girls Kicking up the dirt and shooting out the lights Life can be an ol' briar patch Gotta dance your way through it sometimes So we're gonna drink a little beer, play a little music And have a big time tonight     Yeah, we're gonna drink a little beer, play a little music And have a big time tonight A bunch of down home boys and some blue jean girls Kicking up the dirt and shooting out the lights Life can be an ol' briar patch Gotta dance your way through it sometimes So we're gonna drink a little beer, play a little music And have a big time tonight Yeah, we're gonna drink a little beer, play a little music And have a big time tonight A bunch of down home boys and some blue jean girls Kicking up the dirt and shooting out the lights Life can be an ol' briar patch Gotta dance your way through it sometimes So we're gonna drink a little beer, play a little music And have a big time tonight  [Post-Chorus: Thomas Rhett & Rhett Akins] Drink a little beer, play a little music And have a big time tonight That's right   Ah, come on boys, whoo! This is so weird having my dad on a song right now Considering he's 50 Uh, 47 I think he's gonna make a comeback album and this is the start of it I taught you everything you know, son But not everything I know We through playing now"
/songs/1123716,Thomas Rhett,Front Porch Junkies,https://genius.com/Thomas-rhett-front-porch-junkies-lyrics,http://api.genius.com/songs/1123716,It Goes Like This,2012-08-28,"We ain't kickin' it inside We ain't kickin' it outside We're just sippin' moonshine watchin' chicken fry And makin' that swing swing side to side Singin' ""Hoop, hoop, hoopty do"" Come on, girl, can you feel that groove? The mandolin is strummin' All my friends are comin' We're just chillin', grillin', willin' to get funky Yeah, we're just some front porch junkies (Oh, we're just front porch junkies) (Oh, we're just front porch junkies)  We ain't kickin' it uptown (No!) We ain't kickin' it downtown (Hell no!) We're just lightin' it up on the low-down Blowin' smoke on a Blue Tick Coonhound Singin' ""Boom, boom, boom-di-boom!"" Come on, y'all, can you feel that groove? Swamp air comin' through the screen door Bare feet stompin' on the wood floor We're just diggin' it, finger lickin' pickin' out in the country Yeah, we're just some front porch junkies (Oh, we're just front porch junkies) (Oh, we're just front porch junkies)  Just sittin' here workin' on a flip-flop tan Got a cold Bush light and a coozie in my hand Dang, I don't be needin' no white sand beach I got the sweetest little Georgia peach in a two piece Belly button ring is shinin' like a diamond Says I oughta be up onstage at the Ryman I don't need no crowd, no light, smoke production The beer's ice cold and the subwoofer's bumpin' Sittin' on a cloud, feelin' pretty lucky Dang, it feels good to be a front porch junkie (Oh, we're just front porch junkies) (Oh, we're just front porch junkies)  We ain't kickin' it inside (No!) We ain't kickin' it outside (Hell no!) We're just sippin' moonshine watchin' chicken fry And makin' that swing swing side to side Singin' ""Hoop, hoop, hoopty do"" Come on, girl, can you feel that groove? The mandolin is strummin' All my friends are comin' We're just chillin', grillin', willin' to get funky Yeah, we're just some front porch junkies (Oh, we're just front porch junkies) (Oh, we're just front porch junkies)"
/songs/3174426,Thomas Rhett,Gateway Love,https://genius.com/Thomas-rhett-gateway-love-lyrics,http://api.genius.com/songs/3174426,Life Changes,2017-09-08," Does your heart skip a beat when he kisses you, baby? Yeah, I just gotta know for my peace of mind Staying up all night 'cause it's driving me crazy Tell me yes or no, either way, I'm fine   Last time we talked, said you'd never been better That's what you said, though, when we were together Mine in July, but you're his in December   I guess I was your gateway love I didn't get you high enough Kinda like an 8th grade crush that never lasts Are you on that heavy stuff? Tell me, did you find the one, find the one I thought I was? But now I know that I was just your gateway love, baby Yeah, I was your gateway love, baby   Was I just one piece of the puzzle you played? Did you have your eye on a different prize? Was it just another number on a whole other waitlist? I knew it had to end, but it was sublime   Last time we talked, said you'd never been better That's what you said, though, when we were together Mine in July, but you're his in December   I guess I was your gateway love I didn't get you high enough Kinda like an 8th grade crush that never lasts Are you on that heavy stuff? Tell me, did you find the one, find the one I thought I was? But now I know that I was just your gateway love, baby Yeah, I was your gateway love, baby Yeah, I was your gateway love, baby Yeah, I was your gateway love, baby   Does your heart skip a beat when he kisses you, baby? 'Cause I just gotta know for my peace of mind   I guess I was your gateway love I didn't get you high enough Kinda like an 8th grade crush that never lasts Are you on that heavy stuff? Tell me, did you find the one, find the one I thought I was? But now I know that I was just your gateway love, baby Yeah, I was your gateway love, baby Yeah, I was your gateway love, baby Nothing but your gateway love, baby"
/songs/391029,Thomas Rhett,Get Me Some Of That,https://genius.com/Thomas-rhett-get-me-some-of-that-lyrics,http://api.genius.com/songs/391029,It Goes Like This,2013-11-18," Yeah girl, been diggin' on you Sippin' on drink number two Tryin' to come up with somethin' smooth And waitin' on the right time to make my move But I just can't wait no more Can't let you slip out that door You're the prettiest thing I ever seen before Got me spinnin' around, I ain't even on the dance floor   You're shakin' that money maker, like a heart breaker, like your college major was Twistin' and tearin' up Friday nights Love the way you're wearin' those jeans so tight I bet your kiss is a soul saver, my favorite flavor, want it now and later I never seen nothin' I wanted so bad Girl, I gotta get me, gotta get me some of that Yeah gotta get me some of that   Little more what you doin' right there Swingin' your hips and slingin' your hair Side to side with your drink in the air Lord have mercy now girl I swear Gotta get your number in my phone Gotta get me some of you alone We can worry 'bout it later on Right now keep makin' this my favorite song   You're shakin' that money maker, like a heart breaker, like your college major was Twistin' and tearin' up Friday nights Love the way you're wearin' those jeans so tight I bet your kiss is a soul saver, my favorite flavor, want it now and later I never seen nothin' I wanted so bad Girl, I gotta get me, gotta get me some of that Yeah gotta get me some of that   In my ride, by my side, down the highway In the dark, in my arms, in your driveway All because of that smile you threw my way Yeah girl you got a way of   You're shakin' that money maker, like a heart breaker, like your college major was Twistin' and tearin' up Friday nights Love the way you're wearin' those jeans so tight I bet your kiss is a soul saver, my favorite flavor, want it now and later I never seen nothin' I wanted so bad Girl, I gotta get me, gotta get me some of that Yeah gotta get me some of that   Yeah, I gotta get me some of that Oh girl, I gotta get me some of that Oh yeah I bet your kiss is a soul saver, my favorite flavor I want it now and later"
/songs/3174441,Thomas Rhett,Grave,https://genius.com/Thomas-rhett-grave-lyrics,http://api.genius.com/songs/3174441,Life Changes,2017-08-17," You're my forever, my slice of heaven On this side of the Mississippi River, baby You're my infinity, no end to you and me Come hell, fire, or rain, baby, nothin' can change it No, nothin' can change it   Ooh, when the good Lord calls me home and this life is through I may be six feet deep, but I'll still be lovin' you Baby, what we got won't ever die Can't take diamonds, can't take gold But I'll take your love with me when I go I'm gonna take it to the grave with me   You're my destiny, you'll always be with me Today, tomorrow, all the way to eternity, baby No last breathe taken on this earth No concrete tombstone, no amount of dirt can change it No, nothin' can change it   Ooh, when the good Lord calls me home and this life is through I may be six feet deep, but I'll still be lovin' you Baby, what we got won't ever die Can't take diamonds, can't take gold But I'll take your love with me when I go I'm gonna take it to the grave with me To the grave with me, to the grave with me To the grave, to the grave with me To the grave with me, to the grave with me To the grave, to the grave, to the grave with me To the grave with me, to the grave with me To the grave, to the grave, to the grave with me To the grave with me, to the grave with me To the grave, to the grave, to the grave with me   You're my forever, my slice of heaven On this side of the Mississippi River, baby   Ooh, when the good Lord calls me home and this life is through I may be six feet deep, but I'll still be lovin' you Baby, what we got won't ever die Can't take diamonds, can't take gold But I'll take your love with me when I go I'm gonna take it to the grave with me"
/songs/2317039,Thomas Rhett,I Feel Good,https://genius.com/Thomas-rhett-i-feel-good-lyrics,http://api.genius.com/songs/2317039,Tangled Up,2015-09-25," Ray Bans on, that sky is blue Cannonball into the pool Drink in hand, gonna act a fool like sha la la Boombox playin' that Third Eye Blind Wife is sippin' that Rosé wine I just lost all track of time like sha la la   My truck A/C is broken That Georgia breeze is blowin' I'm feelin' easy goin', that's right   I feel good, today Can't nobody bring me down And I just got paid, and I think I'm gonna hit the town Yeah, my problems can wait 'til tomorrow 'Cause I feel good today yeah Can't nobody bring me down, down, down, down, down Can't nobody bring me down, down, down, down Can't nobody bring me  (Uh excuse me, can someone bring the beat back)   My team won in overtime And I'm three sheets on Bud Light Lime Don't taste good, but that's alright now It ain't even Saturday But I'm gonna celebrate So don't you rain on my parade now, no no   My truck A/C is broken That Georgia breeze is blowin' I'm feelin' easy goin' that's right   I feel good, today Can't nobody bring me down And I just got paid, and I think I'm gonna hit the town Yeah, my problems can wait 'til tomorrow Cause I feel good today yeah Can't nobody bring me down, down, down, down, down Can't nobody bring me down, down, down, down Can't nobody bring me down, down, down, down, down Can't nobody bring me down, down, down, down Can't nobody bring me   Down I feel good, James Brown Turn the lights low, turn the music up loud Got a good party goin' on back at the house Bunch of big booty girls, yeah they come from the south The good vibes when you feelin' it Whoever made the potato salad put they foot in it I know we ain't the same, yeah, we different But we all stay connected like the Internet   I got no motivation Except for recreation Feels like I'm on vacation That's right   I feel good, today Can't nobody bring me down And I just got paid, and I think I'm gonna hit the town Yeah my problems can wait 'til tomorrow Cause I feel good today, yeah Can't nobody bring me down, down, down, down, down Can't nobody bring me down, down, down, down Can't nobody bring me down, down, down, down, down Can't nobody bring me down, down, down, down Can't nobody bring me"
/songs/1263118,Thomas Rhett,In a Minute,https://genius.com/Thomas-rhett-in-a-minute-lyrics,http://api.genius.com/songs/1263118,It Goes Like This,2013-10-29,"Here in a minute, any work I got left to do, aw man I'm gonna quit it If the boss man wants me to stay any longer he can kiss it, goodbye 'Cause I got a lot on my mind and I'm tryin' to forget it Yeah, right here in a minute So here in a minute I'm gonna roll to the Quick Sak Maybe grab a scratch off ticket If I get a lil' lucky, get some money in my pocket I'm gonna spend it On beer, yeah ice down the toolbox and see how high I can fill it Yeah, right here in a minute  I'm gonna call everybody Tell' em all there's a party If you want then it you better come and get it I'm gonna rock all night 'til I'm feelin' alright And the man in the moon get to grinnin' I'm gonna have a big time cause you get one life So I'm gonna make sure that I live it Cause you never know when you're gonna go It could all be all over in a minute  So, here in a minute I'm gonna find me a field somewhere, we can wake up the cricket's yeah Throw some diesel on the fire and see how high we can get it Get the guitars out and listen to them ol' boys pick it All night, right here in a minute  I'm gonna call everybody Tell' em all there's a party If you want it, then you better come and get it I'm gonna rock all night 'til I'm feelin' alright And the stars in the sky get to spinnin' I'm gonna have a big time cause you get one life So I'm gonna make sure that I live it Cause you never know when you're gonna go It could all be all over in a minute So here in a minute  In a minute gonna get a little loud, turn it up, burn it down Take a ride around, paint the whole dang town Here we go, countin' it down, 3, 2, 1...  I'm gonna call everybody Tell' em all there's a party If you want it, then you better come and get it I'm gonna rock all night 'til I'm feelin' alright And the stars in the sky get to spinnin' I'm gonna have a big time cause you get one life So I'm gonna make sure that I live it Cause you never know when you're gonna go It could all be all over in a minute  No, you never know when you're gonna go It could all be over in a minute So here in a minute, ah yeah Right here in a minute, that's right I'm gonna pop me a beer and I'm gonna get to sippin' Get to grinnin', right here in a minute"
/songs/1086734,Thomas Rhett,It Goes Like This,https://genius.com/Thomas-rhett-it-goes-like-this-lyrics,http://api.genius.com/songs/1086734,It Goes Like This,2013-05-06," Hey girl, you make me wanna write a song Sit you down, I'll sing it to you all night long I've had a melody in my head since she walked in here and knocked me dead Yeah girl, you make me wanna write a song   And it goes like ooh, what I wouldn't do To write my name on your heart, get you wrapped in my arms baby all around you And it goes like hey, girl I'm blown away Yeah it starts with a smile and it ends with an all night long slow kiss Yeah it goes like this   Hey girl, you make me wanna drive you home Get you outta here and get you all alone I don't know what it is about you, baby But I'm all messed up and it might sound crazy But you make me wanna write a song   And it goes like ooh, what I wouldn't do To write my name on your heart, get you wrapped in my arms baby all around you And it goes like hey, girl I'm blown away Yeah it starts with a smile and it ends with an all night long slow kiss Yeah it goes like this   Lookin' at you lookin' at me that way Makes me wanna grab my old guitar and play   Something like ooh, what I wouldn't do To write my name on my heart, get you wrapped in my arms baby all around you And it goes like hey, girl I'm blown away Yeah it starts with a smile and it ends with an all night long slow kiss Yeah it goes like this   And it goes like ooh, and it goes like hey And it ends with a kiss Yeah it goes like this"
/songs/3174413,Thomas Rhett,Kiss Me Like a Stranger,https://genius.com/Thomas-rhett-kiss-me-like-a-stranger-lyrics,http://api.genius.com/songs/3174413,Life Changes,2017-09-08," Busy working hard, wrapped up in my job, we got bills to pay Lately, when we talk, it feels like I don't hear a single word you say Can we get back to the basics And find that young love and make it? And tear down all these walls Ignore all of our calls and just stay in   Kiss me like a stranger Baby, hold me like we've never met Every touch, a little danger Like you ain't gotten used to me yet Strike a match, light the fuse You and I, we could use some reckless behavior So, baby, kiss me like a stranger   Lightning on my skin Every touch remembering what you mean to me, oh Let me reminisce my lips on your lips Like a symphony, you're playing on my heartstrings   Kiss me like a stranger Baby, hold me like we've never met Every touch, a little danger Like you ain't gotten used to me yet Strike a match, light the fuse You and I, we could use some reckless behavior So, baby, kiss me like a stranger   It's been a little crazy lately Come on and remind me, baby Well, girl, don't keep me waiting Come on over my way and lay it on me   And kiss me like a stranger Baby, hold me like we've never met Every touch, a little danger Like you ain't gotten used to me yet Strike a match, light the fuse You and I, we could use some reckless behavior So, baby, kiss me like a stranger   Ooh, won't you kiss me, won't you kiss me Won't you kiss me like a stranger Mmm, yeah, won't you kiss me like a stranger Ooh, I got plans for you, I got plans for you I got plans for you, I got plans for you Kiss me like a stranger You feeling now, ooh You feeling now, ooh You feeling now, ooh"
/songs/3174379,Thomas Rhett,Leave Right Now,https://genius.com/Thomas-rhett-leave-right-now-lyrics,http://api.genius.com/songs/3174379,Life Changes,2017-09-08," Same streets, same party Drowning their problems in Bacardi Same people still talking Whoa, I'm so over it, I'm sorry   Baby, you and me can leave right now Ditch all your friends, and the guy you came with Get to know you where it ain't so loud Just you and me alone, some old moonlit road Well, the two of us could disappear Just say the word, we'll get outta here Baby, you and me can leave right now Meet me out back if you like how that sounds   You and me could You and me could We can leave right now You and me could If you like how that sounds You and me could   If not, I get it That smile on your face, yeah, it says different One kiss, girl, just try it 'Cause you never know, you just might like it   Baby, you and me can leave right now Ditch all your friends, and the guy you came with Get to know you where it ain't so loud Just you and me alone, some old moonlit road Well, the two of us could disappear Just say the word, we'll get outta here Baby, you and me can leave right now Meet me out back if you like how that sounds   You and me could You and me could We can leave right now You and me could If you like how that sounds You and me could Oh, baby, you and me could Oh, baby, you and me could   Same streets, same party Same people still talking   Baby, you and me can leave right now Ditch all your friends, and the guy you came with Get to know you where it ain't so loud Just you and me alone, some old moonlit road Well, the two of us could disappear Just say the word, we'll get outta here Baby, you and me can leave right now Meet me out back if you like how that sounds"
/songs/3165498,Thomas Rhett,Life Changes,https://genius.com/Thomas-rhett-life-changes-lyrics,http://api.genius.com/songs/3165498,Life Changes,2017-08-31," Waking up in my college dorm Yeah, my life, it was pretty normal Looking for a date to the spring formal Wasn't worried 'bout nothing else, no Majoring in Undecided Notebook full of bad songs I was writing Never dreamed anybody else would like them Now they're sitting on a Walmart shelf   Ain't it funny how life changes You wake up, ain't nothing the same and life changes You can't stop it, just hop on the train, and You never know what's gonna happen You make your plans and you hear God laughing Life changes, and I wouldn't change it for the world, the world, oh no And I wouldn't change it for the world, the world, oh no   I bought a ring and she said, ""I do"" But everybody else said, ""Man, you're twenty-two Whatcha trying to prove? Hey, why don't you wait?"" 'Cause I've been waiting on her since the second grade, yeah And now she got her own set of fans She got a blue check mark by her Instagram And I wrote a little song about holding her hand And now everybody wanna die a happy man   Ain't it funny how life changes You wake up ain't nothing the same and life changes You can't stop it just hop on the train, and You never know what's gonna happen You make your plans and you hear God laughing Life changes, and I wouldn't change it for the world, the world, oh no And I wouldn't change it for the world, the world, oh no   I remember the day I told my Daddy and Mama ""You're gonna have a grandkid, yep From Uganda, that's right, we're adopting And she is the cutest little girl that you've ever seen"" Well I was wrapping my head around being a dad A big wrench got thrown in the plans we thought we had Now Lauren's showing, got one on the way Yeah that's two under two, hey, what can I say?   Ain't it funny how life changes You wake up ain't nothing the same and life changes You can't stop it, just hop on the train, and You never know what's gonna happen You make your plans and you hear God laughing Life changes, and I wouldn't change it for the world, the world, oh no And I wouldn't change it for the world, the world, oh no"
