api_path,primary_artist,title,url,song_endpoint,album,release_date,lyrics
/songs/30300,Timbaland,Talking on the Phone,https://genius.com/Timbaland-talking-on-the-phone-lyrics,http://api.genius.com/songs/30300,Tim's Bio: Life From Da Bassment,1998-11-28," Yo yo yo yo Wah wah wah Yea yo yo Wah wah wah wah Wah wah wah wah (uh huh) Yo yo Wah wah wah   I trusted her, my home girl from school (yea yea) Introduced her to my man, they became cool (uh) She told me that, that he loved me so (wah wah wah wah) I shoulda known she liked him all along (yo) They were   Talking on the phone (talking on the phone, you) Gotta get your own (gotta get your own man) Leave my man alone (leave my man alone and stop) Callin' him on the phone (callin' him on the phone)   Don't hang with girls, cuz they too slick They smile in my face, all on my man's (ohh...ficky ficky) You don't know what, what I've been through I'll get him first, then I'll deal with..you   Talking on the phone (talking on the phone) Gotta get your own (you gotta get your own man) Leave my man alone (and leave my man alone) Stop callin' on the phone (and stop talking on the phone)   Daaaa, da da (yo yo yo) Daaaa, da da Da da, da da (yo yo yo) Daaaa, da da Daaaa, da da (yo yo yo) Daaaa, da da (yo yo yo yo) Da da, da da (ficky ficky)   Ficky ficky ficky S-U-P-A Fly, I'm cute I, keep y'all bitches, chicken like soup What y'all wan' do, I'm not that chick to talk shit Nor I'm that chick to fuck wit' Did you hear this? Did you get this? Watch Missy flip like an acrobatic My automatic Tongue tactic Make flows like this Be the muthafuckin' shit (shit echoes)  [Verse 4: Alien & Kelly Price] What I need right now Is for y'all You and Kelly I need for y'all to To come meet me in space Now could y'all sing that for me one more again The first verse   I trusted her, my home girl from school (yea yea) Introduced her to my man, they became cool (uh) She told me that, that he loved me so (wah wah wah wah) I shoulda known she liked him all along (yo) They were   Talking on the phone (talking on the phone) Gotta get your own (you gotta get your own man) Leave my man alone (leave my man alone and stop) Callin' him on the phone (callin' him on the phone)  [Verse 5: Alien & Kelly Price] How do y'all like space? Can you dig it? (wah wah wah wah) Now if you like space for all my martian people out there I need all y'all to put y'alls hand up If you can feel me Cuz need Kelly to sing the second verse for me on the space version  [Verse 2 repeat: Alien and Kelly Price] Don't hang with girls, cuz they too slick They smile in my face, all on my man's (ohh...ficky ficky) You don't know what, what I've been through I'll get him first, then I'll deal with it (what she doin' girl) You   Talking on the phone (say what) Ta-ta-ta-talking on the phone (can you feel it) Ta-ta-ta-ta-ta-talking on the phone (say what, yea) Ta-ta-ta-ta-ta-ta-talking on the phone (yea, say what, yo yo yo yo yo) Talking on the phone (I'm feeling quite good right now) Talking on the phone (but I think it's time for me to take my spaceship to another planet) Talking on the phone (cuz right now I don't think the world is ready for Timbaland) Ta-ta-talking on the phone (I'm on that next level, can you dig it) Ta-ta-talking on the phone (can you dig it) Ta-ta-talking on the phone (I don't think so)   Come to the light, Kelly!"
/songs/30255,Timbaland,Talkin' Trash,https://genius.com/Timbaland-talkin-trash-lyrics,http://api.genius.com/songs/30255,The PJs: Music from & Inspired by the Hit Television Series,None," Do you like it?  Uh, uh, uh, what Do you want it?  Uh, uh, uh, what Do you like it?  Uh, uh, uh, what Do you want it?  Uh, uh, uh, say what, here we go Do you like it?  Uh, uh, uh, what, here we go Do you want it?  Uh, uh, uh, what, here we go Do you like it?  Uh, uh, uh, what, here we go Do you want it?  Part two, part two   Why you always askin' me why I talk like that? What, you think you betta, nigga, cuz your pockets are fat? Excuse me?  But wasn't I the one that you meant? You talkin' trash to these niggas about to dent up they whip You know me and I don't think I have to explain You that same crotty nigga that fucked that bitch in my Range It was the same, life, it was talked up a good game Between that money and that pussy that she claim to fame   Look at you, talkin'-tellin' all the bullcrap lies It was you who made me put my hands on your thighs Never ever was the one that humped that girl on your Rover You forgot your baby cousin humped that girl on your Rover It's Timbaland, baby, I don't get down like that Don't try to explain, get yo ass to the back Never ever disrepsect the man that put you on his team Now baby dove, get the keys to your Beem'  1	 	Why you talkin' big trash to me? 	 	Cuz you always playin' games, Timothy 	 	Why you tryin' to make me mad, ba-be 	 	Cuz you always playin' games, Timothy  	 	Why you talkin' big trash to me? 	 	Cuz you always playin' games, Timothy 	 	Why you tryin' to make me mad, ba-be 	 	Because you always playin' games with Bassy   I done met many players that act like you Think because they spend some money that I'm ready to screw Instead of talkin' 'Hit me up around the 1st and the 5th' Cuz you rot in a crumbed out six, you think I'm whipped Got numerous niggas that be rottin' my shit And the last thing I need is a nigga for kicks I stay dibbed and forever spend the louchie on Gucci Fuck the money and diamonds cuz nigga, I'm still shinin'   Look at you, girl, talkin' trash Talkin' trash, actin' grown, show your ass Don't try to get on my track and clown You my queen, my mistress, my Jackie Brown Why you tryin' to start trouble in my can? Now hot and angry and I'm getting amped Keep on givin' me the cold shoulder Now I got to get the keys to the Roller You gone  Repeat 1   It was all for the paper, that's right, all for the love Only wanted most what ghetto girls dream of I need the Hummers and the yachts, Don P on the rocks Cardierre wrist wear with the shivel on top Then you lace me, now you hate me, now you tryin' to replace me Had a woman when you dated me, I guess I was crazy (know you was crazy) Tried to play me but your game's a little lazy Cuz I hooked up and got with your man, nigga scrammed   Girl, what you know about Cardi and wrist wear? When you don't even wear Vic's Underwear Think before you start talkin' shit Remember, I'm the man with the diamonds and whips I ain't tryin' to beg, but a legend like those speedos I ain't gon get mad if you hump one of my people I keep tellin' you this is me you talkin' to Talkin' trash won't get you nowhere, baby boo  Repeat 1 Repeat 1"
/songs/1861869,Timbaland,Talk That,https://genius.com/Timbaland-talk-that-lyrics,http://api.genius.com/songs/1861869,None,2016-10-28,"They can talk that shit they can talk that shit They can talk that shit they can talk that shit They can talk that shit they can talk that shit They can talk that shit they can talk that shit  Baby girl you saw I'm a don let's get on one accord If you misunderstanding me check me out on forbes And I got a maybach with the partition And they call it flat head baby flat baby the new edition  It's timbaland man beats that make you bump that Over a mill on my debit card believe that Wanna hurt a nice top I'm talking implant 'bout to cop a nice watch I'm talking rembrandt  I've been around world so much I think I'm omar I met that  you the golden arch Yeah I talk shit nigga that deed shit I bought a yacht just to see if I would get seasick  So why you fronting for when you ain't got that? I got a bugatti zana bitch you ain't got that Homey your money's too young you need to go to bed It's grown man over here nigga we talk that  Hey shorty what you looking for? I bet I got it here I'm in a maybach he in the cavalier Now you can only talk cash here if you got cash Let's have a conversation we can talk about that  And I'ma talk talk talk talk And I'ma talk talk talk talk Now go and give me 50 because when I talk that spitting If the haters keep hating I'ma have to come and talk that shit  Oh you think you cute huh got a lot of money huh I'm filthy rich and you can call me donald trump huh I got big bank I'm talking big bucks And I bought a phantom to see how the back doors open up  Missy e on the track I'm make you bump that I got the new ferrari shorty you ain't got that I got them whips that so sick when I spit them hating chicks Wanna know how much I get two hundred grand and eat doritos chips  Been around the world so much I'm like obama And I got a vacation spot in the bahamas  Yeah I talk shit talking 'bout that deep shit I call the dj's up and tell them go and leak this  'cause I got that cash I got that dough I make my money money grow so I'm never broke You wanna know much it costs to get a tim track Man you can't afford that  Hey shorty what you looking for? I bet I got it here I'm in a maybach he in the cavalier Now you can only talk cash here if you got cash Let's have a conversation we can talk about that  And I'ma talk talk talk talk And I'ma talk talk talk talk Now go and give me 50 because when I talk that spitting If the haters keep hating I'ma have to come and talk that shit  They call me missy e I got a lot of cheese And you're a nickel bag shorty I'm a dime piece Don't you see the clothes I wear, got dough up everywhere And the lamborghini doors that go up in the air  Man look at this I got the bentley whip I drive the sickest benz boy I make them haters sick You know, I got it, I get it, I be the richest in the city Talking more shit than you see up in the toilet  Man you's a hater I got the big house with the elevator See the way you sit on it 12 big acres I rent movies for my movie theater  Now what you talking bout? She ain't got that I got the credit card, that color be jet black See the way the hater talk a missy don't care I be your a millie a milli I'm a millionaire  Hey shorty what you looking for? I bet I got it here I'm in a maybach he in the cavalier Now you can only talk cash here if you got cash Let's have a conversation we can talk about that  And I'ma talk talk talk talk And I'ma talk talk talk talk Now go and give me 50 because when I talk that spitting If the haters keep hating I'ma have to come and talk that shit"
/songs/30270,Timbaland,The One I Love,https://genius.com/Timbaland-the-one-i-love-lyrics,http://api.genius.com/songs/30270,Shock Value II,2009-12-08,"[Intro: D.O.E.] Girl, gimme that, mmm, ahh, c'mon, girl, get down Girl, gimme that mmm, ahh, Timberland got you, baby Girl, I hear you talkin' that, how you got things in control? Come and sit across my lap, there some things you need to know I got that good-good lovin', have you buggin', in the zone Bet I'll have you goin' crazy I don't think you ready fo' it Here we go   Naw shorty, I don't think you know 'bout me yey While you've been talkin' the talk, I've been walkin' the walk since I turned sixteen, yeah Now now now now daddy, boy, you stop 'pproachin me, yeah You better get get it together 'cause I'm not your normal routine, yeah, ayy, ayy, ayy Oh I, I've got that uh uh uh to back it up So you better make make, make sure that you're good enough To keep it up, relationship gotta mean enough For you to act right, boy, you gotta act right   I'm a maniac, a maniac It's so crazy how I act when I fall in love I'm a maniac, a maniac Gotta know if you're down for me before I move on 'Cause I'm a maniac When it comes to the point of love, gotta know that I rock with you 'Cause I'm a maniac When it comes to the things I do, gotta know that I'm willing to Ro-ah-ah-ah-ock, only wit'chu, yeah And never sto-ah-ah-ah-op, 'cause you're my boo, yeah I'm a maniac, for love, maybe I'm crazy, yeah, I'm crazy, yeah     Ooh yeah, if you really want to get wit me yeah You need to get it together 'cause I'm out here givin' you all of me, yeah Ah-ah-ah-oww, baby, I'm the chick that you really need, yeah I don't have to sell myself cause you can see the proof's in the pudding, yeah, ayy, ayy Oh I, I've got that uh uh uh to back it up So you better make make make sure this is what you want To keep it up, relationship gotta mean enough For you to act right, boy, you gotta act right!   I'm a maniac, a maniac And if it's concerning you, then I lose my head I'm a maniac, a maniac The way I feel is crazy, that's how I know 'Cause I'm a maniac When it comes to the point of love, gotta know that I rock with you 'Cause I'm a maniac When it comes to the things I do, gotta know that I'm willing to Ro-ah-ah-ah-ock, only wit'chu, yeah And never sto-ah-ah-ah-op, 'cause you're my boo, yeah I'm a maniac, for love, maybe I'm crazy, yeah, I'm crazy, yeah  [Verse 3: D.O.E.] Uh, don't you know When I put that thing on you, you get emotional Babe, you had your heart on lock and key, I broke the code When I put my ballot in your slot, you'll vote for D.O.E Turn you on like remote control (remote control) Oh no no, here we go go go Girl, don't stop it, love the way you pop and drop it, low low low Uh, I should call you Taylor Maid, 'cause your jeans fit tailor-made Do not disturb so tell the maid we're gonna be all day day   I'm a maniac, a maniac It's so crazy how I act when I fall in love I'm a maniac, a maniac Gotta know if you're down for me before I move on 'Cause I'm a maniac When it comes to the point of love, gotta know that I rock with you 'Cause I'm a maniac When it comes to the things I do, gotta know that I'm willing to Ro-ah-ah-ah-ock, only wit'chu, yeah And never sto-ah-ah-ah-op, 'cause you're my boo, yeah I'm a maniac, for love, maybe I'm crazy, yeah, I'm crazy, yeah  "
/songs/106187,Timbaland,The Party Anthem,https://genius.com/Timbaland-the-party-anthem-lyrics,http://api.genius.com/songs/106187,None,2013-01-01," 1, 2, 1, 2 I said 1, 2, 1, 2 Everybody hands up in the air 1, 2, 1, 2 Let me see your drinks up in the air 1, 2, 1, 2 1, 2, 1, 2   It's that modern day Tony Stark, biggest dog in the game with the biggest bark Money, money, money, money don't make the man Man make the money with the biggest master plan I got the, got the, got the, got these niggas going nuts Raising bottles in the air, the money they throwing up Peep my, peep my, peep my, peep my, peep my game boy When it's all said and done I'm hall of fame boy I'm riding, riding, riding, riding in a new ghost With my business partner, nah, not White Wed french folks Call me, call me, call me, call me “Tim: The Party Man” Be in the clubs and radio all on one command Now show your hands   Okay (okay), let's get it jumping (let's get it jumping) Turn up the speakers Can you hear the bass bumping? Them tweeters tweaking I came here to party, pass that cup around (round) Put your hands in the air move'm up and down (down) Hey (hey), give me a bottle and a fucking cup Fuck that cup, I'm about to turn that bottle up Cause I cam here to party, pass that cup around (round) Put your hands in the air move'm up and down (down) Oohwoah   I heard somebody said he wasn't dead yet They should've never said that Young Tunechi got the game down Pat Sajak Even though I'm paid in full, all I want is Payback Man, fuck these niggas. Pause I spray king kill the world and fuck them all in my cigars I make them mother fuckers bow down, no applause All of my goons wired up like broken jaws I rep that mother fucking red flag put you in a dead bag I get bread you get the crumbs at the bottom of the bread bag And my letters is Y M, shout out Stunna and Slim I'm fucking with Tim and my girl, I'm fucking her friend Tunech!     This country bitch from Virginia See the way the crowd go wild when Misdemeanor 'bout to enter Everybody better bow down when I step up to the mic; front and center Say I'm too old to rap, I'll be rapping til I wear dentures Yeah, hello haters You mad? Pick your chin up What did I say about running your mouth? You better respect your mentors I'm so relentless flow colder than the winters I'm pretty in the face and I should pose for a pin-up (I drink my gin up) I'm on the mic, I'm back with Tim We looking good like working out up in the gym Anybody wanna see us? Competition? We don't see'm Ain't nothing change, we ahead of the game above the rim This how we do it     1, 2, 1, 2 I said 1, 2, 1, 2 Everybody hands up in the air 1, 2, 1, 2 Let me see your drinks up in the air 1, 2, 1, 2"
/songs/30290,Timbaland,The Way I Are,https://genius.com/Timbaland-the-way-i-are-lyrics,http://api.genius.com/songs/30290,Shock Value,2007-07-09," Yeah, yeah (Yeah) Yeah, yeah (Yeah) One at a time, baby Yeah, yeah (Yeah)   I ain't got no money I ain't got no car to take you on a date I can't even buy you flowers But together we'll be the perfect soulmates Talk to me, girl   Oh, baby, it's alright now, you ain't gotta flaunt for me If we go Dutch, you can still touch my love, it's free We can work without the perks just you and me Thug it out 'til we get it right   Baby, if you strip, you can get a tip 'Cause I like you just the way you are (I'm about to strip and I'm well equipped Can you handle me the way I'm are?) I don't need the G's or the car keys Boy, I like you just the way you are Let me see ya strip, you can get a tip 'Cause I like, I like, I like   I ain't got no Visa I ain't got no Red American Express We can't go nowhere exotic It don't matter 'cause I'm the one that loves you best Talk to me, girl   Oh, baby, it's alright now, you ain't gotta flaunt for me If we go Dutch, you can still touch, my love is free We can work without the perks just you and me Thug it out 'til we get it right   Baby, if you strip, you can get a tip 'Cause I like you just the way you are (I'm about to strip and I'm well equipped Can you handle me the way I'm are?) I don't need the G's or the car keys Boy, I like you just the way you are Let me see ya strip, you can get a tip 'Cause I like you just the way you are  [Verse 3: John Doe/D.O.E] Baby girl, I don't got a huge ol' house, I rent a room in a house Listen baby girl, I ain't got a motorboat, but I can float ya boat So listen baby girl, once you get a dose of D.O.E., you gon' want some mo' So listen baby girl, when I make it, I want you back, want you back, yeah"
/songs/2015078,Timbaland,The Way I Are (Vs Nephew),https://genius.com/Timbaland-the-way-i-are-vs-nephew-lyrics,http://api.genius.com/songs/2015078,None,2006-10-06,"[Verse 1: Timbaland Simon Kvamm] I ain't got no money I ain't got no car to take you on a date  Aha I can't even buy you flowers But together we could be the perfect soulmates  Aha Talk to me girl   Oh, baby, it's alright now, you ain't gotta flaunt for me If we go Dutch you can still touch, my love is free We can work without the perks just you and me Thug it out 'til we get it right  [Hook 1: Keri Hilson Simon Kvamm] Baby if you strip, you can get a tip 'Cause I like you just the way you are I'm Scandinavian, everything is what it is I don't need the G's or the car keys Boy I like you just the way you are I'm Scandinavian everything is free  [Verse 2: Timbaland Simon Kvamm] I ain't got no Visa I ain't got no Red American Express Aha We can't go nowhere exotic It don't matter 'cause I'm the one that loves you best Aha Talk to me girl   Oh, baby, it's alright now, you ain't gotta flaunt for me If we go Dutch you can still touch, my love is free We can work without the perks just you and me Thug it out 'til we get it right  [Hook 1: Keri Hilson Simon Kvamm] Baby if you strip, you can get a tip 'Cause I like you just the way you are I'm Scandinavian, everything is what it is I don't need the G's or the car keys Boy I like you just the way you are I'm Scandinavian everything is what it is Baby if you strip, you can get a tip 'Cause I like you just the way you are I'm Scandinavian everything is what it is I don't need the G's or the car keys Boy I like you just the way you are I'm Scandinavian everything is free  [Verse 3: John Doe/D.O.E] Baby girl, I don't got a huge ol' house I rent a room in a house Listen baby girl, I ain't got a motorboat but I can float ya boat So listen baby girl, once you get a dose of D.O.E. you gon' want some mo' So listen baby girl, yeah   And we will do it again when We'll play it again then And you will hear it again, and Again and again and Thug it out 'till we get it right  [Hook 2: Simon Kvamm Timbaland Timbaland & Keri Hilson] Nothing but the Scandinavian way I are I'm about to strip and I'm well equiped Can you handle me the way I are? Nothing but the Scandinavian way I are Let me see ya strip, you can get a tip Cause I like you just the way I are? Love me the Scandinavian way I are I'm about to strip and I'm well equiped Can you handle me the way I are? It's properly, the Scandinavian way I are I'm about to strip and I'm well equiped Can you handle me the way I are?   I'm Scandinavian everything is, what it is (Oh!) I'm Scandinavian everything is, what it is (Oh!) I'm Scandinavian everything is, what it is"
/songs/2397235,Timbaland,"This Me, Fuck It",https://genius.com/Timbaland-this-me-fuck-it-lyrics,http://api.genius.com/songs/2397235,King Stays King,2015-12-25," DJ Timi Timb, on the 1's and 2's 'bout to give it to ya   I try, survive, K9's outside What's life, I strive, I do it, you lie   This me, fuck it, this me, fuck it Like this, fuck it, right here, fuck it   Get mine, take yours, go far, go hard Go home, big mansion, front look like a backyard This me, fuck it, touch me, bussin My weed musty, treat the Porsche like a Huffy Listen ladies, if ya nigga lame, then I don't wanna fuck ya Listen ladies, if you ain't wanna waste things Then I don't wanna hug ya Big money, soldiers, slept on me, Folgers My girl, gorgeous, both pockets, bulges This me, that's right, pulled up, stop light Got out, aight, aight, aight   This me, fuck it, this me, fuck it Like this, fuck it, right here, fuck it   Timbo, great, make beats like steak Chef in tha booth, make niggas a plate Make niggas relate, might dive in a lake VA, banana clips, Planet of The Apes Ain't no debate, ride like freeway Ride like DJ's, if money talks, I'm on three way Live life, get paid, been high since 10th grade Fuck with me get ya rent paid, cuttin' up like a switchblade   This me, fuck it This me, fuck it Like this, fuck it Right here, fuck it"
/songs/3227932,Timbaland,This Track Is Stoopid,https://genius.com/Timbaland-this-track-is-stoopid-lyrics,http://api.genius.com/songs/3227932,None,2016-10-28," Timbo the king, right? Haha Uhn EGGGHCK   King Push, Timbo V.A, that’s kin folk Cocaine on tempo You hold hands with that nympho My big pimpin', too cold Lobster and shrimp, I’m the new Hov No Carter here, but my Cartier Is just lit up like a party here I’m post Porter, A.Z Midget moli and a AC Triple park like Freddy Meyers We gettin' money like it’s ‘83 Modern day hide away South to France on holiday She in Hermes with her ass up And I’m smackin’ it like Oda Mae I turned her, I showed her I made her cause I mold her I owed her not a iota I dressed her up cause she on my shoulder (Woo!) Baller like You’ve been a petty nigga all your life Take shoes back quick when she pause a fight Shoot a bitch in her foot like it’s Harlem Nights   This track is stoopid All the ones  SOON!"
/songs/30285,Timbaland,Throw It on Me,https://genius.com/Timbaland-throw-it-on-me-lyrics,http://api.genius.com/songs/30285,Shock Value,2007-02-04," The time has come, flyweight champion of the world! (Flyweight champion of the world) The time has come (Hey girl) The Hives   Take it to the back of the club Fast talkin, don't take this the wrong way I've been peepin that ass And if you give me my chance, I ain't gon' play I really wanna get to know ya That's what I told ya girl, you know I don't play (OW!) I wanna put it in your - Whoa girl You better do what the song say   Uhh, just throw it on me; uhh, just throw it on me Uhh, just throw it on me (Wiggle that ass before you throw it on me) Uhh, just throw it on me; uhh, just throw it on me Uhh, just throw it on me (Wiggle that ass before you throw it on me)   I got so many broads White cars I can jump in two or three in the same day (WOO-OO) And when I park my car Soon as I walk in the spot women say (OW!) They ... Showin' me titties And they callin my name and all night God damn babe (SHUT UP!) Niggas is hatin me Cause they girl wanna throw that thang on me like it's okay, girl!   Uhh, just throw it on me; uhh, just throw it on me Uhh, just throw it on me (Wiggle that ass before you throw it on me) Uhh, just throw it on me; uhh, just throw it on me Uhh, just throw it on me (Wiggle that ass before you throw it on me)   From the look of at that ass You probably a ""Gold Digger"" but I ain't Kanye Baby girl, you're on the right track But you're goin' the wrong way And when we leave out the party Baby girl I got the game that we gon' play And when ya wake up tomorrow I'll be on the highway (peace) HEY!!   Uhh, just throw it on me; uhh, just throw it on me Uhh, just throw it on me (Wiggle that ass before you throw it on me) Uhh, just throw it on me; uhh, just throw it on me Uhh, just throw it on me (Wiggle that ass before you throw it on me)   Right... ... before you throw it on me Right - The Hives (just throw it on me) THE HIVES - JUST THROW IT ON MEEEE~! Just throw it on meee, just throw it on meeeeeeeeeeeee (Uh-uhh) Throw it on meeeeeeee, oooh yeahhh OWWWW~!"
