api_path,primary_artist,title,url,song_endpoint,album,release_date,lyrics
/songs/30280,Timbaland,Give It to Me,https://genius.com/Timbaland-give-it-to-me-lyrics,http://api.genius.com/songs/30280,Shock Value,2007-02-06," Is it going? Is it going? Is it going? Is it going? I don't know what you're lookin' for Oh, yeah, boy, come on   I'm the type of girl that look you dead in the eye, eye I'm real as it comes if you don't know why I'm fly-y-y-y-y I've seen you trying to switch it up, but girl, you ain't that dope I'm the Wonder Woman, let me go get my rope I'm a supermodel and mami, si mami Amnesty International, got Bangkok to Montauk on lock Love my ass and my abs in the video for ""Promiscuous"" My style is ri-dic-dic-diculous, 'ulous, 'ulous   If you see us in the club, we'll be actin' real nice If you see us on the floor, you'll be watchin' all night We ain't here to hurt nobody (So give it to me, give it to me, give it to me) Wanna see you work your body (So give it to me, give it to me, give it to me)   When Timbo' is in the party, everybody put up they hands I get a half a mil' for my beats, you get a couple gra-a-and Never gon' see the day that I ain't got the upper hand I'm respected from Californ-I-A, way down to Japan I'm a real producer and you just a piano man Your songs don't top the charts, I heard 'em, I'm not a fa-a-an Niggas talkin' greasy, I'm the one that gave them they chance Somebody need to tell 'em that they can't do it like I can   If you see us in the club, we'll be actin' real nice If you see us on the floor, you'll be watchin' all night We ain't here to hurt nobody (So give it to me, give it to me, give it to me) Wanna see you work your body (So give it to me, give it to me, give it to me)   Could you speak up and stop mu-mumbling? I don't think you came in clear When you're sittin' on the top It's hard to hear you from way up here Now I saw you tryin' to act cute on TV ""Just let me clear the air..."" We missed you on the charts last week Damn, that's right you wasn't there Now if se-sexy never left, then why is everybody on my shi-i-it? Don't hate on me just because you didn't come up with it So if you see us in the club, go on and walk the other way 'Cause our run will never be over, not at least until we say   If you see us in the club, we'll be actin' real nice If you see us on the floor, you'll be watchin' all night We ain't here to hurt nobody (So give it to me, give it to me, give it to me) Wanna see you work your body (So give it to me, give it to me, give it to me)   Oh... (Huh, huh, huh) Oh... (Huh, huh, huh) Oh... (Huh, huh, huh) Oh... (Huh, huh, huh) Oh... (Huh, huh, huh) Oh... (Huh, huh, huh) Oh... (Huh, huh, huh) Oh... (Huh, huh, huh)   If, you, see, us, in, the... Club, we'll be actin' real nice If you see us on the floor, you'll be watchin' all night We ain't here to hurt nobody (So give it to me, give it to me, give it to me) Wanna see you work your body (So give it to me, give it to me, give it to me) If you see us in the club, we'll be actin' real nice If you see us on the floor, you'll be watchin' all night We ain't here to hurt nobody (So give it to me, give it to me, give it to me) Wanna see you work your body (So give it to me, give it to me, give it to me)"
/songs/2506700,Timbaland,Go Ahead (Boo Boo Kitty),https://genius.com/Timbaland-go-ahead-boo-boo-kitty-lyrics,http://api.genius.com/songs/2506700,King Stays King,2016-02-03," Man i'm talking bout i'm in the pussy Man i'm talking man i'm in the pussy that's being disrespectful bitch I hear a bitch say skeet in me Skeet in you bitch I can't do that it's not worth money nowadays Bitch i'll skeet on you but can't skeet in you Yeah!! DJ Timmy Tim Skeet skeet skeet We on some ghetto shit baby Yeahhhh! let's go baby   Go boo boo kitty Go boo boo Go boo boo kitty Go boo boo Go kitty Go boo boo kitty Go boo boo Go boo boo kitty Go boo boo   Go ahead act like you ain't know her Go ahead act like you ain't notice her Go ahead act like you ain't notice her Go ahead, yeah, ok Go ahead pull up on the scene yeah Go ahead flexin on that thing , yeah we here Damn go ahead, yeah go ahead Go ahead rock all night, go ahead say you did it first yeah yeah Ima go ahead kill em boys put em in a hearse Put em in a hearse, go ahead Ima go ahead pull up in a old one playing on flex, yeah Ima go ahead show em niggas why we got next yeah yeah go ahead Go ahead rock that 13 17 Go ahead respect young pimping got 2 pinky rings Go ahead fall back cause the [?] got the cap yeah yeah go head Go ahead keep yo 2 cents nigga i'm about real paper Yeah run it up go go head   Go boo boo kitty Go boo boo (I love it baby) Go boo boo kitty Go boo boo (I love it baby) Go kitty Go boo boo kitty Go boo boo Go boo boo kitty Go boo boo   I'm in this bitch with ma squadron Act like you don't know about them I've got right now and you got next Go ahead and I like is the opposite Putting them back in the kitchen I'm back in the pans and the pots are gonna wash Go ahead act like we ain't got the sauce like [?] You niggas is dry shit (yeah ) Nike my clothes go head Nike my woes go head My team on go god damn Act like you don't know God damn I don't fuck with no I mean It's the chip on ma shoulders man Sleep if you want my friend Go head, go head   Go boo boo kitty Go boo boo (I love it baby) Go boo boo kitty Go boo boo (I love it baby) Go kitty Go boo boo kitty Go boo boo Go boo boo kitty Go boo boo   Timbo say get em so it's go and get em On full attack i'm a savage I just gained a drip on em then I regulate To the money young nigga watch em levitate Hella thing we made attention watch me elevate Tryna reach the most high for a better day See I just play positions some just had to listen Young nigga leaning constant scheming on yo bitch"
/songs/113700,Timbaland,Hands In The Air,https://genius.com/Timbaland-hands-in-the-air-lyrics,http://api.genius.com/songs/113700,Step Up: Revolution – Music from the Motion Picture,None," Dance all (night) I said dance all (night)   Hey baby girl: Looking all done up I wanna know: Where did you come from? The heat begin to raise... Hot woman The club about to go into flames... Baby, speakers thumping Let's party hard, and just move something The vibe is right and it goes, goes, goes, goes something like this:   Such a beautiful crowd... The levels on 10... People standing on chairs with their hands up in the air Girls getting real wild... Hair blowing in the wind... Girls standing on the chairs with their hands up in the air   ...With their hands up in the air... ...With their hands up in the air... ...With their hands up in the air... ...With their hands up in the air... ...With their hands up in the air... ...With their hands up in the air... ...With their hands up in the air... ...With their hands up in the air...  [Verse 2: Ne-Yo] High heels, standing on them soft couch cushions Careful, not to break her concentration Maintain sexy as she maintains balance (balance) If you fall, baby girl it won't be cute at all (at all) Drink in your left hand (left hand) Girlfriend in your right (your right) On the couch dancing (dancing) Holding on for dear life (life) Thump of the music (plus!) The flash of the light (plus!) Long legs and a short skirt equal one hell of a night! Know what I'm talking about?    [Bridge: Timbaland & Ne-Yo] Uh, hands in the air Uh, hands in the air I got my eyes closed! Jumping up and down, baby I'm on ten I got my eyes closed! Listen to the sounds, so hypnotizing (Hey!) And I bet before the night ends (Hey!) I'm going to find one that I'm liking Take her home, get it on next morning Baby girl, give me that one more gin before you go (I got my hands in the air) I got my eyes closed (I got my hands in the air) I got my eyes closed (I got my hands in the air) I got my eyes closed (I got my hands in the air) My hands, my hands, in the air, in the air...  "
/songs/1835940,Timbaland,Hands Up In The Air,https://genius.com/Timbaland-hands-up-in-the-air-lyrics,http://api.genius.com/songs/1835940,None,2016-10-28,"There's all I said there's all Hey baby girl, looking all grown up I wanna know where did you come from The heat begin to raise I warm up The club about to go on plane Niggas speakers thumpin' Lets party hard And just move something The vibe is right and it goes Goes, goes on like you Such a beautiful crowd Levels on the ten We're standing on chairs With our hands up in the air Girls getting real wild Hair blowin' in the wind Were standing on chairs With the hands up in the air With the hands up in the air With the hands up in the air With the hands up in the air With the hands up in the air With the hands up in the air With the hands up in the air With the hands up in the air With the hands up in the air If youre standing on them Soft couch cushions Careful not to break your concentration Maintain sexy as she maintains balance Balance, if you fall, baby Girl that won't be cute at all Drink in the your left hand Girlfriend in your right Only comes dancing, holding on forget all night Long legs and a short skirt Equals one hell of a night And now Im talking about Such a beautiful crowd Levels on the ten Were standing on chairs With our hands up in the air Girls getting real wild Hair blowin' in the wind We're standing on chairs With the hands up in the air With the hands up in the air With the hands up in the air With the hands up in the air With the hands up in the air With the hands up in the air With the hands up in the air With the hands up in the air With the hands up in the air I got my eyes closed Jumping up and down baby I'm teen I got my eyes closed Listen to the sounds so hypnotizing And I bet before the night end You will find out that I'm not like him Take her home, get it on the next morning Baby girl, give me that one more Give me before you go I got my eyes closed (baby I got my) I got my eyes closed (baby I got my) I got my eyes closed (baby I got my) I got my eyes closed (baby I got my) Such a beautiful crowd Levels on the ten Were standing on chairs With our hands up in the air Girls getting real wild Hair blowin' in the wind Were standing on chair With the hands up in the air With the hands up in the air With the hands up in the air With the hands up in the air With the hands up in the air With the hands up in the air With the hands up in the air With the hands up in the air With the hands up in the air"
/songs/2895843,Timbaland,Harmony,https://genius.com/Timbaland-harmony-lyrics,http://api.genius.com/songs/2895843,None,2016-10-28," Together never, together, together Together nev-   We were born to fly, limitless No matter what, we stay up If we're a team that is enough No boundaries, we're fearless Where we go on, we go all We never break, we never fall   In this world that we're creating Magic's all around We can fly above the ground   Hey yeah, we should come together Let's be heroes in the night (in the night) Black spotlights beaming in the black sky We can lift the darkness with our light 'Cause everybody's in harmony Harmony Harmony Everybody's in harmony Harmony Harmony  [Verse 2: Dalton Diehl & Timbaland] Whenever chaos (Kaos) gets crazy Trouble knocks on the door With your heart above the floor Keep shining, yeah, keep trying If something's wrong we'll be strong Face your fears until they're gone   In this world that we're creating Magic's all around We can fly above the ground   2x Hey yeah, we should come together Let's be heroes in the night (in the night) Black spotlights beaming in the black sky We can lift the darkness with our light 'Cause everybody's in harmony Harmony Harmony Everybody's in harmony Harmony Harmony   All together, harmony We're all together in harmony"
/songs/427385,Timbaland,Hello,https://genius.com/Timbaland-hello-lyrics,http://api.genius.com/songs/427385,Shock Value,2007-02-04," Lord Ain't nobody think we be coming like this here They don't know what I'm talking 'bout homeboy... For all the pretty ladies out there, roaming the streets I got attitude The bad chicks What up what up what up you know what I'm saying Ow, Let me talk to y'all ladies   We on another level Who you down with? I'm down with several People that you can't clown with, go to town with and get down with Hello We on another level Who you down with? I'm down with several People that you can't clown with, go to town with and get down with Hello   Baby, let me come and scoop you in the Benz We can chill and lay back while I drop my top, baby If you want, you can bring a friend I get it poppin' off Be glad you got involved Girl, if you play your position then all your problems solved They show me love in every hood and every city I go They say ""Timbo you the best"" and I say baby ""I know"" Two-tone Maybach when I slide up in it when I go my ride is tinted Gotta pull the shades back and tell her ""Hello"" She wanna chill with a nigga We can smoke we can drink just keep it real with a nigga I got a plan, shorty, come get your man, shorty Let me put it simple so you can understand shorty cause   We on another level Who you down with? I'm down with several People that you can't clown with, go to town with and get down with Hello We on another level Who you down with? I'm down with several People that you can't clown with, go to town with and get down with Hello   Smooth with the flow, get you where you going You already know and if you don't then I'ma show Look how I does that They ain't looking at you they looking at me they be like ""What's that?"" Tryin' to get they buzz back I got places to go and a whole lotta things to see (I guarantee) And I'ma be right here 'til y'all done got enough of me Steady on my grind, tryna get it Money on my mind, is you wit' it? Tried to hold me down 'cause of that ego now they ain't around, but look at me Hello!   We on another level Who you down with? I'm down with several People that you can't clown with, go to town with and get down with Hello We on another level Who you down with? I'm down with several People that you can't clown with, go to town with and get down with Hello   Ho.. mack on my nuts Keep pumpin' their chin Turn their back for a second I be fuckin' their friend Give it to 'em real good they be lovin' me then Askin a nigga could I have it again? Put a sip of billow over the win(dow) and bust in Like one of their men Then the ride and the roller 'yo And every nigga in my click gon' dig em Down nigga.. Jigga ask every ho i know I met a bitch up at Amoco You could tell she was thicker than the average ho (yeah) You could see that ass from the front And them titties from the back So I had to get at that ho Real talk Cash flow... stacked up safe in the vault Pimp bitches at my face 'cuz I know how they talk Ain't savin' these hoes Ain't shit gettin' bought Real ass nigga all over their thong P.I.M.P. ten toes down Bitch can't swim Bitch gon' drown Bitch can't fly I can't either That's why niggas get high off reefer New millenium nigga in a old school Regal Used to have hood rats Now I got people A.L.A.B.A.M.A You know I gotta send a shout out to my people   We on another level (We on another level, baby) Who you down with? I'm down with several People that you can't clown with, go to town with and get down with (down with) Hello We on another level Who you down with? I'm down with several People that you can't clown with, go to town with and get down with Hello Hello"
/songs/30289,Timbaland,Here We Come,https://genius.com/Timbaland-here-we-come-lyrics,http://api.genius.com/songs/30289,Tim's Bio: Life From Da Bassment,1998-11-17," Another one   Here we go so wave your hands For Missy, Maganoo, and Timbaland We gon' show you how to party right So pass the UHH and get the hype Alright, we gon' party tonight   If you're livin' for love, start livin' for life If you're having a baby, then make her your wife If you're up in the club where the dub It's like a bank sell to the highest bid Put the cash in your bank Girl I'm lovin' your booty, you can ""hoo"" to my blow Then fish but please honey child, don't kiss All I want is a freak when I'm up in the club Maybe after the dance, dinner sharp, then the tub I'm a nigga wit' class, you're a girl with a job Taste of my neck like corn on the cob I'm second to none, I'm freaky as ever Go downtown, ""Well I never""   Uh, uh Well I'm the man, that they call Timbaland Now he the bir-ba-bir-ba-bird, understand? We gon' party, until the sun comes up Bartender, you forgot to fill up my cup, uh Ain't no stoppin' until your draws start floppin' There won't be no beef unless the disc stop jockin' (what?) She said this, and he said that And he said that Timbaland can't rap But I don't care because I make dope tracks I make you bounce and wiggle, and do this and that Timbaland, where you live at? VA baby, believe dat   Aiyyo, aiyyo Now I'm rich, I once was poor If you're late with my dough, then there's no show I grease my hair and it still won't grow If you feel my butt, boy you gotta go Out the back for touchin' my back For trying to jack every Timbaland track Maganoo, where you was? They been bitin' our style, those silly bugs Where's the spray? I'mma spray 'em good So the next time they bite they die like ""Ugh"" I'mma roll up the biggest dutchie Get some sweets cuz I got the munchies   Here we go so wave your hands For Missy, Maganoo, and Timbaland We gon' show you how to party right So pass the UHH and get the hype Alright, we gon' party tonight Here we go so wave your hands For Missy, Maganoo, and Timbaland We gon' show you how to party right So pass the UHH and get the hype Alright, we gon' party tonight   He he Girl, when the bar open up five rum Everybody wanna get a buzz, get some 9 out of 10, all girls gonna freak Just gon' depend on who they gonna freak Don't gotta floss, all girls know they name Only near, chillin' in the club, no game Brotha mad at me cuz I got cheddar cheese When the club close got his girl on her knees Oh man please, learn the two degrees Degree number one, keep your hon off trees Degree number two, keep your girl 'round you Never trust a girl, Lord knows what she do   Uh huh Tricks - is what I got in my bag Hits - is what I make out the lab Ritz - is the crackers that I eat Bitch - is what a man don't need Rubber - shows I'm a careful lover Stutter - is what I do in trouble, what?   My man Timbaland He make beats for the streets See, me and Maganoo In the back rollin' trees Gettin' high off the phone Tell a nigga what chu want, HEY! Now, I'm in the S-L-K I roll up the window, so the 'doo won't sway Spray my hairspray so the waves obey So when I say stay, them bitches stay Oh by the way Me and Timbaland, we got the beats to make you dance   Here we go so wave your hands For Missy, Maganoo, and Timbaland We gon' show you how to party right So pass the UHH and get the hype Alright, we gon' party tonight Here we go so wave your hands For Missy, Maganoo, and Timbaland We gon' show you how to party right So pass the UHH and get the hype Alright, we gon' party tonight   Doo-do-do, doo-do-do (Yea) Doo-do-do, doo-doo, doo doo doo (Yea) Doo-do-do, doo-do-do (Yea) Doo-do-do, doo-doo, doo doo doo (Yea) Doo doo, doo doo doo, doo doo doo........(Yea)"
/songs/30263,Timbaland,If We Ever Meet Again,https://genius.com/Timbaland-if-we-ever-meet-again-lyrics,http://api.genius.com/songs/30263,Shock Value II,2009-12-08," What's somebody like you, doing in a place like this? Say, did you come alone, or did you bring all your friends? Say what's your name, what you drinkin'? I think I know what you're thinking Baby, what's your sign? Tell me yours, I'll tell you mine Say, what's somebody like you Doing in a place like this? (One, two, three, c'mon!)   I'll never be the same - if we ever meet again Won't let you get away - say if we ever meet again This free fall (Ahh) got me so (Ohh) Kiss me all night, don't ever let me go I'll never be the same - if we ever meet again   Ohh, ohh Say if we ever meet again   Do you come here much? I swear I've seen your face before (Before, yeah) Hope you don't see me blush, but I can't help but want you more, more Baby, tell me what's your story? I ain't shy and don't you worry I'm flirting with my eyes, wanna leave with you tonight Do you come here much? I gotta see your face some more Some more, 'cause baby...   I'll never be the same - if we ever meet again Won't let you get away - say if we ever meet again This free fall (Ahh) got me so (Ohh) Kiss me all night, don't ever let me go I'll never be the same - if we ever meet again   If we ever meet again, I'll have so much more to say (If we ever meet again) If we ever meet again, I won't let you go away (If we ever meet again) If we ever, ever meet again, I'll have so much more to say (If we ever meet again) If we ever, ever meet again, I won't let you go away Away-ay-ay-ay   I'll never be the same - if we ever meet again Won't let you get away - say if we ever meet again This free fall (Ahh) got me so (Ohh) Kiss me all night, don't ever let me go I'll never be the same - if we ever meet again I'll never be the same - if we ever meet again Won't let you get away - say if we ever meet again This free fall (Ahh) got me so (Ohh) Kiss me all night, don't ever let me go I'll never be the same - if we ever meet again   Just when the night can't get no less Porn star startin', what is this? Vixens fightin' for their stress I put in like Mr. West, yes You gon' finish dear And your body's so superb Me and you the best in here But yo' girl, face and ear Face and ear, face and ear Face and ear, face and ear"
/songs/30296,Timbaland,I Get It On,https://genius.com/Timbaland-i-get-it-on-lyrics,http://api.genius.com/songs/30296,Tim's Bio: Life From Da Bassment,1998-11-24,"What's up Jack?   This goes out, uh huh It goes out, uh huh To all the B-Biters, huh? What? Timbaland got something to say ya'll Check him out This is the lil' man speaking right now Yo, Timbaland, kick it   If it's money to be made, I guess I'm the printer If it's ice to be rocked, I guess I'm the winner You know my crew, Ginuwine, not the pretender One in a million like Aaliyah Burn like Gonorrhea, what? I beat the beater, snares everywhere Cris' like the diamonds in the watch on my wrist Audiences growing like a newborn You must be on some new and improved Lyrically I murder tracks, put two in a crew Tell me, who wanna mo' Catch me in the studio, what? Doing a do Give me 10 minutes, I'll hook you up with joint that's mean ]From New York, VA to Cali, all points in between  Timbo I even bowed it down in NO And every corner that I flow You know I get it on Timbo, I even bowed it down in NO And every corner that I flow I get it on   Can you get it on? (Um hmm) Are ya hands up? (Um hmm) Where all the playa haters at? (Um hmm) Now point 'em out (Um hmm)  Can we get it on? (Um hmm) Are ya hands up? (Um hmm) Where all the playa haters at? (Um hmm) Now point 'em out (Um hmm)   I'm the top nigga, watch nigga, hot nigga, yo (Yo) Shit that I dropped, nonstop nigga, whoa (Whoa) Meet the futuristic unpredicted by the psych (Uh huh) Either nigga's vibe or they make shit light (Whew) Hip to the hop when I came in the do' (What?) Missy went platinum then I came in some mo' (What?) Aaliyah, then Ginuwine, Mag and two O's (Uh huh) Outside production on Coko and Total Fugitive wanna buy the man for real Got warrrents beats and program to kill Timbaland nigga, and I'm Ill Don't believe me? Take the back of your hand and feel  I'm burnin' up, yo, can't stop my flow I'm burnin' up, ya'll can't stop my dough Im burnin' up, up top and down south they know When it come to these beats I don't play, yo I get it on   Can I get it on? (Um hmm) Are ya hands up? (Um hmm) Where all the playa haters at? (Um hmm) Now point 'em out, yeah (Um hmm)  Can we get it on? (Um hmm) Are ya hands up? (Um hmm) Where all the playa haters at? (Um hmm) Now point 'em out (Um hmm) Now she's gon' point 'em out, check it   I come sweeter than a two seater Benz Have your pockets wide open, have you spendin' on friends It never ends, expensive indeed Without the C's, lavish habits love the carats Nigga's with mad weaves Spendin' money ain't nuthin' Nigga's who style frontin' And then pretend ya gettin' old Nigga, we let you know, diamond district Platinum Rolex's with the chips in it Money to burn, nigga when will you learn It's automatic, now I realize I gotta have Lifestyles of the rich, that fly assed bitch There's a track to be ripped, I got the hot shit Check the whip, I'm banging from my land to my six Had you screamin' at the show saying Bassey's a hit I got the gift and nigga's know I'm ready for this Eyes closed, lips sealed, and prepare for the kiss  [Timb & Lil' Man] And I told ya'll we won't miss, what?   Did she get it on? (Um hmm) Are ya hands up? (Um hmm) Where all the playa haters at? (Um hmm) Now point 'em out (Um hmm) Point 'em out, what?  Did she get it on? (Um hmm) Are ya hands up? (Um hmm) Where all the playa haters at? (Um hmm) Now point 'em out, yeah (Um hmm)  Can I get it on? (Um hmm) Are ya hands up? (Um hmm) Where all the playa haters at? (Um hmm) Now point 'em out, uh (Um hmm)  Can he get it on? (Um hmm) Are ya hands up? (Um hmm) Where all the playa haters at? (Um hmm) Now point 'em out nigga (Um hmm) Now point 'em out, what?  Now let's ride, yeah boo  Yo, Timbaland People don't understand how you do these beats, yo Ha, even I don't understand You know people always tryin' to bite you And made stuff like you You da man right now I ain't mad at cha Play on playa"
