api_path,primary_artist,title,url,song_endpoint,album,release_date,lyrics
/songs/53521,Timbaland,Pass At Me,https://genius.com/Timbaland-pass-at-me-lyrics,http://api.genius.com/songs/53521,None,2011-09-13," Timbaland David Guetta Mr. Worldwide  (Timbaland x3) Hit the dance floor and pick it up Baby, put it down and pick it up    We used listen to cover girls (wasn't in it) And now I mess with cover girls Magazines, you can catch me on the cover, girl I created my own planet I hover the Earth, and cover the world I spit so thick, imma call it a pearl I see you tryna claim her, now I play with her pearls Try to come at me, with all of my [?] Life's a bitch, but I made her my girl Now she does what I say, does what I please ? she lives on her knees Jack and Jill went up the hill Each with a buck and a quarter Jill came back with $2.50 What a working girl, now work it, girl! Like..   Ah, Ah, Ah-Ah, Ah, Ah, Ah (Ah, Ah) Ah, Ah, Ah-Ah, Ah, Ah, Ah (Ah, Ah)   Hey Girl! I love when you do With all that booty, oh-oh my god Hey Girl! I love when you do With all that booty, oh-oh my god Oh-oh my god, Oh-oh my god Oh-oh my god, I love that booty   I love when you, making me Oh pass at me, oh pass at me I love when you, making me Oh pass at me, oh pass at me  [Verse 2: Timbaland & Pitbull] (Timbaland) I love when I see your pretty ass on the floor I love when I see you break it down like you in control (Pitbull) I got a cup to my right, and a girl to my left And I'm stumbling when I'm out of breath Like g-g-g-g-g-g-go Like g-g-g-g-g-g-go I got girls on my right, I got girls on my left The one in the middle and I'm feeling on her breath Like g-g-g-g-g-g-go Like g-g-g-g-g-g-go     I love when you, making me Oh pass at me, oh pass at me I love when you, making me Oh pass at me, oh pass at me I love when you, making me Oh pass at me, oh pass at me I love when you, making me Oh pass at me, oh pass at me I love-love-love-love-love-love Love-love-love-love-love-love Love-love-love-e-e-e-e-e-e-e-e  (Beat breaks)  Pass at me, pass at me, pass at me Pass at me, pass at me, pass at me Pass at me, pass at me! Pass at me, pass at me, pass at me Pass at me, pass at, pass at me!  "
/songs/30298,Timbaland,Phat Rabbit,https://genius.com/Timbaland-phat-rabbit-lyrics,http://api.genius.com/songs/30298,Tim's Bio: Life From Da Bassment,1998-11-28," I be that nigga named Luda A.K.A. L-O-V-A L-O-V-A Fuck that shit Nigga what you wanna say one time Southside let's ride (say what) And if you love what you do, do what you feel Then I know you gonna mark my words I drop shit like birds Then it's about the time for yo ass to get served Just lay it on down Just lay it on down While we relax to the tight raps And the phat tracks That that nigga Timbaland put down Oh yes, let's get it on down to the nitty grit Don't have no time for the petty shit Cuz I got more dick than a lil' bit And time flies, when I'm havin' fun I can make a ho get like Forrest Gump and just ""run baby run"" I guess that they can't handle this Brother's just to scandalous If you don't wanna get freaked Get up out my way just like an ambulance (say what) Giddy up, giddy up ride up on the real, and death to the fake And tell yo boyfriend just to chill, don't playa hate Kick back relax, and just take off yo shoes Cuz I gotta tell you what I wants to do (uh oh) Yea   Let me touch it (let me touch it) Let me feel it (let me feel it) Let me grab it (let me grab it) That fat rabbit (fat rabbit, fat rabbit, fat rabbit) Let me touch it (let me touch it) Let me feel it (let me feel it) Let me grab it (let me grab it) That-that rabbit (ohhh, c'mon) Let me touch it (let me touch it) Let me feel it (let me feel it) Let me grab it (let me grab it) Fat rabbit (fat rabbit, fat rabbit) Let me touch it (let me touch it) Let me feel it (let me feel it) Let me grab it (let me grab it) That-that fat rabbit (uh oh)   Fatter than fat facts like a dove sack Showin' them where that love's at So open up your eyes and get a surprise like in CrackerJacks Punan' Don happy Givin' up that nappy dug out Get the cut up, then I cut out Why you standin there wit yo' butt out (whoo) And it's always in the back of my mind Wherever the place, whenever the time Even in College Park, after dark, I'mma get my sunshine Closer than close, closer than most, then I'm all up in ya Beginner, give me a thigh, breast, and wing like Ms. Winner And let dinner be served Can I get it on a platter, shatter your bladder And put so much light in yo' life I'll make the roaches scatter The wetta the betta, I'm ready to get ya Gotta have rabbit like that cheddar So I can freak ya like I just met ya Hot like a sauna, get comfy like in a Cadillac Nick nack paddy wack give a dog a bone Jack Kick back relax and just take off yo shoes Cuz I gotta tell you what I wants to do (uh oh) Yea   Let me touch it (let me touch it) Let me feel it (let me feel it) Let me grab it (let me grab it) That fat rabbit (fat rabbit, fat rabbit, fat rabbit) Let me touch it (let me touch it) Let me feel it, girl (let me feel it) Let me grab it, girl (let me grab it) That-that rabbit, girl (ohhh, c'mon) Let me touch it, girl (let me touch it) Let me feel it, girl (let me feel it) Let me grab it, girl (let me grab it) Fat rabbit, girl (fat rabbit, fat rabbit) Let me touch it, girl (let me touch it) Let me feel it, girl (let me feel it) Let me grab it, girl (let me grab it) That-that fat rabbit, girl (uh oh)   Yo' love is supa-cala-fragalistic You don't know how bad I missed it If it broke then don't fix it Yo stuff is butta like a biscuit Reminisce like Mary I gotta pop that cherry Kinda like that coochie You wanna be my hoochie Better than my advesary Don't be so scary I, never thought that you could act up Make a nigga wanna back up Keep it tight through the night while I wet this track up So we can slip and slide Make you wanna dip and dive Trippin' while we rip and ride Til I get to the coming side Got you where I want yo ass In the case of an emergency, break the glass Keep yo eyes on the President, erase the past We be happy if we had more blunts to pass Get done up and run up And the guts of yo butt don't shake like they used to I wake 'em up like a rooster Take it slow, not faster than a turbo rooster No worry, no hurry No pain, no gain Keep yo eyes on strain Cuz ain't a damn thing changed Kick back, relax and take off yo shoes Cuz I gotta tell you what I wants to do (uh oh) Yea   Let me touch it (let me touch it) Let me feel it (let me feel it) Let me grab it (let me grab it) That fat rabbit (fat rabbit, fat rabbit, fat rabbit) Let me touch it (let me touch it) Let me feel it, girl (let me feel it) Let me grab it, girl (let me grab it) That-that rabbit, girl (ohhh, c'mon) Let me touch it, girl (let me touch it) Let me feel it, girl (let me feel it) Let me grab it, girl (let me grab it) Fat rabbit, girl (fat rabbit, fat rabbit) Let me touch it, girl (let me touch it) Let me feel it, girl (let me feel it) Let me grab it, girl (let me grab it) That-that fat rabbit, girl (uh oh)   Let me touch it, let me touch it Let me feel it, let me feel it Let me grab it, let me grab it Fat rabbit, fat rabbit Let me touch it, let me touch it Let me feel it, let me feel it Let me grab it, let me grab it Fat rabbit, fat rabbit Let me touch it, let me touch it Let me feel it, let me feel it Let me grab it, let me grab it Fat rabbit, fat rabbit Let me touch it, let me touch it Let me feel it, let me feel it Let me grab it, let me grab it Fat rabbit, fat rabbit   Wha, uh huh Yea Dirty South, can y'all really feel me East Coast, feel me West Coast, feel me Dirty South, can y'all really feel me East Coast, feel me West Coast, feel me Dirty South, (uh huh) can y'all really feel me East Coast, feel me West Coast"
/songs/30299,Timbaland,Put 'Em On,https://genius.com/Timbaland-put-em-on-lyrics,http://api.genius.com/songs/30299,Tim's Bio: Life From Da Bassment,1998-11-28," Do you like it, do you like it, do you like it, whassup? Do you like it, do you like it, do you like it, what? (Put 'em on, put 'em on, put 'em on) Do you like it, do you like it, do you like it, whassup? (Put 'em on, put 'em on, put 'em on) Do you like it, do you like it, do you like it, what? (Put 'em on, put 'em on, put 'em on) Do you like it, do you like it, do you like it, whassup? (Put 'em on, put 'em on, put 'em on) Do you like it, do you like it, do you like it, what? Do you like it, do you like it, do you like it, whassup? (Put 'em on, put 'em on, put 'em on) Do you like it, do you like it, do you like it, what? (The first verse, bird)   It's a hot Saturday My little sister's outside Playin' patty cake (patty cake) My momma's in the kitchen (kitchen) Wit' the Shake 'n Bake Magoo got on the stockin' cap Tryin' to pick this way I'm (I'm) in the back with the play sta' A little boy (boy) came and gave me an invitation Said there's a party and ya gotta wear your suit And ain't no time (time) for the D-Q I say who-dee-who   Pass me the courvoisier It's a party-yea, it's time to play I see today is a good day I'm out for gleem, plus play it then finally hit your screen I may not be the giant but I want that jolly green I got tomorrow's dreams baby, don't share the turf (what?) Maybe I'll tap your glass, I got some cheers for you For they yak can't hold me back So baby, whassup with that? (yeah, yeah, yeah) Tell me where the party at   Pick it pick it pick it up   You and I goin' do that damn thing, make it bang You went out to the room in the back Bring me in a Henney and a pack Give a blunt to that fact suicide State of mind, do or die, anytime We can bang in the back of the 'Lac Any damn thing bang Do the thing in the back of the 'Lac In the car, at the bar, gettin' high, wanna try You went out with the heels on the block Get the nine's all coughin' And nigga's gon' run in our spot Wonder why hypnotize, on my eyes and thighs You ain't heard of me yet But I betcha ain't met another one yet Who do it like this  It's on, put yo hands in the air We got you in the zone, get yo hands in the air If it's on, put your hands in the air We got you in the zone, put your hands in the air  If it's on, put your hands in the air We got you in the zone, put your hands in the air If it's on, put your hands in the air We got you in the zone, put your hands in the air  See I'm keepin' all the party people in the place And I'll pull another playa's parts bags Send searchin' for sex for six packs See I'm Simpsoning them all to the back She even knows I'm hellerin So they'll move till they pickin low, go over really If I say hit his head and then hang another round I'm showing 'em, knowing if it's a drag That you hit it from the back and stroke Left to the right keep it right on time One time, two time for your mind Better get soft layers and go over mine Come about two chairs and go here's an ear if it's on tonight Then this is the word I speak Shit don't quicks mo' too tight   I come clear to your mouth and spit many a spouse and get Civil cuz riddles can sizzle picks it a foul out Package your rap attack, it's for presses and stash They catch your track by the tail and smack they head on the nail Factoring the jam made by Timbaland givin' fans something Bumpin' (bumpin') and scrumpin' for your consumption Listen close to the slick and those quick quotes Keep gettin' dope shit, fuck with this, it'll get you so most   When she get crucial forget about what chu used to Cuz I'm here to pay dues too, nigga put it to the back sayin' I'mma school you on the rules to how to tell who's who On a cruise to who's tryin' to use you In the same sentence demention that will lose your attention So pull mad intentions like Mag' Lot of people gonna wanna see me stand stagnant, but it ain't gonna happen Sound completely like Twista, or get mean like Mista' For they feel the purple from the first time The first rhyme that they first heard First word, nigga's know that I'm a gold mine Come on nigga's now lets go a time Tell I'm in a power mood, the party groove records tour if I move it I'mma support their dues or loose it  It's on, put yo hands in the air If I got you in the zone, get yo hands in the air If it's on, put your hands in the air I got you in the zone, put your hands in the air  If it's on, put your hands in the air If I got you in the zone, put your hands in the air If it's on, put your hands in the air If got you in the zone, put your hands in the air  If it's on, put your hands in the air I got you in the zone, put your hands in the air If it's on, put your hands in the air If I got you in the zone, put your hands in the air  If it's on, put your hands in the air If got you in the zone, put your hands in the air If it's on, put your hands in the air If I got you in the zone, put your hands in the air  Put 'em on, put 'em on, put 'em on Put 'em on, put 'em on, put 'em on Put 'em on, put 'em on, put 'em on Put 'em on, put 'em on, put 'em on  If it's on, put your hands in the air We got you in the zone, put your hands in the air If it's on, put your hands in the air We got you in the zone, put your hands in the air"
/songs/1836272,Timbaland,Put 'Em On - Timbaland,https://genius.com/Timbaland-put-em-on-timbaland-lyrics,http://api.genius.com/songs/1836272,None,2016-10-28,"Featuring Static & Yoshamine  Do you like it do you like it do you like it whassup? Do you like it do you like it do you like it what? (Put 'em on put 'em on put 'em on) Do you like it do you like it do you like it whassup? (Put 'em on put 'em on put 'em on) Do you like it do you like it do you like it what? (Put 'em on put 'em on put 'em on) Do you like it do you like it, do you like it, whassup? (Put 'em on, put 'em on, put 'em on) Do you like it, do you like it, do you like it, what? Do you like it, do you like it, do you like it, whassup? (Put 'em on, put 'em on, put 'em on) Do you like it, do you like it, do you like it, what?  (The first verse, bird)  It's a hot Saturday My little sister's outside Playin' patty cake (patty cake) My momma's in the kitchen (kitchen) Wit' the Shake 'n Bake Magoo got on the stockin' cap Tryin' to pick this way I'm (I'm) in the back with the play sta' A little boy (boy) came and gave me an invitation Said there's a party and ya gotta wear your suit And ain't no time (time) for the D-Q I say who-dee-who  Pass me the courvoisier It's a party-yea, it's time to play I see today is a good day I'm out for gleem, plus play it then finally hit your screen I may not be the giant but I want that jolly green I got tomorrow's dreams baby, don't share the turf (what?) Maybe I'll tap your glass, I got some cheers for you For they yak can't hold me back So baby, whassup with that? (yeah, yeah, yeah) Tell me where the party at  Pick it pick it pick it up  You and I goin' do that damn thing, make it bang You went out to the room in the back Bring me in a Henney and a pack Give a blunt to that fact suicide State of mind, do or die, anytime We can bang in the back of the 'Lac Any damn thing bang Do the thing in the back of the 'Lac In the car, at the bar, gettin' high, wanna try You went out with the heels on the block Get the nine's all coughin' And nigga's gon' run in our spot Wonder why hypnotize, on my eyes and thighs You ain't heard of me yet But I betcha ain't met another one yet Who do it like this It's on, put yo hands in the air We got you in the zone, get yo hands in the air If it's on, put your hands in the air We got you in the zone, put your hands in the air If it's on, put your hands in the air We got you in the zone, put your hands in the air If it's on, put your hands in the air We got you in the zone, put your hands in the air See I'm keepin' all the party people in the place And I'll pull another playa's parts bags Send searchin' for sex for six packs See I'm Simpsoning them all to the back She even knows I'm hellerin So they'll move till they pickin low, go over really If I say hit his head and then hang another round I'm showing 'em, knowing if it's a drag That you hit it from the back and stroke Left to the right keep it right on time One time, two time for your mind Better get soft layers and go over mine Come about two chairs and go here's an ear if it's on tonight Then this is the word I speak Shit don't quicks mo' too tight  I come clear to your mouth and spit many a spouse and get Civil 'cause riddles can sizzle picks it a foul out Package your rap attack, it's for presses and stash They catch your track by the tail and smack they head on the nail Factoring the jam made by Timbaland givin' fans something Bumpin' (bumpin') and scrumpin' for your consumption Listen close to the slick and those quick quotes Keep gettin' dope shit, fuck with this, it'll get you so most  When she get crucial forget about what chu used to 'cause I'm here to pay dues too, nigga put it to the back sayin' I'mma school you on the rules to how to tell who's who On a cruise to who's tryin' to use you In the same sentence demention that will lose your attention So pull mad intentions like Mag' Lot of people gonna wanna see me stand stagnant, but it ain't gonna happen Sound completely like Twista, or get mean like Mista' For they feel the purple from the first time The first rhyme that they first heard First word, nigga's know that I'm a gold mine Come on nigga's now lets go a time Tell I'm in a power mood, the party groove records tour if I move it I'mma support their dues or loose it It's on, put yo hands in the air If I got you in the zone, get yo hands in the air If it's on, put your hands in the air I got you in the zone, put your hands in the air If it's on, put your hands in the air If I got you in the zone, put your hands in the air If it's on, put your hands in the air If got you in the zone, put your hands in the air If it's on, put your hands in the air I got you in the zone, put your hands in the air If it's on, put your hands in the air If I got you in the zone, put your hands in the air If it's on, put your hands in the air If got you in the zone, put your hands in the air If it's on, put your hands in the air If I got you in the zone, put your hands in the air Put 'em on, put 'em on, put 'em on Put 'em on, put 'em on, put 'em on Put 'em on, put 'em on, put 'em on Put 'em on, put 'em on, put 'em on If it's on, put your hands in the air We got you in the zone, put your hands in the air If it's on, put your hands in the air We got you in the zone, put your hands in the air"
/songs/30288,Timbaland,Release,https://genius.com/Timbaland-release-lyrics,http://api.genius.com/songs/30288,Shock Value,2007-02-04," Alright Hey! Clap Oh...  [Verse 1: Justin Timberlake & (Timbaland)] I need you, girl Hey, I really need you I need you, girl (Let me tell you somethin') I think I'm getting a charge (Yeah) So here the party goes (Yeah) With all my G's in the back (Yeah) Who needs a bodyguard (Yeah) I think I need to...   Release! I'm out of control, I'm out of body Release! I'm out of Patron, who's here to party? Release! I'm out of control, I'm out of body Release! I'm out of Patron, I'm out of - (Wait a minute!)  [Verse 2: Justin Timberlake & (Timbaland)] Ohhh (Yeah) I push the party starts (Yeah) Haters can't even see me (yeah) We flame the party hard (Yeah) I think I need to...   Release! I'm out of control, I'm out of body Release! I'm out of Patron, who's here to party? Release! I'm out of control, I'm out of body Release! I'm out of Patron, I'm out of - (Wait a minute!)   Who pumps the parties right? He keeps the party movin' The club is overpacked But this can't wait 'til mornin (yeah)  [Verse 3: Justin Timberlake & (Timbaland)] We've got a video (Yeah) I think we're late for our shoot (Yeah) We at our video (Yeah) Hey - these girls, they cute! (Yeah) They want me to do my part (Yeah) But first I gotta...   Release! I'm out of control, I'm out of body Release! I'm out of Patron, who's here to party? Release! I'm out of control, I'm out of body Release! I'm out of Patron, I'm out of - (Wait a minute!)   Pump it... Get funky! Get funky! Uhh, get busy Don't stop now..   Funk, c'mon now girl, get close to me Work your body Work your body Work your body Tell somebody! Work your body Work your body Dance (Ahh, ahh, ooh) Dance (Ahh, ahh, ooh)"
/songs/3255631,Timbaland,Round Da Way Tim,https://genius.com/Timbaland-round-da-way-tim-lyrics,http://api.genius.com/songs/3255631,Timbaland Thursdays ,2011-01-20,"Hello America, Timbo is back SV, Shock Value Check it…  It’s Timbo, Timmy T/ I live in Miami still rep the VA beach/ Moving at light speed, who you know just like me/ A simple black man who own a private island/ Boss man is Iovine, gas house and Verizon/ Don’t fly in nothing less than a gulf stream/ There’s one more thing about me, niggas gone doubt me/ Because the Timbaland brand holds a lot of clout, G/ Come on girl lets go play housie, take these drugs get drowsy/ When the feeling come on give me some top piece/ I know that’s really not me but a nigga really horny/ I do a lot of nasty shit without a warning/ Come on come on hold me, shake that shit for me/ Cause in bed you ride that shit like a horsey/ Oh oh oh oh oh Lordy, let’s change up the story/ I’m too rich for y’all niggas to ignore me/ I don’t do it for glory, but a nigga love Porches/ A nigga will never sell his soul to sorcery/ Mom and dad divorces, that’s what split up the most list/ It made me so strong and it forced me/ To watch my haters closely, why blogs is so nosy?/ If you know something bout me nigga then show me/ You talking to the old me, ain’t ain’t ain’t that right, Steve?/ Tell them bitch haters to meet us up in Paris/  HOOK Let me tell you bout this nigga/ From round da way/ He - he the coolest nigga and I got to say/ His name is Timbo/ So down to Earth think he can be your kinfolks/ (repeat 2x’s)  Verse Two Black card, I got three/ He just recently sent me that new white piece/ The one without no writing, me, that’s a light beam/ I got a two-million thirty-five carat Graff ring/ Wife got the same thing - to me - that’s a ? mean/ Because me and you have nothing in common/ I’m my own Army, I like it when it’s starving/ I like to fall down - get up - it makes me hard G/ I paid a lot of parsley - got that Charles Barkley/ I like my women bow-legged - that got that dark meat/ Vacations and the RE somewhere near Greece/ Where the villas in the middle of the ocean/ Where don't wear no own rings - me and you boinking/ I got a lotta equity up in Beijing/ Think you niggas phase me - when I’m on phase 3?/ I sold a hundred and twenty million now chase me/  HOOK"
/songs/480,Timbaland,Say Something,https://genius.com/Timbaland-say-something-lyrics,http://api.genius.com/songs/480,Shock Value II,2009-11-03," This shit was all I knew, you and me only I did it all for you, still you were lonely We could've worked it out, uh, but I guess things change It's funny how someone else's success brings pain When you're no longer involved, that person has it all And you just stuck standin' there but I'm gon' need you to say something, baby Say-say something, baby Say something, babe, say something I'm gon' need you to say something, baby I'm gon' need you to say something, baby, ohh-whoa   It really sucks, but ever since I’ve been long gone I traded in my señorita for a microphone I hate the way you fell apart girl, its sad to see Your life is good, but me and you it’s catastrophe If I was unsuccessful, would you be satisfied? I need a paramedic girl, I’m feeling paralyzed If I could choose, you will always be a friend to me The more money I made you acting like my enemy – it's crazy I can’t help it if you feel ashamed Thought the pressure would turn you into my diamond babe How can something so familiar be so strange Closest friends get estranged when the status change, ah Is it my mistake, thinking that where I am and where you at? And my homeboy Larry Live is the only one that had my back You were the perfect pair and now it seems that we don’t match Is it the money, want me to give it back?   This shit was all I knew, you and me only I did it all for you, still you were lonely We could've worked it out, uh, but I guess things change It's funny how someone else's success brings pain When you're no longer involved, that person has it all And you just stuck standin' there but I'm gon' need you to say something, baby Say-say something, baby Say something, babe, say something I'm gon' need you to say something, baby I'm gon' need you to say something, baby, ohh-whoa   I am the topic of conversation, this is celebration Let's toast to the fact that I've moved out my mama's basement To a condo downtown, 'cause it's 'all about location I sit and drink wine and watch Californication, to life You shoulda been here to kick it with me We could have split this whole thing up 50/50 But now I'm at the 40/40 getting bitches tipsy Killing shit, the ever-so talented Mr. Ripley How I go from being the man that you argue with To me and Dwayne Carter putting out the hardest shit I should wanna go back to the one I started with But I'm addicted to this life, it's gon' be hard to quit Yeah, just ask me how things are coming along You could tell me that you've never heard none of my songs Long as you end up saying one day you plan to listen 'Cause what's a star when it's most important fan is missing?   This shit was all I knew, you and me only I did it all for you, still you were lonely We could've worked it out, uh, but I guess things change It's funny how someone else's success brings pain When you're no longer involved, that person has it all And you just stuck standin' there but I'm gon' need you to say something, baby Say-say something, baby Say something, babe, say something I'm gon' need you to say something, baby I'm gon' need you to say something, baby, ohh-whoa"
